id	label	hovertext	author	x	y	type	relevance	size	year	umap1d
26345820	If I understand FloC correctly thoug	If I understand FloC correctly though, it sends your profile/tags/interesting topics from your owned client software. So this basically means that if you have a browser like Firefox, it could send a preset cohort set to server that doesn't build your tracking profile and gives you things you're interested in.To me this seems like a win? It allows you as a person to control how your ad profile is built (and if it's sent at all) and doesn't send your data to servers anymore?(Please correct me if I misunderstood the technology.)	izacus	7.8329554	-7.7111883	comment	4.0	30.0	1614881186	-14.498431
24004784	This FLoC?https://github.com/jkarlin	This FLoC?https://github.com/jkarlin/floc	aspenmayer	7.834339	-7.7007017	comment	4.0	12.0	1596159470	-14.484135
27516328	What I don't get about the reporting	What I don't get about the reporting on this topic: Isn't all this opt-out stuff just necessary while Google is testing FLoC and it'll be opt-in(!) after it leaves Origin Trial phase? Or is this Google employee straight up lying* here? https://twitter.com/Log3overLog2/status/1384337637763387394?...* I don't suspect he his.	jasonvorhe	7.834924	-7.708058	comment	5.0	19.0	1623768587	-14.487033
27518008	This is a great example of why Googl	This is a great example of why Google FLoC is not incentive-compatible with consumers nor business owners.  Amazon (like Facebook) has a monopoly on ad targeting on their target properties—- properties they own.  Google FLoC is Google’s attempt to (further) monopolize their target properties—- the web at large, which Google does NOT own.  Google does NOT pay to service the traffic they generate.  Google does NOT pay to fulfill consumer orders.  Google wants you to think they’re acting in your best interests with FLoC.  Maybe if Google offered more free GCloud credits and subsidized conversions they generate, that would be a different story. (Maybe Google could start by paying Wikipedia for some of the traffic they generate).  But Sundar wants you to think FLoC is about privacy, because Sun	choppaface	7.843301	-7.694474	comment	5.0	77.0	1623775608	-11.296815
26821003	Google must have seen this coming. I	Google must have seen this coming. It was never going to be the privacy savior Google billed it as, so why push forward with the concept? We have to look deeper to understand what value FLOC provides to Google. They can exclusively gather tracking info through the browser they control, and they can weaken competitor’s privacy arguments by claiming that they do not track individuals.	twobitshifter	7.837812	-7.706189	comment	5.0	22.0	1618497217	-14.478403
26830223	That sounds like people arguing that	That sounds like people arguing that nuclear energy is a bad solution to climate change because it's not perfect and technically not renewable.- FLoC is still far better than third party cookies- As much as we'd love to live in a world without advertising, 95% of the internet wouldn't exist without it.- If we are going to have advertising, I'd much rather have FLoC than third party cookies	ehsankia	7.8345976	-7.7098927	comment	5.0	17.0	1618553903	-14.494843
26830335	Has nobody bothered to read anything	Has nobody bothered to read anything about FLoC?The purpose of this permission is to prevent embedded third-party content from using FLoC. Besides that it’s a no-op.FLoC does not track arbitrary websites, it tracks sites which retrieve the FLoC cohort via JS. So instead of dropping a unique third party cookie, and associating it with the data on the page, sites can now retrieve a k-anonymous cohort id and associate it with the data on the page. If you’re not doing that (or serving ads) there’s nothing you need to do.That’s not to say that FLoC doesn’t deserve criticism just that most criticism I’ve encountered is not grounded in reality.	jahewson	7.834124	-7.710096	comment	5.0	22.0	1618554785	-14.49177
26830702	> Some website owners think the best	> Some website owners think the best strategy is to opt their websites out of FLoC by attaching a header.I've tried to look up which header that would be. The only thing I could find was a github issue, but only containing a request for such a header, not actually describing one. https://github.com/WICG/floc/issues/13So I understand it correctly, currently publishers can't opt out from this tracking? What if you process sensitive data, e.g. protected by HIPAA, or attorney client communication?	est31	7.8346577	-7.71036	comment	5.0	18.0	1618558328	-14.485092
26837937	Is it just me, or is FLoC simply an 	"Is it just me, or is FLoC simply an act?  A way for Google to say, ""See, regulators, we're trying!  You don't have to regulate us, we're doing it on our own!""While they know full well the web will never get on board with this.Seems like just a way to buy time, to muddy the waters.  Make the ecosystem more complicated.  Pin the blame on others for not getting on board with your attempt to ""fix"" the situation.  ""We tried our best, but Mozilla won't join us!!"""	2bitencryption	7.8342643	-7.710579	comment	5.0	19.0	1618600558	-14.485021
26854312	I am hopeful that this will help get	"I am hopeful that this will help get rid of FLoC but I worry about two things. One, this will end up being treated like the ""no track"" headers. That's just totally ignored after IE (was it IE?) enabled it be default. That gave all the trackers a reason to just ignore it and track everyone. I don't know if that exact same thing can happen here, but something similar maybe? The other thing I worry about is that FLoC 2.0 or whatever might replace it, will be worse.""Kill it before it lays eggs."" but do we worry about what evolves from this if it dies?"	blakesterz	7.832635	-7.7102513	comment	5.0	72.0	1618766143	-14.491184
26968453	alright 41 comments and everyone see	alright 41 comments and everyone seems to know what FLoC is so i’ll be that guy.What is FLoC and whats the big deal?I googled https://www.theverge.com/2021/3/30/22358287/privacy-ads-goog...  and it seems like an attempt by Google to add proprietary cohort based tracking to replace third party cookies. well intentioned but could have flaws. anything else i should know?	swyx	7.835411	-7.709272	comment	5.0	42.0	1619612119	-14.49326
27063720	> ignores the actual ethical problem	> ignores the actual ethical problems (e.g. large-scale collection of personal information)I find it ironic to see this brought up as the first example of problems, when this is exactly what Google's FLoC intends to solve. The same FLoC that has so vocally been rejected by HN recently.	underyx	7.8373475	-7.7042465	comment	5.0	18.0	1620311131	-14.460702
27464139	> FLoC is premised on a compelling i	> FLoC is premised on a compelling idea: enable ad targeting without exposing users to riskThe second you open your browser you are exposed to risk. Many times I have had to tweak the default settings of my browser to comply with my (non paranoid) requirements. Basic things like putting DuckDuckGo as the default search engine, turning off various JS APIs like HTML5 Canvas, WebGL, using AD-blockers and other addons, tweaking about:config and hardening it, etcCall me a power user if you want, but all this hardening stuff should ship out-of-the-box.	______-	7.834579	-7.7097692	comment	5.0	31.0	1623351078	-14.490205
27516135	Blocking FLoC is as easy as adding t	Blocking FLoC is as easy as adding this header to the HTTP response:Permissions-Policy: interest-cohort=()Source: https://www.drupal.org/project/drupal/issues/3209628	c0nfused	7.840788	-7.7060027	comment	6.0	44.0	1623767822	-14.481491
26755313	Am I FLoCed?	Am I FLoCed?	filleokus	7.83336	-7.7089524	story	6.0	154.0	1617998267	-14.511081
26766280	Why is it abhorrent? FLoC doesn't co	"Why is it abhorrent? FLoC doesn't compromise your privacy. It does interest inference client-side, away from bigcorp servers. It doesn't leak any information about you. But all the ""privacy"" people are totally against it anyway.Why? Because they just hate advertising. The whole ""third party cookies are bad"" thing has always been a sham: it was never about privacy. It's always been about killing advertising itself."	quotemstr	7.836512	-7.707164	comment	6.0	19.0	1618097519	-14.48117
26834624	> I run a website with no trackers, 	"> I run a website with no trackers, no ads, nothing at all to do with Google or any other company in any way.Then your site will not be included in FLoC: ""A page visit will be included in the browser's FLoC calculation if document.interestCohort() is used on the page. During the current FLoC origin trial, a page will also be included in the calculation if Chrome detects that the page load ads or ads-related resources."" -- https://web.dev/floc/(Disclosure: I work for Google, speaking only for myself)"	jefftk	7.83437	-7.710278	comment	6.0	22.0	1618584807	-14.490723
26968409	FLoC is basically something implemen	"FLoC is basically something implemented in a browser. Why website owner should be bothered by it? If client decided to use browser with FLoC than it's their decision. The only interesting thing might be to inform user that they are using shitty browser that doesn't respect their privacy and make sure that website works in other browsers.What if Google decides that they will ignore that header? Is there anything preventing them from doing that? Do we know why they decided to even implement this ""workaround"" with header?"	Tom4hawk	7.8339963	-7.710138	comment	6.0	23.0	1619611771	-14.487265
27464755	What bothers me the most about FLOC 	What bothers me the most about FLOC is that there is no reason or advantage for me as a user to run it unless I'm forced to. Cookies, even if they get hijacked for tracking, are genuinely useful to persist state and having them on results in a better experience. Even in the case of something more invasive like DRM/EME, I might want to turn it on in exchange to be able to watch some new show on a streaming service. Turning on FLOC brings nothing to the user in return and feels like charity towards advertisers.	justinplouffe	7.833025	-7.711349	comment	6.0	107.0	1623354122	-14.495216
26345507	It seems like FLoC could make it eas	"It seems like FLoC could make it easier to opt out centrally rather than going through a mess of specific (dis)approvals for the specific trackers on every site.  Maybe it could even be a good place for a dial - ""I'll expose a 4-bit cohort, but nothing more specific.""It also seems like FLoC could make it more politically viable to crack down non-consensual tracking.  Publishers wouldn't be able to say ""we have no choice but to deal with this [third party tracker] scum"" but could continue to gate content by subscription or (consensual) FLoC as necessary for their business model.Pushing publishing and advertising towards proactive consent about targeting puts them into a dialog with the market about what's ok, instead of letting them hide behind a bunch of shifting tracker businesses."	evrydayhustling	7.83316	-7.710791	comment	6.0	32.0	1614880101	-14.494844
25904549	> FLoC is an engineering solution to	> FLoC is an engineering solution to a political problem.Yes.>  the problem with targeted advertising is the targetingIs it? The problem with advertisement is the advertisement. I don't like to see ads at all, but one thing I know for sure, I'd take targeted ads at all time over random ads.> People don't like seeing their web history funnel into their advertising.No. This is the problem YOU have with it. Most of the non-tech people I know have no idea what you are even talking about.	maria_weber23	7.833626	-7.710126	comment	7.0	37.0	1611589790	-14.489469
30071445	Google kills off FLoC, replaces it w	Google kills off FLoC, replaces it with Topics	adwmayer	7.834457	-7.710075	story	7.0	62.0	1643116777	-14.49599
26830048	While I do understand that some peop	"While I do understand that some people may not like it, I don't see how FLoC is particularly harmful. I've read several articles about it, and most of them just say something like ""you are being put in a advertising cohort -- see how creepy it is"", which doesn't really prove anything.One more specific argument against FLoC is that it will make help tracking users via fingerprinting. I don't really buy it. First of all, the estimations from [EFF article](https://www.eff.org/deeplinks/2021/03/googles-floc-terrible-...) are just plainly wrong. They are talking about narrowing down to thousands of users, while in fact if Chrome has on the order of a billion users, and if FLoC has only 8 bits of entropy, the actual number of users in a cohort is on the order of millions. Secondly, from my under"	eterevsky	7.8340163	-7.7103057	comment	7.0	40.0	1618552506	-14.489394
25903611	The problem is not the option to pla	"The problem is not the option to place cookies per se. The issue is its misuse which aims to de-anonymize users (in order to place ads).
I don't see how saving the user data somewhere else (in a browser add-on or in the browser natively) is helping here.EDIT:
The official description [https://github.com/WICG/floc], does a better job in explaining the point.
They try to cluster (=""cohort"") users interests and exchange that with the ad-service. 
This could maybe help to increase transparency and authority over your data as it's saved locally.
But I don't see a way to limit the access to the users cohorts (they even say that themself, see link above). Everybody could access my interests - not just Google and other ad services.
And of course, if you have 1000 categories and some meta informati"	Medicineguy	7.8467264	-7.695799	comment	8.0	53.0	1611585722	-14.494054
28977504	> Re: forced Chrome logins. Don't ne	> Re: forced Chrome logins. Don't need cookies if you own the browser!(https://twitter.com/fasterthanlime/status/145209451374118912...)The swindle with FLOC was pretty obviously tied in this, but people still went in circles discussing whether it's private or not, and downvoting those who said FLOC is a trap.Let's consult the plan, nothing is even secret about this:- Google disables third-party cookies, crippling competitors to its Analytics, and thus their data for ads.- Google throws them the FLOC bone to avoid being sued, dressing it up as a privacy measure. Meanwhile FLOC is controlled by Google's code in the browser.- Google itself continues to vacuum up users' stats for all sites through the browser, never needing the cookies or FLOC.So, if this is not a case of Google using its mono	aasasd	7.851871	-7.691047	comment	8.0	81.0	1635080525	-14.512317
26796832	I’m sure there has to be a better wa	I’m sure there has to be a better way to introduce the audience to FLoC. I’m over five paragraphs in and the article hasn’t properly articulated what is FLoC and _why_ it is bad. Just that it is bad.	jereees	7.8305807	-7.7119694	comment	8.0	44.0	1618338485	-14.489485
26830130	Would I be terribly downvoted if I s	Would I be terribly downvoted if I said that I prefer targeted ads? I'd rather see GPUs than feminine hygiene products.FLoC seems like a method of saving my preferences locally, which is fine. I'm not interested. I won't use Google's browsers and I'll continue to filter my traffic.Internet privacy will always be an uphill battle, there's worse things going on, starting with centralized and monopolized DNS, I feel we should focus on fixing that.	notum	7.8401217	-7.700228	comment	8.0	27.0	1618553262	-14.468104
26856895	> Why is this bad? As the Electronic	> Why is this bad? As the Electronic Frontier Foundation explains in their post “Google’s FLoC is a terrible idea“, placing people in groups based on their browsing habits is likely to facilitate employment, housing and other types of discrimination, as well as predatory targeting of unsophisticated consumers.All of this has been happening with tracking cookies, fingerprint tracking, pixel tracking and so on. And will continue to happen.I find it so bizarre it took Google to talk about phasing out 3rd party cookies and replacing it with a much lesser technology in the face of FLoC, for people to suddenly be all up in arms about it.	slver	7.8357954	-7.7081127	comment	8.0	58.0	1618783386	-14.5004
26797004	"""Please switch to a browser that sup"	"""Please switch to a browser that supports FLoC to view this page."" [Links to Chrome, etc.]""This website requires a browser that supports FLoC.  Please install one of the folllowing compatible browsers: "" [Links for Chrome, etc.]""We've detected you are using a browser that does not support FLoC.  Please update your browser to use this website."" [Links to Chrome, etc.]""Your browser is outdated!  Please upgrade.""  [Links to Chrome, etc.]""Browsehappy"" [Links to Chrome, etc.]As someone who routinely uses a browser that does not support Javascript, I see ""warnings"" like this once in a while.  There are so many.  Apologies if I remember the wordings incorrectly.  Of course, 99% of the time the lack of a Javascript engine has zero effect on the ability to retrieve the information I need from the s"	1vuio0pswjnm7	7.835039	-7.70867	comment	9.0	49.0	1618339140	-14.494044
26885043	I find the visceral reaction against	"I find the visceral reaction against FLoC interesting. On paper it is an improvement over explicit 3rd party tracking cookies that are used to monitor the sites you visit and are ultimately used to categorize you. Just something about ""we're gonna stamp you with some labels and broadcast them to every site you visit"" really provokes people even though the end results are the same as before."	monkeybutton	7.8350782	-7.709549	comment	9.0	46.0	1618974926	-14.49301
26765246	FLoC stands for Federated Learning o	"FLoC stands for Federated Learning of Cohorts which aims to target advertising better without it directly relying on singularly personal information.https://web.dev/floc/  FLoC enables ad selection without sharing the browsing behaviour of individual users.

  FLoC provides a privacy-preserving mechanism for interest-based ad selection.

  As a user moves around the web, their browser uses the FLoC algorithm to work out its ""interest cohort"", which will be the same for thousands of browsers with a similar recent browsing history. The browser recalculates its cohort periodically, on the user's device, without sharing individual browsing data with the browser vendor or anyone else.


https://www.chromium.org/Home/chromium-privacy/privacy-sandb..."	mcint	7.8343835	-7.7097535	comment	10.0	174.0	1618089731	-14.5170355
26829563	Let me get this straight: even if my	Let me get this straight: even if my site has no ads or trackers, Chrome will now use my visitors data for advertising and surveillance???Does anyone else see FLoC as worse than the current state we're in?	dannyw	7.8335257	-7.710945	comment	10.0	65.0	1618548148	-14.4908495
26854094	WordPress is 41% of the web. If this	WordPress is 41% of the web. If this goes through and FLoC is disabled by default by WordPress, will FLoC be dead on arrival?	meattle	7.8328195	-7.710023	comment	10.0	70.0	1618764835	-14.485348
26884281	Everybody Hates “FLoC”	Everybody Hates “FLoC”	giuliomagnifico	7.831566	-7.709337	story	11.0	77.0	1618967839	-14.48541
26968241	The internet is split roughly into 3	The internet is split roughly into 3. The top 100 websites get a third of the page views, the remaining top 10k get another third and millions of websites get the last third.The top 100 have dedicated engineering and policy teams teams that will disable FLoC because they're either not interested in ads (Wikipedia) or have their own first party implementation that doesn't need FLoC (Facebook). They'll ditch FLoC.The next 10k might have engineering teams that can make the change, but might be more interested in finding out about their audience so they can monetize more easily. They'll keep FLoC.As for the remaining millions, only a tiny minority of them will even know this is a thing, let alone care enough to make the change or contact a developer who can do it. These are the folks who have 	nindalf	7.8332987	-7.7105775	comment	12.0	95.0	1619610069	-14.489343
30120799	Rebranding FLoC Without Addressing K	Rebranding FLoC Without Addressing Key Privacy Issues	skellertor	7.83284	-7.711933	story	13.0	185.0	1643406391	-14.495039
26838540	I'm definitely in the minority of co	I'm definitely in the minority of commenters on these FLoC threads. I hate that 3rd party cookies exist, and support FLoC if it would hasten the demise of 3rd party cookies. It seems like many consider the alternative to FLoC to be an anonymous web where content can be accessed without login. The migration of content into walled gardens like Instagram seems more likely to me.	xnx	7.8334665	-7.706825	comment	14.0	96.0	1618603871	-14.491814
28210507	Google considers switching FLoC to a	Google considers switching FLoC to a topic-based approach	robin_reala	7.8340726	-7.709668	story	17.0	64.0	1629212011	-14.470433
26829845	How to fight back against Google FLo	How to fight back against Google FLoC	rajeshrajappan	7.8335705	-7.7108135	story	17.0	158.0	1618550703	-14.487733
27463794	Privacy Analysis of FLoC	Privacy Analysis of FLoC	jonchang	7.833238	-7.711491	story	20.0	288.0	1623349517	-14.49367
26830557	FLoC Away from Chrome	FLoC Away from Chrome	bjt2n3904	7.837248	-7.7053065	story	24.0	347.0	1618557028	-14.477733
27459247	Ad tech firms test ways to connect G	Ad tech firms test ways to connect Google’s FLoC to other data	EdwinHoksberg	7.833575	-7.710919	story	26.0	327.0	1623322688	-14.495616
26795505	The Vivaldi browser will not support	The Vivaldi browser will not support Google’s FLoC	Fiveplus	7.840324	-7.702295	story	27.0	362.0	1618333693	6.1796145
26836923	Nobody is joining Google's FLoC	Nobody is joining Google's FLoC	Analemma_	7.833998	-7.7106123	story	28.0	269.0	1618594993	-14.489368
26854073	Proposal: Treat FLoC as a security c	Proposal: Treat FLoC as a security concern	meattle	7.833111	-7.711272	story	30.0	561.0	1618764706	-14.491296
