id	label	hovertext	author	x	y	type	relevance	size	year	umap1d
34362894	Submodules are hell. I work somewher	"Submodules are hell. I work somewhere with a polyrepo topology, with the inevitable ""shared"" bits ending up integrated into other repos as submodules. Nothing has been more destructive to productivity and caused so many problems.A plain old monorepo really is the best."	_rm	8.62237	8.999769	comment	3.0	13.0	1673573999	-11.990271
34434658	I've eased this multi-project burn o	"I've eased this multi-project burn out in those steps:- move all projects to a monorepo. This is great because all projects are in one place, they become interconnected as some code will end up being a library for multiple ones. This ensures that even when I'm doing side-project ""foo"" some of the code or stuff will also end up improving ""foo"" or ""bar"".- move the monorepo to github codespaces. The very last thing I want to do when I want to work on my side projects after some time is to remember how I had to setup everything, from ide, to the os, etc.- keep todos, documentation, notes, all in the monorepo. What did I have to do? `apps/foo/todo.md` or search in the project for ""TODO:"". No point into having docs on different services, they stay close to the project.- write E2E and integration"	epolanski	8.63289	8.990627	comment	3.0	10.0	1674084588	-12.867809
23482607	Author of the post here.I think Git 	Author of the post here.I think Git upstream is trying to simplify configuration. They have a config option called `features.manyFiles` which enables most of the features we enabled for our developers (https://git-scm.com/docs/git-config#Documentation/git-config...).We wanted to use this instead of deploying a wrapper, but it turns out that some of Git's features like fsmonitor do not interact well with repositories with submodules (there were Git crashes). And we have some developers that work on repositories with submodules. So we needed something more flexible, like enabling these features only on particular repositories.	ublaze	8.617759	9.004204	comment	3.0	13.0	1591826168	-12.008559
23483436	Is there a reason people prefer a mo	Is there a reason people prefer a monorepo to submodules?I worked at one place that kept everything in a mercurial mono repo and it was a real pain keeping branches in sync.	swiley	8.624807	8.996815	comment	3.0	10.0	1591832169	-11.965016
23483565	The fact that so many are using mono	The fact that so many are using monorepos points to a weakness in revision control and dependency management tools. This is a big gap where someone will invent Git’s replacement. What features will it need to replace Git?	silverlake	8.632126	8.988765	comment	3.0	10.0	1591833191	13.841568
30946520	The main downside that people always	The main downside that people always mention is it takes a long time to clone or pull a large repo. This is actually a flaw of git, not a flaw of the monorepo as a concept.	jeffbee	8.631954	8.990784	comment	3.0	14.0	1649348175	13.84564
30947418	People hated that they couldn't make	People hated that they couldn't make atomic changes across components. Google's monorepo means everybody has to move in lock-step, which is bad for everybody:* library maintainers must make sure they don't introduce any regressions to any users at all. There's no major version number that you can increment to let people know that something has changed. Development necessarily slows.* Library users must deal with any breakage in any library they use. Breakage can happen at any time because everybody effectively builds from HEAD. There are complicated systems in place for tracking ranges of bad CL numbersMonorepo isn't entirely to blame for this, but it certainly doesn't help. I've been at Google 15 years and I'm tired of this.	inoffensivename	8.635417	8.984329	comment	3.0	10.0	1649351482	13.842879
30959234	Your best bet for monorepo building 	Your best bet for monorepo building across a variety of languages is Nix. If money is no object you can also make do with Bazel.	tazjin	8.675949	9.028147	comment	3.0	13.0	1649435528	13.811748
34969251	the gratitude thing is kinda fun. I 	"the gratitude thing is kinda fun. I imagine that managers treat that as a ""positive only"" indicator (lack of gratitude markers should not be counted as a negative, but a lot of them should be counted as a positive), since it's dependent on coworkers who do that kind of thing.In a previous job I would always offer ""e-bux"" for fixes. I was half tempted to write a quick backend to track these e-bux, but gamifying that sort of stuff has its own consequences as well...> If there is an issue with a single deploy, it stops the whole company from shipping changes.This definitely feels odd to me. Monorepo shouldn't mean mono-artifact! Perhaps this is more theoretical/one point, but if Stripe engineers feel this and this person felt this after less than a year... Bazel is nice y'all. (EDIT: I'm bein"	rtpg	8.634798	8.988868	comment	3.0	10.0	1677592233	13.845032
36953713	> which is distributed and egalitari	> which is distributed and egalitarian at its core, is a better model for a fast-paced, globally distributed community of developers than previous monorepo systems like MercurialI'm a bit confused by this. I don't think that's what monorepo means, is it? Monorepo is what you choose to put in a repo? And I thought Mercurial was extremely similar to Git as it's also a DVCS?	robertlagrant	8.631258	8.986482	comment	3.0	10.0	1690878433	13.846996
36964083	What is your spiciest take on monore	What is your spiciest take on monorepos	pperi11	8.63206	8.990898	story	3.0	5.0	1690928844	13.844165
37292567	Most large monorepos simply are not 	Most large monorepos simply are not on git. Google has Piper, Yandex has arc, Facebook has eden (which is actually semi-open-source, btw!), some companies use Perforce and so on.	tazjin	8.63339	8.9906845	comment	3.0	13.0	1693222986	13.845669
37292571	for each submodule affected by some 	for each submodule affected by some change you would need an additional commits, yes. But those commits are bundled together in the commit of the parent repo where they act as one.So, atomicity of changes can be guaranteed, but you need to write a few more commits. However this effort of small increases of commits is far outweighed by the modularity imo.	steffres	8.617257	9.00514	comment	3.0	13.0	1693223032	-12.009491
29190959	Google had to build an internal vers	Google had to build an internal version control system as an alternative to git and perforce to support their monorepo.Microsoft forked git and layered their own file system on top of it to support a centralized git workflow so that they could have a monorepo.	anon9001	8.632415	8.987628	comment	3.0	13.0	1636653834	13.839244
29195112	I understand that your customers wan	I understand that your customers want very large git repositories, so that's the need you're going to serve.  As a (very large) bonus, you're going to sell a lot of cloud services to people that can't manage to work with their monorepo on local machines.  I won't be surprised if in 5 years, most big companies are just leasing GitHub instances as the only reasonable way to edit/build/test/deploy all of their code from the browser.  I think it's a concerning trend if you're not GitHub.Also, I appreciate that you're upstreaming to core git and not trying to build a technical moat.But why do so many people want these monorepos?This seems like a serious developer education problem to me.If I'm wrong that Google is the cause of this cultural shift toward monorepos, what do you think caused it?I 	anon9001	8.632307	8.987261	comment	3.0	13.0	1636677928	13.850674
29195687	> No one has claimed that a monorepo	> No one has claimed that a monorepo lets you magically do atomic RPC API migrations.Plenty of people have claimed and continue to claim that a monorepo lets you magically do atomic API migrations, and skate over how the fact that many APIs go over RPC these days.> It won't though: if you cover both code paths at each stage of the three stages, you'll cover all possibilities (its also not clear that you need integration tests to cover this, you can fake the client or server and test against both versions and be fine). This is the same if you've got multi or mono-repo, although with a monorepo there's a decent argument that maintaining integration tests is easier, as you can build both the client and server from within the repo.This relies on assuming that you perfectly maintain the previou	lmm	8.632769	8.99074	comment	3.0	20.0	1636683898	13.851788
29510150	> The Commission will make its softw	> The Commission will make its software available as open source in one single repositoryLet's hope this is not a git monorepo...I wonder where they will release it? Github would be the easy choice. They could self-host a forge or just a web frontend, publish tarballs, etc.An interesting choice would be to use SourceHut, which is now based in the Netherlands with ddevault. (edit: well, maybe it's still incorporated in Delaware).	MayeulC	8.631893	8.986109	comment	3.0	17.0	1639146172	-11.757835
36258360	Ask HN: Branching strategies for mon	Ask HN: Branching strategies for monorepos, what is your approach?	floppydisc	8.631416	8.990939	story	3.0	2.0	1686321044	13.841616
36400671	I doubt the fact they use a monorepo	"I doubt the fact they use a monorepo has any impact on this thinking. A versioned sourced repository is no different from a file server. If some ""ai copyright infringed"" code made it into the monorepo it doesn't compromise the whole thing. There are still clear distinct projects and products.But exactly, this is a hygiene thing. Staff will still be using these tools anyway."	samwillis	8.632395	8.989056	comment	3.0	24.0	1687245007	13.842317
25907222	Ask HN: Monorepo design best practic	Ask HN: Monorepo design best practices? (naming convention etc.)	bredren	8.632662	8.989168	story	3.0	2.0	1611601469	13.847114
26165355	Both --recursive not being default a	Both --recursive not being default and then using --recurse-submodules when pulling are my top annoyances in git.	c03	8.616605	9.005912	comment	3.0	12.0	1613562415	-12.055562
26167836	I absolutely despise submodules, but	"I absolutely despise submodules, but under many use cases you don't add or remove that often. We definitely run into errors people complain about. In fact there are errors that the average user (that doesn't really care about SVC) pretty much can't fix... or with much difficulty. I don't know that I'd still say it's a dealbreaker, but that's definitely very bad. Very much does break some of the spirit of git and what makes it ""nice"".We've been using them, and our system is still very usable (obviously this is a ridiculous thing to brag about, but worth pointing out).I'm wondering if there's a better way to handle shared code between two repos, where the users of either don't have access to the other parent? You might be able to use subtrees? Email source code and just create n separate com"	P_I_Staker	8.617588	9.002205	comment	3.0	13.0	1613577538	-11.994331
26239575	Anyone know a clean way to have nest	Anyone know a clean way to have nested git projects? Every time I make a commit in B (the nested git project), there are changes in A. Previous searching of a solution was hard to understand..	moosebear847	8.617097	8.994056	comment	3.0	14.0	1614099272	-11.948894
31160410	The rub for me here is that making o	The rub for me here is that making one change in a core library ideally wouldn't touch 100+ other source files. This feels like a separation of concerns issue in which a module is being over used.Perhaps I'm just in the wrong headspace, as I have never had to work in a monorepo fashion. That being said just because your code is in a monorepo, does that directly mean that you aren't versioning your libraries?To my understanding most package management tooling in most echo systems allow for versioning. With that said, wouldn't you slowly roll out the version to the downstream projects Monorepo or not?	DerArzt	8.633104	8.990249	comment	3.0	10.0	1650919779	13.848392
31515321	This is an interesting write up!The 	This is an interesting write up!The only question I have is around your point on monorepos - every monorepo I’ve seen has been a discoverability nightmare with bespoke configurations and archaic incantations (and sometimes installing Java!) necessary to even figure out what plugs in to what.How do you reason about a mono repo with new eyeballs? Do you get read in on things from an existing engineer? I struggle to understand how they’d make the job of auditing a software stack easier, except for maybe 3rd party dependency versions if they’re pulled in and shared.	zer01	8.633296	8.990122	comment	3.0	16.0	1653546589	13.842424
31597568	I'm currently evaluating/tinkering w	"I'm currently evaluating/tinkering with an idea:I think that a well structured monorepo might make a move away from all-encompassing full-stack frameworks and plugins to libraries, tools and special purpose frameworks easier to get close to a best of both worlds situation.The background is deploying up to a dozen or less new sites and apps per year as a small team while continuously maintaining the old ones and wanting to merge in new improvements found in newer development.---Rationale:Big web frameworks and similar give you per-project productivity, structure and are batteries included, but come with downsides, such as less control, less flexibility, unneeded complexity and abstraction, legacy cruft and gotchas, generally poor performance that you ""fix"" with caching where you can etc. Yo"	dgb23	8.632875	8.989073	comment	3.0	10.0	1654189517	13.82702
31764005	If you don't have a couple of hundre	If you don't have a couple of hundreds engineers who would write a custom file system for git (Microsoft), or who would take an existing source control system and nearly fully rewrite it (Facebook), or who would write a custom source control system from scratch (Google, Yandex, etc) DON'T USE MONOREPO.Otherwise you are risking to end up in a situation when hundreds of your engineers have to spend tens of minutes every time they need to simply push their code changes.	kanu666	8.633013	8.991304	comment	3.0	10.0	1655371421	13.87733
31766986	I get a headache imagining everythin	"I get a headache imagining everything Google in a monorepo.  So how do you reconcile this single GIT repository approach with Infoworld's ""The case against monorepos""? [1]:Reason #1. Monorepos go against single-team ownership principlesReason #2. Monorepos encourage bad practices involving massive refactoringReason #3: Small repositories are better than large ones[1] https://www.infoworld.com/article/3638860/the-case-against-m..."	stevenjgarner	8.631988	8.989279	comment	3.0	10.0	1655392375	13.846343
14411508	Why split it into separate modules? 	Why split it into separate modules? Seeing that big companies are very successful with monorepos (Google, Facebook, Microsoft), has made me reconsider if repository modularization is actually worth it. There are a host of advantages to not modularizing repos, and I'm beginning to believe they outweigh those of modular repos.	arjie	8.630456	8.991457	comment	3.0	28.0	1495645284	13.844716
14412979	I'd rather see google open up their 	I'd rather see google open up their monorepo as a platform, and compete with github.  git is fine, but there's something compelling about a monorepo.  Whether they do it one-monorepo-per-account, or one-global-monorepo, or some mix of the two, would be interesting to see how it shapes up.	daxfohl	8.632154	8.987281	comment	3.0	20.0	1495656017	13.844007
14662586	There is no better, there is only tr	"There is no better, there is only tradeoffs, and some people prefer one tradeoff and others prefer another tradeoff. That's just how it is.So before making any siginficant changes one should discuss what the desired tradeoff is, and then measure the continuous change towards that tradeoff.For instance monorepo is a goal for people who want interacting tools to be build in their corresponding state without need to consult someone else. Can you do that? Check out the repo (for 2-5 hours depending on your code size) and then just hit ""make"" and ""make test"" and it runs through? If yes it's a success, if no something went wrong in the process.PS: There are actually build tools that are language independent, e.g. make, CMake or Maven. You can just use these.PPS: I'm personally really happy to se"	erikb	8.646077	9.000571	comment	3.0	11.0	1498738459	13.822482
14662746	Monorepo doesn't imply read permissi	Monorepo doesn't imply read permissions for the entire repo for everyone in the company.	klodolph	8.63252	8.990703	comment	3.0	12.0	1498740071	13.846789
20566165	Ask your doctor if Monorepo is right	Ask your doctor if Monorepo is right for you.	rezmason	8.633862	8.982347	comment	3.0	11.0	1564502487	13.846888
20567094	My team just switched to a monorepo.	My team just switched to a monorepo. It's been only a few weeks, so I can't claim any results yet, but we've lived w/ the pain of poly-repo for long enough that we were ready to invest in a single repo.We've spent a lot of time building and iterating a unified ci/cd environment to support the new repo. Previously each project had it's own test/deploy/build/publish story and usually it's own jenkins project. Now, each project is registered and triggers its own steps. Cross-project edits can happen in a single pull request. We have an incredible amount of integration tests (more so than unit tests), and getting them to work corss-project while migrating has been challenging.We've gone from ~10-15 actively maintained repos to about 3 as we're slowly migrating. We have a mix of services, libra	DanFeldman	8.632139	8.990285	comment	3.0	18.0	1564507907	13.841536
20568139	Let's assume without proof that Glib	Let's assume without proof that Glibc developers are good. Similarly, kernel.org developers are good as are the gcc.gnu.org people.Should glibc, gcc and the kernel be in a monorepo?(Cue laugh track ...)	kazinator	8.632555	8.985662	comment	3.0	10.0	1564513926	13.846506
20569721	How do you handle building changes t	How do you handle building changes to just one of those projects? Can Jenkins do that (easily)?I think that's the big thing that always puts me off monorepo... We'd basically be going from ten 5 minute builds to one 50 minute build if it wasn't possible to do incremental builds. IIRC Google and MS have purpose built tools that do impact detection to work out what to build for their monorepos to keep build times down.	joshschreuder	8.644732	9.002244	comment	3.0	12.0	1564524610	13.8266
20911893	I thought the monorepo setup made cr	I thought the monorepo setup made cross-project dependency changes easy?	tedmiston	8.632304	8.990984	comment	3.0	12.0	1567963467	13.8436365
20917409	that stood out to me too... not the 	that stood out to me too... not the monorepo really, but the fact its a monorepo of a billion lines of code. seems almost impossible to maintain when you have a dependency change at the lowest levels that affects numerous projects.If i am understanding google was in a situation where they had to update every project that used typescript inside the entire company at the same time, that seems untenable.	apalmer	8.633542	8.987694	comment	3.0	11.0	1568031477	13.863749
24173670	I think if git submodules were archi	I think if git submodules were architectured differently, they could have been a really interesting solution for package management. In fact my last place of work uses a layer on top of submodules as part of their internal package manager. I think they could be really special but unfortunately are now sort of relegated to history.	anchpop	8.614819	9.007675	comment	3.0	23.0	1597537419	-11.999753
24175686	I won't suggest others are referring	"I won't suggest others are referring to the same issues necessarily, but try switching between branches(/commits) when you have submodules. Let alone rebasing etc... they simply  don't ""just work"". You always get some odd vestige of a submodule hanging somewhere that ends up causing problems, either in the index or the .gitmodules or somewhere in .git/ or whatever. Hell, the fact that there are so many places where git submodules are recorded itself has caused me so many headaches."	mehrdadn	8.61734	9.005346	comment	3.0	10.0	1597558859	-12.006772
24256041	Is there actually any veracity to th	Is there actually any veracity to this claim or is it general anti-google shit-flinging?I ask because from what I understand from Google's monorepo, it should be easy for engineers to take direct dependencies on whatever they want.Of course TF is an exported out library so things might be different, but surely it won't then be a good example of Google's DNA?	kinkrtyavimoodh	8.634209	8.985623	comment	3.0	11.0	1598223952	13.853941
34049286	Monorepos and monoliths are orthogon	Monorepos and monoliths are orthogonalMonorepos are a tooling nightmare. Monorepos are a bandwidth black hole.Monorepos make some things possible that are just not possible or very very hard when you have multiple independent repos that are built and tested independently.Namely,a) they allow you to test the effects of a change on all the components that depend on you, before you merge your change. This reduces the noise caused by regressions (API or behaviour) introduced in one component that is depended on by many consumers.b) they are a practical way to ensure that all components have up to date internal dependencies: by placing the burden of API and behaviour breakage to the author of the change, you don't end up having hundreds of teams each struggling to keep up with dependencies that	ithkuil	8.632685	8.989313	comment	4.0	20.0	1671432807	13.846362
26479390	Nice work, really interesting blog p	Nice work, really interesting blog post!On a sidenote, git itself can also get painfully slow with large monorepos. Hope GitHub can push some changes there as well.I know FB moved off git to mercurial because of performance issues.	iliekcomputers	8.633296	8.986372	comment	4.0	20.0	1615913565	13.824696
26479399	Offtopic, but I often wonder if ther	Offtopic, but I often wonder if there are people using `git worktree` to have several related code trees within the same repo.Technically it works the mostly the same as multiple repos, but theoretically allows to have something like a bootstrap script with everything self contained in the same repos. Looks like an alternative tradeoff between a monorepos with shared history and multiple repositories.	tuyiown	8.629493	8.981832	comment	4.0	16.0	1615913586	-11.897061
26920494	I've considered building systems tha	I've considered building systems that would speculatively run builds using forward projections of all pending pull requests, as well as run multiple parallel scenarios on merge order + rebase such that merge conflicts are minimized. Maybe sprinkle in some monte carlo if the numbers get a little intense.In practice, I feel it is much easier to assign work and organize your codebase so that logically-different business functions can be managed in isolation.We rarely have merge conflicts these days, and we are also on 1 big monorepo. It mostly boils down to discipline and architecture.	bob1029	8.635685	8.991257	comment	4.0	12.0	1619220631	13.837659
27010518	I’ve always found that the biggest i	I’ve always found that the biggest issue with monorepos is the build tooling. I can’t get my head around Bazel and other Blaze derivatives enough to extend them to support any interesting case, and Nix has too many usability issues to use productively (and I’ve been in an organization that gave it an earnest shot).	throwaway894345	8.647735	9.001252	comment	4.0	22.0	1619908673	13.824677
12737307	Then maybe you can answer a few ques	Then maybe you can answer a few questions:- Do you have zero external dependencies on 3rd party library not own by Google? These must still be managed anyway? How do you deal with project X is not ready to move to external library version N but project Y needs version N?- What about release branches? If you need to intergrate a bug-fix in a sub-system, the magic mono-repo now means merging a fix is harder as it may depend on other unrelated changes all over teh repo? The laissez-faire attitude of not having to care about details in HEAD would seem to bite back in release branches.	pierrebai	8.632848	8.989583	comment	4.0	15.0	1476815438	-9.282005
13598968	> Git is more pleasant when you brea	"> Git is more pleasant when you break your codebase into isolated components. These can be pretty large—the Linux kernel has 16 million lines of code—but if your codebase is many times larger than a complete modern kernel, you might want to split it.As part of a company that switched to same kind monorepo structure form several separate repositories - there is nothing ""pleasant"" about having to deal with multiple Git repositories for connected components. Subtrees, submodules are utter hell of maintenance, checkout bugs (which hurt CI) and bad UX across the board (""why doesn't this build?"" ""you forgot to checkout submodules"" ""no you forgot to move the commit pointer"" ""no you forgot to change dependant tests because you didn't see them in an isolated repository""...)It's not a GOOD approach,"	izacus	8.623487	8.9969225	comment	4.0	17.0	1486567907	-11.967117
