id	label	hovertext	author	x	y	type	relevance	size	year	umap1d
14976140	Especially in a world where GVFS is 	"Especially in a world where GVFS is a thing (not quite yet), I fail to see the advantage of a monotree over a monorepo with lots of branches and scripting around a MAINTAINERS file.What's wrong with branches and folders? Why are upstream repositories needed? (My hunch is the answer is just ""it's slow with that much code"" to which I again say ""not when GVFS is ready"").Not to say Linux should change their ways, just that I wouldn't adopt them as part of a company."	rattray	8.631922	8.989047	comment	5.0	19.0	1502336446	13.840919
28940487	Like versioning services, deployment	Like versioning services, deployment of the code base, breaking out new microservices, transitioning to any container based deployment solution. Monorepos aren’t just a nightmare for release management, they’re a nightmare for any sort of single responsibility oriented architecture. I’m really exhausted of “senior devs” that believe they’re architects championing monorepos just because they’re too lazy to change minor versions in a repo.	randmeerkat	8.6325445	8.989369	comment	5.0	28.0	1634792484	-13.762663
28940384	You lost me at monorepo. That might 	You lost me at monorepo. That might work at a very small scale, but past that monorepos create more problems than they solve.	randmeerkat	8.632355	8.987874	comment	5.0	38.0	1634791647	13.845218
23432138	How do you achieve this technically?	How do you achieve this technically? Monorepo would be a pain to break.Or just break up Google into two but let both of them keep the access to the same repo? Then what would this achieve?	kediz	8.632369	8.989345	comment	5.0	17.0	1591382161	13.848876
30946127	Any suggestions for how to go from m	Any suggestions for how to go from multiple Git repos to a monorepo? Preserving history would be really nice. I've looked at submodules and subtrees and both seem to have huge downsides and don't deliver the same benefits of a true monorepo.	liminal	8.631934	8.990432	comment	5.0	17.0	1649346564	13.843467
30946614	I know some of the FAANGs do monorep	I know some of the FAANGs do monorepo (Google being the biggest) but AWS does not.A monorepo is an organizational mess when trying to manage and transfer ownership across thousands of teams, contain the blast radius of changes, unless you invest a ton of resources into  proprietary tooling that requires a bunch of maintenance, since all the open source solutions are terrible at this and the whole data model is built around splitting out individual project repositories. And then after all that effort, why wouldn’t you just use tooling the way it was intended, and the way it’s used in the open source model, so you can partition your CI/CD without a bunch of hacks, and don’t run into bizarre scaling issues with your VCS.It perplexes me people advocate for this strategy. All I can think is it’	oceanplexian	8.632367	8.989187	comment	5.0	31.0	1649348533	13.845977
30946741	Honestly I would 100% do a monorepo 	Honestly I would 100% do a monorepo every single time if there was good tooling for incrementally building and testing libraries. Having to rebuild every image from scratch for every single change scales miserably. Things like Bazel exist, but you basically have to have a team dedicated to operating it (maybe the difficulty varies by language, but it was a major pain when I tried to use it to build some relatively simple Python projects a few years ago).	throwaway894345	8.675834	9.028315	comment	5.0	23.0	1649348981	13.794307
30959291	Well done and congrats to the Turbor	Well done and congrats to the Turborepo team on the launch as well as the Vercel merger, which I think is a great thing for the JS ecosystem!We now have a healthy competition between several JS domain-specific build tools bit.dev, Nx, Turborepo, and Rush. This is in addition to plugins to general purpose monorepo tooling like rules_nodejs (Bazel). I'm looking forward to the seeing the new ideas that come out from the community as this field matures.However, I feel a bit sad at the state of general purpose build tools (Bazel/Pants/Buck, make, GitHub Actions, Maven, Nix) or cloud-based IDEs (Cloud9, Codespaces). These tools come off as too complex to operate and build on top of such that we, the JS community, seem to be choosing to build JS-specific tooling from scratch instead. There are a 	steven-xu	8.652387	8.988473	comment	5.0	28.0	1649435784	13.7941675
31260124	I generally agree, but two things I'	I generally agree, but two things I'd like to point out.If you're using python for the web you're already part of the complexity problem, atleast from the perspective of someone deploying php 15 years ago.  I use python for web development, and I love it, but deploying webpages used to be copy an apache config and  ftp/scp your files to some location.   Now we need app servers and reverse proxies, and static files are served differently, and even though I've gotten used to it over the last decade it does't mean it's good.The other thing is that MonoRepos are pushing back against complexity for the sake of complexity. Why create a new repo when a directory will work just fine?  I think a ton of people got repo crazy because their coporate jenkins server only allowed one project per repo,  b	dec0dedab0de	8.632756	8.989236	comment	5.0	37.0	1651671200	-13.808488
31598163	Surprised you haven't heard of or us	Surprised you haven't heard of or used lerna (with yarn workspaces), which is the defacto monorepo setup in JS world. I use it to maintain a bunch of monorepos and works pretty flawlessly.	halfmatthalfcat	8.633759	8.990812	comment	5.0	21.0	1654191909	13.841732
34767675	Monorepos are great... but only if y	"Monorepos are great... but only if you can invest in the tooling scale to handle them, and most companies can't invest in that like Google can.  Hyrum Wright class tooling experts don't grow on trees.A good article to reference when this topic gets raised: 
http://yosefk.com/blog/dont-ask-if-a-monorepo-is-good-for-yo..."	zdw	8.633537	8.986268	comment	5.0	23.0	1676240009	13.84396
34887152	Nx is hot garbage imo. Buggy, overly	Nx is hot garbage imo. Buggy, overly verbose, inflexible, poorly documented, and I'm dubious about their peer review process.If I don't need build caching I'm not using any tool but PNPM and its workspace toolset - that's literally all most people need for a monorepo. I've looked into Turborepo, and its simplicity versus Nx is a strength. However, it's not the taskrunner that I want.I now work in a monorepo where build caching is required, so I'm excited about moon and keeping a watchful eye on the project's progress. From my evaluation so far, it fixes all of my gripes about Nx and I'm keen on it not trying to do too much, while allowing me to make it as flexible and extensible as I need. Extending configs is chefs kiss	andrew_	8.634541	8.985666	comment	5.0	16.0	1677013049	13.8308325
16364164	The catch is the tooling.  If you ha	The catch is the tooling.  If you have the time and resources to make the tooling that is necessary to make it work specifically for your org, than great!But if you don't, then a monorepo will generally slow you down because it will require coordinating changes across a much bigger group of people.Monorepos are great for very small companies with a low communication overhead, and very large companies with the resources to build the tooling to make it work.For everyone in between, I feel that small repos and microservices give the best developer velocity.	jedberg	8.63285	8.987454	comment	5.0	30.0	1518487210	-13.805918
16565299	Mononoke – A Mercurial source contro	Mononoke – A Mercurial source control server designed to support large monorepos	gfortaine	8.630529	8.991534	story	5.0	106.0	1520811088	13.887165
21234785	Monorepo shortcomings 1 and 2 seem l	Monorepo shortcomings 1 and 2 seem like bullshit to me.  Perforce, the popular monorepo at most companies I've worked at, supports access control.  Monorepos do not prevent you from segmenting your code into modules and pushing binary/source packages into source control so that builds can avoid compiling everything(TiVo used to do this, and it worked well when you got the hang of it).I feel like these debates are often fueled by false arguments.  Either way you go, you're going to want to build support tools and processes to tailor your VCS to your local needs.	01100011	8.632339	8.990026	comment	5.0	48.0	1570901677	13.8528385
18813238	Can anyone here explain to me how a 	Can anyone here explain to me how a monorepo like Google or Facebook handles security?If I pull the repo - I have the entire contents of Google or Facebook? Is that right?Surely that lacks the normal security measures around what must be highly sensitive information, so there must be more to it than I know of?	laurencei	8.6325245	8.989126	comment	5.0	19.0	1546496161	13.848037
18813417	You can't split monorepos after the 	You can't split monorepos after the fact, at least not without immense costs. You can always just put all your small repos into a big one.	adrianN	8.63138	8.98922	comment	5.0	43.0	1546499009	13.852604
18815380	I think this article is complete hor	I think this article is complete horseshit. A monorepo will serve you 99% of the time until you hit a certain level of scale when you get to worry about whether a monorepo or a polyrepo is actually material. Most cases are never going to get there. Before that point, a polyrepo is purely a distraction and makes synchronous deployment really painful. We had to migrate a polyrepo to a monorepo and it was not fun because it was a migration that should have never had to be done in the first place. Articles like this are fundamentally irresponsible.	yowlingcat	8.632713	8.989899	comment	5.0	48.0	1546526516	13.849635
18815893	I work on CI/CD systems, and that’s 	I work on CI/CD systems, and that’s one thing that definitely gets harder in a monorepo.So you made a commit.  What artifacts change as a result?  What do you need to rebuild, retest, and redeploy?  It doesn’t take a large amount of scale to make rebuilding and retesting everything impossible.  In a poly repo world, the repository is generally the unit of building and deployment.  In monorepo it gets more messy.For instance, one perceived benefit of a monorepo is it removes the need for explicit versioning between libraries and the code that uses them, since they’re all versioned together.But now, if someone changes the library, you need to have a way to find all of its usages, and retest those to make sure the changed didn’t break their use.  So there’s a dependency tree of components som	thanatos_dem	8.632815	8.989991	comment	5.0	19.0	1546530151	13.845932
18824590	People who like multirepos are alway	People who like multirepos are always saying how easy it is to pin dependencies but like you I haven’t seen anyone doing it right since I left Google. The monorepo third-party system works well in practice.Ps thanks for getting scipy into third_party all those years ago.	shereadsthenews	8.63274	8.990512	comment	5.0	29.0	1546615380	13.847197
18855923	In my case, I'm struggling to find g	In my case, I'm struggling to find good tooling to support monorepos. We're running a microservice architecture, but our CI is triggered by GitHub web hooks. Currently we're either doing a full build of everything on each webhook event or we're doing some error-prone git-diffing to try to make sure we're only rebuilding when necessary. I've looked at tools like Buck and Bazel, but they seem really heavy for our ~30 person engineering team and they also seem to have odd ways of doing things (no support for pulling from a package repository, vendoring is assumed to be vendored--which incidentally the author of this blog post characterizes as a Bad Thing). Folks who are using monorepos successfully--what tooling do you use to solve these problems?	weberc2	8.633694	8.990116	comment	5.0	19.0	1546959905	13.830006
24971288	My Thoughts on Monorepo	My Thoughts on Monorepo	shekhargulati	8.632317	8.988677	story	5.0	37.0	1604341499	13.847126
31955057	For Lua, just to be safe, I fork all	For Lua, just to be safe, I fork all my dependencies and when I work on a project I add those forked dependencies as git submodules. Just to feel a bit more secure any dependencies never disappear.Not sure if this is good practice.	wsc981	8.617493	9.003498	comment	5.0	22.0	1656724499	-11.9814205
39478610	Since it uses SQLite under the hood,	Since it uses SQLite under the hood, Fossil as a version control system might be able to scale much more gracefully than git for huge monorepos. I think about this often but haven't found a way to effectively use this knowledge yet, since I haven't worked in a giant monorepo shop yet, nor have I found any third parties talking about their experience with this.	hiAndrewQuinn	8.632148	8.987997	comment	6.0	24.0	1708680269	13.830619
19531938	Editors need to be able to support o	Editors need to be able to support our very unique way of storing code (monorepo).	ilovecaching	8.633088	8.984406	comment	6.0	23.0	1553980879	13.848476
15890440	Large-scale refactorings are actuall	Large-scale refactorings are actually pleasant.My team owns a framework and set of libraries that are widely used within the Google monorepo.  We confidently forward-update user code and prune deprecated APIs with relative ease — with benefits of doing it staged or all-at-once atomically.It's imperfect, but maintenance in distributed repositories is infinitely worse.  Still, I remember the earlier days of the monorepo and keeping Perforce client file maps; that was a pain!  https://www.perforce.com/perforce/r15.1/manuals/dvcs/_specif...	matttproud	8.632651	8.98969	comment	6.0	46.0	1512891887	13.838034
15891299	Must have: Tooling that can interact	Must have: Tooling that can interact on a file or sub directory level. Git cannot do that.Should have: Access control to view and change file on a subdirectory basis. Everyone can see the repo so you can't permissions users per repo anymore. It's optional but these companies have that.Recommended: Global search tools, global refactoring tools, global linting that can identify file types automatically and apply sane rules, unit test checks and on commit checks available out of the box for everything and that run remotely quickly, etc...It's regular tooling that every development company should have, but only big companies with mono repos have it.It's not that the tooling is needed to deal with the mono repo, it's that the tools are great and you want them. But they can't be implemented in a	user5994461	8.632575	8.988207	comment	6.0	31.0	1512912897	13.837356
18810604	My problem with polyrepos is that of	My problem with polyrepos is that often organizations end up splitting things too finely, and now I'm unable to make a single commit to introduce a feature because my changes have to live across several repositories. Which makes code review more annoying because you have to tab back and forth to see all the context. It's doubly frustrating when I'm (or my team is) the only people working on those repositories, because now it doesn't feel like it gained any advantages. I know the author addresses this, but I can't imagine projects are typically at the scale they're describing. Certainly it's not my experience.Also I definitely miss the ability to make changes to fundamental (internal) libraries used by every project. It's too much hassle to track down all the uses of a particular function, 	mrgriffin	8.632939	8.988561	comment	6.0	35.0	1546465991	13.84855
18814027	Hilariously misguided.Pretty funny t	"Hilariously misguided.Pretty funny to read that the things I do every day are impossible.Monorepo and tight coupling are orthogonal issues. Limits on coupling come from the build system, not from the source repository.Yes, you should assume there is a sophisticated ""VFS"". What is this ""checkout"" you speak of? I have no time for that. I am too busy grepping the entire code base, which is apparently not possible.If the ""the realities of build/deploy management at scale are largely identical whether using a monorepo or polyrepo"", then why on earth would google invest enormous effort constructing an entire ecosystem around a monorepo? Choices: 1) Google is dumb. 2) Mono and poly are not identical."	rossjudson	8.632664	8.990103	comment	6.0	42.0	1546509642	13.848704
30635888	Monorepos are changing how teams bui	Monorepos are changing how teams build software	gk1	8.633458	8.989202	story	6.0	8.0	1646970137	13.847075
17239313	Makes sense. Google runs a mono-repo	"Makes sense. Google runs a mono-repo. Microsoft ran codeplex[2]. 
Microsoft wanted to be in Github's space but couldn't compete, so bought the space.[1]: https://cacm.acm.org/magazines/2016/7/204032-why-google-stor...[2]:https://en.wikipedia.org/wiki/CodePlex"	maerF0x0	8.633863	8.979806	comment	6.0	25.0	1528216192	-11.7672825
17504357	It seems like splitting into separat	It seems like splitting into separate repos was a rash response to low-value automated tests. If tests don't actually increase confidence in the correctness of the code they're negative value. Maybe they should have deleted or rewritten a bunch of tests instead. Which is what they did in the end anyway.>> A huge point of frustration was that a single broken test caused tests to fail across all destinations. When we wanted to deploy a change, we had to spend time fixing the broken test even if the changes had nothing to do with the initial change. In response to this problem, it was decided to break out the code for each destination into their own reposThey also introduced tech debt and did not responsibly address it. The result was entirely predictable, and they ended up paying back this d	Floegipoky	8.632849	8.986875	comment	6.0	34.0	1531281101	13.842713
17606103	Maybe I'm not cool enough to underst	Maybe I'm not cool enough to understand this, but I don't see the draw for monorepos. Imagine if you're a tool owner, and you want to make a change that presents significant improvements for 99.9% of people, but causes significant problems for 0.1% of your users. In a versioned world, you can release your change as a new version, and allow your users to self-select if/when/how they want to migrate to the new version. But in a monorepo, you have to either trample over the 0.1%, or let the 0.1% hold everyone else hostage.Conversely, imagine if you're using some tools developed by a far off team within the company. Every time the tooling team decides to make a change, it will immediately and irrevocably propagate into your stack, whether you like it or not.If you were at a startup and had a p	whack	8.632856	8.990541	comment	6.0	42.0	1532479329	13.845971
21626047	Git-subtrac: all your Git submodules	Git-subtrac: all your Git submodules in one place	mrzool	8.61674	9.005113	story	6.0	132.0	1574665287	-12.0451355
27906155	This is the reason for monorepos.It'	This is the reason for monorepos.It's not about migrating APIs or coordinating deployments. That's an impossible problem to solve with your repo. It's to update libraries and shared code uniformly and patch dependencies (eg. for vulns) all in one go.Imagine updating Guava 1.0 -> 2.0. Either you require each team to do this independently over the course of several months with no coordination, or in a monorepo, one person can update every single project and service with relative ease.Let's say there's an npm vuln in leftpad 5.0. You can update everything to leftpad 5.0.1 at once and know that everything has been updated. Then you just tell teams to deploy. (Caveat: this doesn't really work as cleanly for a dynamically typed language like javascript, but it's a world wonder in a language like	echelon	8.632457	8.990445	comment	6.0	24.0	1626875093	13.825358
28384169	Monorepos will ruin your life – but 	Monorepos will ruin your life – but they're worth it	tyson-cadenhead	8.635668	8.98331	story	6.0	64.0	1630522755	13.842312
22576236	Has anyone used Git submodules to is	Has anyone used Git submodules to isolate large binary assets into their own repos? Seems like the obvious solution to me. You already get fine-grained control over which submodules you initialize. And, unlike Git LFS, it might be something you’re already using for other reasons.	derefr	8.617629	9.003048	comment	6.0	26.0	1584201620	-12.005851
13621569	Is the practice of shoving all dispa	Is the practice of shoving all disparate pieces of proprietary software (or individual projects) in the same repo a common occurrence?  I have found that pulling unrelated changes just so that I can push my changes is an inconvenience.  Furthermore, tracking the history of a particular project is confounded due to unrelated commits.  I am sure that their vcs (piper?) makes this a feasible task, but for git, it seems like it would suck.The article posted by kyrra, mentions this.Given the value gained from the existing tools Google has built and the many advantages of the monolithic codebase structure, it is clear that moving to more and smaller repositories would not make sense for Google's main repository. The alternative of moving to Git or any other DVCS that would require repository spl	__strisk	8.632716	8.985567	comment	6.0	32.0	1486797716	13.826887
14411502	Really good question. Actually, spli	"Really good question. Actually, splitting Windows up was the first approach we investigated. Full details here: https://www.visualstudio.com/learn/gvfs-design-history/Summary:- Complicates daily life for every engineer- Becomes hard to make cross-cutting changes- Complicates releasing the product- There's a still a core of ""stuff"" that's not easy to tease apart, so at least one of the smaller Windows repos would still have been a similar order of magnitude in most dimensions"	vtbassmatt	8.632389	8.978856	comment	6.0	57.0	1495645198	13.789645
30946116	It's very simple: with a monorepo yo	It's very simple: with a monorepo you always have access to everything you need, together with a ton of stuff you don't.  Whether or not this is advantageous boils down to whether the cost of not having access to something you need is greater than the cost of having access to a bunch of stuff you don't.  As long as your system is reasonably efficient at letting you select small subsets of everything you could potentially have access to, the cost of having access to a bunch of stuff you don't need is essentially zero.  Perforce is good at that.  Git isn't.  So people who use Perforce tend to think that monorepos are good and people who use git don't.  And they're both right.	lisper	8.631666	8.983716	comment	6.0	39.0	1649346493	13.820385
31597057	What is the beneficial distinction b	What is the beneficial distinction between this and composing the monorepo with git submodules? I have been doing that in my codebase after suffering from all the regrets of attempting to emulate npm package releases of my modules. I feel that utilizing submodules feels more pure and conveys isolation and separation. It feels like I am not grokking something vital about why Monorepos > Repo w/ git submodules.	blorenz	8.623669	8.998237	comment	6.0	25.0	1654187678	-11.989997
31763078	"Right, it's ""I have to send 5 PRs to"	"Right, it's ""I have to send 5 PRs to 5 different repos, get them all cross merged, and then at the end it's wrong anyways so I have to start all over"".Multirepo management is extremely frustrating compared to ""it's all in the same folder""."	rtpg	8.632015	8.987746	comment	6.0	24.0	1655361409	13.791946
31763154	They made a bad design decision 10 y	They made a bad design decision 10 years ago, have been fighting the fallout for years, and will be doing so forever and ever because things will only ever grow.They wrote a blog post on how clever they think all their workarounds are, at least one of which involves sparse-checkout -- which is perilously close to chopping up your monorepo into several, while still pretending monorepo is fine.I feel like somebody's job and/or ego is heavily invested in keeping things as they are, even if it demonstrably does not scale to their needs, and the solution is blindingly obvious to even a casual observer.That is institutional insanity.	the_biot	8.633686	8.989973	comment	6.0	28.0	1655362177	13.843024
36333580	> If done in a company with a monore	> If done in a company with a monorepo I'd be especially interested in hearing moreAre there any big companies left which haven't adopted a monorepo?	aeyes	8.627104	8.976164	comment	6.0	26.0	1686781191	13.869219
29190439	Monorepos create more issues than wh	Monorepos create more issues than what they solve.	speedgoose	8.6335745	8.989564	comment	6.0	23.0	1636651134	13.847921
29190664	> Monorepos are much easier for ever	"> Monorepos are much easier for everyone to use, and are the only natural way to manage code for any project.I strongly disagree with that, but I'll let this blog post explain it better than I can: https://medium.com/@mattklein123/monorepos-please-dont-e9a27...> You keep talking about Google, but a much more famous monorepo is Linux itself.I thought it was fairly well known that monorepos came directly from Google as part of their SRE strategy.  It didn't even come into common usage until around 2017 (according to wikipedia).  If I'm remembering correctly, the SRE book recommends it, and that's why it gained popularity.Also, I don't believe that Linux is a valid interpretation of ""monorepo"".  Linux is a singular product.  You can't build the kernel without all of the parts.A better example"	anon9001	8.632363	8.988112	comment	6.0	22.0	1636652212	13.843271
