id	label	hovertext	author	x	y	type	relevance	size	year	umap1d
25142254	I was in the same boat.  It felt sup	"I was in the same boat.  It felt super wrong.  It felt like the long, slow nightmare of maintaining an early Boostrap site all over again.  But I got peer-pressured into trying it on a medium-sized project and yep: I'm in love.  I'm in camp Utility Classes now.The only serious issue I had was when implementing designs provided by an outside designer:1. The design says this width needs to be 28 px2. That'd be ""w-7"", which TW doesn't provide.  Guess I'll add it to my tailwind config file.3. Repeat ad nauseam until I broke down and added all ""w-n"" widths to my tailwind config from 1 to 500.4. Repeat for min-width, spacing, border-radius, etc.The result is that A) I get really good at converting pixels to rems to tailwind-scale, then back again in my head and B) My tailwind config is huge - th"	fishtoaster	9.821934	-8.723773	comment	5.0	26.0	1605732523	-15.582861
25141373	For those complaining about dense HT	For those complaining about dense HTML using Tailwind, the headline feature of 2.0 should be @apply for everything: https://tailwindcss.com/docs/functions-and-directives#applyIt lets you move all of those excessive class attributes into your CSS, where it realistically belongs. And that makes your CSS look a little more like CSS. But you get guard rails on it by applying a known set of properties to each rule. It's really the best of all worlds.	timdorr	9.821673	-8.724288	comment	5.0	28.0	1605728246	-15.585298
25146612	It's not like Tailwind is SAP or som	"It's not like Tailwind is SAP or something. It's just CSS. You shouldn't need to re-work your entire process around it.The custom stuff in our config was mostly the need to create standard styles for components. Eg. button large, button small, etc. to correspond with our design system.For example, here's tailwind code required to create a button large: 
bg-violet-100 text-violet-700 text-base font-semibold px-6 py-2 rounded-lgHow the hell does that help with consistency? You have to copy paste that mess every time you create a new button, and then guess what happens if the button you copied from needed special margin? Try debugging that if something looks wrong. Also try turning that into dark mode.Now you've got to search through the spaghetti to find what's custom about this button and f"	pembrook	9.817821	-8.726998	comment	5.0	21.0	1605764682	-15.57793
25334106	The discussions of Tailwind are alwa	The discussions of Tailwind are always heated but fundamentally boring because all the threads are started by people making the obvious objections that arise before you use it which were answered by Adam three years ago.[1] Do people who have actually used Tailwind in a real project have anything to add?[1] https://adamwathan.me/css-utility-classes-and-separation-of-...For my part, I am seeing slow rendering on some of my sites (page doesn't appear on webpagetest.org until 1s after network is done), and I wonder if maybe having atomic CSS is slower to render? Anyone have experience with that?	earthboundkid	9.823551	-8.722945	comment	5.0	29.0	1607360906	-15.578649
31989062	Show HN: Preline UI – Open-Source Ta	Show HN: Preline UI – Open-Source Tailwind CSS Components	jaha	9.823644	-8.718601	story	5.0	64.0	1657033393	-15.577606
36627089	I've never understood why public opi	I've never understood why public opinion is so polarizing on Tailwind.Could someone with experience in both camps help me understand the tradeoffs, and offer any guidance on whether Tailwind would (not) be a good fit?	c_s_guy	9.817175	-8.72635	comment	6.0	29.0	1688703784	-15.591615
36627205	I don't understand why it's an eithe	I don't understand why it's an either/or between Tailwind vs using CSS classes. Tailwind is awesome. At the same time, no, repeating the same styles for links, buttons again and again isn't great. Code littered with hundreds of classes is plain ugly and makes it hard to read and work on. This[1] is a valid complaint about Tailwind. The < span > at the end has nearly 20+ classes.At some point, you should abstract some set of classes. In some cases, CSS selectors and other CSS feature will allow you to do what you want with far fewer lines of code.[1]: https://twitter.com/xirclebox/status/1673557143088242689	shubhamjain	9.822085	-8.723005	comment	6.0	38.0	1688704640	-15.577726
36650343	If you’re aiming for simplicity, how	If you’re aiming for simplicity, how did tailwind make it to the list? Why not use plain CSS?	ricardobeat	9.820755	-8.725695	comment	6.0	21.0	1688864304	-15.582045
36785865	Tailwind before tailwind.It's strang	Tailwind before tailwind.It's strange, I never saw the point of it, however I saw the value in tailwind almost straight away.I think that might be the difference in examples.  The tachyon examples always look uninspiring.	omegabravo	9.8195	-8.726317	comment	6.0	26.0	1689772935	-15.57602
36936126	If you're going to use Tailwind why 	If you're going to use Tailwind why not just use the style attribute and just give up on CSS classes?	PaulHoule	9.821247	-8.724167	comment	6.0	26.0	1690752144	-15.580456
37093776	HyperUI: Free Open Source Tailwind C	HyperUI: Free Open Source Tailwind CSS Components	DerekBickerton	9.824	-8.717778	story	6.0	115.0	1691786705	-15.579059
37146010	Cool hot-take but it’s not true. You	"Cool hot-take but it’s not true. You’re literally learning CSS when you learn tailwind. And no one (good) picks up a tool solely because it’s shiny, they pick it up because they find it has utility, which evidently LOTS of people do.And if you don’t think it’s reusable then you at least need to bring an argument for why that’s so because the docs, personal anecdote, and the opinion of LOTS of people is completely opposite.So:
- You ARE learning CSS, you’re just putting it where it belongs: on the element it affects
- It’s modernity doesn’t matter at all
- It’s literally as reusable as raw CSSI can’t downvote you, but you’re definitely wrong."	blitz_skull	9.826108	-8.71695	comment	6.0	35.0	1692188777	-15.581796
39140721	I love tailwind. I strongly feel tha	I love tailwind. I strongly feel that most modern CSS solutions are massively overthought. In engineering we have bigger problems to solve than a key/value list that makes a div blue.Tailwind removes the thinking around CSS, naming, preprocessors etc etc, it just lets me write good CSS and focus on components and other engineering problems.I seem to be one of the few people who can read CSS properties horizontally as well as vertically, so I'm all good on most peoples major complaint.	PUSH_AX	9.821562	-8.723832	comment	6.0	56.0	1706263013	-15.579916
27762633	Sincerely I don't understand what's 	Sincerely I don't understand what's the appeal of tailwind. It's just one more sign of dementia to add to the landscape.	hnedeotes	9.816785	-8.727019	comment	6.0	47.0	1625673805	-15.575446
28004932	This is a very nice step in making T	"This is a very nice step in making Tailwind more Bootstrap like (read beginner friendly). One common complaint about Tailwind is that it makes the HTML look very full (full of classes).A very good example on OP's website for a button:Using tailwind:  <a class=""inline-block px-4 py-3 text-sm font-semibold text-center text-white uppercase transition duration-200 ease-in-out bg-indigo-500 rounded-md cursor-pointer hover:bg-indigo-600"">Button</a>


Using daisy:  <a class=""btn btn-primary"">Button</a>


Although I personally think that the corners at a bit too rounded by default, giving it a very amateur look but I think you can customize that.But a very promising project indeed."	hashedout	9.822755	-8.721468	comment	6.0	48.0	1627625098	-15.580826
28344302	Ruby on Rails: View Components, Stor	Ruby on Rails: View Components, Storybook and Tailwind - a match made in heaven?	finniananderson	9.869575	-8.685186	story	6.0	113.0	1630212913	-15.550027
22424657	I think it's a little more subtle th	"I think it's a little more subtle than you're saying.When you use inline styles for everything, you're making the initial development a little faster by making future maintenance and changes a lot harder. (Like, if you decide headings should be italic instead of bold, that's a one-liner fix if you're using CSS properly, but if you're using inline styles you have to individually fix every heading on every page.) So most people have internalized ""don't use inline styles for everything"" as a general rule.But if you don't actually care about that sort of future maintenance (or you're charging hourly for it), then using inline styles for everything looks really attractive to you! But you can't literally use inline styles for everything because even non-experts know that using inline styles for "	csande17	9.825235	-8.7186365	comment	6.0	23.0	1582735571	-15.570192
22424756	Disclaimer: I haven't used Tailwind.	"Disclaimer: I haven't used Tailwind. Maybe I'm missing something.> For example, if I'm working on a card and I want some text below the main text to have a smaller, gray font size. What do I name that class? ""card-sub-text"", ""card-sub-title""? No - don't even worry about it - ""text-sm text-gray-700"" and move on.What's the difference with ""color: gray; font-weight: 700""? In this case I really don't have to care about the property order, whereas in your case I would guess you still have the cognitive overhead requiring you to know that ""gray"" comes before ""700"" (unless it's expected to be preprocessed away? what if I use text-700-gray?)."	arcatek	9.825412	-8.717278	comment	6.0	37.0	1582736002	6.560608
22429231	Tailwind is fantastic. Everyone goes	"Tailwind is fantastic. Everyone goes through the initial shock of complaining about the ""ugly markup"", the violation of separation of concerns, etc. But I've worked in enough large codebases to tell you that the ones that use Tailwind have a more consistent UI, with much less handwritten CSS. Bootstrap sites inevitably devolve into a soup of custom CSS and Bootstrap framework. You end up with lots of verbose class declarations like ""btn btn-link btn-primary btn-xs danger"", but you still need lots of little `margin-left: 3px` rules to push and pull things into place. Most other CSS libraries suffer the same fate.On the other side of things, sites without a framework generally opt for a convention like ""BEM"" (block-element-modifier). BEM seems to be the worst of both worlds, both abandoning "	luketheobscure	9.820892	-8.727398	comment	6.0	22.0	1582764469	-15.578581
23057363	Ask HN: Is it worth purchasing Tailw	Ask HN: Is it worth purchasing TailwindUI?	harshamv22	9.819792	-8.724991	story	6.0	21.0	1588488820	-15.576576
33789497	I'll be honest here, after working w	"I'll be honest here, after working with tailwind for 7 months I really hate this piece of tech and really regret picking this company.I thought it wouldn't be a big deal but after seeing unnecessary long walls of class names I'm really tired. Anything other than basic styling is an absolute pain with tailwind and I don't understand why /my company specifically/ can't just use typestyle/styled-components/css modules to separate walls of text from components. 
With time, I degraded to the point I where I use classnames library just to split longer class string into 3-4 smaller ones so I can split the component into multiple rows to make it look better"	deliriumchn	9.824736	-8.720184	comment	6.0	22.0	1669738849	-15.580617
33791019	A lot of people I respect really lik	A lot of people I respect really like Tailwind, but I just don’t get it. Seems like you end up with walls of classes because you don’t name your compositions, and thus your design system doesn’t actually live anywhere. If you have a standard box in your design system with a certain padding, spacing, font size, and so on, are you really going to write out all its constituent properties every time you use it? How do you manage that effectively?As an alternative, use a scss mixin (or even just a class) called standard-box and then use it everywhere. Do that for all the major parts of your design and you’ve created a language with which to build individual chunks of UI. Modifying the design system itself isn’t free but it’s a lot easier than mapping the change to every use of every tailwind cl	icambron	9.823221	-8.722401	comment	6.0	22.0	1669745388	-15.581527
26786313	Tailwind is the weirdest thing I've 	"Tailwind is the weirdest thing I've ever ran across. It's basically inline CSS.Personally, I write CSS this way:1. Select based on cascaded semantic HTML elements;
2. Don't repeat yourself;
3. No unnecessary classnames;
4. No style-descriptions in classnames.Only when you have troubles selecting an element based on its position in your DOM you should choose a classname. It should not be "".text-gray-500"" (like Tailwind does) but it should be ""p.author-role"".In my case the classname is semantically descriptive whereas Tailwind is not. In my case you just need to update the CSS and in the case of Tailwind you need to change your HTML and then probably also create a new CSS class.But still, ideally, you'd simply select it like this:The author name:    figure.author figcaption h5 { ... }

The a"	734129837261	9.824587	-8.720629	comment	6.0	32.0	1618269184	-15.582859
27174325	Two tips:- don't justify text, it do	Two tips:- don't justify text, it doesn't look good and it makes text harder to (https://designforhackers.com/blog/justify-text-html-css/)- 'On this page' section is too long. And once I scroll down I don't see it anymore so I can't use it for navigation. Look at https://getbootstrap.com/docs/5.0/getting-started/introducti... or https://tailwindcss.com/docs/installation to see how useful can it be.	rayrag	9.822406	-8.721904	comment	6.0	38.0	1621179111	-15.579255
38112536	Back in the day we made fun of this 	Back in the day we made fun of this nonsense, now we freakin glorify it with libraries like Tailwind & friends...	i0nutzb	9.818567	-8.723377	comment	6.0	52.0	1698927919	-15.573174
31159424	I have been using tailwind. One thin	I have been using tailwind. One thing I've noticed is that it can become unmaintainable compared to styled-components since you just have divs with classes (and it's hard to read 50 nested divs).Has anyone used something like Tailwind-Styled-Component [1] and found it worthwhile?https://www.npmjs.com/package/tailwind-styled-components	vsroy	9.826651	-8.719552	comment	6.0	28.0	1650914504	-15.579025
31696092	I completely disagree.To fix the css	"I completely disagree.To fix the css + jsx in one file, just write your styled components at the bottom of your component.If you ever seen a react component completely riddled with Tailwind, you'll realize how messy and uncoordinated it looks.Even I would consider switching between two files just to avoid that style of css.Furthermore the necessity to utilize horizontal scroll because adding 10+ more rules will inevitably break your prettier printWidth rule is, by far, the most annoying aspect of Tailwind.    absolute inset-0 bg-gradient-to-r from-cyan-400 to-sky-500 shadow-lg transform -skew-y-6 sm:skew-y-0 sm:-rotate-6 sm:rounded-3xl

    position: absolute;
    top: 0;
    left: 0;
    right: 0;
    bottom: 0;
    linear-gradient(45deg, #fff, #000);
    box-shadow: 1px 1px 1px 0 rgb(0 0"	fc373745	9.821377	-8.723728	comment	6.0	32.0	1654877393	-15.599949
25866949	Show HN: WickedBlocks – Tailwind Blo	Show HN: WickedBlocks – Tailwind Blocks ready to copy-paste	Mike_Andreuzza	9.825345	-8.708969	story	6.0	82.0	1611277623	-15.579327
34337917	"This should be called ""Don't use Tai"	"This should be called ""Don't use Tailwind in a React library for a design system"" as this really has nothing to do with Tailwind and is all about integration of Tailwind into a React design system.None of these ""negatives"" are ""negatives"" for using it as part of a standard HTML/CSS website outside of React. The comparison between readability of a bunch of divs and web components or react makes no sense, of course <SidebarItem /> is easier to read then <div class=""flex-1 bg-blue font-bold, text-md d:none""></div> but nobody writes React like that. Everyone will have a SidebarItem component that spits out that div."	dubcanada	9.8251705	-8.722012	comment	6.0	36.0	1673442239	-15.57851
25141296	What kind of projects do people use 	What kind of projects do people use Tailwind for? and what's the general role of the person using it? I haven't found a use for it myself as a predominantly front-end dev but I've met a few devs who like it a lot but found that they were generally less comfortable writing plain css without a framework. No shade towards Tailwind intended, just not a paradigm I've gotten on board with yet and trying to understand.	have_faith	9.822847	-8.722378	comment	6.0	27.0	1605727941	-15.577613
38628543	Tailwind gives you almost all of the	Tailwind gives you almost all of the upside of a design system with almost none of the downside. I will not be taking questions.	ethanbond	9.819117	-8.723771	comment	6.0	22.0	1702480498	-15.579198
32644158	PSA: the best way to enable Microfor	"PSA: the best way to enable Microformat-like stuff with almost no effort is to keep describing content with reasonable class names even if you never pay any special attention to the microformats.org standards.One unfortunate side effect of things like Tailwind CSS is that some folks with a single-minded focus on looks are now using only the Tailwind class names, but you can do both.  If before you'd have written something like class=""video-thumbnail"" and styled the content with a class selector in your CSS, but now you've adopted Tailwind and have excised all the descriptive class name from the content (rather than just rming your stylesheet and adding Tailwind classes to whatever class names are already there), then please put the descriptive class names back in!  And if you have colleagu"	cxr	9.82255	-8.723302	comment	6.0	45.0	1661810754	-15.584556
27515891	Tailwindo: Convert Your Bootstrap CS	Tailwindo: Convert Your Bootstrap CSS to Tailwind CSS	wilsonfiifi	9.821453	-8.724315	story	7.0	72.0	1623766813	-15.542053
21440078	Hi!I am the author of Tailwind Build	"Hi!I am the author of Tailwind Builder. I launched it today!It's the first genuinely advanced online editor for the Tailwind CSS framework.I based it on the same technology I used to start https://bootstrapshuffle.com and https://bulma.devFeatures:* 140 ready-to-use HTML components (drag & drop).* All Tailwind settings are available with convenient pickers.* Autocomplete for CSS classes.* Live edit & online preview.* You can export code to HTML and CSS (compiled version) and Pug and Tailwind config (sources).* Easy build (""npm run build"")Any feedback is welcome!"	kemyd	9.8229	-8.722186	comment	7.0	27.0	1572859787	-15.575515
30207404	Show HN: Mailwind – Use Tailwind CSS	Show HN: Mailwind – Use Tailwind CSS to design HTML emails	soheilpro	9.824251	-8.7182455	story	7.0	63.0	1643986185	-15.573102
33299090	But tailwind fans keep saying that y	But tailwind fans keep saying that you don't need to learn css. Even in the comments here, people have said they use tailwind so they don't have to learn css because they're not a designer.Also the biggest reason to use tailwind is apparently because naming css classes is hard...	ehutch79	9.819702	-8.727798	comment	7.0	35.0	1666452644	-15.582546
33788137	Tailwind is honestly great for begin	"Tailwind is honestly great for beginners since it ""simplifies"" CSS into short-hand classes. The people that know CSS don't want to learn new classnames when they can use CSS and that is a standard.I'm personally scared of forgetting CSS if I use Tailwind extensively. I also don't like the aesthetic of all the classnames being bunched together, but Tailwind does have value."	theturtletalks	9.82137	-8.724405	comment	7.0	42.0	1669732823	-15.582324
33787459	>  But that's kind of the point. Tai	>  But that's kind of the point. Tailwind is a layer on top of CSS, but it doesn't actually hide any complexity in the layer below. You still need to know CSS.This completely misses the point of Tailwind. The point is not to hide the complexity of CSS, but to provide access from the markup to enough of capabilities of CSS that you don't have to edit your stylesheets 95% of the time, when you alter the styling of a document.When Tailwind does fall short because it doesn't provide the exact CSS feature that is needed to solve the problem, it still provides a template for how to solve the problem: Using one-rule utility classes, that are named for what they do, not for how they are meant to be used.	adamlett	9.820828	-8.7252655	comment	7.0	38.0	1669729528	-15.581349
26735768	I still don’t get the tailwind hype.	"I still don’t get the tailwind hype. To me, I think the relevant parties are invested, myself included. CSS is weird and has had a lot of “answers” appended to it out of desperation, but I’ve been feeling really good about styled-components and/or SASS modules, probably slightly in favor of the former, using file based code splitting. I’ve seen the explanations countless times, but if you were to ask me to advocate for tailwind right now, I’d find it difficult to highlight the advantages. The answers don’t immediately jump out at me, the problem we’re solving doesn’t seem immediately apparent, so I have trouble advocating for or understanding the tech.
 “You can build stuff quickly!” - doesn’t this just sound like someone comfortable with raw CSS?
“You don’t need to context-switch!” - thes"	franklyt	9.824932	-8.719686	comment	7.0	25.0	1617863772	-15.579904
38286835	Here is the meat https://github.com/	"Here is the meat https://github.com/abi/screenshot-to-code/blob/main/backend/...""""""
You are an expert Tailwind developer
You take screenshots of a reference web page from the user, and then build single page apps 
using Tailwind, HTML and JS.
You might also be given a screenshot of a web page that you have already built, and asked to
update it to look more like the reference image.- Make sure the app looks exactly like the screenshot.
- Pay close attention to background color, text color, font size, font family, 
padding, margin, border, etc. Match the colors and sizes exactly.
- Use the exact text from the screenshot.
- Do not add comments in the code such as ""<!-- Add other navigation links as needed -->"" and ""<!-- ... other news items ... -->"" in place of writing the full code. WRITE TH"	tlarkworthy	9.825779	-8.70319	comment	7.0	30.0	1700121423	-15.578051
35482833	Hey guys!  I've spent the past three	"Hey guys!  I've spent the past three months rewriting the WeBase front-end based on TailwindCSS!The original front-end was built with Bootstrap, a tool I still very much appreciate, but as I really started to ""get"" Tailwind I started to see its power and wanted non-developers to get to experience it.The WeBase website editor only supports around 70% of Tailwind (the full surface area of Tailwind is pretty BIG!), but I am happy with how it has turned out.There are still some UX issues I need to improve but I wanted to start getting some feedback as soon as possible to I'm making if generally available today!I'm running a deal for HN users... 80% off of the Lifetime deal ($49 instead of $249).  Just use the coupon code: HN4LYFEThe pro version allows you to publish to websites to custom domai"	harrisreynolds	9.851636	-8.682137	comment	7.0	28.0	1680882126	-15.569828
28004930	I’m not saying this is ugly but the 	I’m not saying this is ugly but the visual execution of some of these components is poor. No good usage of padding in some examples, poor ratios between the typography and the containers, inconsistent use of different line widths and border radius, weird and incosistent design choices in spacing and proportions…I mean. This looks alright and it will certainly make any UI look pretty decent, but the execution is not superb like the actual TailwindUI library which is incredibly well thought from a visual design perspective. Those components are perhaps less shiny than these but they are incredibly functional and way more intentional.This is a good effort though and I hope to see it improving.	whoisjuan	9.823756	-8.7176695	comment	7.0	37.0	1627625081	-15.571117
29501726	Before you ask, as it happens in eve	"Before you ask, as it happens in every Tailwind post, what is the point of this when CSS ""promotes"" reuse and separation of concerns, have a look at @ 
5e92cb50239222b comment: https://news.ycombinator.com/item?id=29501650And let me repeat what every Tailwind fanboy (like me) states every time this project is on HN: don't knock it till you've tried it. Look at the animated example in the front page. You'll never be able to iterate that quickly with CSS."	1_player	9.813984	-8.734439	comment	7.0	47.0	1639077784	-15.580039
29501593	Since I learned to write semantic cl	Since I learned to write semantic class names, and to compose using scss or react components, Tailwind feels like it would be a big step back. I get that it would be kind of nice to prototype in, but is anybody here using it for complex apps or UIs?	awestroke	9.823004	-8.721851	comment	7.0	24.0	1639077174	-15.580306
