id	label	hovertext	author	x	y	type	relevance	size	year	umap1d
25141922	> It lets you move all of those exce	> It lets you move all of those excessive class attributes into your CSS, where it realistically belongsNo. Adam said multiple times that he basically added the feature to make onboarding people smoother.The right way to use Tailwind is to extract components, for example in Vue.That way you have the markup, behavior, and styling in self-contained in a single file, that can be used anywhere, without leaking any internal implementation details.	samuelstancl	9.821717	-8.723032	comment	4.0	17.0	1605730834	-15.583043
25143868	> But now you still have the issue o	"> But now you still have the issue of coming up with CSS class names.Not entirely true. I'd be totally fine with class names that identify what type of widget it is. <div class=""card"">, <div class=""modal""> <button class=""secondary-action"">, or <span class=""clipboard-copy""> are ""made up CSS class names"" that identify a type of widget and used without making no assumption about presentation concern. <button class=""btn btn-small""> and <div class=""w-12 rounded-small""> are not.And yes, I understand that tailwind allows you to create types and @apply them. What I am saying is that (1) I'd like to see this separation to be enforced and not just possible and (2) plain SASS also lets you do that already. so I don't understand what I would gain from adding tailwind.> Components are a better way for "	rglullis	9.822233	-8.72292	comment	4.0	29.0	1605740869	-15.579176
25286947	This just makes my eyes bleed. CSS-i	This just makes my eyes bleed. CSS-in-JS was bad enough but now you want to mix-in SASS and Tailwind? Is there a prize or something for the number of technologies which can be squeezed into a line of JS? Please stop it.	cutler	9.831267	-8.710299	comment	4.0	37.0	1606985333	-15.580552
25333479	Can anyone recommend any text-heavy 	"Can anyone recommend any text-heavy tailwind themes? Or - are themes even viable with Tailwind?I'm a backend Dev who plans to buy Tailwind Build (or w/e it's called). I enjoy the idea of not having to worry (as much) about design, and instead just focus on content layout, etc. Tailwind is neat that way.With that said though i'm not a fan of the .. ""modern"" design. I'll use it, i guess, but on text heavy pages ala Wikipedia or HackerNews, Tailwind looks like it would waste a lot of space. Though maybe i'm off base.The point of this is to ask if theming has gotchas. Eg maybe themes work, but they're rarely ever supported well enough, leaving you with little gaps in design that cause problems. Thoughts?"	adkadskhj	9.818781	-8.719015	comment	4.0	13.0	1607357419	-15.579232
25332680	The text flows outside of the box in	The text flows outside of the box in the very first example of why Tailwind is great. Viewed on mobile. Not convinced.	xyproto	9.819261	-8.726588	comment	4.0	14.0	1607353083	11.068435
38716344	I bought tailwind UI more than a yea	I bought tailwind UI more than a year ago. The lifetime/unlimited product or whatever it was.It’s generally fine but feels incomplete. Many of the components don’t have any alpine or JS code documented even though the team has clearly built those aspects  when building the previews and demos.I’m not sure what the rationale was there but I hope they’ve fixed it here.	atonse	9.820879	-8.723811	comment	4.0	21.0	1703125750	-15.577804
38716347	Also look at Flowbite as an alternat	Also look at Flowbite as an alternative tailwind component library	memset	9.8225355	-8.720166	comment	4.0	13.0	1703125781	-15.574371
38716504	Why does Tailwind not build framewor	Why does Tailwind not build framework agnostic UI components?The best thing about Tailwind is everyone can use it.Wish we could go back to the days of building for the web and not building for React.	impulser_	9.825621	-8.723568	comment	4.0	20.0	1703127320	-15.576656
39037931	The love for tailwind might be expla	The love for tailwind might be explained as mass psychosis.It's like the coding version of https://en.wikipedia.org/wiki/Dancing_mania	niceice	9.815842	-8.725017	comment	4.0	20.0	1705552864	-15.573761
39038843	> The plugin will respect your tailw	> The plugin will respect your tailwind.config.js file and work with any Tailwind plugins you’ve installed, but _there is no way to change the sort order_.Really like that they don't give options to change the settings. Just one less thing to bike shed within teams. Really doesn't matter what is picked, just as long as it is consistent (and not obviously stupid).	EspadaV9	9.839925	-8.667339	comment	4.0	42.0	1705561223	-15.577736
32788669	This is the reason I love tailwind. 	This is the reason I love tailwind. There's no bloat, no headache of naming conflicts (in fact they completely did away with naming), no orphan css. CSS for a full blown website can be less than 5kb. It takes away the pain of thinking about CSS architecture, naming things, conflicts etc and you can just focus on styling.	dpacmittal	9.82202	-8.72097	comment	4.0	39.0	1662795320	-15.580684
38242084	I don't use Tailwind anymore at the 	"I don't use Tailwind anymore at the moment, but in my experience, it does not lead to shipping massive CSS/JS resources.
In fact I don't know about any client-side JS at all that is emitted by Tailwind (my last experience was 2.x, not sure if anything has changed).Regarding the CSS size, my experience was the opposite, Tailwind output was usually a lot smaller than hand-written CSS.I have nothing against plain CSS either though; but it's at least as easy to make a mess."	moritzwarhier	9.823685	-8.720653	comment	4.0	16.0	1699809253	-15.580556
38483007	if you already use a high level comp	if you already use a high level component model, why does it matter that it's implemented in Tailwind? What is the benefit of Tailwind anyway? You should think in terms of props and variants, not some alias indirection to css properties.	nsonha	9.822125	-8.723811	comment	4.0	15.0	1701403578	-15.584738
39262578	I'd love to use Fresh but a framewor	I'd love to use Fresh but a framework for web development which calls itself v1.x and yet only supports Tailwind for styling purposes feels very immature.The fact that for the next iteration they are prioritizing view transitions and not CSS bundling is baffling.	agos	9.822717	-8.722563	comment	4.0	17.0	1707148909	-15.57998
32822743	> I still get a reasonable consisten	> I still get a reasonable consistent set of values to chooseHow do you deal with one of those values needing to change? With SASS or css-in-js you can define a variable and then update it everywhere at once by changing a single line. This seems to be the biggest thing you give up with Tailwind.	nicoburns	9.82346	-8.717462	comment	4.0	13.0	1663067088	-15.580483
32011560	https://tailwindui.com/ - lots of pr	https://tailwindui.com/ - lots of pre-made templates using tailwind css. Some are free, but the more advanced ones require payment.	he_is_legend	9.820487	-8.724743	comment	4.0	12.0	1657184683	-15.577758
39417058	Tailwind is write only, you’re not s	Tailwind is write only, you’re not supposed to read it or maintain in. Want to change some property? Delete the entire class=“” attribute and start anew. Take that primary button example from the article - no one is claiming that it’s readable, especially when there are hundreds of primary buttons throughout the app, each with a slight variation.This works great for marketing or landing pages, or other use cases where it’s not you who maintains it after deployment; the next sucker will want to rewrite it all anyway.	orangepanda	9.820654	-8.724577	comment	4.0	20.0	1708242412	-15.578912
39417103	Like many I was initially skeptical 	Like many I was initially skeptical of Tailwind because I thought it made the code look “ugly”. But then I started using and almost immediately noticed the productivity boost. Two things that I noticed while using it was 1) I never knew how much I disliked naming things before I didn’t need to do that anymore and 2) how big of a mental burden it was to keep the mapping between the id/classes and the CSS, not mentioning the whole cascading part where you could never actually be sure just from glancing at the code what will be the resulting css. That second point is probably the most understated feature of Tailwind - you never have to wonder about the styling of an element again, because everything is right there in the classnames. The added benefit is that it basically forces you to write y	M4v3R	9.821369	-8.72426	comment	4.0	20.0	1708242977	-15.58284
39417133	I have no idea how tailwind has gott	"I have no idea how tailwind has gotten so popular.Tailwind is a way to justify writing inline css in our HTML. This was once considered the cardinal sin of a frontend developer. You avoided inline-css at all costs.But now Tailwind just makes a class for text-color-blue which simply abstracts the `text-color: blue;` css property away into its own class. But don't fool yourself, you are just writing inline css by a different name.There is no way to explain how it is more maintainable to write `class=""rounded button hover:bg-color-black-700 bg-color-black-400 active:bg-color-black-500 focus:bg-color-black-500 rounded-sm text-sm text-color-gray-300""` instead of just `class=""btn btn-primary""` using the ""old-school"" semantic approach. I can list numerous advantages of the semantic approach here."	jacurtis	9.822506	-8.722545	comment	4.0	27.0	1708243431	-15.581237
39551118	Kind of unrelated but if you want to	Kind of unrelated but if you want to build nice modern layouts and if you are one the 10 people in the planet that doesn't use Tailwind take a look at sub grids. It's really underrated given how well supported and nice to work with it is.https://developer.mozilla.org/en-US/docs/Web/CSS/CSS_grid_la...	msoad	9.825601	-8.7152815	comment	4.0	14.0	1709222458	-15.578721
39618550	Is there any good tutorial/ guide av	Is there any good tutorial/ guide available with best practices for tailwind?	tomschwiha	9.815882	-8.726507	comment	4.0	19.0	1709747036	-15.581521
32075037	The primitives on which this is buil	"The primitives on which this is built are cool. Fastify and Vite are two projects I love. The moment I see TailwindCSS added as an opinionated default, I nope right out. Tailwind is one hype-train I can't wait to see run out of steam. I've been around enough years to see a lot of things that we thought were GREAT ideas, turn into ""what were we thinking?"" I believe we'll be doing the same with Tailwind in 3 years. ""Why oh why did we think annotating all of our HTML elements with a bunch of class names - some which represent rule-value pairs, was a _good_ idea???"" This viewpoint makes me very unpopular obviously. But it's a hill I've chosen to die on. It's bad DX and it's worse for maintenance. I welcome a lot of downvotes... but let's revisit this in 3 years and have a candid conversation a"	nobleach	9.823912	-8.72124	comment	4.0	16.0	1657656830	-15.579464
35689991	That's the nature of how these thing	That's the nature of how these things go. People that like Tailwind praise it. People that think it's fundamentally bad design avoid it and don't say too much, or are drowned out by the people praising it.People who just write SCSS don't even think about it.	nawgz	9.820551	-8.724704	comment	4.0	19.0	1682354686	-15.57185
35893360	Tailwind is a CSS framework, and som	Tailwind is a CSS framework, and some soon-to-be cancelled product from Google that shares (stole) its name isn't going to change that in my mind. Honestly, that name collision seems in poor taste. They couldn't come up with a name that's not already used by a popular open source project?	TechBro8615	9.821362	-8.723778	comment	4.0	13.0	1683752025	-15.587153
35914856	I have mixed opinions seeing Tailwin	I have mixed opinions seeing Tailwind on that list.If you're not a designer, it takes a non-trivial amount of time to add the utility classes you need to get something that looks passable. Quite simply, it gives you too much control over something that just doesn't matter for an MVP.There are great component libraries out there (I'm a fan of Chakra) that give you sane defaults so that you can get something off the ground, while not focusing on something that doesn't matter at the MVP stage.Maybe Tailwind + Radix makes more sense after you raise funding...?	solatic	9.821565	-8.722276	comment	4.0	25.0	1683892374	-15.576785
20655071	Cool! I've been wanting to try a fra	Cool! I've been wanting to try a framework like Tailwind, but I get the feeling I'd like something like Atomic CSS [1] better. It generates classes based on what you use, as opposed to Tailwind, which supplies thousands of classes that you may need and leaves it up to you to strip out the ones you don't use (I think?). I dunno, it just seems like Tailwind has it backwards to me, but am I misunderstanding something? Does anyone have experience with both (or some other micro class framework) who can tell me how they compare?[1] https://acss.io/	dlbucci	9.822993	-8.722456	comment	4.0	13.0	1565363442	-15.591003
31157761	Pretty cool!How does it compare to T	Pretty cool!How does it compare to TailwindUI?	kiru_io	9.820296	-8.724449	comment	4.0	16.0	1650906471	-15.577083
31214161	Beginner-friendly guide to use Tailw	Beginner-friendly guide to use Tailwind CSS with Jekyll	mzrnsh	9.820696	-8.7263365	story	4.0	56.0	1651304803	-15.580358
31693795	> If you're not using Tailwind (or s	> If you're not using Tailwind (or something like it) then you're going to end up creating classes using the raw CSS, and then naming them yourself, and then having to remember what you called them.This is true. But if we better taught the cascade and promoted the idea of global styles rather than pretending it's a problem then more people would be better at this and the problems would gently recede.We (the high-end front-end dev community) have fallen into the habit of using class names where we really wanted IDs and using components when we really wanted global styles. I feel we have been pushed in this direction by developers who didn't understand the technology properly. The Tailwind author clearly understands it, so I'm not targeting them... but they are supporting the people who don'	the_other	9.824143	-8.721879	comment	4.0	22.0	1654867367	-15.58216
31694498	I've used Tailwind on many projects 	I've used Tailwind on many projects at work for about a year now. I do not like it.Tailwind seemingly affords an easy way of writing inline styles, but it 1) clutters the HTML, 2) leads to repetition and makes people break the DRY principle (yes, you should extract to components, but people don't always do that), 3) uses names that can be similar but are not identical to CSS properties and feels like a bad abstraction.If you use something like Svelte, where you can write local CSS within a component I fail the see the benefit of Tailwind. For me Tailwind is the most ill-conceived frontend tech I've had to use in later years.	erokar	9.822525	-8.723596	comment	4.0	15.0	1654870347	-15.577832
31765115	Show HN: Tailwind DX – A DevTools Ex	Show HN: Tailwind DX – A DevTools Extension for Tailwind CSS Developers	gimliapp	9.82264	-8.720185	story	4.0	24.0	1655381609	12.641355
29112379	personally I find tailwind to be atr	personally I find tailwind to be atrocious looking and can't understand anyone preferring it to styled-components	lancemurdock	9.820947	-8.724455	comment	4.0	20.0	1636058956	-15.5794735
29112262	Also a Tachyons fan. I looked at Tai	Also a Tachyons fan. I looked at TailwindCSS, but stopped at the installation section. The recommended path to get it working with Create-React-App is to install a bunch of JS packages (PostCSS, autoprefixer) and to layer on another tool over CRA (craco)? No thanks, I'd rather just <link> tachyons.min.css and move on.	bryik	9.852645	-8.697396	comment	4.0	16.0	1636058175	-15.57617
29113218	For me it looks like all terrible co	"For me it looks like all terrible concepts in one place.
Please learn CSS, you'll see how fluid and easy it can be, and how many problems Tailwind introduces.I recommend going with Pollen if you really need some kind of framework for CSS. I believe that's the way to really help with CSS development without the burden of learning yet another layer of abstraction over simple CSS."	jarek83	9.824075	-8.720712	comment	4.0	19.0	1636064701	-15.587472
29501695	Looks fantastic. My only concern usi	Looks fantastic. My only concern using this in a full React project is its lack of interoperability with standard libraries. It seems like for the best experience, you either buy Tailwind UI to use with a tailwind project for anything except the most basic UIs, reimplement the Tailwind UI components yourself, or have a weird mix of css-in-js and Tailwind CSS. Although I love the idea of HTML-native inputs all the way through, I tend to immediately run into issues where using a native interface instead of a JS-based implementation harms the user experience.Props to the team though - I feel like this is something I'll try out for a marketing site.	gunshowmo	9.85825	-8.697061	comment	4.0	19.0	1639077629	-15.571225
29502159	Tailwind always looks like a cool ev	Tailwind always looks like a cool evolution of Tachyons [0] to me (with a build step). On the other hand, tachyons is really simple, you just drop it into your project with no build required (or drop the sass in), and I've never really felt like it was missing any features I wanted.Has anyone used both seriously who can compare?[0]: https://tachyons.io/	rgbrgb	9.824413	-8.722723	comment	4.0	17.0	1639079967	-15.579182
29502806	Seems like you are basing your opini	"Seems like you are basing your opinions on some misconceptions. Let me try to clear that for you.""CSS modules still seem to solve every problem Tailwind solves, and better.""- Not necessarily true. Unlike css modules, tailwind removes the whole ""think about a name for your class"" mindset, reducing friction from the development process. It also unifies some base level design decisions like spacing and colors, which developers would have to rely on ""best practices"" otherwise, which don't necessarily get strictly enforced.""I'm not sure how Tailwind works, but any CSS that's built at runtime and JS and inserted into the DOM dynamically should be avoided, and is an example of favoring developer experience over end user experience.""- You are right, looks like you are not sure how Tailwind works. "	ksubedi	9.823946	-8.722155	comment	4.0	19.0	1639083332	-15.581993
29503469	>This works okay in extremely compon	">This works okay in extremely componentized web apps. It's a nightmare if your UI isn't highly componentized. I've seen projects where you make a button by copy pasting this ~80 character string of tailwind classes all over the place, and then changing the color names if you need to. Good luck fixing that when the designer decides that we don't want any buttons to have rounded corners anymore.That app is done wrong. If you are using the same styles to represent a button you should use postcss and do.myButtonClass {
  @extend: (80 tailwind classes here)
}"	JasonCannon	9.832215	-8.7098055	comment	4.0	23.0	1639086873	-15.580374
29502165	The thing that made Bootstrap click 	The thing that made Bootstrap click for me years ago as a backend developer were these complete example layouts:https://getbootstrap.com/docs/5.1/examples/Is there anything similar for Tailwind CSS?	keewee7	9.821114	-8.724194	comment	4.0	17.0	1639079997	-15.576295
29504449	> I used the JIT version recently on	"> I used the JIT version recently on a new landing pageYeah, that's kinda the poster child use case for Tailwind and similar frameworks. Landing pages are all about being jazzy and unique and eye catching, and not so much about code reusability/composability.Where it gets less fun is when you want widget consistency across multiple areas of a site and across design tweaks over time, since now you have to deal with several `class=""...""` strings across multiple files, possibly with class names in arbitrary order, possibly mixed with logic from other templating languages (be it from Django or JSX or whatever). So you can't just grep to achieve the objective of changing styles in one place to affect all instances of some semantic group.Personally I think comparing Tailwind directly against tra"	lhorie	9.821383	-8.724244	comment	4.0	24.0	1639091882	-15.582798
29504646	Every time Tailwind does something g	Every time Tailwind does something great and gets posted here, the conversation devolves into the same arguments: “I don’t get it. It’s just inline styles.”What is it about CSS that gets people so offended and opinionated? If it were a new JS framework, few people would be saying “I just don’t get XYZ. Use React”. Is it because Tailwind is so drastically different and breaks people’s core ideas about separation of concerns? Maybe it’s because we all learned CSS very early and were told to do it XYZ and now challenging that is painful.If you honestly want to “get” Tailwind, go use it in a project. If you don’t like it, don’t use it. Nobody is going to change your mind in a comment and you’ll never convince anyone to stop using it.Idk. CSS is what I least care about. It’s a thing. I use it t	commanderkeen08	9.820746	-8.725094	comment	4.0	19.0	1639093047	-15.579534
29533324	I don't see a stark difference betwe	I don't see a stark difference between inline attributes and, say, tailwind CSS.	nine_k	9.838248	-8.698036	comment	4.0	12.0	1639341187	-15.574312
29626688	Question: Are people using tailwind 	Question: Are people using tailwind for layout? Even when CSS grid is available? If so what is the benefit of tailwind layouts over modern CSS, beyond what tailwinds usually brings?	runarberg	9.821337	-8.724603	comment	4.0	15.0	1640017838	-15.578427
34194759	Show HN: I Built Sailboat UI – Moder	Show HN: I Built Sailboat UI – Modern UI Framework for Tailwind CSS	lvwzhen	9.823104	-8.720058	story	4.0	20.0	1672476518	-15.579667
34337150	I believe the solution here is most 	I believe the solution here is most definitely @apply. I know the Tailwind team seem to be against @apply (and even flirted with removing it), but having used it extensively to build complex (imo) sites and apps, @apply has been unavoidable and actually great to have.The fact is @apply is there and if we're using it and there's enough push-back, I don't see why the Tailwind team wouldn't listen to that or create a workable upgrade path for those who wish to continue to use it.So use the tools you have - don't avoid it just because the core team dislike it. They can't remove it in the version you have installed today (unless they have some magical way to reach into your computer/server)	simonhamp	9.821707	-8.721811	comment	4.0	20.0	1673434832	11.200818
34336919	No, I haven't. As I said I've worked	No, I haven't. As I said I've worked in several companies that explicitly have this sort of abstraction. If so, what's the point of using Tailwind? Tailwind fans will say it's atomic classes, but when using them with many devs, it indeed turns into reinventing CSS classes.So, perhaps it's the other way around, that Tailwind is simply not a good tool at scale.	satvikpendem	9.821893	-8.723266	comment	4.0	16.0	1673432197	-15.582429
34763543	Comparing Bootstrap to Tailwind is c	"Comparing Bootstrap to Tailwind is comparing apples to oranges. They are both css ""frameworks"", but bootstrap is also a completely pre-made optioned design system. You don't really get that with Tailwind.The point of bootstrap is to get something that's 90% of what you want FAST. And it can easily be customised to build a design system for yourself. With tailwind you have more foundational design work to do up front.Personally I like the direction Bootstrap going, introducing utility classes, however there is more to do. My main wish is that they embrace web components for the JS side so that they are js framework agnostic.As with all these tools you should evaluate what's best for you and your team."	samwillis	9.828118	-8.715785	comment	4.0	17.0	1676215868	-15.580644
34764704	When I saw the Tailwind example, the	"When I saw the Tailwind example, the first thing that came to mind was... ""Wasn't CSS supposed to decouple presentation from content""? Because this sure looks like going back to <font> tags and style="""" attributes everywhere."	jmmv	9.824186	-8.719182	comment	4.0	14.0	1676222760	-15.577756
34858073	Refreshing to see someone else who h	Refreshing to see someone else who hates Tailwind. It's a nightmare.	beezlewax	9.811501	-8.73175	comment	4.0	17.0	1676818605	-15.557351
34923048	Lots of examples of it online of peo	Lots of examples of it online of people using Tailwind because they don't know CSS well enough, it's not even debatable when they themselves  literally claim that's why they use it.Even in this thread there are people doing so: https://news.ycombinator.com/item?id=34921960I understand perfectly well why people like Tailwind. The problem is not initial productivity; indeed, I can write bash scripts too very quickly that make me feel infinitely productive. It's what comes afterwards, the maintenance, the teasing of code written, that Tailwind makes so difficult.And sure, use what you want, but I won't use it.	satvikpendem	9.82199	-8.723396	comment	4.0	25.0	1677234294	-15.579581
37614631	Ask HN: Why everybody speaks only ab	Ask HN: Why everybody speaks only about Tailwind, what happened to Bootstrap?	rrmdp	9.823836	-8.723256	story	5.0	4.0	1695402528	-15.582219
37715703	Show HN: Vanilla CSS Tailwind altern	Show HN: Vanilla CSS Tailwind alternative in 18 lines	geenat	9.823367	-8.71793	story	5.0	26.0	1696083707	-15.574681
