id	label	hovertext	author	x	y	type	relevance	size	year	umap1d
12279560	They're not fake by that metric eith	They're not fake by that metric either though.  No one can tell the difference between a synthetic and a high quality natural diamond - certainly not with the naked eye.  So you're free to pretend your diamond came out of the dirt if you so desire.	tempestn	5.606575	3.720313	comment	4.0	11.5	1471046295	-15.075718
12279296	I -love- that the Canadian company s	I -love- that the Canadian company started marketing 'conflict free diamonds' as a way to break the deBeers cartel.It makes me wonder if the synthetic guys have a leg to stand on regarding the ecological footprint of pit mining versus lab grown, or if it's abo	hinkley	5.611461	3.724989	comment	4.0	13.0	1471041677	-15.0720415
35214978	I love how the first reply to this t	I love how the first reply to this tweet thread is Grady Booch, co-inventor of UML and pretty influential Software Eng. person in the early 2000s.Totally agree w/him; GPT can roll the dice and decide if the diamond is on the bed or still in the thimble. It doe	bfung	5.612405	3.7085736	comment	4.0	14.5	1679188700	-15.054005
28320758	> They have the mean tendecy to expl	> They have the mean tendecy to explode into super sharp pieces when you're not expecting it, so wear goggles.Well, I guess I need to buy a new wedding ring at some point.	dvaun	5.6248674	3.709729	comment	4.0	21.0	1630011905	-15.088023
15817261	I think that jewelry should have a p	I think that jewelry should have a property of showing off, so hidden private key wouldn't work that well. You need to have some mechanism how to show status. And that nicety factor was driven mostly by women decorum.	PetoU	5.634104	3.723139	comment	4.0	10.5	1512061104	-15.064953
17950082	But even the price of a diamond has 	But even the price of a diamond has a limited range. Art on the other side has no upper limit. A little canvas with something conceptual drawn on it can easily reach tens of millions of dollar.I always thought that part of the pleasure people get by shopping i	cm2187	5.6247773	3.717575	comment	4.0	15.5	1536565174	-15.078076
18485044	I think the Kelly criterion doesn't 	I think the Kelly criterion doesn't apply as widely as people think it does. Its derivation is based on on maximising the growth rate of your fortune. But this is equivalent to assuming that money has logarithmic utility for you. If you don't value money in a 	OscarCunningham	5.4094253	4.321421	comment	4.0	13.5	1542618660	-14.824171
30230596	That's how diamonds and gold work. Y	That's how diamonds and gold work. You wouldn't accept blood diamonds for example, it would reflect poorly on you.	vntok	5.610197	3.7180538	comment	4.0	11.0	1644137487	-15.072978
30270055	I'm not sure I understand how Kelly 	I'm not sure I understand how Kelly applies to insurance, as by definition the Kelly of any -EV bet is 0. Can you elaborate on how to do a Kelly calculation with a wager of negative expected value? Or what am I missing?	ssanders82	5.406934	4.3213825	comment	4.0	10.5	1644392831	-14.817615
16217600	I always wonder about this when I se	I always wonder about this when I see films where criminals mastermind a plan to steal diamonds.	emodendroket	5.6310577	3.7144945	comment	4.0	10.5	1516740984	-3.0188472
16331608	And if you keep crushing it then it 	And if you keep crushing it then it will become as hard as a diamond.	noworld	5.6121	3.717807	comment	4.0	15.0	1518091491	-15.062462
16551212	> De Beers is fighting Chinese lab-g	> De Beers is fighting Chinese lab-grown diamondsAnd I hope they lose.https://priceonomics.com/post/45768546804/diamonds-are-bulls...  (and HN comments on original posting 2013-03-19 -- https://news.ycombinator.com/item?id=5403988  )	Jedd	5.603076	3.7219183	comment	4.0	27.5	1520598008	-15.072141
16551236	From the article:>The arrival of lab	From the article:>The arrival of lab-grown diamonds has challenged the widely-held assumption that diamond prices could only go upI'll admit I don't know a lot about the diamond market and perhaps I'm misinformed, but how on earth was this a widely held assump	moccachino	5.6048517	3.7212954	comment	4.0	12.0	1520598278	-15.074332
16551254	>> From what I understand, these gem	>> From what I understand, these gems are actually better than natural ones...Yes, for decades they claimed clarity and purity to be indicators of the highest quality. Now that humans can manufacture them with better specs than nature, they're shifting to clai	phkahler	5.612455	3.717735	comment	4.0	13.5	1520598589	-15.072814
16551296	Saying lab grown gems are fake is li	"Saying lab grown gems are fake is like saying ""Is that Orchid you bought me a fake from greenhouse or a real one that someone picked from a jungle?""It's funny what massive marketing campaign can do."	sharpneli	5.606434	3.7198145	comment	4.0	12.0	1520599129	-15.072831
16552579	Good! ... The DeBeers cartel is mono	Good! ... The DeBeers cartel is monopolistic and exploitative.  There's an interesting article that talks about how they initially created demand for diamonds as they weren't commonly associated with an engagement.  I'm glad to hear there's a competitor that s	smoyer	5.6072974	3.7225056	comment	4.0	11.0	1520610999	-15.067771
16551411	>Indeed, even the most experienced d	>Indeed, even the most experienced diamantaire’s in the world can’t tell the fakes from those extracted from mines when using their naked eye, which is where technology comes inif they look identical to the naked eye, how can jewelers and debeers justify buyin	gruez	5.6041603	3.7204168	comment	4.0	14.0	1520600540	-15.077495
17183918	tldr: De Beers is going to sell synt	"tldr: De Beers is going to sell synthetic diamonds, after having vowed they wouldn't. (The already did but limited the synthetic ones to industrial applications.) Price will be ~1/10th that of naturals.My reaction: ""Oh, come on, this is the most insidious mono"	SilasX	5.6050544	3.721584	comment	4.0	14.5	1527640261	-15.064243
17186610	If you think that solely the physica	If you think that solely the physical properties of the stone are what matters then you dont understand the point of an engagement ring.	mehwoot	5.6314325	3.707623	comment	4.0	11.0	1527677878	-15.0788765
17186675	Must be cultural differences then - 	Must be cultural differences then - nobody around here (Central Europe) cares or asks about rings.	tzaman	5.6537757	3.6874359	comment	4.0	12.0	1527678547	-15.074988
17186869	Yes, this post missing the point tha	Yes, this post missing the point that I as a diamond buyer already know this but it will not stop me from purchasing more diamonds.In a hypothetical world, if a diamond could be bought for $10K and sold for $10K, where is the risk? Then it's no longer for only	xstartup	5.611947	3.720806	comment	4.0	12.5	1527680580	-15.077774
17228813	I think it is reasonable to mention 	I think it is reasonable to mention here that diamonds suck [0].[0] http://diamondssuck.com/viahttps://news.ycombinator.com/item?id=12944464	fghtr	5.6057835	3.7195063	comment	4.0	18.0	1528126527	-15.072916
25978451	Big diamond rings still seems to be 	Big diamond rings still seems to be mainly an US thing still: https://www.engagementringbible.com/the-most-popular-engagem...I live in Europe and in my experience a stone in a wedding ring is very uncommon.	Gys	5.6285896	3.707572	comment	4.0	12.5	1612097783	-15.080883
25979022	There's an idea in yogic philosophy 	There's an idea in yogic philosophy that you can't truly know a thing until you experience it. The classic example is a mango - you can read about them, you can study their chemistry, you can ask questions of mango eaters, but until you taste a mango you can't	xyzelement	5.620275	3.7133691	comment	4.0	14.0	1612103164	-15.080231
37397745	I have read that the distinguishing 	I have read that the distinguishing feature is that natural diamonds have flaws. Entrapped dirt or what have you that is not found in the sterile environment of the synthetic ones.	0cf8612b2e1e	5.605559	3.72172	comment	4.0	11.0	1693947951	-15.074733
37452278	Diamonds are made of just carbon.	Diamonds are made of just carbon.	Horffupolde	5.6148114	3.7160535	comment	4.0	11.0	1694312070	6.1084523
37509362	MarketingThe sentimental value of a 	MarketingThe sentimental value of a diamond is its rarity.  And natural diamonds with few imperfections are rare.  And a big diamond, useless for anything else, is the only way to show how much the marriage is worth.  This is what is being sold to us.Synthetic	Vvector	5.6122265	3.7183332	comment	4.0	12.5	1694700791	-15.076535
37509434	Is there evidence that jewelry was a	Is there evidence that jewelry was a good store of value in previous generations though?We hear about families selling their jewelry to escape the country or when they're short on funds, but did they actually get a good price for it?	crazygringo	5.624649	3.7170684	comment	4.0	11.0	1694701111	-15.0600605
25158724	It might for diamonds, but many wome	"It might for diamonds, but many women will still want something expensive ""just so that the man will prove that she matters to him by buying her something"", which is sad.Women will either move to more expensive diamonds or request something else. Business oppo"	OneGuy123	5.61275	3.7166772	comment	4.0	14.0	1605863720	-15.08085
38684566	> they (politicians) limit the numbe	> they (politicians) limit the number of new builds,This theory doesn't work very well, because there are lots of places where new construction is entirely uncapped (politicians are desperate for the new property tax growth), and prices still don't fall there.	maxsilver	5.615513	3.7226794	comment	4.0	10.5	1702916391	-15.074828
39058126	Myanmar has the most bountiful gem m	Myanmar has the most bountiful gem mines in the world. I visited in 2019 and there were many shops with piles of ruby, jade, sapphire, even amber. They're already pretty specialized in mining and have little qualms about razing mining areas so would be able to	drak0n1c	5.6187835	3.7199512	comment	4.0	11.5	1705685029	-15.073393
32562433	Whenever that comment comes up I fee	Whenever that comment comes up I feel the urge to just post the wiki entry for the Kelly criterion. If you don't have as many resources as your competitors in the market, reduce your bet size!!! Yes, that may mean you cannot challenge Mark Zuckerberg for yacht	WJW	5.406171	4.3218617	comment	4.0	15.0	1661247521	-14.792634
38246174	The origin of diamond engagement rin	"The origin of diamond engagement rings was insurance: with the decline of ""breach of promise"" suits, the fiancée at least had something to sell as a settlement if the fiancé reneged on the promise of marriage.All of that nonsense is long gone; the fetish for e"	gumby	5.6287	3.7043195	comment	4.0	14.5	1699842173	-15.078188
38246581	Not everyone wants to spend $20,000 	Not everyone wants to spend $20,000 on a rock so that their spouse isn’t “embarrassed in front of her friends.”	cactusplant7374	5.6432276	3.6973321	comment	4.0	12.5	1699846503	-4.260522
38246794	If she wants a diamond despite knowi	If she wants a diamond despite knowing all the misery the diamond industry spreads, then you should probably just break up	amrocha	5.61537	3.7156885	comment	4.0	18.0	1699848684	-15.08103
38247088	oh yes preference for a diamond ring	oh yes preference for a diamond ring is definitely a dealbreaker	paulddraper	5.61823	3.7150502	comment	4.0	16.5	1699851364	-15.050093
38247440	I guess that works for most men. Per	I guess that works for most men. Personally, one of my criteria is that she can't want a diamond, that might sound crazy but I want a partner in life that is financially sensible and fiscally responsible, we have to leave our children with more than we were le	friend_and_foe	5.6121817	3.7152083	comment	4.0	38.0	1699855095	-15.082209
38247457	Splurging every once in a while does	Splurging every once in a while does not inherently make someone “fiscally irresponsible.” For many people, especially on this forum, $3k-$5k for a ring is literally a few days work or less worth of pay.(Please no one get pedantic on ring cost to me, absolutel	seattle_spring	5.635217	3.702189	comment	4.0	26.5	1699855288	-5.462321
38247779	That first link makes me want to buy	That first link makes me want to buy some 1 carat CVDs to play around with.I mean at those prices, making my own diamond chandelier isn't too out of the question.	Maxion	5.6092324	3.7190442	comment	4.0	13.5	1699859640	-15.074103
38248519	The diamond tradition became a ridic	"The diamond tradition became a ridiculous cultural trait, buy lab-grown diamonds can help greatly mitigate the wastefulness of regular natural diamonds. I don't think Moissanite is the right replacement - they have too much of the so-called ""fire"", almost too "	glimshe	5.607583	3.7195568	comment	4.0	17.0	1699868024	-15.074792
38248632	I have an even cheaper solution: jus	I have an even cheaper solution: just don't buy a ring.It all depends on what your partner wants obviously. If it's important for your partner to get a diamond ring and you value your partnership more than the cost of a diamond, then buy a diamond. If your par	Thomashuet	5.6226764	3.7111707	comment	4.0	15.0	1699869337	-15.078175
38248687	This of course is true and makes sen	This of course is true and makes sense, but you could also say the same thing about eating dinner in a restaurant: you could save money by skipping a meal, or by getting a frozen meal at the supermarket.  A restaurant meal at a decent restaurant isn't that exp	shiroiuma	5.758996	3.7045443	comment	4.0	12.0	1699870043	-4.404231
38248912	Jewelry is not unpractical, it's lik	Jewelry is not unpractical, it's like an insurance for bad times. When shit hits the fan you still have your jewelry to sell.	ako	5.6236553	3.7154067	comment	4.0	12.0	1699872827	-15.068806
38248929	> After all, [engagement rings] only	> After all, [engagement rings] only need to last a few months, or maybe 1-2 years, until the wedding.I think this is the cultural distinction you're missing -- married American women typically wear both their engagement and wedding ring their entire lives, an	throwaway287391	5.621642	3.7112386	comment	4.0	11.5	1699873003	-15.081236
14745125	The general opinion is this is a syn	The general opinion is this is a synthetic diamond laundering operation. Synthetic diamonds are of course chemically identical to natural, but natural diamonds still fetch a higher price.	ghostly_s	5.607497	3.7201192	comment	4.0	17.0	1499787977	-15.074098
15291733	Funny to see this article here now. 	Funny to see this article here now. For the last few weeks I've been geeking out on exotic materials, and especially Tungsten Carbide. I even went so far to buy a polished Cobalt binded TC 70mm sphere from China. It's virtually indestructible and very few mate	logotype	5.752892	3.6751053	comment	4.0	19.5	1505896407	8.512723
15582377	It's worth noting that for a finite 	It's worth noting that for a finite number of bets (the number being known to the bettor) the Kelly Criterion is not the optimal strategy. Intuitively, the closer you are to the end the less worried you should be about going bust (as you won't be missing out o	OisinMoran	5.406633	4.321841	comment	4.0	12.5	1509323191	-14.823725
17328566	>  the giver can sue the receiver to	>  the giver can sue the receiver to recover the ring if the engagement is broken off.Which contradicts the whole idea of an engagement ring:> In the United States, until the Great Depression, a man who broke off a marriage engagement could be sued for breach 	trendia	5.62	3.7108934	comment	4.0	15.0	1529172519	-15.117069
21094379	> Strebe has coated a $2 million (£1	> Strebe has coated a $2 million (£1.6 million) 16.78-carat natural yellow diamond in the materialWouldn't it have been smarter to, say, make a glass replica, coat that, and pocket the $2 million diamond?	asdfman123	5.6075964	3.7212238	comment	4.0	14.5	1569606261	-15.076236
21523175	She was happy skipping travelling bu	She was happy skipping travelling but not an indistinguishable rock on a ring? The marketing is too strong indeed.	andrepd	5.622734	3.7116568	comment	4.0	21.5	1573646935	-15.079559
21523248	It's a weird American thing. People 	It's a weird American thing. People here even take out a mortgage to buy these ludicrously expensive engagement rings.	chadmeister	5.633286	3.7078762	comment	4.0	21.0	1573647636	-15.097478
21523214	Diamond is a material. If materials 	Diamond is a material. If materials become cheaper that's not a problem, that's usually great, especially if those materials have desirable properties. Can't wait for diamond to be as cheap as sugar (not that it will ever be), I have zero use for it as decorat	jacquesm	5.6072497	3.7212958	comment	4.0	14.0	1573647225	-15.055405
21523516	Not all women insist on $20K engagem	Not all women insist on $20K engagement rings. I would hope.	jacquesm	5.6251073	3.7090037	comment	4.0	11.0	1573649985	-15.099931
21524218	Millennial here. When I got married 	Millennial here. When I got married we skipped rings because ring culture is bullshit.(It was her idea before anyone asks. I suggested we get non-diamond or lab grown, and was pleasantly surprised when I learned she also thought rings are dumb)	helen___keller	5.637547	3.6959743	comment	4.0	11.5	1573654297	-15.075022
21525329	So, how can a person like me take ad	So, how can a person like me take advantage of this?This seems like a great arbitrage situation.Where would one find these diamonds that no one wants to buy?I hear these stories, but it seems like everyone that is selling a used diamond is still asking top pri	ijidak	5.6064086	3.7204826	comment	4.0	11.0	1573659757	-15.076285
21524168	The problem with a bunch of gold or 	The problem with a bunch of gold or a house is that she can’t carry them around with her throughout her day. With a diamond ring, she can.Why is that important? Maybe it’s less important today, but if you turn on her and she has to strike out on her own, then 	chongli	5.6254454	3.712808	comment	4.0	10.5	1573654076	-15.078701
21530388	> and that was achieved through mark	"> and that was achieved through marketingTo elaborate: The ""tradition"" of diamond engagement rings only dates back to the 1930s, invented almost whole cloth by the DeBeers cartel to sell diamonds. For that reason, I think saying it's a ""part of the culture"" ov"	c5karl	5.628512	3.7057528	comment	4.0	15.5	1573684126	-15.07762
39598565	It's weird to see the people in this	It's weird to see the people in this thread stating the generally accepted scientific viewpoints downvoted while those praising Diamond are upvoted.Diamond is a skilled and persuasive writer, who's had success as a pop science writer but the theories he pushes	CSMastermind	5.6976566	3.660858	comment	4.0	14.0	1709603858	-12.816326
22118570	It's just a diamond, they are not ve	It's just a diamond, they are not very interesting unless you believe the TV commercials that tell you they are super important and special. Carbon is carbon.I'm just laughing at 800 MILLION YEAR OLD ROCK. Like you know how old all the rocks are right?	stopads	5.6439223	3.7089212	comment	4.0	11.5	1579708508	6.018446
22118447	A diamond is worth what people are w	A diamond is worth what people are willing to pay for it. Just cause you don’t think they should be expensive doesn’t mean other people agree with you.	bluedevil2k	5.6056604	3.719325	comment	4.0	14.0	1579707780	-15.07522
22212291	Can anyone here explain to me how a 	Can anyone here explain to me how a diamond anvil cell works?   The metal gasket is under the same pressure as the diamond, so presumably it would deform and let the pressure out?And if it were strong enough to contain the pressure, why not make the whole thin	londons_explore	5.6294465	3.7066202	comment	4.0	13.0	1580582372	8.485269
23399429	The significance of this article is 	The significance of this article is that you don't need a big science lab like CERN to do useful experiments.Diamond anvil cells are under $10,000:https://diamondanvils.com/product-category/diamond-anvil-cel...	redis_mlc	5.6220303	3.715218	comment	4.0	11.5	1591155652	-15.063708
23519966	If I may interject, discussing poten	If I may interject, discussing potential surprises like this will kill the mood and ruin your big reveal later. So unless you’re sure your partner will take it well, I suggest not discussing things like this do just do as you please.Some other friendly tips: y	verroq	5.6273394	3.7095113	comment	4.0	15.5	1592159079	-15.075737
23520067	Bold statement to make about 3,500,0	Bold statement to make about 3,500,000,000 people. That thinking rationally is impossible for their heads.For what's worth my girlfriend already made it clear that she would be very upset if I ever bought her such expensive jewellery, precisely because of lost	andrepd	5.628733	3.7158525	comment	4.0	14.0	1592159875	-15.06836
20438355	What is the difference between this 	What is the difference between this and sapphire?	pkaye	5.625239	3.7016377	comment	4.0	12.5	1563168381	-6.904838
20558280	Where did you purchase the lab grown	Where did you purchase the lab grown diamond?	DrAwdeOccarim	5.6119776	3.716434	comment	4.0	11.0	1564427699	-15.075136
20558283	Why do you want a diamond (natural o	Why do you want a diamond (natural or otherwise) on your finger at all?	stagger87	5.6095133	3.7173615	comment	4.0	11.5	1564427706	-15.072272
20821826	What kind of jewelry did people thin	What kind of jewelry did people think they were getting for a few quid?	krustyburger	5.6512265	3.7078128	comment	4.0	15.5	1567012580	-15.066407
20824372	>A few months after the engagement n	>A few months after the engagement no one will ever care for the rest of your life,A big fat white stone on a finger will draw eyes for so long as a woman wears it. Every woman your wife meets will make a judgement call based on that ring for the next 20 years	pastor_elm	5.6224704	3.7105255	comment	4.0	23.0	1567028963	-15.078458
20824899	This comment sounds so much like a s	"This comment sounds so much like a spambot I decided to see what GPT-2 would generate for ""Real men don't buy fake diamonds"":> Real men don't buy fake diamonds. They buy real diamond rings. Fake diamonds just aren't worth anything, let alone being used for a m"	scarejunba	5.60594	3.7208033	comment	4.0	11.5	1567032891	-15.081753
31628436	Create a Bot to Find Diamonds in Min	Create a Bot to Find Diamonds in Minecraft	gosub	5.6110907	3.7120664	story	4.0	54.0	1654408991	-7.1808376
29356331	What Happened to All the Diamonds in	What Happened to All the Diamonds in the Rough?	jger15	5.613839	3.7153459	story	4.0	28.0	1637977085	-15.07011
17184621	That's not how disbelieving works.Pe	That's not how disbelieving works.People disbelieve facts that would cost them to believe. If I believe in climate change, I have to make expensive life changes (sell the SUV, buy a Tesla, etc). Therefore I will not believe in it.This belief is 100% honest, BT	BurningFrog	5.6055145	3.7216105	comment	5.0	18.5	1527648228	-15.077466
17184678	This article always rubbed me the wr	This article always rubbed me the wrong way as it's practically a condensed rewrite of Have You Ever Tried to Sell a Diamond?, published in The Atlantic in 1982. Much of this article is just quotes from the original. It bothers that the priceonomics.com author	tristanj	5.6058054	3.7214034	comment	5.0	15.0	1527648970	-15.076637
17185248	I mean sure, you could buy something	I mean sure, you could buy something just as nice on ebay for 2$.  but I imagine, your potential wife won't go for that.When I proposed to my wife, she specifically requested the diamond cost a minimum of X dollars.  I was unprepared and I didn't negotiate.  I	pascalxus	5.613175	3.7169917	comment	5.0	13.5	1527657371	-15.081762
17185322	My wife and I got married without bu	My wife and I got married without buying a diamond ring. I simply refused to spend money in things that are overvalued by the market because some marketing scheme was so strong that it made facts look silly. I told her that I refuse to spend money on things th	artellectual	5.613497	3.7159805	comment	5.0	13.5	1527658440	-15.080157
17186656	As a sidenote, the rings with diamon	As a sidenote, the rings with diamonds thing is mostly an American fad.All people i know in Germany have just plain gold rings.It is way nicer because it is more a symbol of commitment than a show of wealth.Those never get out of style, can hardly be damaged a	LordHeini	5.6294675	3.707632	comment	5.0	16.5	1527678317	-15.082167
19131919	> Men are supposed to reciprocate on	> Men are supposed to reciprocate on 14 March on White Day – an event dreamed up by chocolate makers in the early 80s to boost sales.Japan seems to have been especially susceptible to the power of suggestion by commercial entities. It was also the case with di	hatmatrix	5.626133	3.7122252	comment	5.0	16.0	1549856973	-15.078421
38246777	From what I hear, moissanite (and ma	From what I hear, moissanite (and man-made diamonds) are pretty much indistinguishable from natural diamonds. How would someone's friends figure out that it's not a natural diamond? I would think the only way the wife would know is if she asked about the diamo	gnicholas	5.6092477	3.7186604	comment	5.0	16.0	1699848482	-15.074995
38247986	Diamonds are a scam and an ethical m	Diamonds are a scam and an ethical minefield, but I disagree with the notion that women are brainwashed or shallow for wanting one.It’s not about the diamond.It’s about wanting a man with enough resources to waste on a diamond. A diamond’s lack of intrinsic va	jl6	5.615357	3.713826	comment	5.0	17.0	1699862090	-15.079976
