id	label	hovertext	author	x	y	type	relevance	size	year	umap1d
33358000	For those concerned about distinguis	For those concerned about distinguishing 'natural' from 'synthetic' diamonds (not really that meaningful IMO other than maintaining artificial scarcity of a luxury/status item), there's a simple fix: use atmospheric carbon as the building material.  Atmospheri	photochemsyn	5.606663	3.7203212	comment	5.0	15.0	1666880968	-15.073689
28321905	i read something about a guy shatter	i read something about a guy shattering his tungsten wedding band on his wedding night, after deciding that slapping his hands on concrete was how you're supposed to dance.professional advice: don't use an exotic metal for your wedding band. some fire departme	toiletaccount	5.7499366	3.708684	comment	5.0	17.5	1630017282	-15.05986
12944621	This is what annoys me. The geek and	"This is what annoys me. The geek and idealist in me doesn't want to give her a diamond because it's not that valuable. 
Yet, I don't want to be cheap. I don't want her to feel like I don't value her enough."	m1aw	5.616334	3.7152243	comment	5.0	16.5	1479060410	-15.081781
12944630	> Isn't it amazing (and scary) how b	"> Isn't it amazing (and scary) how brainwashed people are about the ""value"" of diamonds, even though they're not actually worth that much?I've never understood this argument. Aren't they worth what people are willing to pay?"	maaaats	5.607726	3.7206173	comment	5.0	14.0	1479060513	-15.076344
12944948	This doesn't work. I have tried it. 	This doesn't work. I have tried it. She (my GF) just argues with me about any purchase I try to make that is around the ballpark of what she is expecting me to pay for a ring.e.g.Her: So you want a new MacBook Pro, but you can't afford a $3000 engagement ring?	ftrflyr	5.6257024	3.7087474	comment	5.0	20.0	1479063695	-15.081544
27795384	It saddens me how people still put s	It saddens me how people still put so much value in diamonds given how prevalent they are on Earth and across the solar system.	Crash0v3rid3	5.607289	3.7207067	comment	5.0	15.5	1625941630	-15.075938
12279360	For other gem materials, the synthet	For other gem materials, the synthetics are so good and cheap it's embarrassing that expensive jewelry is made from them.  You can buy cheap sapphire bar stock[1] or ruby rod[2] on Alibaba. Synthetic emerald gems come in bulk in plastic bags.[3][1] https://www	Animats	5.608296	3.7205915	comment	5.0	16.5	1471042537	-15.0725155
22701031	Ask HN: Need to talk to whoever did 	Ask HN: Need to talk to whoever did contact-tracing on Diamond Princess	caedus-covid	5.6121144	3.7159479	story	5.0	19.0	1585294804	-15.075485
26699177	Diamond alternatives are fine, but a	Diamond alternatives are fine, but another option is just not getting a ring. My wife and I decided not to and nobody really cares. We spent the money on travel instead, and the memories are more valuable to us than a tiny rock.Don’t get me wrong, diamonds and	paulgb	5.612424	3.718653	comment	5.0	19.0	1617631922	-15.077727
26835391	This has been posted 5 other times o	This has been posted 5 other times on HN with no real discussion [1].I'll add my 2 cents: I used to use the principles of kelly betting back when I designed systematic HFT strategies. It gives you a good framework to think about how much to bet based on the ba	anonu	5.4106784	4.318404	comment	5.0	21.5	1618588160	-4.4859157
26836073	Understanding Kelly criterion is alm	"Understanding Kelly criterion is almost useless in practical investment management. I’m a professional trader and former quant and I don’t know a single actual pro who uses anything like Kelly to size bets.
I’m not saying understanding the methodology isn’t co"	hodder	5.4079766	4.3214736	comment	5.0	18.5	1618591142	-14.821019
27035980	I am curious, is the diamond thing a	I am curious, is the diamond thing a US-centric trope? I do not know anyone here who genuinely cares about that sort of thing, generally people want some discreet metal ring. It may be a precious ore to symbolize the commitment but otherwise I have not seen an	Jiejeing	5.622991	3.708858	comment	5.0	13.5	1620124437	-15.071811
27036251	It's mostly about the emotional atta	It's mostly about the emotional attachment. If you find two identical pens, and one of them was used by a famous writer, you would expect a price difference.There is no difference in the quality of those pens. They both work the same, and using the writer's pe	qw	5.6085973	3.7189927	comment	5.0	55.0	1620126579	12.509224
27036375	That's a good point, the difference 	That's a good point, the difference doesn't have to be in the item itself, BUT -Does anyone, other than geologists of course, really care about the back-story of the diamond, how it was created and how it was mined? Or are they just hanging on to an idea that 	Nursie	5.6099677	3.716331	comment	5.0	18.5	1620127491	-15.0712385
27451991	The Kelly criterion is to financial 	The Kelly criterion is to financial math as the Fibonacci sequence is to mathematics. Yes it's neat, no it's not special, please stop bringing it up all the time.	murbard2	5.4068737	4.3220577	comment	5.0	26.0	1623266631	-14.826393
14745088	> These diamonds were all of a unifo	> These diamonds were all of a uniform size and shape and were dubbed 'Silver Bears'. While DeBeers could not understand how the Soviets were producing such a large quantity of gem diamonds of such uniform size, and supposedly from one mine that by DeBeers sur	willvarfar	5.610092	3.715286	comment	5.0	24.5	1499787775	-15.062854
15102987	CVD diamond synthesis has become so 	"CVD diamond synthesis has become so effective that it's embarrassing.[1][2] The diamond gem industry made a terrible mistake. They promoted ""flawless"" diamonds as the most valuable. Now they're up against a process borrowed from the semiconductor industry, whi"	Animats	5.607085	3.7221437	comment	5.0	16.0	1503702834	-15.075515
23398995	> To create the new form [nitrogen] 	> To create the new form [nitrogen] was pressed together between two diamonds to 1.4 million atmospheres of pressure, and over 4,000 °C (7,232 °F)... It appears to have good conductivity, much like that of graphene, which could make it useful in future electro	klyrs	5.6311464	3.697942	comment	5.0	14.5	1591150765	-12.372235
20134461	Show HN: OneTrueRock – TrueCar for D	Show HN: OneTrueRock – TrueCar for Diamonds	onetruerock	5.6139216	3.7138672	story	5.0	8.0	1560021417	-15.066165
20561147	My bride wanted sapphire because she	My bride wanted sapphire because she knew I was convinced of the evil history of diamond. 10 years later she demanded a big diamond to replace it and I realized she'd been seething all those years but compromised because she was playing the long game our marri	lonelappde	5.6155457	3.7158413	comment	5.0	16.5	1564448660	-15.075812
20824494	A man who does that signals that he 	A man who does that signals that he buys into all the social hype, but is too cheap to really buy in ... and he'll be forcing his wife to either reveal that or perpetuate a lie.Why not just be a real man, speak and live the truth. Eschew the lies.Why can't we 	anon1m0us	5.634607	3.701594	comment	5.0	16.0	1567029752	-4.064783
20843318	Bear in mind that anthropologists ar	Bear in mind that anthropologists are not historians. Anthropologists are dedicated to the study of human culture, which is related to but no the same as the study of human history. Guns, Germs, and Steel chiefly argued that geography was a much stronger deter	manfredo	5.7235155	3.6539645	comment	5.0	19.5	1567204281	-12.813935
14664735	Problem number one, that girl in the	Problem number one, that girl in the opening picture has a ring on her left hand. Perhaps try again with single girls?	tbirrell	5.6404223	3.7026997	comment	5.0	21.5	1498755029	-15.075876
31448223	You can cut diamonds with your focus	You can cut diamonds with your focus on the third full day of a water, salt, and black coffee fast.	orangepurple	5.608641	3.7188065	comment	5.0	15.0	1653058147	-15.067711
36064509	My materials science professor alway	My materials science professor always used ring as an example in intro to matse classes of what not to do with titanium.His point was that if you ever get into an accident and the first responders have to cut your ring for whatever reason (MRI machine, etc.), 	alsodumb	5.828263	3.7083085	comment	5.0	12.5	1684966419	-4.4010572
34357222	I happen to be extraordinarily famil	I happen to be extraordinarily familiar with a similar situation (long story). I think you should be careful who you discuss this with, particularly if the previous owners might get involved.My advice would be to go to Bavaria yourself, and destroy the ring.	mometsi	5.6502767	3.7041085	comment	5.0	16.0	1673544333	-15.079654
16551271	Possibly a good time to plug moissan	Possibly a good time to plug moissanite yet again: http://diamondssuck.com	ocfnash	5.610044	3.7191553	comment	5.0	13.0	1520598803	-15.077386
16551369	They’re called fake because they’re 	They’re called fake because they’re artificial, not because they have more flaws. The diamond industry might have once thought it could rely on artificial diamonds being less perfect, but it’s under no such illusion now. I think it’s fair to acknowledge that, 	dsacco	5.6058574	3.7208984	comment	5.0	26.0	1520600049	-15.093825
16551493	You’re taking away a lot of agency f	You’re taking away a lot of agency from people who prefer natural diamonds. Yes, of course their marketing campaign set off the industry, but the reason it worked is because many people are already predisposed to prefer natural things over artificial things. W	dsacco	5.606288	3.720945	comment	5.0	18.0	1520601586	-15.08561
16551291	As the price of diamond continues dr	As the price of diamond continues dropping, I wonder if people will find more interesting applications of the material and it'll eventually become as mundane as things like steel and aluminium. Besides its hardness, it also has very high thermal conductivity. 	userbinator	5.6091413	3.7222395	comment	5.0	41.5	1520599072	-15.067983
21523332	"I actually read the famous ""Have You"	"I actually read the famous ""Have You Ever Tried to Sell a Diamond?""[0] by The Atlantic over 30 years ago and since then, there have been multiple predictions of diamond prices collapsing. (Various reasons given such as Russia, China diamonds flooding market, s"	jasode	5.6058626	3.721862	comment	5.0	12.5	1573648433	-15.074528
30267942	The Kelly criterion is only optimal 	The Kelly criterion is only optimal if you have logarithmic utility. People like to pretend that it somehow becomes optimal in other cases if you have multiple rounds, but when you do the calculations it just doesn't. Having the highest probability to win amon	OscarCunningham	5.4080157	4.3220234	comment	5.0	18.0	1644373651	-14.823639
32861002	Those diamonds were mined in Kollur 	Those diamonds were mined in Kollur in modern day south India. It should go back to them.And yes, before you harp on it, the land we call America should go back to the Native Americans, the aboriginals of Australia and New Zealand should also get their lands b	cafed00d	5.611372	3.7212355	comment	5.0	17.0	1663292568	-15.076654
37276277	The DeBeers marketing is still effec	The DeBeers marketing is still effective and most (US at least) women still want them for their romantic authenticity. I suspect this will be unpopular, but I know many of my married buddies would likely not be if they had insisted and held firm that a lab gro	boppo1	5.6112704	3.7191596	comment	5.0	20.0	1693079820	-15.075048
37455081	Or how about a proper dowry... that 	Or how about a proper dowry... that is the point.A savings bond, or even a symbolic gold chain... provided that the price is reasonably represented in gold weight.Dowries are/were a symbolic and real proof of financial fortitude, intent. They often a represent	dalbasal	5.72692	3.6370277	comment	5.0	27.5	1694347701	-15.063277
37509005	Good!They're mostly a marketing ploy	Good!They're mostly a marketing ploy by DeBeers and other companies to push overpriced stuffGet a moassanite or a synthetic diamond. Engagement rings with a stone are not even a thing outside of the US it seems	raverbashing	5.6296096	3.7057104	comment	5.0	17.0	1694699362	-15.0774145
22209843	I still wish I'd discovered Moissani	I still wish I'd discovered Moissanite before I got married. The rock would have been multiples larger and I'd have the satisfaction of not contributing to a monopolistic and exploitative industry.	lordnacho	5.618507	3.7168097	comment	5.0	35.0	1580553780	-15.075764
22209937	I was fortunate enough to discover m	I was fortunate enough to discover moissanite. Wife loves it, and the price was somewhere in the ballpark of 90-95% cheaper than an equivalent size diamond. The added benefit is, everyone thinks it’s a diamond and we haven’t yet felt the need to correct them..	irishcoffee	5.610376	3.7177558	comment	5.0	31.5	1580555815	-15.076203
22210405	Synthetic diamond will eventually be	Synthetic diamond will eventually become so easy the industry won't be able to supress it anymore. The collapse will be interesting, in the bloddy sense of the term I suspect.	galangalalgol	5.605339	3.7233872	comment	5.0	19.0	1580563979	-15.069982
19744440	In the US, buying jewelry and sellin	In the US, buying jewelry and selling it back is a substantial guaranteed loss. Are the economics of the retail jewelry trade different there, or are the alternatives just so bad that it’s still compelling?	closeparen	5.6247635	3.7179697	comment	6.0	17.5	1556158298	-15.0702505
16256588	Diamond Blockchain Initiative	Diamond Blockchain Initiative	iafrikan	5.609541	3.7202165	story	6.0	26.0	1517220893	-15.093826
18485097	I've only barely looked into the Kel	I've only barely looked into the Kelly Criterion, but can someone explain the intuition behind maximizing the expected value of the log of your wealth? Trying the same derivation mentioned in the article but without the logarithm: the expected value comes out 	krackers	5.4062915	4.322034	comment	6.0	18.5	1542619543	-14.806256
16551753	I just don't get it. Who cares what 	I just don't get it. Who cares what the source of a diamond is?Isn't the point of a diamond its beauty in the eye of the beholder? If I had a big diamond I would definitely want the cheapest one possible with a visual aesthetic I like. Fortunately, my wife and	SomeHacker44	5.610426	3.7203104	comment	6.0	16.0	1520604021	-15.07901
17183876	Are there any perceptible difference	Are there any perceptible differences between these and 'natural' diamonds?	xur17	5.6082425	3.7196023	comment	6.0	22.0	1527639773	-15.074533
17184217	What you are all not getting is that	What you are all not getting is that a diamond is not about its chemical properties, but about economic signalling. Just like artificial fur could not replace natural fur, man-made diamonds will never be the luxury item mined diamonds are today. Diamonds, just	Hermel	5.6086526	3.71949	comment	6.0	16.0	1527643075	-15.073939
17229489	"From their website: A ""recommended"" "	"From their website: A ""recommended"" 1 carat is ~$5000.  Still way too much.You can get a 1 carat moissanite for ~$400.  They shine better, are nearly as hard, and nobody can tell the difference."	legohead	5.60861	3.7209923	comment	6.0	20.5	1528129783	1.7956569
21523765	I inherited some very nice jewelry, 	"I inherited some very nice jewelry, including diamonds, from my grandmother. The ""estimate"" of the total worth was $20,000. However, when I tried to sell it, it turned out that I would only be able to realize a fraction of that estimate, from maybe 1/4 to 1/3 "	Arete314159	5.612862	3.718762	comment	6.0	16.5	1573652147	-15.06286
21524087	Is committing to spending your life 	Is committing to spending your life with someone not trusting them with something that wouldn't be easy for you to replaceAnd how does she know you’re committed if you’re not willing to risk anything up front? You can say “well she knows me! We’ve been dating 	chongli	5.6188107	3.713125	comment	6.0	17.0	1573653692	-15.079654
21524710	There's almost no resale market for 	There's almost no resale market for diamonds, currently. A newspaper famously tries to sell a diamond every few years and publishes the result. They've never sold one.So the insurance value for diamonds is their replacement cost, not their 'value'. Since if yo	JoeAltmaier	5.607651	3.720384	comment	6.0	21.0	1573656604	-15.075273
21526297	It's not the marketing.  It's the fa	It's not the marketing.  It's the fact that it's what biologists call expensive signaling.  You are spending money, not on a trip that you both enjoy, but on a ring that really only she enjoys.  This is an expensive (therefore hard to fake) signal that you car	rossdavidh	5.6123867	3.717117	comment	6.0	39.0	1573664230	-15.079733
12944701	So people do this to signal (both to	So people do this to signal (both to their spouse and their friends) they are both financially capable and care enough about their spouse to burn a large amount of money on a pyre. It's also a very useful signal that you are serious about the commitment and un	Moshe_Silnorin	5.613691	3.7164674	comment	6.0	27.5	1479061173	-15.07941
12944765	Another alternative is synthetic,  l	Another alternative is synthetic,  lab grown diamonds. They are superior to naturally occuring diamonds,  cheaper, aren't tainted by human misery and suffering like conflic/blood diamondst, and arent extracted from ecologically damaging mining techniques like 	FullMtlAlcoholc	5.606911	3.7205513	comment	6.0	18.0	1479061812	-15.062011
12945450	Would you confirm or deny my two hun	Would you confirm or deny my two hunches:- Lab-grown diamonds are purer, more perfect crystals, cheaper, and better than mined diamonds in every way. (ignoring the market manipulation factor, which I'm not too knowledgeable about, except that I've heard big di	fizixer	5.604674	3.7216172	comment	6.0	15.0	1479068808	-15.075608
13086551	The fact that there is so much conce	The fact that there is so much concern over how to differentiate mined diamonds from grown diamonds seems like insanity to me. I understand that the diamond trade has a vested interest in differentiating, but why would end consumer care? They're the exact same	mojoe	5.6069236	3.7208827	comment	6.0	16.5	1480660066	-15.076357
28319167	Cool cube and I want one. But a meta	Cool cube and I want one. But a metalworking friend of mine warned against getting a ring made out of tungsten.Apparently a climber had one on and broke his ring finger, and the EMTs couldn't get the ring off because the finger had swollen and they couldn't cu	devindotcom	5.829081	3.6448421	comment	6.0	35.0	1630004903	8.603979
27036049	The flip side though, is that you're	The flip side though, is that you're making diamond miners unemployed. I suspect if they had alternate employment opportunities available that were more pleasant/better-paying, they'd have already taken them.So losers are the poor folks digging in the ground a	goldcd	5.608808	3.7215593	comment	6.0	16.5	1620124981	-15.075961
27037209	There's also a common line of reason	"There's also a common line of reasoning that roughly goes ""well this particular diamond has obviously already been mined, so no additional harm is caused by me wanting it.""Obviously you and I see that even that line of reasoning alone jacks up demand for an aw"	kqr	5.6072855	3.7204921	comment	6.0	15.5	1620134079	-15.051874
27037517	I'm at the marriage age right now an	I'm at the marriage age right now and I see tons of my friends getting married.A friend got proposed a couple of months ago and her ring is ~40k USD. In my opinion, that's crazy since they're spending ~30k CAD on their wedding.My partner also mentioned that sh	throwawayosiu1	5.614444	3.716665	comment	6.0	18.0	1620136022	-15.077853
27035953	Good for them. It's literally the sa	Good for them. It's literally the same material, and we can now use scientific and engineering advances to remove the need for people to toil and die underground to get them.Hopefully the process is more environmentally friendly too.They are real diamonds.I fi	Nursie	5.6095986	3.7177029	comment	6.0	40.5	1620124269	-15.073351
27452224	This so much.  Like anything that is	This so much.  Like anything that is 'optimal' it is optimal with respect to some criterion.  For the Kelly Criterion it is to maximize the logarithm of the weighted sum of the expected value across all outcomes.This is probably not what you actually want in a	ltbarcly3	5.4073215	4.3224535	comment	6.0	19.5	1623267968	-14.823033
38246235	> Has anyone ever tried to sell an e	> Has anyone ever tried to sell an engagement or wedding ring with diamonds? You get cents on the dollar.Does that mean you can buy one second-hand at a low price, and avoid the inflated market entirely?	SenAnder	5.609079	3.7197905	comment	6.0	29.0	1699842896	-15.07906
38248207	To an engineer's eye this might make	To an engineer's eye this might make sense, but the significant cost of a diamond is actually the very point of buying it. And it's hardly an odd thing - the history of human civilisation is littered with examples of spending for the sole purpose of being able	exitb	5.607996	3.721932	comment	6.0	28.0	1699864694	-15.076007
38248249	Before diamonds were the go-to for e	Before diamonds were the go-to for engagement rings, color stones like ruby, sapphire, and emerald were the thing. So why should it be mossianite and not going back to other gem stones?	RandomLensman	5.6103096	3.7197795	comment	6.0	15.5	1699865087	4.4721727
15699529	Diamond Signs (2012)	Diamond Signs (2012)	brudgers	5.607714	3.7164829	story	6.0	39.0	1510696462	-15.062357
20557953	I was blown away when someone told m	I was blown away when someone told me they wanted a natural diamond. It seemed crazy to me, I don't get why someone would want to pay more for an identical (except for the fact that it was likely mined unethically) stone. I don't think any of my friends have a	tdb7893	5.608192	3.720846	comment	6.0	28.5	1564426079	-15.071924
20823834	I strongly recommend getting a stone	I strongly recommend getting a stone other than diamond. A few months after the engagement no one will ever care for the rest of your life, with the exception of the jewelry sales person who missed out on the commission.	bob33212	5.618156	3.714162	comment	6.0	46.0	1567025404	-15.080037
20824071	Engagement rings are status symbols,	Engagement rings are status symbols, and many women, perhaps even most, will care about it for the rest of her life.  Many women I know upgraded their stones after the family's economic situation improved over time.	Consultant32452	5.638305	3.6930153	comment	6.0	28.0	1567027171	-15.081937
37396372	Have You Ever Tried to Sell a Diamon	Have You Ever Tried to Sell a Diamond? (1982)	mhb	5.6029816	3.726289	story	6.0	30.0	1693941181	-15.0774975
37397730	I personally find the decision to bu	I personally find the decision to buy lab grown diamonds to be weirder, because if you are already thinking logically rather than emotionally and can resist the social pressure then why waste money on a diamond at all? There are plenty of gems or metals out th	paxys	5.6059613	3.721281	comment	6.0	19.5	1693947878	-15.076338
37400658	Sorry to be negative, but I think th	Sorry to be negative, but I think the conventions around marriage needs to be redone alongside all the other changes around marriage. To wit, the ability of a woman to divorce you and receive alimony and child support for basically the rest of her life. It's n	javajosh	5.6381497	3.7036095	comment	6.0	18.0	1693966561	-15.04888
37509111	Totally cool and not everyone's cup 	Totally cool and not everyone's cup of tea. Wasn't mine when I was growing up.But I married a woman who grew up more in that type of sphere. I ended up having a lot of fun diamond shopping in the upstairs office of a dealer in the diamond district in NYC, lear	xyzelement	5.6248646	3.7105827	comment	6.0	23.0	1694699830	-15.074899
25064409	> As soon as you leave the jeweler w	> As soon as you leave the jeweler with a diamond, it loses over 50% of its value.If someone can point out a place where one can purchase a diamond for half off retail price, please do so.	buzzy_hacker	5.6088567	3.7195988	comment	6.0	15.5	1605138406	-15.077075
25158428	Artificial diamonds creation process	Artificial diamonds creation process generating lonsdaleite	bleair	5.6077223	3.7182248	story	6.0	48.0	1605860971	-15.070945
38948652	Diamond Subpixel Arrangement Simulat	Diamond Subpixel Arrangement Simulator	firloop	5.6112747	3.6988616	story	6.0	92.0	1704955506	5.309088
32259949	Aztec Diamond	Aztec Diamond	luu	5.610936	3.71503	story	6.0	70.0	1658976395	3.6121988
22209846	We should crowdfund a PR campaign th	We should crowdfund a PR campaign that diamonds are synonyms for death and exploitation, and it’s more humane for “any gem but a diamond”.A $10 million campaign or so, targeting youth especially, can have tremendous impacts on future generations.	dannyw	5.605056	3.7213104	comment	6.0	16.5	1580553856	-15.076285
23520104	I saw one estimate there is one mill	I saw one estimate there is one million people employed in diamond  mining in Africa.What now happens to their families?In India where diamonds are cut they also employ a million people.What now happens to their families?	aaron695	5.6099153	3.7194595	comment	7.0	21.5	1592160056	-15.07721
12944892	Wife and I had read the Atlantic art	Wife and I had read the Atlantic article before it was too late, went with plain wedding bands for both of us. However, living in America, this is causing issues for her, continuously having to explain to friends and acquaintances why she does not have a diamo	jakewins	5.62421	3.7090437	comment	7.0	26.5	1479063153	-15.076654
