id	label	hovertext	author	x	y	type	relevance	size	year	umap1d
33208121	The Curse of the Blue Diamond	The Curse of the Blue Diamond	backuprestore	5.608	3.718333	story	3.0	25.0	1665777326	-15.061538
33357656	not sure about the relative rarity, 	not sure about the relative rarity, but De Beers did/does artificially limit available stock to keep prices up. If you read really anything about them, you'll see that market manipulation was core to their business model from the start.	saxonww	5.625547	3.7385263	comment	3.0	12.0	1666879701	0.74082714
37785458	Self-Healing of Fractured Diamond	Self-Healing of Fractured Diamond	JumpCrisscross	5.6310706	3.721167	story	3.0	41.0	1696548032	-15.066764
14745159	I thought there were ways to tell sy	I thought there were ways to tell synthetic from natural? Surely DeBeers were particularly interested in discrediting Soviet diamonds and if they could find proof that those were indeed synthetic, they would have used it?	gambiting	5.61254	3.7224197	comment	3.0	10.5	1499788212	-15.078137
12810445	New Method Could Store Massive Amoun	New Method Could Store Massive Amounts of Data in Diamond Defects	jonbaer	5.611461	3.7107058	story	3.0	15.0	1477604090	7.1726103
15210362	The quest to make a crystal harder t	The quest to make a crystal harder than diamonds	elijahparker	5.6118813	3.711126	story	3.0	62.0	1505012928	-15.016137
15293913	"""It's virtually indestructible and v"	"""It's virtually indestructible and very few materials such as diamond can scratch it.""Not really. It's a ceramic and as such will shatter if knocked against another ceramic, hardness notwithstanding. Also, for some reason, my skin eats away at it.See my tungst"	lightedman	5.679826	3.7152503	comment	3.0	10.5	1505916821	8.238323
15331550	To quote Alec Baldwin's character, E	"To quote Alec Baldwin's character, Ellerby, from The Departed:""Marriage is an important part of getting ahead; lets people know you're not a homo. Married guy seems more stable. People see the ring, they think 'at least somebody can stand the son of a bitch'. "	mfoy_	5.6409416	3.696687	comment	3.0	11.0	1506355592	-4.065342
15490566	The whole jewelry diamond market is 	The whole jewelry diamond market is shady and should be boycotted. It is a shame that many still fall for the marketing and think diamonds are rare	rypskar	5.6199784	3.7245872	comment	3.0	11.5	1508245654	-15.07391
38246031	Jewelry isn’t an investment, it’s co	Jewelry isn’t an investment, it’s conspicuous consumption.That said there’s really no reason to buy new unless it’s a custom made piece.	User23	5.622227	3.7152286	comment	3.0	17.0	1699840635	-15.070895
38246498	Honestly, second hand diamond and ot	Honestly, second hand diamond and other gemstone jewelry seems like such a missed opportunity. I feel like people would go for it, with the new focus on sustainability and what-not. I wonder why that's not a thing?	Loughla	5.6104574	3.71896	comment	3.0	14.0	1699845503	-15.073686
38246516	And make sure you appraise her of it	And make sure you appraise her of it - shenanigans like buying something else and passing it off as a diamond could result in her being absolutely embarrassed in front of her friends, which should not be a position you want to put her in.	bombcar	5.618314	3.7139215	comment	3.0	18.5	1699845760	-15.081323
38247607	The diamond industry has a terrible 	"The diamond industry has a terrible problem. They promoted diamonds as ""perfection"". The most valuable diamond is supposed to be a crystal with no flaws.
Then they ran into the semiconductor materials industry. Wafer fabs want every atom where it is supposed t"	Animats	5.6078978	3.7197754	comment	3.0	15.5	1699857521	-15.075224
38248327	"> ""You need to make a 10kUSD+ purcha"	"> ""You need to make a 10kUSD+ purchase on a totally arbitrary piece of jewelry that very well may have incited real human suffering and violence, even though I know that desire is irrational and poorly balanced.""That's a tricky topic to broach. Drop one zero f"	TeMPOraL	5.6512504	3.70224	comment	3.0	14.0	1699865891	0.15409775
38396105	Resting next to me is a titanium rin	Resting next to me is a titanium ring, it is extremely light, resistant to ambient temp change, and is usually cool to the touch. It cost $15 or so. It wears in a really beautiful way, aging like it's enjoying itself.On my finger is a tungsten carbide ring, it	megraf	5.744778	3.7122064	comment	3.0	12.0	1700765465	8.492141
26835952	For anyone actively managing investm	"For anyone actively managing investment portfolios, a deep understanding of the Kelley criterion is very important. For example, it is common practice to use ""Half Kelly"" to size positions, but most sources only provide a hand-wavey intuitive explanation. Thor"	a11r	5.409629	4.3204846	comment	3.0	16.0	1618590604	-14.818585
27035840	Not married, but engaged! I ended up	"Not married, but engaged! I ended up buying a diamond on James Allen (they allow you to select earth created or lab created).They allege their mined diamonds are ""conflict free"" https://www.jamesallen.com/education/diamonds/grading-confli....However, my feelin"	lewisflude	5.6178627	3.7142518	comment	3.0	14.0	1620123425	-15.078558
27036586	The economics behind diamonds are be	The economics behind diamonds are better explained by an sociologist, not a geologist- the high cost and useless-ness of the gift are a feature not a bug! The burning of significant amount of wealth is a costly signal of commitment to the receiver. I heard fro	grw_	5.6157064	3.720113	comment	3.0	13.5	1620129141	-15.080861
27036875	>The societal answer is at least two	>The societal answer is at least two months.Might be an American thing? My parents spent about 1 month worth of my dad's salary on two wedding rings a long time ago. My dad actually wanted to buy a far more expensive ring for my mom, but she insisted to keep i	rndgermandude	5.6339684	3.7081583	comment	3.0	11.5	1620131623	10.620791
27038425	Many women won't directly tell their	"Many women won't directly tell their partner ""I want you to spend a couple months' salary on a beautiful diamond"" because it's tasteless to request and it removes all the meaning behind the man doing so, but they'd also be disappointed if the man didn't do so "	akarma	5.6152253	3.715025	comment	3.0	22.5	1620140966	-15.082116
27038480	I brought my now-spouse along for ri	I brought my now-spouse along for ring shopping, on her own theory that she'd be wearing the thing and should therefore have some input.  She was actually more opposed to mined diamonds than I was at the time.  We talked about this extensively, and considered 	amalcon	5.6138945	3.7180924	comment	3.0	10.5	1620141327	-15.08187
27260256	> The valuable diamonds are the diam	> The valuable diamonds are the diamonds that can be cut to produce a flawless gem.Though note that those aren't rare either. A diamond has no resale value; jewelers already have all the diamonds they're allowed to sell.	thaumasiotes	5.6084337	3.7199507	comment	3.0	12.0	1621819312	-15.075485
15844683	From an economic standpoint, Bitcoin	From an economic standpoint, Bitcoin is backed by generated electricity, computer hardware, and network trust. This is not dissimilar from the American Dollar, currently backed by the global energy economy and network trust. Here, the network is the US Treasur	Manglano	5.6348796	3.7150462	comment	3.0	11.0	1512402290	-1.4053912
17183780	This is great news for scientific re	This is great news for scientific research- diamonds for experimental purposes are a huge market that's impeded by their artificially high cost. From a material standpoint there's a multitude of uses for them- ranging from use in CERN's particle detectors for 	kregasaurusrex	5.608271	3.7210732	comment	3.0	11.5	1527638289	-15.073185
17184057	De Beers hasn't admitted defeat. The	"De Beers hasn't admitted defeat. They've pivoted strategies.""De Beers launched a new jewelry brand on Tuesday [...] The brand, called Lightbox [...] will transform the lab-grown diamond sector by offering consumers a lab-grown product they have told us they wa"	acchow	5.6062474	3.7254477	comment	3.0	10.5	1527641558	-15.07355
17184841	I agree wholeheartedly with this and	I agree wholeheartedly with this and the original article. I sold diamonds in college and really dislike the blood that goes into each and every one of them.Knowing a few of the arguments that fine jewelers might make, could you help me address?1. You may pass	konceptz	5.60867	3.717629	comment	3.0	10.5	1527651013	-15.077862
17184967	Never mind about jewelry and fashion	"Never mind about jewelry and fashion. Cheap synthetic diamonds would open up a host of industrial applications. Bring on ""The Diamond Age""."	nradov	5.6086726	3.7214613	comment	3.0	15.0	1527652952	-15.071493
17184719	Mineral name wise, sapphires are a t	Mineral name wise, sapphires are a type of corundum. Usually blue, sometimes green, yellow, orange, or others, depending on various metals mixed into it. But if it’s red (via chromium) it’s a ruby instead.Clear crystalline aluminum oxide you’d generally just c	wlesieutre	5.619874	3.7079217	comment	3.0	10.5	1527649373	-6.9128933
28320176	Scene of an emergency: hold still wh	Scene of an emergency: hold still while I figure out how to improvise a ring cracker that can crack a solid tungsten ring without further injury to your finger.	jacquesm	5.7710333	3.7020743	comment	3.0	11.5	1630009460	-15.056466
12279095	I read an article in the financial n	I read an article in the financial newspaper today about fake diamonds arriving in Antwerp from India mixed in with real ones in 'diamond melee' packages (lots of small diamonds).(in Dutch): http://www.tijd.be/ondernemen/retail/Nepdiamanten_sijpelen_o...I got 	Luc	5.6065598	3.7204013	comment	3.0	18.0	1471039244	12.415351
12944762	> It's a bit of a stretch to say tha	"> It's a bit of a stretch to say that only diamond rings are acceptable""only"" is a pretty exclusive word, but I don't think it's a stretch saying that only diamond rings are acceptable in the general case. Especially amongst the reasonably affluent class that "	brandur	5.620105	3.713198	comment	3.0	12.0	1479061752	-15.079408
12945183	Yeah well, societal pressures only g	Yeah well, societal pressures only go so far in influencing a relationship. If the other party can't respect your values, an argument over a diamond is the least of your worries.	joecool1029	5.622862	3.7093515	comment	3.0	14.5	1479065891	-15.07888
12946014	Exactly this. The problem with every	Exactly this. The problem with every diamond critique I see is that their very first argument against diamonds is that they're expensive when that is, in fact, the entire point.Likewise, all the people who cry foul about the De Beers conspiracy are neglecting 	morgante	5.6067758	3.7206092	comment	3.0	13.0	1479075631	-15.078849
12946069	"> diamonds being ""non-negotiable"" se"	"> diamonds being ""non-negotiable"" seems like a huge, glowing, neon warning signIt's deeply ingrained in Western culture. Think about it like eating dogs. There's no rational reason not to use dogs for meat, but most Westerners would throw a hissy fit rather th"	Ironchefpython	5.6137524	3.7156234	comment	3.0	18.5	1479076125	-15.083452
21316665	All the industries are competing to 	All the industries are competing to be the one by which you display your worth to society. The order as I see it is: House, Car, Clothes, Phone. Jewelry goes in there somewhere.Each of these products is trying to convince you of their value, excess value reall	chimi	5.633433	3.7175913	comment	3.0	11.5	1571688317	-15.06561
21523201	Spending $20K on a ring is ridiculou	Spending $20K on a ring is ridiculous.	jacquesm	5.647031	3.7016432	comment	3.0	21.5	1573647109	-15.091731
21528356	I don't know if it's so much about t	I don't know if it's so much about the money as it is something that she just... wanted. I'm Indian so its custom to gift the bride a lot of gold. She eschewed that happily in favor of a diamond ring that cost a fraction of the gold she was offered otherwise.B	puranjay	5.631152	3.7094502	comment	3.0	14.0	1573673121	-15.077193
17187359	Not fine with me.  If a girl wanted 	Not fine with me.  If a girl wanted a diamond ring and/or and extravagant wedding I'd dump her.  Materialistic, low IQ and shallow.  Though that's what most people are, I suppose.	Antimachides	5.621319	3.711704	comment	3.0	12.5	1527685787	-15.085872
29695281	Raytracing diamonds	Raytracing diamonds	pizza	5.6072073	3.7149482	story	3.0	131.0	1640545570	-15.070155
30043420	The most interesting part or me was 	The most interesting part or me was that the diamond came from 600km below the earth's surface. Maybe this is common knowledge, not for me. It's pretty cool to think that we have access to such things. If we could dig down that far, would there be an abundance	version_five	5.628072	3.7174003	comment	3.0	11.0	1642909449	-15.068002
30264906	Also known as the Kelly criterion. I	Also known as the Kelly criterion. If one possible outcome of an action is associated with a great enough loss, it doesn't make sense to perform the action no matter how unlikely the loss.	kqr	5.4077106	4.321756	comment	3.0	12.5	1644355396	-14.819374
30269471	This is a common misconception. The 	This is a common misconception. The Kelly criterion maximises growth when the wealth compounds multiplicatively. It makes no assumption about the shape of utility.In other words, it's prescriptive, not descriptive. The Kelly criterion says that if you want to 	kqr	5.408022	4.321594	comment	3.0	10.5	1644386538	-14.81396
18485184	The the main flaw of the kelly crite	The the main flaw of the kelly criterion (along with a number of other results in investment theory like Markowitz allocation) is that in practice it's extremely difficult to know the distribution of the result you're betting on.The mean and variance of a pros	soVeryTired	5.406211	4.3216352	comment	3.0	10.5	1542620869	-14.829232
38789293	Gems isn't good also because it's mo	"Gems isn't good also because it's mostly aesthetic. No intrinsic utility other then being rare and pretty. You won't actually ""improve"" society with gems. It's hard to distill this in technical terms but I hope you're able to understand without the need to get"	corethree	5.611718	3.7202659	comment	3.0	11.5	1703730467	-15.072872
22210407	I also went with moissanite. My wife	"I also went with moissanite. My wife (then girlfriend) was in the ""2-3 months salary for a diamond"" camp which I find incredibly crass. Saved $15k on the diamond by going with moissanite and spent a fraction of that on getting a nice custom ring + wedding band"	CrazyStat	5.611899	3.715888	comment	3.0	12.0	1580564022	-15.088593
39599792	I don't know for certain, but the tw	I don't know for certain, but the two major faults of Diamond are first, that his framework for anthropology is perpetuating beliefs that are antithetical to modern anthropology, and second, that he is extremely resistant to following up with new advances in a	jcranmer	5.7579737	3.6491508	comment	3.0	11.5	1709616713	-12.807299
16513225	Diverging Diamond Interchange comes 	Diverging Diamond Interchange comes to Washington State (2016) [video]	anonu	5.618117	3.7209988	story	3.0	14.0	1520136798	-15.070836
16551371	If you ever want a proof that the ma	If you ever want a proof that the market can be utterly irrational, look no further than:> The arrival of lab-grown diamonds has challenged the widely-held assumption that diamond prices could only go up	vanderZwan	5.609748	3.720891	comment	3.0	18.5	1520600060	-15.074781
24778385	My favorite quote:> Over the course 	My favorite quote:> Over the course of their research, the team busted many dozens of $3,000 diamond pairs. “That’s the biggest problem with our research, the diamond budget,”	yboris	5.605915	3.7211366	comment	3.0	16.5	1602692550	-15.073248
24778582	This was achieved in a diamond anvil	This was achieved in a diamond anvil cell, a sample smaller than a millimeter is squeezed between two diamonds in a special apparatus.  This is how you achieve world record high pressures, not even remotely in the realm of possibility for engineering a materia	colechristensen	5.6684594	3.697551	comment	3.0	11.0	1602693460	8.516704
24778683	Sounds like prices for gem cut diamo	Sounds like prices for gem cut diamonds, which brings in the whole DeBeers monopoly pricing. I wonder why manufactured or rough cut diamonds couldn't be used.	darksaints	5.6057143	3.72128	comment	3.0	15.0	1602693898	-15.070543
25158911	"""Artificial"" diamonds.Unless I've mi"	"""Artificial"" diamonds.Unless I've misread something, these are genuine diamonds. IE, carbon crystals.""Artificial"" makes people think of moissanite and similar materials."	billpg	5.6098495	3.7167785	comment	3.0	11.5	1605865688	-15.075412
25158663	Perhaps this will finally disrupt th	Perhaps this will finally disrupt the expensive diamond buying for engagements.	apples_oranges	5.6069846	3.7218437	comment	3.0	16.0	1605863092	-15.072167
23519840	Well, if a single company manages to	Well, if a single company manages to own all the piles of diamonds, they could artificially limit supply to keep prices high.	umvi	5.607925	3.720806	comment	3.0	11.5	1592158172	-15.064754
37397218	De Beers basically controls the whol	De Beers basically controls the whole diamond market. They make it almost impossible to resell them and strictly control the supply. They were also responsible (via advertising agency N. W. Ayer) for the idea that diamonds should be used in engagement rings in	arcticbull	5.6041694	3.7230923	comment	3.0	12.0	1693945505	-15.075448
37397814	> Shiny carbon is shiny carbon to me	"> Shiny carbon is shiny carbon to meYou're only considering intrinsic value. That's helpful for raw commodities.For nearly everything else, value is tied to perception, history, etc.If I have two identical baseballs, they're both ""just"" baseballs. But one of t"	jaaron	5.6108828	3.7181835	comment	3.0	10.5	1693948310	6.45651
37400163	Yea lab grown diamonds are insanely 	Yea lab grown diamonds are insanely cheap. You can buy them on Alibaba. A 3 carat, D VVS1 with an excellent cut is $3K.	rcme	5.6058636	3.7220368	comment	3.0	10.5	1693962820	-15.066162
26089206	That is true of a lot of things. Wou	That is true of a lot of things. Would diamonds or gold be as valuable if people didn't think it was a store of value?	samfisher83	5.6357245	3.7253993	comment	3.0	12.0	1612965817	-15.046066
20558092	The term you use, “a synthetic stone	The term you use, “a synthetic stone”, is odd considering it actually is a diamond.I mean, if the gold in the ring was not mined from the earth, but instead extracted from seawater (it’s a thing), would you call that not “gold”, but “a synthetic metal”?What ab	teddyh	5.608389	3.721384	comment	3.0	13.0	1564426790	-15.073776
20557747	Diamonds have had their supply artif	Diamonds have had their supply artificially restricted for decades, inflating their prices. That, combined with the ethical dilemmas (blood diamonds, etc.) associated with the stones, it doesn't make sense to me to get them. They don't even look prettier than 	Konnstann	5.6071305	3.7197268	comment	3.0	10.5	1564424971	-15.070488
20798429	Yellow diamonds? Sorry but unless th	Yellow diamonds? Sorry but unless the diamond is clear its considered inpure and into the bin it goes.Then marketing got involved. Now yellow diamonds are a thing. Dont fall for it.	spookware	5.6061	3.7190688	comment	3.0	12.0	1566811904	-15.075753
33685533	he had some twitter thread two years	he had some twitter thread two years ago where he was talking about betting five times [what the gambler’s formulation of the kelly criterion would suggest], which is bug fuck insane and would’ve had me shorting him immediately if i’d been aware of it and coul	sigstoat	5.4140778	4.319387	comment	4.0	12.0	1668979691	-14.8229
26835665	A simple description of the Kelly cr	A simple description of the Kelly criterion is that if you want to grow wealth over a long period time, at each decision point take the one that maximizes your average expected log wealth.I'm trying to use it in real life, though sometimes the decisions are qu	xiphias2	5.4117684	4.3208694	comment	4.0	15.0	1618589292	-14.821609
26835931	How did you apply Kelly to a HFT str	How did you apply Kelly to a HFT strategy? Usually those strats don't have a binary outcome so standard Kelly wouldn't fit.	fighterpilot	5.405971	4.322143	comment	4.0	16.0	1618590521	-14.823114
27035878	If you are on the same page as your 	If you are on the same page as your partner, you'll have no trouble sorting this thing out.  In my case I bought a joke ring that cost me about 2$ in a toy store.If you are not on the same page as your partner, you have more important concerns than a stupid ri	enriquto	5.6486454	3.7099612	comment	4.0	11.0	1620123700	-15.06727
27036086	There was an article the other day t	There was an article the other day that talked about the resale value of diamonds. Basically jewelers refuse to buy back diamonds at any reasonable price (compared to original retail value. And refuse to make new rings with old diamond etc. So there is very li	tda	5.60773	3.7202926	comment	4.0	14.0	1620125265	-15.073266
27036409	> at a fraction of the costThat migh	"> at a fraction of the costThat might also be the reason. If something is cheaper, it feels inferior.Also with diamonds it's probably a factor that the fiancé is expected to present serious intents with a deeper monetary investment. ""Look honey, it's an ethica"	tiborsaas	5.620345	3.7125635	comment	4.0	10.5	1620127752	-15.079965
27036464	Diamonds are precious partly because	Diamonds are precious partly because they're rare. If you find a way of 'making' a diamond it loses some of that value. It's interesting to me that someone would even try making a comparison between a precious stone and something like water/ice which is mostly	veltas	5.607694	3.720426	comment	4.0	10.5	1620128246	-15.104085
27036795	Alternate view: Almost everything in	Alternate view: Almost everything in life is ridiculous when you view it with cold logic. It's utterly ridiculous to put golden balls on a fake tree in your house every year, but due to societal constraints most people in Western societies do it.Your SO probab	KennethPT	5.624177	3.7092276	comment	4.0	11.5	1620131068	-15.066246
12944727	"""The big difference between moissani"	"""The big difference between moissanite and diamond is that moissanite can be manufactured reliably and efficiently in a laboratory.""Thats not true, diamonds can be manufactured reliably and efficiently in a laboratory as well. And its nearly impossible to tell"	diamond1	5.604172	3.7234385	comment	4.0	12.0	1479061342	-15.075243
12944729	A $2000 ring is cents per day for a 	A $2000 ring is cents per day for a long marriage.66% of marriages survive 10 years. The ring would cost 50c per day.Buy the ring, and spend less of coffee.	DanBC	5.6320577	3.7076638	comment	4.0	13.0	1479061345	10.626154
12944934	We were engaged in 2006 and I forwar	We were engaged in 2006 and I forwarded that article to my soon to be wife. Her answer was: I don't think this is funny. I ended up buying a 10k diamond ring. We're still happily married with 1 beautiful 8 y.o. daughter. Ask any married guy and they'll all say	vpayette	5.623109	3.7123764	comment	4.0	11.5	1479063564	-15.083235
12944977	Did you get to the point of explaini	Did you get to the point of explaining why you're against diamonds? Was she able to tell you why she wants a diamond in particular? To resolve this issue it would be good to exchange the exact, real reasons why one side wants the diamond and the other doesn't.	TeMPOraL	5.615258	3.7155583	comment	4.0	24.5	1479064005	-15.081835
12945077	> having to explain to friends and a	"> having to explain to friends and acquaintances why she does not have a diamond.I don't think this is a universal ""in America"" thing. Maybe in some parts of the country, but here in the northeast it seems like it's none of their business; I can't imagine aski"	stephencanon	5.623854	3.7088966	comment	4.0	11.0	1479064879	-15.073995
12945553	> So if she insist, don't be angry a	> So if she insist, don't be angry at her - be angry at De Beers.I completely agree. My fiancé and I are currently two engaged Americans, and we had a couple conversations about how we envision our wedding ceremony to happen. For the most part, we had very cas	jakebellacera	5.6169605	3.7137604	comment	4.0	12.5	1479069860	-15.081179
12945817	Right, I read that as your SO dictat	Right, I read that as your SO dictating to you that you must give her a diamond. My apologies.	lacampbell	5.6226683	3.7092507	comment	4.0	13.5	1479073048	-15.081034
12945818	I dunno, I don't think it's that sim	"I dunno, I don't think it's that simple. For one, the ""respect your values"" arguments goes both ways: she values a diamond, he doesn't. If she insists on a diamond, she's not respecting his values. If he insists on no diamond, he's not respecting hers.It's ver"	somestag	5.6216455	3.7122872	comment	4.0	15.0	1479073062	-15.045548
13085757	Not all diamond types/classes are be	Not all diamond types/classes are being manufactured.  Synthetic diamonds will always be different from natural stones specifically because they lack natural imperfections.  Not everyone wants perfection.	sandworm101	5.6084476	3.7219102	comment	4.0	11.5	1480649527	-15.075089
13143821	Kelly Criterion in detail	Kelly Criterion in detail	dedalus	5.4069433	4.3220844	story	4.0	61.0	1481339902	-14.837468
27808370	Diamonds are sometimes absurdly expe	Diamonds are sometimes absurdly expensive with no valid reason. Do you believe this justifies robbing diamond stores?	unishark	5.6075015	3.720952	comment	4.0	20.5	1626079898	-15.074284
