id	x	y	type	relevance	size	year	umap1d	hovertext	url	author
15300360	5.608503	-2.309803	comment	3.0	10.5	1505964056	15.070744	"Please identify one concrete computing action that I cannot do with Linux/Windows/Mac that Urbit enables.In other words, what is Urbit's ""Killer Feature""? Cause I'm not seeing one.And a runner up ques..."		occultist_throw
15300411	5.6533346	-2.3329165	comment	3.0	19.0	1505964973	15.047117	"> ""A value in Hoon is called a noun"" - or you could just call it a value.A ""value"" sounds like an abstract concept.  A noun is one of two things: a natural number or a pair of nouns.  Calling it a ""va..."		pcmonk
15300510	5.618573	-2.3126366	comment	3.0	12.0	1505966569	15.065054	Do you have something in mind? Using GNU Social as a convient whipping-post, it's built on PHP and MySQL and Salmon and PubSubHubbub and...The point of Urbit is to be a cobherent, self-contained platf...		chc4
15688179	5.610014	-2.3081613	story	3.0	27.0	1510594396	15.058664	Urbit and the blockchain wars	https://urbit.org/blog/2017.9-critique/	amingilani
27269576	5.6226377	-2.2989943	comment	3.0	16.0	1621889648	15.06437	The only good thing about Urbit are the Jorge Luis Borges references.Fun fact, the creator of Urbit, Curtis Yarvin, is a far-right blogger with some pretty crazy ideas:http://distributedweb.care/posts...		captainmuon
22676133	5.6123075	-2.3082733	story	3.0	16.0	1585068142	15.065735	Urbit Is for Communities	https://urbit.org/blog/urbit-is-for-communities/	jlehman
23037512	5.6209793	-2.3210473	comment	3.0	31.5	1588289543	15.065494	Just out of curiosity, have you verified in some way that your alternative is legitimate? (Like maybe there are some contexts you haven't considered where other aspects of Nock are necessary.)If so, a...		westoncb
23037588	5.623984	-2.297975	comment	3.0	18.5	1588290312	15.0614	It's intentionally obscure, I believe the stated reason was that moldbug only wanted people to use Urbit who have buy-in in the form of having spent/wasted a significant amount of time and effort		Lewton
12003548	5.6082673	-2.30935	comment	3.0	10.5	1467224660	15.07149	I find the original blog posts [1] a really interesting read. Nowadays Urbit is indeed full of buzzwords, “your personal cloud computer” and the like. But initially, Urbit was this [2]:> Urbit is a ne...		Ruud-v-A
13595075	5.625458	-2.3128138	comment	3.0	14.0	1486519675	15.061018	Thank you for the comment. It is nice to be able to talk to someone who believes in Urbit ideal. I have a question for you: there are many advantages of running things on huge scale. How do you see Ur...		theamk
18908054	5.612925	-2.3116992	story	3.0	49.0	1547514087	15.066896	Urbit / Primer (2019)	https://urbit.org/primer/	networked
31933983	5.6135454	-2.309516	comment	3.0	10.5	1656603394	15.066088	For those that haven’t checked it out the ideas behind urbit are really interesting, it’s the first attempt I’ve seen to get us out of the local maximum of centralized web services we’re trapped in wh...		fossuser
31934026	5.6142936	-2.3040154	comment	3.0	12.5	1656603529	15.064352	OK, but that doesn't actually refute my central point, that Urbit is a cult.  One of the hallmarks of cults is that they invent a private language that helps identify the in-group.  Obviously I am not...		lisper
39624886	5.704213	-2.238051	story	3.0	46.0	1709783567	15.038418	Well-Known URIs	https://www.iana.org/assignments/well-known-uris/well-known-uris.xhtml	Lwrless
25280725	5.622438	-2.3016274	comment	3.0	19.0	1606938749	15.058382	"Yes but AFAIK he is no longer with them.In any case look at it for its technical merit not the politics of its founder. If you're going to eschew any tech founded by someone with... shall we say ""inte..."		api
25281741	5.6127944	-2.3077164	comment	3.0	15.0	1606943682	15.066284	If you're wondering whether there is something of value hiding underneath all of the obscurity and if it might be worth your time to do a deep dive, IMHO the answer is a resounding no.  There is nothi...		lisper
31123432	5.6135325	-2.306648	comment	3.0	16.0	1650643649	15.065138	"Worth noting that urbit is, as one poster on hacker news put it, ""purposefully obfuscated""https://news.ycombinator.com/item?id=11852141and its parent company was named after a short story by Borges wh..."		pabl8k
24269016	5.6151085	-2.3107717	comment	3.0	12.5	1598341680	15.04833	I think this is a good idea and I think making it easy for people to host their own services is valuable. [0]It’s also been tried a few times with little success (sandstorm.io).I think the problem is ...		fossuser
26665461	5.618458	-2.3132164	story	4.0	15.0	1617308055	15.0694895	Urbit: A clean-slate OS and network for the 21st century	https://urbit.org/	mikece
27268954	5.617198	-2.3081384	comment	4.0	18.0	1621886160	15.067769	While the Urbit tech stack is clearly insane (some say it’s on purpose), The urbit identity layer is interesting and useful. You basically buy your username as a NFT, and that username is bound to sig...		fvdessen
27269061	5.6094623	-2.309964	comment	4.0	18.5	1621886711	15.0668125	Urbit is a prank that has somehow lasted for a long time. If you look at their version of machine code, Hoon or whatever its called, it's purposefully obfuscated so that, just to add two numbers together requires I think 4 different instructions. I did my OS class final project on it 6 years ago...		mjfl
13594298	5.6094823	-2.3076813	comment	4.0	12.5	1486511885	15.066146	I remain unsure whether Urbit is a real thing or simply an incredibly long-running satire. Their missives do nothing to clarify this point.		jff
13594331	5.6106095	-2.3077826	comment	4.0	23.0	1486512380	15.06146	Someday I hope to understand what urbit actually is :-)		newsat13
12003695	5.611814	-2.3104115	comment	4.0	12.5	1467225899	15.065686	urbit dev here: we completely agree that we need to have useful apps on top of it. We have an alpha for super simple wordpress-like hosting (in fact, the urbit.org site uses it!). All you have to do i...		hault
18908314	5.6222024	-2.312754	comment	4.0	11.5	1547517831	15.063535	"Isn't the exact same political opinion ""encoded"" in IPv4, and/or the continued use thereof? It seems weird to complain about Urbit specifically when it's just perpetuating such a long-standing practic..."		zozbot123
22858550	5.6132097	-2.3054805	comment	4.0	17.0	1586802816	15.0649	"Perhaps it's a matter of perspective, but I don't see it as derogatory.  Rather I see it as a reflection of the way which questions about Urbit are typically asked.  I.e. ""Can someone explain what Urbit is and why it's relevant to a normal person like myself?"""		lliamander
23035181	5.6116877	-2.3071845	comment	4.0	17.0	1588275551	15.066289	Urbit is such a niche product that totally ignores the average consumer it's essentially dead on arrival.They struggle to explain it to technical people. Imagine trying to explain this thing to your m...		0xy
23035443	5.625903	-2.3018272	comment	4.0	11.0	1588277045	15.044984	It’s a scam.They have 2^32 “planets” (a UUID that you can use to interact with the Urbit network), that they are each trying to sell for ~$10-$20 on a cute “exchange”:  https://urbit.live/(Of course y...		GuiA
23037782	5.6133175	-2.3052459	comment	4.0	17.5	1588291956	15.065219	In this aspect and many others, Urbit is reminiscent of Scientology.		pavlov
23037838	5.6819015	-2.3864481	comment	4.0	17.5	1588292361	15.062867	Hmm, I looked around on that post at all the parts referring to Nock and I still don't see anything that would convince an impartial reader of what you're saying.Are you taking issue with the style/la...		westoncb
37058151	5.6149936	-2.3069425	comment	4.0	16.5	1691549231	15.064778	I am biased with my own opinion of Urbit, as I’ve been visited by similar muses desiring similar results. Urbit to me today in its path and form resemble an ontological existential crisis resembling s...		pyinstallwoes
25153988	5.614246	-2.302937	comment	4.0	13.5	1605817854	-3.7935686	No it doesn’t Urbit is slow and offers no anonymity. It’s not a realistic project, just a naive person’s implementation of using symbology to “cash-in” on something that is artificially made to seem e...		trianglem
25281187	5.6305366	-2.289212	comment	4.0	11.5	1606941240	-5.587772	Yarvin was quite explicit about creatively embedding neo-reaction in the design.  The most obvious is the hierarchical finite namespace -- you receive your identity from an authority, and the authorit...		michael1999
25281191	5.617685	-2.3052495	comment	4.0	12.0	1606941243	15.063474	Urbit feels more like an ARG than a serious project. You need to buy into what feels like an entirely new language and religion.It has some real TempleOS vibes.		mmastrac
15300257	5.6136723	-2.309984	comment	4.0	34.5	1505962431	15.066448	I'm one of those people that get it, so I'll try to explain it without going off the deep end and waxing poetically about planets or whatever.Urbit is a platform for building decentralized apps. To th...		chc4
15300451	5.611578	-2.3098524	comment	4.0	18.5	1505965587	15.070559	Right, but you could do that with any P2P overlay network with any embeddable VM. Why use the very unorthodox one that Urbit came up with? I really think that's the question people are asking when the...		tptacek
21673636	5.610637	-2.3079357	comment	4.0	10.5	1575170668	15.065449	It may be marketing genius if the goal is to appeal to the type of nerd who loves obscure systems and occult jargon... the kind that geeks out on the complexities of D&D while chatting you up about th...		api
21674003	5.608719	-2.303638	comment	4.0	12.0	1575178036	15.067452	"Is this some kind of over-the-top joke that I'm not in on? I've browsed and read but honestly still can't understand what Urbit is. When I saw the picture of the stone with the thing on top I thought I was finally ""in"" on the joke, but they seem to continue on."		Rainymood
31933624	5.6097183	-2.2925615	comment	4.0	24.0	1656602311	15.059683	Just in case you're wondering whether Urbit is worth looking into, let me save you the trouble: no. Just, no.  Urbit is a cult.  All of its artifacts are deliberately obfuscated in order to instill a ...		lisper
28743181	5.6124926	-2.3092468	comment	4.0	14.0	1633322720	-8.919825	>If Urbit were reimagined in 2021, it would be running on Sia or Ethereum: your data is stored on the blockchain, your applications are running as perpetual smart contracts, and you can access it from...		drfxyjhdyfrhgc
28743300	5.6117296	-2.3097978	comment	4.0	10.5	1633324085	15.065288	>Is there actually a third option? I'm wondering of the author simply misunderstands Ethereum.The issue is Urbit bills itself as 'decentralized' but isn't. If you buy Ethereum and disconnect from the ...		weare138
13594945	5.610058	-2.3104835	comment	5.0	21.0	1486518177	-8.916938	A couple thoughts from an early backer who really, really wants Urbit to succeed (and fears it won't):1. What is Urbit?I'm not involved with it and don't speak for the devs, but this always comes up, ...		ThrowAway123543
12003312	5.608924	-2.3083084	comment	5.0	12.5	1467222860	15.068515	"I might be misunderstanding Urbit (quite easy it seems), but this idea of selling off what is essentially ""land"" seems to go against some of the ideas that it pushes - i.e. the democratisation of the ..."		danpalmer
23035185	5.6137557	-2.306077	comment	5.0	24.5	1588275601	15.063564	"I searched ""Urbit"" in the HN archives. The old discussion is still relevant for a project as long-term as this, and the more recent you get the more Urbit is misunderstood or attacked simply for being..."		rkobeissi
23035381	5.6115456	-2.3069105	comment	5.0	19.0	1588276693	15.066462	Could you explain what Urbit’s main goals or purposes are?I feel like, for Bitcoin, the intent and outcome might not be perfectly aligned, but I get what it was for and how it is used.		phnofive
27268845	5.6080112	-2.3086374	comment	5.0	19.5	1621885586	15.06703	I don't know much at all about Urbit, but this doesn't seem like it was written in good faith tbh.The mention of security holes seems to be the only real serious critique. Hopefully some urbit people ...		voldacar
15300408	5.6138296	-2.3125043	comment	5.0	22.5	1505964916	15.103345	This is a good, well-written explanation of the most reasonable, mainstream aspects of Urbit, leaving the impression that it's essentially like a P2P version of AWS Lambda.But of course, that's not al...		tptacek
31123643	5.612634	-2.3083255	comment	5.0	18.5	1650644386	15.067722	I'll try.  First, what it is:  Urbit is a virtual machine OS for server-side applications. If you imagine a future in which it is common for non-technical people to rent cloud server space on which to...		ineptech
31500684	5.6598344	-2.3010547	story	5.0	45.0	1653453716	-12.5883875	Plundervolt (2019)	https://plundervolt.com/	pmoriarty
21674628	5.612078	-2.3067372	comment	5.0	16.0	1575191015	15.063808	The goal is noble, but Urbit is destined to become a case study in the dangers of isolation and obstinacy.This project has gone so deep into its own inner sanctum that they've lost tabs on wider reali...		cookiecaper
21673003	5.6607294	-2.2971153	comment	5.0	34.0	1575160476	15.065021	The project founder’s wikipedia page:https://en.wikipedia.org/wiki/Curtis_YarvinIt has leaked over to the project WP page:https://en.wikipedia.org/wiki/UrbitI personally choose not to run this software or support this project. YMMV.		sneak
18908159	5.607777	-2.3057694	comment	5.0	16.5	1547515698	15.065018	For those out of the loop as I am, what is Urbit?		saagarjha
37058155	5.614456	-2.3052568	comment	5.0	17.0	1691549287	15.06567	Okay, I tried to read some of this, just like I tried once years ago to look at what is Urbit, and I don't get it. Maybe it's profound, but if you can't write roughly two paragraphs that clearly describe it, I'm out.		ks2048
37059296	5.6475644	-2.286161	comment	5.0	17.0	1691561979	-1.7058069	It's disappointing how much low-effort bashing there is in this whole thread.  Sure urbit is weird and has a lot of baggage and questionable design decisions, but the project we're discussing is expli...		hn_urbit_thr123
25281295	5.611494	-2.3089	comment	5.0	15.5	1606941697	15.066581	OK, I have to ask this time : could someone ELI5 what Urbit is / could be useful for?		MaanuAir
21673121	5.6059623	-2.3065176	comment	6.0	29.5	1575162341	15.067448	"I have seen Urbit a couple times but never really understood it.  From the ""Understanding Urbit"" page ->Imagine that you can login from anywhere with one name and password.>And when you do, your entir..."		ALittleLight
22911727	5.624035	-2.3104362	comment	6.0	15.0	1587249757	15.064988	Where do Nock and Hoon belong (from Urbit, for those who are out of the loop)?		wolfgke
27269365	5.616542	-2.3099933	comment	6.0	25.0	1621888393	15.06504	I also did a deep dive on Urbit a few months back (shameless plug: https://blog.janissary.xyz/posts/urbit), and I really agree with the author for the most part.Definitely the most concerning part of ...		_peeley
15299972	5.611228	-2.307558	comment	6.0	68.0	1505958578	15.050544	"Every time I read something about Urbit I am reminded of the Lewis Padgett short sci-fi story, ""Mimsy Were The Borogroves"" [0], [1] describing children discovering alien future toys, and subsequently ..."		aeontech
25405594	5.6131306	-2.3056428	comment	6.0	16.5	1607855497	15.067268	A lot of people always complain about how hard it is to figure out what Urbit is, but I'm pretty sure the obfuscation is part of the plan.I've been following Urbit for a while now (maybe 6-7 years?), ...		scotchmi_st
16816764	5.617773	-2.3047652	comment	7.0	23.0	1523489473	15.065553	Hi all, Peepeth creator here. Would appreciate your thoughts.https://www.reddit.com/r/ethereum/comments/87k9iz/presenting...https://www.producthunt.com/posts/peepeth		bevan
14363339	5.6104627	-2.3101628	story	7.0	21.0	1495059685	15.065722	Ask HN: Urbit Sale – will you be buying?		abstractbeliefs
31124343	5.6077886	-2.311028	comment	7.0	24.0	1650646541	15.069188	FWIW here's an explainer I wrote up a year ago for a friend who asked.  I'm not affiliated with urbit, except that I want a product that does what it does (which at this point means I'm hoping someone...		hn_urbit_thr123
23035132	5.612064	-2.3073058	comment	9.0	28.5	1588275265	15.067762	I've been told what Urbit is about 10 times now and I still don't fully get it.		type02
25280963	5.6145577	-2.3061802	comment	9.0	29.0	1606940004	15.06612	While I’m not convinced Urbit is a good idea, its extreme arcanity actually has a pretty solid justification: keeping out entryist parasites. It’s extremely difficult to fake Urbit expertise to Urbit ...		centimeter
12003388	5.610108	-2.3096905	comment	11.0	43.5	1467223423	15.066826	"Can someone give a synopsis of Urbit? Every time Urbit comes up, I skim their website but get pretty lost in marketing-speak. I see a lot of ""control your data"", ""digital freedom"", and ""general purpose computing"" without any short, to the point explanation of what the heck it's all about."		wille92
37057471	5.612626	-2.3085265	story	12.0	48.0	1691542586	-12.579421	Plunder and Urbit	https://gist.github.com/wicrum-wicrun/b308b298721ccbe0de9c6c73a6ee4242	walterbell
15299442	5.6098876	-2.3083787	story	12.0	158.0	1505951746	15.06925	Bootstrapping Urbit from Ethereum	https://urbit.org/blog/2017.9-eth/	zwtaylor
28742537	5.612507	-2.3074768	story	16.0	68.0	1633316406	15.0645895	An Honest Look at Urbit	https://jayriverlong.substack.com/p/36-an-honest-look-at-urbit	riverlong
13594025	5.6098633	-2.3089302	story	16.0	141.0	1486509964	15.0715475	Urbit in 2017	https://urbit.org/blog/2017.1-update/	alfredxing
25280006	5.6124763	-2.3078945	story	17.0	73.0	1606935659	15.067313	Urbit Precepts Discussion	https://urbit.org/blog/precepts-discussion/	dedalus
31122532	5.6070976	-2.308592	story	20.0	62.0	1650640120	15.066312	Urbit Takeoff Is Here	https://hatryx-lastud.tlon.network/newsletter/urbit-takeoff-is-here	AngelusNovus
22858154	5.6337967	-2.3279748	story	20.0	70.0	1586800537	15.064616	Urbit for Normies	https://urbit.org/blog/urbit-for-normies/	goranmoomin
25404575	5.610449	-2.3081093	story	21.0	79.0	1607838110	15.064683	Who Owns the Stars: The Trouble with Urbit	http://distributedweb.care/posts/who-owns-the-stars/	deegles
12003142	5.610959	-2.3095138	story	27.0	105.0	1467221298	15.068129	Urbit Is Building a 'Virtual Galaxy' for Bitcoin Nodes	http://www.coindesk.com/urbit-developers-bitcoin-node/	beefman
