id	label	hovertext	author	x	y	type	relevance	size	year	umap1d
26507384	If it's a prion disease, they someti	If it's a prion disease, they sometimes take years or possibly decades to develop.The big question is how they were all infected. Is it in the food supply (meat, milk)? Was it tainted blood donations?42 people is a lot of people... The vCJD outbreak in the 90s	JauntTrooper	6.905511	6.018883	comment	3.0	16.5	1616100520	14.902012
14789345	I know this because I have taught yo	I know this because I have taught yoga classes for years. There you tend to meet a lot of people who have tried to find help for their health issues and try yoga as a last resort. Unfortunately yoga isn't a cure for lots of people either.But just listen to the	maxxxxx	6.988877	6.3051167	comment	3.0	10.5	1500304824	-13.718361
27524693	Have you been tested for Lyme Diseas	Have you been tested for Lyme Disease?  I know several folks with it, and they had very awful times (unnecessary surgery even) getting diagnosed.	kevmo	6.9928207	6.321228	comment	3.0	14.0	1623815289	-13.735909
27551697	Prions are scary, but the fact that 	Prions are scary, but the fact that prions have presumably existed for just as long as life has existed on Earth, there must be something that keeps prions from replicating out of control and causing mass death and extinctions.	BitwiseFool	6.8970146	6.0246096	comment	3.0	11.0	1624031837	14.905918
15687070	But isn’t Lyme disease just in the e	But isn’t Lyme disease just in the eastern us?  How would 70% of worldwide alz sufferers acquire it?	mrfusion	6.9916553	6.32939	comment	3.0	10.5	1510586704	-13.708263
38063290	A recent occurrence I will share rel	A recent occurrence I will share related to this was having to convince my doctor that I had Lyme disease. I Googled the symptoms, saw the trademark bullseye, and of course concluded that I had Lyme disease. It was right where I got the tick bite, 8 weeks late	SOLAR_FIELDS	6.995154	6.317156	comment	3.0	12.5	1698617000	12.010627
38066607	This happens with protein folding in	This happens with protein folding in the body as well, leading to prion diseases such as Creutzfeldt-Jakob disease.Once the badly folding protein is introduced there is no way back.https://www.hopkinsmedicine.org/health/conditions-and-diseas...	Benjaminsen	6.912534	5.8999515	comment	3.0	12.5	1698651210	14.90088
26863517	Agreed.  Prions almost strike me as 	Agreed.  Prions almost strike me as an interesting boundary condition for stupid behavior.  But if most of the world's meat supply becomes effected by prion caused diseases (think: Chronic Wasting Disease https://www.cdc.gov/prions/cwd/index.html ) then I thin	danesparza	6.917176	6.015741	comment	3.0	10.5	1618844740	14.905377
26863637	Prions are pretty scary, but I think	"Prions are pretty scary, but I think there are a lot of things this article gets wrong.- Prions are resistant to sterilization (since there is nothing to ""kill""), but simple soap and water are still highly effective- Prions don't ""last forever"". They can live "	legitster	6.909083	6.0237217	comment	3.0	18.5	1618845302	14.904322
27048250	I do wonder if it’s possible that va	I do wonder if it’s possible that vaccines that are designed to make the body produce certain parts of the spike protein could lead to prion diseases accidentally.  Are we sure of the proteins coded for and also that this coding can’t produce misfolded protein	andy_ppp	6.892117	6.0245056	comment	3.0	12.0	1620210617	14.90336
27100434	The Lyme Disease Vaccine	The Lyme Disease Vaccine	luu	6.9898458	6.3313603	story	3.0	26.0	1620599511	-13.70705
17026933	The incredibly frustrating reason th	The incredibly frustrating reason there’s no Lyme disease vaccine	klipt	6.9898963	6.3333497	story	3.0	20.0	1525831340	-13.722912
28208583	> That only happens in 30% of cases 	> That only happens in 30% of cases though.According to the CDC, its 70-80%[0].[0] https://www.cdc.gov/lyme/signs_symptoms/index.html	sva_	6.989524	6.3286843	comment	3.0	11.0	1629198701	-13.730178
28208710	Take a look: https://www.frontiersin	Take a look: https://www.frontiersin.org/files/Articles/628045/fneur-12-6...These are spirochetes in the brain/spine of a dead patient who had proven lyme diagnosis, has been given the standard treatment in the past, never recovered, developed dementia, died.F	inter_netuser	6.988292	6.3260326	comment	3.0	21.0	1629199803	-13.72098
28207913	The article touches this briefly: I 	The article touches this briefly: I think it's horrible that the antivax movement successfully managed to push a working lyme vaccine off the market, based on concerns that turned out to be false.Every time you get a tick you should remember that you could be 	hannob	6.991455	6.3311877	comment	3.0	29.0	1629193213	-13.717678
28214530	I grew up in CT. Had it 4 times, onl	I grew up in CT. Had it 4 times, only got the bullseye once.  It is no joke, and as you get older it seems to suck more and more. Last time I had numbness in my face as the only symptom, but...thrice bitten, fully paranoid, and I was treated pretty fast.One th	abakker	6.9997487	6.322512	comment	3.0	10.5	1629232418	-13.730546
27983668	Scary.I think and airborne human tra	Scary.I think and airborne human transmissible prion disease that kill in a few years is the kind of event that can bring our society back to prehistoric living in just a few decades. Hope it never happens.	marcodiego	6.911596	6.01943	comment	3.0	14.0	1627479961	14.902898
27983699	"The word ""prion"" is actually a contr"	"The word ""prion"" is actually a contraction of the words ""protein"" and ""infection"". (edit: although I agree it's not what one might conventionally think of as an ""infection"")"	jamespwilliams	6.8937435	6.0245237	comment	3.0	11.0	1627480189	14.9038315
12147309	Visiting physician sheds new light o	Visiting physician sheds new light on Lyme disease	kungfudoi	6.989623	6.32757	story	3.0	51.0	1469227478	-13.7097
39183784	It mentions brain proteins contamina	It mentions brain proteins contaminating it, makes me think of prions.	diob	6.895452	6.0129557	comment	3.0	17.5	1706568093	14.904775
29740368	I think the problem is that the main	I think the problem is that the main way of testing for Lyme is to test for the antibodies. So what if you fall in the 20%? How will you know? You'll still end up being treating whether vaccinated or not.	giantg2	6.9910207	6.326249	comment	3.0	16.0	1640892228	-13.729178
30022891	Human transmissible prions are the m	Human transmissible prions are the most terrifying non-extinction level event I could imagine for humanity.Prion diseases like mad cow kill within one year after 5-10 years of infection.The massive wave of death and terror would end society as we know it	diordiderot	6.909963	6.019052	comment	3.0	11.5	1642770244	14.9041815
30559621	The article mentions it’s a prion or	The article mentions it’s a prion or prion-like. Kinda scary. Does our immune system not have any way to fight prions? If not then presumably vaccines wouldn’t work against them either.	programmarchy	6.897645	6.0269694	comment	3.0	18.0	1646424019	14.897792
18648928	I don't think that's true. Prions ar	I don't think that's true. Prions aren't bacteria or viruses that evolve and transmit. They're mostly just a misfolded protein that occurs spontaneously. (They can then be transmitted.)I'm not sure there will ever be a prion that hasn't already existed, wherea	mattmaroon	6.894852	6.0262156	comment	3.0	11.5	1544458770	14.903014
18649245	The example in the article has very 	The example in the article has very little transmissive ability because it grows in the brain and eyes.  If there were a respiratory prion disease that could be much different.  By nature of being a protein they are simpler and harder to eliminate than bacteri	travisoneill1	6.8944545	6.0241704	comment	3.0	13.5	1544461132	14.907259
18653241	A Prion Love Story (2013)	A Prion Love Story (2013)	lobo_tuerto	6.895338	6.0151463	story	3.0	64.0	1544500727	14.90709
19718691	> For example, prions in an infected	> For example, prions in an infected deer's feces could bind to soil taken up by plants, spread to its leaves, then infect another deer that eats the leaves.Terrifying. How old is this disease, and why is it only spreading now? Actually, there's not much in th	deogeo	6.9026794	6.0262866	comment	3.0	13.5	1555939457	14.902097
28722470	Prions are a minor risk when you eat	Prions are a minor risk when you eat them. So, maybe don't grow tomatoes on the grave of your loved ones. Though, I suspect that would actually be perfectly safe since plants don't tend to pass other pathogens despite what we feed them (i.e. manure).Otherwise,	jillesvangurp	6.908606	6.0226884	comment	3.0	12.0	1633116618	14.934478
20278637	My father nearly died of [what we be	My father nearly died of [what we believe to be] Lyme disease. A few years ago he started getting awful bouts of pain all over his body. He couldn't eat, was losing weight, was losing muscle mass fast. It got the the point where he was using a walker (he was l	robolange	6.9886513	6.325019	comment	3.0	24.5	1561494929	-13.73637
20279222	Surprised to see Lyme disease on HN,	Surprised to see Lyme disease on HN, since bringing affordable DNA testing for B. burgdorferi & other pathogens to the public is the startup I've been working on since 2014.Relevant Plug: https://www.tickcheck.com/As mentioned in other comments, serological te	stupidboy	6.9980564	6.319027	comment	3.0	14.5	1561498526	12.007984
36994191	> While most Lyme disease patients w	> While most Lyme disease patients who are diagnosed and treated early can fully recover, 10 to 20 percent suffer from persistent symptoms, some seriously disabling.There's no evidence that chronic Lyme exists:> There is no evidence to suggest that “chronic Ly	moeris	6.9877763	6.32782	comment	3.0	10.5	1691111497	-13.711888
36151529	There's a musician named Ren (@renma	There's a musician named Ren (@renmakesmusic) who was told for years that he had various psychiatric diseases and eventually it was discovered that he had an autoimmune disorder caused by Lyme disease. He writes songs about his experiences and how he thought h	PretzelPirate	6.9894547	6.3252068	comment	3.0	13.5	1685629786	-13.708975
36496890	Will the growing deer prion epidemic	Will the growing deer prion epidemic spread to humans? Why not?	sieste	6.949679	5.9944367	story	3.0	26.0	1687890878	14.9020815
14081015	I first heard about prions and Creut	I first heard about prions and Creutzfeldt-Jakob Disease after getting a letter saying I may have been exposed.I had surgery after someone with CJD, but before that person died, was autopsied, and diagnosed.That was over a decade ago.  So far no signs of it.  	metasean	6.912657	5.9995666	comment	3.0	12.0	1491847373	14.904751
14081463	No-meat diet is not 100% prion-proof	No-meat diet is not 100% prion-proof according to Wikipedia:> When researchers fed hamsters grass that grew on ground where a deer that died with chronic wasting disease (CWD) was buried, the hamsters became ill with CWD, suggesting that prions can bind to pla	hdhzy	6.924989	6.0158653	comment	3.0	19.0	1491850595	14.902358
14082098	Prions are not alive and therefore d	Prions are not alive and therefore do not need to compete for resources to further their existence.	jcoffland	6.894345	6.029036	comment	3.0	16.0	1491855008	14.907396
20493792	Anyone else highly suspicious about 	Anyone else highly suspicious about the release timing of this report in 2017? At the time when Lyme cases were picking up?	amriksohata	6.991549	6.329075	comment	3.0	16.0	1563744624	-13.731288
20494464	Slightly off-topic, but for anyone i	"Slightly off-topic, but for anyone interested, I did write up my own battle with Lyme, which went on for many, many years, till I found a simple solution:""How I recovered from Lyme Disease: I fasted for two weeks, no food, just water""http://www.smashcompany.co"	lkrubner	6.9871273	6.3306084	comment	3.0	13.0	1563753326	-13.721213
20493855	There’s a conspiracy theory that the	There’s a conspiracy theory that the us military is purposefully or accidentally responsible for Lyme as a bio weapon.Fun fact, things like bubonic plague were used during WWII. Japan had a plan scheduled to go off a few months after they surrendered (and thus	b_tterc_p	6.9875736	6.333639	comment	3.0	12.0	1563745429	11.95705
20532465	I'm sure there are some overzealous 	I'm sure there are some overzealous folks who are misdiagnosing themselves with chronic Lyme, but I think the author's attitude is a bit too dismissive. I have a close family friend who became paranoid after getting Lyme, and I have another friend who's sister	nosefrog	6.988755	6.3226447	comment	3.0	12.0	1564117235	-13.699736
26815549	Pfizer Covid-19 vaccine linked to pr	Pfizer Covid-19 vaccine linked to prion-based disease in vaccine recipients [pdf]	leopaacc	6.89936	6.027607	story	4.0	10.0	1618453570	14.935237
26863532	"I remember that in the 90s, when ""ma"	"I remember that in the 90s, when ""mad cow disease"" was dominating the headlines, it was predicted that there would be an exponential increase in cases, decades down the line. The same point about prions being virtually indestructible was being made, the same c"	incrudible	6.9043493	6.017614	comment	4.0	18.5	1618844803	14.903136
26863797	In order to evolve there has to be s	In order to evolve there has to be some kind of genetic information passed on to descendants. But for prions there is no such mechanism. A lower energy state is assumed and that's that.	im3w1l	6.884105	6.029849	comment	4.0	13.5	1618845998	14.904468
27048177	Prions terrify me as well because it	Prions terrify me as well because it seems like there's no stopping them..> In 2015, researchers at The University of Texas Health Science Center at Houston found that plants can be a vector for prions. When researchers fed hamsters grass that grew on ground w	tauntz	6.905266	6.0236664	comment	4.0	29.0	1620210111	14.903705
27095734	> [I]t was just a twisted protein, c	"> [I]t was just a twisted protein, capable of performing the microscopic equivalent of a Jedi mind trick, compelling normal proteins on the surface of nerve cells in the brain to contort just like them. The so-called ""prions,"" or ""proteinaceous infectious part"	mariodiana	6.890989	6.016943	comment	4.0	11.0	1620566734	14.90333
12816376	The prion disease rumours circulatin	The prion disease rumours circulating on Twitter about Soylent are really disturbing.	arcadeparade	6.93089	6.021472	comment	4.0	11.5	1477665867	14.886704
27550960	Since prions are found abundantly in	Since prions are found abundantly in the head, just bury or lock away the skulls and treat them like nuclear waste. Compost or cremate the rest of the body.	1-6	6.922484	6.0181427	comment	4.0	17.5	1624027910	14.907386
27983610	Has there been any research on Prion	Has there been any research on Prions as a bio-terrorism weapon? It sounds like you could infect thousands/millions and have a close to 100% death-rate without anyone noticing until many years after the contamination started.Imaging contaminating food/drinking	chrbarrol	6.9063416	6.0240974	comment	4.0	27.0	1627479714	14.90277
28208819	I'd encourage anyone interested to d	I'd encourage anyone interested to do their own research. The scientific consensus today is what is stated in the linked wikipedia article. There are lot of myths around Lyme disease.https://eu.delawareonline.com/story/sponsor-story/nemours/20...Myth #5: Lyme 	yodsanklai	6.9876523	6.327997	comment	4.0	15.5	1629200698	12.018354
28211187	I live in Minnesota and am being tre	I live in Minnesota and am being treated for Lyme disease for the second time in 15 months. It's no joke. The first time I got Lyme, it came with a painful shingles co-infection on top of the usual symptoms.Now the second time, I am again worried about getting	pwenzel	6.9967704	6.317009	comment	4.0	17.5	1629215432	11.964134
28283142	Lyme disease can be treated pretty e	Lyme disease can be treated pretty effectively with penicillin. Maybe instead of blaming the lawyers, we should blame penicillin. :) Sometimes having a safe, low cost treatment prevents the development or adoption of a preventative medicine or vaccine. One can	newbamboo	6.9902816	6.324535	comment	4.0	17.0	1629759661	-13.723387
22766135	This has no bearing on the tests of 	This has no bearing on the tests of this new drug, but it's worth noting that the best prevention is getting ticks off of you quickly.I know this because I live in a very tick infested area (Ozark Mountains) and very few people who've grown up here in families	oblib	6.997553	6.3234	comment	4.0	12.5	1585885273	11.962983
18499719	Brain-Destroying Prions Also Spread 	Brain-Destroying Prions Also Spread Through Victims' Eyes	snazz	6.8941636	6.022196	story	4.0	38.0	1542766685	14.907861
18648550	We take measures now, for tissues wh	We take measures now, for tissues where prions are a possible transmission risk. The article mis-represented that. But:(1) there are only so many resources to go around. Should we be devoting them to vanishingly rare things rather than things that might actual	arkades	6.897712	6.0230765	comment	4.0	23.0	1544455840	14.905834
29740946	Interesting. At first I figured the 	Interesting. At first I figured the title was misleading — surely they meant an anti-Lyme disease vaccination — but it turns out that, no, they mean exactly that: anti-tick. They're training the immune system to recognize the tick saliva. This means that the i	SamBam	6.9899573	6.3295217	comment	4.0	24.5	1640895442	-13.68473
29741307	> The irony is, in the United States	> The irony is, in the United States at least, a tick-proofing vaccine would be most useful in areas where the population has a relatively dim perspective on mRNA vaccines.In what sense? The states most affected by Lyme[0] are generally the most (COVID-19) vac	chrononaut	6.9971704	6.327417	comment	4.0	15.5	1640897659	-13.708836
30023010	I like to tell people that early hum	I like to tell people that early humans lived in close contact with animals for hundreds of thousands of years, and until a few generations ago, when most people were still farming for a living. If prions had the potential to end the human race, they would alr	Victerius	6.8946815	6.0267515	comment	4.0	11.5	1642770851	14.905995
25742149	We already have a Lyme disease vacci	We already have a Lyme disease vaccine. However, the manufacturer refuses to sell it for human use due to PR threats from conspiracy theorists. Unfortunately, creating vaccines is only half the battle.https://www.ncbi.nlm.nih.gov/pmc/articles/PMC2870557/	elil17	6.99058	6.3306	comment	4.0	19.5	1610424505	-13.707659
25743051	>It’s so pervasive and creates all k	>It’s so pervasive and creates all kinds of weird dietary and nervous system issues.I am not an expert, but I think it would be amiss to omit the Lyme disease controversy with these statements. https://www.ncbi.nlm.nih.gov/pmc/articles/PMC4477530/Lyme disease 	danfo	6.9892817	6.3181973	comment	4.0	20.0	1610432171	-13.7119665
36992902	Lyme apparently has been proven to b	Lyme apparently has been proven to be in the wild since time immemorial and thus the headline is nonsense.[1][1] https://www.sciencealert.com/congress-is-investigating-wheth...	unyttigfjelltol	6.991292	6.326963	comment	4.0	16.5	1691101551	-13.722901
36993486	Lyme's incubation is long and impact	Lyme's incubation is long and impact on infected people uncertain, which makes it useless as a bioweapon. The sciencedirect article effectively dismantles the innuendo about Lyme as a bioweapon.	unyttigfjelltol	6.9887986	6.3296385	comment	4.0	11.0	1691105524	12.070199
38499268	Mine started after taking antibiotic	Mine started after taking antibiotics for Lymes. Not sure what caused it the antibiotics or lymes... this was in 2021 so other things were at play too.Anyone have any tips for healing?Really has hindered from doing deep thinking and just even day dreaming. I h	rajin112	6.991515	6.3181086	comment	4.0	10.5	1701531350	-13.7123375
15687524	Former Alzheimer's researcher here.I	Former Alzheimer's researcher here.I've never heard of this before. Some cursory googling only turns up a sole author publication by Alan MacDonald in Medical Hypotheses and a few news pieces by dodgy organizations like the Spirochaetal Alzheimer's Assocation.	jdpigeon	6.9919343	6.27098	comment	4.0	14.5	1510589799	-13.705014
32466654	I was pretty nervous about Lyme Dise	"I was pretty nervous about Lyme Disease a couple of years ago after there was a lot of publicity about it.
Now I feel like it's all a bit overblown.
I come from a family that's worked in dairy farming for generations on both sides.
People who've worked in hay "	stormdennis	6.9893575	6.328258	comment	4.0	14.5	1660546757	11.983373
32467799	Strangely, i know someone from lithu	Strangely, i know someone from lithuania that told me her whole family got vaccinated against lyme.Does a working vaccine already exists ?	bsaul	6.9892874	6.334676	comment	4.0	12.5	1660557901	-13.718857
32507010	Now my mind is wondering if insects 	Now my mind is wondering if insects could be a source and transmitter of prion diseases.Perhaps the proteins in bugs don’t line up with humans though.	comradesmith	6.895942	6.0244746	comment	4.0	12.5	1660813063	14.89989
35647345	Or hopefully CWD.   I feed about 40 	Or hopefully CWD.   I feed about 40 deer a day, twice a day and they are at high risk of getting chronic wasting disease misfolded prions.  I don't consume the deer but CWD can be passed from urine and feces so I wear dedicated shoes specifically for the purpo	LinuxBender	6.9282026	6.008944	comment	4.0	16.5	1682029420	14.90175
36153072	Be careful with anything related to 	Be careful with anything related to “chronic Lyme”. While it is true that Lyme disease can trigger long-term symptoms, Lyme has also become a catch-all haven for pseudoscience practitioners and quackery.It has become so bad that most patients with unexplained 	PragmaticPulp	6.9886975	6.326134	comment	4.0	14.0	1685635310	-13.74216
20279215	Just a note, Chronic lyme disease is	Just a note, Chronic lyme disease isn't really a thing.https://www.ncbi.nlm.nih.gov/pmc/articles/PMC4477530/This isn't to say you haven't been dealing with a lot of garbage, just that you might need to seek different medical care if your doctors are telling yo	cogman10	6.9886274	6.3284464	comment	4.0	11.5	1561498486	-13.727674
20493329	Ancient History of Lyme Disease Reve	Ancient History of Lyme Disease Revealed with Bacterial Genomes (2017)	erentz	6.9893365	6.330877	story	4.0	91.0	1563739351	-13.687349
20746539	Lyme disease is no joke. My neighbor	Lyme disease is no joke. My neighbor's son found out he had Lyme after being mis-diagnosed with (I think) MS. He was losing motor function, one eye started to go blind, and he was chronically tired. He made a full recovery after being diagnosed but that was se	jcoby	6.9882593	6.3180213	comment	4.0	17.5	1566306615	11.979436
20748064	Why Is Lyme Disease So Hard to Under	Why Is Lyme Disease So Hard to Understand?	wglb	6.9890027	6.329756	story	4.0	53.0	1566315131	-13.713907
14080552	it's highly unlikely...  There's a (	it's highly unlikely...  There's a (probably directed, weighted) graph of species-species transmission potential, and it does seem to obey some rough distance rule, which does NOT correlate necessarily with species distance rule.  We think that cows can transm	dnautics	6.912869	6.018896	comment	4.0	10.5	1491844694	14.900311
31758205	Not accurate. If you read the origin	Not accurate. If you read the original research study this recommendation is based on, it prevents the bullseye rash, which they used as a proxy measure. It's unclear whether or not it actually prevents lyme.I personally got bitten by a tick, did the prophylax	Alex3917	6.99056	6.324341	comment	4.0	29.5	1655321564	11.996134
28981343	The thought of an as-yet-unknown CJD	The thought of an as-yet-unknown CJD-like prion disease that's slowly developing somewhere is absolutely terrifying. This made me wonder about how tests are run for prion diseases, though. Is it just a matter of placing the spinal fluid sample under a microsco	bink	6.8993773	6.034763	comment	4.0	15.0	1635105496	14.905552
29119814	"Prions are ""just"" proteins that shou"	"Prions are ""just"" proteins that should get broken down by the body. But they don't, and they cause ‎Creutzfeldt-Jakob in over 10 years after ingesting."	darthvoldemort	6.8999066	6.0217323	comment	4.0	31.0	1636122759	14.903989
29120018	Are you suggesting that every new mo	Are you suggesting that every new molecule should be treated as if it were a prion?	cglace	6.9004717	6.0256033	comment	4.0	28.0	1636123545	14.90224
34822649	Tesla recalls 362,000 U.S. vehicles 	Tesla recalls 362,000 U.S. vehicles over Full Self-Driving software	stalfosknight	6.2198105	5.534347	story	4.0	7.0	1676570608	3.9195986
17013323	I wonder how widespread Lyme Disease	I wonder how widespread Lyme Disease has to get before the economic incentives to develop a new vaccine reach a tipping point.There used to be a vaccine but it was discontinued because of insufficient demand.https://www.niaid.nih.gov/diseases-conditions/lyme-d	rectang	6.9910226	6.331178	comment	5.0	15.5	1525706012	-13.72366
19128080	If prions stick to surgical instrume	If prions stick to surgical instruments “like glue” what about needles and lancets? Could this be the link between diabetes and Alzheimer’s?	aiyodev	6.9226866	5.9549212	comment	5.0	16.5	1549812009	14.887023
28210434	For what it's worth, my wife has ~so	For what it's worth, my wife has ~something~. She hasn't gotten a consistent diagnosis--Fibromyalgia, etc. She tested positive for Lyme at some point. All we know is that she's sore and tired all the time and has mysterious allergic reactions to things, all th	overthemoon	6.9956837	6.3172994	comment	5.0	17.0	1629211660	-13.710958
