id	x	y	type	relevance	size	year	umap1d	hovertext	url	author
19444042	9.265139	7.6512666	comment	7.0	29.5	1553100610	13.959283	This seems like an overly critical article. Zoning laws and NIMBY impulses should be fought tooth-and-nail and I'm glad Airbnb is doing so. The platform has allowed me to actually enjoy travel in ways...		iandanforth
19474482	9.260515	7.6450105	comment	7.0	28.5	1553404274	13.972522	Recently I rented an Airbnb that turned out to be nothing like the pictures. The building that the apartment was in was falling apart, stank of cigarettes and was on a sharp slant to the point where m...		stephencoyner
19765512	9.277189	7.601046	story	7.0	72.0	1556373189	13.949805	The Airbnb Invasion of Barcelona	https://www.newyorker.com/magazine/2019/04/29/the-airbnb-invasion-of-barcelona	pingou
16285380	9.273385	7.6458683	comment	7.0	24.0	1517515625	13.956455	When AirBnB finally does IPO, who will want to buy it? What more growth could possibly come out amidst the increasing regulation?		matte_black
16322070	9.262848	7.649939	story	7.0	104.0	1517974611	13.971064	Airbnb’s Battle to Stay Private	https://www.bloomberg.com/news/articles/2018-02-06/inside-airbnb-s-battle-to-stay-private	thedogeye
16871906	9.262906	7.6500626	story	7.0	7.0	1524091392	13.967955	Up for Lunch with YC Founders in SF? (Airbnb Experience)		ninjaa
16987393	9.26572	7.6488056	comment	7.0	34.5	1525364917	13.963241	'Airbnb Inc. disputed the study’s findings, calling them “wrong on the facts” and containing “substantive issues with the methodology.”'Did Airbnb publish what these wrong facts and substantive issues are?		loceng
17264838	9.2693405	7.634395	comment	7.0	27.0	1528462992	-4.202922	I understand all the ramifications in certain cities where the housing prices are getting effected by airbnb, but I think in this case it is just the Hotels strong arming because they were losing busi...		poisonarena
17265144	9.26987	7.640985	comment	7.0	30.0	1528464917	13.961922	This is the approach taken in London: Anyone can AirBnB their property, but only for 90 days a year, unless you have special permission. This prevents people buying up/renting flats just to let them out on AirBnB and putting pressure on the already cripplingly bad housing situation.		fredley
17266717	9.265842	7.645891	comment	7.0	68.0	1528473597	13.962603	No, sorry. AirBnB is creating immense problems in tourist destinations, to the point where people in major cities in Greece (and other countries) are having trouble finding affordable permanent housin...		StavrosK
17831932	9.2767515	7.5994115	comment	7.0	20.5	1535072043	13.935522	Most Americans have spare bedrooms for when guests visit.  You could have your guests stay at a hotel but typically that will be really far from your home which sucks for everybody.  Having Sonder or ...		samclearman
21017477	9.2648115	7.646653	comment	7.0	20.0	1568908893	13.965787	Tangential to the topic, but does AirBnB operate under any regulations? When I was in Seattle, my apartment building ended up adding an explicit clause in the lease saying you couldn’t rent a property...		tracer4201
21021801	9.2641	7.6336427	comment	7.0	26.5	1568936076	13.957461	I really really love Airbnb, and I've mostly stayed at Airbnb and ignored hotel in the last 5 years perhaps. I now find hotels dirty, impersonal, and a chore to stay at to be honest.Now, I've become i...		baby
21286597	9.274279	7.64876	story	7.0	17.0	1571348370	13.963841	Not even Airbnb can turn a profit	https://www.fastcompany.com/90418766/report-not-even-airbnb-can-turn-a-profit	rblion
21355575	9.248258	7.6656904	story	7.0	103.0	1572015221	13.943672	Airbnb in the Himalayas	https://veridici.com/how-airbnb-is-silently-changing-himalayan-villages/	bookofjoe
21409488	9.2632475	7.6437054	comment	7.0	19.5	1572533741	13.9718275	"Even after a >>>month<<< of digging through public records...Dealing with Airbnb’s easily exploitable and occasionally crazy-making system is still just a bit cheaper than renting a hotel.""It's consta..."		joezydeco
21410687	9.301749	7.6434484	comment	7.0	19.5	1572539963	13.951517	I think what Airbnb, and uber, lyft, Amazon etc. All fail to understand is the longevity ans stickiness of brand. Once you become an untrustworthy or low quality brand, it's very hard to change that. ...		dannykwells
21409158	9.256514	7.6184535	comment	7.0	42.5	1572532068	13.963075	There are also some smaller-time scams hosts run. I was forced to pay a three-figure cleaning fee by an AirBnB in DC earlier this year because they claimed I left a stain on their couch -- which I nev...		chadlavi
39337733	9.26713	7.651505	story	7.0	24.0	1707679342	13.964446	Investors in Airbnb arbitrage business allege they were defrauded in scheme	https://www.cnbc.com/2024/02/11/investors-in-airbnb-arbitrage-business-allege-they-were-defrauded.html	rntn
18914080	9.269307	7.6490755	comment	7.0	35.0	1547580435	13.963512	I plan on shorting Airbnb once it IPOs. It will only go down in the short term. Regulations were at an all time low and will slowly ramp up. For better or for worse, these regulations will hurt Airbnb...		justadooda
18923482	9.26475	7.6391296	comment	7.0	30.0	1547663462	13.962998	It's almost as if AirBnB's hosts and guests are bearing the externalities that should be priced into the transaction on both sides...For hosts, property damage, etc. is a matter of when, not if, and f...		munchbunny
18923636	9.263909	7.6372623	comment	7.0	25.5	1547664205	13.960292	I'll add to this as well. I've had two incidents over the past year.1. I rented a place and was told that I could check-in whenever. When I got there, the key wasn't available and I wasn't able to con...		rickyc091
33287734	9.258181	7.648006	comment	7.0	45.5	1666358597	13.955722	But it's also Airbnb themselves.  It's well known that negative reviews are scrubbed and even edited, this is something many people including myself have experienced.  Any doubts, spend some time on t...		mancerayder
33876715	9.257914	7.6222925	comment	7.0	48.5	1670310324	13.917445	We rented an airbnb, very nice, very luxurious. Had motion activated lights everywhere. We slept with the light on because it malfunctioned and there was no physical switch to turn it off -- we actual...		twawaaay
38171121	9.26195	7.6492496	comment	7.0	21.5	1699315220	13.958361	I’ve grown to appreciate Airbnb for big family trips (access to kitchens being a big plus).It’s still very funny to me that the site and app look very good and I constantly see Airbnb design writeups ...		rtpg
38474806	9.256447	7.650469	story	7.0	33.0	1701358760	13.990567	Airbnb's Silent Killer	https://www.nbcnews.com/tech/tech-news/airbnb-carbon-monoxide-poisonings-detectors-rcna105634	Nadeus
14843970	9.263097	7.6507187	story	7.0	41.0	1500941853	13.972121	6 Reasons Why I Am Done with AirBnB as a Renter	https://donewithairbnb.wordpress.com/6-reasons-why-i-am-done-with-airbnb-as-a-renter	graniter
14942019	9.270544	7.630745	comment	7.0	29.5	1502037846	13.963035	Put me in the camp that's very anti-AirBnB as a resident who doesn't want where I lived turned into a hotel. I live in NYC. It's a problem.The real problem here is not Airbnb, which is a symptom; it's...		jseliger
12393868	9.268959	7.6452737	comment	7.0	26.5	1472590885	13.953321	Jessica is awesome. That said, this part near the beginning, where Sam says...>>Sometimes they create a small success, and sometimes they create these companies that really transform the world, and YC...		enraged_camel
12455691	9.260237	7.6275377	comment	7.0	28.0	1473358931	13.938779	As an host, I'll never discriminate on the basis of religion, sex orientation, color of skin, national origin or gender identity.When it comes to disability, I might refuse someone whose disability wo...		nicolas_t
35476214	9.246617	7.5641127	comment	7.0	47.5	1680825348	13.956246	"The modern Airbnb experience: Pay a 150 dollar ""cleaning fee"" and then be instructed to wash the bedsheets, vacuum the apartment, do the dishes, dust the TV and replace the candles before you leave"		enlyth
28129928	9.2624445	7.643779	comment	7.0	28.0	1628608946	13.948288	Ignoring this author for breaking the house rules and thinking he is in the right. The reality is Airbnb's are slowly being regulated away due to both the poor behavior of guests and bad hosts that ha...		blankobj
28216802	9.271701	7.634824	comment	7.0	26.0	1629250384	13.962497	My Dad recently needed a place to live.  No matter how far I drew the circle on Zillow in our part of the state, there were no rent houses, for any price.  I texted my realtor about it and asked if it was the Airbnb effect.  She said “Yes, probably.”Infuriating.		JohnJamesRambo
28659999	9.259993	7.641766	comment	7.0	24.0	1632655595	13.959256	I do this right now and have been living in airbnbs with my wife and child for over a year paying comparable rent we did in Denver. We actually got featured on the Today show for it a few months ago. ...		jsonne
22564568	9.261242	7.646983	comment	7.0	21.5	1584071662	13.963783	AirBnB failed.  I don't even check it out anymore when I travel because a hotel typically costs about the same due to the fees charged by the hosts.  I would choose a hotel over AirBnB until the price...		ohbleek
22662553	9.264244	7.6514783	story	7.0	28.0	1584958761	13.962694	Will AirBnb Go Bankrupt? and When?	https://thehftguy.com/2020/03/23/will-airbnb-go-bankrupt-and-when/	user5994461
22708891	9.262332	7.6464252	comment	7.0	19.5	1585365291	13.962822	"I hate using AirBnB. We used it once during an extended stay in Milan and the apartment was horribly dusty (I have allergies), the maid practically worthless and the ""host"" in no way matched the perso..."		78966hh888
22725042	9.265751	7.647999	story	7.0	50.0	1585539901	13.964721	Airbnb to Halt All Marketing, Most Hiring as Losses Mount	https://www.theinformation.com/articles/airbnb-to-halt-all-marketing-most-hiring-as-losses-mount	justswim
22808826	9.266488	7.6467423	comment	7.0	52.5	1586304193	13.955101	To those asking how Airbnb could possible need that much money.Wikipedia says they have 12,736 employees.$1B works out to $78,518 per employee (before payroll taxes, health insurance, etc.).So if you'...		crazygringo
34219584	9.260029	7.6481223	comment	7.0	25.5	1672676212	13.941631	Any platform that extracts money from X has the incentive to get rid of any negative reviews about X. Reviewers are not the revenue source. That's why AirBnB, Yelp, Glassdoor, etc will get rid of bad ...		raincom
34821462	9.262191	7.6435857	comment	7.0	19.0	1676567085	13.97258	AirBnB was fun at first when I could find someone renting out their personal beach house when they weren't using it, or an extra room in their house. I had many good experiences with family events or ...		PragmaticPulp
34832946	9.273709	7.6285725	comment	7.0	32.5	1676629067	13.955644	> The airbnb thing is more interesting and nuanced but harder to get a handle on. It might be that airbnb is causing some unhealthy things in the real estate market.I have friends living in Lisbon and...		piva00
13770926	9.273722	7.6527724	story	7.0	7.0	1488422028	13.965358	How do tech companies spend 100's of millions?		Apane
13864305	9.265686	7.647477	comment	7.0	20.0	1489455955	13.9578495	Ummm [0]...would appreciate an explanation here.[0]: https://github.com/airbnb/native-navigation/blob/91ae656192d...		danappelxx
13866727	9.26467	7.649808	comment	7.0	20.5	1489492665	13.959655	"It seems unrealistic to expect AirBnB to ""fix"" this issue. This is a cultural problem, not a technical one, and it's outside their sphere of control. Sure, they could shut down a few blatantly racist ..."		retrac98
14131243	9.263767	7.6250553	comment	7.0	22.5	1492440699	10.441196	AirBNB seems to be combating itself just as much, frankly.Take this idea that an AirBNB host can set pretty much any service/cleaning fee, which is not factored in to search-by-price and not even disp...		makecheck
31202525	9.277251	7.623399	comment	7.0	19.5	1651218653	13.953828	Never heard of a landlord who’d rather have a string of short term rentals than one continuous long term rental unless there’s some renter protection law that makes you an effective permanent tenant. ...		renewiltord
31203089	9.265983	7.645288	comment	7.0	19.0	1651223731	13.96246	What it is that leads you to believe the 3-6 months thing is so significant? There are (a very small proportion of) AirBnB guests who are awful. There are (a very small proportion of) longer-term tena...		gnfargbl
39671547	9.238877	7.5001864	comment	7.0	39.5	1710180820	13.948289	I'm a host.  I charge a $200 cleaning fee and my cleaners charge me $250, so I lose money on cleaning.I ask guests to:* Strip the beds (otherwise, I find that people re-make beds and it's hard to tell...		klinquist
36593700	9.401944	7.653244	comment	7.0	23.5	1688512400	13.952771	"Tell your friend that a billion dollar idea is always at first a stupid idea that will never work.See:  
1. Dropbox
2. AirBnB
3. Uber"		theGnuMe
36674463	9.259742	7.6244044	comment	7.0	23.0	1689031708	13.916851	Why is AirBnb still a thing ? Do people like doing chores while on a vacation ?		manishsharan
37079144	9.268287	7.6405516	comment	7.0	30.0	1691688933	13.974257	"A better title would be ""low-touch real estate speculation doesn't pan out for some people"". AirBnB flippers have wreaked small havoc in my city, scooping up all kinds of units that would have otherwi..."		tech_ken
37438698	9.265081	7.6511564	story	7.0	13.0	1694203385	13.965633	NYC Kneecapped Airbnb. Private property being treated as city's housing stock	https://reason.com/2023/09/08/did-nyc-just-kneecap-airbnb/	Bostonian
24758074	9.283303	7.6451154	comment	7.0	25.0	1602529191	13.962025	This is PR nonsense to help promote Airbnb's IPO plan, a plan exclusively launched to cash out before the buzzer sounds. Understandably AirBnb wants to create a story of how they brilliantly pulled th...		baron_harkonnen
32762383	9.352918	7.6534953	comment	7.0	65.5	1662621780	13.937752	"That issue isn’t only with Airbnb. Many other tech companies have poor customer service and more than willing to just ban you rather than deal with issues.
Had incident with Uber. Driver came 30 mins ..."		haxorito
31833320	9.264015	7.6394463	comment	7.0	24.5	1655885941	13.95813	They need to sort out the issues with poor service, hosts going dark, properties not as described, cleaning fee rip-offs etc.Hotels are also cheaper nowadays by the time you account for hidden fees.After my last 3 attempts went bad, I'm done with AirBNB.		benjaminwootton
32048747	9.266774	7.648209	story	7.0	2.0	1657485497	13.965774	Ask HN: What's the reason that Airbnb Experiences never took off?		poisonborz
22083365	9.264145	7.6368356	comment	7.0	24.0	1579338970	13.943035	I wanted to start something like this many years ago (and I still cannot find anything like it in the cities I go to); I travel a lot for work and I want to leave a suitcase in every city I travel to ...		tluyben2
23556319	9.265273	7.6406446	comment	8.0	27.0	1592425627	13.982036	Seems silly to discuss the falling rental prices in prestigious cities without even a nod to AirBNB.AirBNB rentals have collapsed, and so a lot of owners have moved their properties into conventional ...		Pxtl
20488724	9.258723	7.650989	story	8.0	40.0	1563661495	13.965717	How Airbnb’s Sales Process Changed With Rapid Growth	https://medium.com/better-marketing/how-did-airbnbs-sales-process-change-with-rapid-growth-6079482057fb	aiansiti
20648780	9.534382	7.667803	comment	8.0	26.0	1565298414	13.9694	Not all gig companies are the same.Uber is not a real business. Nothing about hiring a driver or maintaining or running a car is cheaper now than before Uber. Uber will never be profitable unless peop...		ensmartha
13665568	9.26471	7.649388	story	8.0	59.0	1487299861	13.96602	Airbnb Acquires Luxury Retreats, Beating Out Expedia, Accor	https://www.bloomberg.com/news/articles/2017-02-16/airbnb-buys-vacation-home-management-company-luxury-retreats	prostoalex
39670063	9.226935	7.503427	comment	8.0	39.5	1710173924	13.953072	"Cleaning fees aren't a ""scam"" - most property owners really do need to pay someone to clean the property at the end of a stay.But, as another commenter said, they can be used as a way to encourage lon..."		hn_throwaway_99
37278953	9.281217	7.616144	comment	8.0	28.5	1693103729	13.956497	On one hand, people should have the ability to do what they want with properties they own. On the other hand, there’s clearly a reason this is happening, and it doesn’t sound like it came out of a voi...		SOLAR_FIELDS
37447389	9.2678175	7.640629	comment	8.0	27.5	1694278209	13.95359	Is restricting new construction the problem? I believe the problem is airbnb, mega-corporations/banks buying up and renting out homes, homes that sit empty trying to get exorbitant rental rates, vacat...		gre
24662435	9.257422	7.6492558	story	8.0	79.0	1601645858	13.961403	The Customer Service Reps for Disney and Airbnb Who Have to Pay to Talk to You	https://www.propublica.org/article/meet-the-customer-service-reps-for-disney-and-airbnb-who-have-to-pay-to-talk-to-you	danso
25274237	9.274117	7.634857	comment	8.0	31.0	1606896650	13.961979	A completely personal rant:I was almost evicted since my landlord wanted to make more money with Airbnb. Before that I've already heard of cases how in tourists towns the local poorer population wasn'...		OneGuy123
25377258	9.266744	7.6479445	comment	8.0	29.0	1607627745	13.95867	> But something surprising happened: they enjoyed having those first three guests staying with them. And the guests enjoyed it too. Both they and the guests had done it because they were in a sense fo...		jrochkind1
25387146	9.262912	7.638716	comment	8.0	27.0	1607702306	13.961049	I’ve had nothing but bad experiences with Airbnb and hosts who are basically trying to rinse as much money as possible for as little effort as possible. I’m not sure after a long journey I want to won...		andy_ppp
38859943	9.272802	7.6192493	comment	8.0	25.0	1704316092	13.957029	Still car limited. I like doing work-cations but I have a similar issue with the working space. A real chair, external monitor, key board is really essential for work more than a week. Flying anywhere...		tayo42
32762207	9.258336	7.6510744	comment	8.0	22.5	1662620539	13.961198	Cunningham’s July 2018 Medium post about his experience went viral — and soon afterward, Airbnb responded to apologize and reinstate his account. “You were removed after we received a report alleging ...		lazyasciiart
31833486	9.268514	7.6206594	comment	8.0	32.5	1655887846	10.167112	Their search now prominently encourages odd stays like this as well. It's puzzling as it seems to be at the expense of other search filtering.They've reduced useful search filters like 'has a desk' an...		throwaway13337
32493173	9.26243	7.650256	story	8.0	29.0	1660719884	13.967238	Got a “Test dev” notification from Airbnb:D	https://twitter.com/sudotimar/status/1559797636504457216	timar
22082949	9.2942705	7.602683	comment	8.0	43.0	1579332266	13.928444	This is a pretty vibrant space with many startups trying to solve the problem.It's been sparked by the raise of Airbnbs which rarely offer luggage storage.A similar trend is in self checkin solutions....		Lucadg
22095911	9.476367	7.656631	comment	8.0	24.5	1579489064	-2.1336012	A company can choose to ban you from their service for this. Uber eats, probably not an issue. But imagine the inconvenience of not having Uber for the rest of your life. Or worse, Airbnb which doesn’...		virtuous_signal
13679385	9.263696	7.6530576	story	8.0	39.0	1487507437	13.963908	The Rise of the Professional Airbnb Investor	https://priceonomics.com/will-real-estate-investors-take-over-airbnb/	paulpauper
13866190	9.257533	7.645563	story	8.0	50.0	1489484669	13.963102	I’m a black man. Here’s what happened when I booked an Airbnb	https://medium.com/stay-woke/i-read-about-this-phenomenon-of-black-people-being-rejected-on-airbnb-f36dd3ab0375#.26qwgv6ih	helmett
14130806	9.262924	7.6392674	comment	8.0	88.5	1492436821	13.960822	Having used AirBnB for a while, I now prefer to stay in a hotel. Staying in AirBnB I don't feel safe at all and 80% of the AirBnB's I stayed had one problem or the other. There is no importance given ...		ouesp
14293597	9.265902	7.649656	story	8.0	78.0	1494263953	-5.7061224	Scaling Mobile Messaging at Airbnb	https://medium.com/airbnb-engineering/messaging-sync-scaling-mobile-messaging-at-airbnb-659142036f06	knighthacker
30855187	9.262682	7.647803	story	8.0	134.0	1648648150	13.961869	Unbundling Airbnb	https://www.peterfabor.com/posts/unbundling-airbnb	peterfa
30876160	9.264159	7.6428113	comment	8.0	29.5	1648800677	13.964211	"or you can up-bundle airbnb. I would like to be able to pick ""2 years in <nice place>"" as a package that includes everything from home to food/gym/car etc"		jdrc
31189323	9.262206	7.645288	comment	8.0	26.0	1651127202	13.967104	"""Cracking down on Airbnb""... you say this as if Airbnb is a horrible thing or something LOL"		alexb_
31267213	9.265149	7.640078	comment	8.0	40.5	1651706921	13.954688	I think one of the key takeaways for me is just how important the 29 day+ stay is for them as an emerging category which sounds right to me... in part because I enjoy that style of travel but also bec...		atlasunshrugged
31426206	9.264774	7.6499605	story	8.0	116.0	1652899409	13.969005	How Airbnb Built “Wall” to prevent data bugs	https://medium.com/airbnb-engineering/how-airbnb-built-wall-to-prevent-data-bugs-ad1b081d6e8f	charlysl
35898372	9.263061	7.642959	story	8.0	93.0	1683785989	13.946246	Airbnb CEO: CEOs calling workers back to the office 'going away to the Hamptons’	https://www.businessinsider.com/airbnb-brian-chesky-ceos-mandating-return-to-office-going-hamptons-2023-5	alex_young
36290044	9.256335	7.6469297	comment	8.0	23.0	1686557998	13.955786	The problem with the Airbnb review system is that very few people are willing to leave a candid review because (1) it seems like bad manners when renting from an individual (as opposed to a large corp...		mysterypie
36513545	9.266722	7.645407	story	8.0	17.0	1687991468	13.966151	Airbnb Revenue Collapse Sparks Housing Market Crash Fears	https://www.newsweek.com/airbnb-revenue-collapse-housing-market-crash-fears-1809543	FollowingTheDao
34219765	9.253637	7.6524816	comment	8.0	79.5	1672676952	13.956042	Airbnb removed my positive review and accused me of being in cahoots with the host to leave positive feedback.They said they have found an existing relationship between me and the host. Mind you have ...		elmerfud
34219805	9.2703705	7.6453013	comment	8.0	52.0	1672677100	13.957964	There is an old joke, how do you know that someone is a vegan or does crossfit?  You'll know because they'll make sure you know minutes after meeting them.In 2008-2011 on HN if someone worked at faceb...		chollida1
34871147	9.245591	7.5780463	comment	8.0	37.5	1676918114	-11.238791	I agree with you on almost all of this, but I think the cleaning fee is different. It represents an actual cost for an actual activity. I think AirBnb should show initial totals with it included, so y...		wpietri
19443939	9.268521	7.654087	comment	8.0	36.5	1553100030	13.965517	AirBnb is a terrible, terrible company. Most of their money comes from corporate-owned mini-hotels yet they advertise as a mom and pop shop.At every turn their solution is to sue small towns and cities so they can continue to extract wealth from our neighborhoods.Disgusting.		matchbok
19474288	9.263024	7.652075	comment	8.0	37.0	1553401257	13.961198	It’s crazy to me that Airbnb is this massive company that derives most of their revenue from illegal services. What other multi-billion dollar co is remotely comparable?Agree last thing I want to deal...		randomacct3847
19954827	9.27888	7.6553597	story	8.0	22.0	1558292547	13.960184	Paul Graham: “Airbnb happened because its founders could not pay their rent”	https://twitter.com/paulg/status/1129897694984646657	minimaxir
15786250	9.264301	7.647357	story	8.0	92.0	1511777911	13.966958	Airbnb’s Money-Laundering Problem	https://www.thedailybeast.com/inside-airbnbs-russian-money-laundering-problem	gfredtech
16334534	9.266106	7.6475525	story	8.0	73.0	1518115984	13.96406	Detroit has outlawed Airbnb for R1 and R2 zoning	https://detroit.curbed.com/2018/2/8/16991266/detroit-banned-airbnb-zoning	uptown
16439105	9.264805	7.643593	comment	8.0	33.0	1519319175	13.954696	Airbnb is trying to make more money by offering experiences (events that generally seem very expensive to me) and moving to a more high-end branding. If I open the website I mostly see the more exclus...		Gys
16439541	9.260065	7.648951	comment	8.0	27.0	1519321802	13.983526	This is strange marketing as it almost sounds like the non-Plus listings aren't what people already expect to some degree from an airbnb.> With Airbnb Plus, you can always check in effortlessly. Every...		annexrichmond
16440206	9.256167	7.637642	comment	8.0	40.0	1519325498	13.957028	I travel a lot and have stayed at 50+ airbnb places all around the world -- but the biggest problem is that the reviews are always so artificial you honestly have zero idea of what you're getting into...		grapehut
16815468	9.268441	7.638755	story	8.0	64.0	1523479819	13.962181	Vancouver signs first agreement in Canada with Airbnb for short-term rentals	http://vancouver.ca/news-calendar/city-signs-first-mou-in-canada-with-airbnb-for-short-term-rentals.aspx	Tiktaalik
21068611	9.25295	7.649591	story	8.0	6.0	1569396783	13.937676	Ask HN: How Should Airbnb Respond to Trespassing?		sirrele
21412658	9.278016	7.600551	comment	8.0	49.0	1572550123	13.960782	Here is another scam that someone tried to pull on me.I booked a place in Reno a week in advance. On the night before check-in at about 2am I got a text from the host asking me to increase the price o...		elchupanebre
