id	label	hovertext	author	x	y	type	relevance	size	year	umap1d
13378854	The impetus for this project was tha	The impetus for this project was that I wanted to move away from Chef because it was costing me an extra administrative server per month. I wanted to try something new, so I didn't bother looking into chef-solo. I wanted something agent-less, and it seemed lik	schizoidboy	9.671322	-7.0475535	comment	5.0	27.5	1484181227	-13.268463
13381058	I see. This is really astonishing.I 	I see. This is really astonishing.I always preferred using plain SSH and Shell for automatically configuring servers.That's why I had a look at Ansible, but despite this simple concept, it seemed too bloated to me: too many layers around this simple idea. But 	vog	9.662398	-7.0372458	comment	5.0	17.5	1484214373	-13.306493
13441086	RedHat Ansible High-Risk Vulnerabili	RedHat Ansible High-Risk Vulnerability	fapjacks	9.680054	-7.043294	story	5.0	39.0	1484875999	-13.30066
13483902	Canonical Distribution of Kubernetes	Canonical Distribution of Kubernetes	loppers92	9.343643	-7.1853757	story	5.0	76.0	1485366979	-13.484212
27515885	I decided to put off learning kubern	I decided to put off learning kubernetes for 2 years because I wanted to see if people would still love it and if it would last. People went from loving it to fairly mixed feelings in their blog posts. Now I’m trying to decide whether to jump on the bandwagon 	gentleman11	9.3762045	-7.1289535	comment	5.0	12.5	1623766787	-13.489695
27691240	How do they do version upgrades, isn	How do they do version upgrades, isn't that the traditional Achilles heel of K8s that leads people to want to frequently recreate clusters from scratch and/or do blue/green?	fulafel	9.35062	-7.17689	comment	5.0	15.0	1625074244	-13.521659
27894169	Yes! Was going to say the same. Kube	Yes! Was going to say the same. Kubernetes is far easier to learn than some random bespoke setup. After reading the article, it just sounds like they reinvented the wheel but made it AWS specific for some reason.Was brought on as a consultant years ago and fou	heydonovan	9.376198	-7.157407	comment	5.0	18.5	1626791309	9.037754
27910478	As a Kubernetes outsider, I get conf	As a Kubernetes outsider, I get confused why so much new jargon had to be introduced. As well as so many little new projects coupled to Kubernetes with varying degrees of interoperability. It makes it hard to get a grip on what Kube really is for newcomers.It 	etaioinshrdlu	9.351485	-7.1818824	comment	5.0	14.5	1626893719	-13.50091
27912439	This argument is often made and is r	This argument is often made and is ridiculous.No one should or is using Kubernetes to run a simple LAMP stack.But if you have dozens of containers and want them to be manager in a consistent, secure, observable and maintainable way then Kubernetes is going to 	threeseed	9.361236	-7.167374	comment	5.0	23.0	1626902829	-13.497154
27918333	Is developing locally with one of th	Is developing locally with one of these k8s implementations a good option? My current workflow is to develop locally with a combination of bare (non-containerized) servers and Docker containers, but all of my deployment is to a hosted k8s cluster.If developing	arcticfox	9.373453	-7.1187854	comment	5.0	12.5	1626958940	7.773061
27973901	It was year 2016, kubernetes did not	It was year 2016, kubernetes did not have jobs, cronjobs, statefulsets. Pods would get stuck in terminating state or container creating state. Networking in kubernetes was wonky. AWS did not have support for EKS. It used be painful.It is year 2021, 1000s of ne	debarshri	9.369408	-7.1547894	comment	5.0	22.0	1627401238	-13.48881
27976732	Moving from classic servers to conta	Moving from classic servers to containers you get:- Builds with fixed dependencies that never change. Rollback is easy- Easy deployment of a prod environment on a local machine- Fast deployment- Easy automation (use version X with config Y)With Kubernetes (or 	mixermachine	9.383955	-7.12061	comment	5.0	17.5	1627415261	-13.466217
12011796	Etcd looks more and more promising a	Etcd looks more and more promising as its usage and development activity increases. Anyone using it internally as a standalone part in the system (e.g. not just for k8s or coreos)?Using e.g. gRPC shows great promise, but systems like ZooKeeper still play nicer	Ygor	9.518985	-7.15886	comment	5.0	13.0	1467321356	-13.306629
12104744	OS seems a little presumptuous. As d	"OS seems a little presumptuous. As does the majority of the ""how it works"" page. Making wildly ridiculous claims that amount to ""microservice are silly"" (my paraphrase) when really they've only managed to successfully sandbox applications. Much like Android wi"	andrewstuart2	9.662839	-7.230133	comment	5.0	19.5	1468631184	-13.692945
12147537	Anyone working on K8s at Box or I gu	Anyone working on K8s at Box or I guess anywhere else that has deployed it partially feel free to answer this, but:How do you handle gatewaying traffic into Kubernetes from non-K8s services? I've been trying to get a basic cluster out the door with one of our 	tedreed	9.358146	-7.1737127	comment	5.0	14.5	1469230299	8.954452
12183752	So how does it compare to Ansible?	So how does it compare to Ansible?	kkarimi	9.679098	-7.0507216	comment	5.0	13.5	1469745778	-13.315387
12303632	There are 2 major issues with this:1	"There are 2 major issues with this:1) Small teams (~1-5 people) trying to seem ""big"" by working at Google's scale.2) Heroku's prices. We are currently (successfully so far) migrating a small Django project from bare Amazon EC2 instances to ECS with Docker. Eve"	lambdacomplete	9.273908	-7.252527	comment	5.0	16.5	1471430722	-13.479506
12323827	I just used `./cluster/kube-up.sh` t	I just used `./cluster/kube-up.sh` to setup my cluster on AWS. I am now wondering what's missing for a production setup. It seems to be working OK so far (though I just have 3 minions and a few pods). One thing I wish I knew how to do is how to safely upgrade 	olalonde	9.3693	-7.16469	comment	5.0	23.0	1471643985	-13.497942
12462725	One thing I've found extremely diffi	"One thing I've found extremely difficult to handle is the Zookeeper cluster model of containers. Where when a thing dies, a thing has to come back and be able to referred to as ""zookeeper-1"" forever. The way to do this currently is to use a service in front of"	_asummers	9.357679	-7.173577	comment	5.0	16.5	1473432640	8.961248
12462732	The setup to get k8s running isn't g	The setup to get k8s running isn't great, but once it's running and you understand it's config files it makes things so much easier. We're getting ready to deploy k8s at work soon and begin moving more there as we can.From what I understand, and is completely 	0xCMP	9.367219	-7.141742	comment	5.0	14.0	1473432664	-13.488499
22411635	And how much developer time did it c	And how much developer time did it cost?We have done the same - our bills went down, but not by as much as 80% I think closer to 50%. But it took a fair bit of developer time, and we now have a lot of Kubernetes related problems to deal with. I guess those wil	collyw	9.354932	-7.1655455	comment	5.0	14.5	1582618871	-13.490949
22435744	Ask HN: Do people still use Heroku a	Ask HN: Do people still use Heroku and the like?	_bxg1	9.236417	-7.2902894	story	5.0	14.0	1582826111	10.303681
22487281	> They probably don't pay you enough	"> They probably don't pay you enough.Can confirm :)> ...we do already pay for resources that are provisioned by our K8S clustersCustomers are charged for worker nodes, but until this point, the control plane (""master"") nodes have been free. In addition to the "	sethvargo	9.407743	-7.126694	comment	5.0	15.0	1583351296	-13.469784
22490040	Namespaces handle most of these issu	Namespaces handle most of these issues.  A NetworkPolicy can prevent pods within a namespace from initiating or receiving connections from other namespaces, forcing all traffic through an egress gateway (which can have a well-known IP address, but you probably	jrockway	9.372929	-7.1434984	comment	5.0	16.0	1583371333	9.764083
22513134	I'm not familiar with the space so m	I'm not familiar with the space so my question might not be that relevant - where does OpenShift fit in all of this (I still struggle to differentiate it from Kubernetes) and is there any merit to IBM trying to sell it so hard?	0x1221	9.396635	-7.059115	comment	5.0	16.0	1583605904	-13.423588
22618398	You haven't been forced to deploy so	You haven't been forced to deploy something that builds a local K8s cluster and builds and runs 10+ containers just to get a microservices app up and ready for development, I see... (only partially /s).	geerlingguy	9.358271	-7.168525	comment	5.0	14.5	1584548972	-13.494577
22621566	Real question coming from a non-k8-u	"Real question coming from a non-k8-user. What would you use something like this for?
Server hosting or?"	zulu-inuoe	9.351115	-7.1757603	comment	5.0	12.5	1584568011	-13.51493
22662216	A big problem is local storage provi	A big problem is local storage provisioner for kubernetes is still not GA. I want to use an SSD attached to one master, and use that as storage for the other RPIs. Doing this is still undocumented/the Wild West.	rmdashrfstar	9.369345	-7.154899	comment	5.0	14.5	1584953679	-13.48883
22661653	What sort of fun projects/experiment	What sort of fun projects/experiments do people do with a super low powered k8s cluster locally?I'm kind of in this weird position where I understand the benefits and use of k8s, but I:a) Can't think of any cutesy distributed systems/microservices type thing t	s-km	9.353967	-7.158144	comment	5.0	22.0	1584944074	-13.494675
22671019	Is ansible really reusible?  We had 	Is ansible really reusible?  We had an ansible deploy for bringing up MySQL database.  I stopped using the codebase and came back to it months later; and I spent two days trying to get it to work (it was an unholy combination of local and community yaml) and e	dnautics	9.678166	-7.055275	comment	5.0	13.0	1585014816	-13.314108
22689202	Although I understand the fear that 	Although I understand the fear that many have of being left behind the technology curve by not having the time - or the chance - to run Kubernetes in their day to day work, we really must appreciate that Kubernetes really is the future of infrastructure. For t	fosk	9.352701	-7.1737523	comment	5.0	18.5	1585176597	-13.491436
22690244	Containers are not necessary if the 	Containers are not necessary if the systems are build with something like Guix or Nix as they provide transaction level updates to applications and dependency and secure by default as no need to run a daemon with root access to run, monitor and manage containe	dragonsh	9.3880825	-7.107362	comment	5.0	14.5	1585188258	-13.483801
22693278	Ask HN: Long-running polling jobs in	Ask HN: Long-running polling jobs in FaaS?	miraculixx	9.380914	-7.1247463	story	5.0	4.0	1585228825	4.782374
22896521	Ask HN: Affordable K8s for individua	Ask HN: Affordable K8s for individuals?	pandacasi	9.390039	-7.129935	story	5.0	7.0	1587101843	-13.486468
22914322	3 thoughts:1. Didn't he had already 	3 thoughts:1. Didn't he had already a personal website?2. Why is he teaching Basic over Scratch?3. Will it scale to Kubernetes one day?	mister_hn	9.341149	-7.1881256	comment	5.0	12.5	1587283444	-13.500588
22938929	Resources for cloud independent arch	Resources for cloud independent architecture design?	carnitas	9.361592	-7.1684732	story	5.0	9.0	1587500402	9.311485
23005147	I think we all understand the useful	I think we all understand the usefulness of a road-warrior-style VPN. But it doesn't seem so clear what k8s is adding here?Anyway, on the topic of scalable UDP services, does anyone have any experience of load balancing a UDP service? Because UDP is connection	tombh	9.365327	-7.1695914	comment	5.0	15.0	1588065142	-13.474055
23041981	what do you end up using instead of 	what do you end up using instead of k8s?	tuananh	9.344006	-7.181737	comment	5.0	13.0	1588341272	-13.490633
23042069	question: if not k8s, what everyone 	question: if not k8s, what everyone has been using to orchestrate containers at home? Ideally, I just want something easy to setup, low maintenance cost and easy to backup and restore if sth went wrong.i've been using k8s at work for over 4 years but for home 	tuananh	9.391944	-7.0987244	comment	5.0	13.5	1588341850	-13.502926
23058716	Docker Swarm Cluster Complete Guide	Docker Swarm Cluster Complete Guide	lukasbar	9.416408	-7.030237	story	5.0	84.0	1588510812	-13.472623
23082457	So are these rumors about apple comi	So are these rumors about apple coming out with a PAAS/workload system that I've been hearing for 2-3 years starting to turn true? They've started hiring a lot of kubernetes engineers and afaik they were a mesosphere shop until evidently recently (judging by t	mjayhn	9.362355	-7.1684556	comment	5.0	14.5	1588699536	-13.482328
23143423	Running Spark on a Kubernetes cluste	Running Spark on a Kubernetes cluster is already pretty easy, so it is unclear what value this is adding. Controlling cost is the hard part. You may only need a cluster for 1 hour per day for a nightly aggregation job. Kubernetes clusters are not easy to provi	flowerlad	9.395226	-7.137395	comment	5.0	13.5	1589212328	-13.452302
23146077	This page really should just support	This page really should just support get params in the url! Do you know how many people I could trick into believing this with ?FLASHY_LANGUAGE=rust&HYPED_TECHNOLOGY=kubernetes ??	spiantino	9.346781	-7.185255	comment	5.0	15.0	1589225916	-13.491797
23213748	In my opinion, the most common mista	In my opinion, the most common mistake is not in the article : using kubernetes when you don't need to.Kubernetes has a lot of pros or the papers but in practice it's not worth it for most small and medium companies.	speedgoose	9.34708	-7.182051	comment	5.0	22.0	1589738167	-13.509991
23279099	I guess I'm much more conservative t	I guess I'm much more conservative than other folks, but I think we've scratched only 10% of the surface of the benefits that things like Kubernetes, Consul, Vault and Terraform should/will provide.So they're on the list. I feel like at my job I'm pushing at t	busterarm	9.373487	-7.135631	comment	5.0	14.5	1590198619	-9.406479
23303250	> This setup is not trully highly av	> This setup is not trully highly available. The whole cluster depends on the Synology as data storage. You could improve this further by replacing the centralized NAS with a distributed solution. But besides that the cluster is very solid and scalableI unders	NikolaeVarius	9.357623	-7.1632614	comment	5.0	12.5	1590429823	-13.492421
23355135	According to the article you are wro	"According to the article you are wrong about ""infrastructure as code"". Kubernetes is infrastructure as data, specifically YAML files. Puppet and Chef are infrastructure as code.Edit: not sure why the down votes, I was just trying to point out what seems like a"	bosswipe	9.378164	-7.1622133	comment	5.0	13.5	1590784227	-13.465981
23355227	I've only ever used cfengine and Ans	I've only ever used cfengine and Ansible, but they are both declarative.  Hell, Ansible uses yaml files too.I would be somewhat surprised to find out Puppet and Chef weren't declarative either.  Because setting up a system in an imperative fashion is ripe for 	bcrosby95	9.672641	-7.0286145	comment	5.0	19.5	1590784747	-13.30356
23355838	Yes, people ought to do a side by si	Yes, people ought to do a side by side comparison of a new user learning to K8S v AWS v GCP before claiming Kubernetes adds more complexity than it returns in benefits.Remember the first time you saw the AWS console? And the last time?	verdverm	9.355916	-7.1759653	comment	5.0	37.0	1590788224	-13.466163
23356141	Reading this charitably: I guess I a	"Reading this charitably: I guess I agree. k8s is definitely overpowered for my needs. And I'm almost certain my blog or my business will never need that full power. Fully aware of that.But I'm not sure one can find something of ""the right power"" that has the s"	silviogutierrez	9.354648	-7.1731663	comment	5.0	28.5	1590790264	-13.492536
23356194	Hmm really?  My experience is that, 	Hmm really?  My experience is that, with k8s I end up learning all the complexities of k8s in addition to AWS.Besides, personally I find AWS console much easier to understand.  I don't get why people hate it.	yongjik	9.354678	-7.1765857	comment	5.0	23.0	1590790645	-13.490433
23356500	Curious why run it at all?  The cost	Curious why run it at all?  The cost must be 10 times more this way.  It is mostly for the fun of learning.I come from the opposite approach.  I have 4 servers two digital ocean $5 and two vulr $2.50 instances.  One holds the db.  One server as the frontend/co	wolco	9.348435	-7.1828694	comment	5.0	26.0	1590792379	-13.486599
23365573	I wrote a beginners guide to Kuberne	I wrote a beginners guide to Kubernetes	pj3677	9.344006	-7.1858425	story	5.0	165.0	1590879423	-13.500937
23372125	Show HN: k3sup ('ketchup') – bootstr	Show HN: k3sup ('ketchup') – bootstrap Kubernetes with k3s over SSH	alexellisuk	9.356079	-7.1738005	story	5.0	67.0	1590954537	11.878466
26519149	Don't get it.  Seems like someone is	Don't get it.  Seems like someone is trying to make Kubernetes work on Service Fabric or something.	outside1234	9.34205	-7.188177	comment	5.0	13.0	1616195839	-13.498192
26519144	An abstraction (OAM)On the top of an	An abstraction (OAM)On the top of an abstraction (K8s Custom Object specification)On the top of an abstraction (Kubernetes, et.al.)On top of another abstraction (Containers)On top of another abstraction (VMs)I wonder if the Dyke-sealing-boy is available for th	falcolas	9.462245	-7.0408897	comment	5.0	19.0	1616195796	-13.449647
26562831	Keeping scrolling! Under GKE (manage	Keeping scrolling! Under GKE (managed Kubernetes), you see the call outs to EKS and AKS, respectively.The Anthos point is that other clouds don't offer their k8s stacks as supported options on other clouds.If you see things you find wrong in the table, let me 	richards	9.358003	-7.170675	comment	5.0	14.5	1616552453	-13.483471
26634907	Things like that make me shake my he	"Things like that make me shake my head every time I hear ""Go is easy to learn.""No. It's not. There are way too many dark corners with things lurking there to bite you. It just ""looks easy"" until you try to do something non-trivial.Used to love it but the more "	one2three4	9.367205	-7.182272	comment	5.0	14.5	1617114125	-13.499789
26663855	This is ~17k lines of shell scriptin	"This is ~17k lines of shell scripting and claims to be ""simple"". Kuberentes is probably ~1m lines of Go. I'm not entirely convinced that this is less complex (simpler) than Kubernetes.There are many factors in complexity, but a big one for me is what I have to"	danpalmer	9.425037	-7.1356525	comment	5.0	15.0	1617299547	-13.495223
26714822	It's sad, but expected.This is not a	It's sad, but expected.This is not about Apache, but a failed open-governance for commercial open-source from Mesosphere. It's not the case with Apache Spark nor Apache Beam, HBase, etc.Mesos (and many other Berkeley AMPLab efforts) had briliant ideas behind i	random3	9.3805275	-7.148422	comment	5.0	17.5	1617730292	-13.494351
26738512	Hello! I am one of the maintainers o	Hello! I am one of the maintainers of Ory Keto. We spent a lot of time and effort to read, learn, and analyse the Google Zanzibar paper (https://research.google/pubs/pub48190/) and the release brings that all together. There are still many things missing, but 	neupatr	9.333143	-7.192541	comment	5.0	16.0	1617889011	-13.46519
26788181	I agree with you for the Heroku of a	I agree with you for the Heroku of a decade ago.Now, I'd say Render is the modern version of what Heroku was. It's super easy to use for Rails/Laravel/Node/etc, it doesn't break clustering of Elixir apps and static sites are free.	AlchemistCamp	9.167785	-7.3814073	comment	5.0	13.0	1618288795	-13.529965
26800724	I'm sure this has benefit to someone	"I'm sure this has benefit to someone but it doesn't really answer my core ""K8S is simple"" question in my mind:Single node proxmox VM/LXC mix homeserver. Is learning K8S worthwhile?I can see it helping me on cloud tech (inherently multi node) yet seems like a n"	Havoc	9.358097	-7.16267	comment	5.0	13.0	1618355686	8.092222
26993634	To get the cluster up and running us	To get the cluster up and running using AWS EKS, it costs $0.10/hour which means at a minimum you're spending $72/mo ($860+/year) to just run the cluster and not the underlying resources. How do you justify this and compare against other options like Qovery?	EncoreApp	9.367157	-7.1669927	comment	5.0	15.0	1619791615	-13.476326
26993680	On the one hand, I don't want to pos	On the one hand, I don't want to post a shallow dismissal on your big launch day. On the other hand, this does look like something that's been tried a dozen times before. To name one example, Convox (https://convox.com/) started out using ECS on AWS, but more 	mwcampbell	9.35321	-7.173979	comment	5.0	17.5	1619791813	-13.465255
27053916	Ask HN: Where to Learn Kubernetes?	Ask HN: Where to Learn Kubernetes?	Radamantz	9.348319	-7.1838036	story	5.0	17.0	1620239953	-13.516085
27172851	Vcluster – Create fully functional v	Vcluster – Create fully functional virtual Kubernetes clusters	kiyanwang	9.348346	-7.1799	story	5.0	35.0	1621163618	-13.494368
14788741	Overengineering the Deployment of St	Overengineering the Deployment of Static HTML with CI/CD Docker and Kubernetes	mswehli	9.368103	-7.1269093	story	5.0	52.0	1500301561	-13.44592
14857236	Does anyone know what service discov	Does anyone know what service discovery, network security policy and ability to add multiple redundant copies of the same service this offers?I'm guessing it's powered heavily by kubernetes, so maybe that answers the question, but I'd be interested to know mor	sammorrowdrums	9.359229	-7.169402	comment	5.0	13.0	1501084201	-13.514468
15037601	"The author says it's ""hard to use El"	"The author says it's ""hard to use Elixir with services like Heroku because your instances won’t find each other by default (the way they’re supposed to)"".I just wanted to mention https://gigalixir.com which is built to solve exactly this problem.Disclaimer: I'"	jesses	9.175546	-7.3761253	comment	5.0	15.5	1502983718	12.84728
15179429	Show HN: Online ansible playground w	Show HN: Online ansible playground with an introductory tutorial	turkenh	9.68352	-7.0574155	story	5.0	20.0	1504648483	-13.290531
15186580	I recently reached out to Mesosphere	I recently reached out to Mesosphere to better understand the value and options available to my company if we switched to Mesos (and thus Mesosphere). We currently run Kubernetes across all major cloud providers and we'd like some help.I was startled by how do	slap_shot	9.381583	-7.1417017	comment	5.0	18.0	1504727336	-13.485793
15315455	OpenShift is a fork of Kubernetes.  	OpenShift is a fork of Kubernetes.  Case in point.  OpenShift has functionality called a Route.  That isn't in Kubernetes.  Kubernetes of course went and added something similar called ingress.This means that anytime Kubernetes does a release that RedHat has t	breser	9.407672	-7.0380726	comment	5.0	22.5	1506111749	-13.440145
15325860	Neat! I was looking into tracing sol	Neat! I was looking into tracing solutions for our k8s cluster the other day and was going to look into setting up Zipkin.  Now I'll this to my list of tools to evaluate. I found this blog post by uber informative https://eng.uber.com/distributed-tracing/ so m	jhinds	9.37373	-7.1705127	comment	5.0	19.5	1506278045	8.317274
15489798	Why wouldn’t you start with Kubes? L	Why wouldn’t you start with Kubes? Less vendor lock in and a much bigger community.	mrmondo	9.349369	-7.177531	comment	5.0	21.5	1508235047	-13.5311365
15487893	Volume Monitoring in Kubernetes with	Volume Monitoring in Kubernetes with Prometheus	qubit23	9.367175	-7.1687045	story	5.0	58.0	1508201751	9.410292
15597017	Heptio Contour – An ENVOY powered in	Heptio Contour – An ENVOY powered ingress controller	lazypower	9.335293	-7.2027106	story	5.0	50.0	1509487703	4.4150925
28836716	Dropping by to express healthy inter	Dropping by to express healthy interest in this project.Rancher have a pretty good track record so far:  - the Rancher platform itself (https://rancher.com/) is a really powerful and user friendly way to manage container clusters of all sorts, giving you a sel	KronisLV	9.379066	-7.122804	comment	5.0	22.5	1634020269	-13.478815
28876118	As a Xoogler it's always seemed weir	As a Xoogler it's always seemed weird to me how Kubernetes was compared to Borg. Kubernetes covers a much larger set of things than Borg alone, and I don't necessarily think that's for the better. Being written in a language that isn't well-suited to large pro	tazjin	9.378208	-7.1479154	comment	5.0	38.0	1634292548	-13.518632
28877700	Hi, I see you mention the tiniest no	Hi, I see you mention the tiniest nodes in Hetzner there, whereas the Nomad documentation [0] talks about 3-5 server nodes in the 2-digit GiB memory range, which is what has kept me from trying Nomad as I find it insane. How much truth is there in the docs?[0]	Uberphallus	9.406379	-7.116447	comment	5.0	16.5	1634306059	-13.25682
28880357	For work I can totally understand th	For work I can totally understand this trade-off but this fact makes k8s pretty much a non-starter on side projects or personal sites because running a small cluster on small nodes leaves you so little headroom for your code that it's just not worth it. Swarm/	Spivak	9.341584	-7.1824107	comment	5.0	12.5	1634318778	-13.488633
28885586	Redis Cluster Re-Implemented in Rust	Redis Cluster Re-Implemented in Rust: Scaling Redis Easily in Kubernetes	doyoubi	9.388749	-7.161825	story	5.0	106.0	1634359039	9.486007
