id	x	y	type	relevance	size	year	umap1d	hovertext	url	author
35298044	9.261843	7.6452665	comment	4.0	16.0	1679706949	13.964806	My experience is that this is a lost cause. AirBnB will always favor the host guilty or not. They provide no support for the end user.Everyone hates AirBnB now. The only problem is there is no sensibl...		csomar
28157869	9.499748	7.662202	comment	4.0	19.5	1628783726	13.953967	I think none of his claims about the cause are the real one. It's more like: Uber undercut taxis by using VC money to try to buy market share, which worked, but now they have to raise prices and less ...		jeffreyrogers
28297525	9.2672	7.652576	comment	4.0	12.0	1629859757	13.961997	I'm honestly not a fan of this, despite how well intentioned it may seem (road to hell?)AirBnB is honestly trying too hard with this PR move, it boggles my mind that shareholders don't reign in corporate stunts like this.		blahblahblogger
28331588	9.267176	7.637798	comment	4.0	15.0	1630090196	13.959021	The whole argument of this article seems misplaced.There is enormous demand for both temporary and permanent housing in many places, and to some degree it is fungible.  If it wasn't Airbnb, some other...		BayAreaEscapee
28332526	9.266419	7.64056	comment	4.0	16.0	1630095393	13.96937	The article makes many valid points but..why is that Airbnb's problem? Why not city, state, and local governments whose jobs it is to resolve the very issues the article raises? That logic is not one that I am able to follow, other than it is a big, easy name with money.		Ajay-p
28371820	9.317538	7.640278	comment	4.0	13.0	1630435039	13.959857	You have the Ubers and AirBnBs circumventing laws around the world and you think it's hard to optimize for a remote law and accountancy practice? Just have offshore remoters do the bulk of work and have it signed by a certified local lawyer / accountant.		ThalesX
28585482	9.268806	7.6509476	comment	4.0	13.0	1632068092	13.982478	Airbnb ruined Couchsurfing because it changed social expectations around hosting strangers at your house. Before Airbnb, no one really even thought people would pay for the privilege to sleep on your ...		nateberkopec
28587260	9.263062	7.6425357	comment	4.0	12.0	1632080611	-3.245884	It was well thought out too, hard to spam with fake comments etc.My family hosted people for a year or two and we were never empty. The appeal of a family home with a private room that had dozens of r...		zwayhowder
28659702	9.264725	7.6467867	comment	4.0	11.5	1632651176	13.96089	I find it interesting that the author only looks at Airbnb as a source of housing, but it seemingly doesn’t occur to them that it’s also a way to flip their liability (their house) into an asset.I mov...		madaxe_again
22404877	9.385955	7.6577888	comment	4.0	12.0	1582558631	13.954774	It's easy to criticize AirBnB and Uber. Try to do something with a similar impact. If that's not an innovative company, I don't know what is it.I don't particularly like Uber and AirBnB, to be clear. But it's hard to deny they're rare and valuable.		simonebrunozzi
22530256	9.540854	7.661464	comment	4.0	21.0	1583790769	13.964678	It reminds me of all the Uber and Airbnb clones that didn't recognize that the primary features that created their success was the commoditized nature of the seller and the ability to tap into latent ...		slg
22562433	9.266262	7.631299	comment	4.0	11.5	1584051075	13.962358	My experience with AirBnb has been good but often I feel I miss something. If possible I always almost choose a hotel, because it seems cleaner, service oriented, often has breakfast and a place to ha...		danielovichdk
22639788	9.268292	7.641174	comment	4.0	14.0	1584727514	13.961155	As someone that would like to buy a house one day, I welcome this. People owning multiple houses to rent out to vacationers that people would like to actually live in doesn't upset me at all.If people...		tylerchilds
22642899	9.26335	7.646134	comment	4.0	12.0	1584747928	13.962017	First Airbnb use, I booked a week just outside a national park. While driving, just before I arrived, the host cancelled, leaving me with an option of cancelling my trip, or a $400/night Best Western.  Airbnb should have compensated me for that one. I’ll never use them.		jmpman
22652170	9.272731	7.649033	comment	4.0	15.0	1584843911	13.960819	Instead of worrying about how people choose to rent their properties, they should instead look to the source of high rental prices, which is bad zoning laws and insufficient total units.Meanwhile Airb...		lend000
22652694	9.267953	7.639399	comment	4.0	10.5	1584850792	13.97196	> the reality is that neighbours of that Airbnb bear the externalitiesWhat toxic waste, exactly, do Airbnb listing dump on their neighbours?Professional Airbnb investors buy up whole properties, renov...		golergka
22652712	9.266287	7.642247	comment	4.0	10.5	1584851034	13.980598	Upfront rent is totally fine, Airbnb itself charges upfront. But 3 upfront rents? Ive never gotten a deposit or the extra rent back at the end. Airbnb isnt a real solution but i dont think landlords ever were either		seisvelas
22709970	9.272602	7.629066	comment	4.0	12.0	1585384884	13.960301	Usually companies just hire on people at that stage to show growth, so that they’ll get more money.Look at AirBnb - they don’t need thousands to operate their business, but they have them and they continue to hire		akmarinov
22710895	9.267486	7.641815	comment	4.0	30.5	1585400693	13.954778	I live in touristy city, and I wish nothing more than to see Airbnb crash and die.Finding rent here is mission impossible, most landlords will happily rent to you for a contract that ends at the start...		Raed667
22733068	9.261656	7.650264	story	4.0	25.0	1585609367	13.96327	Airbnb Will Give $250M to Hosts Who Lost Income to Virus	https://www.bloomberg.com/news/articles/2020-03-30/airbnb-will-give-250-million-to-hosts-who-lost-income-to-virus	rayuela
19235395	9.265774	7.6389174	comment	4.0	20.0	1550955114	13.95504	Is there a monopoly to break?   Are all hotels in NY owned by the same group?There are other issues as well of course, that Airbnb guests (and the owners) who are running a hotel don't care at all if ...		duxup
19189671	9.260396	7.6501055	story	4.0	28.0	1550484198	13.961222	I got banned for life from AirBnB	https://thenextweb.com/syndication/2019/02/18/how-i-got-banned-for-life-from-airbnb/	xbmcuser
19332919	9.251986	7.646581	comment	4.0	11.5	1551995711	13.964767	If an Airbnb is a lot cheaper there is going to be a reason, often it's location. I tend to move around and the ridiculous cleaning fees for Airbnb make it a non-starter. I'm flying to San Diego tomor...		jonknee
19333143	9.301102	7.6388993	comment	4.0	14.0	1551997288	13.896038	"Whether or not a company is a ""tech"" company is kind of a muddled question, but taking even a brief glance at https://airbnb.io/ (their engineering blog) makes it clear that AirBnB does some pretty se..."		dpandya
19335642	9.27112	7.6360226	comment	4.0	11.0	1552027821	-1.5489371	What about those of us who do not wish to take in any of this and still pay the consequences?In Madrid rent is up a staggering 17% YoY, mostly due to AirBnB. That affects anyone looking for an apartme...		arcturus17
19334350	9.269392	7.608942	comment	4.0	13.0	1552008339	13.95524	It really seems to depend on the city. For about $100/night in Zurich I stayed once in a huge top floor flat and once in a bedroom with private bath in a giant palace with plenty of room to entertain ...		shereadsthenews
19417245	9.419598	7.6315393	comment	4.0	10.5	1552862788	0.91400313	Airbnb or Uber are not really tech companies. They are business companies with a WebApp required as part of the execution. They didn't invent anything on the technical level, they brought some busines...		warp_factor
19427296	9.267482	7.6404366	comment	4.0	12.5	1552959450	13.961221	Here, according this[0] report Toronto has around 6200 entire units as airbnb units. That's at the very least 6200 less rental units in the market. And you know very well how supply and demand works. ...		parthdesai
19443827	9.264916	7.651304	comment	4.0	18.0	1553099470	13.972609	The more I look at AirBnb, it reality it seems like a conspiracy to enable illegal activity (illegal listings, not collecting taxes). I wonder if in the future, a US Attorney or State Attorney General...		RcouF1uZ4gsC
19443839	9.262529	7.6420827	comment	4.0	24.0	1553099561	13.961979	Edit, it was shut down because my local area has a rule against bed and breakfasts that aren't located on a main road.Our Airbnb got shut down after a year by the local government. It wasn't a safety ...		frontloadpro
19443916	9.265748	7.643484	comment	4.0	12.0	1553099925	13.964986	To be sure, these aren’t Airbnb’s taxes, any more than Hilton “pays” taxes for its guests’ hotel stays. Rather, the officials sparring with Airbnb want the company to collect and forward the taxes fro...		stcredzero
19444226	9.286816	7.6147227	comment	4.0	27.5	1553101493	13.954025	I run a vacation rental in a small town in the mountains of Colorado.  I'm quite happy to pay the taxes the town demands.  Our place is busy, and our guests make a significant impact on the town, spen...		nate_meurer
19444146	9.271339	7.6443653	comment	4.0	14.0	1553101148	13.954101	I find it really unfortunate that the airbnb debate is always so polarized.AirBNB has often provided me a better alternative to a largely terrible hotel market that often takes racket prices and makes...		hannob
19473778	9.268994	7.638289	comment	4.0	22.0	1553394387	13.964353	Is this a surprise? I stayed at places in Vancouver and Seattle 2 years ago that had prominent signs in the lobby straight up stating the building did not allow Airbnb and the hosts had instructions a...		a2tech
19473956	9.2632475	7.6405225	comment	4.0	12.5	1553396796	13.962571	Almost every Airbnb I've stayed in has felt a bit like this--like I'm not really supposed to be there--and it's a reason I tend to stay in hotels.I appreciate the premise of staying in a city a bit mo...		dehrmann
19474117	9.262361	7.6452055	comment	4.0	12.5	1553398781	13.961812	I've stayed at quite a lot of Airbnb over 4 years of traveling and every time this happened I reported it to Airbnb and they were usually quick to help me get into another place. The service got worse...		reustle
19474225	9.263717	7.647901	comment	4.0	12.5	1553400293	13.963954	It’s the right thing because airbnb distorts house prices (among other factors too). In some cases pricing locals out  of the market in place of tourists. Which is why those rules are often in place.		josho
19474362	9.490279	7.662524	comment	4.0	15.0	1553402459	13.960723	Uber and Airbnb are completely different beasts. At least rideshare benefits both residents and visitors alike and taxis are universally hated for high rates and fees.How does Airbnb benefits resident...		randomacct3847
19506287	9.268699	7.64117	comment	4.0	16.0	1553722368	13.961583	Somebody should Airbnb this. Who wouldn't want the opportunity to cross the United States in their own personal rail car? No airports to deal with, no impersonal hotels. Sounds like a retirement dream.		pseudolus
19537284	9.26791	7.6423965	comment	4.0	17.0	1554057026	13.972325	Actually, I would guess catching people that try to Airbnb their rent-stabilized apt (short-term guests).Honestly, I agree it is would be kind of messed up for someone to have the fortune of winning a...		tmp192489
19603612	9.265642	7.6386056	comment	4.0	23.5	1554716150	13.964237	There is no way I am staying at another Airbnb if there is a hotel.		nfjdjajjdj
19771591	9.279239	7.6198363	comment	4.0	31.0	1556465091	4.9013214	What about the people owning homes as investments, or as part of their retirement plans?  You can argue that a lake house would be taxed because it's lived in part of the year (weekends), but what if ...		chiph
19853418	9.28182	7.648885	comment	4.0	23.5	1557262922	13.959375	Intermediary platforms such as Airbnb and Uber exacerbate cities’ housing problems and weaken worker protections.Its interesting that this line has no support and just treated as fact for this article.  Is there a source to explain the reasoning?		protomyth
15786784	9.263509	7.649136	comment	4.0	12.5	1511785605	13.967965	So let me get this straight:1.) they book a night at a cooperating-host with a stolen credit card2.) host receives payment minus AirBnB fees 2 days later3.) host transfers amount minus his own cut to ...		philfrasty
15787102	9.264866	7.6495237	comment	4.0	15.0	1511789274	13.982834	My point is they call AirBnB out specifically when they're not the only ones that have this issue and that could be used to do this.  They even state in the article that AirBnB is just being used as a...		zodPod
16148207	9.267624	7.640964	comment	4.0	17.5	1515985505	13.964114	Speculation shouldn't drive up the price of rent. If anything, it should drive rents down because more units will be built to satisfy speculators which will then be contributed to the pool of availabl...		jordanb
18049279	9.263486	7.6503687	story	4.0	100.0	1537674357	13.981164	Airbnb asks SEC to let it give hosts equity	https://www.axios.com/airbnb-asks-sec-to-let-it-give-hosts-equity-a7d99495-0782-4bce-92bb-4c692ef1b621.html	sethbannon
18127798	9.265196	7.6458817	story	4.0	59.0	1538544091	13.958401	Customized regression model for Airbnb dynamic pricing	https://blog.acolyer.org/2018/10/03/customized-regression-model-for-airbnb-dynamic-pricing/	feross
18314308	9.267638	7.6390843	comment	4.0	12.0	1540613539	13.960645	Another aspect of Airbnb is that it makes everywhere the same as far as interior decor goes. Traditional rent seeking landlords spend $0.00 on things like paint, carpets and fixtures, preserving place...		Theodores
18387545	9.295407	7.5925326	comment	4.0	15.5	1541466993	13.959108	Property owners are responsible for the housing crisis. The city is at their whim.But that’s beside the point, because this is a case about an unlicensed Airbnb. I don’t know what the laws are where y...		ilikehurdles
18516204	9.41452	7.6592083	comment	4.0	13.5	1542979136	13.958978	"Horrific predicted tech enabled dystopia now in China.
Where next? what if airlines taxis and hotels shared ratings, would the west be so different?
I hate Uber Airbnb pestering me for a rating every ..."		garyclarke27
18571538	9.2627125	7.650438	comment	4.0	10.5	1543604053	13.96847	Celebrating? HN is extremely anti-Airbnb.		ryanwaggoner
18572786	9.268459	7.6330957	comment	4.0	34.5	1543613218	13.960653	This is cool, but selfishly speaking, the area I'd really like to see Airbnb sink their teeth into is the apartment rental market. I've rented a few long-term (~3 month) sublets on Airbnb, and the pro...		danenania
18914237	9.267496	7.6479974	comment	4.0	11.0	1547581400	13.976559	> The risk for regulation has passed as citizens see AirBnB as an accepted reality. Hotels aren't happy, but rightfully see AirBnB as a competitor.I agree with your overall, but I'm not so sure I agre...		jedberg
18914372	9.255402	7.6549387	comment	4.0	11.5	1547582135	13.961352	> vacation rentals outside of major metropolitan areas that AirBnB has conquered from craigslist.Last time I looked, many/most vacation rentals are multiply listed on VRBO, etc. Is there a reason to think that AirBnB is stickier than the other vacation rental sites?		ohazi
18922227	9.256846	7.649803	comment	4.0	11.5	1547656320	13.964982	I would have called Airbnb as soon as I found there was an issue and made them book me in somewhere else. You are paying a service fee to them for a reason.		fyfy18
18924981	9.264763	7.6458077	comment	4.0	11.0	1547671608	13.959597	I consider Airbnb to be a menace to society. The hotel industry exists for a reason.I've been lucky and never had a truly bad experience with Airbnb, but I've had some lousy ones and never a top notch...		city41
18925079	9.263171	7.6505036	comment	4.0	12.0	1547672095	13.969249	When I interviewed at Airbnb, they asked me about one thing I learned in the past that could be useful for Airbnb.I suggested that people who are developing the product should once in a while spend a ...		iabacu
29797181	9.26587	7.651663	story	4.0	5.0	1641316596	13.956442	My friends have Covid Airbnb won't allow us to change our reservation		justinzollars
30317950	9.26338	7.6488166	story	4.0	6.0	1644713452	13.980758	‘I would’ve left’: TikToker says Airbnb host charged them for air	https://www.dailydot.com/debug/airbnb-host-charges-guest-for-air-tiktok/	serverlessmom
30414039	9.289718	7.5772166	comment	4.0	16.5	1645438997	13.905867	That's the moment I'd recommend you to close the website and book a hotel.The whole pandemic reminded me I miss staying in hotels.Not having to worry about groceries, lunch, cleaning ... A great hotel...		postit
30414160	9.263546	7.645554	comment	4.0	46.0	1645439823	13.98388	Airbnb has been very human hostile since the beginning.The first time I had to create an account, they required that I connect with a google account with access to all my contacts. Then ask me to make...		BiteCode_dev
30414398	9.267242	7.634263	comment	4.0	17.5	1645441857	13.958221	Why would Airbnb be to blame for this? They're providing a market that fulfills demand for low cost or privately owned accommodations, competing directly with the established hotel industry. Not every...		imiric
30526667	9.249506	7.6377335	story	4.0	1.0	1646224727	13.960958	Ask HN: Can Airbnb Help housing Ukrainian escapees in central europe, please?		nakedrobot2
16234866	9.261013	7.6381454	comment	4.0	15.5	1516915867	13.959222	> I prefer hotels to AirbnbI really don't get this kind of opinion, just because it is so binary. Hotels are great when you need to quickly check-in and check-out, although the experience vary grandly...		baby
16323023	9.262647	7.655037	comment	4.0	12.5	1517992140	13.958981	Before I say what I'm about to say: I know nothing about Airbnb's finances (aside from what's mentioned in the article) and I have no idea if it actually does or does not make sense for them to go pub...		kelnos
16334810	9.279154	7.6180434	comment	4.0	12.0	1518117906	-0.69290197	I understand that they are doing this to help keep housing costs affordable, but Detroit needs tourism income more than they need affordable housing at this point. They have plenty of land and run down houses that can be fixed up if AirBnb raises the cost of real estate in one area.		ChrisBland
16543826	9.262823	7.645369	comment	4.0	32.5	1520510785	13.959958	I've said this before, and I'll say it again. AirBNB is a blight on rural areas (I can speak to this because I reside in rural Scotland) where affordable rental properties are simply disappearing from...		teh_klev
16987771	9.269007	7.6414566	comment	4.0	13.5	1525367562	13.964976	If a few thousand airbnb units cost renters that much money, imagine how much renters would save if more and taller buildings were allowed to be built!		travisp
16988513	9.280724	7.619668	comment	4.0	12.5	1525372386	13.95618	"This is not what people traditionally think of as ""rent-seeking."" Rent-seeking behavior is doing something to get more money without providing any corresponding value. AirBnb hosts do provide value --..."		sdhgaiojfsa
16987637	9.267966	7.6357565	comment	4.0	11.5	1525366613	13.963638	"Is there really much evidence that the majority of Airbnb properties would otherwise be traditional ""12 month lease"" rental apartments if it were not for Airbnb.I mean, I'm sure there are a few, but i..."		josephorjoe
17076654	9.2662115	7.6476865	comment	4.0	17.0	1526410619	13.950063	I find it profoundly stupid for Airbnb to have their own typeface. It's like they have lots of designers around and have to keep them busy with something.Well at least they did not give them the usual entertainment for bored designers: redesigning stuff that does not need a redesign.		iblo66
17141691	9.264281	7.648457	comment	4.0	12.5	1527145578	13.965818	In practice, Airbnb has failed at its aim of providing airbed style accommodations for conference goers.		dnautics
17266871	9.26875	7.635909	comment	4.0	13.0	1528474509	13.957259	I can't speak to this problem in tourist destinations or Europe generally as I don't have enough data to have an opinion, but I frequently see Airbnb blamed for high housing costs in some American cit...		Thriptic
22781137	9.275166	7.6569314	comment	4.0	11.0	1586031355	13.959364	"Is the narrative that big companies are safe havens for job seekers actually true? Isn't Airbnb a ""big"" company?"		wgyn
22808774	9.266942	7.6482935	comment	4.0	23.5	1586303677	13.955343	AirBnb is in an existential crisis right now... it might take years before their market recovers...It makes absolutely sense to have enough money to weather this storm....Even firing people costs mone...		ardit33
22810296	9.268205	7.649667	comment	4.0	11.0	1586323321	13.962367	I always read this comment and and amazed how people here underestimate the complexity of running a large business with global reach and billions of dollars in transactions. Airbnb is in >100 countrie...		dmode
22901857	9.265041	7.655288	comment	4.0	20.0	1587150065	13.962791	Apparently internships are deferred till next year. Don't know how that'll work.It's entirely possible Airbnb never comes back after this, and that a competing product will not be able to fill its sho...		kaesar14
22948199	9.265699	7.6492763	comment	4.0	12.0	1587577587	13.966776	But why it's burning hole in the finances? AirBnB is all marketing. Scale down your cloud instances and don't spend on ads? What exactly burning money at the rate of 1B per month? It's not clear from the article at all.		betaby
22978685	9.2643175	7.654452	comment	4.0	13.5	1587827454	13.965262	Airbnb must be making ZERO dollars right now. Wonder how long they can survive in this situation. They sure have a lot of funding but they were close to going public and returning money to their inves...		yalogin
23084076	9.272833	7.6514053	comment	4.0	11.0	1588708003	-2.9532192	Good engineering culture...?Airbnb is a simple CRUD app...it’s hardly a shining example of hard deeply technical engineering problems that are fun and interesting to work on.		tempsy
23084174	9.294087	7.6808243	comment	4.0	16.0	1588708444	13.986889	I would too, but the thing holding me back is if the shit hits the fan, and I need to do something like buy a freezer to store extra food, I can't conveniently do that in an Airbnb. And if I somehow g...		ping_pong
23084552	9.269164	7.6518636	comment	4.0	10.5	1588710156	13.964821	"Ugh, to be honest I get tired whenever I see the ""Why did company XYZ need so many people, they're just a website!""-type comments. While it is definitely possible AirBnB was bloated, it's not hard for..."		hn_throwaway_99
23085535	9.266951	7.642905	comment	4.0	12.5	1588715660	13.945661	While I don't want to seem like I'm wishing unemployment or hardship on anyone, the implosion of Airbnb is already causing a rent price correction that was sorely needed in many cities that have becom...		atomic77
23084947	9.2670965	7.647375	comment	4.0	10.5	1588712080	13.961297	Once places open up in a few months, I expect a massive short-term surge in demand for AirBnB lodging.I know for a fact that by the end of summer (assuming places open up like planned), I will start t...		filoleg
37747686	9.260155	7.64358	comment	4.0	12.0	1696304256	13.961905	"AirBnB used to be a cheap stay.  Now it's often not.  Many hosts charge the equivalent of an extra night as a ""service fee,"" pushing up the total price for the stay and making it harder to compare pla..."		deadlyllama
37806296	9.267296	7.6364284	comment	4.0	11.0	1696720308	13.954245	Having used airbnb in multiple countries I have never seen the appeal over hotels, except for location/neighborhoods.I also don’t understand the appeal of Kardashians		sharts
37954263	9.262227	7.647725	comment	4.0	13.5	1697796703	13.994649	All I can say is that the reason this person hasn't received a response from Airbnb is because it is extremely difficult to prove that this happened and that this was the doing of the guest.I get that...		skilled
25455859	9.263019	7.644587	comment	4.0	12.0	1608215551	13.97366	In AirBnB's case were there actually any preexisting rules?  It would seem strange to have rules in place governing short term rentals before there was really even a market for that.		travisoneill1
25470604	9.261685	7.6425767	comment	4.0	12.0	1608318089	13.927583	I don't think early AirBnB employees think their equity was a terrible deal. 0.01% of equity is now worth $9m.		thesausageking
25486738	9.238626	7.522837	comment	4.0	11.0	1608477270	13.975755	Airbnb does this all the time. Their advertised prices don’t include cleaning fees.If Airbnb included those fees the pricing would often come out higher than a hotel in many cases. And hotels include cleaning costs as part of the nightly rate		baskire
26182162	9.275717	7.651844	comment	4.0	12.0	1613666999	13.958156	I don't pretend to be an expert, but what 'tech' is there to AirBNB exactly? A SQL database setup and UI CRUD layers for every popular platform?Why does this company even need a hub? It could use some...		alexashka
36674936	9.277985	7.611314	comment	4.0	10.5	1689034852	13.955087	If you are travelling as a single person or a couple hotels sure. As a family the hotel experience is really bad or out of reach price wise. I'm just about to go on a vacation and we looked into hotel...		jemmyw
36768874	9.26547	7.6365714	comment	4.0	12.0	1689663939	13.959159	Depends on the vertical. I would not be real comfortable booking lodging on some random portal, especially if we're talking more of an AirBnB thing vs hotels.		TylerE
36780785	9.263726	7.650908	comment	4.0	11.5	1689726561	13.961444	I don't know if AirBnB is truly in decline given these anecodtes. Any such decline doesn't seem to be reflected in their quarterly revenue yet. But, as I've said for years, I hope AirBnB dies. It's ca...		jmyeet
