id	label	hovertext	author	x	y	type	relevance	size	year	umap1d
35608624	A Kubernetes Operator in Rust	A Kubernetes Operator in Rust	alykafoury	9.357098	-7.207026	story	6.0	54.0	1681778944	-13.497768
36167249	It's a marketing device for people t	It's a marketing device for people to apply to Google and become employees. Remember Google puts its employees way above its customers, and Kurian is only beginning to change that culture.	kccqzy	9.349832	-7.163447	comment	6.0	18.5	1685723329	-13.484678
36286005	Slightly ranty: Ugh I've been feelin	Slightly ranty: Ugh I've been feeling this recently in a few areas. I think a lot of it comes down to imprecise technology and assumptions that are made from that terminology.1.) We have a very large, powerful server we are using for webapps/database. I wanted	sseagull	9.426199	-7.073179	comment	6.0	18.0	1686519583	-13.461333
36337403	I'm looking at the ansible playbooks	I'm looking at the ansible playbooks to setup my favourite beefy baremetal Hetzner server (128GB ram, Ryzen 9 5950X 16-Core, 450Gb fast NVME SSD, 3.5TB x2 NVME SSDs,  155€/month):- Install Debian 11 while booted in rescue mode.- Setup the root file system encr	speedgoose	9.504542	-7.141722	comment	6.0	18.5	1686813528	-13.4411335
28741125	A curated list of PaaS and tools to 	A curated list of PaaS and tools to emulate PaaS on cloud	debarshri	9.36409	-7.145201	story	6.0	16.0	1633300574	-13.459058
28769589	With a database I generally want to 	With a database I generally want to have it on its own dedicated host with fast NVME drives, memory, cpu etc, maybe some OS specific system level configuration options for performance etc. I don't want to binpack it on a cluster of nodes each contending for sy	tiew9Vii	9.36857	-7.161831	comment	6.0	23.0	1633498896	-13.520683
28769041	Why would i want to run my database 	Why would i want to run my database in k8s?	leetrout	9.356581	-7.1772056	comment	6.0	42.5	1633492795	9.798155
28841180	Heroku is by far the best for this b	"Heroku is by far the best for this but just to throw in some alternatives:  * Digital Ocean Apps -- somewhat finicky but works very similar to Heroku, it gets closer to bare metal so I prefer it
  * render.com
  * AWS Elastic Beanstalk -- though setting this u"	bingohbangoh	9.224561	-7.3258677	comment	6.0	19.0	1634053655	-13.502123
28876594	> How do you deploy a thing to run o	> How do you deploy a thing to run on k8s?kubectl apply -f ~/git/infra/secretproject/prod.{json,yaml}One JSON/YAML file too uwieldy? Generate it using jsonnet/CUE/dhall/your favourite programming language. Or just talk directly to the Kubernetes API. You don't	q3k	9.360925	-7.177649	comment	6.0	23.5	1634296926	-13.485636
29069135	Kubernetes is used for orchestrating	Kubernetes is used for orchestrating containers. Pods are used for optimizing hardware resources. As far as I know, Docker have zero support for neither.Edit: Please tell me down voter how to do this with Docker..	AtNightWeCode	9.422422	-7.0246744	comment	6.0	18.5	1635784606	-13.473279
29480267	Kubernetes 1.23 Released	Kubernetes 1.23 Released	ecliptik	9.337902	-7.1764164	story	6.0	65.0	1638926064	-13.499834
29649852	Render.com is such a better option t	Render.com is such a better option these days (and I've been a huge Heroku fan since the beginning). Render has better support and pricing. In addition to great docker support and free static sites, they support distributed Elixir out of the box as well as aut	cpursley	9.180712	-7.36675	comment	6.0	22.0	1640183706	-13.52467
34125116	Get fiber and host this from your ow	Get fiber and host this from your own home. When i see these absurd costs I'm happy with the k8s I built, with ceph for storage.	hbogert	9.379453	-7.13509	comment	6.0	19.0	1671952353	-13.482219
34171593	Buuut...   The Aws+kubernetes approa	Buuut...   The Aws+kubernetes approach is very scalable.If overnight, HN became the new Facebook, the single server model wouldn't work, and the business opportunity would be lost.However, the kubernetes model probably would scale (probably with a few hiccups 	pifm_guy	9.391687	-7.1390986	comment	6.0	15.5	1672313374	-13.491668
34327136	There’s some history here people are	There’s some history here people are missing.Back in the day we used cutesy names for boxes, and we did it for good reason:Back then, before cloud services, when you were building out an application, you would build one computer, load it up with some services,	erikpukinskis	9.754538	-7.361313	comment	6.0	16.5	1673367453	-13.815
34752468	I’ve only read about Service Mesh, m	I’ve only read about Service Mesh, my impression was that it seems to add an awful lot of processes and complexity just to make developer’s lives slightly easier.Maybe I’m wrong but it almost feels like busy work for DevOps.  Is my first impression wrong?  Is 	Scubabear68	9.591223	-7.1808453	comment	6.0	25.5	1676125226	8.299313
34932526	Railway does look impressive. Howeve	Railway does look impressive. However, as someone in the market for a Heroku alternative - I’d say there really aren’t any Heroku competitors. At least nothing directly comparable. The thing that keeps me (and I’m sure other small business owners) tied to Hero	ryanSrich	9.146862	-7.4061933	comment	6.0	17.0	1677286691	-13.497921
35048244	This is, indeed, the exciting part. 	This is, indeed, the exciting part. As Heroku fans, we never really felt like it needed a replacement. And if it did, it seemed like Render was the natural Heroku v.next.One thing we've noticed, though, is that people do actually want Heroku but close to users	mrkurt	9.168001	-7.3914304	comment	6.0	20.5	1678139762	-13.503445
35059459	I thought this was about deploying a	I thought this was about deploying a Kubernetes cluster with Ansible, but nope, it's really about deploying YAML files to Kubernetes, with Ansible.Just...Why?	denysvitali	9.4142275	-7.1483283	comment	6.0	15.0	1678215165	-13.463552
37291888	If the application is containerised,	If the application is containerised, like most are these days, how do you propose running these on said VM?If we're talking about something a little more complicated then a single container, then you arrive at the same problem Kubernetes is solving.	CommanderData	9.420503	-7.0436935	comment	6.0	17.5	1693217100	-13.498053
37332288	Ansible is great, but (imo) aged. Su	Ansible is great, but (imo) aged. Sure it's good for dealing with legacy hardware that cannot support terraform like state, but (imo) untyped yaml and excessive playbook runtimes turn into significant development drain as you scale.Ansible solved a large probl	chologrande	9.629273	-7.047427	comment	6.0	17.5	1693454335	-13.368975
37379040	"What does ""Deploy on Kubernetes"" mea"	"What does ""Deploy on Kubernetes"" mean?I can deploy an application on a machine running a specific Debian version. Go to some provider of bare metal or VMs, they usually have a ""Get a Debian version soandso machine"" button. Then I copy some files to a specific "	TekMol	9.363632	-7.1632934	comment	6.0	15.0	1693822922	-13.486508
24421311	"I think of Kubernetes as ""the new Op"	"I think of Kubernetes as ""the new Operating System"", and these complex resources as fiddling with initscripts, fstab, /etc/interfaces, and so on. Writing an operator is like writing your own initscript.I wouldn't be surprised if we eventually see new abstracti"	kevinmgranger	9.370881	-7.1560125	comment	6.0	18.0	1599661488	-13.4969635
24451115	Damn. Helm is the most important ema	"Damn. Helm is the most important emacs package I use. It's what makes emacs ""emacs"" for me, and the main reason I find every other editor ""from the past"".Is there a way to help Thierry financially?"	fluffything	9.418555	-7.146373	comment	6.0	15.5	1599902698	-10.371326
24501847	I learned not to use it and wait unt	I learned not to use it and wait until the k8s fad goes away.	pjmlp	9.34025	-7.181955	comment	6.0	46.5	1600325122	12.733249
24542503	I feel the same way. The plumbing re	I feel the same way. The plumbing required has become so complex these last few years (if you use new technology).10 years ago we uploaded the server/backend binary to a VM, installed postgres/mysql and configured nginx/haproxy as a reverse proxy/ssl terminati	vbsteven	9.431016	-7.0656734	comment	6.0	16.5	1600691341	-13.44741
24652730	Show HN: Pixie, Instant Kubernetes-N	Show HN: Pixie, Instant Kubernetes-Native Application Observability Using EBPF	zasgar	9.370756	-7.162179	story	6.0	108.0	1601569136	-13.333788
24916734	Show HN: FsKube-A full stack Kuberne	Show HN: FsKube-A full stack Kubernetes enabler now available for Django	rebataur	9.357703	-7.172866	story	6.0	2.0	1603875990	-13.48876
25061599	I have what I feel is an irrational 	I have what I feel is an irrational desire to build an RPi k8s cluster. I feel like I would be better served by a small x86 box, but something about having a real cluster really appeals to me.	tra3	9.3753805	-7.081521	comment	6.0	16.5	1605121289	-13.480258
25187806	"> The whole ""cattle not pets"" thing "	"> The whole ""cattle not pets"" thing is fine once you obtain product market fit and your product needs to scale up. At that point you'll have time and money to do it - before then you're just wasting cycles.Is this true? At my last company we wasted a bunch of "	throwaway894345	9.4293785	-7.0348997	comment	6.0	20.0	1606145759	-11.065119
25325742	I feel like I'm missing some key ins	I feel like I'm missing some key insight here. To me, the tl;dr of this post is: Kubernetes removed the need for Docker just to run container images in a k8s cluster, ergo, Docker is dead.But Kubernetes is super complicated. The author seems to assume that eve	skrebbel	9.399456	-7.080938	comment	6.0	24.5	1607281631	-13.483102
25377217	That's the exact same feeling I get 	That's the exact same feeling I get too. If I'm a mom/pop shop online, why can't I get a k8s cluster w/just 1 machine for $5/month? I mean the big three (4 w DO) can all get you a bare machine for $5/mo that can run Docker. Why not give the k8s management side	rhacker	9.39537	-7.083051	comment	6.0	20.0	1607627546	-13.48935
38720169	I don't understand what the author i	"I don't understand what the author is trying to say with this post.""Don't be a solution looking for a problem""?Okay, but there's little insight beyond that pithy statement, no guidance of how to avoid that trap, just an anecdote that someone did that once?Or i"	eterm	9.34451	-7.177626	comment	6.0	15.0	1703165493	-13.501406
38844874	In the case of running Postgres on K	In the case of running Postgres on K8s, the problem arises immediately when you try to resize a data volume and you can't because the API doesn't support it. K8s is not really for stateful systems, yet, and systems like Postgres that prefer to manage their own	levkk	9.375161	-7.1743884	comment	6.0	17.5	1704219325	9.791465
32549262	Google tech is the best. Google inve	Google tech is the best. Google invented k8s, their k8s cloud is the best in the world. There's nothing similar to GKE Autopilot. Similar things could be said about some other services. People want the best cloud and they hope that those issues won't affect th	vbezhenar	9.359695	-7.1722236	comment	6.0	18.0	1661160988	-13.460571
32597484	Kubernetes appears to be continuing 	"Kubernetes appears to be continuing to increase in popularity despite a large number of these failure stories. Does anybody know why? What does kubernetes do that docker, AWS, Nomad, et al don't? And, if I'm stuck with kubernetes, is there an accepted ""right w"	PainfullyNormal	9.357131	-7.171671	comment	6.0	15.5	1661450350	-13.496609
32623713	Heroku to discontinue free product p	Heroku to discontinue free product plans and delete inactive accounts	stunt	9.149921	-7.3895116	story	6.0	128.0	1661637995	-13.5434065
32626814	Disclaimer: I work at Hashicorp but 	Disclaimer: I work at Hashicorp but I have been saying what I'm about to say for years before joining (check my blog, linked in bio, for reference).There is a way to get all of those necessary things without having the massive complexity of k8s - use Nomad, a 	sofixa	9.37354	-7.16347	comment	6.0	22.5	1661676425	-13.47846
32799174	As a person who manages a big fleet 	As a person who manages a big fleet of servers containing both pets and cattle, the upkeep of the pets is nowhere near the cloud-lovers drum-up.A server installed with half-decent care can run uninterrupted for a long long time, given minimal maintenance and u	bayindirh	9.4469795	-7.075052	comment	6.0	20.5	1662900309	-13.472622
32956650	Ask HN: Heroku to Beanstalk?	Ask HN: Heroku to Beanstalk?	r2sk5t	9.183201	-7.3715487	story	6.0	11.0	1663964811	-13.522401
32987084	Having recently heard a lot of about	Having recently heard a lot of about PostgreSQL in Kubernetes (cloudNativePG for example) it always makes me wonder about the actual load and the complexity of the cluster in the question.> This is the reason why we were able to easily cope with 2M+ requests i	radimm	9.371167	-7.188228	comment	6.0	38.5	1664219890	-13.496985
31795523	I dont get the shit k8s gets. Especi	I dont get the shit k8s gets. Especially on managed offerings like Aks or fargate, they're very easy to deploy, having several environments is easy, maintainance is straight forward.As a generic rule I'm against using complex tech where there's no need, but I 	charles_f	9.345333	-7.18155	comment	6.0	20.5	1655604930	-13.488059
31822312	If you think Kubernetes is unnecessa	If you think Kubernetes is unnecessary overhead, you've never operated at significant scale.	halfstar91	9.34969	-7.1813536	comment	6.0	17.5	1655807278	-13.52586
31975729	> The biggest learning curve is for 	> The biggest learning curve is for the person setting up the initial deployments, services, ingress etc Most other team members may just need to maybe change the image name and kubectl apply to roll things out.This is a huge redflag.It's basically admitting t	hsn915	9.356941	-7.1638	comment	6.0	19.5	1656932452	-13.488251
32085453	Google Kubernetes Engine adds suppor	Google Kubernetes Engine adds support for Arm nodes	crb	9.351588	-7.175313	story	6.0	119.0	1657731544	-13.496598
32106594	I tested Retool a bit, which is grea	I tested Retool a bit, which is great, but it is way too expensive for my projects, so I went with the open-source Appsmith instead.It has been successful, but I recently had to patch it to remove a new annoying «made with appsmith» ad on our applications that	speedgoose	9.397254	-7.0866613	comment	6.0	20.0	1657880348	-13.44069
32213489	Kubernetes must probably be one of t	"Kubernetes must probably be one of the most tutorialized pieces of SW out there. You want a ""crash course"" on the platform of your choice? You got it. You want it for the price of your choice? You got it.The docs are great [1] and offer even interactive parts "	BossingAround	9.344909	-7.182706	comment	6.0	25.5	1658670562	-13.517392
32330006	The problem is that if a company adv	The problem is that if a company advertises a job that is all about maintaing one or two monolithic applications without K8s, distributed system topics, tracing, microservices, AWS/GCP, etc., well, then not many engineers will apply. That's actually a paradox 	danwee	9.35811	-7.169553	comment	6.0	17.5	1659523821	-13.505621
22034137	To play devils advocate, isn't the i	To play devils advocate, isn't the idea with Ansible at least that it's idempotent. The YAML should describe the final state and should be concerned with branching or lower level features like that.(It's the same with SQL, you describe what you want back rathe	collyw	9.682685	-7.0477014	comment	6.0	19.0	1578921306	-13.301422
22057682	Kubernaughty: A collection of docume	Kubernaughty: A collection of documentation, how-tos, tools for K8s	craigkerstiens	9.35965	-7.1705403	story	6.0	106.0	1579117280	-13.48748
22105165	Wait till you learn that some F-16s 	"Wait till you learn that some F-16s run with Kubernetes on board.https://thenewstack.io/how-the-u-s-air-force-deployed-kubern...""“One point for the team was to demonstrate that it could be done,” Chaillan said. He challenged the Air Force and its partners to g"	chinathrow	9.329872	-7.1931324	comment	6.0	18.5	1579594648	-13.476383
22154490	Gravity: Upstream Kubernetes packagi	Gravity: Upstream Kubernetes packaging tools	gk1	9.3434725	-7.16986	story	6.0	98.0	1580070135	-13.495937
22155052	I find each new development in the f	I find each new development in the field of deploying Kubernetes to be grimly humorous. We had lots of techniques to package and deploy things before Kubernetes, but they were complex and inadequate in some ways, and Kubernetes fixes some of those issues. But 	catern	9.393439	-7.091041	comment	6.0	17.5	1580075746	-13.487801
22197827	We've moved a lot of services into K	We've moved a lot of services into Kubernetes and broken things up into smaller and smaller micro-services.  It definitely eliminates a lot of the complexity for developers ... but you trade it for operational complexity (e.g. routing, security, mis-matched cl	smoyer	9.709179	-7.316444	comment	6.0	17.5	1580431981	-13.723637
22237060	Kubernetes the Easy Way	Kubernetes the Easy Way	alexellisuk	9.352014	-7.181522	story	6.0	78.0	1580831991	-13.501045
22235636	I like Docker, I like microservices,	"I like Docker, I like microservices, but I feel like I'm just not excited about Kubernetes itself.  There seems to be a ""bullshit complexity"" that people add to it that I really don't think is going to stick.  But, I really do like the ""GitOps"" experience.  A "	yawgmoth	9.393101	-7.099146	comment	6.0	16.5	1580825300	-13.493877
23461305	> If you want k8s, you really do nee	> If you want k8s, you really do need people that know how to maintain it on a more or less full time schedule.What is the alternative to k8s that does not need people to have any technical knowledge?To me Kubernetes is extremely attractive because it helps me	flowerlad	9.348805	-7.178463	comment	7.0	56.0	1591653731	-13.492501
23462801	I work on a 2-person project and dec	I work on a 2-person project and decided to go with kubernetes (through digitalocean) for the cluster. I am managing everything with terraform and I don't have any big problems. I like that I can write everything as terraform manifests, have it diffed on git p	dvcrn	9.370729	-7.157966	comment	7.0	44.5	1591667148	-13.468091
23508716	The problem we have with ansible is 	The problem we have with ansible is not yaml related but the push based approach, even with awx/tower as soon as you’re running hundreds of machines of a given group it gets painful.We are actually seriously considering a shift to salt atm...	thr0w3345	9.672303	-7.041602	comment	7.0	19.5	1592048117	-13.314944
23817850	This is really a book ad.So, what's 	This is really a book ad.So, what's going on here, I think, is that you have some microservices which call each other. Each microservice is apparently put in a container to avoid dependency issues. Now you have a network overhead problem if the containers are 	Animats	9.403651	-7.1577334	comment	7.0	19.0	1594623926	-13.5094185
23881485	Kubectl – Configuration Guide	Kubectl – Configuration Guide	lukasbar	9.349988	-7.1802177	story	7.0	72.0	1595081400	-13.495211
24098600	Validating Kubernetes YAML for best 	Validating Kubernetes YAML for best practice and policies	kiyanwang	9.3366585	-7.2019	story	7.0	83.0	1596968816	-13.486943
24141972	That's essentially my problem with t	"That's essentially my problem with the open source.I was an open source apologist some time ago, but since I quit full-time job
and started to freelance/working on my own personal projects I began to
realize, that I as an independent developer can't actually p"	npmisdown	9.350889	-7.1760964	comment	7.0	22.0	1597316264	-13.471287
24214563	Why is Kubernetes so absurdly compli	Why is Kubernetes so absurdly complicated? The notion that you need an 'ingress' pod AND an external load-balancer, just to be able to respond to internet traffic - and not even all internet traffic (only HTTPS) - is truly staggering.Is this honestly the best 	ForHackernews	9.353079	-7.1782126	comment	7.0	21.5	1597863329	-13.457361
24346276	I'm confused about how the documenta	I'm confused about how the documentation recommends using a Kubernetes operator to manage OS updates. That seems weird and backwards to me. I would rather see an immutable OS AMI in an auto-scaled group, and just replace the node instance whenever there is an 	dpryden	9.361672	-7.1768904	comment	7.0	30.5	1598990143	-13.493103
20844971	Etcd 3.4	Etcd 3.4	jinqueeny	9.5251	-7.1535635	story	7.0	87.0	1567234304	9.597023
25909038	Yeah exactly... This seems closer to	"Yeah exactly... This seems closer to an HPC problem, not a ""cloud"" problem.Related comment from 6 months ago about Kubernetes use cases: https://lobste.rs/s/kx1jj4/what_has_your_experience_with_kub...Summary: scale has at least 2 different meanings.  Scaling i"	chubot	9.3822775	-7.136672	comment	7.0	23.0	1611609537	-13.481606
26027713	I know it's kind of going against th	"I know it's kind of going against the idea of Dokku, but can it be made to scale across servers? I love the simplicity of Heroku but the cost can be a barrier for some use cases. 
But k8s is too complicated. Anything like Dokku that scales horizontally?"	asaddhamani	9.265868	-7.2653456	comment	7.0	21.5	1612460414	-13.512452
26106353	The current trend goes to multi-clus	The current trend goes to multi-cluster environments, because it's way too easy to destroy a single k8s cluster due to bugs, updates or human mistake. Just like it's not an very unlikely event to kill a single host in the network e.g. due to updates/maintenanc	tutfbhuf	9.357749	-7.167016	comment	7.0	53.0	1613073667	-13.492212
26271696	Sadly, this is a typical Register he	"Sadly, this is a typical Register headline.Google did not say ""Kubernetes is too complex"" but rather, they are making this new tool - called Autopilot - that is an abstraction layer on top of Kubernetes for certain types of applications / companies.This Autopi"	ohmywhat	9.351744	-7.16887	comment	7.0	21.0	1614318122	-13.495874
26271748	I understand their rationale. We man	I understand their rationale. We manage thousand Kubernetes clusters and end-users can find lots and lots of creative way to shoot themselves in the foot:- I can store anything in a secret? Let's have thousands of cat images. Etcd then stops working because we	fen4o	9.360179	-7.1621885	comment	7.0	28.5	1614318946	-13.456405
36327347	Migrating from Heroku to EKS	Migrating from Heroku to EKS	sunguroku	9.212514	-7.3329134	story	7.0	73.0	1686756121	-13.5174055
36485392	Congratulations on your launch.Did y	Congratulations on your launch.Did you ever consider using Amazon ECS instead of Kubernetes? I made the move from EKS to ECS a couple of years ago, because ECS doesn't require you to pay for your own cluster control plane, and I feel that ECS integrates more s	mwcampbell	9.395274	-7.120782	comment	7.0	18.0	1687811380	-13.479733
28876726	Maybe bc no one uses that in reality	Maybe bc no one uses that in reality and use helm instead?	sheeshkebab	9.371685	-7.191393	comment	7.0	20.0	1634298413	4.55309
28879923	> But one of them has 10 times the c	> But one of them has 10 times the components than the otherI've said this before. Kubernetes gives you a lot more too. For example in Nomad you don't have secrets management, so you need to set up Vault. Both Nomad and Vault need Consul for Enterprise set ups	gizdan	9.377787	-7.1593895	comment	7.0	24.5	1634316673	-13.338
28955716	Kubernetes ingress-nginx controller 	Kubernetes ingress-nginx controller vulnerability	jkaftzan	9.357246	-7.1760473	story	7.0	51.0	1634900501	-13.494052
12696081	You are launching a new SaaS company	You are launching a new SaaS company – what PaaS solution would you use?	hkh	9.369178	-7.142051	story	7.0	12.0	1476303176	-13.448446
12842547	I had a very interesting discussion 	I had a very interesting discussion about this subject a couple of weeks ago with a CTO of a big company.I've commented before that Kube absolutely takes over the bigger more complex cloud installations out there, you can see how many companies are betting the	avitzurel	9.388658	-7.138022	comment	7.0	31.0	1477962370	-13.478709
13225183	StatefulSet: Run and Scale Stateful 	StatefulSet: Run and Scale Stateful Applications Easily in Kubernetes	TheIronYuppie	9.36004	-7.1740627	story	7.0	72.0	1482275291	-13.489085
13541786	I recently(past 6 months) joined a n	I recently(past 6 months) joined a new startup as the operations person, and we standardized on kubernetes for deployment. In the past I've worked with puppet/chef/ansible/heroku/aws/appengine/vmware you name it, and Kubernetes is the nicest and most flexible 	zalmoxes	9.363803	-7.1633797	comment	7.0	21.0	1485965227	-13.494413
27657028	El Carro: Run Oracle Databases on Ku	El Carro: Run Oracle Databases on Kubernetes	kelseyhightower	9.368993	-7.166509	story	7.0	32.0	1624842334	-13.489564
27912304	You're mixing together useful comple	You're mixing together useful complexity with useless complexity.Plus at the very least, I'd be very careful about putting type systems into the same basket as Kubernetes. One is a basic language feature used offline and before deploying. The other is a highly	fxtentacle	9.376946	-7.164942	comment	7.0	42.0	1626902145	-13.486894
27917351	I tried a few incarnations of self-h	I tried a few incarnations of self-hosted k8s a few years ago, and the biggest problem I had was persistent storage. If you are using a cloud service they will integrate k8s into whatever persistent storage they offer, but if you are self-hosting you are left 	fy20	9.351117	-7.1736703	comment	7.0	20.0	1626950246	-13.492378
27982051	Build on Kubernetes from Day One	Build on Kubernetes from Day One	mariuz	9.343531	-7.18995	story	7.0	37.0	1627466353	-13.506283
