id	x	y	type	relevance	size	year	umap1d	hovertext	url	author
12985331	9.266449	7.650779	comment	5.0	13.0	1479459109	13.970389	CTO of an adventure experience start up here. Wanted to share my thoughts.The adventures are curated specifically by Airbnb it looks like. They are mostly urban adventures so it doesn't cater to the a...		showtimes
13182709	9.261307	7.621758	comment	5.0	13.0	1481780543	13.898777	I tried to schedule my wedding for the Saturday before the (Monday) eclipse in my GF's rural Idaho hometown so that my science friends would have a reason to make the 800 mile trip from Seattle. Unfor...		boxcardavin
13530846	9.26233	7.6513085	story	5.0	35.0	1485873452	13.937877	How Airbnb Stopped Playing Nice	https://backchannel.com/how-airbnb-stopped-playing-nice-3289d48d1bf5#.u09nxmvp7	mirandak4
13578971	9.712954	7.5936627	comment	5.0	18.0	1486385551	-1.6208683	"Well, for one thing it's not a ""sharing economy"" (that's a feel-good misnomer) - it's a ""part-time work economy"", which is a completely different beast. The fact that Uber, TaskRabbit et. al. have man..."		allengeorge
27514772	9.256051	7.645733	comment	5.0	20.5	1623762321	13.960505	The article mentions a rape in an Airbnb in New York. The suspect had keys, presumably picked up from a lax key exchange in a nearby bodega. The cops were called and Airbnb was notified. Airbnb payed ...		bko
27744158	9.262574	7.6502547	story	5.0	4.0	1625544615	13.965347	Multiple Temp Authorizations to verify card		Epagan
27860562	9.265876	7.6470137	comment	5.0	23.0	1626465551	13.976498	Why all the hatred on Airbnb? I think the fact that housing is treated as an investment vehicle rather than... a home should be dealt with first. Just walking around my neighborhood you can see who is...		ericmcer
27860994	9.269558	7.6375494	comment	5.0	16.0	1626468302	13.98471	Grouping young professionals and tourists together under short term residents is a little bit ridiculous. This type of thinking seems to dominate housing discussions, that young people (or any incomin...		cactus2093
12116137	9.26515	7.649135	story	5.0	119.0	1468859681	13.96822	Employee #1: Airbnb	http://themacro.com/articles/2016/07/nick-grandy/	craigcannon
12237327	9.258135	7.649082	comment	5.0	15.0	1470466131	13.948196	Maybe they can use some of this money to find the negative review I just posted.  After many successful airbnb experiences my wife and I recently had a bad one.  I wondered why the host had all great ...		jcoffland
12453574	9.268752	7.641676	comment	5.0	25.5	1473346599	13.986111	"Yeah, well after having a multi-day house party thrown in my Houston home by a local guy that had the gall to write ""God Bless you"" several times before the rental, and Airbnb doing nothing about the ..."		bobjordan
12453577	9.262065	7.6469574	comment	5.0	21.5	1473346603	13.960845	>Airbnb said it would also accelerate the use of instant bookings, which lets renters book places immediately without host approval.Maybe I'm naive but it seems like that policy would be perceived by ...		jasode
12455899	9.264492	7.618954	comment	5.0	13.5	1473359880	13.953131	If I understand correctly, you're happy to be the one discriminating against disabled people, old people and people with children.But you're not happy if you're on the receiving end of any discriminat...		pascalmemories
12493685	9.264226	7.6476607	comment	5.0	19.0	1473817156	13.972951	I have still not understood how legal Airbnb is. If I own a house, can I just let it out for rent for $$ with no consequences? What is difference between this and running a hotel? (I assume you cannot sublet in most places even though I have seen people do this :/ )		the_common_man
22303543	9.263169	7.6481853	comment	5.0	14.5	1581459351	13.958433	Airbnb is pretty shady. Basically hosts can lie and Airbnb won't really help you out. Plus you have to give them a picture. I don't think I will be using them again.		samfisher83
22457085	9.262228	7.6500854	comment	5.0	23.5	1583074720	13.966365	Airbnb, and others, cancellation policies will be a major reason for the spread of this virus.  The sunk cost fallacy is alive and well here, people don't want to lose money just because they feel sic...		evilnames
22562667	9.259069	7.6548	comment	5.0	29.0	1584052556	13.958104	I have a friend who got into hosting AirBnbs pretty early. Bought a 4 unit place in a rough part of Toronto that was still pretty close to downtown and lived in one of the units while he AirBnbed out ...		3pt14159
22562704	9.257131	7.6486235	comment	5.0	17.5	1584052805	13.965681	Airbnb is a shitty company.  Last october we traveled to Seoul and couldn't find the location of the apartment we booked.  Even the local taxi driver couldn't find it after circling the area for ~30 m...		nuggien
22711341	9.267913	7.6456995	comment	5.0	28.0	1585405942	13.959052	I agree, AirBnB is an unsustainable business and I would also like to see it regulated out of existence. It is extremely classist. Only something that middle class or higher can use while reducing housing availability which primarily impacts lower classes.		cameronfraser
22718258	9.255651	7.656999	comment	5.0	13.5	1585483057	13.968111	I wonder if we will see a government bail-out for all these airbnb hosts ...		chvid
22808786	9.280904	7.6554613	comment	5.0	27.0	1586303794	13.970139	These are the current going rates for junk bonds. There's nothing surprising about that. And yes, pretty sure that Airbnb does not deserve investment grade - I haven't seen their books but those that ...		H8crilA
22808875	9.267324	7.650509	comment	5.0	14.0	1586304800	13.959221	Google suggests Marriot has 176,000 employees, and Hilton 169,000. So AirBnB is massively smaller, still.Underestimating employee counts is a phenomenon similar to underestimating software rewrite cos...		majormajor
22809875	9.267474	7.641494	comment	5.0	16.5	1586317951	13.961025	I see these numbers sometimes and it’s a bit staggering.Why does AirBNB need 2000 engineers to display houses for rent in two phone apps and website? Kind of amazing.There are entire companies that successfully run far more complex businesses with less than 2,000 people.		et2o
22809885	9.267501	7.6423697	comment	5.0	18.5	1586318120	13.960296	The problem is the lack of new construction leading to limited supply of housing, not AirBnB.		gms
22815147	9.259704	7.651768	story	5.0	59.0	1586367642	13.957253	Airbnb’s Coronavirus Crisis: Burning Cash, Angry Hosts and an Uncertain Future	https://www.wsj.com/articles/airbnbs-coronavirus-crisis-burning-cash-angry-hosts-and-an-uncertain-future-11586365860	hkmurakami
22962031	9.250012	7.6104083	comment	5.0	15.0	1587679107	13.950082	Airbnb is also a very big user of this pattern. You can't search by total price, including fees, just the base nightly rate: which makes it difficult to compare options, since one host might have a $2...		JMTQp8lwXL
23017285	9.266739	7.64086	comment	5.0	14.0	1588153544	13.958098	>  Most AirBnB hosts and Uber drivers are not just occasionally letting spare space in their homesI don't believe this is true for Airbnb, both anecdotally and from Airbnb's own statement about NYC:> ...		vinay427
23083867	9.287783	7.6488795	comment	5.0	13.0	1588706970	1.2478523	Why do people consider AirBnB tech?  They are a services company with a website connecting external parties.  This isn't hard tech, this is marketing.Edit: It seems people are under the impression tha...		DamnYuppie
23143051	9.268078	7.645716	comment	5.0	18.0	1589210251	13.958775	Just want to offer perspective from the investor side: I own just one Airbnb in a hot market (downtown, hip neighborhood) and even though bookings were cancelled in April, they’re building back up for...		louiswilbrink
34089911	9.265151	7.5377426	comment	5.0	17.5	1671684253	13.9558935	> But if a hotel starts letting people stay weeks without checking their room, ...Yet I think people regularly stay for weeks with Airbnb/Vrbo without any host inspection or cleaning. I agree with you...		emptybits
26545290	9.285539	7.6170645	comment	5.0	46.5	1616440012	13.963182	I've been migrating my vacant rentals to Airbnbs during the moratorium for this very reason.  I may not rent them out again to long-term tenants for quite some time.Local governments should consider a...		nostromo
26984186	9.265358	7.6354475	comment	5.0	17.5	1619718529	13.96166	If you're going somewhere anyhow, housesitting is a way to get paid to live in someone's pad. Cheaper than airbnb. :) Hostels otherwise.Freighter cruising is slow-paced, DIY/BYO entertainment, interes...		failwhaleshark
14761617	9.487889	7.6666203	story	5.0	22.0	1499956894	13.954859	Startup WorkRamp's Marketplace Helps Train Employees Like at Airbnb and Uber	https://www.forbes.com/sites/alexkonrad/2017/07/13/startup-workramps-marketplace-helps-train-employees-like-at-airbnb-and-uber/#210681864b51	TedBlosser
14778226	9.268891	7.6376305	comment	5.0	24.5	1500144456	13.964097	I know it sounds like free market dogma, but I swear this is true: supply grows to meet demand. Airbnb will just encourage more housing to be built, by creating a new short term housing market that until now had not existed.		Jabanga
14836475	9.735668	7.5791383	comment	5.0	17.0	1500880824	-1.7466161	"In the UK at least, the ""sharing"" economy is basically a way of paying employees less.There are two types of employment, contracted employees (that is employees that are directly employed by a company..."		KaiserPro
14916520	9.264859	7.638286	story	5.0	52.0	1501727760	13.9669695	(Korean)AirBnb: host wasn't intentional (though be attempted to rape his guests)	http://www.insight.co.kr/newsRead.php?ArtNo=114861	devdoomari
14941736	9.268281	7.639133	comment	5.0	102.0	1502034181	13.959896	Put me in the camp that's very anti-AirBnB as a resident who doesn't want where I lived turned into a hotel. I live in NYC. It's a problem.None of this is a surprise, so much so that AirBnB seems to b...		cletus
14941752	9.268375	7.6419005	comment	5.0	17.5	1502034415	13.957604	I think it's stated quite clearly in the article, but although professional landlords might be fine for AirBnB tenants (and obviously good for the landlords themselves), they're bad for cities and the...		brandur
28856557	9.288537	7.650581	comment	5.0	22.0	1634153921	13.951918	- Brian's comments about Airbnb's approach to performance marketing are used to imply that Airbnb's lessons apply to other businesses. Very few businesses - especially those that start from small numb...		aerosmile
29171095	9.263814	7.650722	comment	5.0	14.5	1636518437	13.940883	I rent an Airbnb in Miami but fly back to uk after a hangover style party. Good luck sueing me, even if you did most people don't have a 10,000usd never mind a 1m, then enforcement and collection.how does that open and shut?		googlge6X
29171147	9.269605	7.6482215	comment	5.0	18.0	1636519155	13.964754	"Wow, the astroturfing in this thread already is happening.0. This is nothing new, airbnb always had a free ""guarantee"" they just rebranded it basically from what I see to a trademarkable name.1. Umbre..."		rootsudo
29502104	9.263946	7.64796	story	5.0	16.0	1639079752	13.9664755	New York City, Facing Housing Crisis, Targets Illegal Airbnb Owners	https://www.nytimes.com/2021/12/09/nyregion/nyc-illegal-airbnb-regulation.html	kevin_hu
25510902	9.264525	7.6470942	comment	5.0	19.0	1608669290	13.965457	I appreciate your sarcasm, but we all know it isn't just a small fee.Airbnb lost out on over half the money they could have raised.edit:Priced to the banks at $68/share [1], opened to the public at $1...		echelon
25830586	9.288237	7.603199	comment	5.0	20.5	1611037223	13.921498	With all the negative pushback this is getting, it’s making me think he was onto something. The exact same criticisms would apply to Airbnb, for example. “They have not the slightest idea how the hotel industry works. This is a very professional industry with a lot of legal hurdles...”		sillysaurusx
13997650	9.2633705	7.6460953	comment	5.0	15.0	1490898024	13.947618	A lot of confusing points to this story.  I'm not defending AirBnB, but this story does baffle on a number of levels.> (they came with a professional sound system)How do you not see this coming, from ...		diminoten
13997711	9.384567	7.662708	comment	5.0	18.0	1490898457	3.5538695	Why do people find it surprising that companies who exist mainly on the premise of ignoring laws/regulations they find inconvenient, won't eventually ignore  laws/regulations that you think worthwhile...		RcouF1uZ4gsC
13998404	9.267526	7.6440883	comment	5.0	12.5	1490903901	13.9349165	I find it shocking that someone thought it was a good idea to list a flat on airbnb that they're only renting themselves. Largely in England subletting is not allowed under the terms of rental agreements.		jInflux
13998434	9.270397	7.6401944	comment	5.0	20.0	1490904160	13.953304	The irony of YC's flagship startup forcing exploding term sheets on their customers is a bit much to take.[ps]Airbnb's statement concluding this story says that this interaction fell short of their ex...		tptacek
14065990	9.273663	7.521944	comment	5.0	24.0	1491640770	13.93684	Clearly you didn't read the article at all: they left used condoms, tissues, and empty bottles of wine all over the apartment. The owner had to clean it up, which was probably quite gross for him. Tha...		vosper
14130863	9.259847	7.6435766	comment	5.0	15.0	1492437388	13.963995	Do they really need to combat airbnb? I travel a lot (relatively), but I can't get the idea of this service. It's a bit cheaper, but a) I can't cancel it b) I can't book it without interaction with a ...		ar15saveslives
14130997	9.267794	7.636376	comment	5.0	31.5	1492438492	13.940076	"Your usual airbnb property is not ""an unsafe hotel."" My flat is presently being let on airbnb and isn't suddenly unsafe because someone else is in it rather than me."		tim333
14378271	9.266353	7.6384897	comment	5.0	22.0	1495219105	13.95661	My girlfriend and I were looking at real estate in SF. It was unreasonably expensive for places that we did not love. We have since decided to sell all of our things and live full-time in AirBNBs arou...		philip1209
23835413	9.264787	7.6446733	story	5.0	24.0	1594749890	13.966367	Airbnb asks for donations to their hosts	https://twitter.com/olenskae/status/1283000201993748482	101008
23843913	9.262748	7.648654	comment	5.0	22.0	1594814110	13.964046	> Airbnb has lost its fucking head. Why would I donate to my host? I can't even afford one house.Well, at least it sounds like many of those hosts can't, either.		pavel_lishin
23843946	9.270566	7.634205	comment	5.0	19.0	1594814352	13.952429	Other articles of this topic mentioned this titbit:> The financial situation is especially dire for megahosts, some of whom bought up dozens of properties and built short-term-rental empires that made...		kozhevnikov
24123845	9.265566	7.6520305	comment	5.0	17.0	1597170255	13.966484	Eh maybe this is a good idea. Airline and hotel stocks have been up and people are planning for the end of COVID-19 by Jan. So by Jan they could of reached their old level's plus raised cash in a cash strapped world.I doubt anyone believes airbnb is going to flop anytime soon.		DeonPenny
24129276	9.257322	7.6484795	comment	5.0	15.5	1597215489	13.962183	I recently had the occasion to stay with 4 different Airbnb hosts over the span of under a month, my takeaway was that if I owned any Airbnb stock, I would've sold it immediately.The first two accommo...		romanhn
20439379	9.271732	7.653012	comment	5.0	15.0	1563185102	13.983899	I am doubting this data points. AirBnB has virtually no background checks and people are not robbing away houses en mass. Why AirBnB has such a different track record vs Car2Go?		sytelus
14664104	9.262784	7.6504135	story	5.0	14.0	1498750450	13.962067	Ask HN: Who's an AirBnB host?		tixocloud
31197257	9.265599	7.641464	comment	5.0	14.5	1651174851	13.983871	I have seen AirBnB referenced many times in these comments as having something to do with the increase in home prices.  From what I can find there are 660,000 AirBnB hosts in the US; this was found un...		DamnYuppie
31202162	9.262659	7.6457205	comment	5.0	21.5	1651215130	13.962887	Do you think this is an primarily caused by Airbnb?		Hedepig
31308510	9.266015	7.654424	story	5.0	31.0	1652047326	13.957426	Airbnb CEO calls the office an 'anachronistic form' and 'from a pre-digital age'	https://www.businessinsider.com/airbnb-ceo-brian-chesky-office-anachronistic-from-pre-digital-age-2022-5	goplayoutside
31454481	9.266911	7.651148	comment	5.0	21.0	1653096518	13.9797	> Hive SQL, Spark SQL, Scala Spark, PySpark and Presto are widely used as different execution enginesThis makes me think they're doing something very very wrong. AirBNB does not have data on the scale...		d_burfoot
35865654	9.335734	7.5592146	comment	5.0	12.5	1683572319	13.878672	"I didn't know this existed in NYC. It's well known in Vegas (which the article mentions) where it's called a ""resort fee"". It's paid at check out and is mandatory. And yes, it's to have a lower sticke..."		jmyeet
35940434	9.518381	7.5084934	comment	5.0	16.0	1684090984	1.0782036	Just off the top, I'm seeing a common logical misfire here, specifically:> If you asked the average American on the street about tech, they would tell you they like to use products like Airbnb, DoorDa...		Zetice
35959117	9.272281	7.6319966	comment	5.0	26.5	1684226400	-7.504966	When I was living in Dublin Ireland, I was paying 1500 EUR a month for a one bedroom appartment, nothing special but expensive, the landlord say he was not going to renew the contract because he was g...		bilekas
36221540	9.280353	7.6519747	comment	5.0	14.0	1686100839	13.962908	"> that it can somehow ""escape"" the legal frameworks of human beingsAnd yet multibillion dollar companies whose entire business is illegally running hotels or taxis get nowhere near the vitriol?Airbnb clearly causes harm for locals in popular tourist cities."		Yeahsureok
36256858	9.277546	7.64097	story	5.0	94.0	1686313847	13.958654	France plans to close tax loophole benefiting Airbnb	https://www.reuters.com/business/france-plans-close-tax-loophole-benefiting-airbnb-2023-06-09/	mfiguiere
36500874	9.264696	7.637852	comment	5.0	13.5	1687913708	13.961648	What's the deeper story, though?Is it really an airbnb story, or is it a story about those cities, or is it about travel generally?		andsoitis
36501516	9.550936	7.6601944	comment	5.0	27.5	1687918705	13.952573	They do the opposite of creating value? Are you serious? What bubble do you live in?Not just to me but to many millions, both uber and airbnb have be almost life changing. I don't want to write long-t...		badrabbit
36522947	9.24507	7.571567	comment	5.0	16.5	1688056948	13.9588375	The cleaning fees on AirBnB are dishonest (hidden by default), ridiculously high, and redundant with giant list of chores that make me do all the cleaning anyway.  They're predatory and greedy and des...		Arainach
34196751	9.267357	7.6390424	comment	5.0	14.0	1672497242	13.952384	I see this amongst younger users (under 35) on the forums I run.They are very happy sharing a vitriolic dislike of everything that is a landlord society.This is very clearly against even a single buy-...		buro9
34499044	9.260979	7.652995	story	5.0	68.0	1674532839	13.965105	Ask HN: Airbnb requires my credit-card transaction history?		zug_zug
34775060	9.265183	7.6167383	comment	5.0	13.5	1676303551	-4.711511	> If someone tried to add random fees like AirBnB does in the US, you would not have to pay them.Airbnb adds fees that goes to airbnb ( vs the host). How does that look in germany, its added to the pr...		dangwhy
34821374	9.262214	7.6473804	comment	5.0	13.0	1676566786	13.984572	"TikTok HATES AirBNB. I don't think that the tech folks have realized how reviled AirBnB has become. The main issue I hear about - and have personally experienced - are hosts requiring a ~$200 ""cleanin..."		throwayyy479087
34821605	9.26695	7.642508	comment	5.0	13.0	1676567508	13.987112	They grow like crazy at a loss and then take advantage of their market dominance to strong-arm the prices back up. To be honest I'm more shocked that hotels are still having trouble beating AirBNB pri...		Salgat
34821619	9.258061	7.647348	comment	5.0	16.5	1676567558	13.968282	I have a whole home AirBnB. My energy prices have tripled in the past three years. My labor costs have gone up 50% in the past three years. Guest has a problem connecting to WiFi? HandyMan charges $95...		rticesterp
34821900	9.262361	7.634662	comment	5.0	27.5	1676568453	-10.796258	"Every single thread on airbnb seems to be dominated by this comment. I really don't understand the FUD.It is ""solved"" in usa airbnb too , infact german one seems to have more fees/line items, not less..."		dangwhy
34984882	9.2603855	7.6482224	comment	5.0	13.5	1677690511	13.966761	AirBnB is a terrible platform for users.Recently a host charged me a cleaning fee, left me a negative review about not cleaning. I requested that the cleaning fee be refunded, since it was clearly fra...		bgorman
35034398	9.259514	7.6506658	comment	5.0	20.0	1678053065	13.982771	I had the same thing happen to me. Not only do I not stay at AirBNBs anymore, I cancelled my Discover Card when they refused to fix it... after ~15 years as a customer.Once you hit a certain tax brack...		trhr
35034545	9.265137	7.6491957	comment	5.0	22.0	1678053769	13.934073	Imagine being banned from Best Western, for example, because you disputed a charge!Having a dispute, especially one which is so reasonable like this, being grounds for banning is insane to me. Compani...		nixpulvis
39643703	9.265901	7.6462674	comment	5.0	17.0	1709920448	13.956596	One way to reduce demand is to ban Airbnb, which has happened in some markets.Unlike residents, tourists do not vote, and are not really entitled to cheap accomodations wherever they go.		bobthepanda
39643717	9.268554	7.6463833	comment	5.0	16.0	1709920504	13.970451	Airbnb doesn't service 'demand for housing', it artificially decreases supply for the benefit of tourists.		Sebguer
39643742	9.268222	7.6458573	comment	5.0	13.5	1709920625	13.963205	If you ban AirBNB, you'll immediately get 50,000 (or however many) houses back on the market. You would otherwise need to build 50,000 houses, which would surely require a great deal more effort. Why ...		jimbob45
39669269	9.263397	7.644424	comment	5.0	16.0	1710170212	13.970448	It feels to me that AirBNB hosts are an entitled group of people. They want all the benefits of renting out their place (in most cases, it goes against the original intent of renting a spare room, or ...		Delumine
39669814	9.264964	7.636134	comment	5.0	17.0	1710172842	13.99403	Airbnbs are amazing for:- Group get-aways where the point is being together at the place, not seeing the sights of whatever area you’re in.- Families traveling, especially when not staying in a city c...		vundercind
39669832	9.231905	7.468997	comment	5.0	26.0	1710172936	13.943525	It's hard to gauge cleaning effort: if a guest uses every dish in the kitchen without doing a wash up, they cleaning crew could be there for hours.But if a guest is tidy, then the cleaning fee should ...		ohnoitsahuman
39669877	9.226682	7.4722958	comment	5.0	13.5	1710173130	13.918176	If you’re paying the cleaning fee anyway, why would you do any of that stuff?		sneak
39671420	9.260978	7.6382794	comment	5.0	14.5	1710180190	13.962235	I find it sad how Airbnb has taken a market that worked (in many places) and re introduced all the problems that have been resolved through decades of regulations being put in place for hotels etc.Cha...		sschueller
38707621	9.270361	7.6492257	comment	5.0	16.0	1703073128	13.983439	I would assume this is easily accomplished with minimal ai. The obvious demographic to target would include young adults, college students, urban dwellers, individuals with outgoing personalities, tho...		spacebacon
15889688	9.258547	7.645593	story	5.0	14.0	1512876359	13.9619	HN Show: I've built a crypto alternative to Airbnb for the global tech community		Delta0
16322609	9.269497	7.6485367	comment	5.0	12.5	1517984569	13.9682665	The interesting thing I read from reddit was that 30% of Airbnb’s cash flow last year came from an internal hedge fund holding currencies, equities, fixed income. This hedge fund was set up by their e...		acconrad
16325053	9.265484	7.647891	comment	5.0	18.5	1518017646	13.960077	Is VRBO/HomeAway not a significant competitor? It's owned by Expedia, so it has a pretty huge backing.I usually check both AirBnB and HomeAway when I'm looking for a rental and don't see any reason to...		RandallBrown
16439169	9.273636	7.65494	comment	5.0	18.0	1519319589	13.966527	i don't see how a whole new company can exist to fill in the gap of what airbnb's price slider filter can fix in 2 seconds		volkk
21042418	9.281082	7.652602	comment	5.0	14.5	1569171763	12.973989	True in the case of wework yes but in the case of Airbnb the founders seem to have collectively cashed out only a few tens of million, which just sounds like they cashed out just enough to buy themselves nice cars or something		ramraj07
21200456	9.264849	7.6493845	story	5.0	71.0	1570600802	13.967092	Applying deep learning to Airbnb search	https://blog.acolyer.org/2019/10/09/applying-deep-learning-to-airbnb-search/	godelmachine
21363585	9.265181	7.648814	story	5.0	41.0	1572097123	13.967593	Machine Learning-Powered Search Ranking of Airbnb Experiences	https://medium.com/airbnb-engineering/machine-learning-powered-search-ranking-of-airbnb-experiences-110b4b1a0789	jamesjue
21387862	9.574921	7.6665606	comment	5.0	21.0	1572361092	13.969204	I find it interesting that the two example companies of Uber and AirBnB that succeeded by “focusing” solving problems, did so breaking the law and pushing externalities onto others. AirBnB runs afoul ...		RcouF1uZ4gsC
