id	label	hovertext	author	x	y	type	relevance	size	year	umap1d
22575597	"Not FAANG but for small to medium ""c"	"Not FAANG but for small to medium ""cloud native"" businesses I like to use this approach with minimal dependencies:Managed Kubernetes cluster such as GKE for each environment, setup in cloud provider UI since this is not done often. If you automate it with terr"	caleblloyd	9.39872	-7.110661	comment	4.0	12.0	1584196727	-13.4171
22575617	Surprised more people here are not u	Surprised more people here are not using Salt. Having used both Salt and Ansible, I much prefer Salt, especially when working with larger teams.When working solo I use Guix, both Guix and Nix are _seriously_ amazing.	b5n	9.674422	-7.0367465	comment	4.0	15.5	1584196884	-13.303824
22630838	Pardon the ad hominem, but this is m	"Pardon the ad hominem, but this is mostly marketing FUD from someone with a vested interest in you not using Kubernetes. Kubernetes may not be perfect, but I guarantee you the licenses are a lot cheaper than whatever ""NanoVMs"" are.The tone is also very arrogan"	seneca	9.353806	-7.1644425	comment	4.0	11.5	1584646587	-13.494507
22593978	Heroku Is Down	Heroku Is Down	ignaces	9.147987	-7.401395	story	4.0	8.0	1584375642	-13.545905
22663951	FYI, if you're looking to deploy a h	FYI, if you're looking to deploy a hobbyist/side-project Kubernetes cluster I'd highly recommend k3s [1] - it's a lightweight certified distribution, and is ridiculously easy to set up. I haven't needed to do any maintenance besides the periodic update.It also	odensc	9.353044	-7.173331	comment	4.0	11.5	1584970508	-13.490745
22670477	Are there any other Ansible alternat	Are there any other Ansible alternatives that avoid the whole YAML mess?	decasia	9.680546	-7.052021	comment	4.0	14.5	1585009620	-13.303665
22763453	That's great. 2 minutes before it we	That's great. 2 minutes before it went down a pipeline workflow ran in Heroku deploying a bug to my app. Now I can't deploy the hotfix since it depends on Github and I'm not able to revert to the last successful build on the Heroku interface.Any ideas?	HugoDias	9.154833	-7.387585	comment	4.0	12.5	1585859821	9.636857
18956108	I don't understand all the negative 	I don't understand all the negative comments here, K8S solves many problems regardless of scale. You get a single platform that can run namespaced applications using simple declarative files with consolidated logging, monitoring, load-balancing, and failover b	manigandham	9.349201	-7.184712	comment	4.0	18.0	1548024410	-13.48569
18956201	I very much agree that kubernetes is	I very much agree that kubernetes is useful in an environment that doesn’t need to scale, but do tell how it enables consolidated logging and monitoring, since my medium/small shop is spending quite some time setting up our own infrastructure for it.	pgwhalen	9.363379	-7.1741714	comment	4.0	11.5	1548025642	-13.487862
22732804	Finding the Right PaaS for Kubernete	Finding the Right PaaS for Kubernetes	oap_bram	9.355286	-7.1604486	story	4.0	50.0	1585606819	-13.489184
19032150	Why did Google create Kubernetes and	Why did Google create Kubernetes and open source it? Why did the people who created Kubernetes all leave Google? What was the business strategy behind it all?After all, the created omega but it never did replace borg. Kubernetes wasn't meant to replace borg, w	mfer	9.370666	-7.1476912	comment	4.0	13.0	1548815987	-13.468922
19059411	AWS, Facebook and amazon are going t	AWS, Facebook and amazon are going to get absolutely crushed if there’s a recession that triggers a tech industry pullback. All the VC funding that goes to these hot tech companies goes to Facebook and google for ads and AWS for server space.In addition, kuber	empath75	9.410262	-7.120355	comment	4.0	15.0	1549060299	-0.26949513
19062624	The idea of “you can find a job imme	The idea of “you can find a job immediately after getting a degree or certification” ended a few decades ago. Today, you need some experience, especially in cloud computing.Thankfully, in this field there are few barriers of entry, save for having some natural	atemerev	9.3695965	-7.161421	comment	4.0	13.5	1549110029	-13.494243
19077007	I like the concepts behind istio.  I	I like the concepts behind istio.  I want to be able to use istio, but I had it running in a test/dev environment, and it would just randomly start saying 503 for my virtual services.   Removing and adding the virtual service would fix it for a couple of days.	Tobani	9.474598	-7.1814003	comment	4.0	13.5	1549293904	-13.439857
19168294	Not just complexity, but quantity of	Not just complexity, but quantity of tools that do the same thing. Helm, Forge, Ksonnet, Operators, now this Skaffold (haven't heard of it before)... Sure, there are some differences, but still... I'm currently moving one app from GAE to GKE and saw recipes fo	drdaeman	9.364725	-7.182393	comment	4.0	13.5	1550202118	-13.489382
19168299	Completely ridiculous. I have been i	Completely ridiculous. I have been in the Kubernetes community for a couple years now, and there is a crazy amount of ridiculous unneeded micro-optimization for problems that nobody except the 1% of users got.Istio mesh is a good example.	warp_factor	9.352211	-7.1756363	comment	4.0	14.5	1550202216	-13.497677
19223570	I absolutely loved the concept of co	I absolutely loved the concept of containerization when I started working with it a few years ago. Docker provided such a perfect way to ensure my application would build and run correctly when I pushed things up to my servers.Then came orchestration. Swarm wa	hiimshort	9.397906	-7.0772843	comment	4.0	12.0	1550817123	-13.486618
19261755	Not trying to be snarky, just a sinc	Not trying to be snarky, just a sincere question - why would you use kubernetes for something like IoT?	comboy	9.339531	-7.183869	comment	4.0	15.0	1551255104	-13.497295
19262238	I'm running a three node cluster on 	I'm running a three node cluster on Hetzner Cloud for less than $10 a month. Comprehensive guide and automated provisioning available here: https://github.com/hobby-kube/guide	pstadler	9.376073	-7.153117	comment	4.0	17.5	1551262294	-13.452131
19262994	> great K8S API, that Swarm lacksHmm	> great K8S API, that Swarm lacksHmm... nothing against k8s, but it’s deployment api is an abomination on par with aws cloudformation.You need teams of yaml engineers to manage these things.	sheeshkebab	9.375201	-7.1237607	comment	4.0	12.0	1551273240	-13.45251
19299624	I saw so many places falling for thi	"I saw so many places falling for this fallacy.Instead on working on the core products, engineers would have ""fun"" adding more microservices, redundant Kubernetes clusters, istio controllers etc etc. (all of that with less than 10 users)."	warp_factor	9.357713	-7.1748786	comment	4.0	13.0	1551687364	1.7007289
19341075	If you want a simple (but bare-bones	If you want a simple (but bare-bones) self-hosted version of this service, check out the open source version I made a couple years back:https://github.com/Detry322/redisredHere’s a hubot plugin for slack:https://github.com/Detry322/hubot-redisredWe use this ex	Detry322	9.166769	-7.3768973	comment	4.0	10.5	1552072410	-13.518089
19359888	> ‘Engineers get sidetracked by thin	> ‘Engineers get sidetracked by things that make engineers excited, not that solve real problems for users’ — we’ve heard it all before. There’s no shocking revelation here (you are on Medium.com after all …). But there seems to be a pervasive sense that you c	cwyers	9.349215	-7.178444	comment	4.0	15.5	1552319728	-13.490929
19257675	Announcing k3s: The Lightweight Kube	Announcing k3s: The Lightweight Kubernetes Distribution Built for the Edge	mjriberdy	9.3534565	-7.1747904	story	4.0	63.0	1551210450	-13.502161
19412335	what does SUSE even do in the age of	what does SUSE even do in the age of kubernetes?	trpc	9.327603	-7.1776943	comment	4.0	11.5	1552799043	-13.50104
19467496	I've started heavily using Nomad rec	I've started heavily using Nomad recently and it's a real joy.  Adding things in is just so easy because it doesn't do much and (mostly) everything is very well defined.  I cannot suggest it highly enough.An example is I setup a log pipeline recently spanning 	chucky_z	9.406191	-7.1212573	comment	4.0	17.0	1553292937	-13.2917595
19468400	Heroku turns a strategical liability	"Heroku turns a strategical liability (""I have only one employee who understands what rsync is; if he leaves I'm screwed"") into a fiscal one. Any company I've ever known will always choose the latter, for anything outside of their core competency.We use Heroku "	nothrabannosir	9.171339	-7.379918	comment	4.0	18.0	1553303307	-13.536004
19488323	The inclusion of Kustomize[1] into k	The inclusion of Kustomize[1] into kubectl is a big step forward for the K8s ecosystem as it provides a native solution for application configuration. Once you really grok the pattern of using overlays and patches, it starts to feel like a pattern that you'll 	grantlmiller	9.356359	-7.178684	comment	4.0	18.0	1553562091	-13.489398
19490497	I've hardly looked at k8s, it looked	I've hardly looked at k8s, it looked like a pain to get a docker-compose file running in it the last time I looked. I think there was a tool to translate it to something kubernetes could deal with.That said, after the last four months I've had of trying to get	cs02rm0	9.360726	-7.163815	comment	4.0	13.0	1553595625	-13.504535
19436901	Istio 1.1 Released	Istio 1.1 Released	crb	9.485035	-7.1696043	story	4.0	28.0	1553035584	-13.434356
19556081	Too little, too late. Surpassed by A	Too little, too late. Surpassed by Ansible (and AWX) a long time ago. Chef was nice in 2014 to get rid of puppet...	jandeboevrie	9.6820545	-7.0335007	comment	4.0	14.5	1554223467	-13.297213
19576816	Exactly. There's no silver bullet, o	"Exactly. There's no silver bullet, only trade offs.In this case you're only shifting the complexity from ""maintaining"" to ""orchestrating"". ""Maintaining"" means you build (in a semi-automated way) once and most of your work is spent keeping the services running."	rlander	9.73922	-7.148029	comment	4.0	65.0	1554410064	-13.624097
19713585	Is Istio/Envoy supported on a non-k8	Is Istio/Envoy supported on a non-k8s deployment?We're deploying an application that's in containers but not running on k8s, and has:* an Angular front-end, using grpc-web* a gRPC-web proxy (improbable-eng; golang)* an nginx proxy (for Angular, and routing grp	nevi-me	9.438912	-7.137317	comment	4.0	11.5	1555870490	8.964554
19816974	Zero to Kubernetes on Azure	Zero to Kubernetes on Azure	onatm	9.354751	-7.177043	story	4.0	155.0	1556877848	-13.518803
19830301	I’m guessing I’m being grayed becaus	I’m guessing I’m being grayed because I’m suggesting Heroku might go out of business? Ok let me explain. That is one scenario, it’s unlikely but there might be other similar scenarios that pose risk being tied in to one providers stack. DDOS, TOS issues, simpl	quickthrower2	9.160067	-7.3895226	comment	4.0	11.0	1557016098	-13.539989
19840282	I am curious to see how they recomme	I am curious to see how they recommend handling storage on bare metal k8s.	NickBusey	9.357957	-7.160701	comment	4.0	15.0	1557156465	-13.474158
19860555	Like the time when Kubernetes, prior	Like the time when Kubernetes, prior to it being announced, could have been a joint collaboration between Docker and Google.	nickstinemates	9.400655	-7.057365	comment	4.0	17.0	1557333616	-13.468297
19921188	Show HN: Konstellate – An Open Sourc	Show HN: Konstellate – An Open Source GUI to Visualize Kubernetes Applications	burcs	9.348143	-7.1820974	story	4.0	133.0	1557938555	-13.488684
19940840	Lokomotive: An engine to drive cutti	Lokomotive: An engine to drive cutting-edge Linux technologies into Kubernetes	blixtra	9.352608	-7.1913567	story	4.0	43.0	1558109001	-13.496279
19968772	If you see an airplane that flies yo	If you see an airplane that flies you might conclude airplanes are a good transportation pattern. But if you see there's a boat, that promises to fly, and you see that people taped a lot of helicopters onto it to make it fly, then probably you would conclude t	scraegg	9.3837185	-7.196526	comment	4.0	10.5	1558432386	6.4038873
15782814	Edit: Thanks to replies explaining t	Edit: Thanks to replies explaining that in fact AKS doesn't charge for the master! I'm leaving the rest of this comment standing because it's an honest reply to the article posted - Microsoft isn't disingenuous, this article is just wrong.> Be that as it may, 	gkop	9.382356	-7.1469707	comment	4.0	15.0	1511728199	-13.47686
15808900	(Azure Container Instance engineer h	(Azure Container Instance engineer here)This looks very similar to what we launched with Azure Container Instances last summer.The Azure Container Instances kubernetes connector is open source and available here:https://github.com/Azure/aci-connector-k8s	bdburns	9.372485	-7.132158	comment	4.0	17.0	1511976995	-13.488349
15831205	Have you ever heard of Kubernetes, a	Have you ever heard of Kubernetes, a tool that is so much in the upswing that it dominated the last Amazon announcements, that Docker decided to integrate with it despite being its competitor in some regards, that hundreds of thousands of engineers suffer to u	erikb	9.366564	-7.1889906	comment	4.0	10.5	1512208136	-13.45402
15874349	This looks pretty cool. Is it depend	This looks pretty cool. Is it dependent on Google’s kubernetes or can it be run on Openshift or DC/OS as well?	smooc	9.396978	-7.155182	comment	4.0	11.0	1512681544	-13.468477
15894233	Well, Dokku [1] is already a good so	Well, Dokku [1] is already a good solution to the heroku cost problem. All the power and convenience of heroku commands with the freedom and low cost of docker deployment. It has lets-encrypt ssl support too![1] https://github.com/dokku/dokku	gitgud	9.1929035	-7.344109	comment	4.0	23.0	1512950319	-13.531206
15894487	Ah, I've heard about Deis, I'll chec	Ah, I've heard about Deis, I'll check that one out, thanks. My main concern is the fact that Kubernetes recommends running more than one server, which is a luxury my personal projects cannot afford. Does anyone know how well it runs on a single server?	StavrosK	9.363288	-7.162022	comment	4.0	13.5	1512954417	-13.491609
15894327	I'm using Dokku to serve a bunch of 	I'm using Dokku to serve a bunch of sites and love it, it has made deployments a breeze. I did run into some Docker problems (used too much CPU and couldn't connect to its socket, etc), but I don't think it was Dokku's fault, but Docker's.I want to see if I ca	StavrosK	9.258693	-7.2652845	comment	4.0	20.0	1512951826	-13.505904
15862644	Metaparticle: A stdlib for distribut	Metaparticle: A stdlib for distributed systems from the co-creator of Kubernetes	bdburns	9.349375	-7.1808105	story	4.0	36.0	1512579493	-13.504309
15976700	Chronos is just an example. There're	Chronos is just an example. There're many bugs in Mesos that don't get fixed for months/years. Mesos core is legacy (pre 11) C++ code nobody wants to maintain.	vicaya	9.397659	-7.109833	comment	4.0	11.0	1513834817	-13.483154
15975651	I don't get this. Didn't Kubernetes 	I don't get this. Didn't Kubernetes come out of Google Borg that had been in use forever? The second write should be more elegant and impressive -- why so many basic bugs?	pishpash	9.365535	-7.150234	comment	4.0	10.5	1513820490	-13.480072
16011210	Go Experience Report: Generics in Ku	Go Experience Report: Generics in Kubernetes	Tehnix	9.471218	-7.247423	story	4.0	18.0	1514324402	10.266127
16084468	No, it didn't. Yes, k8s has 'won' in	No, it didn't. Yes, k8s has 'won' in large-scale deployments, but if you're working at a small shop, then just imitating what Google does with millions of servers is dumb. Do what works at your scale -- and Swarm is extremely easy to manage.Many people ask why	sz4kerto	9.399678	-7.080297	comment	4.0	16.0	1515228923	-13.47662
16085243	Do you really find k8s useful for a 	Do you really find k8s useful for a single node deployment or were you just making an example?I haven't used but I have used DC/OS, Mesos, and Marathon extensively, which is not a setup I'd do for a small number of nodes personally.	tedmiston	9.3564205	-7.174304	comment	4.0	13.5	1515246966	-13.494685
16084350	Wow! Did Docker give up swarm? I tho	Wow! Did Docker give up swarm? I thought there was a time when Docker didn't like the existence of k8s all that much.Anyways, I envision this being very useful for development, may even replace my docker-compose based test setup.	pacavaca	9.399158	-7.070128	comment	4.0	28.5	1515226031	-13.477009
16085562	Thanks for the reply.I agree with wh	Thanks for the reply.I agree with what you say. I'm not tying to say people should all jump to k8s. Having options on the market is great.But I was trying to refute the notion that Kubernetes has no advantages unless you're running a huge cluster. My main poin	linkmotif	9.380775	-7.132574	comment	4.0	12.0	1515251426	-13.483206
16086100	> How do I install GKE on my servers	> How do I install GKE on my servers? ;)Great question! All major Cloud providers offer managed Kubernetes services:https://cloud.google.com/kubernetes-enginehttps://azure.microsoft.com/en-us/services/container-servicehttps://aws.amazon.com/ekshttps://www.ibm.	pacala	9.373018	-7.1521072	comment	4.0	13.0	1515258088	-13.485655
16158605	Checkout SanFran - Lambda like serve	Checkout SanFran - Lambda like serverless functions platform for Kubernetes https://github.com/dosco/sanfranThe main focus of its design was fast function startup time and horizontal scaling.Fast function startup is done with a combination of pool of warm cont	gsvclass	9.362341	-7.16735	comment	4.0	11.0	1516114782	-13.501508
16051528	Getting started with microservices a	Getting started with microservices and kubernetes	techterrier	9.43693	-7.1873083	story	4.0	101.0	1514897028	-13.557545
17909803	That's because, for the vast majorit	That's because, for the vast majority of developers, there's no point in using k8s.It's really only necessary when you have a big app (or a few instances of a few big apps) that will have lots of containers and lots of management required.Please. Don't use k8s	striking	9.384066	-7.1093965	comment	4.0	16.0	1536075733	-13.483122
18064469	Own hardware is always cheaper to bu	"Own hardware is always cheaper to buy than using a cloud service, but keeping it running 24/7 involves substantial costs. 
Sure, if you run a solo operation, you can just get up during the night to nurse your server, but at some point that no longer makes sens"	LeonM	9.377171	-7.152659	comment	4.0	12.0	1537863439	-13.499069
18081765	I completely agree.  The current tre	I completely agree.  The current trend of orchestration all sells a story of hyperscale like GIFEE. That is not how most people do or should run there deployments (I'm talking about the vast majority outside SV). The operational complexity today is too high. K	darren0	9.356826	-7.168675	comment	4.0	21.0	1538016081	-13.498698
18081851	What do you think most people should	What do you think most people should use instead of k8s? Or is there not a good answer for that yet? Do you think containers themselves are overkill, or just k8s?	mwcampbell	9.370755	-7.118174	comment	4.0	16.0	1538017288	-13.491079
18091463	It's about time for a Kubernetes to 	It's about time for a Kubernetes to do LTS releases.  3 month release cycle and support for only 9 months is too quick for companies given that in practice companies are running lots of clusters, not just 1 or 2 big clusters.	darren0	9.346343	-7.1781754	comment	4.0	24.5	1538116737	-13.495984
18091565	In practice most people do not run k	In practice most people do not run k8s upgrades through a CD pipeline.  They are much more conservative about it.  This is not a technical issue, just a cultural one mainly.  People plan and roll out upgrades.  Most organization treat a cluster as a large pet.	darren0	9.348238	-7.1778593	comment	4.0	11.5	1538118799	-13.474734
18091937	People with Kube experience, at what	People with Kube experience, at what point should someone on Heroku consider switching to Kube with something like GKE? I have a rough idea of the pros and cons, particularly cost vs. time overhead, but curious about more subtle things.	te_chris	9.296298	-7.208684	comment	4.0	10.5	1538125359	-13.498642
18121009	For me kubernetes is also a breeze. 	For me kubernetes is also a breeze. There is some learning curve because we started with Helm, Tiller, Grafana, Prometheus right from the start. But the kubectl command is easy to work with, and the k8s yaml files are really a breeze of fresh air compared to A	TeeWEE	9.574923	-7.076962	comment	4.0	13.0	1538484500	-13.378736
18127741	When picking preemptive machines for	When picking preemptive machines for this demo project is the intention here to simply save money for a pet project?I guess my main question is would anybody actually use preemptive for k8s knowing that if a worker node gets reaped k8s will magically route onl	deckarep	9.35057	-7.175956	comment	4.0	11.0	1538542928	-13.469197
18128021	Great article!I‘m running a full-fea	Great article!I‘m running a full-featured three node cluster for less than $10/month on Hetzner Cloud. This kind of setup requires a little more effort, but it can be fully automated and you learn a couple of things about Kubernetes on the way. I published and	pstadler	9.37067	-7.1587067	comment	4.0	12.0	1538547639	-13.475373
18128471	From my experience it's quite expens	"From my experience it's quite expensive, at least in GKE. As Kubernetes takes a lot of cpu & memory by itself.
I run a pool of one node n1-highcpu-2 (2 vCPUs, 1.8 GB memory) and it costs me about 72 euros per month.kube-system is taking about 730 mCPU of the n"	aksels	9.362768	-7.15365	comment	4.0	10.5	1538554934	-13.486248
18139130	I do agree with you, but I don't thi	"I do agree with you, but I don't think I really missed the point of the original article. From the original article:
> However popular wisdom would suggest that Kubernetes is an overly complex piece of technology only really suitable for very large clusters of"	carlosrdrz	9.351104	-7.180215	comment	4.0	33.5	1538655081	-13.506032
18139304	> using it for anything less than do	> using it for anything less than dozens of machines is overkillThe question isn't really whether you need dozens of machines, it's whether you can foresee eventually maybe needing dozens of machines.Remember the bad old days when people said that relational d	solatic	9.378419	-7.153223	comment	4.0	17.0	1538656525	-13.4844475
18141597	> But maybe I envision my side proje	> But maybe I envision my side project turning into full-time startup some day.The state of the art for cluster management will probably something completely different by then.  Better to build a good product now and if you really want to turn it into a startu	admax88q	9.361378	-7.1649446	comment	4.0	16.0	1538672246	-13.487407
18123885	Teleport v3.0 introduces Kubernetes 	Teleport v3.0 introduces Kubernetes support	twakefield	9.342634	-7.1859894	story	4.0	61.0	1538502067	-13.493427
18129681	Kubernetes on Bare Metal	Kubernetes on Bare Metal	namidark	9.350598	-7.179648	story	4.0	51.0	1538571274	-13.494483
18151998	I still haven't figured out who they	I still haven't figured out who they are, but my email account that was compromised was made specifically for Heroku.Thanks to haveibeenpwned.com for the heads up.	fooey	9.140999	-7.4018946	comment	4.0	11.5	1538776051	-13.548568
18157478	The cloud fight of 2019-2020: AWS vs	The cloud fight of 2019-2020: AWS vs GCP in the Kubernetes arena. Curious to see who's going to win, of if it's going to be a tie.Jokes apart: GCP got a head start in containers thanks to Kubernetes; AWS realized it and tried to catch up. Dominating the space 	simonebrunozzi	9.383665	-7.1199574	comment	4.0	17.5	1538862880	-13.473865
18294692	I for one have always liked the simp	I for one have always liked the simplicity of DO for hosting but I've never wanted to take on the full liability of self-rolling a DB server (and backups and replicas). So everything my company has I've put on heroku or azure. This has potential to be really s	nerdywordy	9.199134	-7.3615746	comment	4.0	27.0	1540403251	-13.482212
18496176	Depends on the scale. If I only have	Depends on the scale. If I only have 10 containers to manage I'd throw them on a m4 and let it be. Benefit of using k8s kicks in when your use case gets complicated.	frostyj	9.377116	-7.118686	comment	4.0	14.5	1542737924	-13.50217
18496333	I once got an interview from a compa	I once got an interview from a company in the container space because one of their exec read an article I published talking about the trouble with container systems[1]. (Really good talk/interview, but I ended up not moving forward because I didn't want to mov	djsumdog	9.357472	-7.174517	comment	4.0	16.5	1542738787	-13.47962
18496380	4-8 dedicate staff members to run k8	4-8 dedicate staff members to run k8s?  seriously, How did you come up with that number?1)  You can run k8s hosted on Google, DigitalOcean with zero effort.2)  I built a k8s cluster in 3 days with zero experience after spending a week playing with minikube, re	segmondy	9.35253	-7.170171	comment	4.0	11.5	1542739050	-13.491336
18596362	1.10.4 was released only earlier thi	1.10.4 was released only earlier this year and is no longer supported. C’mon, Kubernetes.	deboflo	9.346607	-7.1833935	comment	4.0	11.5	1543898809	-13.507581
18596277	Whelp. That puts Amazon's EKS on a n	Whelp. That puts Amazon's EKS on a non-supported version (1.10.4) of Kubernetes then. :/C'mon, Amazon.	falcolas	9.358062	-7.1731834	comment	4.0	15.0	1543897828	-13.474201
18715525	Isn’t Ansible a “Chef or Puppet in P	Isn’t Ansible a “Chef or Puppet in Python“?	IfOnlyYouKnew	9.676379	-7.046529	comment	4.0	10.5	1545227234	-13.309437
