id	x	y	type	relevance	size	year	umap1d	hovertext	url	author
33287024	9.263955	7.6407943	comment	3.0	11.0	1666353054	13.907466	Artificially lowering prices? You mean basic supply and demand?The regulations aren't guests responsibility the hosts and airbnb should be compliant.AirBnB and competitors are very important despite t...		vertis
33287253	9.266936	7.6362967	comment	3.0	16.0	1666354902	13.9604435	"This stuff is incredibly common in short term rental market.  You are scraping the bottom of the barrel on landlord scruples.There was a recent fire in a summer vacation town popular with NYers.
The t..."		steveBK123
33288195	9.267135	7.6434517	comment	3.0	25.0	1666361689	13.953412	>  will be back in the hands of the people who actually live in the cities.There apparently is a real demand to rent such places for short terms like holidays or trips. Banning AirBnB, or AirBnB going down, won't remove that demand.		berkes
33343297	9.264017	7.6317077	comment	3.0	10.5	1666790643	4.5658283	Don’t stay at hotels then, only stay at airbnbs/vrbos that have good wifi.		mensetmanusman
26813049	9.265476	7.6493263	comment	3.0	12.0	1618434186	13.96128	Airbnb doesn't have network effects, the value to users increases pretty linearly with the number of hosts, and doesn't really increase at all with the number of other users.		Grustaf
37657802	9.264989	7.6428013	comment	3.0	12.5	1695728310	13.949253	I travel with my kids, and usually can find better places for a whole family on airbnb than I can on booking.com.		CalRobert
37657895	9.267077	7.6331215	comment	3.0	11.0	1695728862	13.953337	I have used AirBnbs nearly a hundred times and they are never comparably priced to hotels. But this seems to be an anti-Airbnb hate fest, not a rational discussion, so obviously data isn't relevant here.		keiferski
37593385	9.263422	7.648492	story	3.0	5.0	1695272288	13.960365	Airbnb Is Different Now	https://www.theatlantic.com/technology/archive/2023/09/airbnb-hotel-hosting-cleaning-fees/675355/	gnicholas
37747173	9.264245	7.649137	story	3.0	2.0	1696299831	13.959119	Airbnb Is Fundamentally Broken, Its CEO Says. He Plans to Fix It	https://www.bloomberg.com/news/articles/2023-10-02/airbnb-is-broken-its-ceo-says-here-are-his-plans-to-fix-it	saeedjabbar
37768512	9.268455	7.64268	comment	3.0	11.0	1696440148	13.956029	Presumably this tenant who is staying for a year would be staying elsewhere in the city if they couldn't stay at the Airbnb. How is it adding to the housing crisis?		viscanti
14916523	9.261638	7.652011	comment	3.0	17.0	1501727773	13.9691925	"tldr: 
1. Some months ago, a Korean woman was drug-raped by an airbnb host.2. Airbnb did not block the host nor did it tell anyone about the host3. The host tried to drug-rape his guests again4. Japan..."		devdoomari
14941914	9.264538	7.644023	comment	3.0	12.0	1502036528	13.9590645	Airbnb employee here. (Software engineer; I don't speak for the company.) Personally, I like staying in listings that are owned and operated by the resident. It's more personal and it lets me connect ...		BMorearty
14941958	9.265342	7.6376443	comment	3.0	10.5	1502037135	13.965735	Airbnb is one of those rare products that cracked open an entire world of possibilities for me. For the first time, I've gotten the chance to live as a local all around the world, for even less money ...		archagon
14957160	9.273745	7.6139293	comment	3.0	12.5	1502196043	13.948682	If correct, this is very bad. Applying a political filter to deny lodging to people who are visiting for a purpose the corporation does not approve of is a very bad idea.I could understand if hosts wh...		ptero
15005540	9.265711	7.651912	comment	3.0	11.0	1502666370	13.964075	I don't know if this does a lot of good for Airbnb, aside from good publicity. Hate groups will go underground. They will still use Airbnb, but they'll hide their activities more.		Overtonwindow
12559558	9.265707	7.6506767	story	3.0	22.0	1474572586	13.964661	Airbnb Raises $555M in New Funding	http://fortune.com/2016/09/22/exclusive-airbnb-raises-555-million-in-new-funding/	gatsby
12668103	9.404639	7.659765	comment	3.0	15.0	1475953005	13.934674	I'm not sure you can make a good case that regulation opposed to the interests of AirBnB/Uber/etc. is a bad thing for the economy from the point of view of the workers.  From that angle, it's zero-sum...		ScottBurson
12732978	9.267604	7.650728	comment	3.0	18.5	1476780899	13.99138	Finally an article that answers some pressing societal questions:* Can hostfully.com identify suspicious data analysis? (no.)* If given the chance, will Airbnb present misleading data for self-serving...		dlss
12733698	9.274171	7.616381	comment	3.0	13.5	1476793310	13.963515	> Trivial: Because the market size increases. More people are renting hotels/airbnb + more often + for longer durations.Lol, yes, this is fair. The hotel market doubling in revenue would be headline n...		dlss
12771523	9.265144	7.648867	comment	3.0	11.0	1477188825	13.964188	Well, this is bad because it's the Chinese government.But companies like Airbnb have to use proxy metrics like number of Facebook friends. If I could be proven to be the trustworthy person I am, then ...		arjie
12800815	9.263025	7.648516	comment	3.0	10.5	1477517463	13.962825	"Thank you for sharing.  I viewed this as ""How did the hotel lobby beat the AirBnB lobby given that AirBnB hosts have so many more voters?""  I still view it as a shame, but it's a little more complicated."		mathattack
12800354	9.281831	7.600153	comment	3.0	13.0	1477514801	13.917791	Higher hotel prices are not necessarily bad, especially for the local residents.I had an Airbnb spawn across the mews behind my building they have a pretty large open balcony and there were parties li...		dogma1138
12800382	9.27443	7.628693	comment	3.0	15.0	1477514970	13.966443	I'm sure the hotels will charge as much as possible, but since they pay taxes that assumably (since it was illegal) AirBnB hosts didn't, sounds like a win for the City Government of NY.Just an observa...		qdog
12801065	9.270547	7.6261387	comment	3.0	11.0	1477519325	13.936065	> No-one wants to live next to a AirBnB. End of discussion.Exactly.AirBnB shows total disrespect.I am sympathetic to those who want clean, low-cost places to stay when visiting NYC.  According to Priceline there are $60 hotels/motels in Union City, NJ 15 mins away by transit from Times Square.		davidf18
12822854	9.263304	7.647571	comment	3.0	10.5	1477721987	13.941092	> I agree to treat everyone in the Airbnb community—regardless of their race, religion, national origin, ethnicity, disability, sex, gender identity, sexual orientation, or age—with respect, and witho...		aikah
12822884	9.265673	7.640005	comment	3.0	12.5	1477722824	13.9619255	I don't use Airbnb and most likely never will.However, let's say for argument sake I do want to rent my extra bedroom out. What if I don't want rent to some weirdo crust punk? I wouldn't feel like my ...		sergiotapia
12823080	9.264675	7.641941	comment	3.0	16.0	1477727473	13.970194	Yes, Airbnb can do what they want with their property, namely their website and business. If you don't like it then they even outline what you can do in the linked article.This knife cuts both ways.		Vintila
12823410	9.267517	7.6401415	comment	3.0	13.0	1477737607	13.952873	Maybe. But the more likely outcome is that people will simply continue to do what they do until they get kicked off and that every wanna-be renter of some Airbnb listed property is going to claim 'discrimination' from now on when they are refused.		jacquesm
27515093	9.263322	7.634794	comment	3.0	10.5	1623763537	13.963784	There's bigger issues IMO, based on the article:* Accepting hosts with prior criminal charges for battery, who then proceeded to sexually assault a guest.* Under-resourcing trust and safety teams unti...		dannyw
27516693	9.263419	7.6417	comment	3.0	12.0	1623770096	13.962166	Hotels are more reliable and organized, but I prefer AirBnB in general. I like feeling a part of the neighborhood or city, I like the home-y vibe of most AirBnBs. Hotels in contrast are a bit sterile ...		WhompingWindows
35476358	9.232657	7.480734	comment	3.0	14.5	1680826345	13.94296	Isn't it the hosts demanding that? I'm sure most people don't expect you to clean up, or if they do don't also charge you a cleaning fee.		flangola7
22506552	9.257158	7.6461143	comment	3.0	11.5	1583523596	13.961035	"> 
The problem here is that guests are never told that 5 stars = normal stay. This leads to problems. If AirBnB was more up front about expectations it would make their review system a lot better.They..."		jdminhbg
22651904	9.268984	7.649187	comment	3.0	17.5	1584841020	13.964223	I honestly don't understand why European cities don't go nuclear against AirBnB. There's so much money to be made in fines and instant political approval from virtually every tenant.		hocuspocus
22652518	9.272703	7.631065	comment	3.0	12.0	1584848251	13.955354	Good. Rentals charge 2 months rent and a deposit. The only reason I can afford housing is because of airbnb. It's the only place I can find housing that doesn't do that BS.That's here in Merida, at le...		seisvelas
22652588	9.269783	7.639243	comment	3.0	18.0	1584849161	13.961045	The cause of high housing prices are low supply and high demand. Housing supply is growing at a slower rate than demand. There are two ways to solve this:1) build a ton of housing to catch up with dem...		djannzjkzxn
15161543	9.57033	7.654185	comment	3.0	14.0	1504448538	-1.8589622	"> ""Privatize the gains, socialize the losses"" is undeniably a lucrative business strategy, but it's not one I particularly want to celebrate.This doesn't describe anything that AirBnB or Uber are doin..."		wyager
15692272	9.264651	7.6488905	comment	3.0	11.5	1510628672	13.958176	"You don't need to look much further than the story of Google. Search was thought to be a ""solved problem"" and many at the time thought that there was zero money in search. Plus it was an incredibly sa..."		askafriend
38171132	9.263315	7.6437526	comment	3.0	13.0	1699315284	13.967973	Throwing house parties in Airbnb rentals violates the platform’s policies, yet remains a common issue for hosts. “We’ve used machine learning techniques to look at the last billion and a half guest ar...		pizzafeelsright
38171220	9.259775	7.6307826	comment	3.0	12.0	1699315913	13.953254	I can’t speak for others but I avoid Airbnb at all costs now.  Hosts expecting people to be out at 10 am, check in at 4 pm and clean the place like a maid?  No thank you.  Cleaning fee?  No thank you....		Mistletoe
26898777	9.266059	7.64167	comment	3.0	12.0	1619066183	13.961299	"Why do you think AirBnB looked silly?""After moving to San Francisco in October 2007, roommates and former schoolmates Brian Chesky and Joe Gebbia came up with the idea of putting an air mattress in their living room and turning it into a bed and breakfast."" -Wikipedia"		KingOfCoders
26961766	9.26227	7.6496983	comment	3.0	16.5	1619558663	13.968772	"The ""share an AirBnB to be able to afford the conference"" part seems particularly damning to me. That seems entirely premeditated and predatory."		fabian2k
22707512	9.26331	7.6463995	comment	3.0	12.5	1585348320	13.964823	This is unfortunate for the folks at AirBNB. As someone who specializes in front end, I've admired their user interface and it is clear they have talented people.		JMTQp8lwXL
22711518	9.268215	7.6397047	comment	3.0	10.5	1585407669	13.967343	How is it something only classists can use? I use Airbnb _because_ it is cheap, usually significantly cheaper than hotels when visiting cities. I use it to save money because I am cost conscious. A lo...		akirakurusu
22718360	9.266049	7.6435986	comment	3.0	14.5	1585484366	13.963205	Well, since it says right there in the article that takings for a property rented on AirBNB could be 3-5 times the basic rental rate there will be little sympathy I fear. I mean, if that property has ...		clort
22780799	9.267009	7.6440086	comment	3.0	13.0	1586028628	13.960809	I don't follow this logic.Bird/lime own their inventory.Airbnb is better off than the hotel chains IMO. The hotel chains have to keep paying their staff and rent while revenue drops, but airbnb just s...		temp20160423
22808696	9.265167	7.648459	comment	3.0	14.5	1586303089	13.953131	I thought AirBNB was recently claiming to have more than $1Bn in Cash on Hand. This seems like an extreme measure that wouldn't make sense if they actually did have that much cash -- right??		onlyrealcuzzo
22815691	9.267721	7.648978	comment	3.0	14.5	1586371242	13.95433	"Posted this on a different thread but no one responded, even though many people wanted to ask as well, judging by the votes: ""Could someone who is working at Airbnb right now comment (anonymously) on ..."		xiaolingxiao
17878916	9.267477	7.639022	comment	3.0	10.5	1535651335	13.957656	I live next door to an AirBnB, in a building where maybe 1/5 of the flats have been converted to tourist flats. When I moved in 3 years ago there were zero.I'm woken up by screaming drunk tourists as ...		mcjiggerlog
18930828	9.261294	7.6515155	story	3.0	25.0	1547734181	13.96038	Website detailing difficult guest experiences on AirBnB called “AirBnB Hell”	https://www.airbnbhell.com	gamechangr
19235450	9.262653	7.651299	comment	3.0	23.5	1550955676	13.964136	More bad behavior that is encouraged by the AirBnb leadership. Disgusting. They could solve this problem overnight with their software but choose not to because it makes ~70% of their revenue, while a...		matchbok
15787039	9.261084	7.6502337	comment	3.0	15.5	1511788666	13.9792	I really don't understand how this is Airbnb's problem.  Why do people attack these kinds of services so often?  It's not their fault people are paying through them and then having people send the mon...		zodPod
15787195	9.293366	7.651506	comment	3.0	11.0	1511790246	13.968707	> That company gets so much flack for the way its users act.Gig economy companies blur the line between user and employee. If a hotel chain had a problem with its hotel managers laundering money, woul...		kerkeslager
15806757	9.2573185	7.650147	comment	3.0	12.0	1511963820	13.964122	Key detail:> He left at 3am, reported, host is suspended, colleague got refund.Airbnb can't check everything, but at least they respond in a good and timely manner.		golergka
15969753	9.623517	7.6665382	comment	3.0	21.0	1513780145	13.9552145	"Yours seems like a fairly usual reply when either Airbnb or Uber are discussed - ""it works for me"". Great that it works for you.I have never had a problem with the cabs where I live (and Uber is banne..."		collyw
16816301	9.27039	7.6395755	comment	3.0	22.0	1523485445	13.96199	Sure I mean if we're playing with lines on a graph in a theoretical space then building enough supply can exceed the demand and result in more affordable housing. That's not real life however.In reali...		Tiktaalik
16989286	9.266227	7.6469555	story	3.0	25.0	1525377144	13.9717045	New York City report pins millions in rent hikes on Airbnb	https://techcrunch.com/2018/05/03/new-york-city-report-pins-millions-in-rent-hikes-on-airbnb/	cfadvan
21018302	9.264302	7.645267	comment	3.0	13.0	1568913306	13.967254	What exactly is the roadmap for Airbnb? They stays feature seems to have maxed out in listings and declining now that random people are trying to manage 15+ listings in many cities. I often see the sa...		pastor_elm
21042463	9.332765	7.65872	comment	3.0	11.5	1569172145	13.958216	> Airbnb is by all accounts a wildly successful companyI remember 5 years ago when I turned down a lucrative offer from Uber because I just didn't believe in the company.  People told me I was crazy, ...		Judgmentality
21008539	9.263056	7.644842	story	3.0	1.0	1568831937	13.965361	Any reasons to avoid direct booking versus Airbnb for 2nd or 3rd stays?		mgav
22886185	9.275366	7.6057067	comment	3.0	11.0	1587012741	13.964856	> No one is sitting on a pile of apartments, or ventilators, or college spots, or food distribution capacity.The large number of empty apartments being rented 3-4 nights a month on AirBnb in most larg...		emilecantin
22901912	9.270118	7.6527	comment	3.0	11.5	1587150324	13.930325	Seems like they have enough cash to ride this out. But yes very possible that they'll need to scale back dramatically and change their business model entirely. I'm guessing even after restrictions are...		yibg
22912526	9.508088	7.65595	comment	3.0	11.5	1587257995	13.950272	This is exactly how two of the biggest startups of the past 15 years - Airbnb and Uber - were built.Airbnb and Uber built products that were in a legal gray area. Lawmakers are still catching up to them.		mkolodny
22948354	9.260099	7.6550665	comment	3.0	16.0	1587578420	13.972423	Clearly they're spending a lot of money, and maybe they'll need to do layoffs and/or other budget cuts to make it through this, but I imagine Airbnb will actually come out of this even stronger relati...		cactus2093
23084353	9.264762	7.651485	comment	3.0	11.0	1588709210	13.994915	Glad to see the money they are stealing from those of us who can't cancel our summer airBNBs is going to a good cause.		elhudy
23083865	9.255088	7.6720986	comment	3.0	15.5	1588706967	13.937278	There are going to be a lot of tough decisions for people who have to decide whether to buy their Airbnb options or lose them. I bet a lot of people at Airbnb are wishing they went public before all this.		lacker
28332588	9.269549	7.653134	comment	3.0	12.0	1630095702	-11.2249775	It's not. In general this sort of opinion seems to very much be in the current zeitgeist. Amazon should just be nicer and stop exploiting workers! AirBnB should solve the housing issues in major citie...		sushisource
27914041	9.2596655	7.651325	comment	3.0	11.0	1626914753	13.97202	> They have to spend resources on the investigation, and build a pile of evidence. You think someone is gonna stake out every suspected violator for days on end?The property is listed on AirBnB.com, w...		PragmaticPulp
12091870	9.267033	7.6397557	comment	3.0	11.0	1468474729	13.957458	Why can't we compromise a bit here? I don't think many people have issues with folks renting out their place for a few weeks during the year, but buying property and using it to attract vacationers to...		loudin
12091675	9.269122	7.6320963	comment	3.0	15.0	1468471566	13.968676	It's not victimless.  Your neighbors are the victims if you illegally rent out your apartment/house on Airbnb.  There are good reasons why zoning laws and rental contracts forbid these things.		mdorazio
12151386	9.274954	7.6445746	comment	3.0	17.5	1469314981	13.943652	>But the larger company has done some really sketchy things where they mislead users in the name of growth. They also have policies that help entrench it beyond what is fair.This could be the story of...		downandout
12454092	9.269048	7.64073	comment	3.0	14.5	1473349586	13.958761	The law, if you read it, pretty clearly does NOT apply to AirBnB (except possibly people who rent a large number of flats on it). From 803(b):(b)Nothing in section 804 of this title (other than subsec...		yummyfajitas
12455667	9.265312	7.644591	comment	3.0	10.5	1473358858	13.967321	I can think of one way AirBNB could attempt to persuade hosts: publish data showing that there is no correlation between any of [race, religion, national origin, disability, sex, gender identity, sexu...		simonsarris
12456693	9.276537	7.6522303	comment	3.0	14.5	1473364474	13.968171	It's not about WhiteBnB. It's about WhomeverIWantBnB. I am white, European, affluent, from a popular country and was rejected many times by AirBnB hosts (most of them blacks or women), so what? I look...		bitL
12912815	9.276551	7.6166415	comment	3.0	11.0	1478714780	13.958335	"I went to Bruxelles earlier this year with 5 other friends and I'm glad we were able to rent a whole flat for 3 days, we wouldn't have been able to do so by renting from professional.  
Altough we noticed that the place we were staying in was dedicated to being rented all the time."		Outpox
12912842	9.332722	7.6516128	comment	3.0	19.5	1478714894	13.960883	In Seattle there are problems with building managers not renewing leases because, even with high/low seasons, they can make more money renting the same rooms as AirBNBs.AirBNB is a great idea if you'r...		djsumdog
12913807	9.269066	7.641546	comment	3.0	10.5	1478720154	13.965166	It's also a temporal issue -- Building housing lowers house prices in the future, restricting AirBnB lowers house prices today.		mikeyouse
12939040	9.267489	7.6438212	comment	3.0	20.0	1478972973	13.964477	> AirBnB: Transforms residential housing into (in most jurisdictions) illegal hotels.Huge part of this is actually state over-regulation. People just can't build houses. If local folks can earn some m...		elcct
13302410	9.500873	7.663726	comment	3.0	53.5	1483376722	13.953295	It's almost as if AirBnB, Uber et al get by on skirting the law other people have to follow.		darpa_escapee
13302706	9.276654	7.628503	comment	3.0	11.5	1483378479	13.949002	Which hotel regulations do you think are overly onerous and ridiculous?  Most of those regulations were put in place to protect communities and customers, not the hotels themselves.  Zoning laws preve...		mdorazio
13302729	9.275335	7.639709	comment	3.0	12.0	1483378694	13.96391	Hotel taxes support infrastructure and city services.  And things like proper safety and fire regulations in hotels ensure that guests know where fire exits are, that fire extinguishers are available ...		JohnTHaller
13303060	9.268597	7.6407332	comment	3.0	10.5	1483380854	13.96385	It is related to AirBnB because there is an argument that the tax is unfair to consumers to begin with.It is designed to screw over foreigners.		stale2002
13443768	9.261634	7.6512775	story	3.0	6.0	1484920666	13.965515	Airbnb website inaccessible in Europe. They forgot to renew their certificate	https://twitter.com/r3bl_/status/822439101798510592	r3bl
13512937	9.259356	7.6327543	comment	3.0	13.0	1485677124	-3.4799297	Are they planning to force people on the platform to host refugees (paid, obviously)? I can see several practical problems with that; taking people from their home to a place where they do not speak t...		wyager
13513590	9.263626	7.646744	comment	3.0	11.5	1485687541	13.947212	"Stunt, then, as AirBNB isn't providing any free housing. You're just going to browbeat people who offered ""housing to displaced neighbors and relief workers"" to underwrite ""your"" provision of housing to people who are neither neighbors nor relief workers."		cronjobber
13513745	9.263452	7.648537	comment	3.0	18.5	1485691267	-11.027481	That's dumb argument, sorry. Disaster relief is temporary and help is provided to people who suffer from external circumstances. Housing for homeless is a daily job for the government and it is differ...		ivan_gammel
13535792	9.482319	7.6659575	story	3.0	17.0	1485900785	13.955487	How Uber and Airbnb Won	https://www.wsj.com/articles/how-uber-and-airbnb-won-1485821086	robterrin
21408629	9.264933	7.6478643	comment	3.0	21.5	1572529567	13.966023	I'll ask the dumb question (I don't use AirBnB): why not dispute the charge via a credit card?		kop316
21411627	9.265012	7.651612	comment	3.0	10.5	1572544274	13.960063	I am not sure why, but reading this article just made me feel pretty ill. How does someone (multiple someones?) have the moral ability to do these kinds of things? I seriously can't believe the whole ...		apacheCamel
21459917	9.2683325	7.6428046	comment	3.0	14.5	1573017421	13.959992	"70 percent of voters supported the new regulations.The new restrictions allow homeowners to rent out portions of their homes as long as they’re present during a guest’s stay.
But they prohibit renters..."		shartshooter
21460646	9.265649	7.643865	comment	3.0	13.0	1573028698	13.974048	> I used to love staying in Airbnb’s but can’t stand the cheapness of it all as of late due to them turning into pure investments and no longer real homes.That's nice that you prefer one type of renta...		cycrutchfield
21465517	9.335112	7.660763	comment	3.0	14.5	1573065370	13.95575	"One category that's missing on the left is ""Parents."" There's Tinder for parents (Peanut), Birchbox for parents (multiple subscription boxes). It would be interesting to think about what Uber or AirBn..."		snegu
21467895	9.261415	7.648544	comment	3.0	10.5	1573077345	-10.493457	How is this an improvement over Airbnb's existing review and complaint mechanisms?		pmoriarty
21538792	9.282672	7.6484656	comment	3.0	30.5	1573761484	13.96376	Jersey City just had a public referendum on short-term rentals that AirBnB spent millions of dollars lobbying against. It's good to see that the both the public and its elected officials are coming up to speed on the realities companies like Uber and AirBnb force upon them by skirting the law.		navigatr
18030243	9.257723	7.656875	story	3.0	13.0	1537425586	13.95363	Show HN: Open Sukkah – Airbnb for Public Sukkahs	http://www.opensukkah.com	machtesh
29774114	9.263067	7.64841	story	3.0	13.0	1641158829	13.9635	Airbnb will hide guests’ names to fight discrimination (but only in Oregon)	https://www.theverge.com/2022/1/1/22862541/airbnb-oregon-hosts-guests-initials-discrimination-lawsuit-settlement-update	devadvance
29933833	9.230997	7.609659	comment	3.0	15.5	1642164741	13.951127	"I went to visit the US and transferred just 500 Dollars to a friend for our shared Airbnb. The account got suspended because of ""unusual activities"" I called them and told them it was myself transferring funds and it still took them two weeks to reinstate the account..."		YXNjaGVyZWdlbgo
29981615	9.261884	7.642534	story	3.0	5.0	1642523685	13.939556	Starting today, I'm living on Airbnb	https://threadreaderapp.com/thread/1483474046847225865.html	cblconfederate
