id	label	hovertext	author	x	y	type	relevance	size	year	umap1d
22880931	The Inevitable Return of COBOL	The Inevitable Return of COBOL	nightfuryx	10.147483	9.793805	story	5.0	23.0	1586973794	-8.929832
23091089	I find it somewhat ironic that IBM i	I find it somewhat ironic that IBM is struggling so hard to find COBOL programmers to keep mainframe alive, but they also insist on locking down z/os to the point that you can't get access to a terminal unless you already know COBOL and work for an enterprise 	tw04	10.14831	9.790463	comment	5.0	17.0	1588774088	-3.9948316
23297347	Show HN: A Simple COBOL Game, TicTac	Show HN: A Simple COBOL Game, TicTacTOBOL	BasiliusCarver	10.146529	9.786775	story	5.0	23.0	1590375742	-8.91663
34045990	So much wrong with this and the arti	So much wrong with this and the article linked in first sentence.Just a few notes.To be pedantic, COBOL was invented by the Navy, mostly by GMH. And to call it dead is not consistent with the humongous body of code that keeps many large institutions afloat.And	wglb	10.147786	9.793909	comment	5.0	18.5	1671407726	-8.950302
26491802	> COBOL programs have history. They 	> COBOL programs have history. They were changed in '77 and then the change was reverted in '79 and then again in '84. Nobody really remembers why.I wonder how different it would be if they had a good source control system (and used it). Would you be able to l	wtetzner	10.147857	9.794815	comment	5.0	14.5	1615991688	-8.949465
26719780	> “COBOL doesn’t present any securit	> “COBOL doesn’t present any security problems because it doesn’t really talk to any resources,” Malik said. “It just says ‘read’ or ‘write.’”Can someone knowledgeable of COBOL expand on this? It sounds... not quite right, like it's missing some surrounding co	carols10cents	10.147823	9.790034	comment	5.0	13.5	1617761111	-8.944447
27074307	(I work in mainframes, but not direc	(I work in mainframes, but not directly COBOL.) COBOL could certainly be done better today, but its strength comes from the fact that it limits what programmers can do with it.In the past, there was a divide between systems and application programmers. Roughly	js8	10.147931	9.793917	comment	5.0	16.0	1620382866	-8.947735
15606867	This is what I like about Rebol & Re	This is what I like about Rebol & Red...pity Rebol didn't catch on more. The full Rebol download is a single executable (no real install) and can build GUIs, and so much more in a very small amount of code.	throwaway7645	10.169855	9.717245	comment	5.0	20.5	1509583252	-7.511844
29229704	I have retired some COBOL in my life	I have retired some COBOL in my life, I can’t say that my experience is universal, but here’s what happened during my time consulting for a Fortune 500 company sunsetting COBOL into Java (1.4).> If the systems are so vital surely there is a detailed specificat	ihumanable	10.148164	9.792608	comment	5.0	12.5	1636996388	-8.913938
29611075	Ask HN: Is anyone programming in mod	Ask HN: Is anyone programming in modern COBOL?	exdsq	10.147969	9.793816	story	5.0	12.0	1639884746	-8.919943
13862538	I thought that COBOL programmers wer	I thought that COBOL programmers were in great demand, for maintenance of old systems, and increasingly so as old programmers retire.	josh_fyi	10.14769	9.7941475	comment	5.0	12.5	1489440068	-8.914838
13971283	I've noticed that Red shows up on HN	I've noticed that Red shows up on HN with some regularity, and it sounds interesting.  But I don't really understand where it comes from or who it's meant for.  The Red / REBOL community seems more than usually self-contained, although it's possible that it's 	sevensor	10.154626	9.734259	comment	5.0	26.0	1490645594	-7.4278536
14083942	Cobol expert = $1,000 an hour rate. 	"Cobol expert = $1,000 an hour rate. Great niche, but eventually will get replaced.Awesome marketing and PR for his company Cobol Cowboys (http://cobolcowboys.com.> His wife Eileen came up with the name in a reference to ""Space Cowboys,"" a 2000 movie about a gr"	nodesocket	10.147814	9.794165	comment	5.0	20.5	1491871732	1.7637103
14085147	Because COBOL is the PHP of the 60s,	Because COBOL is the PHP of the 60s, and mainframes are slow and expensive.Also, too many of the talents are stuck in a blocked I/O mindset somehow.Some are wizards though, writing assembly and making raspberry pi sized systems blazingly fast. OK a couple of r	kpil	10.147844	9.794062	comment	5.0	14.5	1491889378	1.4276817
14482734	To like COBOL, you need to posess a 	To like COBOL, you need to posess a particular kind of rigid corporate mindset. I wonder whether it's fathers/mothers had the mentioned physic structure, or it was a fruit of 50's salaryman mental subjugation. No offense ment.	jxub	10.148037	9.79386	comment	5.0	13.0	1496600447	-8.936902
23460232	> I’m just not inclined to agree tha	> I’m just not inclined to agree that civil society can’t continue to run on millions of lines of COBOL for another 60 years. It certainly can.> Java 8 and Python 2 on the other hand are a far more serious threat. When systems can’t get off end of life technol	_bxg1	10.147849	9.794017	comment	5.0	14.5	1591647008	-8.908397
20454655	My understanding is that part of COB	My understanding is that part of COBOL's longevity stems from its particular handling of fixed-point math being a specified requirement of various financial contracts. Odd to see this write-up not mention fixed-point math, actually.	fc_barnes	10.147834	9.794215	comment	5.0	19.5	1563317599	-8.895595
31224658	Ask HN: Is it worth to learn COBOL?	Ask HN: Is it worth to learn COBOL?	marcodiego	10.147813	9.793854	story	5.0	9.0	1651409830	1.7784983
36056703	> Almost all of this seems untrue (e	> Almost all of this seems untrue (except maybe the last one). I’ve worked at a variety of banks from front to back office across securities and private wealth. I’ve seen plenty of company-specific languages, plenty of C++, Java, perl, python but have literall	skissane	10.148301	9.792544	comment	5.0	14.0	1684929022	-8.883988
34408546	I find COBOL to be a very interestin	I find COBOL to be a very interesting language, with a huge unexplored potential. For example, I'm sure that most people are not aware that COBOL has generics, method overloading, declarative error/exception handling, asynchronous messaging, etc.This stuff is 	KTSnowy	10.147713	9.794607	comment	5.0	16.5	1673923277	-8.978467
35011267	> How much COBOL code can run on a r	> How much COBOL code can run on a regular Ubuntu machine?All of it. GNU Cobol exists, as do proprietary solutions from companies like Micro Focus that target the JVM and .NET (which is what you're looking for for a real COBOL solution).But why is it so import	bitwize	10.147863	9.794541	comment	5.0	18.0	1677859121	-8.899913
35011368	COBOL was actually in the CS curricu	COBOL was actually in the CS curriculum for my university, a fact that several of my friends brought up when the 'COVID is prompting a real need for COBOL programmers in light of the need to change benefits rules and unemployment!' stories were a regular featu	benjaminpv	10.148169	9.7947	comment	5.0	17.0	1677859525	1.7270322
38864805	What if you are one of the only few 	What if you are one of the only few who know how to maintain a Cobol system for a bank? Aren't you very valuable?	DeathArrow	10.1479225	9.79343	comment	5.0	19.5	1704359335	-8.94897
15685067	COBOL and Fortran. Probably with som	COBOL and Fortran. Probably with some z/OS as well.Much of the world's financial systems run on it, replacing it is infeasible, but the expert's in this area are aging out (and many have retired more than once). But the tech still needs maintaining, and is dif	shakna	10.148016	9.787	comment	5.0	18.5	1510561258	-8.866461
16010971	Ask HN: Rebol/Red parse is great. Ha	Ask HN: Rebol/Red parse is great. Has it been re-implemented in other languages?	macmac	10.15483	9.734936	story	5.0	15.0	1514321807	-7.4031963
16664964	I have coded Solidity a bit, and it'	"I have coded Solidity a bit, and it's pretty obvious the language is not up for the task. I mean its 2018 and we have a brand new ""business language"" that can have overflows and stuff. It's like making all mistakes over again. Many problematic vulnerabilities "	kerng	10.147987	9.794083	comment	5.0	14.5	1521867735	-8.884863
21288612	Interesting.  The problem of cobol i	Interesting.  The problem of cobol is that is verbose, like java. Type type and then type.  Copy and find all the time. Good luck to understand any as it takes a lot of time to read it.Do not like cobol or java.	ngcc_hk	10.147969	9.793731	comment	5.0	14.5	1571371906	-8.946598
32910954	Introductory-level educational COBOL	Introductory-level educational COBOL materials with modern tooling	mooreds	10.147718	9.794689	story	5.0	71.0	1663678290	-8.944091
36754631	I'm surprised that I haven't heard o	I'm surprised that I haven't heard of this line of languages before.The home page of Rebol, which it says it's derived from, seems to do a much better job at stating its purpose: http://rebol.com/	jomohke	10.153682	9.744181	comment	5.0	18.0	1689573411	-7.404843
25385474	Sometimes I wonder if I should learn	Sometimes I wonder if I should learn COBOL just so maybe I can get my first real programming job. (and no, I am not joking...)	speeder	10.147611	9.794017	comment	5.0	26.0	1607693455	-8.873244
25385878	The hatred comes from people like me	The hatred comes from people like me, who have worked with COBOL and will tell you it's terribly frustrating to work with, needlessly verbose in multiple places where it doesn't need to be, and often used in banks for purposes which are the death of all you ho	the_af	10.14769	9.794395	comment	5.0	20.5	1607695615	-8.982374
36689723	As someone who worked on a 35 millio	As someone who worked on a 35 million loc cobol and jcl system for several years in the late 90's, I don't find this to be funny at all. Cobol was purported to be readable with english language like syntax to make it more understandable. Giving gems such as:  	throwaway1492	10.148283	9.792295	comment	6.0	27.0	1689128343	-9.011766
21289014	Oh man, I always wanted to learn mor	"Oh man, I always wanted to learn more about COBOL.  People like to crap
on the language, but this article makes it seem like it's not that bad,
actually.  I could see myself programming that, for a large sum of money
of course.With that said, the real COBOL co"	ainar-g	10.147793	9.794696	comment	6.0	17.0	1571378005	-8.949972
21288048	COBOL turns 60: why it will outlive 	COBOL turns 60: why it will outlive us all	mindcrime	10.14755	9.7940235	story	6.0	37.0	1571364402	-8.960432
12096819	>There’s nothing wrong with the lang	>There’s nothing wrong with the language itself, the problem is that barely anyone knows it — at least not in the context of mainframe programming.What data did you use to determine that barely anyone knows mainframe COBOL? There are a significant amount of co	bitmapbrother	10.1477	9.795202	comment	6.0	19.5	1468526967	-8.949363
12097085	Not compeltely related to article bu	"Not compeltely related to article but I've often heard that banks argue that COBOL is more reliable and maintainable then any ""modern"" language.I've always wondered why this is the case. Is it because people are way more careful when entering code? The article"	Matt3o12_	10.147705	9.7941885	comment	6.0	17.5	1468529476	-8.91831
28071096	Contemporary COBOL: Developers' Pers	Contemporary COBOL: Developers' Perspectives on Defects and Defect Location	Fragoel2	10.148008	9.786917	story	6.0	50.0	1628150759	-8.911018
28542646	> Cobol remains the language of choi	> Cobol remains the language of choiceSigh , those single liner  that both illustrate the ignorance and the status of the author.I’m an enterprise architect in banking , 6 month ago I was hired for  IT Transformation.My mission was very simple « move the bank 	asien	10.148269	9.792818	comment	6.0	17.0	1631731029	-8.914189
22840267	Here's some simple COBOL code:http:/	"Here's some simple COBOL code:http://www.csis.ul.ie/cobol/examples/Conditn/Conditions.htm    identification division.
    program-id. letters.
    data division.
    working-storage section.
    01  Char               PIC X.
        88 Vowel           VALUE ""a"	msla	10.147927	9.793643	comment	6.0	17.0	1586591290	-8.957289
26736326	Ask HN - should I build my new start	Ask HN - should I build my new startup around COBOL?  Or should I use a less proven language such as Python, Go, Rust ? /s	sgt	10.14808	9.794493	comment	6.0	23.0	1617869909	-8.977066
26737362	That was always my impression. But s	That was always my impression. But some thread on HN from yesterday a lot of people were saying COBOL salaries were very low, so which is it?	somedude895	10.148123	9.794229	comment	6.0	16.0	1617880407	1.7451339
27441327	I can see in the page that last PDL 	I can see in the page that last PDL release was on February, okay. Probably the presence of activity indicates that there are people using PDL, and more than that, maintaining it. Since PDL existed for many years, I would speculate that these people presumably	aduitsis	10.149371	9.786902	comment	6.0	35.5	1623188756	4.323379
37992556	Having written some COBOL while cons	Having written some COBOL while consulting for a bank:The language is not interesting at all without the ecosystem, which is this fully flushed alien alternative universe of computation. If you want to dive into COBOL, don't try to run it on x86, get yourself 	SonOfLilit	10.147852	9.794435	comment	6.0	26.5	1698100615	-8.931979
38010416	Having worked for 20 years in fintec	Having worked for 20 years in fintech, I have seen many large European and Asian banks running on COBOL programs written 30 years ago, using EBCDIC. In many cases the sources for some of those programs are lost, due to the fact that proper version control syst	giamma	10.148795	9.791502	comment	6.0	19.5	1698221087	1.5403717
38023870	COBOL bridge for Node.js	COBOL bridge for Node.js	mooreds	10.147788	9.793266	story	6.0	47.0	1698316808	-8.942391
15430476	Get ready for a data dump of 40 year	Get ready for a data dump of 40 year old COBOL code /sBut in all seriousness, this is a great step forward in institutional software. Open up software to further progress towards standardizing an industry's software interface.	cbcoutinho	10.148045	9.7942915	comment	6.0	31.5	1507502965	-8.926155
20299768	One thing I really miss from mainfra	One thing I really miss from mainframes is their stability.Case a) Lots of years ago IBM changed CPU architecture on their System i. Every program we made was transparently recompiled to the new instruction set on first run, and just worked after that.Case b) 	ASalazarMX	10.14794	9.791044	comment	6.0	19.0	1561676504	-8.9205475
20455152	One of my last jobs as an intern in 	One of my last jobs as an intern in 2004 was to rewrite an old batch process COBOL app in C# and ASP.Net. App was basically input about 6 fields, and based up some rules.  It really wasn't terribly complicated, but I had to read the source to understand exactl	hermitdev	10.1478815	9.792895	comment	6.0	30.5	1563322112	-8.942237
20916177	Ugh? Many systems still run COBOL to	Ugh? Many systems still run COBOL today. Python 2 is likely to be around for a long time. Since the stuff is open source, wouldn't it be nicer if it was possible to fix a bug if needed? Not saying that it should be actively worked on. But maybe one person coul	d--b	10.147884	9.7936535	comment	6.0	19.0	1568017312	-8.954642
14203786	Realistically, if, say, one of these	Realistically, if, say, one of these big corps/banks with deeply-integrated COBOL systems spent a few years revamping their systems to something more modern and usable today, how much would it cost?Running mainframes isn't cheap. COBOL programmers aren't cheap	scrollaway	10.148412	9.792003	comment	6.0	25.0	1493220584	-8.902079
37389644	Does anyone want to comment on why C	Does anyone want to comment on why COBOL has a reputation of being good for critical stuff? Are there technical reasons for this, or is that just branding?	tjrgergw	10.147801	9.794775	comment	6.0	15.5	1693906256	-8.899964
25176311	There’s a lot of that out there. I h	There’s a lot of that out there. I have avoided COBOL but I have seen stuff written in VB6/COM which was also in the same state. Eventually the one guy who knows anything about it leaves or dies. In the name of “progress” someone wraps it in something else and	qz2	10.147726	9.793177	comment	6.0	17.5	1606040009	-8.975169
32822513	Not a computer scientist, but surely	Not a computer scientist, but surely COBOL could be machine translated to another more modern language - or even a dialect of a modern language specifically created to make such a translation verifiably correct?	implements	10.147773	9.794201	comment	6.0	15.0	1663065031	-8.965837
24079170	REBOL Shell Interface	REBOL Shell Interface	bryanrasmussen	10.15299	9.75675	story	7.0	90.0	1596784153	-8.1368265
26426066	That's a good question!The reason gi	That's a good question!The reason given is it's getting difficult to find COBOL programmers and the platform isn't as agile as other platforms. I have to admit that IBM is working to make the platform more agile and you can do more than run COBOL - you can run	taylodl	10.147885	9.793268	comment	7.0	30.0	1615481325	-8.857298
35726415	Learning COBOL: A Journey for the Mo	Learning COBOL: A Journey for the Modern Programmer (2021)	rbanffy	10.147864	9.793279	story	7.0	114.0	1682594773	-8.8997965
12634931	The worst is, if you don't keep up w	The worst is, if you don't keep up with this, good luck getting a web job five years from now, you'll be the equivalent of a Cobol programmer. Can't get off the train.	Scarblac	10.147771	9.793865	comment	7.0	19.0	1475583041	-8.881224
12097442	The COBOL programmer shortage is sol	The COBOL programmer shortage is solvable if they simply pay people enough money. COBOL programmers do not make SV salaries, far from it. Yet the code they write generally is handling more critical tasks than most of the stuff SV startups are producing (bank b	ams6110	10.148051	9.791402	comment	7.0	33.0	1468533001	1.6574749
17301606	"It's a ""real"" language, it's just no"	"It's a ""real"" language, it's just not a terribly good or fast one. It's works decently when its use is limited to what it was made for: manipulating web pages. For anything else, the ""designed on the back of a used piece of toilet paper"" starts to shine throug"	arghwhat	10.147717	9.79402	comment	7.0	41.5	1528882769	-8.953372
17636270	The statement about Decimal being an	The statement about Decimal being an import is a garbage, misleading statement. Decimal IS PART OF THE STANDARD LIBRARY!!!! It might not be in the global context, but that is a far cry from having to install an external library which this article makes it seem	slaymaker1907	10.147804	9.7940235	comment	7.0	18.5	1532833075	-8.983773
17989671	Defusing COBOL Bombs with Smart Auto	Defusing COBOL Bombs with Smart Automation	mbellotti	10.146693	9.77948	story	7.0	74.0	1536950180	5.664871
29700938	What modern programming language is 	What modern programming language is the best replacement for COBOL	aks2161989	10.148098	9.794038	story	7.0	10.0	1640597244	-8.949598
26566963	There is regular news about how one 	There is regular news about how one COBOL system or the other has become unmaintainable and is causing problems. [1] If your hypothesis would be true this wouldn't be the case, as there would always be enough smart devs to learn COBOL and keep working on them.	dtech	10.148089	9.793273	comment	7.0	20.0	1616592851	-8.890423
22788053	How hard would it be to automaticall	How hard would it be to automatically convert that COBOL to e.g. C++ or Rust? I suspect not that hard, since COBOL does not even have a heap afaik.	amelius	10.1476345	9.794792	comment	7.0	19.0	1586116131	-8.923687
14088303	I worked for years on the modernizat	I worked for years on the modernization of a critical banking infrastructure system. The problems are manifold. The biggest problem is overall architectural impedance mismatch - switching from a batch system (most of those old COBOL mainframe apps are batch sy	beat	10.148166	9.793333	comment	7.0	24.0	1491922130	-8.900622
32912332	I have heard that a developer willin	I have heard that a developer willing to learn COBOL can land a massive salary.  Is this actually true?  What companies are hiring/looking for people and is there a place to get realistic numbers?	freedomben	10.147939	9.793705	comment	7.0	20.0	1663685043	1.6872723
31228767	Does anyone have confirmation for th	Does anyone have confirmation for the old rumour that there is high demand for COBOL engineers because of legacy systems eg in banks? And how does one go about finding these opportunities? I remember once talking to a freelance engineer, he didn't do COBOL but	t_mann	10.147998	9.793361	comment	8.0	29.5	1651439970	1.6129873
35011856	I have seen the COBOL issue come up 	I have seen the COBOL issue come up a number of times, and I just don't get it. Am I thinking about this wrong?COBOL seems to be a straightforward language by modern standards. Any programmer with experience with imperative languages should be able to pick it 	BlandDuck	10.147849	9.793893	comment	8.0	24.0	1677861634	-8.885027
17335117	Ask HN: Why COBOL is not hip anymore	Ask HN: Why COBOL is not hip anymore?	maxpert	10.147675	9.792761	story	8.0	4.0	1529281063	-8.992704
18716664	Ask HN: Why did people switch from C	Ask HN: Why did people switch from COBOL to newer languages?	asdfman123	10.147849	9.794792	story	8.0	13.0	1545236201	-8.974371
22782336	How hard is cobol to pick up and lea	How hard is cobol to pick up and learn at the level needed to contribute? I'm sure there are many no longer employed programmers in the tri state area that might be able to help	vikramkr	10.147719	9.794198	comment	8.0	32.5	1586042714	1.723589
22785548	Serious question: Should I learn COB	Serious question: Should I learn COBOL in 2020-0?	maallooc	10.147641	9.794322	comment	8.0	21.5	1586095061	-8.927065
22838070	Just put the entire COBOL source cod	Just put the entire COBOL source code on the github and let us rework it in the Java or C# and be done with this abomination.	newprint	10.14778	9.794676	comment	8.0	22.0	1586558346	-8.917837
34000077	Maybe it's the type of companies I'v	Maybe it's the type of companies I've worked for but I have never seen cobol. Anyone know where it's used most?	4RealFreedom	10.148103	9.792703	comment	8.0	34.5	1671114946	-8.936126
26718716	The language is fine: It's the ecosy	The language is fine: It's the ecosystem that's not.Nobody in the top 50 CS programs worldwide teaches COBOL. Most of the COBOL programs run on mainframe where it's at least a few k$ to even get a look at the documentation or hardware. So nobody bothers with i	908B64B197	10.147668	9.7938175	comment	8.0	32.0	1617752284	-8.948835
26732603	I'm just imagining the level of jaw 	"I'm just imagining the level of jaw dropping and brain exploding that would have gone on had that same headline been published in 1998.Obviously at this point almost three decades into the internet era no one really cares. We all know that ""somewhere"" old COBO"	ajross	10.147773	9.794212	comment	8.0	23.5	1617836023	-8.8965025
38276518	COBOL for GCC Development	COBOL for GCC Development	pantalaimon	10.147754	9.794284	story	8.0	72.0	1700055861	-8.901548
38306854	Worked with a guy ten years ago that	Worked with a guy ten years ago that would obsessively read these reports from the Pentagon. Here's a couple of his stories about the matter: https://www.reuters.com/investigates/pentagon/ and https://www.reuters.com/investigates/special-report/usa-mari... (ve	MrMetlHed	10.145305	9.78792	comment	8.0	71.0	1700242285	4.772458
23670819	On COBOL	On COBOL	MindGods	10.147768	9.793672	story	9.0	52.0	1593368158	-8.941653
20891075	Cobol Web Development	Cobol Web Development	gscott	10.1478405	9.79428	story	9.0	105.0	1567721114	-8.945238
16420959	The Beauty of the COBOL Programming 	The Beauty of the COBOL Programming Language	Caveman_Coder	10.147693	9.7946615	story	9.0	43.0	1519140130	-8.936298
22691622	There are a few things present in CO	"There are a few things present in COBOL that I would like to see lifted into more modern languages. One is the use of the full stop as an expression terminator, as in English, instead of the semicolon. Another is the whole ""picture"" mechanism for number format"	pjc50	10.14781	9.794255	comment	9.0	24.5	1585212412	-8.936557
38306912	Start paying 250k a year for cobol d	Start paying 250k a year for cobol developers and the problem fixes itself really fast. That or start migrating the system. Or more likely they keep using it until it completely breaks and then run to the government for a big handout to fix it.Easy to be irres	bogota	10.147583	9.793429	comment	9.0	43.0	1700242515	1.7065816
14084517	Been working on accounting systems i	Been working on accounting systems in RPG and COBOL since ~1992.  I also know C/X86ASM/Pascal/Delphi/VB/Fortran.  Never bothered with C++ that much; played with Java a bit but Oracle irritates my bowels so moved away from that.As mentioned in the article it's 	sanguy	10.149295	9.788134	comment	10.0	81.0	1491879771	1.7321937
14203326	The idea that large corporations are	The idea that large corporations are simply going to move on from COBOL is out of touch with reality. It really can't be overstated how deeply old COBOL programs are embedded into these corporations.  I worked for one that had been using them since the languag	shepardrtc	10.147848	9.7936735	comment	10.0	46.5	1493217444	-8.977218
31227251	COBOL Programming Course	COBOL Programming Course	marcodiego	10.147795	9.793944	story	10.0	103.0	1651428461	-8.925054
