id	label	hovertext	author	x	y	type	relevance	size	year	umap1d
28464873	I’m generally pretty amazed at how l	I’m generally pretty amazed at how low the salaries are for COBOL developers relative to the criticality of the systems being maintained, and also how common those legacy code bases are.	Guest42	10.147974	9.79206	comment	4.0	22.0	1631148259	1.672741
28465221	I knew COBOL was still in use, but t	I knew COBOL was still in use, but this is astounding:> The Bank of New York Mellon in 2012 found it had 112,500 individual COBOL programs, constituting almost 350 million lines;Could that really be true? Can anyone provide some context to make that make sense	jrochkind1	10.147914	9.793151	comment	4.0	11.5	1631151428	-8.931876
28466189	What is intrinsically wrong with run	What is intrinsically wrong with running systems on COBOL? These systems have a very long lifetime, and COBOL has worked for that entire time.Would it really be an improvement to rewrite a banks's backend processing software in the latest fad flavor of languag	IncRnd	10.147933	9.79397	comment	4.0	12.5	1631161700	-8.939315
28541109	I've always thought that the reason 	"I've always thought that the reason COBOL is still ""popular"" is that it became an entrenched technology many years ago, and the cost of replacement is high enough (and it works fine doing what it's doing) that no one wants to invest the time and money to repla"	bluejekyll	10.147979	9.794152	comment	4.0	15.0	1631723119	-8.97205
28662771	Yeah, C and Java have had non-breaki	Yeah, C and Java have had non-breaking changes for years. Java code from 1995 can still compile and execute in Java 17 (2021).I imagine COBOL is similarly stable but I have no experience there.	TedDoesntTalk	10.1480665	9.793051	comment	4.0	14.0	1632677652	-8.931829
19915941	My point is that it's the reality. C	My point is that it's the reality. Change and adapt or die along with the COBOL programmers. I watched the COBOL programmers get laid off in droves after Y2K and the dotcom bust so it's a lesson I won't forget. Sure there are some COBOL programmers making mint	docker_up	10.147919	9.794238	comment	4.0	13.0	1557887768	1.5189098
17992918	Serious question: COBOL's just a lan	Serious question: COBOL's just a language. How come no one has put together some kind of runtime interpreter, for COBOL, or thought to produce an emulator facade that keeps the business logic of legacy code, but ports it to another platform, architecture, infr	beesKneesMan	10.147951	9.794305	comment	4.0	11.0	1536984143	-8.915752
18079071	Do You Know Cobol? If So, There Migh	Do You Know Cobol? If So, There Might Be a Job for You	breck	10.147687	9.793611	story	4.0	10.0	1537987796	1.7541618
18845973	> > If anything, it sounds too easy,	"> > If anything, it sounds too easy, making me think ""what's the catch?> This is rude and uncalled for.I think she/he raise a fair point about how the Red language is advertised, and it's actually a rather friendly to assume that it's due to language barrier.M"	hjek	10.1574545	9.718977	comment	4.0	25.0	1546875589	-7.3160396
17217848	Supply and demand.Game developers: v	Supply and demand.Game developers: very sexy, easy to show off, has a (very) large supply of talent. Pay not bad, not good, work schedule very demanding.COBOL developer: extremely unsexy, almost don't want to admit it publicly.  Tiny supply, relatively much la	crazybit	10.147937	9.794096	comment	4.0	11.5	1527998636	1.6897302
22782474	The point at which the government sh	The point at which the government should have rewritten their COBOL systems into a language that would have a talent pool to draw from was at least 30 years ago.	c3534l	10.147277	9.790465	comment	4.0	16.5	1586044138	-8.888948
22837948	I coded COBOL and RPGII programs bac	I coded COBOL and RPGII programs back in the late 70's, and I'd flip burgers before writing another line.	jerhewet	10.147824	9.794157	comment	4.0	11.0	1586557525	-8.956982
22838032	I worked in COBOL at an internship a	I worked in COBOL at an internship and this was around 2012. This system runs over 1000 court systems in the U.S. It's graphical too and sort of looks like vb6 on the frontend. It was a nightmare to work in even though the team was disciplined and took care of	codenesium	10.147708	9.794574	comment	4.0	12.5	1586558111	-8.891608
22854225	Ask HN: Where is the evidence that l	Ask HN: Where is the evidence that learning COBOL pays and is in demand?	ornornor	10.147817	9.795001	story	4.0	8.0	1586768839	1.7796762
37992619	I've been intrigued enough to pull d	I've been intrigued enough to pull down Gnu COBOL and attempt to write some simple programs, and found it to be quite an alien universe in and of itself. Can you give any examples of the fully-fledged mainframe world differing from running it on x86/arm?	shawa_a_a	10.147669	9.794424	comment	4.0	15.0	1698101004	-8.851843
25556706	My wife stopped applying for jobs in	My wife stopped applying for jobs involving government programs involving COBOL several years ago. She is very fluent in a lot of languages including COBOL, FORTRAN and so on. The issue is that these agencies never want to pay real wages for a very narrow skil	SteveGerencser	10.147793	9.794231	comment	4.0	11.0	1609129989	1.6200813
26348579	There's far more critical code in th	There's far more critical code in the world running on COBOL and s3[79]0 assembler. COBOL is vastly more important than C.	rodgerd	10.1479435	9.794006	comment	4.0	12.0	1614893103	-8.861315
37392055	So for those who don't know, Microfo	So for those who don't know, Microfocus is a retirement home for technologies that need to be taken out behind the barn and shot but can't be because there are like 3 major customers out there that have a Microfocus product as a core part of their organization	gustavus	10.14767	9.794684	comment	4.0	13.0	1693923796	-8.943955
24545149	Does COBOL translate easily to more 	Does COBOL translate easily to more modern languages? Anything tricky or odd about it? I’ve never needed to use it.	azhenley	10.148429	9.788848	comment	4.0	17.5	1600705021	-8.934934
25282708	Close I think - the best language to	Close I think - the best language to use is the one you will have the easiest time hiring good talent for.  If you found a startup and all really love and are fluent in COBOL that's great but... good luck when it comes time to hire another employee.	munk-a	10.147554	9.781429	comment	4.0	11.5	1606948784	-5.7489257
25388269	The importance of the comments in CO	The importance of the comments in COBOL reminds me of a developer I worked with who was famous for removing comments to 'tidy up the code'The other developers then spent time readding the comments	fiftyacorn	10.147853	9.794364	comment	4.0	12.5	1607707922	-8.9959135
25389127	At least for me, I criticize from ex	At least for me, I criticize from experience: I worked with COBOL, and think it's an awful, unfun language, commonly used for unfun projects. And COBOL jobs don't pay particularly well where I live, either.> In my country and in Sweden it is quite easy to get 	the_af	10.147905	9.792109	comment	4.0	14.0	1607712317	1.7626157
38646818	I used to work at a large insurance 	"I used to work at a large insurance company with a COBOL core system. I completely agree with this. They paid for people who knew all the undocumented idiosyncrasies and foot-guns in the code. Not just ""Knowing COBOL"". A decent programmer could read a COBOL pr"	Deprecate9151	10.14778	9.794363	comment	4.0	12.5	1702585774	1.7239647
32513140	"> Rebol is pronounced ""reb-ol"".> It'"	"> Rebol is pronounced ""reb-ol"".> It's similar to ""rebel yell""So, like Ravioli without the last i. Raviol.I don't understand why developers go with these pronunciations. Clang is another offender. The obvious pronunciation was see-lang, but they went for clang,"	copperx	10.154512	9.736599	comment	4.0	12.5	1660847033	-7.448704
32797933	This part sounds alluring to me:> “I	This part sounds alluring to me:> “It does exactly what you tell it to do on a line [of code],” explains Stuart. ”Sometimes you get files that are 2,000 lines long, but they’re easy to understand because they simply do what they say they’re doing at that line.	AlbertoGP	10.148001	9.793989	comment	4.0	16.0	1662886004	-8.893127
38307851	I can build you a team using today's	I can build you a team using today's (quality: average B2B startup) programmers and today's methodologies that will write software for 40 years.It will just cost twice as much as the team that iterates quickly. It will cost more because I will spend more money	ebiester	10.147932	9.794493	comment	4.0	16.0	1700246003	-8.959948
15430649	I would love for a few banks to dump	I would love for a few banks to dump all their old COBOL code on to GitHub. Not because it would necessarily be useful for anything, but simply because it would be fascinating to read... There is actually very little open source COBOL code available, of the ma	skissane	10.147714	9.794388	comment	4.0	21.0	1507506354	-8.937435
15566062	Oh my God. I wasted a year of my lif	"Oh my God. I wasted a year of my life on a COBOL project. It is easily the worst language I have ever used. 
There is a reason that COBOL is a linguistic dead-end! Functions? Sensible limited variable scope? A decent approach to handling whitespace so that com"	maxharris	10.14778	9.7936735	comment	4.0	14.0	1509084183	-8.952544
15566331	I have regualr talks with people who	"I have regualr talks with people who were using COBOL a while ago.
There are things were cobol is good :1/ COBOL run in closed environments. This allows these to be rock solid.
   (no such thing as a dependency nightmare). You don’t have such a thing
   as dif"	wiz21c	10.147871	9.794465	comment	4.0	11.0	1509088742	-8.911533
15566600	I have not used COBOL for 30 years b	I have not used COBOL for 30 years but the language deserves respect. The transition from assembler to COBOL was one of the biggest productivity improvements in the history of programming, comparable to the introduction of Java and VM-based programs in the 199	hodgesrm	10.147724	9.794699	comment	4.0	16.0	1509092681	-8.936211
15566755	> But how complex can these programs	> But how complex can these programs be? Surely anything written before 1992-ish can’t involve that much code just because of the limitation of the machines they were designed to run on. What makes it that expensive that no one wants to rewrite them in a moder	shakna	10.147784	9.793978	comment	4.0	15.0	1509094799	-8.926556
17334664	Hi, I worked on the C/C++ compiler f	Hi, I worked on the C/C++ compiler for zLinux, the COBOL compiler for zOS, and on the non-open-source version of Hercules.If you've got zOS and COBOL knowledge then Toronto is the place for you. IBM develops their zOS software in Toronto (well, Markham) mostly	CountHackulus	10.14783	9.791692	comment	4.0	10.5	1529274079	1.7757635
17341222	Unpopular answer: anything that's ab	Unpopular answer: anything that's about to become legacy. See COBOL programmers.	murph-almighty	10.147877	9.794504	comment	4.0	13.0	1529352083	-8.9635725
21289274	Have not dealt too much with COBOL b	Have not dealt too much with COBOL but learnt it a while ago. It was one of the easier languages to comprehend quickly. I thought it was well suited for input and data processing focused applications.I do remember thinking it's odd that a line has exactly 80 c	kerng	10.14791	9.793769	comment	4.0	17.5	1571382561	-8.9412155
21376114	A fully graphical calculator app in 	"A fully graphical calculator app in Rebol is just a few lines of code. The formatting looks pretty legible at the below link if you scroll down a bit.REBOL [title: ""Calculator""]
view layout [
    origin 0  space 0x0  across
    style btn btn 50x50 [append f/te"	7thaccount	10.156008	9.733919	comment	4.0	12.5	1572264266	-7.926338
39188895	We have been able to largely get rid	We have been able to largely get rid of COBOL. Why haven't we been able to do the same with Javascript? It's a very useful language given the amount of existing code and support, but very few people I know actually like it.In the 90s, vendors seriously investe	glimshe	10.148263	9.791153	comment	4.0	12.5	1706614588	-8.941924
39279896	Well you can run Hercules, the emula	Well you can run Hercules, the emulator.  But you will then discover that the mainframe 3270 terminal user interface experience is terrible.  A funny thing is this: there is a mainframe plug-in for Visual Studio Code.  The idea is you do your COBOL development	jhallenworld	10.147843	9.792429	comment	4.0	17.0	1707250453	-8.8498125
31906904	Banks in Sweden are making a big eff	Banks in Sweden are making a big effort of recruiting, training and offering a viable career path for COBOL developers. A bunch of central systems still run like clockwork on IBM mainframes, why replace them?https://sebgroup.com/career/who-are-you/graduates-an	brtkdotse	10.148211	9.792952	comment	4.0	11.0	1656420198	1.7294939
31907544	> COBOL devs are a specialized niche	> COBOL devs are a specialized niche these days and they get paid accordingly.In my experience the well paid COBOL devs are those with 20+ years of experience, often in one specific system, often bumped by being re-hired a bunch of times for the same position.	tapland	10.147785	9.794278	comment	4.0	15.5	1656423685	1.8131075
32405400	Java has reached the status of Cobol	Java has reached the status of Cobol - it is immortal because it is everywhere and has been around a long time.Because of that, there are a lot of Java devs.Our team works in Go, and so we get a few Java devs in once in a while as new positions open up.  The b	tomohawk	10.148437	9.790675	comment	4.0	10.5	1660084359	-8.894624
22120525	Also see COBOL on Cogs, http://www.c	Also see COBOL on Cogs, http://www.coboloncogs.org/INDEX.HTM	dx87	10.147683	9.795133	comment	4.0	13.5	1579718235	-8.89321
22213813	It is a lot like COBOL, but oddly wi	It is a lot like COBOL, but oddly with more punctuation (probably because of the lack of consistent use of whitespace in Chinese). I think it may be a fun way to practice my 漢字.	microcolonel	10.1476755	9.793517	comment	4.0	14.5	1580598018	-8.9851055
35756192	i know a system that runs cobol.but 	"i know a system that runs cobol.but there are like 4 or 5 other systems on top of it, some of them use XML, some html, some asp, some java, some vba, some c#.i dont really understand the concept of a ""x language job"". like jobs tend to need people to learn sys"	fatneckbeard	10.147833	9.793296	comment	4.0	11.5	1682796133	-8.926775
35801449	Could LLMs help here to translate be	Could LLMs help here to translate between programming languages? Same with COBOL. Is a coding assistant the way to get legacy systems updated -- sounds like a consulting niche.	dpflan	10.147837	9.793279	comment	4.0	11.0	1683116331	-8.927386
35802076	Oh, they found COBOLs lost brother ;	Oh, they found COBOLs lost brother ;)	dangling42	10.14756	9.793622	comment	4.0	12.5	1683120130	-8.917858
35918716	Several decades old centralised tech	Several decades old centralised technology batch processing ALL CAPS messages in COBOL with a transaction time measured in days or weeks, a 10-15% transaction failure rate, no finality and exorbitant costs?	detrites	10.14783	9.794205	comment	4.0	16.5	1683910045	-8.955179
24080144	REBOL was such a fun language to use	REBOL was such a fun language to use. I wish it was open sourced earlier, then it might have made a larger impact. RED is a spiritual successor that deserves a look as well: https://www.red-lang.org/	soapdog	10.155331	9.73427	comment	4.0	17.5	1596793400	-7.444116
20217806	Actually I'd be surprised if they're	Actually I'd be surprised if they're even paying market rate for these developers, regardless of how difficult or impossible it is to find them.  COBOL programmers still make about $70,000/year or so (https://www.glassdoor.com/Salaries/cobol-programmer-salary-	commandlinefan	10.147831	9.794232	comment	4.0	15.5	1560888362	1.6846226
20455178	I had a contract about 10 years ago 	I had a contract about 10 years ago for a major city's water department. The contract was to convert an internal application for customer billing, written in COBOL running on the mainframe to a web application backed by Oracle.When I started gathering requirem	0x445442	10.147763	9.795154	comment	4.0	12.0	1563322420	-8.957044
20894579	Although there is perceived demand, 	Although there is perceived demand, COBOL jobs pay very poorly.  Like $50K.Exception of course for consultants with a following, and customers that believe you have 'unicorn' skills.One advantage is the software stack is mature and not subject to fads and fash	bdavis__	10.14776	9.794355	comment	4.0	11.5	1567768050	1.738143
13611157	Honestly, I don't care whether I am 	Honestly, I don't care whether I am driven over by a Porsche Cayenne or a Willys MB.And while I have not worked in the banking sector myself, lots of my friends did - and it was not cobol. They are catching up and they all know that their mainframe sw is dated	jlg23	10.148027	9.793109	comment	4.0	10.5	1486675705	1.7195225
13909376	Ask HN: Is it worth becoming a COBOL	Ask HN: Is it worth becoming a COBOL engineer?	aktungmak	10.147855	9.794555	story	4.0	3.0	1489954711	1.8168095
14084098	"From the article ""Experienced COBOL "	"From the article ""Experienced COBOL programmers can earn more than $100 an hour""In Australia that's a lot, but my understanding is that it's common for American developers to be on way more than this..."	catmanjan	10.147936	9.792664	comment	4.0	14.5	1491873378	1.6960986
14084104	"""Experienced COBOL programmers can e"	"""Experienced COBOL programmers can earn more than $100 an hour when they get called in to patch up glitches, rewrite coding manuals or make new systems work with old.""Any contract-based engineer would charge that, or more, regardless of the language. Fortune 5"	kingnothing	10.147761	9.793866	comment	4.0	17.5	1491873447	1.7097481
14084081	The problem really isn't COBOL. COBO	The problem really isn't COBOL. COBOL is not a difficult language. It reads almost like English sentences. Any competent programmer would not be challenged by COBOL. The problem is all the glue. JCL, SNA, CICS, ISM, ISPF, etc.It's like the difference between J	ams6110	10.147808	9.794355	comment	4.0	32.5	1491873234	-8.999548
14085197	Best story I've heard is one of the 	Best story I've heard is one of the old programmers commenting his COBOL code in latin. It was a different time...	UweSchmidt	10.147864	9.794336	comment	4.0	11.5	1491890132	-8.947441
14482483	Cobol's legacy lives as PL/SQL, ABAP	"Cobol's legacy lives as PL/SQL, ABAP, and other enterprise data handling languages. While everybody is quick to point that this is not ""real programming"", they required astonishing amounts of engineering efforts to make things work.I would love to see a decent"	atemerev	10.1475935	9.794709	comment	4.0	11.5	1496597185	-8.9423895
31229603	There is absolutely demand. I've bee	There is absolutely demand. I've been doing cobol for four years and have banks and insurance companies asking me to come in for an interview all the time.But no remote teams, no companies ready to offer any support for relocation and not a pay making a move w	tapland	10.147826	9.793708	comment	4.0	14.0	1651446306	1.6803995
31262583	Yes. Some banks still run COBOL behi	Yes. Some banks still run COBOL behind the scenes here.	rglover	10.1480665	9.793071	comment	4.0	12.5	1651681373	-8.98961
28824699	This COBOL shortage myth has been ar	This COBOL shortage myth has been around since I was a kid.  It wasn't true then, and isn't now.The entire problem is that they don't pay well for what is supposedly a rare resource.  And nobody wants to learn a dead language for peanuts.Offer 500k/yr, and me 	silisili	10.147675	9.794031	comment	4.0	11.0	1633926899	1.7305955
28824357	Not if they can’t find anyone willin	Not if they can’t find anyone willing to learn COBOL.There’s huge demand for developers on modern systems. Seriously, how much are you going to pay a developer to do mainframe COBOL - and is that developer going to produce commensurate value, really able to ho	ctdonath	10.147889	9.793591	comment	4.0	17.0	1633923121	1.6842722
28981296	The cost of running government on CO	The cost of running government on COBOL (h/t Cowen)	chkaloon	10.147572	9.793904	story	4.0	18.0	1635105077	-8.917084
34408534	Who do you expect to use this?  As I	Who do you expect to use this?  As I understand it most COBOL use is on legacy mainframes that definitely aren't going to also be running .NET anytime soon.  When a company is hiring a COBOL programmer they aren't hiring someone to just sling code--anyone can 	qbasic_forever	10.147927	9.794182	comment	4.0	15.0	1673923125	-8.938768
34946743	That's interesting. Must be hard to 	That's interesting. Must be hard to hire for nowadays. Then again, my friend says at least one government is still using COBOL!	andai	10.147568	9.792045	comment	4.0	12.0	1677428830	-8.916559
35011486	I have never written cobol, but I wo	I have never written cobol, but I wonder if there is a market for a COBOL transpiler to something like C#/Java/typescript, or even python would be a viable business?	mattnewton	10.147928	9.793307	comment	4.0	11.5	1677860158	-8.934211
16964548	Is it really better if we replace x 	Is it really better if we replace x million lines of COBOL with x million lines of java or c++?  What is the financial language of the future that is easy to write and reduces errors?	kristianp	10.147989	9.793356	comment	5.0	16.0	1525147948	-9.049304
16964612	Anyone have thoughts on how to go ab	Anyone have thoughts on how to go about learning mainframe programming and COBOL? Honestly seems like a useful skill given its existence everywhere but I don't think very many engineers (myself included) know where to start in learning it.	mcafeeryan92	10.147628	9.794723	comment	5.0	16.0	1525149290	-8.9438505
38509198	How hard is it to actually learn COB	How hard is it to actually learn COBOL? It seems like a fairly simple language to pick up, but maybe the idiomatic COBOL used in these legacy systems is particularly nasty for some reason.	matthewdgreen	10.147938	9.79255	comment	5.0	30.5	1701626628	-8.931509
34009801	I have been deeply fascinated by COB	"I have been deeply fascinated by COBOL ever since 1994. In 1994 I was looking at where to go to college, and the community college near the town I grew up had two ""computer"" associates programs. One was a program focused on personal computers, and one was a pr"	earino	10.147806	9.792672	comment	5.0	15.0	1671162287	1.7484539
28142227	There are plenty of ways to port out	There are plenty of ways to port out of COBOL, none will work.I once interviewed for a COBOL position.  It was a typical large financial institution.  It was a lead position that wanted a migration plan out and then would lead to a team for me.  I have a lot o	cdumler	10.147852	9.793036	comment	5.0	21.0	1628691270	-8.95944
12902879	"I remember showing my ""systems analy"	"I remember showing my ""systems analyst"" brother-in-law my second year university schedule when I was planning which courses I would take that fall.""You don't have any Cobol, PL/1, OS360 Assembly Language or APL on here"", he observed.""I am going to focus on C, "	t1m	10.147821	9.793586	comment	5.0	21.0	1478631107	-8.916028
13012531	It's interesting how often we see th	It's interesting how often we see these articles (and associated discussions) saying that programming is harder than it should be, and that if only we had a better language, it would be much easier.In my experience, choice of language makes only a superficial 	taneq	10.147717	9.793915	comment	5.0	17.0	1479802460	-8.921704
13509384	C and C++ are dead like COBOL in 201	C and C++ are dead like COBOL in 2017	k4rtik	10.147798	9.794319	story	5.0	7.0	1485638035	-8.907684
27835426	REBOL was so far ahead of its time .	REBOL was so far ahead of its time ...	Bluestein	10.149231	9.779493	comment	5.0	17.5	1626282411	-8.74704
12091175	I think it's the bad kind of impress	I think it's the bad kind of impressive, one where ATMs still run COBOL.	mherkender	10.14785	9.794456	comment	5.0	16.5	1468460965	-8.923393
12097216	It's not that COBOL is particularly 	It's not that COBOL is particularly good or bad.  It's that COBOL-era database technology is painfully-obsolete.  Flat files, ISAM, and IMS are all pre-SQL, and old shops are likely to still be running some of that stuff. DB2 isn't too bad; it speaks SQL and r	Animats	10.147813	9.794248	comment	5.0	18.0	1468530898	2.8062866
22782427	I used to work on mainframe COBOL du	I used to work on mainframe COBOL during the Y2K times. While the language is easy to pick up and the OS specific things are not too hard, the style of programming can lead to issues. Typically, shared data structures are often stored in separate files called 	vaidhy	10.147937	9.794025	comment	5.0	24.0	1586043646	-8.9363785
22837891	Someone invent a COBOL to Python con	Someone invent a COBOL to Python converter to get rid of these old dinosaurs IBM Mainframes.	cable2600	10.148048	9.792982	comment	5.0	12.5	1586557158	-8.9224825
22840770	>> I don't want to sound condescendi	>> I don't want to sound condescending but why can't these systems be rewritten in a modern language?Cobol was a modern language 50 years ago. Python will be an ancient language 50 years from now. What do we do? Keep rewriting everything every 50 years?And tho	YeGoblynQueenne	10.147938	9.794494	comment	5.0	14.0	1586599062	-8.913078
22841333	The IRS, treasury, and others locall	The IRS, treasury, and others locally are looking for COBOL programmers. I can explain why they're struggling to find any just by looking at the pay scale: $30,113 - $86,021 (GS-5 through GS-12, and most won't get the top end of the GS-12 scale). The $30K GS-5	Someone1234	10.147866	9.794139	comment	5.0	14.0	1586608542	1.6768978
