id	x	y	type	relevance	size	year	umap1d	hovertext	url	author
13558922	10.976853	-8.129553	story	5.0	67.0	1486117931	-3.2104206	Rust required to build Gecko	https://groups.google.com/d/msg/mozilla.dev.platform/Gzwh1IbxvHE/qs49_VAdAwAJ	jandem
13559066	11.014359	-8.03721	comment	5.0	18.0	1486120892	-3.243393	IMO, Rust is the most promising technology of the decade.We had C and C++ for a long time, and never managed to replace them. We created higher level languages (Haskell, Go, Java) as a mitigation but ...		sametmax
13583917	10.987695	-8.105082	comment	5.0	19.0	1486415092	-3.2423985	"Rust needs a Rust book not written by the Rust developers. ""Rust for Dummies"", if you will."		Animats
27513493	10.97479	-8.002118	comment	5.0	16.5	1623754632	-3.1902595	Obligatory Rust comment: would it help reduce bugs if we replaced loads of janky C code with janky rust code?		ClumsyPilot
27526634	11.070104	-7.9853477	comment	5.0	15.0	1623836544	-3.2708516	There must be something else, because most of what Rust brings to the table is what functional languages have been providing for ages, just with rebranded names.		daptaq
27546024	10.961176	-7.987566	story	5.0	29.0	1623976305	6.8675413	Rewriting the GNU Coreutils in Rust	https://lwn.net/Articles/857599/	signa11
27548866	10.916437	-8.064203	comment	5.0	12.5	1624010217	-3.3107898	I know a good number of people who will move away from Linux after Rust get in the kernel.		andy_threos_io
27553289	10.917429	-8.059403	comment	5.0	14.0	1624040686	-3.2605429	"Why not have all this Rust energy focused on a new kernel (not a toy/experiment), a kernel architect ed not evolved. 
You would get better results and if you need Linux compatibility add support for i..."		simion314
27577920	10.97804	-7.9988337	comment	5.0	14.0	1624271953	-3.243993	> I had a Rust job for around half a year, where people build web servers and came from a C and C++ backgroundI don't think this is system programming rather network programming.You should try embedde...		sometimesshit
27746671	10.977542	-8.070613	comment	5.0	14.5	1625569269	-3.2061064	"Anyone feel like we get a ""Linux Rust support"" post every month lately?Feels a bit like the ""new more efficient battery technology"" recurring post.edit: to precise it's not that I'm not supportive of ..."		staz
27861666	11.017978	-8.019264	comment	5.0	13.0	1626472359	-3.2936487	"Are they switching mid project and doing the ""Rewrite It in Rust"" meme? Or only for new project?If for new projects what type of project that is not some kernel, browser or some low level library  is ..."		simion314
27939814	10.953162	-8.041448	comment	5.0	26.0	1627124188	-3.185636	The FUD around Rusting the kernel reminds me of similar sentiments surrounding autonomous vehicles. Better != perfect; it's an evolutionary step. Even if there are unintended negative consequences of Rust code, if they are less frequent than the rate we deal with bugs today, then it's worth using.		ayane_m
27957660	10.998462	-8.114783	comment	5.0	12.5	1627294224	-3.1708455	I have to agree with the first comment: Speaking as someone who was a tech trainer and writer of course materials, tutorial, etc. for a couple of decades, if ``carge-edit`` is not core to what you're ...		mikro2nd
12005961	10.9653015	-8.049734	comment	5.0	14.5	1467248710	-3.1964316	Let's keep the hate off of HN. We get that you are salty. We're all salty. Give us the benefit of not being so predictable about it. Spread hate on a thread about C++ pointers. Ask us why we don't use Rust. Literally anything.		coderdude
12066130	10.9905405	-8.133094	comment	5.0	20.5	1468168360	-3.2730243	I really hope nobody mistakes the sexy title of this book as a reason to learn unsafe rust. If it can be done without this advanced feature, it probably should.		rattray
12081371	11.339714	-8.048731	comment	5.0	25.0	1468348780	10.205206	I'm sorry to say but you must be delusional. Can you list the these `aggressive` breaking changes? There were only 7 releases since go1 and I fail to find any breaking change in the language specifica...		themihai
12155000	11.01697	-8.064528	story	5.0	111.0	1469395759	-3.2288022	Rust Performance: A story featuring perf and flamegraph on Linux	http://blog.adamperry.me/rust/2016/07/24/profiling-rust-perf-flamegraph/?	adamnemecek
12183095	11.024226	-8.021553	story	5.0	99.0	1469739405	-3.1624694	Coq to Rust Program Extraction	https://github.com/pirapira/coq2rust	kushti
12315671	11.007171	-8.111952	comment	5.0	16.0	1471548875	-3.1843705	Author here!You can check out the new book here: http://rust-lang.github.io/book/We're working on the new book because the old book isn't as good as it could be, but that doesn't mean it's bad: a lot ...		steveklabnik
12325123	11.02956	-7.9803567	story	5.0	126.0	1471665507	-3.2253094	Rust: Systems Programming for Everyone	https://www.infoq.com/presentations/rust	adamnemecek
12474801	10.990314	-8.070453	comment	5.0	17.0	1473618568	-3.2151072	A lot of problems in Rust seem to involve replacing (smart) pointers with handles. Sometimes you really do want to do that, but it's bad if it's a necessary kludge.Like someone else said recently, it's a problem if you can't reasonably teach a basic computer science course in Rust.		TillE
12489285	11.046802	-8.055411	story	5.0	52.0	1473781441	7.525846	This Year in Conrod – An Update from the Rust GUI Library	http://blog.piston.rs/2016/09/13/this-year-in-conrod/	mitchmindtree
28609517	10.960313	-8.0953045	comment	5.0	22.0	1632256084	-3.2579627	"""How we avoided rewriting in Rust"" feels like clickbait given that the answer is ""our problems were algorithmic, not language-specific"""		brundolf
28639821	10.998546	-8.092991	comment	5.0	20.0	1632471376	-3.2161918	Why must every new rust project be reported here? Are there any other languages for which every new thing is being reported as if it were some major milestone?Is it true that this happens because Amazon is astroturfing rust like mad (as suggested on this website the other day)?		agent327
22316676	11.129173	-8.062352	comment	5.0	15.0	1581590159	7.5786495	I wouldn't call Actix the most mature, but it's definitely the one that gets talked about the most.I built a fairly complex backend directly on top of Hyper[0] (it doesn't even involve that much glue,...		_-___________-_
22316702	11.066504	-8.01031	comment	5.0	15.0	1581590521	7.550371	This is from memory, I would welcome any corrections.Actix was written with a lot of unsafe code[0], which some people considered unnecessary and potentially dangerous in a web framework. In some case...		_-___________-_
22336284	11.34425	-7.989343	comment	5.0	24.5	1581785233	10.122589	Author here. I think the Rust vs. Go question is interesting. I actually originally wrote esbuild in Rust and Go, and Go was the clear winner.The parser written in Go was both faster to compile and fa...		constexpr
22340257	11.325678	-8.018986	comment	5.0	19.5	1581836658	10.175373	AFAIK the only unique feature of Rust is a borrow checker, right? (compared to other feature-full languages, i.e. not Go)Regarding the main example of author, it's great that the progressive side of Go team won, so generics are coming in Go 2.		zerr
22409971	10.94664	-8.049687	comment	5.0	24.5	1582591944	-3.2053914	Pretty much every con in Rust is some variation of (we | others) don't use Rust enough. Interesting to see!Would have assumed the Kernel would be where Rust truly shines, but that's where it's blocked, which is... interesting!		sk0g
22409987	11.553765	-8.006	comment	5.0	20.0	1582592069	10.242717	The big difference seems to be:Con: The Fuchsia Platform Source Tree has had negative implementation experience using Go.i.e. they tried it, because they're from Google and they basically had to, and ...		ohazi
22444306	10.98441	-8.140082	comment	5.0	13.0	1582910046	-3.1633208	"Author here - I apologize for pulling Rust into this, but for the life of me couldn't find any comparable language that solves those problems ""the right way"".I tried really hard. I knew a lot of peopl..."		fasterthanlime
22517794	10.975558	-8.096732	comment	5.0	13.5	1583672380	-3.2402222	This is not about a rewrite of libhydrogen in Rust.		jedisct1
22558318	10.986811	-7.9815865	comment	5.0	35.0	1584029675	-3.3135936	Better line numbers is huge. Actually huge for people leaning rust. In a pretty big way it's like the difference between Java where you get a stack trace (where you mostly care about the live number a...		computerphage
22609036	11.014526	-7.983601	comment	5.0	27.0	1584472710	-3.292985	As much as I use Rust personally and for some of my own pet projects, for serious HTTP services and introducing it into a new developer team, I'm afraid that isn't feasible for my requirements. I'm pu...		rvz
22643166	10.965038	-8.005792	comment	5.0	19.0	1584750680	-3.1762578	This is a 'mindshare' game. D had its chance, now Rust has its chance. Would have been cool though if D had caught on more back in the day. Re-invention seems to be impossible to avoid in the software world.		jacquesm
22843192	11.025287	-8.016248	comment	5.0	15.0	1586629534	-3.2828283	>> but it only really matters if you explicitly upgrade to 2018This is OK for programmers who already know Rust. But for new programmers coming to the language, it presents a very difficult challenge....		pritambarhate
22904244	10.998408	-8.005982	comment	5.0	15.5	1587169158	-3.222191	Ask HN: Do you recommend learning C++ first then Rust? My logic is that learning C++ and navigating its pitfalls would lead to a better understand of Rust and the underlying reason behind certain design decisions.		ridhwaan
22997380	10.997281	-8.007089	comment	5.0	16.5	1588005239	-3.223778	"I'm not a compiler writer myself, but my impression is that designing a compiler ""the traditional way"" and designing one ""the IDE way"" look really different. Most people who learned to write compilers..."		oconnor663
23032159	11.031306	-8.081625	comment	5.0	20.0	1588261750	-3.3071365	What are the chances of Rust or another language coming to the fore for cloud infra?		DevopsQuestions
23059032	11.311356	-7.995533	comment	5.0	25.0	1588514444	10.0985155	"Note that Rust and Go programs differ in a seemingly insignificant, but actually important detail.Rust does this    next_dist = std::cmp::min(
        dist_if_substitute,
        std::cmp::min(dist_if..."		matklad
23060699	10.985332	-8.136002	story	5.0	4.0	1588528744	-3.2057736	Ask HN: Why are all these Rust related posts showing up on HN?		itsmefaz
23159660	10.998708	-8.044567	comment	5.0	14.0	1589316878	-3.1929562	"Is there a significant limitation in using Rust on the stable branch? Every interesting tutorial, book, or tool I find seems to use nightly. I know it shouldn't be a big deal but it ""feels dirty"" and perhaps I should just view nightly as any other language's ""stable""."		sl1ck731
23170832	11.113389	-8.007557	comment	5.0	20.5	1589398439	9.991672	"Notably:- No Rust/Go rewrite- GC not disabled- Didn't apply the latest research on k/v storageJokes aside, this is the fun parts of hosted software and glad to hear the ""things don't have to be so hard"" side of things. Hope it continues working out!"		parhamn
23191380	11.004032	-8.0600815	comment	5.0	15.0	1589545937	-3.3028357	Rust mods have to stop listening to the elite language intelligentsia.Successful eco systems are pragmatic and idiomatically straightforward.Everything & the kitchen sink in a language is not a recipe...		easytiger
23191521	11.036472	-8.017279	comment	5.0	15.5	1589546879	-3.22901	Is now the time to start learning rust? In your estimation, are there going to be lots of job opportunities for people who have 15 years experience with rust?I primarily live in the .Net world, but ru...		Multicomp
23257763	11.012105	-8.064336	comment	5.0	14.5	1590065471	-3.1829453	If you haven’t yet used rust-analyzer, immediately go and try it out. The developer experience is much better than RLS, particularly for larger projects.One question I’ve had for some time: what exact...		sjroot
23337606	10.940352	-8.03408	comment	5.0	16.0	1590675780	-3.2980216	You have no proof that writing a Linux-like kernel in Rust would result in fewer bugs, or even that it is feasible at all (what with writing even linked lists being difficult).		nsajko
26511350	11.000664	-8.047338	comment	5.0	40.0	1616145188	-3.22144	As others have written, there's basically no connection between Rust's six week release cycle & the rate of actual change to Rust. If Rust switched to a 12 week release cycle, all that would change is...		withoutboats2
26511389	11.318775	-8.023952	comment	5.0	16.5	1616145669	10.172426	For me the biggest problem with Rust is its so darn complex. I recently had to modernise a few ancient CLI tools and knew it was a case of Rust vs Go.I knew neither language, but try as I might I just...		traceroute66
26511872	11.000343	-7.9912314	comment	5.0	15.5	1616150741	-3.2227702	over-engineering in hope that the language does everything for everybody is my biggest worry and why my excitement to consider it as something I want to work with drops with every year. Considering ho...		DyslexicAtheist
26512153	11.017656	-8.029587	comment	5.0	12.5	1616154003	-3.2714026	Hi author here,This is just a report of the voices of the people I'm converting to Rust because they are never heard.The compound effect of small and fast changes is complexity.Uncontrolled complexity...		sylvain_kerkour
26511948	10.993925	-8.004896	comment	5.0	16.5	1616151806	-3.2861936	> Upgrading the toolchain practically never requires any changes to code.if you work on safety/security critical systems upgrading the toolchain is considered like changing the tires on a moving vehic...		DyslexicAtheist
26540979	10.969309	-8.153184	comment	5.0	14.5	1616422158	-3.2089462	Does rust have this issue? Anyone with experience?		nullifidian
26716283	10.770004	-8.203572	comment	5.0	15.5	1617737271	-11.27528	Contributor here: there's so much cool stuff in this release.I was personally most involved in improving the docs, the reliable change detection work (you can now detect changes no matter when your sy...		alice-i-cecile
26727371	11.007026	-8.053176	comment	5.0	20.5	1617813657	-3.2865126	"I have a suggestion for HN admins. There could be a thread about Rust superiority pinned to the top of HN where the Rust ""brigade"" could promote their chosen tool supremacy all day long and in return ..."		nec4b
26735470	10.993722	-7.99185	story	5.0	95.0	1617860822	-3.2473452	Cryptographically verifiable code review system for cargo Rust package manager	https://github.com/crev-dev/cargo-crev	pabs3
26794393	10.97857	-7.985338	comment	5.0	12.5	1618330083	-3.2690578	At this point Rust is not the prmary ecosystem for anything.The important and exciting new things are written in C++, not Rust. Rust has no advantages over C++ once you know C++.		otabdeveloper4
26835460	10.942299	-8.036102	comment	5.0	28.0	1618588404	-3.2537062	Speaking for myself and not the person you replied to- It would make me 10x more likely to work on the kernel, just because I enjoy programming in rust more than I enjoy programming in C. (At least gi...		gpm
26852242	10.982647	-8.065148	comment	5.0	17.0	1618752452	-3.2561376	Microsoft promoting rust, never thought I’d live to see the day.Not clear why one would choose this over the official rust documentation and tutorials.Oh and also - it’s a trap. Microsoft are not friends of free software.		loloquwowndueo
26862856	10.968695	-8.078536	story	5.0	39.0	1618840941	-3.1846473	Microsoft Previews Rust for Windows	https://www.tectalk.co/microsoft-previews-rust-for-windows/	thunderbong
26903914	11.420219	-8.027704	comment	5.0	17.0	1619105635	10.210765	I think you have this backwards. Go is explicitly optimized for software engineering; in fact, it's the only language I'm aware of that makes large-scale engineering its north star. Here's Rob Pike di...		nemo1618
26983452	10.97811	-8.036869	comment	5.0	16.5	1619714754	-3.2775314	"Rust should include in their license: ""The Software/Language shall be used for Good, not Evil""https://en.wikipedia.org/wiki/Douglas_Crockford#%22Good,_not..."		amelius
26990084	11.012263	-7.983078	comment	5.0	15.0	1619760485	-3.254058	Disclaimer: Embedded dev here, working with 8, 16 and 32 Bit microcontrollers. Almost exclusively C.In Europe (and especially in Germany where I live) I don't see myself writing Rust in my day job for...		sai_c
27000436	10.98468	-8.091957	story	5.0	126.0	1619822575	-3.1613414	Making Generative Art with Rust	https://blog.abor.dev/p/making-generative-art-with-rust	habitue
27022945	10.975174	-8.145957	comment	5.0	13.5	1620032545	-3.141134	"The OP mentions in passing that Brendan Eich ""was solidly on team Rust"" prior to leaving Mozilla, but adds no further details to that intriguing statement. Wouldn't that make Eich the Most Unrecognized Contributor? I don't think his name would be on any commit repo, after all."		zozbot234
27031583	10.982421	-8.093033	story	5.0	38.0	1620080523	-3.202869	The Great Rewriting in Rust	https://deprogrammaticaipsum.com/the-great-rewriting-in-rust/	ingve
27050322	11.408875	-7.9830146	comment	5.0	21.5	1620225102	10.133149	Rust iterators are beautiful. If you've ever implemented C++ iterators, you'll be pleasantly surprised at how elegant it is in Rust by comparison (actually you could replace iterators with about any l...		eloff
27085301	10.993287	-8.103752	comment	5.0	15.0	1620465111	-3.268525	Why is microsoft posting this / working on this rather than the rust project itself?		tbrock
27121011	10.956612	-8.078076	story	5.0	92.0	1620754731	-10.268751	Integrating Rust into the Android Open Source Project	https://security.googleblog.com/2021/05/integrating-rust-into-android-open.html	theafh
27120019	10.982522	-8.108845	comment	5.0	19.5	1620750045	-3.1676126	Since you said „master“ you are probably already somewhat proficient, but if not, I can not recommend enough to just try Rust out for some project one day. It literally took me 2 days from writing my ...		axiosgunnar
27281845	11.000856	-8.064087	comment	5.0	13.0	1621972818	0.70763266	The Rust hype machine continues unabated. Silicon Valley is just as vulnerable to tech hype as the general public is to political hype. Indeed, Silicon Valley thrives on and depends on hype of all kin...		chmaynard
27284013	10.961961	-8.189786	comment	5.0	18.0	1621984547	-3.2300858	That doesn't smell right.  I've got 15 year old knives that have never once shown signs of rust.  A pair of old scissors left in the rain rusted in under a day.  That puts the factor to closer to >10000 than 10 or 100...		peteradio
27313347	11.037191	-8.016944	comment	5.0	15.0	1622194595	-3.2631707	I know people here are a bit touchy about Rust, and writing everything in Rust. But here is one advantage I have found with Rust programs: The installation just works. Cargo, as a package manager, is ...		csomar
27316456	10.988246	-7.993404	comment	5.0	15.5	1622215332	-3.2167354	I mostly agree with this sentiment but I think it's not that necessary to point out. Yes, some of these are abandonware but many are written by the same set of strong Rust programmers. I think you'd b...		singhrac
27344366	11.016302	-8.007898	comment	5.0	12.5	1622471145	-3.2605467	> A third implementation of the rust compiler.What is the second rust compiler?		sampo
27405924	11.059918	-8.03558	comment	5.0	23.5	1622907510	-3.2314398	This looks really great.£35 Individual, £100 Team, £600 Company, seems like fair/straightforward pricing for a team that has members who know some Rust but haven't built out a production API with it y...		rattray
27406409	11.081417	-8.0015	comment	5.0	12.5	1622910623	-3.2311218	I'm pretty interested in learning rust to build APIs, but I'm already productive with Java and Node/Typescript and wonder if it would be worth it, aside from being interesting.Anyone up for giving me an elevator pitch that it would be? Or, also interested in confirmation that it wouldn't!		davnicwil
14772699	11.10713	-7.9866743	comment	5.0	15.0	1500062345	7.4749727	I actually really love the restrictions on fairings. I'm working on a project right now that uses Node.js with Express, and there are all of these pieces of middleware that won't compose at all, and I...		jamescostian
14813624	10.977051	-8.145803	story	5.0	318.0	1500566510	-3.1996374	Announcing Rust 1.19	https://blog.rust-lang.org/2017/07/20/Rust-1.19.html	steveklabnik
14855295	11.017605	-8.047925	story	5.0	54.0	1501068942	3.5104434	Show HN: Juggernaut – Experimental Neural Network in Rust	http://juggernaut.rs/	afshinmeh
15048766	11.046358	-7.9956627	comment	5.0	20.5	1503082298	-3.2076478	I have been using this for a few weeks, as a newcomer to Rust. Although it has some issues, I would not try to develop Rust code without it. It is incredibly useful and works well enough for day-to-da...		modeless
15178189	10.950142	-8.138698	comment	5.0	14.0	1504638480	-3.1698592	Not from the docs, but a pretty clear community example is that tickets for RustFest are more expensive for people who don’t belong to an underrepresented group.Edit: replaced “minority” with “underre...		Ruud-v-A
15266216	11.504461	-7.9989767	comment	5.0	23.5	1505589670	10.250727	"> Both languages seem to be competing for the same user base and they both seem to be ""systems programming"" languages, so there must be a winner, right?No, Go isn't a systems programming language beca..."		bad_user
15266229	11.061522	-8.002834	comment	5.0	17.5	1505589883	-3.2759573	What are some program that Rust is not always a reasonable choice to write in? Frankly, there may be some areas where another language is slightly easier to program in than Rust, but I see the value i...		webkike
15270583	10.950834	-8.0180435	comment	5.0	17.0	1505668143	-8.927205	Anyone know what would be required to get Rust running on the ESP32 boards? I picked up a couple for $6 each (Wemos LoLin32), and it's an impressive board for the price. Wifi and bluetooth built in.I ...		wlesieutre
15345898	10.9881935	-8.087161	comment	5.0	40.0	1506501369	-3.1426713	"I can't wait until Rust is no longer be perceived as hipster trendy choice.It's a very solid language in the no-GC niche and shouldn't need a blog post from every project that uses it.Does it have to be 30 years old before it's not ""new"" and weird?"		pornel
15346557	11.002882	-8.049308	comment	5.0	25.0	1506510221	-3.2827191	Is Rust an officially sanctioned language at Google?		indy
15415598	10.978611	-8.118204	comment	5.0	14.5	1507283998	-3.2075448	Another rust proponent lecturing the world on how they should rewrite everything in rust.  yawn		petiepooo
15476951	11.022139	-8.064261	story	5.0	120.0	1508072942	-3.2600102	Calamine: Excel file reader, written in Rust	https://github.com/tafia/calamine	TAForObvReasons
15527413	11.099721	-7.99195	story	5.0	182.0	1508688311	7.4195285	Rust to WebAssembly Made Easier	https://lord.io/blog/2017/wargo/#	adamnemecek
28759036	11.002208	-8.0143175	comment	5.0	16.0	1633440118	-10.176361	"This is seriously cool, and I would use it frequently... if only there was a rust compiler in my computer.Since it is a somewhat ""thin"" wrapper around curl, are there deep reasons for it to be written..."		enriquto
28826746	10.978211	-8.115791	comment	5.0	13.5	1633948174	-3.245785	Not the OP, but here's an explanation anyway: the Rust community is full of superficially kind and polite language, enforced ruthlessly, that masks a high level of politics, intrigue, and backstabbing...		throwaway432242
28830470	10.932921	-8.030895	comment	5.0	48.5	1633971845	-3.2435987	I don't want rust in the kernel. As a small time developer making a hardware product, the investment to understand the kernel and how to build drivers is already huge. I have no interest in learning rust, and it will make it harder for people with limited resources to use linux in their projects.		b20000
28858909	10.978667	-8.080633	story	5.0	25.0	1634168715	-3.1746743	So you want to live-reload Rust (2020)	https://fasterthanli.me/articles/so-you-want-to-live-reload-rust	sea6ear
28927331	10.969098	-8.032138	comment	5.0	15.0	1634710310	-3.2031167	The question is how to enable all this in Rust... Right now there's no simple way to just tell Rust to be fast & loose with floats.		andraz
28986377	10.94093	-8.021309	comment	5.0	16.5	1635159462	-3.3181312	A star has been born. A Linux alternative needs to be compatible with Linux binaries and also support modern architectures.If you want Linux to survive, it needs to be re-written from scratch, optimis...		rvz
28986427	10.989272	-8.053839	comment	5.0	16.0	1635160090	-3.1746526	For each piece of software, there just be a version in Rust, and that version must advertise it's rustiness		gabrielhidasy
29010327	11.005347	-8.066963	story	5.0	127.0	1635318015	-3.2888787	My ideal Rust workflow	https://fasterthanli.me/articles/my-ideal-rust-workflow	ingve
29016476	11.025151	-8.100925	comment	5.0	12.5	1635356427	-3.0918512	Oh that's neat, thanks. Given you also use the rust tools, where do you find yourself reaching for the g* tools?		claytonjy
29161633	10.976585	-8.108422	story	5.0	168.0	1636465627	-3.2432935	Arm Joins the Rust Foundation	https://www.eenewseurope.com/news/arm-joins-rust-foundation	fork-bomber
29192291	11.071946	-8.002139	comment	5.0	13.5	1636660181	7.5877337	Author here. A few other Rust projects to note that I didn't mention in the original post I've since found:- Boa (JS engine in Rust) – https://github.com/boa-dev/boa- RSLint (JS/TS linter in Rust) – h...		leerob
29237142	10.965227	-8.11601	story	5.0	72.0	1637039872	-3.2272186	Alloy 6 First Impressions	https://buttondown.email/hillelwayne/archive/alloy-6-first-impressions/	azhenley
29266250	10.998937	-8.002445	comment	5.0	18.0	1637248167	-3.2626543	How do rust crates compare with something like maven or npm? It looks like some issues for example Typosquatting can be done in all of these dependency managers.		cntlzw
