id	x	y	type	relevance	size	year	umap1d	hovertext	url	author
36676222	10.877121	-8.041427	comment	7.0	18.5	1689047550	-3.4651072	Why didn't Ada take off and why did Rust? Doesn't Ada offer everything Rust does and decades earlier?		Solvency
36874856	10.955322	-8.156061	comment	7.0	27.0	1690362159	-3.1902976	Yikes!https://gavinhoward.com/2023/04/rust-is-dead-to-me/> Rust the language is dead to me.> why?> Because, quite literally, the Rust Foundation wants to make people like me unwelcome in any Rust even...		pcthrowaway
36960199	11.032849	-8.027871	comment	7.0	19.0	1690914263	6.687308	"I do want to make this as easy as possible. As part of that effort I am experimenting[1] with making filing an ICE report be as easy as ""open ticket and attach this file"". We do require a GitHub login..."		estebank
37051547	11.171733	-8.038898	comment	7.0	20.0	1691512042	7.541981	Rust for web dev instead of Go? I want to believe. What’s the killer app?		jahewson
37244287	11.081648	-8.066293	comment	7.0	22.5	1692843182	-3.217754	Why would someone use this over much more maintainable and performant backends in Go or Rust?		guideamigo_com
37259786	11.031904	-8.023375	story	7.0	93.0	1692956347	-3.275649	Rust Malware Staged on Crates.io	https://blog.phylum.io/rust-malware-staged-on-crates-io/	inferiorhuman
24882026	10.971152	-8.020546	story	7.0	135.0	1603574231	-3.2612302	Three open source Sonos projects: efficient embedded development in Rust	https://tech-blog.sonos.com/posts/three-open-source-sonos-projects-in-rust/	lukastyrychtr
24980049	10.981345	-8.096857	comment	7.0	23.5	1604414798	-3.2353008	"Am I the only one who feels _less_ inclined to use a program if they use 'written in rust' as a selling point?I mean, I very rarely see non-rust projects say ""Written in X!"" as a selling point for the..."		grep_name
25037438	10.980204	-8.034823	comment	7.0	26.5	1604944300	-3.271364	Let me tell you that most C++ game dev never heard of Rust, so imagine how long it's going to take for Rust to be something usable in that domain?Right now in the real world of AAA games it is nowhere...		Thaxll
25200859	10.9999075	-8.070067	comment	7.0	66.5	1606240001	-3.2242508	Friends of mine that are contract programmers have been ramping on Rust for the past 2-3 years claiming the number of requests for it has been increasing exponentially. I installed it two weeks ago an...		SoSoRoCoCo
25264521	10.97691	-7.99194	comment	7.0	23.0	1606825009	-3.1890526	"I'm disappointed.
In C I can get a 1k Hello Word binary simply be writing    int main(void) {
        puts(""Hello World!"");
        return 0;
    }

The Rust version is a mess [0][0] https://github.com/mcountryman/min-sized-rust-windows/blob/m..."		pantalaimon
25314170	11.012531	-8.073415	story	7.0	105.0	1607172760	-3.1528685	Show HN: I Wrote a Book on Data Analysis with Rust Notebooks	https://datacrayon.com/shop/product/data-analysis-with-rust-notebooks/	DataCrayon
25435225	11.012582	-7.993824	comment	7.0	26.0	1608066193	-3.3098052	Mandatory mention of of ring [1], one of the goto crypto libraries for Rust.It is also has a focus on hard to misuse API design and uses some BoringSSL primitives as well, while notably not depending ...		the_duke
25440741	11.029998	-8.010939	story	7.0	98.0	1608112411	-3.2113547	Oso – open-source policy engine for authorization in Rust	https://github.com/osohq/oso	dragonsh
38905160	11.008596	-8.059266	comment	7.0	21.0	1704661729	-3.212661	i would be interested to see what proportion of rust projects put “written in rust” in the project description vs other languages		BaculumMeumEst
38987073	11.064966	-8.019213	comment	7.0	23.0	1705202043	-3.2543128	Meanwhile Rust is noncompelling due to its syntax. It made a bunch of weird design choices (like putting class methods in separate `impl` blocks) that have ruined my chances of trying to use it for any personal projects.		LorenDB
32606057	10.976599	-8.047395	comment	7.0	38.5	1661514160	-3.1264117	I'm looking forward to Rust's adoption in popular game development engines. There's https://bevyengine.org/ in the meanwhile		agluszak
32697047	10.978212	-8.112243	comment	7.0	21.0	1662162720	-3.2252595	It seems the Rust people are especially prone to re implementing things. Nothing is really created, just reimplemented.		t6jvcereio
32717665	10.97156	-8.137025	comment	7.0	27.5	1662325135	-3.2169054	I wish that we had Rust 30 years ago. Many of these problems would have been solved by the ownership system.		faisal_ksa
32783553	10.992146	-8.042496	comment	7.0	28.5	1662750506	-3.2165217	For those who aren't aware, in addition to inventing Rust, Graydon also wrote Monotone, the source control system whose internal design Git is based on.  Interpersonally he can be prickly sometimes but his opinions are well worth listening to.		kragen
32814007	10.9627695	-8.153928	comment	7.0	23.0	1663004724	-3.2284067	Is Rust old enough for there to be a 'modern' Rust?		becquerel
32906693	10.967129	-7.980922	comment	7.0	91.0	1663638762	-3.3223407	"Someone else downthread: ""young developers can pick up Rust quite fast, and that makes it vastly easier than trying to find talented C/C++ developers.""I hope so. I have a hypothesis that the big-O for..."		ReactiveJelly
32924785	10.979884	-8.008594	comment	7.0	48.5	1663766497	-3.24432	I have a number of negative stereotypes associated with Rust and Rust programmers that I am trying to set aside right now and just look at this from a technical perspective.  Has the Rust-portability ...		daptaq
32989252	11.34989	-8.029741	comment	7.0	36.0	1664230257	10.190096	"I will agree Rust has a higher ""cognitive load"", but not if you write it every day. I think Rust might be tough to leave and come back say a year later, but Go admittedly would be easy. That said, hav..."		nu11ptr
33019573	11.182272	-8.06137	story	7.0	81.0	1664454245	9.60738	Building a Discord bot in Rust	https://www.shuttle.rs/blog/2022/09/14/serentity-discord-bot	dohguy
33072321	10.917209	-8.057954	story	7.0	47.0	1664824742	-3.287803	Does Rust belong in the Linux kernel?	https://drewdevault.com/2022/10/03/Does-Rust-belong-in-Linux.html	mwcampbell
32105168	11.086697	-7.998625	comment	7.0	26.0	1657865908	-3.279319	I think rust is the new haskell. After spending 7 months learning it, I can say I really enjoy the language, but there's no job in it and in my opinion, they take academic decisions that make the lang...		nbittich
32130946	11.018366	-8.054482	comment	7.0	21.0	1658090089	-3.225325	"The article states that Rust Docs are the best form of documentation, ""state of the art""I'm all for good documentation, but why embed it in the source code? Why not have good documentation files that ..."		mikewarot
32188174	11.016568	-8.00467	comment	7.0	34.0	1658460625	-3.2468836	> However, I am not convinced one can make something solving all the things Rust solves which is substantially simpler as language.I wonder a lot about this too. As far as I know, rust is alone. It’s ...		josephg
32237780	10.970992	-8.101978	story	7.0	190.0	1658841084	-3.184838	Ferrocene: Rust toolchain to safety-critical environments	https://ferrous-systems.com/blog/the-ferrocene-language-specification-is-here/	fofoz
32253361	11.085583	-8.037386	comment	7.0	32.0	1658942491	10.251287	What's always been interesting about the languages Meta uses is the story of the rise and fall of the D programming language at Meta. I wasn't around at the time when Andrei was working there and advo...		dom96
32253432	10.985771	-8.121843	comment	7.0	19.0	1658942766	-3.2328944	"While this is cool to see ""how the big guys do it"", this article is worthless. Specifically, it lacks one fundamental thing: why.Why isn't Go in this list? It is very surprising since it feels like al..."		tuetuopay
32498135	11.015877	-8.030053	comment	7.0	19.0	1660752272	-3.2547095	so what you are saying, is that rust solves the issue of finding competent engineers. you can use a language like rust such that engineers don’t need to be any good. it reminds me of microsoft frontpa...		b20000
22108013	11.012273	-8.026621	comment	7.0	39.0	1579622167	-3.2635775	Rust is a great language if you use for what was intended, system programming and as safe substitute of C and C++.But it's not the answer of everything, to me it's nowadays abused in a lot of projects...		alerighi
23511369	10.988176	-8.095983	comment	8.0	31.0	1592071926	-3.2970378	Rust as a language is great and at this point I'd much prefer to use it over C or C++ any day of the week if the application and context permit. However, I don't think I'd ever want to participate in ...		nilkn
23737451	10.952207	-8.026555	story	8.0	133.0	1593939606	-9.186919	Rust on the ESP32 (2019)	https://mabez.dev/blog/posts/esp32-rust/	lnyan
23936124	11.1995535	-8.09385	comment	8.0	23.5	1595569165	10.18761	"I know it's been mentioned before, but I really feel there is a need to codify an 'internet lore law' about how many comments can appear on a Go themed HN post before someone brings up how superior Rust isSomething like:
Pikes law of unfavourable comparison 
OR
HN Golang oxidation rate"		justasitsounds
24133657	10.959693	-7.9807534	comment	8.0	21.0	1597249552	-3.2832181	For the Rustaceans in the thread, I've been wondering - What's the current state of affairs of Rust for non-x86_64 targets? I know it's in flux, and that documentation isn't always up to date.What arc...		nrclark
24140924	10.976855	-8.122124	comment	8.0	52.0	1597304609	-3.208516	Why do people feel the need to reimplement everything in Rust ?If it's not broken, don't fix it...		linkdd
24334689	10.983735	-8.127801	comment	8.0	24.0	1598899770	-3.2416122	"Why every time I read about Rust the title is in form ""xyz written in Rust""?For example Unreal engine is a game engine. Not ""a game engine written in C++""."		acp2020
19995592	10.948996	-8.170415	story	8.0	246.0	1558643481	-3.1665792	Announcing Rust 1.35.0	https://blog.rust-lang.org/2019/05/23/Rust-1.35.0.html	centril
20161214	11.240796	-7.980845	story	8.0	211.0	1560306141	2.845576	PingCAP Talent Plan: Courses on writing distributed systems in Go and Rust	https://github.com/pingcap/talent-plan	ngaut
20512400	11.049068	-8.036007	comment	8.0	23.5	1563943076	-3.2345026	Question for Rust programmers, do you still use Rust for quick hacking and exploration/prototyping or reach for another tool?Rust is getting more attractive everyday, I wonder if there is something ab...		SpoofedHello
20720192	11.014798	-8.05865	comment	8.0	26.0	1565993340	-3.2572067	Anything Rust gets the post to number 1 spot. What makes Rust special that other programming languages don't enjoy ?		rammy1234
20836962	10.943854	-8.055401	comment	8.0	56.5	1567156405	-3.2357552	I think we should just evaluate Rust based on its merits. Ignore fanboys and ignore the opposite as well.In other words, Rust is just another tool. Regard it as one without subjective emotions either ...		vardump
39354710	10.934086	-8.216672	comment	8.0	26.0	1707801618	3.3455305	This “rust” is cosmetic tarnishing, not structural corrosion. Over time I imagine it will develop into a beautiful patina. Every CyberTruck will look unique.If you really want to keep it looking shiny and pristine, you can always get a clear protective wrap.		Reason077
39377546	11.223329	-8.010351	story	8.0	9.0	1707956848	-8.008271	Is Go fast enough for large computations?		999900000999
39377701	10.927348	-8.238348	comment	8.0	28.5	1707957991	3.3629613	I own a Model X, so I'm extremely aware of Tesla's abysmal build quality and service experience.However. The steel is kind of the point of the Cybertruck. Considering it purely aesthetically, I actual...		LeoPanthera
39517266	11.018075	-8.078486	comment	8.0	35.5	1708985023	-3.2776594	I hope we get an alternative than Rust, though. I understand that lots of people like the language, but I personally find it very unpleasant to use.		JohnFen
36642867	10.879299	-8.115472	story	8.0	151.0	1688809271	-3.0443046	Bevy XPBD: A physics engine for the Bevy game engine	https://joonaa.dev/blog/02/bevy-xpbd-0-1-0	lukastyrychtr
36709361	10.95669	-8.157978	story	8.0	280.0	1689257183	-3.2210603	Rust 1.71.0	https://blog.rust-lang.org/2023/07/13/Rust-1.71.0.html	mbStavola
37107583	11.370135	-8.04402	comment	8.0	43.0	1691912480	10.187412	> You may have read articles and blog posts aiming to convince you that Go is better than Rust, or vice versa. But that really makes no sense; every programming language represents a set of trade-offs...		IshKebab
37454073	10.924135	-8.096143	story	8.0	6.0	1694335805	-3.322809	Ask HN: When Ada/SPARK, then why Rust?		mayureshkathe
24450377	11.020824	-8.045093	comment	8.0	29.0	1599892975	-3.2281618	Is Rust a “times 5” language? Is it that good?I can’t imagine any language being 5 times as productive as current mainstream projects.		tobyhinloopen
24819218	11.018308	-8.009044	comment	8.0	34.0	1603040227	-3.1427338	> 2) Rust's ecosystem makes it easy to find and integrate solutions not offered by the standard APIThis is a double-edged sword.  I'm a huge fan of Rust's tooling, but when it's so easy to add depende...		skohan
25037893	10.981093	-8.035734	comment	8.0	48.0	1604946449	-3.2366347	Having tried writing a game engine in Rust, I can't imagine that Rust would become the future of game development. Lack of safety is a feature in game development, because the optimizations required a...		dimes
38685214	10.9909525	-8.005507	comment	8.0	38.0	1702919355	-3.2764747	Rust needs a language standard:https://blog.m-ou.se/rust-standard/https://rust-lang.github.io/rfcs/3355-rust-spec.htmlhttps://github.com/rust-lang/rfcs/pull/3355There are many organizations and indust...		thesuperbigfrog
38987169	10.992729	-8.072926	comment	8.0	60.0	1705203088	-3.2164443	Rust is a really frustrating language for me: I understand the safety it provides but find the pain of actually using it makes it uncompelling. Plus, the Rewrite it in Rust movement is very off-putting		fiddlerwoaroof
32608287	10.978756	-8.127079	story	8.0	145.0	1661525537	-3.2148886	Hooking Go from Rust	https://metalbear.co/blog/hooking-go-from-rust-hitchhikers-guide-to-the-go-laxy/	carride
32718369	10.979018	-8.048347	comment	8.0	41.0	1662330718	-3.2536905	Why do specifically Rust programmers think that people in every domain are just misguided and waiting for someone to teach them the right development practices? The sheer hubris…The kind of bugs that ...		t8sr
32830158	11.011684	-7.9838753	comment	8.0	27.0	1663103065	-3.2456825	Anyone else kind of losing the thread of all the programming language abstractions that Rust is stacking on top of each other?		jstx1
33056584	10.941271	-7.99352	comment	8.0	42.0	1664723568	-3.2242186	I’ve been using Rust for a while, and I’m so, so tired of hearing this argument.Yes, we know. We get it. Rust is not an absolute guarantee of safety and doesn’t protect us from all the bugs. This is o...		PragmaticPulp
31830020	11.000939	-8.058522	story	8.0	221.0	1655851911	6.962501	Experimenting with Rust in Chromium	https://chromium.googlesource.com/chromium/src/+/refs/heads/main/docs/security/rust-toolchain.md	navigaid
32086973	10.96718	-8.149752	story	8.0	164.0	1657737572	-3.1639972	When rustc explodes	https://fasterthanli.me/articles/when-rustc-explodes	milen
32342884	10.981216	-7.999442	story	8.0	21.0	1659621084	-3.2439895	Rust is not a “safe language”	https://twitter.com/andy_kelley/status/1554933549999894528	longrod
22020229	11.039986	-8.112985	story	8.0	301.0	1578755594	-3.1870513	How to make roguelike games in Rust	http://bfnightly.bracketproductions.com/rustbook/	agluszak
22074171	11.117548	-8.022782	comment	8.0	118.0	1579265698	7.5276937	"""Ok... So that was unprofessional. If you don't want to maintain a project anymore, you give it to someone else and link to that repo in your README.This just screwed me over big time.""https://github...."		tsukurimashou
22218664	10.961745	-8.18279	story	8.0	139.0	1580670387	-3.1732724	Jonathan Blow on Rust	https://np.reddit.com/r/rust/comments/evgl81/jonathan_blow_on_rust/	faitswulff
13714070	11.001282	-8.03182	story	8.0	182.0	1487860140	7.7423563	A Simple Rust GUI with QML	https://www.vandenoever.info/blog/2017/02/17/a-simple-rust-gui-with-qml.html	irfanka
13732706	10.9952135	-8.078721	story	8.0	153.0	1488044664	-3.183589	One Year with Rust: I wrote a full featured application in rust, and so can you	http://vitiral.github.io/2017/02/25/one-year-with-rust.html	vitiral
13752964	11.056761	-8.066122	comment	8.0	21.0	1488281404	7.4727497	You're still using Rust / Go ? I've been using Luna on the Rocket stack, with Huston for distribution and Apollo for stack management, and it fixes mostly all the problems you've mentioned.		supercoder
13992858	11.002886	-8.058379	story	8.0	177.0	1490847614	7.489761	Writing a Raytracer in Rust – Part 1	https://bheisler.github.io/post/writing-raytracer-in-rust-part-1/	miqkt
14081493	10.969052	-7.9851236	comment	8.0	39.0	1491850920	-3.2689824	"I think it has a fair chance (Go is a ""systems"" language and grew very quickly). I also believe you'll see it pop up in unikernels as well. Why, you ask? Because there's always 1 person that starts a ..."		stmfd
14285413	10.993504	-7.9927683	comment	8.0	41.5	1494164627	-3.2739468	"I think the complaint is more that Rust has seemingly tried very hard to make error handling ""simple"".  But in the process it has managed to invent a whole series of new idioms and special syntax that..."		ajross
14421721	11.028181	-8.050965	comment	8.0	22.0	1495767435	6.978577	"I understand that people who like rust REALLY like Rust, but you do realize that your examples of a purpose for existence consist of:1. A programming language, that hasn't yet shown ""escape velocity"" ..."		StevePerkins
30841693	11.004215	-7.9884734	comment	8.0	32.0	1648557395	-3.2167397	This looks really cool and I can't wait to try it, tho... a bit of a PITA to get running. ;)  Took a while to figure out how to build, and had to install 400MB of dependencies first....Edit:  And afte...		loxias
30971989	11.046351	-7.9835377	comment	8.0	22.5	1649537936	-3.167043	Hey, author of bore here! I've been summoned by my friend who saw this on the front page of HN. Thanks for posting.Happy to answer any questions, though the README has most of the technical details al...		ekzhang
31037636	11.010636	-8.014691	comment	8.0	60.5	1650009592	-3.3184037	"Rust is alright as a language, but cargo is extremely scary.  I hope a culture of coding in rust outside of the cargo ""ecosystem"" develops.  The current situation is alienating to reproducibility-oriented developers."		enriquto
31216080	10.968009	-8.145601	story	8.0	103.0	1651326706	-3.2168233	A Rust match made in hell	https://fasterthanli.me/articles/a-rust-match-made-in-hell	mooreds
31238942	10.984192	-8.114425	story	8.0	74.0	1651516257	-3.1874106	An O(1) Generic Blog Post About Rust	https://peterkos.me/rust-const-generics/	peterkos
31355110	11.00559	-7.989756	comment	8.0	23.5	1652367250	-3.2885463	honest question, what necessitated Rust's choice of using such a different module system? Every other modern language seems to roughly map directory to module (go/python etc), or explicitly declare a ...		lumost
31434194	11.038879	-7.997226	comment	8.0	35.0	1652966031	-3.2542624	> This is a superficial complaint, but I found Rust syntax to be dense, heavy, and difficult to read.I'm not sure this is a superficial complaint. People say the hard thing about learning Rust is the ...		NoGravitas
31602809	11.35513	-8.030361	comment	8.0	43.0	1654217826	10.144656	I agree, I don't understand why so many people lately seem to want to use Rust for web domain stuff.I don't like Go, I hated the year I had to work in it @ Google. But frankly, it's better suited for ...		cmrdporcupine
31606713	11.024968	-8.001014	comment	8.0	45.5	1654253955	-3.1951551	Another data point: After writing / (re)writing 20K+ lines of code as a CLI side project in Rust (without touching async), I think I can say it's the best language for me after 20+ years of experience...		iex_xei
31613753	11.099562	-8.0162735	comment	8.0	33.0	1654291138	7.5234747	> Is the Async crew mostly writing web servers and other things that operate using TCP and HTTP? Lower level (eg IP, Eth, network hardware drivers) isn't well supported by rust libs. Nor is higher - w...		xavxav
25469535	10.992317	-8.104457	story	8.0	178.0	1608312667	-3.239832	Rust 2021 Roadmap	https://github.com/rust-lang/rfcs/pull/3037	praveenperera
25550003	10.965699	-8.011173	story	8.0	110.0	1609062687	-3.220356	Show HN: Vas-quod – A minimal Linux container runtime written in Rust	https://github.com/flouthoc/vas-quod	flhoc
25594057	11.002203	-8.049286	comment	8.0	24.5	1609431917	-3.2989533	A question for the Rust crowd, from someone who's thinking about giving Rust another chance in 2021:Last time I tried getting into Rust, some years ago, the recommended way to install it was to use th...		ufo
25610889	10.991751	-8.139123	comment	8.0	28.5	1609569050	-3.2249093	"A half-hour to learn Rust
Jan 27, 2020 · 51 minute read · rustmaybe the site's reading time estimator is broken? sarcasm intended.But seriously, it is good to have people writing things like this."		timhigins
25611173	10.983832	-8.138026	comment	8.0	24.0	1609574076	-3.204544	That is the best article on Rust I've ever seen. Better than the Rust book. I've been saying that Rust needed a book that wasn't written by the designers of the language, who are too close to it. Now we have one.		Animats
25812330	10.954436	-8.145569	story	8.0	141.0	1610902960	-3.2266908	PBRT in Rust	https://github.com/wahn/rs_pbrt	signa11
26088708	10.986575	-8.013773	comment	8.0	68.0	1612963442	6.7680526	> Mozilla used Rust to build Stylo, the CSS engine in Firefox (replacing approximately 160,000 lines of C++ with 85,000 lines of Rust).I would have loved to see two competing teams rewrite it, one in ...		nickelcitymario
35704705	10.898053	-8.280651	comment	8.0	45.0	1682447534	-3.925773	I have a lot of skepticism about anything I read from constructionphysics.substack.com. I'm a mechanical engineer, not a civil engineer, so take my opinion with a grain of salt, but it reads like it's...		elil17
35739375	10.97725	-8.02844	comment	8.0	24.0	1682676056	-3.2008293	> Font shaping performance increased by 5-15% compared to the C++ version.Personally, I wouldn't link it directly to rust, but to rewriting. When you develop something, you usually can't account for a...		AntonCTO
35994610	11.46859	-7.9801826	comment	8.0	39.5	1684446701	10.1520605	I wish more programming languages provided interfaces for building libraries around the std library like what Go does. It makes using libraries a lot better because you aren't dependent on that librar...		impulser_
36048261	10.973566	-8.038428	story	8.0	383.0	1684864906	-10.258585	Comprehensive Rust: course used by the Android team at Google	https://github.com/google/comprehensive-rust	ingve
36103276	10.943584	-8.1611595	comment	8.0	20.0	1685275339	-3.17457	This is certainly strangely phrased. The version I got from another member was that the content of the talk was to be about a proposed feature that may not actually end up in Rust (in my view it likel...		pie_flavor
36122508	10.95344	-8.146076	comment	8.0	38.0	1685435932	-3.2332883	This happened a while ago and was related to the trademark/copyright issue. It’s an immature move and I can’t take this seriously. All this does is creating unnecessary drama surrounding the Rust foundation.		dmeijboom
36538396	11.041102	-8.007024	comment	8.0	22.5	1688144378	7.4736714	"Holy shit this GUI framework looks good.  I am a Qt fanboi, but this looks great.  Normally, I skip all the ""X for Rust"" posts as a bunch of fanaticism.  Could it really be different this time???The f..."		throwaway2037
29240174	10.955388	-8.169522	story	8.0	203.0	1637068714	-3.2644756	Rust on MIPS64 Windows NT 4.0	https://gamozolabs.github.io/fuzzing/2021/11/16/rust_on_nt_mips.html	ingve
29295707	11.103696	-8.068813	story	8.0	154.0	1637495655	7.4763494	Rust programming for web developers, by a web developer	https://codeamigo.dev/lessons/161	plondon514
29309768	10.9559965	-8.159187	comment	8.0	27.5	1637605112	-3.1438468	I'm inclined to believe the rust moderation team even though they haven't disclosed any specifics. The way the core team exercises absolute authority in spite of community complaints has always rubbed...		rust-throwaway1
29485728	10.9855585	-7.98598	comment	8.0	25.5	1638976615	6.467102	Will be interesting to see how much compile times suffer once rust starts being used more heavily in the kernel.In my gentoo days I remember the compile time for firefox suddenly going up from 20 minu...		NextHendrix
29619566	10.947332	-7.9854293	comment	8.0	25.0	1639955773	-3.2074287	I've been doing embedded development for over 20 years. The rust evangelists just don't understand embedded development.Embedded developers are very conservative, they don't chase the shiny and believ...		not_the_fda
34537969	11.006376	-7.9853578	story	8.0	214.0	1674763587	-3.2351265	Thoughts on what a next Rust compiler would do	https://matklad.github.io/2023/01/25/next-rust-compiler.html	arunc
34641116	11.000932	-8.0254345	comment	8.0	28.5	1675432822	-3.1575058	"It's funny, any other post on HN about improvements to Rust I've seen are chock full of comments to the effect of ""I guess that feature is nice, but when will they improve the compile times?"" And now ..."		Bjartr
34789236	10.989197	-8.055878	comment	8.0	25.0	1676382803	-3.204823	The constant Rust spam on the front page makes me think that there may be some sort of pro-rust bot that upvotes them.  There probably isn't, just a lot of enthusiasm, but it's tiring.However, it has ...		pclmulqdq
35071317	10.939815	-8.029405	story	8.0	86.0	1678294097	-3.2693207	Truck: CAD Kernel in Rust	https://github.com/ricosjp/truck	adamnemecek
