id	x	y	type	relevance	size	year	umap1d	hovertext	url	author
33096836	10.955444	-8.035988	story	3.0	68.0	1664983752	-3.2509599	Rust's Safety Is Effective	https://twitter.com/linaasahi/status/1577667448966258690	unrealhoang
33151341	11.048125	-8.119526	comment	3.0	12.0	1665409564	-13.831216	This might have an obvious answer for the more experienced here, but (potentially stupid question) why didn't you use dart for this?Nothing against rust, just interested is all considering the dart/flutter relationship.		account-5
33245884	10.989699	-8.1308565	comment	3.0	11.0	1666093893	-3.237357	> It's a bubble, 99/100 crypto companies are going to crash and burn, or already have.I'm sure this is the 990th time that I have heard this. The fact is, it isn't going away and it seems even more cr...		rvz
33250376	10.978857	-8.11199	comment	3.0	20.0	1666111980	-3.2200265	Rust doesn't solve any real problem.It's a meme language that is only used for writing blog posts and internet commentary.		otabdeveloper4
33253075	10.980027	-8.103238	comment	3.0	12.0	1666123458	-3.1516047	rewriting everything in rust is not just a meme?		jalino23
33253411	11.225474	-7.985237	comment	3.0	24.5	1666124904	-3.3546364	Rewriting in Rust is not a meme, it's a cycle.Before Rust became viable, rewrites were done in Go.From the archives:- Rewriting a large production system in Go https://news.ycombinator.com/item?id=623...		ayewo
33281863	10.980263	-7.985494	comment	3.0	13.0	1666306273	-3.2395265	Rust isn't perfect. UB is a bug in rust, but it occasionally has bugs. Ideally you'd do rust and asan with good unit tests. And yes, if you only picked one, it should be rust, but don't just pick one....		galangalalgol
33349093	11.008018	-7.9964046	comment	3.0	21.0	1666816770	-3.273995	Something I find interesting about this discussion is that Rust seems to be held to a significantly higher standard than any other language developed in the last 30 years.I don't think Rust needs a st...		duped
33350198	11.002758	-8.049381	comment	3.0	18.5	1666821846	-3.2403603	I don't think people who are asking for an accurate description of Rust are holding it to a higher standard than other languages.Rust's current reference docs, more than seven years after Rust 1.0 was...		mjw1007
33350462	11.0227165	-8.0349865	comment	3.0	11.0	1666823312	-3.2296798	"I am one of the people who has written a lot of Rust's docs, including one of the early attempts at ""specifying"" details of the language: the Rustonomicon.Rust's documentation is taken very seriously ..."		Gankra
33388957	11.068566	-8.011311	story	3.0	1.0	1667085652	7.337936	Making an ECS WebAssembly Game in Rust	https://dublog.net/blog/rust-2/index.html	LarsDu88
26502876	11.022416	-8.048094	story	3.0	71.0	1616076769	-3.1957335	Rust in Linux-Next	https://git.kernel.org/pub/scm/linux/kernel/git/next/linux-next.git/commit/rust?id=c77c8025525c36c9d2b9d82e4539403701276a1d	steveklabnik
26511550	10.987191	-8.021382	comment	3.0	25.0	1616147300	-3.2135456	Imagine if Rust only did releases every 18 or 36 months like other popular languages, or every six months like OP wants. Features that haven't been fully baked would be pushed in to the current releas...		nindalf
26512428	10.976487	-7.9942093	comment	3.0	12.5	1616156560	-3.2613657	I didn't say it's too low abstraction to appeal to C++ programmers; Rust and C++ (and Ada, and Zig) have the same level of abstraction. I'm saying that Rust should seriously fight for the market C++ w...		pron
26558434	10.9671545	-8.029186	comment	3.0	15.0	1616524165	-3.2508864	I think if security is a main concern of people working on Linux, there are both lower hanging fruit AND bigger fish to fry than getting code into Rust.Not that it isn't a worthy effort, but it's stil...		busterarm
26637842	11.377146	-7.982351	comment	3.0	10.5	1617126547	10.13332	The only apt comparison IMO is Rust, the other languages with JIT compiling runtimes aren't really useful comparisons.To me this looks like a discussion about syntax and ergonomics. Go provides the sa...		cle
26648990	10.950316	-7.981227	comment	3.0	20.5	1617206804	9.157795	Rust isn't that hard to learn. I teach it to college sophomores who only know Java, and within 2-3 months I have them writing parsers and interpreters in Rust. In fact these students are requesting ou...		ModernMech
26727384	11.047149	-7.982728	story	3.0	5.0	1617813695	-3.2165527	Show HN: Spaik, a Lisp compiler/VM with a moving GC written in Rust	https://github.com/snyball/spaik	snyball
37584105	10.977174	-8.129384	comment	3.0	13.5	1695217892	-3.1630168	I wouldn’t call Rust easy to develop in.		kaba0
26759703	10.984382	-7.9978943	story	3.0	40.0	1618040229	5.9067907	Mastering Ownership in Rust	https://blog.logrocket.com/mastering-ownership-in-rust/	joseluisq
37677181	11.379824	-8.017795	comment	3.0	11.0	1695832283	10.1583805	I’m in a weird spot where I like both equally, but for slightly different reasons.When I have a dumb idea (they’re all dumb), depending on what its core features are, I’ll prototype it in Go, TypeScri...		steve_adams_86
37702263	11.0540285	-7.990601	story	3.0	2.0	1695987594	-3.2480466	Show HN: HN Reply Notifier	https://github.com/fragmede/hn_reply_notifier	fragmede
37763986	10.997639	-8.056933	comment	3.0	11.0	1696421336	-3.1033251	From my experience with Rust, there is nothing fast about developing with it.		lucgagan
37824386	11.009467	-8.038853	comment	3.0	10.5	1696880026	-3.1923327	The Doom of programming languages? Rust must be run everywhere with no irony.		SuaveSteve
37826006	11.368416	-8.015874	comment	3.0	14.5	1696888840	10.204644	"I may have wrong assumptions, but I find it funny they didn't use Golang. Is it not capable of doing the same thing ?
Anyway, happy to see rust being adopted for that usage."		az09mugen
37842464	11.059075	-8.071568	comment	3.0	10.5	1697016340	7.6267924	> Rust doesn't have any GUI frameworks (like Qt)And Slint? And egui? And the Qt bindings crates?You can say that they aren't as mature as Qt, but they are often good enough compared to something that runs in a browser.		jenadine
14924622	11.000534	-8.0677805	comment	3.0	27.0	1501800096	-3.213932	Wow, the comments in this thread are quite harsh. Even though I might not use it, this looks like an awesome project - kudos to the author for finding (& implementing) ways to improve something as mun...		krat0sprakhar
14916749	10.987538	-8.00128	story	3.0	86.0	1501730830	-3.2811806	Writing an OS in Rust	https://os.phil-opp.com/	hacknrk
15023993	11.012226	-8.146765	story	3.0	13.0	1502843096	-3.1971517	Ask HN: Rust topics you wish someone had explained when first getting started?		Toidiu
12584160	11.261556	-7.987814	comment	3.0	19.0	1474913421	10.1847725	"Let's try with other languages:    Rust - C beyond Go

See any problem?"		junke
12584472	11.35824	-8.028665	comment	3.0	17.0	1474915428	10.191582	"Newcomers are always confused by the distinction, this doesn't help at all to put them in the same big bag. This classification is not wrong, but mostly useless when you see how the different ""dialect..."		junke
12586753	10.977604	-8.115887	comment	3.0	14.0	1474936132	-3.1887546	Good luck with that. There ain't no way rust is getting a misra complaint setup anytime soon. Not to mention, the current vendors are entrenched in their ways to ridiculous levels. Companies like keil for example don't bother to have a Linux complaint tool chain.		hak8or
12592161	10.97253	-8.107254	story	3.0	157.0	1475003214	-3.2207484	FreeRTOS meets Rust	http://www.hashmismatch.net/freertos-meets-rust/	cpeterso
12721890	11.048292	-8.026275	comment	3.0	11.0	1476663560	-3.2030015	I am currently working through these in my (very rare) spare time as a means of learning Rust.Forget project Euler or babby's first web server. This is an _excellent_ way to learn a new language, to l...		thenewwazoo
12740116	11.032306	-8.028519	comment	3.0	19.0	1476838960	-3.2346492	I might be wrong but one possible explanation is that the language is so hard to learn that people would need tools to help in the beginning.Within Mozilla, they can use servo as a selling point or tu...		xuejie
12744553	11.002505	-8.010194	comment	3.0	14.5	1476890405	-3.2898927	This is all personal opinion so take it with a grain of salt.I think Rust could do some serious C++ competition if it could dethrone C++ from some platform or have a worthy alternative.That is I think...		agentgt
12766882	11.089036	-8.038001	comment	3.0	22.5	1477105356	7.565829	Awesome. I have used Iron a few times to write small web services, but I can't wait for Rust to really have a strong story for the backend. If that happens it'll be the first language I reach for when...		leshow
12768198	11.36017	-8.023739	comment	3.0	12.0	1477133395	10.184953	Go outperforms rust on all kinds of benchmarks, has a larger community, better documentation, more third party libraries, and significantly better tooling.What's the value proposition for using rust over go?		dysfunctor
27500338	10.974173	-8.034258	story	3.0	12.0	1623657213	5.794059	Rustlang Ownership: Visual Analogy	https://github.com/Lakshmipathi/rustlang-visual-analogy/blob/master/rust_ownership.jpg	giis
27525302	10.989707	-8.090833	comment	3.0	55.5	1623822481	-3.2410889	"Kudos for writing something in rust and not appending ""written in rust!"" everywhere."		shric
27553908	10.977631	-8.059809	comment	3.0	27.0	1624044283	-10.182353	> TIL: That there's an ORG to effectively harass people like Daniel Stenberg to rewrite popular stuff in Rust.This is both inflammatory and wrong. ISRG isn't harassing Stenberg; they're paying him to ...		mwcampbell
27554125	11.003386	-8.051911	comment	3.0	20.5	1624045432	-3.2399182	What is inflammatory is the way a part of the Rust community deals with other languages.You are right is not just ISRG, but it is part of this big masonry-like movement forming to replace C++, not by ...		oscargrouch
27571441	10.93829	-8.205887	comment	3.0	10.5	1624205552	-3.203237	In my experience in the north, cars you drive in winter can get about 15-20 years before you really start to have body rust and things like brake lines start rusting out.Right before the pandemic, I g...		ghaff
27567544	10.972141	-8.082787	story	3.0	31.0	1624168931	-3.2022583	A comparison between Rustam and Arjuna	https://blogs.bl.uk/asian-and-african/2021/05/a-comparison-between-rustam-and-arjuna.html	drdee
27746899	10.979072	-8.151992	comment	3.0	12.0	1625570719	-3.2107008	it's almost as if someone is getting royalties every time Rust is mentioned		cerved
27747077	10.952978	-8.020364	comment	3.0	14.0	1625571754	-3.2289	> Microsoft's Linux Systems Group is interested in contributing to getting Rust into Linux kernel. Hopefully we will be able to submit select Hyper-V drivers written in Rust in the coming months.At ve...		pjmlp
27748074	10.94985	-8.058825	comment	3.0	16.5	1625577309	-3.2265682	This is a very weird comment, of course the people driving this have a long history with the kernel... It takes about 2 minutes of using git to find out that Miguel's (the main author) first commit to...		gpm
27782383	10.95827	-8.165019	story	3.0	81.0	1625828074	-3.1938226	This Week in Rust 398	https://this-week-in-rust.org/blog/2021/07/07/this-week-in-rust-398/	yagizdegirmenci
35183280	11.019044	-8.046818	comment	3.0	12.0	1678980879	-3.2698498	"> Since you ended up here, you probably agree that Rust is potentially an ideal language for Game Development.The name and domain are generic enough that I imagine most visits are ""What is this?"""		manfre
35291528	11.462612	-7.995919	comment	3.0	11.5	1679675547	10.1749115	> for the real goal of of interoperable modules working togetherCORBA, Beans etc predate the modern web but its telling that no one has really bothered to try to recreate them...what is the demand? se...		imwithstoopid
35253704	11.038318	-8.029475	story	3.0	2.0	1679438335	-3.220343	Ask HN: Does ChatGPT Understand Rust?		andrewstuart
35360993	10.980604	-8.13745	comment	3.0	10.5	1680113330	-3.1829906	"What I worry the ""Rust is hard"" commentary and criticism makes people think of Rust.99.9% of the time you're never going to touch voodoo like this. Unless you choose that path."		echelon
35354210	11.030865	-8.014003	story	3.0	74.0	1680078478	-3.3049545	Rust Identified as Safer Coding Tool by NIST	https://foundation.rust-lang.org/news/rust-identified-as-safer-coding-tool-by-nist/	ngrilly
35504726	11.063124	-8.006842	comment	3.0	17.5	1681061490	-3.1204097	why would anyone want to use PL/Rust over PL/PQSL?what is the use case?		systems
35481529	10.959479	-8.137809	story	3.0	7.0	1680875378	-3.2607205	Rust Trademark Policy Comment Form	https://docs.google.com/forms/d/e/1FAIpQLSdaM4pdWFsLJ8GHIUFIhepuq0lfTg_b0mJ-hvwPdHa4UTRaAg/viewform	thesuperbigfrog
22400596	10.957173	-8.165413	comment	3.0	26.0	1582504104	-3.1893258	I'd really like to see a write-up like this on one of the model S's from northern europe. The biggest longevity concern for me is rust and corrosion of the frame due to winter road salt.		ScottFree
22410122	10.927769	-8.029987	comment	3.0	12.0	1582593541	-3.208174	I think that it's more that they already have a kernel, and their focus is moving as much as possible outside the kernel rather than adding to it.And, FWIW, I can see a point where they have a kernel ...		monocasa
22443879	11.386904	-8.040868	comment	3.0	13.5	1582907184	10.201889	"Can we just stop with the ""Rust vs Go"" shit?If you want me to take a critique of Go seriously these days, pick another language to compare it to. Any other language.And yeah, I'm aware that 5 years ago there were a ton of ""Go vs Java"" articles. I didn't think much of them then, either."		marcus_holmes
22457178	11.107236	-8.0443535	comment	3.0	12.0	1583075863	7.566888	I understand that using Actix really highlights the speed advantage of Rust... but I think it's irresponsible to encourage rewrites in Rust using a framework that's dead because the developer decided ...		rgbrenner
22474813	10.9746065	-8.141661	comment	3.0	10.5	1583246783	-3.2517107	"""People"" say that? Really? Now you build up straw men so you can slip ""Rust"" into every discussion."		fortran77
22499162	11.441649	-7.989851	comment	3.0	11.5	1583448291	10.203801	"Inevitably someone's going to say ""This is great, but why did you do this in Golang, when you could have written it in Rust because Rust is so cool."" And then someone else will chime in that if you we..."		PeterCorless
22438880	11.227154	-8.053909	story	3.0	17.0	1582844198	10.18189	Early Impressions of Rust from a Go Programmer	https://coded.io/2020/02/early-impressions-of-rust-from-a-go-programmer/	belak
22487020	10.970362	-8.168144	story	3.0	44.0	1583349918	-3.2394905	Watching Magnets Rust	https://www.kjmagnetics.com/blog.asp?p=rust	trynewideas
22562723	11.329952	-8.041737	comment	3.0	11.5	1584052908	10.070514	Pretty much what I am thinking.  When I use Rust, at the end of the day I will have spent more time with the language instead of my actual task, and I don't see this changing given the rate Rust is st...		clktmr
22643413	10.9827	-8.006044	comment	3.0	14.0	1584753428	-3.2770824	It said Rust and/or C though, and I imagine learning Rust is pretty easy compared to C from what I've seen.		codr7
22645272	10.980741	-8.088646	comment	3.0	11.0	1584778544	-3.2055619	"> Not Rust level capabilitiesAnd you answered your own question.If you aim for performance, ""pretty good"" doesn't cut it."		rumanator
15144649	10.989875	-8.12327	comment	3.0	21.5	1504219812	6.7449055	Are there any blogs about how Rust is integrated into Firefox (a mostly C++ program) - i.e. how the Rust runtime is invoked, garbage collection etc?		smegel
15178430	11.028717	-8.011545	comment	3.0	13.0	1504640161	-3.2900093	"- User doesn't like the fact that buildbot (which they think is maintained by mozilla) uses ""master/slave"" terminology https://github.com/rust-lang/rust-buildbot/issues/2 .  Mozilla gives buildbot $15..."		david-cako
15179999	11.017253	-7.9886427	comment	3.0	19.0	1504654884	-3.2167878	> My sense is that Rust may not have thought enough about compatibility early in its life. Only later when they ran into adoption problems did they start talking more about compatibility.Of course Rus...		pcwalton
15294622	10.9913	-8.037517	comment	3.0	15.0	1505920423	-3.2750387	> Frameworks don't rust.Ah, the optimism of youth. Frameworks don't rust if you don't  mind sticking with the security bugs of 10-year-old kernels. If you need to upgrade your OS, you need to upgrade ...		StavrosK
15345886	11.390544	-8.018774	comment	3.0	26.0	1506501250	10.210924	"Even more, Go is excluded as (author's opinion) goleveldb is not as mature as RocksDB. Thus they should have used CGo, which is way suboptimal, slower etc.The title should have been: ""C++11 or Rust? W..."		dullgiulio
15346378	11.351255	-8.066651	comment	3.0	17.5	1506507993	10.203583	I haven't used Go or Rust but when I compare them I have a gut feeling that I'd be better off with Rust primarily because Go's build tools are not adequate. What do you think about this?		edem
15345828	10.974421	-8.136793	comment	3.0	11.0	1506500650	-3.2162976	Fits in pretty well with the ongoing Rust agenda here in HN		throwaway884
15291612	11.0047865	-8.014261	story	3.0	11.0	1505894285	-3.2799308	Ask HN: Will Rust be as popular as Go or C++?		lostPoncho
15369334	10.9849	-8.130051	comment	3.0	12.5	1506720081	6.7470574	Rust was pretty much designed to solve problems for Firefox. It's IMO the best bet Mozilla has made these last few years and we're just starting to see them reaping the rewards.		kenhwang
15429630	10.970411	-8.144922	comment	3.0	11.0	1507491846	-3.2317278	With the obligatory sneaky Rust advertisement in the title, my bullshit detector rings all its bells. And once more it was right.		dau
15376511	10.986351	-8.11815	story	3.0	18.0	1506834858	6.6773696	Ask HN: How much is the recent improvement in Firefox Quantum due to Rust?		lostPoncho
15444734	11.032852	-8.064891	comment	3.0	13.5	1507664326	7.2267675	I've been working professionally with Rust for a year now. When I got over the first wall, it has become the best tool I've had for creating backend applications. I have history with at least nine dif...		pimeys
15449641	10.936948	-8.029634	comment	3.0	18.5	1507729245	-3.2708285	> the bar is high and Rust has set the bar.Modules were introduced in the 70's as concept, Mesa being one of the first languages to use them, followed by CLU and ML....The issue with lack of modules i...		pjmlp
15582754	10.985936	-8.116507	comment	3.0	11.0	1509330820	-3.238619	"Rustaceans? Would recruiting agencies go for that in job ads?""Are you a top rustacean and looking for a challenge in AI and Big Data and want to work in an international team with young and dynamic rustaceans?  """		dudeonthenet
15629866	11.36733	-8.03502	comment	3.0	17.5	1509896588	10.182683	While rust is the safer, and more featureful language, I think Go is quite possibly the better pick for large corporations just due to it's simplicity. Rust to me is the more interesting language, but...		hardwaresofton
15646584	10.94569	-8.034637	comment	3.0	12.5	1510082507	-3.2127419	This is one of the many reasons why the kernel should have been written in Rust.		ky738
38019671	11.000436	-8.000782	comment	3.0	23.5	1698276419	-3.221556	> I started writing tests in Rust as I would in any other language but found that I was writing tests couldn’t fail.This is a common refrain in C++ testing: if it compiles then it's probably correct.>...		tantalor
38006204	11.021803	-8.0451975	story	3.0	34.0	1698184456	-3.0533812	Show HN: RustPython for FreeDOS with W2c2	https://github.com/coolcoder613eb/RustPython	coolcoder613eb
38063989	11.05986	-7.9966826	story	3.0	14.0	1698622932	-10.219601	Show HN: Rust TUI libcurl HTTP client – developed in prison	https://github.com/PThorpe92/CuTE	dvektor
38082067	10.994235	-8.116975	story	3.0	59.0	1698743661	-3.1986449	Contributing to Rust as a Novice	https://filtra.io/rust-ochagavia-oct-23	wofo
38125951	10.9511175	-8.026257	comment	3.0	13.0	1699000150	-3.2755358	Really unexpected, that the first kernel feature written in Rust is such a huge driver, I would've expected something much smaller first. The reasoning for the change is well laid out imo. I'm looking...		leononame
38144727	11.037408	-7.9989643	comment	3.0	11.0	1699129078	-3.2035267	What (dis)advantages does writing a game in Rust (with Bevy) have compared to other languages? Keen to hear about performance, safety, and dev velocity.		bigyikes
38192579	10.976162	-8.034278	comment	3.0	11.0	1699460333	-3.2525039	A lot of the timeline depends on the partner we're working with to achieve qualification. Initial qualification definitely takes longer, but we're having discussions on how we can cut down on the manu...		Xylakant
38235894	10.980291	-8.10969	comment	3.0	23.0	1699747765	-3.2188857	I think about it the other way; Rust is an ML with a borrow checker. Most of the stuff I hear people gushing about in Rust is IMO them experiencing what's it's like to write ML.		debo_
38271849	11.032116	-8.009074	comment	3.0	13.5	1700008535	-3.2157378	"This looks enough like rust that I'm not sure why I'd pick it over rust. What would be some concrete programs that would be difficult or tedious to write in rust and easy in inko? Could really use a section on ""here's rust code you'd like to write but compiler won't let you"" and how inko works."		tedunangst
38292335	11.01084	-8.137453	story	3.0	13.0	1700155031	-3.267335	The Rust Foundation to Develop Training and Certification Program	https://foundation.rust-lang.org/news/the-rust-foundation-to-develop-training-and-certification-program/	qsantos
38424578	10.975096	-7.9987283	comment	3.0	13.0	1701029650	-9.610821	>  1. It's amazing that they're doing this as a gradual C++ to Rust rewrite, while keeping it working end-to-end, if I understand correctly.Seems to me they're not doing it gradually at all.> Another ...		capableweb
38463229	10.986277	-8.115864	comment	3.0	11.5	1701282865	-3.2535563	Haven't checked yet, but I am sure it's written in Rust		dilsmatchanov
38510054	10.984143	-8.104239	comment	3.0	11.0	1701632635	-3.1708534	I wonder where the name came from. Being HN, here is my nitpicking  imperative:Names are important. Our inheritance is wit, self-awareness, and irony; names that puncture ego and power and that appeal...		wolverine876
38517118	11.044585	-7.9866543	comment	3.0	14.5	1701697598	-3.2244446	>Rust was far from perfect when it started seeing adoption by pragmatistsIsn't Rust still a niche programming language? When compared to C, C++, C#, Javascript, Java, Python?		DeathArrow
38514918	11.005872	-7.987754	story	3.0	5.0	1701678031	-3.218633	A better `ls` in Rust	https://www.bekk.christmas/post/2023/4/a-better-ls-in-100-lines-of-rust	selbekk
38564026	10.99751	-8.003407	story	3.0	39.0	1701997000	-3.246567	Loco: Rust framework for side projects and startups	https://github.com/loco-rs/loco	nateb2022
26818294	10.966038	-8.030649	comment	3.0	17.0	1618479959	-3.2595918	Rust won't make legacy code and legacy coders go away. In fact, as time goes on the amount of crappy legacy Rust code and low-skilled legacy Rust coders will only grow.So Rust is not a solution.		otabdeveloper4
26832598	10.952486	-7.9897585	comment	3.0	35.0	1618572905	-3.2719917	The title is slightly misleading, and so is Linus' response here. This RFC never claimed to be in shape to be immediately mergeable into the mainline kernel as-is. Miguel (the author of the patch) has...		phoe-krk
26845932	11.015723	-8.053507	comment	3.0	10.5	1618680860	-3.1516726	"I know I am being pedantic, but it is a bit weird to editorialize ""How I Implemented /dev/printerfact in Rust"" to ""I Implemented..."", make the author come off a little more boastful than they intended to."		O_H_E
26866238	10.970144	-7.993722	comment	3.0	14.5	1618856495	-3.2203221	While I like the idea of Rust, having to (re)-learn all these subtleties seems daunting (just look at the table comparing dyn vs. box vs. arc vs. references etc.)When I moved to Java 1.0, coming from ...		beders
26983360	10.988545	-8.157059	comment	3.0	14.0	1619714447	-3.1773827	Can anyone speak to what power this gives them in the rust foundation, other than just good will and the dependence on funding?		xgulfie
27153285	10.993584	-8.038849	comment	3.0	13.0	1620993696	-3.1849973	And I guess it’s 2015 edition, because it’ll fail in 2018 edition Rust: where the 2015 edition has ::u8(0u8), the 2018 edition will need you to write crate::u8(0u8) or self::u8(0u8), since only crates exist at the top level now, rather than the contents of the current crate as well.		chrismorgan
27155776	11.017173	-8.059948	comment	3.0	13.5	1621008392	-3.1913445	I'd like to nominate anything by Mara Bos (@m_ou_se) on Twitter. For example:> What's your favourite @rustlang boolean? Option<()>, Option<Option<!>>, std::iter::Once<()>, std::fmt::Result> tired: u16...		iudqnolq
27156084	11.030756	-7.9920936	comment	3.0	11.5	1621009620	9.352017	I'll chime in and say that for me at least, the module system was a hurdle at the start and coincidentally the only part of the language where the explanation in The Book (which is excellent, so thank...		skoodge
27249111	11.061625	-8.009238	comment	3.0	11.5	1621708517	6.742297	What is the biggest project written in Rust? Servo? Hasn't Firefox gave up on it?		xaduha
27249821	10.954543	-8.020865	comment	3.0	12.0	1621713795	-3.250452	"Most ""new tech"" is engineering, not science.If you want empiricism try academic papers instead of mailing lists ;) Some numbers: most critical bugs in the Linux kernel are due to memory safety: 40 out..."		emmericp
27281532	10.973236	-8.015914	comment	3.0	13.0	1621971588	-3.3009894	> Debian 11, which isn't even released yet and has rustc 1.48, is already out of date and unable to compile most rust programs written for the rust spec just 3 months later.This comes up with Java as ...		cogman10
