id	x	y	type	relevance	size	year	umap1d	hovertext	url	author
26903650	11.3998995	-7.9880476	comment	4.0	23.0	1619104382	10.153066	I predict exactly the opposite.Baking ownership into the type system makes API design and refactoring hard, while having GC makes memory management entirely orthogonal and easy to change. Go is alread...		titzer
26903822	11.345924	-8.030097	comment	4.0	30.5	1619105231	10.19115	It seems reasonable to argue the exact opposite:  (edit: for clarification, I think this argument is roughly equal in strength to the parent.  My bias is definitely showing, but my main point is that ...		Laremere
26983659	10.971545	-8.145058	comment	4.0	14.5	1619715653	-3.1972356	Too much. It goads people in the Rust community to pretend to think Facebook is well-meaning company. I'm going to continue thinking Facebook doesn't care about people, even when they're being killed ...		benatkin
26984898	10.983953	-8.006188	comment	4.0	13.5	1619722055	-3.2804475	I think your comment is good, but also, your comment and the parent comment highlight a situation that makes this discussion hard: you're both talking about two different things.You're talking about u...		steveklabnik
26985014	10.967343	-8.006785	comment	4.0	21.0	1619722526	-3.14333	So your complaint is that Rust library authors are too excited to use new stable features as soon as they are available, and your preference would be for them to wait e.g. a year before adopting new l...		jacobolus
27025283	11.099215	-7.9878025	comment	4.0	21.5	1620050994	-3.3084695	Personally, I find Rust syntax to be well-designed. At least, compared to any practical programming language I know.Quite a few times I was surprised that Rust breaks with some old patterns that were ...		stared
27052172	11.040795	-7.9893627	comment	4.0	12.0	1620232672	-3.2472308	Apparently I’m pretty much alone in thinking that Rust is a clumbsy, messy language. The syntax is all over the place. You get the feeling that there’s no design strategy and than anyone with half an idea is allowed to bolt on features.		mrweasel
27081320	11.014735	-8.0729065	comment	4.0	12.0	1620424630	-10.429747	Now they need an official Jetbrains IDE and we'll know Rust has made it.		oblio
27082454	11.183099	-8.014068	comment	4.0	10.5	1620433918	9.461855	Protobuf and gRPC are great, and AWS will continue to make sure developers can be successful using them with AWS. I’ll try to explain how we ended up at Smithy instead of using other existing tools.We...		mtdowling
27121958	11.004962	-7.984853	comment	4.0	16.0	1620759034	-3.2373066	I love Rust, but one thing that seems like a glaring design flaw is that adding a new trait implementation can change the behavior of existing code. This is very counterintuitive, because it seems lik...		ebingdom
27166943	11.342188	-8.000373	comment	4.0	12.5	1621098386	10.174592	Python and Go are also the main languages I've been using for the last decade. Noticing all the hype around Rust recently is prompting me to learn a new language. The last time I learnt a language fro...		vascocosta
27167851	11.2880745	-8.016235	comment	4.0	11.0	1621104755	10.184715	After years of dynamically typed / interpreted languages, I decided I wanted to learn a statically typed language and so I  to set out to trial both Go and Rust. Rust was a painful experience. I kept ...		giantandroids
27142458	11.012935	-8.032366	story	4.0	4.0	1620916205	-3.2936687	Ask HN: Am I too dumb for Rust?		throwawayrust0
27164131	10.970452	-8.1331	story	4.0	76.0	1621076190	-3.2259212	Oxide: The Essence of Rust (2020)	https://arxiv.org/abs/1903.00982	VitalyAnkh
27171978	11.003981	-8.006495	story	4.0	90.0	1621151463	-3.2050412	Verifying Vectorized Rust Revisited	https://project-oak.github.io/rust-verification-tools/2021/05/15/verifying-vectorized-code2.html	ingve
27249224	11.00297	-8.032498	comment	4.0	15.5	1621709410	-3.2678995	Rust is for writing blog posts about how it’s the most liberating, empowering and inspiring experience of your life. Boring technology like C and Java are for writing software.There’s already an OS co...		sk1459
27283671	10.935102	-8.217469	comment	4.0	21.5	1621982397	-3.4134302	"> The author states that ""one of iron’s unalterable properties is that it rusts"" yet further on acknowledges the existence of stainlessEven stainless steel rusts, just more slowly. Roughly 10-100x mor..."		wahern
27285125	10.969334	-8.16205	comment	4.0	11.0	1621993084	-3.220065	What are car mufflers made of that they resist rust so well?		mrfusion
27303213	10.974126	-8.091744	comment	4.0	16.5	1622124016	-3.2042313	I think completing the rewrite[1] of Tectonic[2] (Rust-powered XeTeX) has bigger potential and it's already working in many cases.[1] https://github.com/crlf0710/tectonic[2] https://tectonic-typesetting.github.io/en-US/		xvilka
27313705	10.899706	-8.033065	comment	4.0	14.0	1622197687	-3.2184963	"If a common question in a job interview is ""have you written any OSS projects that are used by others?"" and a positive answer is expected, then this is where we end up.Thousands of new developers, eag..."		marcus_holmes
27357678	10.958292	-8.137665	comment	4.0	10.5	1622566755	4.9497643	That's probably true for now. But only because there's no equivalent to SPARK for Rust yet. Rust + something like SPARK could be really amazing.		nicoburns
27385909	10.953467	-8.176739	comment	4.0	13.5	1622747139	-3.1631734	It's really remarkable how vehicle reliability has improved. I can remember how hitting 100K miles was this rather remarkable thing that probably required a lot of tender loving care. Now it's mostly ...		ghaff
27406074	11.322112	-7.9977593	comment	4.0	28.0	1622908471	10.170342	The DB space for Rust is a bit young, though there are several good projects like sqlx making it much more pleasant.Rust shares many of the benefits of Go:- statically linked binaries for ease of depl...		jkelleyrtp
27406300	11.336119	-8.019853	comment	4.0	17.5	1622909976	10.171475	I personally prefer Rust to Go for things that have hard resource requirements/limits, but there’s no denying that Go is much easier to program than Rust.You don’t need to know much more than Python/R...		foobarbazetc
27406360	11.004497	-8.04104	comment	4.0	11.5	1622910299	-3.1472082	In my experience, Rust code is relatively easy to read, even by developers with no Rust experience.Of course, you can write hard to read code. But that's not typically what comes out of a process of w...		cjg
27406544	11.0644245	-7.9879155	comment	4.0	13.0	1622911515	-3.1600573	Can you expand on “needs a C++ or Scala or Haskell background”? C++ would probably help you appreciate what Rust brings to the table, but I don’t see how any of them fit in when learning to use Rust in practice.		Cyph0n
37580667	11.371914	-8.03603	comment	4.0	33.5	1695187565	10.25092	> And how many instances would be required if Go/Rust would have been used?Zero. Because Shopify would have waited until Rust came out in 2015, instead of launching in 2006, and they would never have ...		berkle4455
27384207	11.0429535	-8.056371	story	4.0	119.0	1622739795	-5.0206676	Camera Calibration from Scratch Using Rust	https://www.tangramvision.com/blog/calibration-from-scratch-using-rust-part-1-of-3	reteltech
37613016	10.927057	-8.00233	comment	4.0	17.0	1695395124	9.13731	I _knew_ there will be Rust at the end.Sorry, not interested. I can’t think in Rust. Tried many times. Things like dynamically updated graphs are nearly impossible to write in Rust, and concurrency is...		atemerev
37638551	10.962994	-8.180646	comment	4.0	12.0	1695602974	-3.2484155	Corrosion is actually a great name for a Rust tool. I expect someone to steal that soon		sampli
37641074	11.033807	-8.011339	comment	4.0	13.0	1695632157	7.6680875	Here, I also want to mention vaultwarden which is an open-source Rust implementation of the server: https://github.com/dani-garcia/vaultwarden		woernsn
37643080	10.991635	-8.118901	comment	4.0	10.5	1695646901	-3.273038	I use rust as a case study about what happens when don't manage a need for users because of indecision and inflexibility.  I've generally been disappointed by the rust community because of inflexibility and the unfortunate infighting that spills out.  Just harmful to success.		drpossum
37676886	11.320695	-8.020417	comment	4.0	10.5	1695831240	10.1701145	Rust supports more software engineering best practices than Go.Some people say the learning curve for Rust is steep. But, in a way you're learning how to write safer code using the latest in language techniques.		ianpurton
37688318	10.997924	-8.014741	comment	4.0	20.5	1695902254	6.8668137	Seems like the first two issues would be harder to encounter in rust (raw pointers and double mutable borrows) but rewriting a huge project is a bad idea because of the massive amount of work involved...		bionhoward
12556896	10.938648	-8.14852	comment	4.0	15.5	1474553441	-3.219124	It won't end with Rust either since it is so appealing and easy to jump into unsafe territory.		bjourne
12614967	10.994898	-8.154899	comment	4.0	12.0	1475266150	6.6818676	If Mozilla wants to lower their engineering costs, wouldn't it make sense to start cutting back on projects like Rust?Don't get me wrong, Rust is an amazing project and I am happy it exists and gratef...		kinkdr
12739728	11.013539	-8.052093	comment	4.0	37.5	1476834088	-3.265728	I think the most astonishing thing to me about the Rust language project is not the language it self (sure it's innovative but there's also still a lot of work to be done to make it get out of your wa...		hetman
12739768	11.004809	-8.08186	comment	4.0	22.0	1476834542	-3.2340934	I think that's a side effect of making a welcoming community a priority.  The Rust Language Server grew out of feedback from the Rust Language Survey, in which many people responded that they wanted g...		JoshTriplett
12749554	10.956677	-8.195381	comment	4.0	13.0	1476933760	-3.165912	Disingenuous? I'm not lying, he is publicly a Rust enthusiast. It would be no less true if I said this about Steve Klabnik regardless of his contributions to Ruby on Rails.		thesmallestcat
12753900	11.02166	-8.006378	comment	4.0	11.5	1476981783	7.3990407	Trying to get ack or ag working properly on Windows is a bit of a pain. Now there’s an equivalent in Rust, rg, and I can get something that’s mostly superior to these others with `cargo install rg`. (OK, so I had to have installed Rust first. But I had done that.)		chrismorgan
12766461	11.351686	-8.006001	comment	4.0	35.0	1477099742	10.157875	It's important to note that Go and C have very different design goals from Rust. Go was never designed to have zero-cost abstractions (garbage collection being the most obvious outcome of this, but th...		pcwalton
12790389	11.005059	-8.037664	comment	4.0	13.5	1477420580	-3.2318695	Because people are subconsciously aware that an unstandardized language will never be appropriate for systems work. Rust is also hard to learn, very few resources, small community, disreputable mainta...		dysfunctor
12864075	11.001156	-8.048589	comment	4.0	22.0	1478182571	-3.2618716	A lot of people are arguing that new projects like this should use Rust. Like https://github.com/ctz/rustls.		oconnor663
12969725	11.026111	-7.994937	comment	4.0	11.0	1479320296	-3.209942	Does Emscripten support Rust already?		shmerl
12970105	10.98577	-8.021513	comment	4.0	15.5	1479322433	-3.2767346	Rust doesn't need to stop C++ to be successful. The market for programmers is already large enough to successfully support dozens of programming languages, and that market will only continue to grow. ...		kibwen
12970247	10.993374	-7.99245	comment	4.0	12.0	1479323134	-3.2698083	What's the place for Rust in the market?The distributed systems have already moved to Go (when it's not Java/C# :D).The system programming is done in either C or C++. (Depending on history and availab...		user5994461
13052997	11.214911	-7.997996	comment	4.0	16.5	1480300044	10.163678	Would anyone choose C for a new systems project with no legacy baggage or dependencies, in a world with Rust and Go?Note that Go does not entirely compete in the same space, and Rust is only starting to gain traction.		cygx
13055128	11.0383	-8.010841	comment	4.0	10.5	1480338430	-3.175482	I was trying to teach myself some Rust and found the state of the documentation to be very frustrating.  The core language is decently documented with the manual, but the standard library documentatio...		jandrese
13098744	11.001763	-8.0937	comment	4.0	17.0	1480824639	-3.2277236	People still care about Rust?After the quadratic hashes and rumored memory issues, I'd have thought people would've dropped interest in it by now.		cyphreak
13097050	10.967849	-8.147006	story	4.0	205.0	1480792776	-3.186645	24 days of Rust – Rayon	https://siciarz.net/24-days-rust-rayon/	zsiciarz
13138271	11.055815	-8.035205	story	4.0	76.0	1481285359	7.476189	Fractalide: Simple Rust Microservices	https://github.com/fractalide/fractalide	dmmalam
13246437	11.076316	-8.009011	comment	4.0	14.0	1482518368	7.61196	Edit: should preface this by saying the framework looks really impressive. I've been looking for a Rust web framework to settle on and this is the most appealing.It's funny to note how much something ...		aaron-lebo
13247476	11.081979	-8.033095	comment	4.0	10.5	1482530992	7.5430894	I suppose this an advance for those already using Rust but the core message on the front page doesn't speak to me as a non-Rust person.FTA: Rocket is a web framework for Rust that makes it simple to w...		rubyfan
13267039	11.051982	-8.027944	comment	4.0	16.5	1482879968	-3.3497841	Rust's had great IDE support for more than a year now.- There's Atom with Tokamak, which you must also install racer and clippy via cargo to get rapid in-line linting.- Then there's Visual Studio Code...		mmstick
13272880	11.018343	-7.990165	comment	4.0	16.0	1482952914	-3.2074625	"A sales pitch asking others to help you with your sales pitch. That's a good marketing concept. It's similar to ""ordinary people say why X is great"" ads.Beyond the safety issue, I'm still not clear on..."		Animats
13277624	10.994122	-7.9885297	comment	4.0	12.5	1483024066	-3.3167284	ANSI Common LISP lives up to that standard. POSIX AWK lives up to that standard. C's versioning lives up to that standard. ksh93 lives up to that standard. All of those are backward compatible, and ca...		Annatar
13277422	11.362712	-8.012481	comment	4.0	16.5	1483021817	10.198799	While that is true, in Go, almost no libraries are written to use non-stable features.  This is not the case in Rust.		nordsieck
13281237	10.953257	-7.989428	comment	4.0	11.0	1483054973	-3.2724223	> > I think the safety aspect of Rust appeals to a lot of beginning programmers.> Is that a bad thing?The appeal to beginners is fine, maybe even a good thing, but the condescending comments from begi...		zerofan
13281274	11.020962	-8.048067	comment	4.0	11.0	1483055241	-3.1867976	"I get the opposite feeling. When I write in Rust, I have feeling ""that's how programming shouldn't work"". The syntax is awkward and you are expected to spend weeks to get anything done. Ultimately, it..."		newsat13
13281280	10.993255	-8.169414	comment	4.0	14.5	1483055315	6.723415	If we were betting money, I'd put mine on Golang over Rust just because of the piles of money and effort Google keeps pouring into it.  Rust is a little cooler, but I just don't see Mozilla having enough resources to keep-up the momentum long-term.		jstewartmobile
13315247	11.317175	-8.0042	comment	4.0	13.0	1483497723	10.197262	I didn't understand why rust and go are natural alternatives to C. Wouldn't C++ be a more natural option? (Despite the fact that both go and rust are developed by third party companies)		rafinha
13315837	10.954489	-8.101576	comment	4.0	12.5	1483506661	-3.2253416	Why does 90% of this huge comments section revolve around Rust? Haven't we had enough of the same already? Yes, we know it provides memory safety guarantees. Yes we know you hate everything written in...		nurettin
13321309	11.392568	-8.006319	comment	4.0	13.0	1483558363	10.217152	For better or worse, I think Go sucked up a lot of the metaphorical oxygen for similar languages.  Swift and Rust are in different niches and don't compete head to head with Go, so this isn't a real p...		curtis
13324332	10.97806	-8.148014	comment	4.0	12.5	1483584932	6.703626	Case in point. Someone shows that mozilla actually employs someone who adovcates for rust on public forums - and they are down-voted.		lacampbell
13375935	10.998242	-7.9942207	comment	4.0	43.5	1484157767	-3.2269707	This is actually something about the code samples in Rust docs that irks me a bit.My view is that sample code such as this should be as idiomatic as possible and that means providing a sample demonstr...		sidlls
13430423	11.189115	-8.097244	comment	4.0	19.5	1484774694	10.195654	"Rust fans are trying to avoid ""vs"" articles, would be great to see such endeavor from Go fans too."		EugeneOZ
13430569	11.285161	-8.04174	comment	4.0	12.5	1484775827	10.182755	I'm not quite willing to dismiss Rust merely for being hard to learn, but after poking around in both Go and Rust for a few weeks, I feel like I could build a project in Go (slowly, and with a lot of ...		SwellJoe
13431053	11.347172	-8.043731	comment	4.0	14.0	1484779044	10.1816435	>>People who say Rust is hard are probably skipping on reading the really well written Rust book.Do you need to read a really good Go book to be productive in Go? If not, I think the OP's point stands, no?		enraged_camel
13431217	11.37376	-8.04881	comment	4.0	11.5	1484779989	10.196183	From the outside, Rust and Go were both originally developed by corporations eventually with community involvement. The credit line for Rust has been changed from the original Mozilla to the Rust Proj...		CalChris
13471793	11.029723	-7.9961085	comment	4.0	14.0	1485270090	-3.2450082	> Even if Rust is much harder than alternatives instead of just different, and even if that's inherent in borrow checking, it's not clear that it's still not worth it in the long run.One obvious argum...		Bartweiss
13472820	11.031978	-8.009706	comment	4.0	13.5	1485275725	-3.378387	> My point is that C++ has a learning curve that's as steep as Rust's. Rust is a C++ replacement. So this isn't a disadvantage for Rust.As someone who learned C++ first and later Rust, no it isn't.  R...		braveo
13559016	10.974205	-8.142432	comment	4.0	30.5	1486120035	-3.2189858	I always see Rust this and Rust that everywhere. Do people mostly think it's a trend or does it have it's merits?		westmeal
13559098	10.975935	-7.9920816	comment	4.0	11.0	1486121676	-3.1201196	">recommend beginners to learn rust before CThis is one thing I've been musing over. Would a beginner see the benefits of rust without first understanding the drawbacks of C?In my opinion they'd just see it as ""this annoying borrow checker thing"" and find it frustrating."		timlyo
13577728	11.051643	-8.006349	comment	4.0	11.0	1486371535	-3.2930121	> What Rust Can Do That Other Languages Can'tBut other languages are Turing-complete too...		mnw21cam
13578992	11.027189	-7.9897194	comment	4.0	11.5	1486385760	-3.3203886	"> For line of business apps, it is inaccessible and the safety dial is turned up too far.My employer has a ""line of business app"" written in Rust. Here's what we're learned:1. Rust does have a learnin..."		ekidd
13583623	11.028561	-8.09692	comment	4.0	27.0	1486413441	-3.211435	"Don't change the language to make it easier (unless that can be a free lunch), but get someone doing a ""Today in rust"" or ""Doing X in rust"" blog/vlog. Also please get some sort of RNG into the main language (not as a crate)."		DeepYogurt
13584104	10.994505	-8.087402	comment	4.0	14.5	1486415917	-3.233955	>  What about the warts part?I'm not sure enough time has passed to tell what Rust's warts truly are. I always joke String should have been called StrBuf...I do this, yes. This is one of the reasons I...		steveklabnik
27539803	11.063073	-7.9975414	comment	4.0	13.0	1623939347	7.452411	> Take pleasure in writing more codeVery common trap. Most of us grew up with a natural enjoyment of programming, so it’s easy to lose sight of the fact that our job as engineers isn’t to produce more...		PragmaticPulp
27594211	11.022996	-8.016951	comment	4.0	13.5	1624381475	7.3058505	Update: We do support !rust as well (and all of DDG's other bangs).Brave Search supports many shebangs, but I don't believe we've added support for `!rust` yet (we do have `!mdn` and `!so` though). I'll submit a request to add a `!rust` option too!		jonathansampson
27547099	10.96315	-8.048508	story	4.0	24.0	1623987228	-3.3037126	Google Wants Rust in the Linux Kernel	https://www.phoronix.com/scan.php?page=news_item&px=Google-Wants-Rust-In-Kernel	zathan
27632821	10.974251	-8.06546	comment	4.0	12.0	1624638168	-3.1837742	This is more of a question to anyone that may have insider informationIt is normal for any large organization to be interested and use many languageBut is microsoft really getting invested and interes...		systems
27746655	10.946754	-8.019388	comment	4.0	71.5	1625569162	-3.2458017	"  We have been in contact with a set of companies and academia members
  that would like to use Rust as a second language in the kernel. Some
  of them have already started to evaluate Rust for their ..."		0x008
27746928	10.968642	-8.150636	comment	4.0	12.0	1625570895	-3.224525	Seems driven by people VERY passionate about Rust.		geenat
27749468	10.973428	-8.144401	comment	4.0	14.0	1625583430	-3.2018282	It has an undertone implying some sort of strange conspiracy amongst rust people. Generally to be suspicious of something means there is something nefarious going on.It has an implication that Linux i...		gpm
27918577	10.997662	-8.0391	comment	4.0	13.0	1626960503	-3.2249887	"This whole ""written in Rust"" as if it was a feature BS must stop someday.Get the project 'A' features and compare with project 'B' features, the strength and weakness of programming languages will be ..."		oscargrouch
27939922	10.930407	-8.075297	comment	4.0	13.0	1627125644	-3.2236483	>> it has a lack of testing and code reviewIs that really true? I mean my first reaction is that the linked article / thread is a direct counterpoint. All the review and testing the rust facilities ar...		CraigJPerry
12011445	10.96913	-8.133778	comment	4.0	13.0	1467318895	-3.217904	"That's a good point. Since this is apparently a self-selected sample of people interested in Rust, a 1/3 ""No"" report is a problem.If the survey was from a random sample of all programmers, the usage level would be much lower."		Animats
12014621	10.9720335	-7.993188	comment	4.0	20.0	1467362197	-3.2479544	> expect severe bugs, crashes, and missing functionality.I really don't mean this in a snarky way: wasn't this kind of thing supposed to be obviated by the switch to Rust? It often seems that every other post about Rust on HN says that if it compiles, it works.		pekk
27948612	10.96607	-8.153563	story	4.0	27.0	1627215369	-3.3351316	A rusty green early ocean? (2017)	https://www.sciencedaily.com/releases/2017/01/170131080007.htm	detaro
27998489	10.994402	-8.077074	story	4.0	97.0	1627577222	-3.1736069	Rust Audio Development Forum	https://rust-audio.discourse.group/	thibaut_barrere
12056345	10.981189	-8.136949	comment	4.0	13.0	1467992993	-3.1998806	"I understand the world play, but perhaps it's a misunderstanding of Rusts name origin ?
https://www.reddit.com/r/rust/comments/27jvdt/internet_archa...
It's after a fungus
https://en.wikipedia.org/wiki/Rust_(fungus)"		cannonpr
12078873	10.976854	-8.144986	comment	4.0	21.5	1468331283	6.803481	Am I'm reading either the headline or the announcement wrong?As I read it, they are not shipping Rust but a component written in Rust.    > For this reason, Ralph Giles and Matthew Gregan built Mozill...		Noseshine
12136857	11.013264	-7.987935	comment	4.0	10.5	1469109721	-3.2058928	When should I use this?Like, which sub set of modules are better as a native version and which sub set of these are better written in Rust?		k__
12142082	10.969685	-8.151171	comment	4.0	32.0	1469169811	-3.175591	The Rust leadership tolerates harassment and threats as long as its against the right wing. One of Rust's top people wants to violently purge the tech community.https://archive.is/BtDaA		im4w1l
12177967	10.959436	-8.009272	comment	4.0	24.0	1469673041	-3.2398672	I think rust needs to slow down in this regard. I have been with Python since 1999 and the stdlib has held it back, I have also used Scala and Haskell and have witness the mess that platform libs on e...		sitkack
12065912	10.997211	-8.005253	story	4.0	191.0	1468164742	-3.2596412	The Rustonomicon: The Dark Arts of Advanced and Unsafe Rust Programming	https://doc.rust-lang.org/nomicon/README.html	jvns
12072738	11.02484	-8.011723	story	4.0	30.0	1468258530	-3.0928493	Tarpc: An RPC framework for Rust with a focus on ease of use	https://github.com/google/tarpc	peeyek
12327065	11.023344	-8.030157	comment	4.0	12.0	1471707999	-3.2049894	We are very interested in making Rust more learnable, and are taking active steps to make it more so:1. I am re-writing the book with the knowledge we've gained watching people try to learn Rust over ...		steveklabnik
12328035	11.067913	-8.138336	comment	4.0	17.0	1471722340	10.265004	i would say rust is the new kid on the block, go is old news.		dominotw
12405728	11.001048	-7.998463	comment	4.0	11.0	1472742083	-3.245496	> Fedora's rationale for including Rust stems from both the language's growing popularity and its potential relevance to Fedora's user base.Maybe this makes me unique, but I don't think so; unless the...		bluejekyll
12410506	10.973708	-8.161487	comment	4.0	13.5	1472784913	-3.1984973	what do you do about rust?  The chrome coating on my grill comes off and the iron underneath rusts.  The wire bristle was the only thing working.		tmaly
