id	label	hovertext	author	x	y	type	relevance	size	year	umap1d
23677266	Is it really a distro? Surely a dist	Is it really a distro? Surely a distro is a collection of tools, applications, and a kernel that form an operating system.Haiku is a single project operating system, so when they make a release it's not a distribution as such, is it?We wouldn't call Windows 10 a Windows distro.	mprev	17.09855	5.681462	comment	4.0	16.0	1593436606	15.554438
29391354	> drivers for modern hardwareHow wel	> drivers for modern hardwareHow well does Haiku work on bare iron nowadays? Any tested laptops - better, any repository of tested brand/models, or of tested hardware in general?	mdp2021	17.100788	5.6851945	comment	4.0	14.0	1638275046	15.555954
29391703	Could it be possible to shove the li	Could it be possible to shove the linux kernel under the Haiku userland?   This would give access to all drivers available in linux.  You could sacrifice compatibility with the linux or POSIX userland.   A bit the same thing as WSL1, but from Linux tu Haiku.	hyperman1	17.099884	5.6838164	comment	4.0	31.0	1638277953	15.554093
34340167	I am confused about this:> Haiku, li	I am confused about this:> Haiku, like BeOS before it, is not a Unix. If you actively like Unix, and what you want to do already works well on Unix – any Unix, and that includes macOS, as well as Linux and FreeBSD – then you probably won't see much appeal here.Don’t they support the same set of terminal command as in other Unix-like systems? From what I saw [1] there aren’t much difference. Well that is what what people care about unix, right?[1]: https://www.haiku-os.org/docs/userguide/en/applications/list...	chazeon	17.100145	5.68442	comment	4.0	15.0	1673454084	15.553535
17441662	Tried Haiku recently and was much im	Tried Haiku recently and was much impressed with speed and stability but without being able to scale to 1920x1080 and having no multi-user capacity it's hard to see how this fits into modern computing environment.. still, one can hope the project sees improvements - I've tracked Haiku along with ReactOS for potential real world usage for years now.. so.. any day now.EDIT: congratulations with LibreOffice port, that does make a difference in terms of usability.	dingdingdang	17.100723	5.6850367	comment	5.0	29.0	1530540079	15.555809
37640156	I'm very sorry but someone's going t	I'm very sorry but someone's going to have to translate this for me, please? bonus points for a successful haiku.	anon_cow1111	17.100899	5.6860847	comment	5.0	17.0	1695622268	15.5575285
33674449	Serenity is still on the list of thi	"Serenity is still on the list of things I need to try out. Can't say anything about it at the moment.But I have to admit that regardless the hype around it I don't think that it's particularly interesting. I see it as just yet another Unix clone; with exactly zero innovation behind it. Even Redox, which I consider being a complete failure, tried some seemingly new concepts (and uses a micro kernel which makes it at least a little bit less ""mainstream"").Haiku is rock solid. Very interesting project! But I would not put it in the basket with toy or research OSes, though. It's based on something that had even quite some commercial success. But yes, Haiku is definitely an ""alternative OS"". It would have been better if I worded this part differently, I guess, as I'm mostly interested in ""experi"	still_grokking	17.100058	5.684968	comment	5.0	26.0	1668890476	15.553842
35186999	"  => write a haiku about leaves
  Au"	"  => write a haiku about leaves
  Autumn's golden hues -
  Leaves of red, yellow and blue! \
  #haikupoetry #leavesshort[1] > segmentation fault  ./chat

Interesting."	blintz	17.100664	5.68597	comment	5.0	19.0	1678994651	15.554832
27871460	Other than BeOS nostalgia: is there 	Other than BeOS nostalgia: is there any good reason to prefer Haiku over [name any modern Linux distribution]? I can see that it’s fun to hack on an OS and make it your own. But is Haiku actually known to do anything particularly well that other operating systems struggle with?	hankman86	17.099901	5.6836834	comment	5.0	20.0	1626595405	15.553712
26055781	Haiku Activity Report – January 2021	Haiku Activity Report – January 2021	mondoshawan	17.10082	5.6859894	story	5.0	115.0	1612713080	15.559162
18771321	I'm highly fascinated between Haiku 	I'm highly fascinated between Haiku and ReactOS, but I havent had a chance to use both in a while. I want them to become available. I really appreciate that Haiku was meant to be a remake of BeOS (iirc) and it does a fantastic job. I feel like we don't do enough OS research like we used to. We've started to dive into making new languages like Rust and Go, but I guess the next wave I'm waiting for is new and interesting Operating Systems.	giancarlostoro	17.100853	5.685166	comment	5.0	30.0	1545935228	15.554276
39627030	Haiku OS in my opinion solves this b	Haiku OS in my opinion solves this better by basing everything on default font size (in pixels). Eg it defaults to 12px, I used 20px for a 3840x2160 monitor. Some GUI widgets scale based on this. All text (when using be_default_font) scale based on this. Spacing / layout depends on this. The key difference (compared to a global x1.5 scaling factor) is that developers of each app decide how to use this information, so different parts of the GUI are scaled disproportionatily. Sloppy apps ignore this, but the devs are quickly notified. So you end up with text larger but GUI widgets can grow dis-proportionatily, so you can fine tune what is 125%, 150%, etc. Eg. ScrollBar can be 125%, toolbar 150%, text 233%. Haiku has had this since the beginning (even BeOS in the 90’s had this). By 2024, almo	smallstepforman	17.09939	5.6829114	comment	6.0	26.0	1709804423	15.552608
27956408	Why, when it basically apparently do	Why, when it basically apparently doesn't run on laptops, and when it fails to start it provides no hint whatsoever about what to do next, is there no information about what to do next anywhere on the Haiku web site?  Why, if your position is that there's a list of hardware (a very well-hidden one, I might add) on which I should be running this, is that list not front-and-centre so I don't waste my time trying to boot it on anything else?Why, to put it more briefly, does Haiku insist on being treated as a serious operating system when it simultaneously clearly runs on less stuff than most other OSes and yet requires us to pretend that it's in the same class as those other OSes?(This doesn't happen with ReactOS. But then they don't have the social disability of resolutely insisting that we 	handelaar	17.100666	5.6849003	comment	6.0	28.0	1627281754	15.553941
28306732	Hello HN, I'm the developer that has	Hello HN, I'm the developer that has been hired. Happy to answer questions!Or you can go make a (tax-deductible) donation to Haiku, Inc. directly to support my contract: https://www.haiku-inc.org/donate/	waddlesplash	17.100206	5.685258	comment	6.0	41.0	1629924386	2.039392
22373894	The idea of storing the icon in the 	The idea of storing the icon in the inode is interesting.Conventionally, when displaying a folder, a file manager identifies the _type_ of each file, and then looks up the appropriate icon.Does Haiku instead display whatever icon is in the inode?  Could a wordprocessor document masquarade as a spreadsheet, and such?I can't think of any security implications of this, nor think of any real mischief that a developer might cause, but I also can't think of any big advantage of it either.  What use-case for having the whole icon in the inode instead of just a mime-type that is then used to look up the (already parsed, and shared) icon?	willvarfar	17.093534	5.673257	comment	6.0	22.0	1582192130	15.542106
34109495	Oh what would have been what could h	Oh what would have been what could have been had Apple bought Be instead of Next. We'd likely not have any iPhones or a 2.5T Apple but we could have had some really cool software. BeOS and now Haiku will always have a special place in my nerd-head.consider sponsoring the team here: https://github.com/sponsors/haiku	gigatexal	17.100113	5.684882	comment	6.0	41.0	1671822509	15.553146
27130075	Haiku is ideal for embedded graphica	Haiku is ideal for embedded graphical systems, since it’s designed as a single user low latency unified system. As the technology stack is unified (from the higher level user space to low level kernel), with a unified desktop environment, unified IPC mechanism, unified file system, unified audio and media system etc, it allows system builders to make lean embedded applications and tools. Case in point - the Medo media editor which does 4K videos, dozens of OpenGL pluggins and binary addons, and the entire multilingual package is 1.28Mb. Crazy efficiency due to being a cohesive integrated system.Haiku is the ideal system for a Risc-V embedded device (think car console, tablet, media centre, info kiosk etc)	smallstepforman	17.100803	5.6849985	comment	6.0	63.0	1620826153	15.554415
31535053	Wikipedia Haiku	Wikipedia Haiku	testingathing	17.100471	5.686035	story	6.0	26.0	1653686384	15.555744
35843775	Progress on running Haiku OS on Visi	Progress on running Haiku OS on VisionFive 2 RISC-V dev board	nixcraft	17.100838	5.6853766	story	6.0	141.0	1683396256	15.553813
17472907	The State of Rust on Haiku	The State of Rust on Haiku	squiguy7	17.099852	5.6853824	story	7.0	232.0	1530895635	15.555208
33605667	I worked on Haiku this summer as par	I worked on Haiku this summer as part of Google summer of code, and it just made me wish their attitude towards user experience was more prevalent in mainstream OSs.It's little things like errors automatically prompting you to open a graphical debugger or processes being grouped by application. There's sensible UX that doesn't expect me to be a wizard to understand what's going on or how to dig deeper.Obviously it has rough edges (as, well, honestly all operating systems do), but the things that do work work really well.	dominicm	17.100882	5.685398	comment	7.0	32.0	1668490184	15.554354
34110640	3 days ago, I installed Haiku on bar	"3 days ago, I installed Haiku on bare metal: an old PC from ~2004. I was not aware that a new version was planned at that time, but the upgrade was completely smooth.My idea when I installed Haiku was to make my own version of the ""old computer challenge""[1], with an emphasis on using GUI apps.Similarly to @probono (a FOSS dev), I also found Haiku ""shockingly good""[2] at being a lightweight, responsive, easy-to-use desktop OS.After some patching, I was even able to compile Tectonic[3], a modern LaTeX engine written in Rust, and Quaternion a Matrix client supporting E2EE[4]. All that running on a single core Athlon 64 and 1.5GB of RAM.I posted some screenshots in a Mastodon threads if you are curious[5] (but my posts are in french sorry :/). And of course this comment is posted from Haiku!["	superboum	17.099989	5.6845098	comment	7.0	32.0	1671829732	15.554003
29391190	Haiku would be an OS I would enjoy r	Haiku would be an OS I would enjoy running every day if there were drivers for modern hardware and it ran the software I need. I stil hope it will get to that point one day. :)	DeathArrow	17.100834	5.685225	comment	8.0	68.0	1638273328	15.554485
29757451	Giving Haiku Beta 3 a try	Giving Haiku Beta 3 a try	pjerem	17.100744	5.6860633	story	8.0	113.0	1641036392	15.554039
23469853	As a Haiku developer (and user, natu	As a Haiku developer (and user, naturally!) I have to disagree. Obviously native software would be preferred, just as it is on macOS, but I am pretty sure that macOS users will tell you that they still prefer macOS, even if they are using Firefox, or JetBrains, or Inkscape, etc., yes?The Linux desktop is a horribly fragmented and fragile ecosystem. Haiku lacks a lot of features the Linux kernel has, but the overall system architecture and design is significantly cleaner and less fundamentally fragile.	waddlesplash	17.099989	5.684308	comment	9.0	64.0	1591730468	15.5534315
18769814	Haiku Beta is finally here	Haiku Beta is finally here	octosphere	17.100761	5.6860876	story	9.0	208.0	1545923352	15.558166
28306253	I like the idea of more operating sy	I like the idea of more operating systems to pick from. I'd love to try Haiku or BSD one day soon. What motivates people to invest in these very niche systems?I'd love to play around with them for fun but is there more to it?	xupybd	17.10023	5.684442	comment	9.0	47.0	1629922065	15.565091
38318513	BeOS and Haiku allowed exposure to k	BeOS and Haiku allowed exposure to kernel graphics buffers decades ago (https://www.haiku-os.org/legacy-docs/bebook/BDirectWindow.ht...), which bypass the roundtrip to compositor and back. A companion article describing the design is here (https://www.haiku-os.org/legacy-docs/benewsletter/Issue3-12....)After 25 years, GTK joins the party …With no native video drivers, moving a Vesa Haiku window with video playback still seems smoother than doing the same in Gnome/Kde under X11.	smallstepforman	17.098537	5.6818995	comment	9.0	63.0	1700308803	15.550692
14617453	Porting Swift to Haiku	Porting Swift to Haiku	wesleyhill	17.100822	5.6860285	story	10.0	102.0	1498201262	15.556309
24756787	Haiku: Call for Wallpapers	Haiku: Call for Wallpapers	bitigchi	17.100845	5.6859193	story	10.0	116.0	1602523141	15.554553
13200633	Haiku booting in UEFI mode	Haiku booting in UEFI mode	return_0e	17.099716	5.6842704	story	10.0	226.0	1481981443	15.5546
27955986	I think at this point I'm on the fou	"I think at this point I'm on the fourth consecutive laptop that this just won't ever boot on. This time, however, it just says ""Haiku"" on a splash screen and then stops completely. No errors, no debug message window, nothing.(At this point usually someone here insists that I file a bug. Which I won't do because a) I have no useful information to put into a bug report and b) I think after eleven years of this nonsense it's probably in there about 200 times already anyway.)Oh, look. Can't even press the space bar to get an unintelligible error anymore."	handelaar	17.100666	5.6851645	comment	10.0	66.0	1627277060	15.554777
27955755	Haiku Beta 3	Haiku Beta 3	bitigchi	17.100061	5.685389	story	10.0	176.0	1627274650	15.558406
28241255	20 Years of Haiku	20 Years of Haiku	bitigchi	17.100468	5.68565	story	10.0	207.0	1629421542	15.556262
34338487	Haiku beta 4: a thing of beauty	Haiku beta 4: a thing of beauty	bitigchi	17.100546	5.6859627	story	11.0	112.0	1673445491	15.554478
28305191	Haiku has hired an existing contribu	Haiku has hired an existing contributor to work on Haiku full-time	aarroyoc	17.100563	5.685884	story	11.0	284.0	1629916422	15.554662
23676975	A decidedly non-Linux distro walkthr	A decidedly non-Linux distro walkthrough: Haiku R1/beta2	Tomte	17.100447	5.684782	story	12.0	83.0	1593433996	15.554388
18893648	IntelliJ IDEA and PyCharm Running on	IntelliJ IDEA and PyCharm Running on Haiku	return_0e	17.098917	5.6814766	story	12.0	242.0	1547331994	15.55198
27867941	HaikuOS running on RISC-V hardware (	HaikuOS running on RISC-V hardware (HiFive Unmatched)	iamnotarobotman	17.100233	5.6848497	story	13.0	306.0	1626548272	15.554295
34879304	Haiku package management	Haiku package management	julicen	17.100212	5.6843576	story	15.0	217.0	1676975392	15.548488
18099127	Haiku R1/beta1 has been released	Haiku R1/beta1 has been released	hakfoo	17.100647	5.685492	story	15.0	296.0	1538205613	15.55561
23171263	Error messages in Haiku?	Error messages in Haiku?	boredgamer2	17.100792	5.686121	story	15.0	164.0	1589400720	15.554384
39005505	Haiku OS: The Open Source BeOS You C	Haiku OS: The Open Source BeOS You Can Daily Drive in 2024	rcarmo	17.10039	5.6842146	story	16.0	124.0	1705349698	15.554873
12420763	500 Byte Images: The Haiku Vector Ic	500 Byte Images: The Haiku Vector Icon Format	luu	17.098614	5.682784	story	17.0	265.0	1472931712	15.556788
22373982	The problem with vector icons is tha	The problem with vector icons is that they don't really scale as well as people seem to think.Just because you can rasterise it at any size, doesn't mean that the resulting icon makes sense at that size. When icons are really small you usually want a simpler version of the same icon for it to remain recognisable.You can see it clearly in the examples used in the article for the 16x16 icon. Compare the bitmap version (https://www.haiku-os.org/docs/userguide/images/apps-images/i...) to the vector version (https://www.haiku-os.org/docs/userguide/images/apps-images/i...) , the bitmap version is specifically made for the low resolution and is still very clear, the vector version is a blurry mess.To properly handle this you'd need either multiple versions or a vector format that can scale the am	Aaargh20318	17.097685	5.681053	comment	17.0	84.0	1582193402	15.547942
22373422	500 Byte Images: The Haiku Vector Ic	500 Byte Images: The Haiku Vector Icon Format (2016)	cosmojg	17.099901	5.684688	story	19.0	265.0	1582184724	15.54735
18583722	What makes BeOS and Haiku unique	What makes BeOS and Haiku unique	valeg	17.100836	5.685654	story	22.0	303.0	1543776183	15.55442
34109349	Haiku R1/beta4	Haiku R1/beta4	waddlesplash	17.10046	5.6857414	story	28.0	440.0	1671821650	15.555401
23469209	Haiku R1/beta2 has been released	Haiku R1/beta2 has been released	waddlesplash	17.100864	5.685986	story	29.0	383.0	1591726983	15.55545
