id	x	y	type	relevance	size	year	umap1d	hovertext	url	author
27984310	12.62729	-7.141696	comment	4.0	17.0	1627483038	12.339358	I've listened to only 2/3 of it, but: he promotes Crystal+Lucky (crystal is compiled) as good replacements for Ruby and Rails.  The second part of his talk is about promoting a new variant of open lic...		georgeam
27986474	12.614764	-7.4626207	comment	4.0	19.5	1627493340	12.913154	Twitter considered migrating from Ruby on Rails to Erlang 11 years ago (but ultimately chose Scala due to the Java tie-in).https://news.ycombinator.com/item?id=2825689I've always wonder how the Erlang...		alberth
12003746	12.573517	-7.0647407	comment	4.0	11.5	1467226243	12.389497	Point 6. freaks me out, because I am not sure if I am one of them.Also, your first three points puts Ruby pretty much out of the picture.EDIT: Mentioned Ruby because that's what I am working on right now, after Java and Scala		sidcool
12012424	12.593934	-7.5005865	comment	4.0	25.5	1467326613	12.9175005	> more maintainableI get that the Erlang VM is really nice for some things (I made my first contribution to it in 2004!), but I'm curious about the above statement, as I haven't had the time to dig into Elixir/Phoenix yet.		davidw
12047545	12.688882	-7.3986654	comment	4.0	12.0	1467867492	12.858934	You seem to be familiar with Elixir. May I ask you some questions?. What kind of web applications are you building with it? I'm asking what kind of web apps or scenarios do you think Elixir is particu...		emluque
12073209	12.976434	-7.6714053	comment	4.0	37.5	1468262179	-12.751601	For those unfamiliar with elm:I would sum it up as:-) a stripped down, simplified version of Haskell-) with a good concept for side effects-) that compiles to Javascript-) gearded towards writing type...		the_duke
12075716	13.00215	-7.689033	comment	4.0	11.5	1468281539	-12.766174	> Otherwise, it will dwindle away soon into the endless annals of forgotten languages.The opportunity I perceive for Elm to avoid this fate is Phoenix adopting it in the default new project, in a similar fashion to Rails adopting CoffeeScript.		inopinatus
12108435	13.133249	-7.3054934	comment	4.0	17.0	1468715326	-12.478899	This has singlehandedly made me interested in learning more about prolog. I mean, if you can do things like that that simply... Holy crap. No wonder so many lisps incude a prolog implementation of some sort.		qwertyuiop924
12161993	13.145076	-7.2923574	comment	4.0	11.5	1469484613	-12.490367	"Oh, Prolog.  I once wrote a hardware configuration in Prolog.  (Dependency resolution - rules like ""An A requires a B or a C"".) The configuration part was fine.  Trying to write a menu system in pure ..."		Animats
12193711	12.609226	-7.8478007	comment	4.0	20.0	1469897890	5.9323225	Characteristic examples from the book Doing Bayesian Data Analysis 2nd edition [1] programmed in Clojure and OpenCL to run on the GPU. Much, much faster than Stan or JAGS!The library used (Bayadera) i...		dragandj
12101191	12.731189	-7.3708224	story	4.0	3.0	1468593077	12.863483	Ask HN: Crystal and Kemal or Elixir and Phoenix?		galfarragem
12062454	12.646901	-7.036299	story	4.0	86.0	1468086392	-10.394654	Why it's important to optimise the tricky parts of Ruby [video]	https://www.youtube.com/watch?v=b1NTaVQPt1E	chrisseaton
12223623	12.674356	-7.4361424	comment	4.0	15.0	1470289222	12.90839	Elixir gets plugged so often in other-language threads - whether it's Julia or Ruby or, like here, Crystal - that if it wasn't FOSS I'd have decided it's being astroturfed.I guess it's a good thing that people like it so much, but it's really starting to feel marketing-y by now.		sundarurfriend
12223745	12.620541	-7.2780204	comment	4.0	10.5	1470291526	10.281484	Maybe the makers of Crystal need to take a leaf out of Go's book.  Despite the Go creators not being windows users (AFAIK), they support Windows as a primary target, to help adoption, I assume.Of cour...		kristianp
12223840	12.63156	-7.263856	comment	4.0	12.0	1470292973	-11.24265	"My biggest concern if i were to try to use Crystal in production would be the lack of ""googleability"". I'm guessing your team is very familiar with the language, so it's not as much of a problem that ..."		coltonv
12223908	12.559387	-7.0433135	comment	4.0	13.5	1470294237	12.381749	Stopped reading when I saw the `end` keyword... the most annoying part of Ruby.Edit: I'm getting hella downvoted but I'm leaving this here. Ruby fanboys can't silence me!!! ;)		welder
12223568	12.59407	-7.2622747	comment	4.0	15.0	1470288451	-11.218645	I'd like to put out there that Crystal is absolutely awesome. The language itself is Crystal clear, but the language documentation and API documentation - oh my!I had never worked with compiled langua...		Svenskunganka
12223487	12.616016	-7.2577	comment	4.0	32.0	1470287020	-11.225175	The really important questions in any modern language:(0) Does Crystal have a lot of undefined behavior like C?(1) Does understanding Crystal programs require a lot of trial and error just like in Rub...		catnaroek
12231146	12.646724	-7.8871884	comment	4.0	22.5	1470392443	-11.142311	"Clojure is currently the sexy lisp du jour.When I first learned Clojure, to me it was the first time programming truly clicked with me. That first time I ever felt that spark of ""oh my god, so that's what programming can be like!"""		hbex5
12301988	12.513854	-7.0465574	comment	4.0	11.0	1471398737	12.342596	1.day?  I confess to not being a Rubyist, but does that require monkeypatching the base int class?I don't see anything unreasonable about Pendulum's interface.  Let's let Python be Python and Ruby be Ruby.		bjt
12305178	12.600818	-7.8668075	comment	4.0	10.5	1471445905	-11.151029	Can you do similar stuff with clojure or Scala? Maybe there's a way to avoid the bad parts		wry_discontent
12321568	12.6400175	-7.849695	comment	4.0	11.0	1471626557	-11.039167	"> adopt the idiotic ""-p convention"" which doesn't even really exist in Lisp any more.Do you have a better way of signaling to the reader that a function is a predicate? I don't write a ton of Common L..."		emidln
12346062	12.577117	-7.2029057	comment	4.0	12.5	1471976303	-11.199423	Very interesting point of view.I see a fourth option:- compile the scripting language to C (like Crystal for Ruby)		vmorgulis
12390979	12.647154	-7.866954	comment	4.0	11.0	1472570741	6.552899	Why not just use Clojure?You've got datomic on the server and datascript on the client, transit on the wire, reader conditionals to share code and much more. Plus everything can be modified as its run...		jeremiep
12402481	12.631364	-7.80932	comment	4.0	14.5	1472690254	-11.098305	This is one of the few JS compiled languages that interest me: Some of these languages add a very thin syntactic layer on Javascript  and maybe a type system. If I wanted Javascript, I'd use Javascrip...		qwertyuiop924
12381131	12.570635	-7.055232	story	4.0	103.0	1472468631	12.385555	Ruby Deoptimization Engine	https://github.com/ruby/ruby/pull/1419	ksec
12500671	12.611582	-7.881616	comment	4.0	11.5	1473882889	-11.16795	The Clojure code is shorter, but that's almost entirely because it's dynamically typed. And that's not necessarily a benefit, either. Cheshire just takes JSON and turns it into plain old Clojure data ...		sdegutis
35282169	12.601227	-7.0225005	comment	4.0	11.0	1679610050	12.355416	TypeScript.Rails is faster for building an MVP. But it's significantly worse than a project built with a typed language when it comes to extending and maintaining.I thought I had misconfigured Sentry ...		EduardoBautista
35387134	12.6671095	-7.86881	comment	4.0	17.5	1680270592	-10.963539	One obvious point I'm missing here, and that I've been missing from Janet discussion in general: why Janet and not Scheme?Gauche for example implements the latest (and IMO greatest) R7RS, its standard...		nerdponx
35497222	13.010395	-7.6907864	comment	4.0	18.0	1680985291	-12.759631	Because the language is frozen in 2019, it's last meaningful release.It was doomed to end this way due to the close leadership and being developed behind closed doors by a single developer.This kind o...		epolanski
35497354	12.561656	-7.5164785	comment	4.0	12.0	1680986158	12.915209	"I've recently had an interviewer tell me that ""Erlang is an academic language"" and promptly stop the conversation after that. That's in a company that was attempting to make distributed applications e..."		Yoric
35510587	12.647996	-7.8880286	comment	4.0	12.0	1681119144	-11.149432	1. Unlike Python, Clojure actually is functional and is optimized for it, with persistent immutable data structures and a huge library for functional transformations. You get faster, more expressive c...		dgb23
28014531	12.540287	-7.152551	comment	4.0	12.5	1627696678	12.3657465	I've used Sorbet a lot in a few projects. Ultimately, I wouldn't use it again. It's too invasive in the codebase and it impacts readability.For example, having to wrap values in `T.must`, `T.nil`, etc...		ljm
28036856	12.648564	-7.9036565	comment	4.0	12.0	1627914041	-11.176429	> ... and the question regarding choosing Clojure as our main programming language rose over and over againIf I find myself having to repeat myself justifying a certain decision time and time again, i...		aliswe
35462784	12.654691	-7.902846	story	4.0	70.0	1680743444	-11.213978	Try out Clojure libraries via rebel-readline	https://github.com/eval/deps-try	todsacerdoti
28144436	12.705906	-7.458677	comment	4.0	10.5	1628700432	12.9325075	My company (I'm not the hiring manager, just in the know) has been struggling to find any kind of programmer who either knows Elixir, or who is willing to learn.I'd love to help them along because the...		LeonenTheDK
28184513	12.637429	-7.4854894	comment	4.0	13.5	1628980448	12.930519	I started applying to some Elixir jobs and have gotten a ton of screening rejections. I haven’t written it before but I have done a little Erlang, albeit not professionally.		the_only_law
28186836	12.640988	-7.883309	comment	4.0	11.0	1629011838	-11.094296	You don't need to write boilerplate code and watch for syntax errors, if you use a programming language that does not encourage boilerplate or have a lot of syntax.When I start a new C# project, first...		nlitened
28189165	13.00944	-7.6934752	comment	4.0	10.5	1629038746	-12.795252	Really I think the mistake there was not forking Elm. Maybe the fork wouldn't have been popular long term, but at least they'd ship.		Igelau
28223291	13.011835	-7.697298	comment	4.0	18.5	1629303012	2.3042104	Honestly I think the main reason for this perception is that people in the Elm community have gotten increasingly tired of correcting inaccuracies people like to post about Elm on Hacker News.I spent ...		rtfeldman
28223121	13.00263	-7.6890497	comment	4.0	20.5	1629302372	-12.758617	As I understand it, there was a rift in the community over the leadership's tone in messaging and communication. Some Developers also felt like they could not contribute in a meaningful way or have co...		jaeming
28305791	12.530935	-7.079259	comment	4.0	11.0	1629919554	12.387371	"I wonder why this otherwise thorough post doesn't mention almost decade-old feature called ""refinements"" [1]?1: https://ruby-doc.org/core-2.5.3/doc/syntax/refinements_rdoc...."		develop7
28190236	12.634139	-7.2514405	story	4.0	45.0	1629046109	-11.061575	Wigner Crystals (2017)	https://johncarlosbaez.wordpress.com/2017/12/07/wigner-crystals/	leephillips
28327526	12.821559	-7.0925126	comment	4.0	11.0	1630070800	12.722302	"""Phoenix 1.6 ships with a new phx.gen.auth command for a complete authentication solution bootstrapped into your application"" - hope it's a decent implementation. Setting up a JWT authentication took ..."		chimen
28327734	12.698843	-7.373583	comment	4.0	13.0	1630071917	12.847241	Ruby companies like AirBNB, Stripe ended up edging out their competitors using the relatively glacial Java or C++ frameworks. We will need to see a new generation of Phoenix winners before Elixir is t...		ipnon
28346291	12.621612	-7.9090524	comment	4.0	10.5	1630241531	-11.142268	This is remarkably similar to the advocacy made by lots of C/C++ programmers that the language is more useful because it lets you make mistakes, which is all well and good until someone buffer overflo...		pjc50
28393034	12.529495	-7.059098	comment	4.0	11.0	1630595527	12.400852	"Hey! I'm the writer of the article. I'm not a fantastic writer but am trying to improve and felt I needed to start somewhere, so I started with something I'm passionate about. 
Truth be told I do not ..."		shuckforjustice
28442356	13.080213	-7.314161	comment	4.0	17.0	1631003000	-12.46918	This is very nice!For reasoning about tree-based data such as HTML, I also highly recommend the declarative programming language Prolog. HTML documents map naturally to Prolog terms and can be readily...		triska
28424217	12.598726	-7.0526752	story	4.0	127.0	1630848640	12.387025	Suture: A Ruby gem that helps you refactor your legacy code	https://github.com/testdouble/suture	mooreds
28473313	12.653604	-7.89068	comment	4.0	18.5	1631214050	-11.175154	> Did I miss something important that should be covered?Accessibility. Outside of that everything seems reasonable. But I don't know much about cross-platforms GUI. I expect someone will come and expl...		Zababa
28494235	13.14254	-7.2200775	comment	4.0	12.5	1631383515	-12.490019	"I've been thinking along the same lines, it seems like logic + ML would complement each other well. Acquiring trustworthy labeled data is ""THE"" problem in ML, and figuring out which predicates to stri..."		infogulch
28550438	12.642241	-7.8919806	comment	4.0	11.0	1631792341	-11.158621	All available with Clojure plus you get the JVM.		cutler
28490894	13.008426	-7.6934996	story	4.0	3.0	1631357574	-12.774813	Ask HN: Why is it so hard to find an Elm job		kiraken
28585245	12.6496	-7.8890967	story	4.0	116.0	1632066334	-11.169376	Create ad-hoc ClojureScript scripts on Node.js with nbb		Borkdude
22361780	13.13538	-7.2819977	story	4.0	85.0	1582070596	-12.497036	Web Programming in SWI Prolog (2019)	https://www.monolune.com/web-programming-in-swi-prolog/	luu
22381316	12.541714	-7.8620534	comment	4.0	13.0	1582266554	-11.126195	"> But I would take any functional language with types over itWhich is what? Scala? Haskell? OCaml? F#? Typed Racket? Idris?I think Clojure really hits the sweet-spot between stupidly boring, ""pragmati..."		iLemming
22402320	12.60547	-7.8596325	comment	4.0	15.5	1582529933	-11.150866	I looked through examples and I don't see what's so revolutionary about it.This is specialized language suited for more or less one task that has nothing specialized for that task which cannot be roll...		lmilcin
22407199	12.548572	-7.525159	comment	4.0	12.0	1582570910	12.958229	"Out of curiosity, what would you be looking for for ""a better Erlang""? Most if not all of my issues were syntactical, or things that were given up as tradeoffs that I can't qualify as ""better"", so I'm curious what someone else's impressions are here."		lostcolony
22445933	12.560035	-7.51839	comment	4.0	11.0	1582921049	12.9342	Erlang is less and less used in telecoms and it's the only place if was really used, lot of things have switch to C/C++/Java.As for the reason why it has less complains it's pretty simple no one uses ...		Thaxll
22460026	12.653508	-7.875914	comment	4.0	14.0	1583103771	-11.143726	Some of it is libraries and frameworks. Some of it is the attention Clojure has paid to ergonomics. A lot of Clojure’s libraries seem to have been built by smart people for mediocre programmers (like ...		peatmoss
22460192	12.643184	-7.8908434	comment	4.0	15.0	1583105714	-11.147382	Last week some nice folks assured me tooling was good in Clojure; and not a total time suck, and so I'm getting ready to take the jump I think... but, one thing I'm still really skeptical about... is ...		rubyn00bie
22460626	12.648983	-7.894409	comment	4.0	12.5	1583110783	-11.160326	My personal perspective (after 8 years clojuring, half of that professionally) is that Clojure keeps progressing, with ever better tools and ideas for getting stuff done, optimally. I remain optimisti...		vemv
22474745	12.67444	-7.3992143	comment	4.0	17.0	1583246294	-5.8841333	They chose Erlang. A language built for communication and managing wire protocols at scale. Which describes WhatsApp itself. That was probably the biggest impact single decision for WhatsApp technically.		nickbauman
22476813	12.669665	-7.391829	comment	4.0	11.0	1583257551	12.7414465	That was probably the biggest impact single decision for WhatsApp technically.As a rule of thumb based on my own experiences and the opinions of more experienced engineers I've had the good fortune to...		munchbunny
22519858	12.526388	-7.145728	comment	4.0	11.5	1583694302	8.630729	There's also a well supported ML for the web from Facebook:https://reasonml.github.io/With React:https://reasonml.github.io/reason-react/		melling
22523681	12.62921	-7.8804746	comment	4.0	16.0	1583739907	-11.10222	I was talking with a Data Scientist  friend abiut what I love so much about Clojure and it was largely about the REPL. To him it sounded like nothing special - trying expressions in a prompt is hardly...		dimitar
22544489	13.143276	-7.275138	comment	4.0	12.5	1583920798	-12.495851	Swi-Prolog includes an http client/server library:https://www.swi-prolog.org/pldoc/doc_for?object=section(%27p...And of course, a lot of support for the semantic web:https://www.swi-prolog.org/web/ind...		YeGoblynQueenne
22548867	12.679884	-7.8679924	comment	4.0	17.0	1583952015	-11.197154	Looks like picking Clojure and Datomic has created a great deal of technical debt for them. They started adding Spec everywhere to specify their data because they were having big problems scaling thei...		Scarbutt
22573198	12.582639	-7.480697	comment	4.0	17.0	1584160260	12.91926	Erlang already has dialyzer. Are they making another dialyzer?		dialyzer
22760924	12.651142	-7.456732	comment	4.0	10.5	1585846066	12.921499	"elixir is npm for erl.the single example you need to know to snub it:   x = 1
   x = 2

thats valid elixir. you're better off using javascript or php at this point"		zapttt
18972699	12.670385	-7.429718	comment	4.0	13.0	1548192601	12.911771	Would you be able to give an example or two where you would reach for go vs elixir and vice-versa?I’ve tinkered with Go, and while it was fairly enjoyable to work with on the small scale, but the lack...		cutety
19099441	12.572084	-7.8296394	comment	4.0	16.5	1549484534	-11.07726	Some experienced devs might say the same thing if they've also found a language that just clicks with them as I have.Clojure is a locus of things I really, really like and I have no reason to change d...		jakebasile
19123830	12.638853	-7.876995	comment	4.0	19.5	1549737655	-10.828111	> If you undertake this exercise you will come to know the answer to the question: why has this idea (a vector-based Lisp) not gained more wide-spread adoption?It's gained incredibly widespread adopti...		bitwize
19125321	12.653449	-7.885661	comment	4.0	13.5	1549754065	-11.05478	How would Clojure be a Lisp, given that it runs zero Lisp code?		lispm
19166911	12.560722	-7.058738	comment	4.0	12.0	1550185177	12.385212	Did you try the Ruby 2.6 JIT Compiler?		hit8run
19234840	12.526218	-7.50074	comment	4.0	14.5	1550947747	12.912834	And 80% of the internet switches (Cisco and juniper) are controlled by erlang.  So?I think you're looking at this wrong.  Part of the reason why so many large scale products use OO, is because they us...		dnautics
19279060	13.147744	-7.286006	comment	4.0	14.5	1551432824	-12.494999	Do you know of anyone combining prolog with integer linear programming? I modelled quite a complex convex optimisation problem as a mixed integer linear programme, but it was very buggy at the beginni...		0db532a0
19279217	13.15281	-7.300275	comment	4.0	10.5	1551434813	-12.502881	"I got into Prolog last year, I really love it. I came across the fascinating article ""Who Killed Prolog?"" (2010), from Maarten van Emden's blog A Programmer's Place.""Compared to these three [Fortran, ..."		yesenadam
19279863	12.648204	-7.8954787	comment	4.0	10.5	1551442894	-11.147023	The following function is valid in hy and clojure.(defn fact [x] (if (< x 2) 1 (* x (fact (- x 1)))))Yes, hy and clojure don't have access to the same libraries, but then neither do clojure and clojurescript, yet you'd agree that clojurescript is a dialect of clojure, yes?		jhbadger
19312494	12.662076	-7.46582	comment	4.0	12.0	1551808542	12.926534	This article is quite good, especially part about bottleneck caused by single supervisor in ranch. However I have to say that title is a bit misleading because all of this has nothing to do with Elixi...		dzik
19358224	12.65399	-7.8979316	story	4.0	47.0	1552305275	-11.190223	An Interactive Quine in Clojure	http://blog.klipse.tech/clojure/2019/01/08/quines-in-clojure.html	tosh
19424013	13.182693	-7.0989513	comment	4.0	11.5	1552935637	-12.424748	Can anyone recommend any implementation of Datalog (+ negation) that is not datomic?I haven't tried datascript, which appears to support negation. Maybe I will try that if/when I revisit this interest someday.		JoelMcCracken
19479819	12.615656	-7.878044	comment	4.0	20.5	1553479085	-11.173199	It's interesting that the very things that attracted the author to Clojure was what kept me from moving to it from Python.I enjoyed the syntax. Loved the immutability. However, I wasn't able to unders...		hetman
19523447	12.650967	-7.874478	comment	4.0	10.5	1553878873	-11.146539	The main issue with using Clojure is that you are expected to build everything out yourself. A lot of dependencies tend to stop being maintained after a while. Auth systems etc. are half-baked with 10...		sansnomme
19526837	12.542707	-7.5214815	comment	4.0	12.5	1553906988	12.915332	I'm a little surprised at where Erlang features in the list. I've never used it personally, but have heard so much about it being an amazing, performant language. I wonder why it's so time/energy/memory inefficient for the algorithms used in this exercise.		osrec
19466393	12.624153	-7.466499	story	4.0	201.0	1553285291	12.915144	Operable Erlang and Elixir [video]	https://www.youtube.com/watch?v=OR2Gc6_Le2U	okket
19601513	13.005181	-7.690154	comment	4.0	10.5	1554690996	-12.758119	The previous version of Elm, 0.18, had a time travel debugger and it was wonderful. Version 0.19 broke something and it no longer works unfortunately. https://elm-lang.org.		auslegung
19618214	12.582055	-7.023334	comment	4.0	11.0	1554838665	12.377018	This likely will be just another book on the long list of books I've owned but don't get through, but hard to ignore a 700-page book with a topic both esoteric and pragmatic (I use git daily but have ...		danso
19695066	12.640803	-7.2623444	comment	4.0	13.0	1555623806	-11.257919	I've been meaning to kick the tires on Crystal, but haven't find the right project yet. Would be curious to hear how people like using it.		wiremine
19707572	12.52374	-7.4772444	comment	4.0	10.5	1555779755	12.943353	Could someone elaborate (or link to a reference) on Joe's point about how having many processes can help build fault tolerant systems? I know next to nothing about Erlang/Elixir or the actor model, bu...		ssivark
19710867	12.537198	-7.518006	comment	4.0	11.0	1555829478	12.881424	Fred probably forgot to mention it, but Joe, Mike, and Robert starred in a short film Erlang: The Movie, a very fine and concise demonstration of fault-tolerance of Erlang.The film has some magic powe...		riobard
19728333	12.600948	-7.863076	comment	4.0	11.5	1556026057	-11.159217	Clojure is popular? It's at the bottom:https://insights.stackoverflow.com/survey/2019#technologyAs much as I love Clojure, it's still a harrowing language for beginners to learn and use. The learning ...		shay_ker
19728502	12.637026	-7.8834157	comment	4.0	15.0	1556027293	-11.162946	I work at Walmart Labs. Clojure is super popular[1] in Walmart Labs. Clojure is fun and importantly it is a very productive language to work with. This gain in productivity comes from less state, thus...		throwawaywlabs
19739176	12.54087	-7.5033426	comment	4.0	10.5	1556118799	-8.943969	Educate me if I am wrong, but there are natively compiled Erlang modules, but no longer any natively compiled Erlang. It only runs on the BEAM, and ever since BEAM/C fell out of use in OTP R5 no native code is generated.		teilo
19694006	12.657871	-7.270666	story	4.0	167.0	1555615442	10.454449	Crystal 0.28.0 Released	https://crystal-lang.org/2019/04/17/crystal-0.28.0-released.html	htfy96
19872497	13.192828	-7.026759	comment	4.0	11.0	1557436472	-12.422176	With due respect, Datalog is a very difficult language to learn, and it just doesn't have the support and resources SQL does.  We were forced to use it in a Data Cleaning course a few years ago becaus...		Vaslo
19883492	13.13989	-7.296477	comment	4.0	11.0	1557533469	-12.477248	Prolog may suffer from a lack of popularity, but I'd argue that's not because it's lacking in power as a means of expressing an idea. Nor is it due to a hardware paradigm mismatch.Lisp and its variant...		TimTheTinker
19906924	12.655772	-7.8036337	comment	4.0	13.0	1557810507	-10.883811	Let me tell you my perspective as a Lisp enthusiast and ex-software engineer who now works in academia. I think the problem is that most people who write software in the world (even many professional ...		lgessler
19875335	12.6508875	-7.880334	story	4.0	137.0	1557466595	-11.188189	ClojureScript: Graal.js REPL Environment	https://clojurescript.org/news/2018-11-02-release#_graal_js_repl_environment	tosh
15771856	12.6626215	-7.859871	comment	4.0	10.5	1511543824	-10.847145	Learning lisp is never in vain. You can almost apply your functional programming paradims learnt in clojure to most of the dynamic languages out there. Plus you will be thinking in the immutable way of doing things.		tejinderss
