id	x	y	type	relevance	size	year	umap1d	hovertext	url	author
33081845	12.637951	-7.8600507	comment	3.0	14.5	1664897609	-11.114061	I worked at a startup that was built on Clojure. It had trouble finding developers for reasonable salaries at the early mid stage. They decided to switch the stack to python at that point. Just an anecdote!		beiller
33082998	12.649342	-7.8990664	comment	3.0	12.5	1664901880	-11.141591	"For me, the killer feature of Clojure is ""REPL driven development"". The ability to get rapid feedback as you build things up is incredible. I'll make a comment form and evaluate expressions within it ..."		hypersoar
33214306	12.547221	-7.5195293	comment	3.0	11.0	1665838009	12.8951025	Erlang’s formulas are incredibly applicable to things we work on today - and shockingly unknown to many developers.I’ve used them several times to show that a proposed system is mathematically impossi...		bad416f1f5a2
33296258	12.649695	-7.890904	comment	3.0	17.0	1666423582	9.290583	Modern Clojure includes that - it's deps.edn (though I'm good with Leiningen).And ditch Emacs (unless you are already using it/used to it) and try VSCode + Calva that runs basically out of the box.Exc...		kimi
33296282	12.613963	-7.8598742	comment	3.0	12.0	1666423944	-11.098642	> you only start a REPL once, so does not really matterPeople say this a lot in Clojure, but don't you worry about global vars that no longer point to what you thought they pointed to?  For this reason alone, I almost always load a new Python REPL.		funstuff007
26494155	12.652478	-7.8905754	comment	3.0	15.0	1616001449	-11.137467	For those unfamiliar with Common Lisp there is also Babashka which allows for Clojure shell scripting without the JVM startup time.https://github.com/babashka/babashka		lambdaba
33378758	12.65012	-7.879129	story	3.0	75.0	1666995906	-11.129339	Cherry: ClojureScript to ES6 Compiler	https://github.com/squint-cljs/cherry	tosh
26545665	12.579658	-7.2591996	comment	3.0	11.0	1616441734	-11.218083	I love the idea of Crystal but I remember reading that compilation times can balloon very quickly for moderately sized apps.Can anyone who writes Crystal today dispel or confirm that information? I imagine the inferred typing makes building a fast compiler really tough.		terracatta
26545864	12.584313	-7.2243204	comment	3.0	18.0	1616442554	-11.217279	Crystal's appeal, for me at least, is the productivity of Ruby with the memory efficiency and execution speed of C++. Static typing is just a way of achieving that, it's not something I'm seeking per se.		Doctor_Fegg
26547925	12.5876	-7.253362	comment	3.0	11.5	1616450732	-11.194512	Is static typing really necessary for speed?The fastest JavaScript engines and LuaJIT are closer in speed to Crystal than Crystal is to C.Granted - all these languages are really fast - and unless you...		onlyrealcuzzo
26516306	12.541771	-7.852147	story	3.0	48.0	1616176314	-11.133996	Clojure: Keyword argument functions now also accept maps	https://clojure.org/news/2021/03/18/apis-serving-people-and-programs	tosh
26705090	12.578791	-7.4739857	comment	3.0	11.0	1617659078	12.905378	"> Erlang already is a more concise language than Elixir but also noisier as there are more punctuation characters.What?Here's more-or-less the entirety of Erlang's ""noisier syntax with more punctuatio..."		dmitriid
26805379	13.166847	-7.1521945	comment	3.0	18.5	1618398018	-12.459501	Nice to see Datalog being validated by a big name, though I don't see what's modern about Logica in particular, or why one should use it over plain Datalog (as syntactical Prolog subset) when the avai...		tannhaeuser
37580354	12.590304	-7.0224867	comment	3.0	13.5	1695183800	-11.237406	Ruby processes don't return the memory to the system,they reuse memory already allocated. This is for efficiency - allocating and freeing system memory isn't free. Even if it did, your peak memory usa...		jacobsenscott
26767623	12.606042	-7.2614822	story	3.0	35.0	1618117818	-11.202795	Show HN: UML model and code examples of GoF patterns in Crystal	https://github.com/takaakit/design-pattern-examples-in-crystal	takaakit
37619569	12.624101	-7.8947816	comment	3.0	12.5	1695429561	-11.1533785	"> Most operations on clojure persistent data structures are an order of magnitude less efficient than they are on the mutable equivalentsIt's not really clear what you mean by ""order of magnitude"" her..."		thaumasiotes
37662056	12.6621	-7.8811884	comment	3.0	14.0	1695746880	-11.04844	Are there people here that prefer Common Lisp to Clojure for webdev specifically and would like to tell us why?		Capricorn2481
37662222	12.642678	-7.892465	comment	3.0	11.5	1695747382	-11.12209	Sure:1. I've been using CL for longer than Clojure has existed2. SLIME is better than any Clojure dev setup I've seen3. Maybe I'm misunderstanding things, but if I get how Leiningen works, I need to r...		aidenn0
37792742	12.611356	-7.8673716	comment	3.0	50.5	1696609104	-11.181073	The Clojure devs should be aware that the synchronization pinning problem is intended to be temporary and doesn't apply at all with GraalVM native images. One of the Loom developers talks about it her...		mike_hearn
37792908	12.652444	-7.904089	comment	3.0	48.5	1696609869	-11.173357	A lot of Clojure projects choose to stick with the LTS releases though, so it might take a while before this problem disappears on its own, even if fixed in the JVM.		fnordsensei
37750471	12.729085	-7.4862795	story	3.0	39.0	1696332940	12.942268	Elixir and Machine Learning: Q3 2023 roundup	https://dashbit.co/blog/elixir-and-machine-learning-q3-roundup	josevalim
37792294	12.618511	-7.8810344	story	3.0	215.0	1696607053	9.078612	Java 21 VirtualThreads vs. Clojure Lazy Seqs	https://clojure.org/news/2023/10/06/deref	grzm
37831614	12.650124	-7.2683053	story	3.0	44.0	1696943510	10.445744	Crystal 1.10.0 Is Released	https://crystal-lang.org/2023/10/09/1.10.0-released/	mikece
14756304	12.654987	-7.886674	comment	3.0	12.5	1499891056	-11.161066	This feature is really, really a long time coming. Myself and other ClojureScript core contributors are happy to answer any questions people may have.		swannodette
14735391	12.63099	-7.2803054	story	3.0	6.0	1499690937	10.271882	How to build video games for Windows using Crystal	http://blaxpirit.com/blog/23/how-to-build-video-games-for-windows-using-crystal.html	RX14
14709639	13.123151	-7.249077	story	3.0	57.0	1499341917	-12.476492	Logic Programming (Prolog, ASP, etc) and GRAKN.AI (a distributed knowledge base)	https://blog.grakn.ai/isa-graql-logic-program-8af1258054a4	graqlbot
14768247	12.514823	-7.0631437	comment	3.0	11.0	1500018556	12.408296	I can't agree, if you are a Ruby programmer you immediately know what's going on in the first line and it's definitely more readable - you see it at a glance instead of having to scan three lines.		methyl
14789221	12.656465	-7.453705	comment	3.0	10.5	1500304142	12.91045	Have you seen Elixir's doctests[1]? They're docs with a code example that gets run by your tests, and if the example doesn't work, your tests fail.[1]https://elixir-lang.org/getting-started/mix-otp/docs-tests-a...		ch4s3
14872247	12.643563	-7.893162	comment	3.0	12.5	1501220860	-11.132101	Interesting.  I've mostly been programming clojure for the last couple years.  But I've got one project I'd like to try to make that is very GUI centric.I don't know what it is about GUI programming, ...		DigitalJack
14873538	13.003091	-7.684678	comment	3.0	10.5	1501242675	-12.776059	It might have been fine if elm-format had chosen better defaults.Go chose tabs over spaces which are configurable in your editor, so everyone wins. Elm has other awkward style choices, like 'comma-fir...		allover
14876871	12.791005	-7.1122313	comment	3.0	21.0	1501270470	12.717433	I'm spending all my free time with Phoenix. I come from a Rails, Laravel, Django and a bit of .NET Core background. So far I am extremely impressed. I'm surprised it has not been adopted by that many folks in production.		fareesh
14877762	12.818782	-7.059857	comment	3.0	12.5	1501277681	12.571997	"The beautiful thing about Phoenix framework is that there is no ""one-true way"" to do things. Rails is omakase, Phoenix is not, and that's a good thing.You want the whole enchilada? Use Guardian.Need o..."		sergiotapia
14890305	12.972559	-7.6202064	comment	3.0	23.0	1501489496	-12.738212	> making very heavy use of Ajax calls to a JSON-based RESTful APIand then> Want to decode some JSON? Hard, especially if the JSON is heavily nested and it must be decoded to custom types defined in yo...		dmitriid
14895712	12.6929035	-7.449973	comment	3.0	11.0	1501533675	12.9448	is there any news recently about Elixir? I'm asking since recently Im seeing a lot of articles about how to get into Elixir which is really nice since I just started pickup the language as well.		beedn
14909984	12.651591	-7.891323	comment	3.0	12.0	1501677173	-11.153182	This is great, very small code. The choice of Clojure would make it a bit difficult for a beginner, but hey, then you know a real language.> This is not an official Google product (experimental or oth...		thesmallestcat
14928609	12.643648	-7.899506	comment	3.0	14.0	1501854607	-11.154508	The perfect language to expand your brain. In a world dominated by java, php, c++,... In my opinion yes, Clojure could the perfect language to continue learning concepts, at same level would be Haskell.		grouchoboy
14928752	12.625052	-7.8716116	comment	3.0	12.5	1501855724	-11.099248	One huge difference is the workflow you have in Clojure. REPL driven development is an experience unique to Lisps. When you're working with Clojure, any code can be run in the context of the live app ...		yogthos
14929745	12.650761	-7.8855057	comment	3.0	12.0	1501863063	-11.10783	Are we doing opinion threads now? Okay. I can do one too!I do like working with clojure. It's my favorite dynamically typed programming language by an easy margin.It's basically everything that was a ...		KirinDave
14929823	12.632786	-7.874637	comment	3.0	12.5	1501863821	-11.074471	> Clojure is a dynamic language.Dynamically typed. As a dynamic language Clojure is less capable than many other Lisp implementations/languages. See for example 'late binding'. In Clojure you either n...		lispm
14932628	12.624822	-7.2685537	comment	3.0	14.0	1501883449	-11.226912	From crystal-lang.org, Crystal is a compiled languageI never understood the phrase compiled language.		sigjuice
14935705	12.608506	-7.496768	comment	3.0	10.5	1501941428	12.944312	"Yes, I understand, I was just wondering if Erlang would be considered a ""proven language"".From my (limited) Erlang experience, Erlang & Elixir have the same core functionality. Elixir has a ""nicer"" sy..."		hellbanner
14935715	12.629996	-7.4811215	comment	3.0	11.0	1501941480	12.93354	Don't use. You're gonna be in big troubles to recruit developers who knows that tech.It's already an issue with Erlang. It's made 10 times worse with Elixir.		user5994461
14954909	12.656128	-7.89874	comment	3.0	11.5	1502172584	-11.224132	Having written Clojure full-time for the past 5 years while writing cleancoders.com has really spoiled me. Clojure's introspective nature makes for some amazingly fast productivity because you can hoo...		penpapersw
15006209	12.653373	-7.9011497	comment	3.0	12.5	1502676479	-11.168769	Clojure devs: 3.5 is the figure you are looking for, and it does look very good, at first glance.		devrandomguy
15063545	12.644337	-7.8945556	comment	3.0	12.5	1503312747	-11.171812	No mention of Clojure? In the comments the author says that since it was a functional JVM language, he never considered it. OK.		JBiserkov
15074722	12.62829	-7.8633204	comment	3.0	10.5	1503423814	-11.163204	I wonder, would it be better to have something like an LLVM frontend for Clojure, rather than another new Scheme? Or, would we still have a long startup time, regardless of the platform? I know Clojur...		devrandomguy
15064127	12.531818	-7.503721	story	3.0	152.0	1503319374	12.90038	A supercompiler pass for Erlang	https://github.com/fenollp/erlscp	bryanrasmussen
12564045	12.650399	-7.8986144	comment	3.0	15.5	1474633905	-11.200642	Can confirm. At work we're moving from Clojure 8 to Java 8 partially because IntelliJ is amazing and partially because Java 8 plus the right libraries is close enough to Clojure anyway, except much faster.		sdegutis
12607300	12.588702	-7.8763156	comment	3.0	12.5	1475171495	-11.191476	You are referring to, for example: http://clojure.org/reference/transientsCombining the two ideasTransient imperative logic in the core (5%), Functional mantle (90%), Side-effecting imperative crust (5%).		harryjo
12660300	12.671671	-7.8684096	comment	3.0	11.5	1475845448	-10.895493	I love Lisp and I'd use it for everything if I could. But the Lisp community spends too much time talking about how awesome it is instead of making good frameworks that anyone can use, even kids just ...		isaiahg
12670056	13.147869	-7.2928796	comment	3.0	15.0	1475992549	-12.485769	I've seen multiple examples of prolog over the years.  From looking at them, one gets the idea that you must hardcode all your data into your program and the only UI is a somewhat odd shell, with no w...		Falkon1313
12704846	12.646322	-7.8916707	comment	3.0	10.5	1476399420	-11.152596	Not a super fan of Clojure, but it's a good language. Shame it's still stuck in the Java ecosystem, though.		qwertyuiop924
12704829	12.641309	-7.8922353	comment	3.0	18.0	1476399279	-11.161498	Thankfully Rich Hickey & co wrote Clojure so we can program on a modern Lisp in the Java Virtual Machine and in the browser! (ClojureScript) (even the .NET CLR is supported)[1] http://clojure.org[2] http://clojurescript.org		JBiserkov
12718753	12.915236	-7.6851606	comment	3.0	11.0	1476628405	-12.688837	At the very least, Elm code should be compatible with Google's Closure compiler (just like Clojurescript). There is no reason the Elm folks should try to re-invent the wheel on this, just harness the ...		hellofunk
12719403	12.529005	-7.820541	comment	3.0	11.5	1476635529	-11.149558	"I have quite some background in OOP and switched to functional programming a few years ago, now working a lot with Clojure, where you actually have the ""code is data"" paradigm. And from my experience,..."		cygned
27501254	12.6333	-7.90208	story	3.0	72.0	1623668916	-11.150998	Code Observation: Clojure's Destructuring	https://danielgregoire.dev/posts/2021-06-13-code-observation-clojure-destructuring/	semperos
27567027	12.643559	-7.041966	comment	3.0	10.5	1624162540	12.357328	Andrew Kane seems to be one of the most productive Ruby developers out there - he has a ton of open-source gems that solve real-world problems: https://github.com/ankaneHe's done a lot of the hard-work for creating the tooling in the first place - the community can step in from here.		forgingahead
27582901	12.634512	-7.18679	comment	3.0	12.5	1624302623	-11.266035	Thunderbong with an excellent link!Chris Seaton is one of the most influential programmers out there for me. I'm so interested in just about everything he's touched. What a guy. Ruby will never die so...		adenozine
27591900	12.58842	-7.481682	comment	3.0	11.0	1624371429	12.912623	You’re missing a lot! In the case of a simple request/response web app yes it doesn’t do a whole lot. Imagine you’re building a complex system with lots of different behavior patterns. Let’s say a bac...		whalesalad
27685875	12.613621	-7.881243	story	3.0	111.0	1625037788	-11.139766	Data notation in Clojure	https://ostash.dev/posts/2021-06-24-edn-data-notation/	wernerkok
27760232	12.698725	-7.445602	comment	3.0	11.0	1625660283	12.939591	>Then just post about your IDE on Elixir forums.Not all users of Elixir hang out on Elixir forums. There are plenty that spend the majority of their time on the internet elsewhere.>and I certainly don...		charcircuit
27784467	12.534412	-7.8456116	comment	3.0	19.0	1625843409	-11.13175	The obvious answer why F# wins over Clojure in many people's books is static typing.		dimitrios1
27820478	13.009467	-7.690921	comment	3.0	10.5	1626181771	-12.772135	Go is open to forks and PRs though. It’s more “we’ve got a vision, but we’ll hear you out”. Elm is full cathedral, Elm comes down from the gods with no input or transparency into the decision process....		donatj
35399619	12.645604	-7.9010544	comment	3.0	10.5	1680351221	-11.221456	ClojureJavaScriptTypescriptOCamlHaskellF#		pharmakom
35497680	13.003434	-7.6824327	comment	3.0	12.0	1680988321	-12.759694	What is lacking in the 2019 release and in what ways does the frozen feeling make things bad in reality?I am curious since we have one major project written in Elm since 2017 and it has been a great success.		jlundberg
35498179	12.641557	-7.4559455	comment	3.0	10.5	1680992064	12.961428	> Elixir, it's the builders FPI'm really glad to hear that, because to me it does seem like Elixir is the FPL that is closest to satisfying a GSD mentality and not getting caught up in too many interesting rabbit holes.		pmarreck
35495670	12.568183	-7.0446615	story	3.0	82.0	1680975436	12.369403	A Rubyist's Walk Along the C-Side (Part 10): Benchmarking	https://blog.peterzhu.ca/ruby-c-ext-part-10/	thunderbong
22381819	12.648084	-7.891295	comment	3.0	17.0	1582275481	-11.161294	I studied Java at University and then worked with it for 15 years through various companies, finance mostly. I like the language but the opportunities and my use of it felt very stale in the end.I swi...		d_t_w
22384158	12.776112	-7.6281357	comment	3.0	10.5	1582301423	-12.712554	Between reasonml and elm which one should I pick?		adamnemecek
22396648	12.533578	-7.845018	comment	3.0	13.5	1582463062	-11.126286	A language that young professionals can use right away and can even support complex projects like kubernetes, Prometheus, consul etc. sounds like an excellent choice for companies to adopt. It might n...		gnur
22460659	12.649946	-7.8871875	comment	3.0	14.0	1583111115	-11.135806	What got me started with Clojure was a coworker at megacorp.  He's since moved on to a company that makes widespread use of Clojure in production.  Startup time was a huge factor for me because I want...		inferiorhuman
22462139	12.61606	-7.893604	comment	3.0	15.0	1583130441	-11.161862	You're aware that it's possible to write bad code in any language, even Clojure, right?		hota_mazi
22462257	12.650943	-7.8947244	comment	3.0	14.0	1583131932	4.392934	And poor tooling support on MS Windows. Leiningen does not even have a proper installer on Windows, last time I checked.Having leiningen not bundled into the clojure distribution, is in strong contras...		billfruit
22463882	12.56315	-7.8682632	comment	3.0	13.0	1583153199	-11.186747	Does Clojure actually force you to use those abstractions though? Many languages provide concurrency primitives, but Rust will fail to compile if you try to use non-concurrency safe objects from multiple threads.		nicoburns
22573326	12.521795	-7.477784	comment	3.0	10.5	1584162426	-12.330944	How? This is just a link to a Facebook job post.Guess this is a good time to plug Gleam though (along with Dialyzer, which has already been mentioned), a statically typed functional programming language which compiles to Erlang.https://gleam.run		markholmes
22582931	12.577835	-7.044723	comment	3.0	16.0	1584273379	12.37783	"The problem with ""you can roll your own language constructs"" is that, er, everybody wants to roll their own language constructs -- as opposed to simply using a library of common ones that have been te..."		bitwize
22659123	13.142356	-7.300197	comment	3.0	18.0	1584914394	-12.484051	Very interesting, thank you for sharing this!Knowing the history of Prolog can be very useful to make progress in this area, because quite often, progress in this area means returning to what earlier ...		triska
22659251	13.166691	-7.303912	comment	3.0	10.5	1584915423	-12.504165	We often don't learn from the greats of computer science (all sorts of APL goodness from the 70s is being rediscovered for data science today).As far as modern Prolog. I know commercial systems still exist, but I assume most work has switched to SWI-Prolog?		7thaccount
22599135	12.61786	-7.484118	story	3.0	1.0	1584399491	12.923673	Any companies using Erlang or Elixir?		denalilumma
15137816	12.647555	-7.7605405	comment	3.0	11.0	1504147571	-11.08764	I feel similarly about ClojureScript. It's a neat proof-of-concept, but I'm not really sure what it adds over regular JavaScript (or at least Babel + Webpack) these days.		_sdegutis
15137195	12.650423	-7.884248	story	3.0	11.0	1504138499	-11.164874	Why I'm ditching Clojure for JavaScript	https://sdegutis.com/blog/2017-08-30-why-im-ditching-clojure-for-javascript/	_diyu
15219705	12.656996	-7.9012303	comment	3.0	11.0	1505147216	-11.1613865	Personally, Given teams writing in java, python, go, or Clojure, I wouldn't join the Clojure team. It looks too painful...https://github.com/clojurebook/ClojureProgramming/blob/maste...		ronnier
15250082	12.516068	-7.0267587	comment	3.0	10.5	1505409045	12.374532	I love ruby, but its falling almost irretrievably behind python in data analysis/visualization/machine learning libraries.		aswanson
15267572	12.634978	-7.8760247	comment	3.0	12.0	1505608406	-9.763102	Let's get straight to the really important question, can J9 or AOT help maybe just a little with clojure startup time woes?		ledgerdev
15191343	12.634934	-7.89343	story	3.0	164.0	1504788709	7.9510407	ClojureCUDA – CUDA programming in Clojure	http://clojurecuda.uncomplicate.org/articles/getting_started.html	prometheus666
15426067	12.637633	-7.8814673	comment	3.0	13.0	1507415900	-11.1611595	Maybe it has gotten better in the last year or so, but I’ve been extremely disappointed in a) the scope of semantics divergence between Clojure and clojurescript, and b) the performance of clojurescri...		saosebastiao
15425913	12.659577	-7.907721	comment	3.0	15.0	1507413454	-11.166559	I've read the original article and, to be quite honest, couldn't actually determine what point it was trying to make. The action items seemed to have very little to do with the rest of the rant.I actu...		moomin
15466215	12.5295	-7.8554296	comment	3.0	14.5	1507906372	-11.156299	"> ""SPJ in an excellent series of talks lists these advantages of types... the biggest thing left out of clojure...""> ""The biggest merit he says is in software maintenence, and i really disagree with j..."		platz
15474580	12.650872	-7.9008474	comment	3.0	10.5	1508018506	-11.163306	Interesting that job postings for clojure are declining: https://www.indeed.com/jobtrends/q-clojure.htmlAnd clojure isn't even mentioned in zdnet's most popular programming languages: http://www.zdnet.com/article/which-programming-languages-are...		bshur
15478877	12.648829	-7.8835177	comment	3.0	11.0	1508096351	-11.07582	Slightly off-topic, but what's your preferred stack for developing data-intensive applications that involve a lot of preprocessing, heavy statistics and machine learning plus a web front-end?Julia sou...		nextos
15520717	12.648312	-7.9017496	story	3.0	59.0	1508561288	3.7162871	A Guided Tour of Clojure Destructuring Bind in Emacs Lisp (2011)	https://github.com/VincentToups/emacs-utils/blob/master/defn-readme.md	pmoriarty
15490249	12.654669	-7.896747	story	3.0	83.0	1508242270	-11.185228	Clojurecademy is now open source	https://github.com/clojurecademy/clojurecademy	ertucetin
15525529	12.658726	-7.9048567	comment	3.0	21.5	1508655438	-11.171435	What exactly do average devs struggle with?Who is making these decisions to rewrite?It would be great if we can see a before and after comparison.Clojure is a pretty simple language. Ive taught it to ...		sheepmullet
15525566	12.656362	-7.899566	comment	3.0	18.0	1508656305	-11.169111	Ten years ago (appoximately) I read an article about how PHP was dying, thanks in part to many new languages cropping up. But I see PHP mentioned all the time here on HN, and the PHP meetups in my are...		hellofunk
15526230	12.647014	-7.8933063	comment	3.0	15.0	1508671219	-11.162874	PHP has a massive following. It was basically the only language for the web 1-2 decades ago, everything had to be written in PHP. Of course, it cannot be extinguished since the existing sites will dra...		user5994461
15574824	12.607444	-7.2438593	comment	3.0	20.5	1509191167	-11.210274	Crystal is a Ruby inspired compiled language, allowing it to run blazingly fast with a very low memory footprint. It uses LLVM for emitting native code, thus making use of all the optimisations built ...		sdogruyol
15575019	12.56455	-7.1445704	comment	3.0	13.0	1509195965	12.412168	I've been working on https://luckyframework.org and I can say that meta programming is extremely powerful and much easier for me to use than either Ruby or Elixir.You can see a bit of what the macro s...		paulcsmith
15575067	12.618322	-7.2313576	comment	3.0	11.0	1509197560	-11.2502985	Crystal really does feel like Ruby without the annoying parts, plus the macro system feels like a _better_ meta programming facility.On the other hand I've read reports that sufficiently large codebas...		look_lookatme
15593845	12.652528	-7.886443	comment	3.0	10.5	1509463145	-11.15547	I never said Clojure wasn't productive, i'm pointing out that it is too tied to the underlying platform.ClojureScript is an excellent replacement for Javascript, however code is not 100% compatible be...		flavio81
15594832	12.517704	-7.854179	comment	3.0	10.5	1509470257	-11.130459	Right, but most of the statically typed code in the world is written in C++, Java, etc. If you're presenting Clojure to your organization, the choice isn't going to be Clojure vs Haskell/Idris, it's g...		james-mcelwain
15581272	12.650091	-7.9075956	story	3.0	81.0	1509309242	-11.1886835	4Clojure Easy Problems Updated on Clojurecademy	https://clojurecademy.com/courses/17592186045426/learn/overview#	ertucetin
