id	x	y	type	relevance	size	year	umap1d	hovertext	url	author
19247982	12.688751	-7.4577065	comment	5.0	12.5	1551119006	12.95322	It took me a while to figure out whether this is an HTTP client library or a server library. Turns out it is the former. Nice! I like that it's in-process. I wish more Elixir libraries would default t...		skrebbel
19248231	12.784519	-7.1040926	comment	5.0	13.0	1551120620	12.738483	A lightweight serverside Elixir framework like this is exactly what I was looking for earlier this week. Phoenix is really clunky in my opinion and pretty foreign (Ruby/Rails-like) coming from a lightweight Flask/Express/Go background.		KhoomeiK
19268180	13.147944	-7.2970076	comment	5.0	14.0	1551314797	-12.487556	"(I'm no expert but..) I recently got into Prolog, and Alloy sounds very similar. So I was asking ""How is it different?"" Strangely, in the FAQ, no mention of Prolog. I found just this:>How does the All..."		yesenadam
19279088	13.1491995	-7.294628	comment	5.0	14.5	1551433174	-12.480428	""" they said that for those who use Prolog in production it is a real competitive advantage that they don't want to announce to the world;""with due respect to prolog (which is a mindbending language), ..."		plinkplonk
19300675	12.957355	-7.648973	comment	5.0	13.0	1551702091	-12.705854	I'm curious what Elm offers that cannot be done in TypeScript.		mikece
19346790	12.658353	-7.441479	comment	5.0	38.5	1552148210	12.92573	Elixir is one of those languages that changes you. I realize its a ruby flavored wrapper on top of erlang but I don't care. Coming from an OOP/C based language background, it took me a while to get it...		vikingcaffiene
19430922	12.7345085	-7.039067	comment	5.0	19.5	1553004590	12.601975	I spent a couple of years dreaming of getting paid to work in Ruby and Rails and about 7 years doing so. There are many things I loved about Ruby, and Rails brought a ton of good ideas to web developm...		nathan_long
19478848	12.655802	-7.9032183	comment	5.0	22.5	1553462469	-11.16822	I don't have a horse in this race but I find it interesting that in my career I've seen a lot of bad code but the worst clusterfucks I've met where all in Clojure while the community seems to be chock...		luckydata
19498732	13.198732	-7.022416	story	5.0	21.0	1553671770	-12.420679	Ask HN: Datalog as the only language for web programming, logic and database		truth_seeker
19541741	13.084686	-7.3268943	story	5.0	93.0	1554111305	-12.471339	Modern Prolog Implemented in Rust	https://github.com/mthom/scryer-prolog	xvilka
19561031	12.821941	-7.1183786	story	5.0	36.0	1554269885	12.748745	Basic HTTP Authentication in Elixir/Phoenix	http://nts.strzibny.name/basic-http-authentication-in-elixir-phoenix/	pplonski86
19565738	12.659288	-7.9014974	comment	5.0	16.0	1554315206	-11.177839	Founder here. Excited to announce Red Planet Labs today. I'll try my best to answer any questions here.Also want to emphasize that we're a fully distributed company, and we're hiring! If you're a stro...		nathanmarz
19690688	12.610468	-7.472951	story	5.0	26.0	1555592874	12.92152	The philosophies of software languages, from Go to Elixir	https://www.welcometothejungle.co/fr/articles/languages-software-go-elixir	UkiahSmith
19697699	12.60241	-7.0337358	comment	5.0	15.0	1555658718	12.379655	My concern about all of this is that it might lead to basically two ruby communities; Rails and Rails devs will mostly keep writing type free code (dhh has always indicated he's not a fan of types), b...		joelbluminator
19707399	12.683249	-7.4604554	story	5.0	140.0	1555777770	3.3879862	Joe Armstrong on Elixir (2018)	https://elixirforum.com/t/learning-elixir-frst-impressions-plz-dont-kill-me/16424/52	tosh
19714970	12.673229	-7.440359	comment	5.0	14.5	1555885553	12.909513	I've just been trying to get back into elixir recently, myself. I'd done some basic crud 'helloworld' stuff when I first tried about a year into professional development.I've since had the Fortune to ...		em_jones
19715242	12.657991	-7.8507857	comment	5.0	19.5	1555889892	-11.154289	After 20 years of traditional JavaScript, I recently got a chance to use ClojureScript on a decent size project, it's the only way I'm ever doing JavaScript from now on. It's a beautiful way to use Re...		kgwxd
19727047	12.557608	-7.5117292	story	5.0	209.0	1556013957	12.908525	Inside Erlang – Joe Armstrong tells his story (2014)	https://wcm.ericsson.net/en/news/2014/12/inside-erlang--creator-joe-armstrong-tells-his-story	lelf
19729358	12.657122	-7.9044185	comment	5.0	18.5	1556032098	-11.169781	I thought that Clojure was losing its buzz in recent times. Perhaps it is that even though the core language is elegant its ecosystem of leiningen, maven for dependencies, etc, and the whole brittle e...		billfruit
19875162	12.662058	-7.8925037	story	5.0	20.0	1557464157	-11.1690445	Ask HN: Books to Learn Clojure Properly?		rntksi
19882521	13.154221	-7.2644577	comment	5.0	17.5	1557524544	-12.482658	"Prolog is a terrible ""programming language"" - and I would never try to use it as such.  But it is (at least conceptually) an excellent query language.  In that regard, it is much closer to SQL, as is ..."		gavanwoolery
37595986	12.701659	-7.3591876	comment	5.0	23.0	1695294861	12.875365	I cannot support much in terms of money or time currently, but somehow I'd wish there are ways to speed this up.Sure, sponsoring from big corps comes with their own problems, but maybe that would be a...		anonyfox
37622632	13.138541	-7.3000865	story	5.0	126.0	1695471642	-12.497637	Coding Guidelines for Prolog (2011)	https://arxiv.org/abs/0911.2899	tosh
37637684	12.512887	-7.4252386	comment	5.0	16.0	1695593669	-9.172035	Are there no typed languages on BEAM?Or some Typescript style front for Elixir?		actionfromafar
37959084	12.706977	-7.304182	comment	5.0	15.5	1697823280	12.779587	"I'm looking forward to this series. I feel like I'm getting ""grumpy old man"" syndrome with Ruby. I've been using Ruby for long time and I feel like a lot of the changes we get now are more ""wouldn't i..."		phaedryx
37965633	12.582599	-7.5155187	comment	5.0	17.5	1697884562	12.906246	I feel like the Erlang/OTP would be perfect for the MMO use case. It’s what I’d try first if building from scratch.		nvarsj
37984387	12.647604	-7.8980803	story	5.0	58.0	1698061960	-11.14997	Debugging compilers in Clojure	https://jpmonettas.github.io/my-blog/public/compilers-with-flow-storm.html	jpmonettas
38053241	12.73039	-7.3176823	comment	5.0	12.5	1698526249	12.811545	Love Elixir and Phoenix, but the last time I checked (granted, two years ago), the major lack was learning material for people who weren't coming from Ruby experience.		yewenjie
38215065	12.623817	-7.4820027	comment	5.0	13.0	1699590701	12.930766	Coming from F# and only dabbled in Elixir, I find the language unfortunately a bit confusing. For instance, the signature of a function only reveals the name and number of the parameters but not type,...		sinuhe69
38271491	12.647142	-7.8911185	comment	5.0	13.0	1700005903	-11.120185	I like it, and certainly much more than java which I just can't. I have trouble committing to clojure fully for larger projects because it's still a bit niche in terms of the size of the community but...		fsckboy
38406318	12.698552	-7.457652	comment	5.0	18.5	1700847831	12.949018	This is from 2021. I'd be curious if Elixir is still in use, or has expanded at all.Side note: Pablo's blog posts are always quite good.		sb8244
33086849	12.649343	-7.8927	comment	5.0	16.5	1664917417	-11.188719	OK but that's a 500k LOC codebase in javascript/python that nobody understands, maybe the project doesn't even get thereeverybody hates their language when they have 100k LOC of tech debt from 8 years...		dustingetz
33089211	12.658734	-7.9048166	comment	5.0	18.5	1664929326	-11.171035	As the saying goes, a bad workman always blames his tools. You can make a mess in any language, and Clojure is no exception.There are plenty of ways to mitigate the problems the author describes. A fe...		yogthos
33103783	12.574718	-7.521138	comment	5.0	64.0	1665024658	12.8951645	> If you have a team of erlang developers do it in erlang (or whatever). Who cares about the marketAs an IC, I care about the market.  I go to work exclusively to exchange my labor for money to suppor...		scarface74
33165489	13.008755	-7.693634	comment	5.0	18.0	1665506330	-12.758682	Who among us is still using Elm (other than this company)? I thought most would have stopped after the creator's holier-than-thou attitude [0], publicly shaming critics [1], only allowing certain peop...		cercatrova
33165682	12.982562	-7.6566877	comment	5.0	13.5	1665507206	-12.725866	i'm always surprised that PureScript doesn't get as much attention as Elm, despite being frequently-updated by a large set of contributors (https://github.com/purescript/purescript), awesome docs (htt...		dimator
33172591	12.700105	-7.4432263	comment	5.0	18.0	1665546564	12.925702	You can hire any senior dev and give them the elixir book and a week to read it. You can also pick up someone junior who hasn’t learned anything wrong and coach them for a few months. I’ve successfull...		ch4s3
33429944	12.699464	-7.460885	comment	5.0	13.5	1667349438	12.938318	Am I wrong, or does it feel like Elixir has lost momentum over the last couple of years? I'd like to spend more time becoming proficient with the language and platform, but it seems increasingly hard ...		symfoniq
33434566	12.517789	-7.5385327	comment	5.0	13.5	1667391749	12.902567	That quote is absurd because the vast majority of applications on the planet are not written in Erlang and work just fine. Working and fault tolerance are in no way related. Being generous the majority of applications with very high uptime are also not written in Erlang.		throwaway1492
33444832	13.031643	-7.6910024	story	5.0	77.0	1667434407	-12.791904	SVGs as Elm Code	https://blog.noredink.com/post/699829728548372480/svgs-as-elm-code	webwielder2
33460587	12.644031	-7.8976727	story	5.0	168.0	1667525511	-11.166002	Clojure from a Schemer's perspective (2021)	https://www.more-magic.net/posts/thoughts-on-clojure.html	pgayed
33462354	12.592819	-7.856581	comment	5.0	16.5	1667537523	-11.1606	> A quick look at the code implies that various data structures are used under the hood for what looks like one data structure in the language. That's a lot of complexity! I'm not sure that's a tradeo...		kccqzy
33465989	12.644041	-7.891129	comment	5.0	17.5	1667567279	-11.149223	Clojure is a nice well thought out language, I wish it wasn't on the JVM.		weatherlight
33535058	12.567827	-7.522295	comment	5.0	15.0	1668015506	12.930979	This is the problem I have with Erlang developers. They only want to work on Erlang. Pragmatism be damned. It is never about the product or the company. It is only about which of the remaining 20 Erla...		onebot
33797713	12.589963	-7.053762	comment	5.0	15.0	1669790739	12.35624	Yeah, I do not even get why people hate Ruby so much. They do rarely even attack the actual weaknesses of Ruby but instead goes on about Rails specific stuff, the slow performance (a Ruby < 1.9 issue,...		jeltz
33829913	12.602636	-7.9557056	comment	5.0	12.5	1669986059	-13.849906	"Are you basically saying that I can build my front end using clojure?I really want to learn clojure and use flutter for a personal project... are there are any reasons not go down this path? (E.g. the ""official"" implementation of flutter is more secure?, etc.)Thank you for the cool project"		FailMore
33897246	12.594205	-7.4018574	story	5.0	16.0	1670434094	12.868249	Show HN: I built a decentralized CashApp crypto alternative	https://ottr.finance	azakharov
35496218	13.004046	-7.6871104	comment	5.0	37.0	1680978888	-12.801181	I'm not surprised Elm is not viable anymore at a medium or large company, despite continuing to use it every day myself for side projects. The creator has deliberately shunned publicity or popularity ...		savanaly
35496234	12.992003	-7.5574465	comment	5.0	13.5	1680978970	-12.753917	TL;DR: they bridged Elm with React, and when they started using Web Components there was an impedance mismatch between the bridges between Elm/React and WebComponents and the bridge between Elm and React, so they had to pick one of Elm and React.		cwzwarich
28036496	12.629349	-7.8892097	comment	5.0	23.0	1627912300	-11.108586	One thing I don't like about all articles on clojure is that basically all of them say: ah, it's just like lisp with lists `(an (example of) (a list))` with vectors `[1 2 3]` thrown in. So easy!But th...		dmitriid
28036620	12.65475	-7.9033294	comment	5.0	16.5	1627912856	-11.1840315	Single engineers will pick clojure at companies , build a project in it, later that engineer will move on, now nobody can maintain this code so it’s rewritten in some normal language. I’ve seen that happen a few times. That code is hard to read and understand. This is why clojure will remain niche.		ronnier
28225377	12.947962	-7.6633606	comment	5.0	21.0	1629311862	-12.745319	"A seasoned small Elm team will probably scale to higher complexity heights than a small JS team in my experience. Same goes for Haskell and the like.The freaking out about ""oh no I gotta write a small..."		whateveracct
28227511	13.000825	-7.6870046	comment	5.0	13.0	1629322713	-12.760682	What are Elm users using on the back end? FP or mainstream languages?		fulafel
28338869	12.6925335	-7.446842	comment	5.0	15.5	1630165017	12.938847	I resonate with this. The churn I find most demoralizing is in the library/module/component space.I’ve been pushing myself to learn elixir these last few months. This is, by the comments of many, more...		travisgriggs
28374890	12.56389	-7.5126147	comment	5.0	16.0	1630452809	12.906782	Is Erlang good for regular web application building? If so, what's the recommended way of doing so?		Zababa
28391922	12.509699	-7.0748043	comment	5.0	17.5	1630590417	12.352249	"I still get a real kick out of Ruby's elegant and powerful metaprogramming, which is something other languages don't often compare to.    class String

      def colorize(color_code)
        ""\e[#{col..."		nixpulvis
28406522	12.651243	-7.8806453	comment	5.0	13.0	1630687599	-11.106927	You see, I'd like to write more of my software in Clojure (or any functionally inclined Lisp). If there was a really good interop story with a non-gc:d native lang I could do more of it.Clojure is a h...		vnorilo
28502580	12.690306	-7.4408636	comment	5.0	13.0	1631464367	12.924286	Elixir shops are learning quickly that the best bet is probably to hire a senior dev that wants to learn and just give them a couple of weeks to learn.As for the surge in interest, I can’t speak for e...		brightball
28502766	12.523135	-7.4851365	comment	5.0	12.5	1631465711	12.912363	I would love to get into erlang and beam. As far as I know, Beam must be a great tool for servers and webservers in general. But can I use the language in other scenarios, too? For example commandline tools, desktop Gui's or games?		zubspace
28510835	12.676087	-7.019536	comment	5.0	14.0	1631537371	12.381807	I tell people all the time about how good the Ruby job market is. Lots of opportunities and not a ton of people to fill them for some reason.People from other languages don’t seem to want to believe it.		brightball
28584266	12.689211	-7.424606	story	5.0	97.0	1632059038	12.908164	Aino, an experimental HTTP framework for Elixir	https://blog.oestrich.org/2021/09/introducing-aino/	clessg
12668954	12.564138	-7.0451584	story	5.0	24.0	1475964787	12.369045	Gem in the Linux source code	https://github.com/torvalds/linux/blob/master/include/math-emu/quad.h#L29	setra
12678041	12.648289	-7.8755846	comment	5.0	13.5	1476116708	-11.162816	"Maybe a Clojure equivalent to NPM's ""devDependencies"" can manage something like this, so that it gets excluded from the final deployment JAR. It's been a while since I'd done Java/JVM development, but the dev-time vs. deploy-time dependencies configuration should be possible, I would think."		tunaoftheland
12787166	12.657573	-7.896641	comment	5.0	21.0	1477397247	-11.131537	Clojure. Before learning Clojure, I didn't even have a career. I just wanted to get into software development.But at the time, all I knew was a bit of Python. And while I could've learned Java, I figu...		votr
13136239	12.660699	-7.881148	story	5.0	87.0	1481250800	-11.176268	Naga: Datalog-based rules engine in Clojure	https://github.com/threatgrid/naga	espeed
13137119	12.653458	-7.8864856	comment	5.0	17.0	1481265603	-11.092093	"""This turns Clojure into a scripting language much like Python, Ruby, Perl, or Bash"" would be if you added a sleep(45) to the beginning of every script you wrote with them. All the latency of a compil..."		abeyer
13183585	12.645514	-7.878758	comment	5.0	36.0	1481796817	-11.045046	Clojure is not just a Lisp on the JVM. Clojure is a Lisp but also much more: Readable persistent vectors, hash maps, and sets. Protocols, records, and anonymous (reified) instances of protocols/interf...		adrianm
13203785	12.646134	-7.8656225	comment	5.0	12.5	1482023714	-11.144507	I'm a big fan of Scheme/CL but I find development in ClojureScript to be quite frustrating. If anyone has some solutions I'd LOVE to hear them; while es6 is great I'd still prefer a more lispy languag...		errantspark
13213918	12.652243	-7.8981123	story	5.0	129.0	1482173739	-11.170896	Proto REPL, a New Clojure Development and Visualization Tool [video]	https://www.youtube.com/watch?v=buPPGxOnBnk	tosh
13216371	12.620424	-7.4720044	comment	5.0	18.5	1482194572	12.939409	I really want to love Elixir, but man, it fundamentally hasn't succeeded in producing a readable, expressive language.  Look at his implementations!  They're a mess of gobbledegook just like Erlang, p...		aetherson
13252935	12.642084	-7.016371	comment	5.0	13.5	1482640425	12.375249	I'm very likely older than you are, so... no.It was very good at the time. Not so much today. We've learned a lot in language design and Ruby feels very antiquated (mostly because it's dynamically typed).		hota_mazi
13283196	12.642252	-7.8830805	comment	5.0	15.5	1483084858	-11.138803	One issue with Clojure is that it comes with strong opinions (STM, immutable data structures, JVM-Java ecosystem) and thus is not as paradigm-enclosing as other Lisps (e.g. Common Lisp).I'd much rathe...		armitron
13283878	12.606022	-7.27108	comment	5.0	18.0	1483098061	-11.245073	If I'm already using, say, OCaml, why would I want to switch to Crystal? (assuming that multicore takes the same amount of time to arrive in each). Whenever I've read about Crystal it sounds like a br...		lmm
13284449	12.650869	-7.9081464	comment	5.0	24.0	1483107550	-11.17651	I tried and really wanted to like Clojure, but I hated the error messages.  I love how it's a lisp, I love how you write programs in it, I love the REPL, it all just feels nice to me.... until I miske...		twoquestions
13323993	12.673734	-7.4492016	comment	5.0	15.0	1483580716	12.923397	My favorite part about Elixir is that it doesn't try to reinvent the wheel. It's not an untested, trendy new paradigm or tool. It's based on decades of Erlang/BEAM/OTP experience and Ruby/Rails/last 1...		sotojuan
13324111	12.670345	-7.457244	comment	5.0	17.5	1483582125	12.947941	> [Kernel] Deprecate support for making private functions overridable. Overridable functions must always be public as they must be contractsJust lost interest. I thought Elixir was supposed to learn from Ruby.		transfire
13324531	12.564946	-7.479873	comment	5.0	14.5	1483587787	12.89539	Will Erlang/Elixir ever be able to attain the raw performance speed of Go?I'm not talking about concurrency, etc. Just raw computational speed.		tiffanyh
13349795	12.639909	-7.8922915	comment	5.0	18.0	1483885797	-11.162545	"STM and concurrency...sure those are ""aspects"" of Clojure, Clojure's biggest strength is that it's data-centric. The vast majority of the language is focused around manipulating hashmaps, vectors, seq..."		_halgari
13367840	13.005065	-7.684587	comment	5.0	20.0	1484075111	-12.765417	After using Elm and the elm-format package in Emacs for the last few weeks I can say that not having to format the source and just letting your editor do it for you on save or via a command is so very...		Dangeranger
13420738	12.649477	-7.9023533	comment	5.0	19.5	1484683988	-11.179036	> If you like Clojure, but are unhappy with the start-up time, or if you want something outside of the JVM ecosystem, then Pixie may be for youYES! :D		spraak
13439446	12.683075	-7.4129925	comment	5.0	16.0	1484859645	12.875279	"As a Ruby programmer trying to take a look at Elxir, i still find it hard to read. Maybe functional languages take time to get used to but it doesn't seem as ""clear"" as procedure or oop style. I know ..."		rebelidealist
13447163	12.683602	-7.449648	comment	5.0	19.0	1484948238	12.925089	I love Elixir as much as the next guy, probably more, but I want to temper your enthusiasm a bit:> it is modern, with modern tooling around the language (e.g. mix, edeliver)Sort of.  Mix is a nice pac...		gamache
13448009	12.574239	-7.1179876	comment	5.0	29.0	1484957583	-11.235962	Elixir looks interesting, but coming from many years of using Ruby, another dynamically duck-typed language is the last thing I need, and (in my humble opinion!) the last thing I think anyone should n...		atombender
13451677	12.589808	-7.773585	comment	5.0	15.5	1485027630	-11.1697035	Isn't Javascript is the most-used functional language that compiles to Javascript?> [Javascript is] a multi-paradigm language, supporting object-oriented, imperative, and functional programming styles...		paulddraper
13455128	12.648507	-7.406035	story	5.0	67.0	1485092253	-10.354246	HTML parsing in Elixir with leex and yecc	https://notes.eellson.com/2017/01/22/html-parsing-in-elixir-with-leex-and-yecc/	eellson
13475076	12.566514	-7.5146837	comment	5.0	21.0	1485289190	12.889495	I've always thought that Erlang would be more successful if it had a better deployment story, along the lines of Go or Rust: e.g. if you had the option of baking an Erlang runtime into a static binary...		derefr
13543848	12.560529	-7.758013	comment	5.0	14.0	1485976096	5.9053636	Start-up times are still an issue with Clojure on the JVM. For instance with Android I've found the initialization times to be pretty much a show-stopper for any application development.		vvanders
13592096	12.648461	-7.888553	comment	5.0	16.5	1486496915	-11.175448	I think some of your frustrations might stem from your workflow. You really have to use the REPL to get the most out of Clojure development.For example, you should never change a bunch of code in diff...		yogthos
13606394	12.69546	-7.4578567	comment	5.0	27.0	1486642799	12.940394	Funny thing is that I have yet to see the other side of argument - when people had a bad experience with Elixir. It seems so nicely fit into its problem domain that basically everybody that starts doing it is happy with results. I guess that says something.		d3ckard
13607803	12.68827	-7.446347	story	5.0	87.0	1486655988	12.933385	Elixir deployments on AWS	https://medium.com/mint-digital/elixir-deployments-on-aws-ee787aa02a9d#.6sl1vuybf	eellson
27592898	12.628953	-7.4198427	comment	5.0	20.5	1624375710	12.886939	The local-reasoning properties of Elixir (and any other functional language with emphasis on immutability for that matter) make it soooooo much easier to onboard. Meanwhile over in a Rails/Laravel/nod...		ashton314
27606036	12.746481	-7.326951	comment	5.0	15.0	1624463978	12.875313	Last time I checked on Elixir, it seemed like people used Phoenix to pretty much do anything useful with it. Is that still the case?		xwdv
27627764	12.6482115	-7.8943267	comment	5.0	13.0	1624602881	-11.176114	Clojure. Is a complex language but it seems really speeding up your programming when you learn how to use it properly. And the community is really addicted to it.		elias94
27683560	12.604868	-7.482866	comment	5.0	17.5	1625013064	12.920604	Erlang/Elixir were designed for telecommunication programs. If what you are doing is even vaguely like this Erlang/Elixir are going to be perhaps the best language you could pick. If you need to make ...		R0b0t1
27683614	12.684123	-7.397814	comment	5.0	16.0	1625013546	12.861545	I'm running an elixir startuppros:- web-socket story is the goat (and I used to write nodejs)- ecto database library is amazing- productivity is on par with django/rails- performance is comparable to ...		cultofmetatron
27685870	12.621534	-7.449972	comment	5.0	12.5	1625037744	12.922767	Folks who have used Elixir in a team environment (as opposed to for personal use), is the lack of types an issue in navigating big/unfamiliar codebases?		jatins
27700626	12.646644	-7.9055066	comment	5.0	14.5	1625155658	10.97224	"What's the story behind clojure.core/read-string? I have always wondered why it executes code. There are some examples in the docs:
https://clojuredocs.org/clojure.core/read-string"		ollran
27867090	12.649114	-7.762937	comment	5.0	19.5	1626541025	12.883418	Having worked with both to create the same system (building a game server) I've found Clojure actually sits better with the functional thinking style (1 data structure, 100 functions).While Phoenix wa...		kopos
27897590	12.630379	-7.84705	comment	5.0	22.0	1626806781	4.4047894	I've tried deps several times, but I keep coming back to leiningen. Can anyone explain the advantage of using deps to me?What I want from a build tool is: manage dependencies, starting a repl, running...		synthc
12033989	12.5481	-7.52633	story	5.0	52.0	1467683882	12.909287	An Erlang WAT-story about guards and guards	https://medium.com/@elbrujohalcon/there-are-guards-and-guards-71e67d4975d7#.7yc664pkc	elbrujohalcon
12043028	12.568115	-7.5174522	comment	5.0	16.0	1467813038	12.935277	Finding an erlang programmer available on site within 1-2 months is the hardest part of deciding to go with erlang. With go you can take a C++/python programmer and have them writing production code p...		woodcut
