id	x	y	type	relevance	size	year	umap1d	hovertext	url	author
24396142	12.613792	-7.460995	comment	7.0	73.5	1599445132	12.916781	While I agree, the article doesn't really give concrete examples.Elixir is layered, making it easy to learn and master. You can get pretty far with Phoenix without ever understanding (or even knowing ...		latch
24396918	12.648379	-7.479681	comment	7.0	18.5	1599457812	12.914461	Elixir is like an abstraction on top of Erlang and its runtime(otp). It heavily depends on the data structures of Erlang and its very difficult to extend it beyond Erlang's limitations / capabilities....		spapas82
20074251	12.648242	-7.8987947	comment	7.0	21.0	1559464605	-11.190472	"""While Storm's Clojure implementation served it well for many years, it was often cited as a barrier for entry to new contributors. Storm's codebase is now more accessible to developers who don't want..."		zenlot
20111820	12.56881	-7.0301757	comment	7.0	27.5	1559798487	12.406973	As a counter-anecdote, the built in Ruby interpreter in Mac OS X Tiger was the way I learned to program and how I got interested in programming. I don't think a bare Ruby interpreter is the best way t...		indigo747
20197184	12.667218	-7.824117	comment	7.0	31.5	1560711054	-10.6357565	Slightly tangential, but I wish some Lisp would make a serious comeback and challenge mainstream languages. For this purpose, libraries are essential. So better tooling would help, and that's why Ultr...		nextos
20220351	12.6590395	-7.9025383	comment	7.0	18.5	1560911540	-11.137575	Sorry for the off topic.Any good recommendations for a Clojure book for a seasoned programmer but with little exposure to Lisps?		noncoml
20262695	12.648753	-7.9068766	story	7.0	140.0	1561378482	-11.167692	Productivity brought by Clojure [slides]	https://www.slideshare.net/humorless/the-productivity-brought-by-clojure-149170292/	tosh
20357572	12.7506	-7.2983327	comment	7.0	54.0	1562272619	12.863352	I'm currently building a video course hosting platform with Elixir / Phoenix and all I can really say is this has been the nicest tech stack I've ever used in 20 years of web development.IMO it really...		nickjj
20591771	13.151696	-7.2991996	story	7.0	82.0	1564740068	-12.506855	Prolog Control in Six Slides	http://www.t3x.org/bits/prolog6.html	nils-m-holm
20789895	12.6557	-7.9043665	comment	7.0	23.0	1566683141	-11.15582	> 1. Economy of expressionFunny, this list is the same one I use as to why I'm so annoyed with Clojure right now.I inherited a mission-critical Clojure ML library my team uses for it's primary busines...		mabbo
20792370	13.146132	-7.2974505	story	7.0	131.0	1566732424	-12.484818	Adventure in Prolog Tutorial (2016)	http://www.amzi.com/AdventureInProlog/advtop.php	AlexeyBrin
20811305	12.986996	-7.670551	comment	7.0	18.5	1566922631	-12.733287	"I don't want to downplay Elm's accomplishments here, but I really disagree with the ""RealWorld"" example here. Does a 29kb asset make a meaningful difference compared to a 100kb asset? Especially if th..."		bastawhiz
25495539	12.589798	-7.0322104	comment	7.0	20.0	1608563192	12.385359	Anecdotally, since I got away from Ruby, working on software became way more productive and tolerable.Maybe it was something with the corner of the Ruby world I fell into, but the syntax sugar options...		what2build
25999916	12.674412	-7.867039	story	7.0	7.0	1612266860	-10.833058	Choice paralysis between CL and Clojure		TornadoFlame
26096945	12.625444	-7.2002215	comment	7.0	25.5	1613005222	-11.228382	Crystal is nearly at 1.0 and seems way faster than Ruby in addition to having a Ruby like syntax, i'd suggest you take a look at it, promising stuff there.https://crystal-lang.org/edit: did i win the ...		yannoninator
26217013	12.636085	-7.252146	story	7.0	69.0	1613940439	-11.154923	An Introduction to Crystal	https://blog.oisinaylward.me/blog/crystal/	thejokersthief
35525705	12.650906	-7.4400473	comment	7.0	22.0	1681223516	12.8981905	"Hi everyone, contributor to Livebook and Nx here.When we started the Numerical Elixir effort, we were excited about
the possibilities of mixing projects like Google XLA's (from Tensorflow)
and LibTorc..."		josevalim
35525661	12.662767	-7.29066	story	7.0	299.0	1681223343	12.844239	Distributed Machine Learning Notebooks with Elixir and Livebook	https://news.livebook.dev/distributed2-machine-learning-notebooks-with-elixir-and-livebook---launch-week-1---day-2-1aIlaw	josevalim
35590873	12.645189	-7.90394	story	7.0	88.0	1681659288	-11.1606045	Clojure Rationale (2008)	https://clojure.org/about/rationale	djha-skin
35624205	13.1377735	-7.2897296	comment	7.0	21.5	1681878074	-12.496991	I have a Prolog book, somewhere.Prolog feels like a really useful feature was hauled out of some other programming language and made to stand on its own.  Like if I pulled regular expressions out of Perl and tried to make them their own language.		at_a_remove
35624279	13.147839	-7.2797008	comment	7.0	33.5	1681878963	-12.486077	If you're trying to solve boolean satisfiability, you want a SAT solver, not Prolog.If you're trying to solve more general problems, you probably want an SMT solver or other more specific solver (e.g....		eslaught
35961700	12.56496	-7.5082426	story	7.0	259.0	1684244204	-11.296767	Erlang/OTP 26 Highlights	https://www.erlang.org/blog/otp-26-highlights/	ramchip
36210886	12.702833	-7.4321995	story	7.0	62.0	1686049489	12.904034	Absinthe for Large Elixir Applications	https://blog.appsignal.com/2023/06/06/absinthe-for-large-elixir-applications.html	amalinovic
28678969	12.712345	-7.3874326	story	7.0	84.0	1632799500	12.872592	Generate Elixir/Phoenix Boilerplate	https://fullstackphoenix.com/boilerplates	weatherlight
28725218	12.645638	-7.8895254	comment	7.0	18.5	1633138264	-11.144299	I regularly work with Clojure.This is probably an unpopular opinion in this thread, but despite having worked with it for years, I still don’t much like it, mostly because it’s far too terse and the s...		temporallobe
28735841	12.647672	-7.891994	story	7.0	14.0	1633254621	-11.085627	Ask HN: Have you felt that Clojure is a bad version of Common Lisp?		wizardofmysore
28831243	12.625464	-7.8583183	comment	7.0	30.5	1633976472	-11.208138	Yeah, I currently do. I only work with companies who can ensure I get to write and maintain Clojure/ClojureScript projects, or any other lisp-like languages.Just like I'm sure many people would reject...		capableweb
28947928	12.686469	-7.4239564	story	7.0	105.0	1634837357	1.6166385	Building the Brex API	https://building.brex.com/building-the-brex-api-52dcb26cacc8?gi=a8b7e7a3a9bc	hdubugras
28966462	13.162316	-7.3091283	comment	7.0	19.5	1634974524	-12.494983	Are there some corners of the industry where Prolog is beneficial? Or is this mostly an academic endeavour?		lrem
29091751	12.567545	-7.783604	comment	7.0	27.5	1635922132	-10.694149	Maybe a more seasoned LISP-`aterian` can answer me ?I'm in the process of learning ClojureScript - real fun so far. I have of course also looked at other LISPs and have noticed that in CJS the use of ...		rawoke083600
12668959	13.141546	-7.2906594	comment	7.0	25.0	1475964804	-12.486862	I studied Prolog in college (3rd CS year course, 2003).I concluded it didn't deliver on its promise.The promise was that, as in the article, you 'Say what you want, not how you want it done.'In practi...		feral
12718552	12.97696	-7.660848	comment	7.0	26.0	1476625541	-12.764443	"Elixir and Phoenix are stable and by now they're a solid choice (more than enough warranted praise on HN), but I'm still skeptical about Elm from a ""platform"" perspective. From what I can tell, Elm ap..."		sotojuan
13056162	12.6513	-7.909641	comment	7.0	19.0	1480348303	-11.164803	But would it put Rich Hickey's children through college?This is just not something we've got a good, reliable answer for.  E.g. I'm pretty confident that his creating and being the BDFL of Clojure wasn't sufficiently remunerative.		hga
13096325	12.655845	-7.8888793	story	7.0	125.0	1480783425	-11.15621	Macchiato: ClojureScript on the Server	http://yogthos.net/posts/2016-11-30-Macchiato.html	macco
13200378	12.656798	-7.8974085	story	7.0	128.0	1481976067	-11.187889	The Next Five Years of ClojureScript	http://blog.cognitect.com/blog/2016/12/13/the-next-five-years-of-clojurescript	tosh
13235337	12.635808	-7.4851236	comment	7.0	19.5	1482388329	12.937588	Coming from the Clojure world, every time I read about about Elixir, the similarity of the two langauges' values always surprise me: immutability, macros, dynamic and gradual typing, concurrency, and ...		kbuchanan
13323154	12.692613	-7.4450994	story	7.0	229.0	1483572544	12.94362	Elixir v1.4.0 released	https://github.com/elixir-lang/elixir/releases/tag/v1.4.0	njade
13338848	12.738796	-7.3347836	story	7.0	181.0	1483727543	12.795517	Building a CQRS/ES web application in Elixir using Phoenix	https://10consulting.com/2017/01/04/building-a-cqrs-web-application-in-elixir-using-phoenix/	tortilla
13367087	12.685533	-7.4688754	comment	7.0	25.0	1484071155	12.925648	I haven't seen Elixir mentioned here in awhile. As it's the next language I'm interested in learning -- how's it coming along? How are people feeling about it after having more time with it?		needz
13507497	12.673893	-7.467493	story	7.0	16.0	1485624038	12.93887	Ask HN: What's not great about Elixir?		verletx64
27581257	12.5843725	-7.044232	story	7.0	300.0	1624295864	12.376698	Rhizome – A pedagogical example of a JIT for Ruby, implemented in Ruby	https://github.com/chrisseaton/rhizome	thunderbong
27598540	12.632561	-7.876796	comment	7.0	23.5	1624403635	-11.175291	The more surprising/interesting thing to me is that it uses React. I'd be curious to see a performance breakdown (how much headroom is left for a more complex game?)I am also curious how Clojure(Scrip...		brundolf
27605215	12.680287	-7.454452	story	7.0	197.0	1624459973	12.932198	New Elixir 1.12 – The developer’s point of view	https://bartoszgorka.com/elixir-1-12-released	clessg
27683613	12.690705	-7.3471556	comment	7.0	60.5	1625013544	12.840025	We use elixir 24/7 on all projects. All the new programmers that ever worked with us never knew Elixir in the first place.And all of them picked it up in a couple of weeks to a level where they could ...		eric4smith
27903775	12.569098	-7.0261884	comment	7.0	20.0	1626856028	12.369015	The language itself is very interesting. I've dabbled a few times and really like the clean ruby-esque syntax.What puts me off delving further is the lack of support in various editors / IDEs / Treesi...		Normille
27938131	12.661148	-7.892233	comment	7.0	22.5	1627096915	-11.168483	Odd choice to use ClojureScript in a tutorial. The point of a tutorial is to convey information effectively. This is like a physics professor deciding to lecture in French because they think it sounds better.		underwater
12135944	12.603731	-7.0355883	comment	7.0	20.0	1469097544	12.376951	"Ruby is the first language I really like. The core concept of the language is small, just not easy to get, but the change on how to programming is significant. 
Sadly, Ruby is not the language for the..."		windor
12157293	12.569378	-7.520945	story	7.0	129.0	1469436194	-10.336485	Lisp Flavoured Erlang	http://lfe.io/	indatawetrust
12328081	12.584925	-7.5138364	story	7.0	168.0	1471723126	12.914807	How to make an efficient payment system in Erlang	https://joearms.github.io/2016/08/08/Draft-Payment-System-in-Erlang.html	tdurden
12346414	12.542381	-7.5043974	story	7.0	81.0	1471978351	12.911114	AFLFast vs. Erlang	http://mindscope.pw/afl-fast-vs-erlang/	sokoowdevops
18994427	12.572644	-7.074723	comment	7.0	23.5	1548376205	12.380081	Nothing to see here,  peaked my interest since “who would pay for a compiler??” In the modern age of open source.Post has a missleading title, and is just rambles about ruby and compilers.		iamNumber4
19096601	12.656566	-7.904456	comment	7.0	18.5	1549470971	-11.167619	I don't hear as much about Clojure these days, and I don't know if it's because my reading habits have changed or if the community has become quieter. My impression was that other languages have captured the zeitgeist and that the enthusiasm for Clojure has abated. I could be wrong though.		msvan
19277272	12.628726	-7.891578	story	7.0	42.0	1551404657	-11.155804	Hy: A Dialect of Clojure Embedded in Python	http://docs.hylang.org/en/stable/quickstart.html	asimjalis
19346637	12.516915	-7.4920177	comment	7.0	36.0	1552145999	12.930254	"I really wish that Erlang/Elixir were strongly typed. I've blown my foot off with the ""dynamic language gets us going fast and now let's scale"" footgun too many times to not be afraid. Obviously big important systems are built in Erlang, but I don't think I've got the guts to do it."		biesnecker
19347290	12.686277	-7.026033	comment	7.0	29.0	1552152853	12.415535	I'm a Ruby guy and I'd love to feel what you're feeling. Where should I start / what should I check out? Bonus points for concept walkthroughs and materials designed to bring Ruby folks up to speed, s...		peteforde
19417079	13.1525955	-7.2909436	story	7.0	97.0	1552860975	-12.49345	Cloud Management with Prolog	https://dev.to/davidk01/cloud-management-with-prolog-29d8	zdw
19775179	12.548349	-7.7044315	comment	7.0	23.5	1556502077	9.366135	"Some dev: ""Hey, I noticed one of our more complex API endpoints had some pretty bad response latency, so I dug into it a bit.  It turns out our PHP/Symfony/Doctrine stack was generating over a hundred..."		cellularmitosis
16021965	12.646983	-7.2551556	story	7.0	87.0	1514469160	10.449896	Crystal 0.24.1 released	https://github.com/crystal-lang/crystal/releases/tag/v0.24.1	wulfklaue
16315472	12.651139	-7.895935	comment	7.0	21.0	1517914150	-11.143658	Programming Clojure applications with CIDER[0] is a really slick experience. By connecting through an nREPL port to a running environment you can capture variable values like function inputs, change a...		mbil
16337731	12.661782	-7.3433976	comment	7.0	24.5	1518147636	12.904984	So I am trying to move away from NodeJs for my next project and I can't decide between Elixir and Go. Can't decide what to choose, any idea if there is any advantage for a noob to learn one or the other?		todd_wanna_code
16407650	12.659345	-7.792688	comment	7.0	29.5	1518981268	-10.5457735	I should expand then: 17 years later, where are the successful Lisp (ok, and Clojure) startups fighting the Microsofts (C++, .Net), Facebooks (PHP!!), Apples (Objective-C, Swift), Amazons (Java, C++, Perl), Googles (C++, Java, Python, Go), Twitters (Ruby, Java, Scala), Dropbox (Python, C++), etc.?		oblio
16412391	12.645854	-7.8925076	comment	7.0	22.5	1519042333	4.251235	Not sure why the excitement around ditching Lein when it looks like there is little or nothing to be gained at this time? The author describes a handful of other tools that are necessary to do things ...		whalesalad
16412050	12.649257	-7.9020414	story	7.0	215.0	1519036811	-11.187794	A Clojure learning journey	https://www.stuttaford.me/2018/02/18/a-clojure-learning-journey/	robstu
16415137	13.010819	-7.692651	comment	7.0	20.5	1519069198	-12.769888	Don't you want people that care about your product instead of the technology behind it?  I do.  Because there may come a time when another technology is a better fit for your product and ultimately yo...		onebot
16825003	12.834736	-7.0680327	story	7.0	104.0	1523567707	12.718957	Choosing Elixir's Phoenix to Power a Real-Time Web UI	https://blog.wallaroolabs.com/2018/04/choosing-elixirs-phoenix-to-power-a-real-time-web-ui/	JONBRWN
16939013	12.652429	-7.8914256	story	7.0	183.0	1524813629	-11.086166	Lisp in Small Pieces of Clojure, part 3	http://gmorpheme.net/lisp-in-small-pieces-of-clojure-part-3.html	ghosthamlet
17121691	13.0682955	-7.3293386	comment	7.0	25.5	1526935520	-12.469187	I've shared this with anyone who will let me divert the conversation to Prolog.   At work we have the Haskell folks, the Lispers who move everything towards Lisp, and I'm the one who moves every conversion towards Prolog, then I send the link to this. :-D		segmondy
17288493	13.138013	-7.2887483	story	7.0	125.0	1528750455	-12.485773	Web Prolog and the Programmable Prolog Web [pdf]	https://github.com/Web-Prolog/swi-web-prolog/blob/master/web-client/apps/swish/web-prolog.pdf	triska
17439861	12.660568	-7.889985	comment	7.0	47.5	1530516374	-11.073259	Clojure for me is the perfect modern LISP, too bad it seems it's dying (happy to stand corrected there)		eafkuor
17536432	12.660217	-7.868303	comment	7.0	20.0	1531680538	-11.034083	"I don't really get why you'd ever want a Lisp-2. Is there an argument/explanation somewhere that I could read up on?(I've used Clojure and JS, which also seems like a ""Lisp""-1 in that you can just put..."		gtdthrow
17574351	12.565045	-7.7303047	story	7.0	118.0	1532088888	-11.074735	Command-line apps with Clojure and GraalVM: 300x better startup times	https://www.astrecipes.net/blog/2018/07/20/cmd-line-apps-with-clojure-and-graalvm/	kimi
17600763	13.003722	-7.688154	comment	7.0	31.0	1532438800	-12.758679	Learning ELM really helped me learn Haskell which is something I'm continuing to do, but Elm helped a lot. So I can see why a Haskell shop would want to use Elm for their frontend work. This makes tot...		salimmadjd
17681213	12.690662	-7.4470115	story	7.0	67.0	1533313747	12.934567	Deploying Elixir	http://luk3thomas.com/notes/deploying-elixir/	luk3thomas
17723744	12.643144	-7.9097443	story	7.0	231.0	1533819071	-11.156593	Problem Solving and Clojure 1.9 with Rich Hickey	https://www.case-podcast.org/20-problem-solving-and-clojure-19-with-rich-hickey	tosh
17724353	12.660774	-7.897938	comment	7.0	24.5	1533824106	-11.118049	On a tangential note, I'm learning Clojure and kind of just getting started on using it.I like it how its a Lisp, and ever since I've learned Common Lisp, I've been wanting to use Lisp at work for eve...		kamaal
17843006	13.014499	-7.6972885	comment	7.0	34.0	1535237390	-12.7510805	The reddit discussion for this post is a telling confirmation of the articles complaints about the community forums/interaction: https://www.reddit.com/r/elm/comments/9a0hc6/elm_019_broke_u...		detaro
21090933	12.67469	-7.436908	story	7.0	193.0	1569585952	12.944255	Application Layering – A Pattern for Extensible Elixir Application Design	https://aaronrenner.io/2019/09/18/application-layering-a-pattern-for-extensible-elixir-application-design.html	aaronrenner
21092197	12.652168	-7.89626	comment	7.0	32.0	1569593529	-11.179546	It hasn't fallen. The Clojure community has been growing steadily and continues to grow (it's a great community, I'll add). Things have just settled down since, that's why there are fewer announcement...		snapey
21111662	12.669107	-7.396817	comment	7.0	27.0	1569815830	12.85348	WhatsApp used to use Erlang, not anymore. Facebook rewrote it completely in C++.https://www.quora.com/When-did-Facebook-switch-away-from-usi...		aloknnikhil
21111996	12.556368	-7.517905	comment	7.0	39.5	1569821146	-5.308719	"I have never programmed Erlang but it feels like it is the currently only language that is some kind of secret weapon. It has similar aura than Lisp had before that with Erlang you can do stuff beyond ""normal"" languages."		atupis
21113034	12.557437	-7.492163	comment	7.0	28.5	1569833891	12.899443	We developed Online Charging System in Erlang that served couple million subscribers for close to three years. I found the whole experience fairly terrible.Erlang is nice enough language and I don't m...		ihuk
21252096	12.658163	-7.023059	comment	7.0	29.5	1571082689	12.372845	No love for Ruby again, the folklore of Ruby hatred within Google and Amazon is quite real.		ksec
21288190	12.639488	-7.2743225	story	7.0	13.0	1571366259	10.479945	Crystal's New Installation Page Is Just Beautiful	https://crystal-lang.org/install/	sdogruyol
21300503	12.621699	-7.868989	comment	7.0	30.5	1571515804	-11.161358	I stopped using clojurescript around 2015, primarily because I was tired of searching for/implementing clojure-idiomatic wrappers around the many javascript libraries out there. Put another way, I lef...		bikeshaving
21310577	12.9714365	-7.679984	comment	7.0	19.0	1571651444	-12.752976	Considering that Elm seems to be by far the most stable, usable and used alternative, just dismissing it for the lack of typeclasses seems a bit short sighted to me. Is this a case of avoiding success at all costs? :)		zoul
21333169	12.656779	-7.89686	comment	7.0	22.0	1571826767	-11.201977	I cannot believe that you make more from such a niche dev tool  than your job at Google. I always thought people who use clojure/scheme would be using their custom setup in emacs or vim.I'm interested to learn more details, how things were when you first started out selling the app and the trend.		spv
21380077	12.574358	-7.5170403	story	7.0	366.0	1572287836	12.916274	Adopting Erlang	https://adoptingerlang.org/	ProfDreamer
21431791	12.561986	-7.5012016	story	7.0	115.0	1572749522	-9.462204	Zotonic: An Erlang Web Framework	http://zotonic.com/	brudgers
21489877	12.575584	-7.0645556	story	7.0	178.0	1573278562	12.324828	Scientist: A Ruby library for carefully refactoring critical paths	https://github.com/github/scientist	kburman
21604850	12.648937	-7.902788	story	7.0	112.0	1574424737	-11.1598215	Clojure-flavored WASM text format	https://github.com/roman01la/clj-wasm	tosh
39098803	12.555419	-7.0722985	story	7.0	133.0	1705976882	12.355276	"The end of ""Useless Ruby sugar"": On intuitions and evolutions"	https://zverok.substack.com/p/the-end-of-useless-ruby-sugar-on	todsacerdoti
39172318	12.551448	-7.070587	comment	7.0	21.0	1706498063	12.384585	Respectfully mostly disagree. Ruby is full of sharp knives. Other languages have dull knives.Writing code without thinking will cut you either way.Things like method missing are exactly the right solu...		RangerScience
39183666	12.639891	-7.8614907	comment	7.0	30.0	1706567488	-11.16426	"Don't really get the criticism of Clojure for being hosted on the JVM, particularly relative to its status as a ""productive"" Lisp. Like oh, you get access to one of the biggest and most mature library..."		charlotte-fyi
39337778	12.605796	-7.2472653	comment	7.0	22.0	1707679676	-11.239425	Crystal was never able to find traction as a Ruby clone that could compete with C speeds. Why would a Python clone have any better luck? I don’t think anyone would accuse Python of being dramatically more usable than Ruby.		jimbob45
39342863	12.679721	-7.4477534	story	7.0	140.0	1707728002	12.9512415	Shell scripting with Elixir	https://arathunku.com/b/2024/shell-scripting-with-elixir/	bo0tzz
18104326	12.547871	-7.0908	story	7.0	66.0	1538278530	12.381897	Sorbet: Gradual typing of Ruby at Scale	https://sorbet.run/talks/StrangeLoop2018/#/	craigkerstiens
18128879	13.129197	-7.285849	story	7.0	98.0	1538560947	-12.493514	Loglan – a predicate logic-based language for humans	https://en.wikipedia.org/wiki/Loglan	entelechy
18139367	12.621729	-7.893918	story	7.0	101.0	1538657219	-11.169024	Scmutils in Clojure	https://github.com/littleredcomputer/sicmutils	tosh
18175088	12.587519	-7.533476	story	7.0	182.0	1539085700	-12.667029	An Elm compiler for the Erlang Virtual Machine	https://kofi.sexy/blog/elm-beam	hkgumbs
18178215	13.149868	-7.3053236	story	7.0	133.0	1539107618	-12.4935255	The Birth of Prolog (1992) [pdf]	https://web.stanford.edu/class/linguist289/p37-colmerauer.pdf	mindcrime
18309826	12.652936	-7.454493	comment	7.0	32.0	1540566073	12.8896055	I'm bullish on Elixir and I agree that ExUnit deserves to be singled out.Whether you consider Elixir fast or slow probably depends on what you're coming from and what you're doing. Personally, I wish ...		latch
18345911	12.649627	-7.8971276	comment	7.0	25.5	1540995808	-11.109991	"This is a bit tangential to the post, but I've seen a couple comments in this thread that amount to ""Clojure is hard to read"", but I think that's a really unfair comparison, because people are unwitti..."		projectileboy
18376652	12.648776	-7.8925543	story	7.0	117.0	1541349329	-11.175259	Learning Clojure: comparing with Java streams	https://blog.frankel.ch/learning-clojure/5/	nfrankel
18476137	12.63273	-7.8920226	story	7.0	83.0	1542472363	-11.194129	Genetic Programming in Clojure	https://sulami.github.io/posts/genetic-programming-in-clojure/	sulami
18539939	12.660822	-7.90655	comment	7.0	47.0	1543299528	-11.197204	Though Rich is right, it pains me to read this because it is indicative of some disputes in the clojure community. I might be mistaken, but it seems that Rich is reacting to Chas Emericks' twitter pos...		newcrobuzon
18552925	12.57942	-7.492435	story	7.0	193.0	1543423035	12.89876	Erlang/OTP 21's new logger	https://ferd.ca/erlang-otp-21-s-new-logger.html	signa11
18656052	12.639467	-7.479905	comment	7.0	18.5	1544543233	12.933804	I really like Erlang and Elixir, but I'm really worried when I see a tech stack that is still trying to figure out deployment and runtime configuration of systems.I'm not trying to be inflammatory her...		dudul
18767592	12.65481	-7.8919935	story	7.0	198.0	1545888930	-11.1781025	Clojure is Capable	http://ahungry.com/blog/2018-12-26-Clojure-is-Capable.html	ahungry
18838508	12.682375	-7.47836	comment	7.0	21.0	1546785482	12.939694	"Could someone give a more concise reason for using Elixir? I have a ""rule of 3"" for checking out things - the third time I hear it mentioned and it seems interesting, then I'll go check it out.Elixir ..."		mrspeaker
29800786	12.630022	-7.4790583	comment	7.0	18.5	1641331661	12.927559	Is anybody using Erlang/Elixir in production for web apps? It seems well-suited for the modern age of using microservices/etc. and scattering things across several servers.		rackjack
29822849	12.690293	-7.455633	story	7.0	274.0	1641473042	12.943928	Elixir and Machine Learning: Nx v0.1 released	https://dashbit.co/blog/elixir-and-machine-learning-nx-v0.1	josevalim
30149213	12.715953	-7.4176035	story	7.0	84.0	1643643871	12.948054	Learn Elisp the Hard Way (2011)	https://github.com/hypernumbers/learn_elisp_the_hard_way	AndroidKitKat
