id	x	y	type	relevance	size	year	umap1d	hovertext	url	author
17476526	13.709038	6.9145284	comment	6.0	34.0	1530929977	-15.896472	I mean, replacing food stamps with thousands of dollars a month means the money could be spent buying food. I'm confused why you would think a UBI would not be allowed to be used to purchase food? The...		tathougies
17476537	13.720639	6.9320006	comment	6.0	20.5	1530930119	-15.896622	I think your parent post's implication may be that those receiving UBI who are on specific government programs would not responsibly budget the right amount of money to the right need, and that there ...		jschmitz28
17476588	13.713829	6.9212413	comment	6.0	19.0	1530930592	-15.894344	My frustration with Basic Income is that it’s a legislative solution to a productivity problem. Instead of redistributing wealth, a practice that can be overturned any time, I advocate for the intenti...		TaylorAlexander
17506865	13.72036	6.932406	comment	6.0	15.5	1531317228	-15.895649	"It's easy to do some research and say, ""Hey, this works! Look at all the places that did it!""Here in the US, we already have a complex network of safety nets to take care of the people who UBI is real..."		at-fates-hands
17588101	13.719205	6.9304905	comment	6.0	20.5	1532284672	-15.896837	Forget UBIs and other bandaids. Just simply taxing their wealth away would transform society. Plutocratic governence won't end until there are no more plutocrats.		viburnum
17664612	13.707388	6.9104247	comment	6.0	20.5	1533144062	-15.894329	There ought to be a name for a minimal UBI that can allow people who are normally just scraping by to bridge short periods of unemployment, unexpected expenses etc. £4K wouldn't be much for the averag...		curtis
17852572	13.720086	6.9311185	comment	6.0	23.5	1535388579	-15.897033	> 0. People are primarily self serving and will likely not use the money as proponents intentThis is an assumption, rooted in the belief that people are poor because they are lazy, and it is wrong. Th...		nkoren
21153585	13.722259	6.934149	comment	6.0	17.0	1570147507	-15.896252	Ugh the whole idea of UBI scares me. It sends me shivers. The idea of shifting responsibility for a personal well being from a person to a governmental entity is really, really, really scary.It will c...		rinchik
21311266	13.720056	6.931737	comment	6.0	27.0	1571659634	-15.896771	Seems they would be a decent candidate to try out UBI and see if in practice it works.They’ve got wealth and they have lots of underemployed and unemployed.		mc32
21715774	13.681714	6.869344	comment	6.0	21.5	1575575395	-15.890918	Yang's implementation is very regressive. You have the regressive VAT tax, but then you also have the fact that you are cutting government benefits then giving everyone $1000. So the poor just end up ...		Miner49er
13206336	13.716654	6.9286375	comment	6.0	28.5	1482078593	-15.8928175	Basically a grassroots UBI movement.Will be interesting to follow these numbers when self-driving semi-trucks start taking over.Edit: I meant similar to UBI in the sense that the group that views them...		tyingq
13303891	13.717625	6.928577	comment	6.0	19.0	1483386967	-15.8981905	This article seems transparently fallacious to me, since the income generated for the 1% is due to investment capital. Investment capital, among a million other attributes that differentiate it vs a s...		gfodor
12068037	13.71784	6.928208	comment	6.0	46.5	1468197020	-15.895539	Part of the issue is UBI poses a threat to established ways of doing things -- many businesses rely on the relative lack of social and labor mobility as a way to provide the continual supply of low-pa...		ubernostrum
12068083	13.717844	6.9291825	comment	6.0	29.5	1468197598	-15.894629	Not at all. UBI is a cynical attempt to push people into even more if casual gig jobs that are en vogue right now.UBI lets you subsist so that you're free to drop off my groceries for beer money.All o...		Spooky23
12243184	13.718498	6.928729	comment	6.0	55.0	1470596704	-15.895511	The idea is that with UBI people don't need to work 40 hours per week at a miserable job if they don't want to.  This in theory causes prices for stuff like McDonalds to go up which should reduce cons...		mason55
12277301	13.69396	6.9015865	comment	6.0	36.0	1471022905	-0.86777717	Glad to see someone acknowledging the myopic view of most intellectuals.During my time in academia (PhD), I'll admit now I had very little idea of what life was like for the majority of people.Since t...		rubidium
35412515	13.721127	6.9335375	comment	6.0	15.5	1680454267	-15.898113	Why should we care what MLK thought about UBI?		peanuty1
35492972	13.718464	6.9299207	comment	6.0	18.0	1680961178	-15.878219	Just hurry up and automate everyone's jobs so we can get UBI		Beaver117
28647095	13.72073	6.930923	comment	6.0	24.5	1632513447	-15.897345	Nah, it's not.Monthly lottery winners are.If you know that 'free money' is just a temporary thing, you don't quit your job and move somewhere where that amount of money is enough to survive, and just ...		ajsnigrutin
22497016	13.720886	6.932955	comment	6.0	30.5	1583435818	-15.897227	Exactly. With a permanent UBI in place you can throw all these studies out the window.		zazaalaza
22498446	13.720552	6.93277	comment	6.0	19.5	1583443431	-15.893134	"The point of UBI is not to fund people's vanity adventures in education. It's to support people who would otherwise be starving or homeless without a job.Regarding ""sickness"", the severity is importan..."		tic_tac
22919187	13.710082	6.9195275	comment	6.0	24.0	1587334032	-15.892055	UBI to people outside of the workforce is entirely different.  My argument against UBI is that it erodes the desire to work, and we still need nearly everybody of working age to work... until the robots catch up (they still have a lot of catching up to do).		mikedilger
23105724	13.720721	6.933634	comment	6.0	26.0	1588873059	-15.897808	"You have to be really careful about generalizing from ""personally getting regular free money"" to everyone getting it. Under a UBI, everyone, unconditionally[1], gets the free money.  That has signific..."		SilasX
23140463	13.720704	6.9329095	comment	6.0	20.5	1589191046	-15.895224	Why can’t we ever design one such experiment right? It’s as if we were giving ammunition to those opposed to it by conducting trials that have flaws! Would it really be so hard to run a proper test th...		ornornor
23201337	13.722446	6.930793	comment	6.0	18.0	1589615681	-15.897142	The economy is crashing, the inflation is rising and that makes UBI look better? How?		TomMarius
23201368	13.7192135	6.9293785	comment	6.0	20.5	1589616080	-15.896309	The virus crisis makes UBI look worse. We are ~2.5 months into lockdowns in the United States and all people got so far has been a check for $1200.People who support UBI need to provide a compelling j...		twblalock
23258124	13.704398	6.908155	comment	6.0	20.5	1590068175	-15.8882065	What is the actual case for Basic Income? I hear that it 'solves' the problem of automation ... except that it doesn't actually solve it AT ALL. If automation will lead to high unemployment, basic inc...		macspoofing
23258240	13.719063	6.9292727	comment	6.0	23.5	1590068694	-15.89653	I'm a leftist person who isn't an opponent of ubi, but is an opponent of Yang's ubi. I have no problem with raising taxes, but I do have other concerns.Namely, if everyone got $x,xxx a month, how do w...		Pfhreak
33156964	13.72005	6.9299655	comment	6.0	37.0	1665439706	-15.8977585	Just as the various US fiscal packages over the past few years are about to do the same.I consider UBI already tried on a mass scale at this point. There’s no intrinsic value to a dollar, handing them out en masse doesn’t enrich people		adam_arthur
38264086	13.720144	6.930677	comment	6.0	18.5	1699974246	-15.896871	Somewhat off-topic, but I must ask: does UBI not depend on expected infinite economic growth?If the economy grows, then we assume the tax base supplanting the UBI coffers will continue to match outflo...		financltravsty
15444791	13.719198	6.9300685	comment	6.0	17.0	1507664810	-15.897076	> The whole article is based on the assumption that once basic necessities are covered, huge numbers of people are going to call it a day and cease economically profitable activity. I think the opposi...		RestlessMind
13619208	13.719552	6.929217	comment	6.0	22.0	1486763379	-15.896729	The idea that giving someone just enough money to live will kill their motivation is insane. If that were true why do people still work 40+ hour weeks when they could be earning enough to live on just...		TheSmiddy
13697210	13.718779	6.928817	comment	6.0	18.5	1487697157	-15.897429	> as people pervert it with exceptionsAs a once landlord, even if government did a great job with it, I don't see why rents wouldn't go up to match it. If my tenants were guaranteed 50k a year, I woul...		drzaiusapelord
13891102	13.718425	6.9289656	comment	6.0	27.5	1489720312	-15.902172	How does a UBI prevent this? The people described in the article don't seem to want more money. They want to play video games. Giving them enough money to live off of would allow them to do exactly th...		yummyfajitas
31543098	13.719755	6.9320517	comment	6.0	16.0	1653766907	-15.9011965	The only realistic way the government could even attempt to accomplish this in any practical way is if they implemented a UBI.		hitpointdrew
25580409	13.71918	6.93095	comment	6.0	17.0	1609323652	-15.892091	I dislike UBI a lot. (coming from the left side of the European political spectrum for what it's worth) for a few reasons. The first one is that I think work is a fundamental aspect of personal life a...		Barrin92
25944445	13.720899	6.932738	comment	6.0	39.0	1611851650	-15.897744	Or all the UBI money would pump up rents to the point that living costs make it infeasible again.		SilasX
26029669	13.720435	6.9309306	comment	6.0	31.0	1612472219	10.830466	How do you design an unemployment/UBI system that provides an incentive not to use it unless necessary and not to stay on it any longer than is necessary?		malandrew
26118764	13.722389	6.932593	comment	6.0	30.5	1613165371	-15.89774	the hardest part of UBI for me to understand is how much of it will be eaten by inflation and how much will actually help people.I’d like to see a lot of research on that part of the topic.  Maybe tak...		wtvanhest
34535512	13.721721	6.9334455	comment	6.0	41.0	1674755412	-15.896099	It seems like if our society had UBI (Universal Basic Income) we wouldn't have to worry so much over cases like this - people would be able to get by, it wouldn't be a crisis for so many individuals.		yboris
34641645	13.715973	6.9264884	comment	6.0	22.0	1675435617	-15.917206	> Seems fairly obvious to me that the boringness comes from adults having to… make a living. And for most people that equates to a 9-5 job that demands conformity and leaves little room for other thin...		PragmaticPulp
38687972	13.719296	6.9302406	comment	6.0	26.5	1702932368	-15.89141	Then we should start planning now by stopping the notion that being a good, moral person includes earning a wage.There are big political issues with achieving UBI. One of them is reversing that notion...		PodgieTar
32653763	13.699586	6.9024177	comment	6.0	52.5	1661886012	-15.889979	It's interesting that you basically just made Andrew Yang's argument for Universal Basic Income -- that we need to redistribute the wealth of automation to all of society.This is the perfect example -...		jedberg
32654529	13.718789	6.9296126	comment	6.0	32.0	1661890683	-15.897662	UBI is impossible to work for two reasons:1) We need people to do low level jobs. So if UBI exists, wages will need to rise until people are willing to do them. This will happen along with price raise...		spywaregorilla
23791568	13.717975	6.9290867	comment	7.0	17.5	1594389998	-15.895958	It is a very complicated issue. I'm all for needs based aid from the government without all the bureaucracy. It would even allow us to help more people on the fringe.However, one thing that no one eve...		snarf21
23998135	13.715154	6.92492	comment	7.0	37.5	1596117266	-15.897659	Can you provide some evidence for this?  Your argument, by extension, would mean that anything that increases a person's income is effectively pointless.  Increased minimum wage? Prices increase and e...		alistairSH
24258640	13.719697	6.930649	comment	7.0	27.0	1598258780	-15.897894	^^ThisThis is the only argument I present to people that talk to me about UBI in a positive way, ie they want UBI.If people are given enough money to live on for free I would wager there is zero incentive for them to be productive within society. Zero.Change my mind!		_Understated_
19980822	13.727726	6.9378004	comment	7.0	19.0	1558531061	-15.897118	On the other hand, in a few years you won't need even basic literacy to thrive in developed countries.It'll be enough to grunt in the general direction of the nearest piece of smart furniture. Amazon ...		nudq
20236109	13.716038	6.923155	comment	7.0	31.5	1561057275	-15.893846	"Nobody can ever answer the question of ""What happens when someone blows their UBI and cant afford to eat?"" Will we let them starve? You'd almost have to from the government side of things.How about 5 ..."		tomschlick
25972179	13.712484	6.9188633	comment	7.0	36.0	1612035341	-15.904547	Authors like this frame the UBI/minimum wage debate as if we just haven't figured out the right policy mix to fix poverty or precarity -- as if it's a problem of ideas.  I propose that it's in fact a ...		overton
26427504	13.719749	6.9307446	comment	7.0	20.5	1615488485	-15.896598	I have written about this before, but I believe this perspective is worth repeating.UBI is a fantastic idea in theory. It is more efficient in terms of capital and human resources than the current sys...		Proziam
12695323	13.718469	6.929329	comment	7.0	29.5	1476296679	-15.896345	There's a significant difference between what happens when you give an intervention to part of a population and all of it. Specifically, the overall system they're a part of will respond differently.T...		ThrustVectoring
13337628	13.722361	6.93344	story	7.0	17.0	1483720381	-15.899942	The UBI already exists for the 1%	https://medium.com/@MattBruenig/the-ubi-already-exists-for-the-1-d3a49fad0580	spditner
27576786	13.717518	6.9279113	comment	7.0	63.0	1624256512	-15.897204	I don't think UBI is ever the answer and the article hints at that. Giving the low paid workers 'bargaining power' doesn't negate the points OP made. Flooding the economy with free money to everyone a...		RhodoGSA
27687741	13.712143	6.9202147	comment	7.0	25.0	1625056886	-15.889949	But the rate of product/services that machinery will produce will make that even a small tax to corporations producing everything autonomously will be enough to feed and give a quality of life to ever...		gutino
27849990	13.720441	6.932339	comment	7.0	25.5	1626382379	-15.898296	"If anyone wants to use the term ""UBI"" they should be forced to first watch ""Freedom to choose"" https://www.youtube.com/watch?v=D3N2sNnGwa4&list=PL474202319...UBI only works when it's 1) Universal (even to rich people) and 2) When it's funded by dismantling some/all of the existing welfare state."		maerF0x0
12277999	13.720425	6.931938	comment	7.0	20.5	1471028726	-15.896058	"The danger I see with UBI, is (in addition to possible inflation, etc.) is that commentators on HN tend to be of higher education, curious, and simply ""hackers"". Most people here would love to be paye..."		hahooooo
19068771	13.720664	6.932973	comment	7.0	23.0	1549189098	-15.893904	I still don't understand how UBI will be paid for. If my calculations are correct, even 560 USD per month would require Finland to increase tax revenue by a third in order to fund it, if the UBI was p...		FartyMcFarter
19571106	13.719636	6.931213	comment	7.0	30.0	1554379276	-15.897587	As an employed person making 100k, if given UBI I would quit and not do anything productive-to-society for most of the rest of my life. So yes, that is a legitimate argument. The counter-argument is t...		Talyen42
15918608	13.7145405	6.9237647	comment	7.0	32.0	1513206812	-15.89344	The UBI debate is fundamental to how we perceive society and what kind of society we want to build into the future.If one's idea of human society is people working to earn money. Fullstop. And those w...		tobbyb
16820806	13.71229	6.920523	comment	7.0	31.0	1523540681	-6.7839723	Millions will wake up with no goals and no structure to their lives because they have all of their most basic needs satisfied by UBI if the democrats have their way. Republicans will require mandatory...		justaman
16875406	13.721204	6.9315624	comment	7.0	21.5	1524141989	-15.897717	These experiments confuse me. Haven't we already seen the result of UBI? Pensions, states that issue money (from state oil income etc), allowances, annuities?The world doesn't come to an end; the peop...		JoeAltmaier
16936819	13.719363	6.929786	comment	7.0	23.5	1524784182	-15.896336	Gerald W. Johnson, a journalist who covered The New Deal during the 30’s for the Baltimore Sun, wrote that what angry poor people want is never usually money (or else they would have revolted a long t...		Bucephalus355
17013770	13.718622	6.9303174	comment	7.0	20.0	1525708674	-15.895807	"Any UBI study that doesn't include everyone in a society is not studying ""universal"" basic income at all. It's just giving some people money. It would be very surprising if this didn't yield positive ..."		tribune
17246369	13.702863	6.897841	comment	7.0	24.5	1528287427	-15.8952875	> a small proportion of the population has manipulated law and the markets to allow them to make off with the wealthI was with you up to that point. Do you have a reference for this? My reading was th...		pedrocr
21167413	13.717957	6.9282355	comment	7.0	26.0	1570303613	-4.127981	As I have said in a number of these types of threads, saying we will pay people off / implement UBI as a solution to reduced participation in the labor force dramatically underestimates the complexity...		Thriptic
18329788	13.721237	6.932564	comment	7.0	28.0	1540837183	-15.896922	My guess is this is of interest to us because it sounds an awful lot like UBI. But, I think the key difference is that the money is connected to parents, who presumably have a standard for how it's sp...		intopieces
29978134	13.721706	6.9325185	comment	7.0	35.5	1642509474	-15.895103	The hard part is that UBI is extremely, extremely expensive. The variant I'm in favour of goes something like:1. $12k / year to everyone2. 50% flat tax (on non-UBI income)3. Small federal land value t...		3pt14159
30247861	13.715418	6.9235506	comment	7.0	40.0	1644254298	-15.89483	So we are going to raise taxes on the middle class to give free money to people that choose not to work? Every single family would then do a calculation to see if its worth the second earner working o...		wonderwonder
33157092	13.716233	6.9252853	comment	7.0	43.0	1665440606	-15.897187	This is a very hard problem to solve. The issue is not just the money and wealth itself but the power to control its flow. You can arbitrarily distribute the money but there are so many gatekeepers de...		summerlight
27120687	13.719306	6.930952	comment	7.0	24.5	1620753332	-15.896879	"I'm a great believer in the power of cash to solve problems. Rutger Bregman's Utopia For Realists opened my eyes on this matter. The minority of ""rotten apples"" only spoil the concept if we let them -..."		playeren
27273703	13.719729	6.930711	comment	7.0	20.0	1621925653	-15.907925	While I agree with the simplicity argument, I think providing a free service is very different from giving everyone free money. UBI is likely to have many unintended consequences. For example, what wo...		xputer
27422566	13.721593	6.934602	comment	7.0	22.5	1623073697	-15.895855	The past year has convinced me that UBI would be an unmitigated disaster.		whiddershins
14959231	13.719409	6.9314046	comment	7.0	21.0	1502208264	-15.894628	1.  Thank you Obama.2.  I don't think UBI is the solution.  Have you met any trust fund babies who don't have to work?  Do you think it's wise to create more of them?		jgalt212
15574737	13.707834	6.9242496	comment	7.0	26.0	1509189307	-15.895979	I feel like this basic income ideology is really rooted in laziness - like, everyone likes free things, right?  You don't have to work for it?But - do we ever really ask where that money is coming fro...		mmjaa
12473859	13.720764	6.932108	comment	7.0	27.5	1473608223	-15.896084	Thank you for your response. I wrote this article because it seems to me the basic income discussion is orchestrated by people, notably in technology, who are unaware of politics and reluctant to get ...		Nicolas_Colin
35288904	13.706163	6.91291	comment	7.0	28.5	1679665113	-15.889666	I really don’t want my productivity to increase.Worst case scenario is that it gets SO good at writing code that software engineering teams are severely downsized or are made obsolete altogether, and ...		Jevon23
35408255	13.711205	6.918565	comment	7.0	23.5	1680422295	-15.887112	To all the detractors of work ethic and the supporters of UBI: What freedom will exist in a world where everyone is reliant on their government for survival, and all mass communication is mediated by ...		noduerme
35412747	13.719654	6.9305954	comment	7.0	23.5	1680455534	-15.8990755	Cost living expenses before UBI = x.Cost of living expenses after UBI = x + UBI.The price of goods will always rise to what the market will bear.If you inject money into a market with schemes like UBI...		claytongulick
35489444	13.720224	6.930186	comment	7.0	27.5	1680917265	-15.897896	> In addition, the UBI creates bad incentives, and requires enormous taxes if funded at an “acceptable” level.> A UBI experiment, in contrast, might be a good way to convince people of the folly of th...		thethirdone
28647018	13.718331	6.9282975	comment	7.0	41.5	1632513080	-15.894933	I think this (COVID relief) is the closest America is going to get to a legitimate domestic experiment on UBI we're going to get for a while so it's rather heartening to see the drop in family poverty.		munk-a
22493804	13.720472	6.932969	comment	7.0	33.5	1583419013	-15.89457	My issue, and I only have one, with these pilot projects for basic income is that its not realistic. The people in the project know that it will end at a fixed time, so their actions are different compared to what would happen in a BI/UBI system.		RegnisGnaw
22605182	13.723292	6.9343543	comment	7.0	19.5	1584455868	-15.898982	"I'm curious, in current proposals, would a UBI be limited to citizens only? I'm guessing not, given the ""universal"" nature of it. If that's the case, I can't say I see support for a UBI gaining wide-s..."		seneca
22607766	13.719886	6.9307566	comment	7.0	22.0	1584467320	-15.894656	UBI is honestly the only solution here.		baby
22947443	13.720061	6.933449	comment	7.0	28.5	1587573593	-15.894366	I can't be the only one who has noticed the huge influx of articles and comments for UBI in places like reddit and even HN, of late. It seems that the ongoing crisis is fuelling a lot of agendas.		noarchy
23267958	13.720027	6.9312415	comment	7.0	34.0	1590112644	-15.893478	> UBI should cover government-regulated and government-provided essentials to living.The reason you don't do this is that the government is not better at making diapers and laundry detergent than Proc...		AnthonyMouse
13890993	13.719682	6.931929	comment	7.0	23.5	1489718974	-15.894342	That's what scares the shit of me regarding UBI.I don't mind paying for it even if it does keep young men immersed in a fantasy world.But I have a daughter. And she will be surrounded by men whose ide...		ocschwar
14327354	13.711543	6.920376	comment	7.0	20.5	1494618889	-15.875073	I really don't understand why ideas like the Negative Income Tax aren't being considered before Universal Basic Income.  In that scenario, the government just sets an income floor and pays the differe...		SirensOfTitan
14327375	13.722078	6.9322457	comment	7.0	60.0	1494619056	-15.897265	"Why would you expect inflation?   All sane UBI proposals don't create money, they just move money from rich people to poor people.  If you're a Friedman disciple, then ""inflation is a monetary phenome..."		bryanlarsen
14463835	13.719494	6.9298987	comment	7.0	20.5	1496346464	-15.898999	The flip side of this is abusive workers who will refuse to put in good effort because the cost of getting fired is lower.Of course, we could argue that workers should be more motivated by the promise...		tryitnow
14607260	13.721824	6.9337897	comment	7.0	27.0	1498074532	-15.898052	not to mention (at least in the US) that you're handing over a huge political/power pawn. Vastly simplified:- Party A's candidate is clean and runs on improving infrastructure but that requires a slig...		rileyteige
14607284	13.71221	6.919951	comment	7.0	27.5	1498074749	-15.891064	I often talk about the need to preserve the right to work for the masses. Many people rebut this with the idea that work is coerced for the masses and that it should not be. These are actually essenti...		Mz
24633097	13.720619	6.930819	comment	7.0	35.5	1601414192	-15.896381	These UBI experiments all have a flaw, they are time limited and the participants know it.  Just try imagining it.  Someone tells you will receive $500 per month for a year.  So that's a reliable inco...		bit_logic
32223985	13.7115135	6.921559	comment	7.0	20.0	1658755882	-15.893068	>If someone posits, for example, that universal basic income (UBI) could ameliorate the loss of jobs due to automation, a straw man would be, “So you want people to sit at home all day and collect fre...		Aunche
23860575	13.719961	6.930765	comment	8.0	22.5	1594916775	-15.896389	> Can UBI scheme help to overcome Unemployment crisis ? @varbhatYou realize that UBI requires monies, right?The US Federal government, and most states, are bankrupt.  There is no money for this years ...		imchillyb
