id	x	y	type	relevance	size	year	umap1d	hovertext	url	author
33157192	13.720119	6.931738	comment	3.0	13.0	1665441327	-15.896639	Never let a UBI promoter escape the question of who is willingly paying for it.It's not to say we shouldn't help those in need.It's not to say as a society we're perfect right now.It's to say that all...		exabrial
33186998	13.7151	6.9256015	comment	3.0	17.5	1665632989	-15.894004	"> a lot of people who opposed it are just regular people who understand just how lazy regular people areI feel like your underlying assumption is that ""if UBI leads people to leave their jobs, UBI has..."		dataflow
26620113	13.7140665	6.9248843	comment	3.0	12.0	1617017441	-15.885848	UBI+existentialismThat's basically what Star Trek has for a post-scarcity world. It assumes that people would be motivated to better themselves or the world, be curious, etc. despite not having to wor...		chriskanan
26692644	13.720939	6.9313335	comment	3.0	16.5	1617568825	5.4890575	So, what happens now? Will Ubiquiti be held to task, by anyone?		arbitrage
26753097	13.720583	6.9316306	comment	3.0	23.0	1617988052	-15.897364	I don't get how people keep saying this. A UBI is effectively a tax credit. You fund it with higher nominal rates. These mostly cancel out for working people, netting to zero in the middle. People at ...		AnthonyMouse
37590917	13.718583	6.929283	comment	3.0	11.5	1695248305	-15.894014	I was a huge supporter of UBI for a while, but now I think money is going to become kind of meaningless at some point (the more we print the less it's worth, and UBI policies would struggle to keep up...		pcthrowaway
37592111	13.716361	6.9270687	comment	3.0	12.0	1695258716	-15.917768	There seem to be a million different issues with a proposal like this, not the least of which is that the allocation of the labor amounts to a corporate or municipal handout.If you pay a living wage t...		sneak
37837325	13.720743	6.9330916	comment	3.0	18.0	1696971364	-15.896669	> I think someone, soon will try to use this project as an argument in favor of UBI, which is ridiculous.Why's that ridiculous? Testing a small scale trial on the people most likely to be effected by a larger scale program seems pretty reasonable to me.		itishappy
14821334	13.720865	6.93238	comment	3.0	12.5	1500651388	-15.895743	If we get a UBI, I'm quitting my developer job and just going to coast the rest of my life.  I don't care how many corners I have to cut, lol.  Gonna milk that cow as hard as I can.My dad used to ask ...		justadeveloper2
14842798	13.718408	6.9284396	comment	3.0	12.0	1500931185	-15.895374	No, that's the point of UBI in your mind. This is actually what I think is harmful about our current obsession with UBI, all the politicians are slowly coming around to it and when they do that you kn...		frgtpsswrdlame
14842867	13.720973	6.933132	comment	3.0	10.5	1500931600	-15.898825	That's the point of UBI in most people's minds, it's a better way to redistribute wealth and once in place should be the only way needed.  Of what purpose is a food stamp program when we can simply ma...		gnaritas
14999003	13.720538	6.9301963	comment	3.0	17.5	1502560693	-15.89629	UBI is welfare with a different name. The results will be the same.Some people will sit on their asses and never work a single day but the majority of the population would keep working. The extra mone...		slackingoff2017
27577412	13.717118	6.928369	comment	3.0	11.5	1624265391	-15.896729	No large scale experiment exists for UBI.		LunaSea
35401306	13.712039	6.9211707	comment	3.0	10.5	1680364839	-15.88715	Automation increases employment. Technological unemployment is a myth.The purpose of a UBI isn't for workers whether they're unemployed by AI or not, it's for non-working household members like new parents, elderly and children. (Poverty is a household phenomenon, not an individual phenomenon.)		astrange
35423831	13.710012	6.917648	comment	3.0	10.5	1680530952	-15.897965	The problem with socialism is that there are certain jobs people do only for money.  For example, no one becomes a dentist because they are passionate about teeth.  However, it makes sense to have a floor on earnings in the form of a UBI.  I think that would be the best of both worlds.		djaouen
22380362	13.720739	6.9320073	comment	3.0	23.0	1582250377	-15.88954	Either that or a more progressive stance on socialist policies that provide basics to everyone. At least with socialist style policies there isn't the possibility of those spending their UBI on junk food or wine our whatever, but I really would prefer either to the current state of affairs.		tjr225
22494962	13.719509	6.9306183	comment	3.0	12.5	1583425575	-15.897793	Part of the reason for ubi is that a lot of work is exploitative or underpaid. Ubi puts people in a negotiating position to not work and demand higher payment, or to not work and contribute to society in other ways.		crystaln
22496008	13.71843	6.9298644	comment	3.0	12.5	1583430570	-15.895191	I agree. Letting workers leave abusive employment situations is a benefit of UBI. UBI might even totally reorient the idea of work in that now an employer has the incentive to keep workers happy that must be balanced with the profit incentive.		DubiousPusher
22496300	13.719611	6.932137	comment	3.0	11.5	1583432051	-15.897921	Where did you get that? UBI won't help people that get free housing in NYC  UBI doesn't work with HCOL areas.		free652
22496964	13.718968	6.9307613	comment	3.0	11.0	1583435578	-15.894412	UBI would reorient the idea of work in the sense that new generations won't think about work the way we do, for them it will be something that you can do, not something you have to do. Similarly how s...		zazaalaza
22498768	13.722423	6.933883	comment	3.0	13.5	1583445335	9.46084	"This issue is not a ""flaw"". It's a root problem. We want to know the effect of permanent UBI, not of a temporary one, and we know (strongly suspect) the effect will be different.Maybe the simple solut..."		datashow
22498989	13.716657	6.925482	comment	3.0	11.0	1583447035	-15.895321	> At the end of the day it's the most direct and effective way of combating poverty and goes a long way towards closing the wealth gap.Where do you think all this Income is going to come from? The mid...		blackflame7000
22588487	13.723865	6.9353213	comment	3.0	14.5	1584319907	-15.8974285	How is UBI supposed to work without major price controls?		peteradio
22601763	13.717809	6.924576	comment	3.0	23.5	1584420462	-15.89564	> prices will rise in an attempt to capture some of that known financial excessThe assumes financial excess. The reason for UBI is that there isn't excess. If 78% of Americans are living paycheck to p...		godelski
22601840	13.717851	6.9280868	comment	3.0	11.0	1584421179	-15.896677	I think his most compelling policy is not UBI, but giving the people money to spend on politics. This country is suffocated by special interests, which create draconian laws for all of us to follow ju...		kova12
22644079	13.711378	6.9203725	comment	3.0	12.0	1584760579	-15.891808	It's a great argument for UBI.Sanders-style minimum wage hikes won't do us much good when there's 20, 30, or even 40% unemployment, which will soon be a reality if these lockdowns persist.		scout4
15163846	13.701067	6.9103146	comment	3.0	18.5	1504472020	3.4474769	Robots aren't capable of doing everything people can do yet, but as they become more capable, what and how are displaced unskilled workers supposed to do if they can't get any job at all? Starve to de...		trapperkeeper74
15165593	13.721996	6.9356275	comment	3.0	11.0	1504496981	-15.896896	Is that good or bad?Listen, I support single payer systems, but how do they figure out how much to pay in each region? Same question for UBI.I have come to believe that UBI and all other safety nets h...		EGreg
15306262	13.717982	6.9294086	comment	3.0	22.5	1506019243	-15.895849	You also have to look at the effect of UBI over generations. Children growing up with UBI may never see people close to them who do actual work. I once  had a summer job at a welfare/employment agency...		maxxxxx
15443406	13.717891	6.929331	comment	3.0	11.0	1507654872	-15.895349	> Does anyone really honestly think that there's a high percentage of women out there wanting to give birth 10 to 20 times?I think 10-20 is hyperbole but the inverse relationship between GDP and birth...		ng12
15706211	13.721892	6.934303	comment	3.0	11.5	1510770035	-15.897569	"UBI doesn't send money in, it redistributes it.And if solving economic problems were as simple as ""just take more money from the rich people and give it to the poor people,"" this problem would have been solved centuries ago."		moduspol
15712886	13.7209	6.9328537	comment	3.0	13.0	1510843051	-15.897721	This is precisely the reason I'm against UBI, I don't want to be involuntarily subject to it. I'd rather have the choice.		neximo64
38234039	13.714144	6.9230814	comment	3.0	16.0	1699733481	-15.891137	> I am in favor of a Universal Basic Income (UBI) to replace the status quo of benefits, including Medicaid, food stamps, housing subsidies, etc. But I want the UBI to be a relatively small amount, so...		Pet_Ant
38508405	13.721425	6.9321074	comment	3.0	26.5	1701622103	-15.898676	A UBI of $x/month will just yield rent increases of $x/month.		ethanbond
38508301	13.716661	6.930259	comment	3.0	15.0	1701621429	-15.897243	I always figured UBI would basically replace and end all government poverty programs at least		coffeebeqn
27020042	13.694846	6.8963447	comment	3.0	11.5	1619998248	-15.87965	To play the devil's advocate, that would also mean keeping things inefficient on purpose to avoid job losses.I want my taxes to be automatically by some computer without having to deal with a human th...		rawtxapp
27061589	13.721101	6.93241	comment	3.0	19.5	1620300130	-15.896842	If you doubled federal individual income taxes for everyone in the US, you could pay each adult US citizen around $750/mo in UBI with that increase.If you doubled ALL federal income taxes in the US, y...		sokoloff
27120503	13.720529	6.931977	comment	3.0	11.5	1620752529	-15.897673	the best argument I've heard for UBI is that it reduces the overhead of administering the allocation of benefits that we are going to provide anyway. Right now, much administration is dedicated to val...		abakker
27421745	13.719132	6.92854	comment	3.0	13.5	1623068887	-15.897133	Just implement UBI adjusted to inflation paid for by VAT and then people are anti-exploitable since they're then not dependant on a job for survival; if you can't infer how this benefits reducing weekly work hours in negotiation and that's why you're downvoting then you're an idiot.		loceng
33654433	13.7214575	6.933133	comment	3.0	12.5	1668778757	-15.896999	"2nd paragraph of the article states, ""Employment insecurity and the rising cost of living are also taking a toll and expanding the profile of those at risk of homelessness. ""Yet, UBI would drive price..."		jkepler
33935940	13.719569	6.9307995	comment	3.0	10.5	1670700810	-15.897071	Full employment never works. Famous example is the soviets. Neither can UBI be penciled into an actual economy. UBI would bankrupt the nation, so would a large scale job guarantee program as described...		blue039
34022470	13.720692	6.932277	comment	3.0	14.0	1671235717	-15.8976555	Also, UBI is often the cheapest and most efficient way to prop people out of poverty and (surprised?) to support their ambitions in education, starting business etc.		andrei_says_
34022799	13.720412	6.9318767	comment	3.0	12.5	1671237865	-15.897959	"UBI has long-term challenges in that organizations will try everything they can to siphon off the money (""rent seeking"") until they succeed. UBI needs to deal with this reality to succeed even in the medium term."		QuantumGood
18993413	13.719718	6.930965	comment	3.0	14.0	1548366890	-15.895857	This is a huge concern. I have known several people who, when they lose their seasonal jobs, coast on unemployment insurance until the very last minute, sometimes even going as far as welfare and couc...		core-questions
19110380	13.71781	6.9283533	comment	3.0	16.0	1549588155	-15.894026	The key bit here is where he says that a lot of people will lose their jobs soon. There are tons of jobs that exist only because of momentum. The financial incentive to pay all these people will dry u...		planktons
19116895	13.72075	6.932738	comment	3.0	10.5	1549648763	-15.894538	Never-mind the money, I fear that even if we can implement it and pay for it, there will still be a host of social problems that UBI advocates do not want to grapple with. There's still no answer to q...		simonsarris
19216609	13.722	6.9349103	comment	3.0	11.0	1550754832	-15.895883	Use some of it to subsidise insulation and better standard buildings, cleaner air and power, better railways etc.Fund a UBI.I'm fascinated at downvotes for this suggestion. What's actually wrong with spending part on lower impact infrastructure and part on a replacement for a broken welfare system?		NeedMoreTea
15788304	13.715911	6.9272556	comment	3.0	10.5	1511798411	-15.897748	When I think about UBI, I keep picturing a group of pidgeons fighting over pieces of bread.I don't see UBI as freedom. It shares a lot with slavery, in that someone else is feeding you, and therefore ...		topmonk
15788333	13.720794	6.9321747	comment	3.0	14.0	1511798653	-15.896264	""" enacting a UBI and paying for it by increasing the federal debt would grow the economy (and increase GDP)""Printing trillions and trillions of dollars of money would increase the debt and increase GDP. Let's do that too!"		AznHisoka
15789418	13.720493	6.931981	comment	3.0	13.0	1511805624	-15.895442	This idea is basically UBI couched in capitalist terms. If every American gets a share of GDP, and GDP is concentrated, then that means that either 1) the share of GDP that each person gets is tiny an...		throwawayjava
15789882	13.723017	6.934581	comment	3.0	10.5	1511808156	-15.895297	"+1.And whence the money for the share?  Taxes.  So this is just a UBI.This, like all UBI proposals, seems like a way to dress up a massive tax hike: ""but you'll be getting your share of GDP!"".  The on..."		cryptonector
15897496	13.719113	6.9295325	comment	3.0	30.5	1513005491	-15.895519	Agreed. Anyone who claims they know what possible outcomes we can expect from UBI is deluding themselves (or more likely feeling their comfort zone / world view threatened).UBI could be as significant...		harryf
15897710	13.718994	6.92436	comment	3.0	15.0	1513007061	-15.896657	Okay, so the system ensures (assuming that it manages to achieve everything it says) that people get an appropriate number of coins and can spend them based on this web of thrust.But what is the net f...		PeterisP
15897801	13.722218	6.933098	comment	3.0	13.0	1513007804	-15.896923	Oh. That's a dumb reason. Until this it was sounding like you had an argument against UBI from society's point of view, not just based on your own financial interest.		rspeer
15918601	13.718442	6.92866	comment	3.0	11.0	1513206760	-15.896083	> The math doesn't work and has never worked. UBI proponents will never talk math because it doesn't add up, even with the most casual analysis.Wrong, utterly wrong, on accounts.> It's not enough to d...		nkoren
15918545	13.718456	6.930828	comment	3.0	14.5	1513206297	-15.897553	"Welfare discourages striving for greatness, because as soon as you show any sign of success it's taken away from you. The ""universal"" in UBI means it's paid to everybody, rich and poor. It lacks the weird breakpoints and perverse incentives of welfare. You are always better off working."		mrob
16040360	13.719737	6.9320545	comment	3.0	12.5	1514723782	-15.891831	What if a stepping stone to UBI was a basic income to everyone that’s demonstrated some technical aptitude?  If scientists and engineers didn’t have to work for, say Zuckerberg, to survive and instead...		ridewinter
16875490	13.717757	6.9278917	comment	3.0	10.5	1524142709	-15.896746	"That's because, for some strange reason, you're confusing UBI with some idealized form of communism.UBI is Universal Basic Income.  The keyword here is ""basic"".  If you sit on your ass and collect UBI..."		magduf
17144473	13.719161	6.930463	comment	3.0	17.5	1527173218	-15.894116	"I posit that, in that case, a new ""normal"" baseline would be established by social consensus (perhaps, owning a home, smart phone, access to media, high quality medical care, and organic food) that is..."		darkerside
21096764	13.721218	6.933569	comment	3.0	11.0	1569622778	-15.898638	UBI mostly removes the need for laws to protect workers from exploitation. This includes sex workers.		petermcneeley
22919457	13.7181635	6.929993	comment	3.0	14.0	1587336642	-15.8951435	Wouldn’t a (high enough) UBI mean the free market would create “affordable” education and “affordable” health care and obviate the need for unemployment benefits?		zhoujianfu
22922469	13.7200775	6.9308276	comment	3.0	21.5	1587376066	-15.897473	No. It is wrong to take from those who want to work to give to those that don't want to. I already pay almost good portion of my earnings to the government to see it squandered on nonsense (e.g. look ...		uk_programmer
23140405	13.719663	6.9306455	comment	3.0	37.0	1589190312	-15.898226	The experiment was terribly flawed in that it only addressed the unemployed, and it didn't affect the existing unemployment system for them, making incentives perverse for all taking part. The UBI was...		diekdnk
23140586	13.717189	6.932836	comment	3.0	14.0	1589192367	-15.89755	In The Netherlands there has been a form of UBI for decades, for anyone who wants it or needs it.It is called 'bijstand', is about € 1k a month and you are eligible for all kinds of other discounts and support.Just request it at your municipality and make sure not to find work.		the-dude
23140717	13.720784	6.9326324	comment	3.0	11.0	1589193765	-15.896622	Why do you say it seems obvious?  The most persistent objections to UBI (or welfare or unemployment for that matter) is that they cause dependency and lazyiness; that they destroy the self-confidence ...		Ensorceled
23140880	13.719696	6.9303403	comment	3.0	27.0	1589195448	-15.896049	The biggest problems with such UBI experiments is the limited time of the experiment.If I had a shitty, dead-end job, and someone offered me (eg.) 80% of an average paycheck in my country, FOR 2 YEARS...		ajsnigrutin
23201583	13.721025	6.9325647	comment	3.0	13.5	1589618240	-15.896046	One reason a UBI might be preferable is because it distorts the labor market less. Also a job guarantee program has issues like what to do for people who are generally toxic and negative to any work e...		anchpop
23243918	13.718599	6.9295697	comment	3.0	45.0	1589956527	-15.897629	You hit the nail on the head, UBI would decrease how much people are locked into undesirable jobs. However, this is a feature, not a failure of the system. Currently, we have under-utilised talent wit...		ntSean
23258113	13.719563	6.929903	comment	3.0	21.5	1590068105	-15.897547	Which is incredibly charitable! Opponents to UBI only oppose the income source being tax; which is a forced wealth transfer (opposite of my money my choice).		exabrial
23258370	13.72735	6.9380116	comment	3.0	12.0	1590069334	-15.893612	I don't understand the optimism around UBI.  UBI is a band-aid and a sign that a system is actually failing.  I get why some people, especially intellectuals, want UBI, but they seem to believe that U...		ravenstine
23263889	13.720636	6.9325027	comment	3.0	17.0	1590089965	-15.897555	UBI is indirectly means-tested; if you make too much money, you end up giving back as much or more in taxes and/or partial UBI clawbacks than what you would get via UBI. This actually ends up working ...		zozbot234
23263943	13.719738	6.9310236	comment	3.0	13.0	1590090177	-15.898976	"1) The ""U"" in ""UBI"" means that working another job does not stop you from receiving UBI, which means it may still make sense to do so if you want more income. UBI is supposed to be enough to live on, ..."		JoshTriplett
23264000	13.720511	6.931946	comment	3.0	10.5	1590090327	-15.896079	People keep forgetting that a UBI won't cover immigrants.  Immigrants would end up doing all the jobs that citizens don't want to do.That's the biggest problem with UBI.  It creates a default class system.		jedberg
23263178	13.719863	6.931386	comment	3.0	16.0	1590087187	-15.896301	Because replacing all other forms of social welfare is completely impractical from a political standpoint in either the short or medium term.  It would involve huge societal changes that would require...		slg
23267772	13.713005	6.929498	comment	3.0	10.5	1590110806	-15.891993	So what if someone spends it all on whiskey or oxy?  They're maximising their own preferences.  If they were addicted to alcohol, sudden withdrawal can kill.One of the big reasons for UBI is the belie...		jms
28381854	13.720488	6.9321995	comment	3.0	14.0	1630513221	-15.897225	Don't forget, our salaries are largely unchanged although the market is finding it out the hard way (employee shortage).So honest hardworking people got triple-fucked.I can't imagine how well UBI would ever go. This should be the nail in the coffin for UBI for me, I will never vote for it.		systemvoltage
28587598	13.72145	6.93287	comment	3.0	12.0	1632083027	-15.898566	> Lower-class workers will see their incomes increase much more on a proportional basis and end up with a net benefit.Except their goods are going to cost more too now. Unless you're going to start proposing price controls.I can't really see UBI doing anything except inflating itself away.		jbboehr
28647237	13.72276	6.936209	comment	3.0	14.5	1632514211	-15.898388	If cost is not controlled I'd expect expenses of food, clothed and renting to rise after UBI being implemented.		markus_zhang
12006531	13.70386	6.910043	comment	3.0	15.5	1467260195	-15.887283	"Isn't that the point of UBI? Getting us past the local maxima of ""this job is soul-crushing and a waste of a person's intelligence, but economics make it cheaper to use a body than a robot""?"		ethbro
12068008	13.717917	6.929473	comment	3.0	43.5	1468196816	-15.897059	Right off the bat:>“We should not advance a policy that is premised on giving up on the possibility of workers’ remaining employed,” Jason Furman, chairman of the Council of Economic Advisers, said Th...		intopieces
12068131	13.719976	6.928615	comment	3.0	10.5	1468198308	-15.893789	This is productivity versus wages over the last 45 years: https://i.imgur.com/nb1qbkZ.jpgNote how wages have not increased as productivity has? UBI is what fixes that. Its distributes that productivity to people so they are not slaves to capital.		toomuchtodo
12243414	13.719055	6.9298525	comment	3.0	10.5	1470600412	-15.895849	While this is true mathematically, I prefer to think about the opportunity cost of not having a UBI.  I (like perhaps many people on HN) basically wasted my 20s trying to make rent while I worked on m...		zackmorris
12243783	13.719643	6.929569	comment	3.0	11.0	1470605684	-15.896771	> UBI> sitting aroundchoose one		k__
12243101	13.738053	6.9511733	comment	3.0	50.5	1470595342	-15.8972225	It would seem to me that UBI would increase consumption, and reinforce our perceptions of success.		jackcosgrove
12245093	13.721129	6.931446	comment	3.0	17.5	1470623194	-15.896195	> If the idea behind UBI is that people don't need to go work, and won't go buy McDonalds anymore, then tax income is going to plummet.The idea is that people don't need to go work, because robots do ...		hx87
13202353	13.718214	6.929304	comment	3.0	29.5	1482006489	-15.894965	"Means-tested programs are the epitome of wasteful government bureaucracy. It's never the right way to ""compromise"". If we can't sell straight UBI, then something like universal food stamps would be a good first step:https://web.archive.org/web/20160321083817/http://mattbrueni..."		TillE
13318741	13.721366	6.9271765	comment	3.0	11.5	1483542032	-15.896148	Every time UBI is brought up, vague arguments about inflation come up. However, I've never seen anyone cite economic literature that actually quantifies such an effect. It's just a claim justified by ...		danharaj
13294790	13.721453	6.9328327	story	3.0	8.0	1483248449	-15.906011	The UBI already exists for the 1%	https://medium.com/@MattBruenig/the-ubi-already-exists-for-the-1-d3a49fad0580	panic
13596807	13.706404	6.9071712	comment	3.0	17.5	1486543368	-15.892854	My vote goes to redistribution of wealth, by means of a progressive tax that starts negative.It is the human thing to do. But it also aligns with economics and politics.Redistribution: because more mo...		ozy
21306159	13.721471	6.933355	comment	3.0	15.0	1571597143	-15.897005	I am against UBI because the soon as you give people $1000 dollars, their rent, transport, and other associated costs will go up by exactly $1000 over a relatively quick time frame. It will initially ...		tehjoker
21311912	13.722527	6.934002	comment	3.0	13.5	1571664004	-15.895694	"UBI is nonsense socialism campaigning for the votes of the uninformed""We'll just give everyone money.  Nobody will demand more and the promise of more money won't become the key election issue as gove..."		LegitShady
21615615	13.721176	6.9332395	comment	3.0	14.0	1574533936	-15.89753	No need to assume an income tax based financing if that’s what you mean. My own take on UBI is to finance it from land rent. In the way Henry George thought about it (or Thomas Paine, John Locke, or e...		CuriousSkeptic
39087644	13.7225685	6.9350753	comment	3.0	15.5	1705913975	-15.893355	Assuming AGI doesn't kill us all, I would imagine the argument for UBI will become much easier to defend once it causes 100x, 1000x, 10000x etc growth in the economy. Our job is mostly to hang on until one of those two outcomes occurs.		hiAndrewQuinn
