id	x	y	type	relevance	size	year	umap1d	hovertext	url	author
24058200	13.716418	6.926966	comment	4.0	16.0	1596612943	-15.876314	The Expanse also has UBI on earth. With it, most people still lack opportunity and live a rather destitute, powerless life.Seems like a pretty good perdition of our future, really. UBI recipients with...		octaveguin
24083225	13.718673	6.9292665	comment	4.0	14.0	1596815588	-15.894842	But then people would have no incentive to work anymore so people would abuse the system. This is why the government has to give the money to corporations, they will spend that money wisely to keep go...		ideals
24213825	13.7170925	6.9285626	comment	4.0	16.5	1597860699	-15.896709	As a general supporter of UBI, I'm not sure there is any way to actually test UBI without just implementing it at full scale.  The U is an important part of it and like you said the expectation of permanence is crucial to seeing a change in long term planning and behaviors.		slg
24214232	13.720745	6.931329	comment	4.0	51.0	1597862106	-15.897526	Any UBI could be entirely reversed by an equal and opposite tax. Of course this would be pointless, but it shows that there are many possibilities, depending on what sort of taxes you combine it with,...		skybrian
24258540	13.717478	6.927552	comment	4.0	16.5	1598257817	-15.897113	How is it that people are both against generational wealth which is a sort of a UBI on a family level (£500k, which is not too far from median household wealth in the UK, means you could roughly draw £15'000/year in perpetuity), and for UBI on a national level?		agent008t
20216256	13.724472	6.9359875	comment	4.0	14.0	1560880997	-15.898336	"I think it is likely that this is backed by a substantial set of US political interests. People that want to experiment with UBI might want to see a Facebook sanctioned UBI.
This is basically any libe..."		orbifold
20221215	13.721348	6.9341993	comment	4.0	12.0	1560925030	-15.898644	"> This is basically any libertarians pipe dream.Are you sure about this? 
I thought libertarians were against all institutions such as the state with power over people.UBI is a socialist policy. It seems in total contradiction with libertarian principles to me. How is that possible?"		elcomet
20225973	13.721637	6.9339094	comment	4.0	11.5	1560969606	-15.897996	I have yet to see any evidence that UBI would accomplish any of the things its proponents think it will. The first unintended consequence I predict would be increases in rent, food, and other basic th...		phkahler
20225619	13.714837	6.9248986	comment	4.0	25.5	1560967836	-15.894362	Doing both is useful as otherwise UBI subsidizes inefficiency and reduces automation.Basically, replacing people with machines is a long term gain and should be encouraged with a high minimum wage.		Retric
20424923	13.719569	6.9309454	comment	4.0	13.5	1562968982	-15.89599	"A big hope of the UBI movement is that it will ""pay"" people to take care of one another in a way that our usual monetary transfer for services rendered simply can't handle well. That is, someone takin..."		jostylr
20570689	13.706545	6.9127016	comment	4.0	18.0	1564533606	-15.894738	"There will always be relative poverty. In other words if we ""solved poverty"" and there were no more hungry people without health insurance sleeping in the streets, you would still have people who had ..."		DoreenMichele
20584112	13.718583	6.929586	comment	4.0	15.0	1564670644	-15.894768	15 years is not UBI. If you can’t rely on it being around for the rest of your life it would be insane to leave your career to live on UBI.		Ididntdothis
20788926	13.705609	6.9236155	comment	4.0	16.0	1566672254	-15.891633	The big takeaway for me is that fundamentally tax policy needs to be redistributive. That idea has been under assault in America for decades, along with the idea of government itself, and it's been ve...		Despegar
20911238	13.721542	6.9332724	comment	4.0	12.5	1567957777	-15.89398	Article says:> They can’t organize labor strikes if they have no labor.The idea of UBI isn’t to make it so that the masses never work again. The idea is so they don’t starve and die when between jobs....		unoti
13616482	13.720731	6.9316673	comment	4.0	14.0	1486743774	-15.897283	I don't understand the principle behind UBI. If everyone makes +$X amount more doesn't everything just raise by +$Y?		jcon321
13697459	13.719646	6.931298	comment	4.0	11.0	1487698369	11.045867	Safety net is not UBI. Safety net expects a working class and a market economy. UBI expects non-workers wholly dependant on the government with set, public incomes.Supply doesn't matter. The land owni...		drzaiusapelord
13897402	13.721132	6.931738	comment	4.0	13.0	1489780440	-15.897967	There's no realistic (as in adding up mathematically) way that UBI will be cheaper than the social programs of today.		greedo
14268741	13.719991	6.9319186	comment	4.0	11.0	1493931410	-15.89745	Potato Potato.Edit: oh, come on. UBI is a form of welfare. It supposedly is to make sure everyone's basic needs are met. Play with words all you want, but that is welfare.		JustSomeNobody
14327464	13.720606	6.9317822	comment	4.0	12.0	1494619871	-15.897105	> All sane UBI proposals don't create money, they just move money from rich people to poor peopleI'm not very educated in this, so correct me if I'm wrong, but my understanding was that while UBI does...		CJKinni
14398216	13.720945	6.932963	comment	4.0	11.5	1495503791	-15.897217	> I think one big piece of the puzzle is that we need to bring back genuinely affordable housing.It's impossible to solve affordable housing by constructing more buildings and regulating prices.  The ...		jlarocco
14399750	13.719048	6.930298	comment	4.0	17.0	1495527910	-15.897889	>  Everyone seems to be discussing UBI and largely ignoring the fact that even if you cut everyone a check for some kind of basic income, if we don't solve some of our housing issues, you will still s...		Mikushi
14577286	13.720529	6.93222	comment	4.0	16.0	1497726954	-15.895762	A UBI that allows citizen to surive on it is simply unfundable; Let's take Belgium, 1000eur/month per citizen; That's 120 billion eur/year. The Belgian state revenue is 227 billion eur/year, and Belgi...		fvdessen
14608018	13.718666	6.9263787	comment	4.0	11.0	1498079636	-15.896338	I was formerly a UBI proponent but I think, at least, in the near to medium term, it's too much of a cultural shift about the role of work in life. That's why these days I'm more a fan of a negative i...		losvedir
14527567	13.721381	6.9335046	story	4.0	19.0	1497106736	-15.893706	A Plan to Reform Welfare and Taxes to Provide Every American Citizen with UBI	https://medium.com/economicsecproj/how-to-reform-welfare-and-taxes-to-provide-every-american-citizen-with-a-basic-income-bc67d3f4c2b8	2noame
30796398	13.722218	6.933861	comment	4.0	23.0	1648162024	-15.885621	1) UBI is not UBI unless everyone gets it.2) Any income surplus generated by UBI is rapidly consumed by middle people and rent-seekers. That’s how we get inflation.		glitchc
30932175	13.7169485	6.916375	comment	4.0	12.0	1649254572	-15.846302	"I agree with you, ""proof of personhood"" is not the greatest barrier to UBI. It is one barrier though. If you look at recent COVID benefits in Canada (CERB), there was widespread fraud in how this was ..."		axg11
31208421	13.720657	6.9311695	comment	4.0	14.0	1651254192	-15.900377	Just stop. Stop printing shitcoins, they are worthless and cannot be the basis of a UBI system. Why would anyone buy them? They will -> 0 like everything else. It’s all scams.Have a think about how yo...		randomhodler84
31605124	13.666068	6.8683925	comment	4.0	13.0	1654239938	0.7861351	There's gonna be a lot more of this, both voluntarily and involuntarily, as we continue to automate. This isn't bad, it's just different.We'll get UBI and robots eventually and this will be the status quo everywhere.		arcticbull
28920487	13.716122	6.92592	comment	4.0	16.0	1634663025	-15.892563	Well, I'm not sure UBI really solves the issue.  Also, replacing labour with machines is not really the problem here; agriculture and industry still require lots of people, it's just that those sector...		rossdavidh
29030114	13.721534	6.93271	comment	4.0	14.0	1635447665	-15.897604	Except if UBI is $10, then cost of living will increase $10. This is an impossibly recursive feedback loop. UBI's effects on the COL is ultimately a turing complete equation, and thus suffers from an inability to analyze when exactly such a recursive scenario will halt.		iammisc
29156861	13.71997	6.9306793	comment	4.0	13.0	1636423598	-15.896124	Seems like all that free money and no one working has definitely caused a supply issue ... yet everyone has tons of money furthering pushing up demand yet supply to meet the demand has shrunk.For thos...		paul7986
29453400	13.723178	6.932657	comment	4.0	16.5	1638739254	-15.885221	A UBI doesn’t necessarily result in inflation. The later is a combination of monetary policy and expectations. UBIs can be paid by means other than printing money.		atdrummond
34481270	13.724203	6.937474	comment	4.0	15.0	1674415286	-15.896691	From an outsider perspective the obvious goals to fix is health care, homelessness and housing. For some reason people jump into completely tangential things like UBI. America has both the strength and intelligence. Does it have the will? If not, why?		127
34616248	13.721836	6.9327984	comment	4.0	13.0	1675279923	-15.898327	"I strongly doubt the UBI part as it goes against the ""religion"" of Wall Street and most politicians."		r00fus
35015253	13.721631	6.933965	comment	4.0	13.0	1677878843	-15.896746	You don't need it to do so indefinitely. You only need it to pay enough to keep you afloat while you either find another job, or get the previous job to relent, take you back, and agree with you—or do...		danaris
16875597	13.718465	6.931083	comment	5.0	27.0	1524143434	-15.900422	I can't see how it's theoretically possible to do a small scale experiment with UBI. If not everyone gets it, you can't see the big impact on the economy (what happens with supply/demand/inflation). A...		alkonaut
16875698	13.714913	6.92424	comment	5.0	20.0	1524144364	-15.892107	Instead of giving out money, why not give out the basic necessities directly? A free home, free utilities, free food, a basic vehicle, free clothes, free healthcare? If you’re happy with these things ...		matte_black
16936790	13.722597	6.933308	comment	5.0	15.5	1524783903	-15.894493	Can you give me feedback to my argument about UBI?https://www.lucidchart.com/documents/view/87d3102c-5b89-4001...		dandare
17013095	13.721737	6.9342217	comment	5.0	19.5	1525704185	-15.897392	I'm not sure if I'm understanding this correctly - maybe I'm missing something significant here, but it says they're giving people 75 cents per day per person? How is ~273 buck a year going to provide...		crsv
17190188	13.721646	6.933883	comment	5.0	15.0	1527704722	-15.899615	That's always been what I wondered as well. UBI solves everything, except for the part where an actor who knows explicitly that all of his tenants will be getting a flat amount per month, then why not...		rarec
17507039	13.720615	6.9329414	comment	5.0	17.5	1531318361	-15.896703	Instead of UBI, which many critics are fearful of, why not switch to a voucher system? The government gives everyone a voucher redeemable for $x for food, $x for healthcare, etc., whatever forms of we...		jeffreyrogers
17664705	13.721564	6.9329724	comment	5.0	15.5	1533144506	-15.899102	Every time you want to evaluate results from social research, you need to ask yourself two questions:1. Are the results internally valid? That is, did the authors reasonably control for factors other ...		pacbard
17664513	13.719257	6.930679	comment	5.0	28.0	1533143533	-15.89433	"""a quora member answered when asked about the UBI""And at that moment, any semblence of legitimacy disappeared...The main question about UBI is who pays for it and how. In the UK, a back-of-a-napkin ca..."		lbriner
17813095	13.7168665	6.927283	comment	5.0	19.0	1534881257	-15.9012165	Interesting theory.That people want to work (more than for just the money) is one of the reasons I am very skeptical of UBI. I think that people want to work, and we apparently don't structure communities very well for people to just pick up meaningful work (or even volunteering) as a hobby.		simonsarris
18968866	13.72107	6.9326715	comment	5.0	16.5	1548170633	-15.89684	As someone who's been on employment insurance before. I can't understand the appeal of ubi. Getting a small amount of money to do nothing is excruciating. It's really not a fun way to live.		grawprog
19871485	13.7196245	6.930134	comment	5.0	13.0	1557430482	-15.920606	Unless you consider ancillary information like, IBM owns Redhat and hates Oracle, and Oracle has decided to extract money for anything Java + Enterprise, and UBI is targeted for Enterprise customers.W...		ChuckMcM
19899430	13.71959	6.91917	comment	5.0	24.5	1557756977	-15.89428	A UBI in the salary range of an Amazon warehouse worker would be on the order of 1/3rd GDP.		gridlockd
37647453	13.711234	6.922718	comment	5.0	17.5	1695662638	-15.885068	I'm very worried constantly. This is the story of the bear, where you just have to be faster than the other guy. For now. The bear is getting faster and faster and it won't be long before it eats all ...		callwhendone
38508323	13.722053	6.9333973	comment	5.0	19.5	1701621515	-15.908998	I don't know much about UBI. How do people generally see it being implemented?Does everyone get the exact same, flat amount? Do only people below a certain income get it? Does the amount gradually dec...		SeanAnderson
14706650	13.717363	6.931447	comment	5.0	18.0	1499293840	-15.896807	I'm curious, isn't UBI basically untenable without single payer healthcare? Assuming he will be running for president, doesn't that mean he will be essentially a socialist candidate?		mvid
33186706	13.720361	6.9323483	comment	5.0	14.0	1665630614	-15.898105	Studies of UBI never fail to indicate the lives of people given UBI are better than before. What they don't seem to ever do is try to compare the improvement caused by UBI to alternative ways of spend...		causality0
33396301	13.718317	6.922994	comment	5.0	14.0	1667149685	-15.893139	"There's a bit in Ubik that stays in my mind. Joe Chip gets into an
argument with his apartment door that refuses to open for him because
he owes it money. I kinda got that the door was an autonomous
m..."		nonrandomstring
33978771	13.715154	6.9292264	comment	5.0	13.0	1670980830	-15.899825	I agree there is a problem with high healthcare costs, and food costs especially now.However what we saw with covid stimulus and unemployment wasn’t the “everyone’s now an artist” outcome that is sugg...		spacephysics
34022970	13.722687	6.9344263	comment	5.0	15.0	1671238941	-15.89628	"I've also never seen anyone address the high chance that post UBI the #1 issue for every politician will become ""I will raise the UBI"" and if they don't their opposition will. How will we deal with an ever increasing UBI and where will that every increasing source of money come from?"		eikenberry
35173058	13.717957	6.929352	comment	5.0	15.0	1678906557	-15.897929	A very large chunk of federal taxes are for UBI and universal healthcare for old people		throwaway6734
35401122	13.700953	6.905727	comment	5.0	19.0	1680363578	-15.882852	UBI will pretty much be a requirement if AI lives up to the hype and doesn't hit a sudden wall in improvement again. And even physical jobs might not be safe considering transformers are being used fo...		ren_engineer
28244312	13.714628	6.9248233	comment	5.0	16.5	1629452334	-15.896323	Whilst the detractors of UBI like to paint it as automatically impossible, like breaking some fundamental law of nature,  I bet the same people would have said the same things about the Covid benefit ...		jimnotgym
28358171	13.714965	6.9271646	comment	5.0	17.0	1630343858	-15.896203	There's a lot of different problems in play here and they all stem from slightly different places. There's a lot of worker exploitation going on. People are paid less than they are worth and work more...		bluefirebrand
28476376	13.714699	6.923462	comment	5.0	13.5	1631233591	12.421823	> Liberals aren't going to support the Milton Friedman-esque UBI ideas.Isn't that a liberal idea??		onlyrealcuzzo
13134230	13.718636	6.931932	comment	5.0	20.5	1481230716	-15.894413	All humans have a psychological need to be needed. The current way to best feel this is to provide income for yourself and your family through work, and provide a service for your employer. This is ex...		FreedomToCreate
13207933	13.717636	6.9277143	comment	5.0	15.5	1482098447	-15.89398	One thing I haven't really seen adequately addressed is this: what happens when some people inevitably waste their $2000 a month stipend on non-essentials and then don't have enough money for rent or ...		remarkEon
13317105	13.721991	6.933034	story	5.0	39.0	1483526472	-15.897825	The UBI already exists for the 1%	https://medium.com/@MattBruenig/the-ubi-already-exists-for-the-1-d3a49fad0580#.1wuim2od4	Parbeyjr
13455760	13.7174635	6.906618	comment	5.0	15.5	1485101664	-15.892311	> inflation is always a monetary phenomenonI don't understand this reasoning. Look, only one of the following can be true: (1) everyone can buy basic necessities of life, in which case nobody is poor ...		tomp
13457484	13.72117	6.9321427	comment	5.0	18.5	1485119287	-15.896724	why does it matter?  The point of UBI is to allow people to do what they want.		braveo
13595168	13.718344	6.929176	comment	5.0	22.5	1486520895	-15.8963	I think you are ignoring some bad things that could come out of UBI.The greatest danger is that people may be comfortable near the BI level until they are about 30, and not really work or educate them...		jeffdavis
27740223	13.721092	6.9322634	comment	5.0	14.0	1625507308	11.789187	Many people have more than a billion, and I can't really think of any sort of luxury you get with 10 billion you can't easily have with 1B.  Above the 1B mark you are solely holding wealth to further ...		nr2x
27950250	13.721622	6.933231	comment	5.0	27.5	1627229467	-15.897761	I'm against UBI, but at this point, we should just pick a low-risk state and do it, just so we can all see how it realistically plays out. Maybe I'm wrong and it's amazing and solves many problems. Or...		daenz
27950477	13.720412	6.9324527	comment	5.0	23.0	1627230727	-15.896843	Would be nice to hear why are you against UBI.For starter, here are my main doubts:0. The most important one. The true UBI - not the one-year-hundred-bucks-pilot-projects - but a true lifetime promise...		AlexTWithBeard
12010124	13.718671	6.929245	comment	5.0	14.0	1467307388	-15.894767	I thought the U stood for universal. If you take it back in new taxes, it's just a transfer program from productive to non-productive.		wang_li
12068050	13.720194	6.9296336	comment	5.0	18.5	1468197172	-15.897612	I've been skeptically positive towards UBI, but this sounds like a real problem with UBI, to me.  Do you think there is merit to this concern?		cle
12244546	13.720871	6.9331384	comment	5.0	27.0	1470615208	-15.897284	In short, a UBI will make us all poorer because people will refuse to provide the things that others actually want, and instead will engage in hobbies that provide little value to the world?Your phras...		yummyfajitas
12450711	13.715061	6.9230394	comment	5.0	17.5	1473315937	-15.889726	So we take what we're currently spending and spread it out to everyone instead of just people who need it?Doesn't that mean that the people who need it the most will just get less than they're getting...		grahamburger
12464564	13.720339	6.9238396	comment	5.0	12.5	1473443794	-15.896101	Does UBS really oversee $2 trillion or is it a mistake? Further in the article it says that $1.5b is managed by quants. That is a very low proportion.		polskibus
28647174	13.721893	6.934077	comment	5.0	14.5	1632513786	-15.898763	"> if ubi is permanent…The most likely outcome is that very quickly all the UBI money will be going to the few landlords and soon people will need ""UBI plus a job"" to pay rent and make ends meet.And wh..."		throwaway210222
22405062	13.719995	6.9311037	comment	5.0	15.0	1582559503	-15.896347	"Good - let's have a real world test and see whether there is something behind UBI as a concept.And perhaps this'll be the first program to survive the trolls and nay-sayers who will find the smallest niche failures and sspout the ""If ANYONE falls through the cracks it's a FAILURE!"""		zentiggr
22405141	13.717128	6.9285235	comment	5.0	15.0	1582559832	-15.896693	> (b) California residents who are 18 years of age or older and receiving benefits under the Medi-Cal program, the County Medical Services Program, the CalFresh program, the CalWORKs program, or Unemp...		throwaway55554
22405520	13.719781	6.9321127	comment	5.0	14.0	1582562044	-15.896584	If you double taxes, but the money is literally just going back into people's pockets, less administration fees of the UBI program, it's just income redistribution and can completely work.		JMTQp8lwXL
22494284	13.719862	6.930433	comment	5.0	42.0	1583422042	-15.89737	> With basic income, we may just raise the cost of those things.The problem with this argument is that it proves too much. It's true of anything that causes the poor to have more money. Lower unemploy...		AnthonyMouse
22494541	13.723539	6.934759	comment	5.0	16.5	1583423391	-15.895429	I really, really like the idea of UBI. However, some napkin math:In the US, with ~250 million people being eligible, a $1000 UBI would cost ~$3 trillion. That's almost the entire budget of the US. How...		pingyong
22496402	13.719899	6.9311385	comment	5.0	19.0	1583432671	-15.895831	Ok, but work (productivity) is how you actually pay for UBI.So by giving UBI, you are decreasing the resources that pay for it.		refurb
22497961	13.72098	6.9331074	comment	5.0	20.5	1583440965	-15.896187	 > Sounds like a success to me.I like the concept too, but we have to be careful what we wish for.If, somehow, UBI becomes real there will be a huge push from the libertarians and far-right to dismant...		crispyambulance
22591096	13.723105	6.9345493	comment	5.0	15.0	1584349001	-15.8992605	"UBI could be possible in a closed society, but not if you are open for uncontrolled influx of people from outside your society. Because the offer ""get free money"" is just too good.There was the choice..."		101404
22600345	13.74057	6.9493403	comment	5.0	41.0	1584407225	-15.897277	I’m so confused why this inflation argument keeps popping up.If you’re paying for the Ubi with taxes then there’s no inflation. Net money supply hasn’t changed (0).If you pay for ubi by printing money...		mrfusion
22601850	13.717019	6.927167	comment	5.0	14.0	1584421306	-15.89674	Why would I choose to jump through bureaucratic and degrading welfare programs for vouchers and discounts when I can opt-in to a superior UBI program that gives me cash which I can use for anything? I...		bavell
22603626	13.720947	6.9324517	comment	5.0	16.0	1584442280	11.906153	>  but the risk for people in power to use it against the people.As opposed to what, private undemocratic unaccountable authoritarian institutions controlling peoples' lives?> nce UBI exists, people w...		JDiculous
22693079	13.72256	6.9304767	comment	5.0	13.5	1585227619	-15.895436	> And maybe - just maybe - it's time everybody took another look at the UBI debate, again.Doesn't UBI directly result in inflation and cause currency devaluation? If the money that you hold loses its ...		shripadk
22769667	13.721486	6.933861	comment	5.0	13.5	1585925140	-15.896966	Taxing only the wealthiest americans could easily fund a UBI for everyone else. The middle class will not have to make any sacrifices		smooth_remmy
23103721	13.721498	6.9339623	comment	5.0	13.0	1588863490	-15.896874	Important thing to keep in mind regarding UBI is that goverment does not generate any money. In order for goverment to give money, it needs to take it from someone.So UBI is just proxy for wealth redi...		nocitrek
23104781	13.719483	6.928012	comment	5.0	18.5	1588868735	-15.893349	Oh, this study was very useful, no matter how the guardian is trying to frame it. There was no clear indication that basic income encourages people to find jobs. You can scratch that one off the list....		radu_floricica
23201478	13.720419	6.930996	comment	5.0	36.0	1589617294	-15.893201	Maybe we shouldn't be presupposing that governments are better at resource allocation than their citizens. People will still work with UBI, but they are much better positioned to choose the kind of work they personally do best.		Mengkudulangsat
23243868	13.721412	6.9330225	comment	5.0	20.5	1589956001	-15.896249	A market's throughput is limited by the number of participating actors. If a large percentage of the population can't participate, the market's capability to price, evaluate and represent value is hin...		mrdoops
23244262	13.714997	6.925713	comment	5.0	19.0	1589959907	-15.893644	"> Contrary to popular belief fear of death by being poor is not the only thing that motivates people.That's not very charitable. I rather doubt that anybody here considers ""Dickensian Nightmare"" as a ..."		donw
23258051	13.71739	6.9308066	comment	5.0	22.5	1590067723	-15.900111	UBI has a lot of practical problems. Why not start at universal health care or wider affordability of affordable housing and education? Without that any UBI will immediately be eaten up by rising prices in these areas.		Ididntdothis
23263337	13.717923	6.9294252	comment	5.0	35.5	1590087723	-15.897852	People studied the UBI idea and recognized the costs of giving money to everyone are so enormous that it's unworkable. That's there the means testing has come in to try to limit that.Something more li...		Tiktaalik
