id	x	y	type	relevance	size	year	umap1d	hovertext	url	author
33157005	13.720387	6.9314947	comment	4.0	15.0	1665440038	-15.897254	"That's a misleading title. It's predicated on the assumption that, ""conservative support for UBI rests on an approach that would increase poverty, rather than reduce it."""		sysread
33186862	13.721203	6.9360576	comment	4.0	17.0	1665631978	-15.896815	A cash infusion and a couple of months of unemployment at a time when most people were afraid to leave their houses does not amount to a strong datapoint against (or for) UBI. Testing UBI's null hypothesis requires normal economic activity.		woodruffw
33709322	13.71992	6.9322624	comment	4.0	10.5	1669142450	-15.896563	Good discussion on UBI, I used to be a big proponent of it, but after the pandemic I agree that it's not a cure all, and definitely will cause a lot of people to fall further down a vice trap, encoura...		fullshark
33880935	13.719051	6.9302034	comment	4.0	14.5	1670338567	-15.896828	"Please no more ""geniuses."" This cult of personality celebrity idol worship is toxic. The U in UBI stands for ""universal"" -- you don't need to be a genius to apply. UBI is great for enabling everyone t..."		liminal
27112270	13.725791	6.933352	comment	4.0	10.5	1620689659	-15.896049	Isn't UBI supposed to be funded by taxes and thus not as inflationary as giving new money where it's most likely to be spent?		lainga
27120781	13.72092	6.932266	comment	4.0	11.0	1620753784	-15.903256	The real question is how we pay for UBI. UBI, being universal, means everyone gets money. Where does that money come from, including over time and into the future?How much do we spend on the benefits ...		annoyingnoob
27164521	13.720568	6.9327474	comment	4.0	26.0	1621081066	-15.903927	"It's disappointing to see the tories (""The Conservatives"" political party's nickname) knee jerk opposition. It would be nice to see more details on the actual trial (length and amount paid). That said, we basically know UBI works, it's just that no one has the balls to just do it..."		LatteLazy
27164608	13.720625	6.9324675	comment	4.0	29.0	1621081881	-15.896934	Part of the reason for this lack of interest in the actual outcome is that state benefits are one of the main battlegrounds in the UK's culture war. A lot of the Tories' base comes from the ideologica...		bjackman
27273621	13.720419	6.931693	comment	4.0	27.0	1621925099	-15.895278	That is analogous to the argument favouring UBI as a replacement for usage-restricted (food stamps, scholarships, etc.) and means-tested benefits. Leaving aside the debate on whether the universality ...		Mordisquitos
37591219	13.718843	6.9309845	comment	4.0	11.0	1695250876	-15.896846	> I'm leaning more towards socialized housing, food, health care, and public transporation now, at least for the basics.What's the difference between that and UBI? The state giving the people a magica...		randomdata
37647216	13.713777	6.9220514	comment	4.0	16.0	1695661770	-15.893856	The real problem is distribution of the output of production. We will need something like UBI eventually.		make3
12537283	13.720811	6.9336557	comment	4.0	12.5	1474349375	-15.8978815	"I thought one of the major benefits of UBI was that, because it's universal, there's less stigma attached? If you're either ""working"" or ""on the dole"" then the latter makes you feel pretty useless. If..."		taneq
13169918	13.718709	6.9293456	comment	4.0	12.0	1481657217	-15.893656	I'm with you entirely.I have no idea how to solve this problem. My cousin's husband is a truck driver. He makes a six figure income running between Indy and Chicago (bang, bang). He's going to retire ...		virmundi
13207813	13.719207	6.929624	comment	4.0	11.5	1482097290	-15.895844	> The shift in attitude needs to be that slackers are being paid to stay out of the way of people that want to work and that's a good thingThe people who work, who I assume are the intended audience o...		twblalock
13207903	13.718463	6.9294615	comment	4.0	12.0	1482098166	-15.894116	The biggest turn off for me is that most UBI advocates seem to have the opinion that people freed from jobs will turn into philosophers or artists or otherwise make productive use of their time. I arg...		ng12
13308998	13.719915	6.930727	comment	4.0	15.0	1483450725	-15.897259	The title is misleading in two ways.First, 60% does not sound like too much (makes you think that 40% agree) until you see that only 2% actually agree with it.Second, the question is not about UBI in ...		tpetricek
13438094	13.719955	6.9303765	comment	4.0	10.5	1484850373	-15.895176	>but it's a somewhat limited solution to capping how far down someone can fall in societyThat's welfare's job. UBI is to provide a living wage when its not possible or difficult to do so (depressed ar...		drzaiusapelord
13455836	13.717597	6.927566	comment	4.0	12.0	1485102617	-15.895384	"Capitalism is going away, no matter what, once we have massive unemployment due to automation.
You think people are just going to accept starvation? Shit will get real, real fast.
And most people aren..."		nickthemagicman
13455739	13.713737	6.920558	comment	4.0	13.0	1485101462	-15.889421	Funny how all the proponents of a Universal 'Basic' Income aren't proposing instead to make every 'Basic' item 'Free'.After all, if you believe their rhetoric, giving someone $500/mo should be the sam...		jarym
13457211	13.715965	6.926915	comment	4.0	29.5	1485116753	-15.898514	I think that's one of the biggest open questions with UBI. What percent of people would use UBI to do productive or self-improving works vs those that solely play video games, watch TV, and feel like ...		chriskanan
13458337	13.714928	6.923685	comment	4.0	10.5	1485127661	-15.894202	The fact that someone is paying you to do these jobs shows that the things you do do have a lot value to someone (your boss, the company's customers etc.). So your existing job is far from being meani...		wolfgke
13594877	13.716013	6.925167	comment	4.0	10.5	1486517420	-15.895047	> b) the more work is done by machines, the richer the population as a whole will beTrue - as a whole. But as things stand now, the owners of the machines get richer, and the displaced workers get sig...		foxylad
13595253	13.719966	6.9314227	comment	4.0	15.0	1486522206	-15.908947	Ubi should never be about owning anything. It should be about providing housing, food, healthcare, clothes, and nothing more. It should be for all citizens, including children. This way you can have a...		bitJericho
27576810	13.722792	6.9344196	comment	4.0	13.0	1624256723	-15.898435	> UBI means that anyone who's able to live frugally may, at any time, retireWill never happen: a soon as it starts rolling to a significant number of people, the minimal rent set by landlords will be ...		tasogare
27577732	13.719561	6.9314847	comment	4.0	12.0	1624269619	-15.896704	Regarding UBI I have asked this in multiple forums (not HN) so I'll ask again and see if you (or anyone else) has a response to this. After the oil bonanza in the middle East, a number of countries pr...		bongoman37
27631228	13.7164545	6.927837	comment	4.0	13.5	1624631444	-15.898266	Absolutely. There is no free lunch. UBI comes on the backs of the value adding class of society. Some people actually LIKE to work, hard as it is for some to believe.The Value Adding Class will have p...		SavageBeast
27740100	13.721583	6.9342527	comment	4.0	12.5	1625506517	-15.897283	How would that work in practice? Wouldn't people just move to the higher UBI areas?		ericmay
27850152	13.721216	6.933415	comment	4.0	12.5	1626383220	-15.893643	">""dismantling some/all of the existing welfare state.""I think this is going to be a nigh insurmountable hurdle. To be upfront, I do not support UBI and I am extremely skeptical of it. But plenty of my..."		BitwiseFool
27900574	13.687007	6.8971267	comment	4.0	18.0	1626824260	-15.894357	"One could argue the move to continue unemployment payments / covid payments is a strategy to ""raise minimum wage"" without actually having to pass any policy to do so.  Politically it's brilliant, you ..."		71a54xd
27950355	13.722993	6.93639	comment	4.0	13.0	1627229966	-15.901575	Is it representative to hand out $1K or $500 a month? It doesn't sound like it would change much for most people, though I'm sure there's someone on some margin who gets pushed over into being able to...		lordnacho
12068009	13.718896	6.9306045	comment	4.0	10.5	1468196825	-15.896433	There may be valid criticisms of UBI, but this article doesn't mention any.> Our goal should be ... to foster the skills ... to make sure people can get into jobs, which would much more directly addre...		tlb
12070809	13.669892	6.8748794	comment	4.0	17.0	1468243032	-1.5888016	[Expat living in France, leaving soon]France is a very bad example of UBI. I see it as a society where everyone expects their rights, but no one sees anything as their duties. People see all public (a...		ucaetano
12243230	13.722621	6.935034	comment	4.0	29.5	1470597489	-15.897319	UBI comes from tax money though. If the idea behind UBI is that people don't need to go work, and won't go buy McDonalds anymore, then tax income is going to plummet. If tax income plummets, what pays...		RyanZAG
12468515	13.7144985	6.925497	comment	4.0	14.5	1473501356	-15.895369	"Given the ""gift in one hand, gun in the other"" history of western actions in Kenya and other African countries over the last centuries, it's hardly surprising there's going to be the random pocket of ..."		PieterH
35191939	13.718739	6.9297886	comment	4.0	12.5	1679018579	-15.892794	Look .. I am one of the working class here. But I gotta point out. Our standard of living is far superior to someone living in 1970 when it comes to stuff/technology. The stuff is cheaper because of C...		brutus1213
35262654	13.718138	6.927738	comment	4.0	10.5	1679499224	-15.897783	UBI is a half-measure, we need democratic, communal control of industry.		nivenkos
35411908	13.718382	6.9290786	comment	4.0	23.0	1680451058	-15.893875	UBI will always be the best answer.  MLK advocated for it as the best way to alleviate poverty. Even Milton Friedman believed in a pseudo-UBI through his Negative Income Tax.		bigtex88
28049253	13.718182	6.929394	comment	4.0	15.0	1627999177	-15.897143	> ... as bosses refuse to raise wages to attract employeesI see UBI as a very elegant solution to this problem. It levels the playing field for everybody. The problem with the current job market is that the negotiation power is not symmetrical.		perfunctory
28204198	13.714198	6.9245386	comment	4.0	16.5	1629156767	-12.818044	Correct me if I'm wrong, but I was under the impression that wages are quite inflated in the USA and $1000/year is not a livable income (i.e. sufficient for cheap housing, cheap food, water, electrici...		lucb1e
22386679	13.720862	6.9322495	comment	4.0	17.5	1582318799	-15.898744	"While I was a proponent of UBI several months ago, I have found some irreconcilable flaws and would urge everyone to consider Progressive Guaranteed Income, a basic income for people below a certain ""..."		stazz1
22405332	13.7209215	6.9329057	comment	4.0	15.0	1582560834	-15.896962	"Nothing that requires the labors of other is a ""right"". UBI funded by private equity is fine. UBI funded by taxes is theft and extortion."		exabrial
22494488	13.72003	6.931954	comment	4.0	14.5	1583423144	-15.897486	>Right now there are explicit subsidies for housing and healthcare. If they get replaced with a UBI in the same amountGood luck with that. UBI is barely tolerated by the left and progressives but only...		macspoofing
22494690	13.721254	6.9329705	comment	4.0	11.0	1583424126	-15.895552	The end does not justify the means. Forcibly removing someone's money and transferring it to another person can never be justified. Tax-funded UBI is theft, slavery, and extortion.However, if a billio...		exabrial
22494519	13.716541	6.9237075	comment	4.0	12.0	1583423272	-15.890283	I don't think this fits the definition of basic income.> Whatever income participants earned was deducted from their basic income at 50 per centThat is equivalent to a massive 50% tax rate on every do...		winstonewert
22495216	13.721258	6.933334	comment	4.0	10.5	1583426714	-15.895499	There are absolutely people who would contribute to society in other ways but there are also people who would not work, not contribute and, sit in their rooms all day not having the will to do anythin...		a0zU
22495353	13.717219	6.927462	comment	4.0	15.0	1583427309	-15.900501	A lot of work today is pretty much bullshit/meaningless; I mean look at 85% of the US insurance / medical billing professions are useless and only exist because there is manufactured bureaucracy. Bull...		xzel
22497387	13.721441	6.9310465	comment	4.0	11.5	1583437728	-15.897218	"[citation needed]Is that anything but conjecture? I see a study showing that UBI is a ""good thing"", and you didn't provide a source for your reasoning.Edit: to all those saying that the parent comment..."		battery_cowboy
22499035	13.720815	6.932559	comment	4.0	13.0	1583447360	-15.896586	"""UBI is a political decision which is renewed with every government""If this is true than implementing UBI will be more problematic than I thought. All UBI proposals so far call for all other financial..."		zazaalaza
22594004	13.717483	6.927898	comment	4.0	14.0	1584375753	-15.895431	I too think this is silly. Everyone wants to use this disaster to achieve the policy goals they wanted anyway. Republicans want to use it as an excuse for tax cuts. Democrats want to expand public hea...		Gunax
22594304	13.720355	6.93238	comment	4.0	12.5	1584377124	-15.897601	i just don't see how UBI survives a highly polarized, segregated society pumped out by the US media. imagine the headlines by Fox News as soon as they find 4 people living together playing video games...		maximente
22601721	13.720117	6.932032	comment	4.0	14.5	1584419813	-15.901872	The problem with UBI is that most versions of it would essentially liquidate social services that people would normally receive. UBI only makes sense in addition to the other parts of a comprehensive  safety net (universal housing and healthcare), not as a replacement.		beastcoast
22769577	13.717411	6.928043	comment	4.0	21.0	1585924750	-15.892138	> Without universal basic income, we are totally f@ckedUBI isn't a savior. UBI still requires that people, you know, pay taxes. If 30-40% of people have no income and are completely dependent upon the...		nvahalik
19116671	13.720308	6.9302373	comment	4.0	12.0	1549647570	-15.899286	The experiment was probably staked with an agenda to show that UBI doesn't work, given the parties in the government and the massive bias in selecting the participants.The sample of 2000 people were c...		yason
19116240	13.720808	6.932918	comment	4.0	10.5	1549645376	-15.897174	did they really have to study this? We have decades of welfare to analyze. UBI is dead in the water. Call it a negative tax rate instead.		pastor_elm
19219005	13.7158575	6.9261856	comment	4.0	12.0	1550772380	-15.898096	It's more than that. People need purpose.That's why things like UBI are a pipe-dream. Any Fortune-500 executive could live a life of leisure with 2-3 years of planning. They tend to not make that choice.		Spooky23
19571358	13.717338	6.92814	comment	4.0	15.0	1554381018	-15.896481	You’re basically saying that because it has ethical value it can’t make people lazy. That’s irrelevant. UBI might make people lazy. In fact, it would be pretty shocking if it didn’t make some % of the...		b_tterc_p
19807959	13.709711	6.917879	comment	4.0	11.5	1556805583	-15.892303	As you must know being a business owner, labor is only one component of expenses, so prices don't go up x% just because labor went up x%. In McDonald's case, a 100+% rise in wages would represent a 4%...		jimmaswell
19899369	13.711065	6.9205103	comment	4.0	31.5	1557756512	-15.891986	UBI. Then we can be gleeful about more automation.		amedvednikov
19899974	13.722779	6.933587	comment	4.0	16.0	1557759933	-15.898019	UBI supporters always seem to forget that the money has to come from somewhere.		driverdan
19900302	13.722358	6.9348845	comment	4.0	13.5	1557761649	-15.897069	I'm a UBI supporter in theory. It's the practical math that always leaves me hung up. Even $600/mo/adult citizen is a seemingly prohibitive amount of money (works out to approximately the entire amoun...		sokoloff
15870514	13.721259	6.9318404	comment	4.0	17.5	1512658950	-15.893502	I still don't see how UBI doesn't cause inflation enough to offset any benefit(in the near term ie before robot job apocalypses).		sharemywin
15871077	13.691212	6.9246593	comment	4.0	11.5	1512661919	-15.895966	When it comes to UBI, there's an interesting psychological phenomenon.I believe that McDonald's and similar establishments could have automated away the vast majority of their work force years, maybe ...		fpgaminer
15918153	13.720165	6.930485	comment	4.0	12.5	1513203098	-15.895675	"""We’re still in our pilot. It turns out that giving money to people is much harder than you might imagine. We’ve had to work with state, local, federal governments so that people in our study don’t lo..."		jpao79
15918407	13.716693	6.9300227	comment	4.0	11.0	1513205021	-15.894054	> If I were Sam A. instead of (or in addition to) funding UBI, I would fund R&D projects which enable people to live as off grid and self-sufficiently as possible with all the comforts of urban/suburb...		Suncho
15918850	13.716719	6.926835	comment	4.0	17.5	1513209647	-15.896774	"""The other way is thinking of the billions of brains wasted every generation just trying to survive, exactly what humans did 2000 years ago. Now imagine if all these brains could be freed and god know..."		dahdum
16100583	13.723119	6.9350386	comment	4.0	16.5	1515445623	-15.89826	That's a really great insight.  The fact that such good intentions often lead to bigger problems is what concerns me about UBI - it will surely have huge second-order effects.  I'm not sure what they ...		DougN7
16192278	13.7121315	6.921509	comment	4.0	15.5	1516427576	-15.89822	I'm not trivializing anything. I spent 5.7 years homeless. I got off the street 4.5 months ago.We have a ridiculous number of homeless in the US. Meanwhile, rich tech giants talk of giving UBI to ever...		DoreenMichele
18329861	13.69717	6.9267054	comment	4.0	15.0	1540837570	4.809309	People treat drug users as if this was something that they chose to do. In fact, most drug addicts are in this situation because they suffer from a tendency to drug abuse. Many of them had good jobs a...		coliveira
18390047	13.7082405	6.9177284	comment	4.0	14.0	1541503849	-15.89546	Paywalled, but the taster paragraph gives a strong hint:> Near the end of 2006 Mitch Daniels, then governor of Indiana, announced a plan to give the state's “neediest people a better chance to escape ...		pjc50
18795387	13.7216015	6.9338026	comment	4.0	11.5	1546274945	-15.899527	UBI was only a small-ish step to a moneyless post-scarcity economy.When rent is taken care of (cause there isn't rent), along with food, water, electricity, communication and more, what is there to 'buy'?		crankylinuxuser
18921805	13.718153	6.9289985	comment	4.0	11.0	1547653652	-15.894602	yes, I am surprised this is overlooked.  It may be that tech workers who like the idea of UBI imagine working on open source projects.  I picture a large percentage of the population choosing to use d...		onetimeusename
18923268	13.7201805	6.9313307	comment	4.0	19.0	1547662241	-15.895991	If people don't work on anything once they get UBI this isn't really a problem.  Currently, there are many many people who already don't do anything.  They only do a little as possible to avoid gettin...		Verdex
18923711	13.721565	6.9338355	comment	4.0	13.5	1547664691	-15.898215	With respect to 1,2,3.People make some pretty bad decisions.  And people like to trick other people into making bad decision.  I didn't think this was controversial.Why is this relevant to UBI?  One o...		Verdex
29969602	13.720736	6.931963	comment	4.0	13.0	1642443222	-15.894613	If UBI could be implemented in around the same cost as the welfare programs it replaces, it would have a net zero effect on inflation. The downside of nearly all current forms of welfare (in the U.S.)...		jhauris
29978355	13.72115	6.9333324	comment	4.0	13.0	1642510854	-15.898139	If you raise taxes and prices a lot, UBI will become basically useless, because it's effects will be eaten up by inflation.Hell, why wouldn't I increase rent to the UBI amount?		DocTomoe
29977542	13.720334	6.932144	comment	4.0	10.5	1642504151	-15.897424	I mean, OK, but one could also argue that the reason a given artist is struggling is because their work is not highly valued in the first place.Maybe the artist is making under-appreciated contributio...		headmelted
30080518	13.715661	6.9272237	comment	4.0	38.0	1643160568	-15.8961525	"I'd be much happier if UBI proposals were higher. 
Living on ~900$/month nowadays would be difficult.20 years ago I was able to split rent for a tiny concrete windowless-basement-bedroom for 450$/mo, ..."		willjp
30172539	13.72137	6.932971	comment	4.0	18.0	1643766972	-15.897711	"UBI is a pipe-dream.  Look what happened when we tried it on a small scale with stimulus to ""everyone"".  Rents went up 20-40% across the board, and demand exceeded supply in most industries.  This wil..."		eric_b
30247330	13.719454	6.9310546	comment	4.0	13.0	1644252384	-15.895487	You cut most of our bureaucratic social safety net (food stamps, disability, social security, etc) and replace it with a system where everyone gets enough for the bare basics.  If you were smart, you'...		wing-_-nuts
30397908	13.721222	6.933178	comment	4.0	30.5	1645285434	-15.896213	I think it starts with a return to a progressive tax system with higher tax rates on upper incomes. In today's political climate, UBI would be dead on arrival.		gnz11
16875462	13.726078	6.9402137	comment	4.0	18.0	1524142507	-15.901514	>2/ Regardless of what version of UBI you personally support, it is probably not a good idea to give money to those who don't need it.Wrong.  The system doesn't work if you don't give people to money ...		magduf
16875802	13.72149	6.932977	comment	4.0	16.5	1524145310	-15.899348	There are already large versions of UBI already in place, just by another name. If you take a look at Saudi Arabia and other rich gulf states, there’s essentially large cash transfers to citizenry for...		whb07
16936875	13.722241	6.9330173	comment	4.0	13.0	1524784665	-15.898336	One thing I don't see addressed here or in research on the topic is the macroeconomic impact.  Would a UBI cause inflation or other mechanisms to make up the difference in prices?  For example, if eve...		shireboy
16996850	13.72021	6.9317737	comment	4.0	12.0	1525457725	-15.901418	UBI will lead to societal degeneration. Prices of essential services and goods would skyrocket; people would lose direction and the small amount of meaning they had.I call UBI gay-space-communism beca...		aristocles
17013231	13.715707	6.9252033	comment	4.0	11.0	1525705188	8.833551	 Didn’t Finland just roll their UBI experiment back?If I remember correctly they tried it on the small sample it didn’t have a meaningful impact and they calculated it would be too expensive to try the whole country, but I could be meant remembering wrong.		SlowRobotAhead
17013721	13.719185	6.9313006	comment	4.0	12.5	1525708371	-15.919872	As someone who is friends who two different social workers and related to someone in family court diversions (think: parents getting their kids taken away and want them back) I can tell you that UBI i...		ataturk
17175617	13.71782	6.9284453	comment	4.0	21.5	1527554387	-15.896681	This is one of the main reasons I am so heavily in favor of UBI, even though I am quite the anarchist if we are talking about idealism and not pragmatism.There IS money being made out there by large f...		anoncoward111
22795508	13.720514	6.9334674	comment	4.0	15.5	1586192943	-15.90326	This is fantastic, finally we'll get some real-world results so we can see the consequences (good and bad) of UBI at a very large scale and we can put an end to all the speculation about what it might...		grecy
22803245	13.717285	6.9259195	comment	4.0	14.5	1586268014	-15.896033	Every single UBI proposal I've seen has failed to work even with back of the envelope math, even when using generous assumptions and estimates. They end up either 1) Gutting existing entitlements by a...		HideousKojima
22815401	13.718853	6.9297986	comment	4.0	29.5	1586369272	-15.896653	Of course there are productivity boosters. The dishwashers, vacuum cleaners, vehicles, computerized booking, and many other pieces of technology have replaced the need for many additional workers.The ...		earthtourist
22830040	13.722363	6.9305935	comment	4.0	11.0	1586493939	-15.896677	Seems like the US should have UBI at this point. How can the purchasing of junk bonds be justified but not a UBI? Give every citizen a fed bank account, type in some numbers and poof! 2k/month.		deevolution
22918615	13.721025	6.9334784	comment	4.0	15.5	1587328716	-15.915544	Once we implement UBI, what's the argument against doubling it?		rriepe
23140727	13.720416	6.9315825	comment	4.0	18.5	1589193850	-15.896098	Where's the money for the UBI experiment coming from?There's no free lunch, folks...		moralsupply
23140486	13.720098	6.932077	comment	4.0	10.5	1589191349	-15.897964	but did UBI encourage more productivity from those participants? Is it more than the cost of such a program? I want to know if UBI is a net benefit or not.		chii
23201362	13.719285	6.93012	comment	4.0	41.0	1589615998	-15.898008	> Another positive sign for UBI is that most Americans seem keen to return to their workplaces. One fear has been that UBI would lead to a couch-potato culture, with people choosing to stay at home ev...		BelleOfTheBall
