id	x	y	type	relevance	size	year	umap1d	hovertext	url	author
33082469	13.5807085	-5.5186834	comment	3.0	12.5	1664899913	9.817041	Just a note that LiteFS isn't a distributed filesystem; despite the name, it's not a filesystem at all, but rather just a filesystem proxy. It does essentially the same thing that the VFS layer in SQL...		tptacek
33099767	13.655977	-5.592798	comment	3.0	13.5	1664996014	9.813531	"I mean.  I was definitely unfamiliar with their ""Code of Ethics"" [0] until I read it and I cannot say that I'm a tremendous fan.  But also, it's the absolute last thing mentioned in the readme, so unl..."		anoonmoose
33100227	13.457365	-5.2558856	comment	3.0	13.0	1664998218	9.718342	"Is Postgres ever going to allow automatic partitioning?Something like:    CREATE TABLE logs (
      time TIMESTAMPTZ,
      data JSONB  
    ) PARTITION ON time IN INTERVAL '1 day'

And it just create..."		eatonphil
33138289	13.504627	-5.4053392	comment	3.0	11.5	1665289979	9.794709	What you're saying applies more or less no any NoSQL database.  Unusable for your use case is a bit of a big statement.  There's plenty of cases where you don't need the power of relational databases ...		YZF
33145874	13.632639	-5.6197047	comment	3.0	11.5	1665354170	9.81324	> Uses SQLite, and no external dependencies except Python 3.10+I don't know if it's the way it's been written, but it reads to me that only python is needed, no libraries.I'm assuming this isn't true ...		cetra3
33190378	13.44078	-5.108992	comment	3.0	14.0	1665666050	-6.9346704	"A related and also very useful usage pattern: ""backend instance per customer"".Because…There are many ways to implement multi-tenant SaaS; but a highly underrated approach is to write a single tenant a..."		kylecordes
33190737	13.471793	-5.4976697	comment	3.0	16.5	1665668173	9.76791	SQL MERGE looks great! I hope I remember it when the time comes, instead of writing 3 separate queries.edit: Postgres docs on MERGE: https://www.postgresql.org/docs/15/sql-merge.html		mullsork
33198315	13.620952	-5.6682343	comment	3.0	10.5	1665707714	9.959114	"Is ""ported"" the right term here? It know the repo's README says ""CGo-free port"", but this is the C version of TCL transpiled from C to Go (see the ~13MB .go files per platform in the ""lib"" directory)...."		benhoyt
33206541	13.547748	-5.466661	comment	3.0	11.0	1665768940	9.748718	Shameless plug of my mvSQLite [1] project here! It's basically another distributed SQLite (that is API-compatible with libsqlite3), but with support for everything expected from a proper distributed d...		losfair
33213622	13.493548	-5.3995757	comment	3.0	14.5	1665831102	9.812147	What frustrates me about the software industry is the many failed lineages problem. There are many mountains of code that get the job done at various companies but isn't shared. The lineage of these i...		samsquire
33216326	13.436499	-5.4297886	comment	3.0	11.0	1665852425	9.794341	"> We plan to do more research on scalability, since column-based databases can’t grow as big as their NoSQL counterparts.This one sentence makes me question this firm's expertise. ""Column-based database"" has a meaning, and Postgres definitely isn't one of them."		simscitizen
33320867	13.49275	-5.422201	comment	3.0	13.5	1666638078	9.830695	Seems like all the NoSQL databases eventually implement SQL, maybe we should use EventuallySQL instead NoSQL		synthc
33329795	13.626432	-5.5937304	comment	3.0	11.5	1666702271	9.909591	"""This bug is an array-bounds overflow. The bug is only accessible when using some of the C-language APIs provided by SQLite. The bug cannot be reached using SQL nor can it be reached by providing SQLi..."		harryvederci
33357938	13.482307	-5.385971	story	3.0	16.0	1666880791	9.794236	What is PostgreSQL commitfest and how to contribute	https://supabase.com/blog/postgresql-commitfest	kiwicopple
33376664	13.497856	-5.5334916	comment	3.0	16.0	1666986101	9.822996	As a little pro-tip, the demos appear to be serving a gzip compressed WASM file, but offering a brotli compressed version for clients that say they accept it would be even better:    665K sqlite3.wasm...		coder543
33379069	13.590679	-5.5655484	comment	3.0	11.5	1666998072	9.898419	See, that's the insanity: why would we need an independent implementation? sqlite has authoritative libraries, that everyone uses, and sqlite3 has been stable for literally over a decade. For all that...		TheRealPomax
33388919	13.615002	-5.581488	comment	3.0	12.5	1667085360	9.8557825	Is this example too large or about the right size for you? https://github.com/simonw/sqlite-utils/commit/ab8d4aad0c42f9...		simonw
26581192	13.528908	-5.4234276	comment	3.0	17.0	1616684928	9.76019	I've built a complex CRM that handles 2.1 million USD in transactions every year. It is running sqlite with a simple in-memory lru cache (just a dict) that gets purged when a mutating query (INSERT, U...		michaelmcmillan
26581414	13.560353	-5.496779	comment	3.0	11.5	1616685960	9.7477865	The article addresses this.  Basically, you can have any number of concurrent readers, but only a single writer.  Writing and reading can happen concurrently just fine.  So the question is -- how many...		gwd
26674671	13.575526	-5.51758	comment	3.0	10.5	1617389722	9.812601	Just SQLite - two tables, one for the nodes, one for edges + some fancy constraints and queries. I was tempted to make a custom binary format, but that's a big task, and it seems to work fine as it is...		climech
26676135	13.455291	-5.3181596	comment	3.0	13.5	1617398525	9.737787	A good overview, but the most secure way is to not give any table-level access privileges and only allow access using SECURITY DEFINER stored procedures (the PG equivalent of the setuid bit). For inst...		fmajid
26685384	13.626616	-5.579222	comment	3.0	13.0	1617489528	9.911662	One of the things I really like about SQLite is the fact that it is in the public domain.But most third-party extensions, like this one, aren't. (This extension is MIT licensed.) If you think SQLite b...		skissane
26770324	13.904574	-5.1879745	comment	3.0	11.0	1618148588	-13.613032	Sequential is still bad if you don’t want to disclose the size of your customer base or other commercially sensitive information.Also see the German Tank Problem[1].1. https://en.m.wikipedia.org/wiki/German_tank_problem		yardstick
26773909	13.977954	-5.215154	comment	3.0	12.5	1618178776	-13.646134	> Personally, I'm a fan of giving everything a random UUID, because it's more flexibleUnless of course, you're using a relational database like OP and incur a performance hit from using a UUID as your...		yukinon
26785627	13.630444	-5.1577806	comment	3.0	11.0	1618264225	9.871252	"On the other hand, MongoDB is already sort of obsolete and trending towards death by the time that all ended up happening while ElasticSearch is hot and ""new""."		busterarm
26817305	13.516805	-5.559974	comment	3.0	17.0	1618472451	12.149669	Over the last few weeks I built a Rails app, after a ~10 yr hiatus. I love Rails.Rails switched to SQLite for at least the development environment.As soon as I started to test the app with multiple cl...		the-dude
26817386	13.520727	-5.4472704	comment	3.0	12.0	1618473168	9.735559	> I use Gitea(Github clone) locally with SQLite running on ZFS where I can take atomic snapshots of both the SQLite database and git repositories.ZFS snapshots may not result in a consistent databases...		mulander
26817876	13.549247	-5.504604	comment	3.0	12.5	1618476848	9.817728	We've been using SQLite as our principal data store for 6 years. Our application services potentially hundreds of simultaneous users at once, each pushing 1-15 megabytes of business state to/from disk...		bob1029
37582350	13.452524	-5.4123435	comment	3.0	14.5	1695203916	9.82208	The core problem here is that web application developers don't understand or use database transactions. I've seen this myself at almost every web shop I've ever worked at - queries / updates would be ...		josephg
37595838	13.530356	-5.238406	comment	3.0	13.5	1695293430	9.751008	How is (a) wrong? Pg doesn't horizontally scale like Mongo does		seedless-sensat
37614742	13.561312	-5.489959	comment	3.0	20.0	1695403035	9.791325	I’m bullish on SQLite, and this is mostly a great article, but this kind of stuff is flat-out misleading:> When you put your data right next to your application, you can see per-query latency drop to ...		jmull
37615063	13.582697	-5.5135746	comment	3.0	18.0	1695404332	9.804049	Any self respecting e-commerce site would want fault tolerance and strong consistency even with potential network partitions, so definitely not SQLite as described in article		endisneigh
37678497	13.533118	-5.5309615	comment	3.0	12.0	1695837427	-11.0869255	I dug into the internals of the local, SQLite version of this just now and wrote up some notes here: https://til.simonwillison.net/deno/deno-kv#user-content-deno...The most interesting detail is proba...		simonw
37733802	13.973661	-5.2039237	comment	3.0	11.0	1696218930	-13.66229	It seems insane to me to “validate” GUIDs/UUIDs.Half the point of these things is that they’re treated as opaque identifiers.		jiggawatts
37734485	13.98482	-5.2098646	comment	3.0	10.5	1696226472	-13.694979	Is there a way to encrypt 122 bits -> 122 bits? If so – do that and set version to 4.Alternatively, just say it's a random string ID and not an UUID.		notpushkin
37733316	13.982834	-5.218905	comment	3.0	11.5	1696214026	-13.6847	And you can use it today with Postgres uuid type. Postgres doesn’t care what you store in it as long as it has the correct length. So you can generate a uuidv7 and store it natively		pyrolistical
37734980	13.986458	-5.212239	comment	3.0	13.0	1696232155	-13.70756	Why not just use the AES-128 result as the UUID then? What's the benefit of the internal structure at all?If AES-128 is an acceptable external UUID (and likely an acceptable internal one), then you might as well just stick with a faster RNG.		dragontamer
37736936	13.488	-5.4276767	comment	3.0	11.0	1696247261	9.901955	I too ran a small ISP from 1995-1997 or so, and the biggest gift I got from one of my co-founders was the strong suggestion we use this new cheap database called mSQL [1] as the basis of our accountin...		dgacmu
37737760	13.986483	-5.2104015	comment	3.0	13.0	1696253129	-13.6744585	Unless you have specific needs, the only type of UUID you should care about is v4.v1: mac address + time + randomv4: completely randomv5: input + seed (consistent, derived from input)v7: time + random (distributed sortable ids)		ricardobeat
37738098	13.98192	-5.2040353	comment	3.0	11.0	1696254698	-13.697306	As someone who only cares about v4, I periodically wonder why don't I just use fully random 128-bit identifiers instead (without the version information).		kozak
37805833	13.442781	-5.248585	comment	3.0	14.0	1696715146	9.764224	Alternatively you could use Continuous Archiving with Point In Time Recovery [1] which has been built into Postgres for a while.  Once your db exceeds several tens of gigabytes dumping to SQL is just not a viable solution anymore.[1] https://www.postgresql.org/docs/current/continuous-archiving...		michelpp
37767207	13.4717865	-5.4025965	story	3.0	29.0	1696435619	9.807255	Improving PostgreSQL: How to Overcome the Tough Challenges	https://www.yugabyte.com/blog/improve-postgresql/	franckpachot
37836498	13.482756	-5.340465	comment	3.0	11.0	1696966786	9.765523	I am a new contributor to Postgres as of 5 months ago. I turn 27 later this month. While I haven't contributed too much of value, I have a few commits here and there with plans to do other things, lik...		tristan957
37848312	13.432462	-5.1450353	comment	3.0	10.5	1697048697	9.704362	But a droplet with a Postgres db is nearly free, and seriously performant.And for 65/month, you can get a VERY beefy Hetzner server.You’ll have to wade through the crazy thicket that is the menu of cl...		FredPret
37891285	13.473919	-5.3244653	comment	3.0	20.0	1697388450	9.771638	Postgres still has a ways to go for scale but has improved substantially in replication options since that 2017 article. Sharding has also seen a lot of upstream patches from enterprise db and other c...		bbatha
37891330	13.490179	-5.3880715	comment	3.0	18.5	1697388699	9.8329935	Vanilla MySQL vs vanilla Postgres. MySQL still wins on scale. You run single MySQL servers with 70,000 connections, you can't get close on Postgres because of a fundamentally broken connection-per-pro...		samlambert
37851399	13.448417	-5.2646966	story	3.0	15.0	1697064791	9.81009	Traktor, true multimaster replication for PostgreSQL	https://theplateisbad.blogspot.com/2023/10/traktor-true-multimaster-replication.html	samaysharma
37918251	13.974036	-5.219214	comment	3.0	11.0	1697562850	-13.646688	If you care about compressability, you can simply use a different way of generating UUIDs, instead of switching to another type. For example initializing a 128-bit counter when starting the process an...		CodesInChaos
14715279	13.453124	-5.3353634	comment	3.0	14.0	1499390164	-13.565971	"You can achieve similar goals to Datomic using Postgres:    create table snapshot (
        id uuid primary key default uuid_generate_v4(),
        ts timestamp without time zone default now(),
      ..."		Cieplak
14716016	13.4870405	-5.38149	comment	3.0	12.5	1499401192	9.829723	Until they go out of business and you're fucked. That's when you wish you'd stuck with Postgres.		vosper
14723131	13.632744	-5.3955207	comment	3.0	13.0	1499470915	9.860089	When I started building my first app in 2011 MongoDB was the rage. So I build the back-end using the futuristic 'No-SQL' technology. It turned out to be slow (~1 min Query time), inconsistent, and mis...		jsemrau
14805812	13.628657	-5.377688	comment	3.0	11.0	1500483823	9.826699	You definitely can but MongoDB provides convenience over storing and managing JSON files on you filesystem by your own efforts.		mrtksn
14976205	13.466768	-5.2401047	story	3.0	58.0	1502337453	9.817223	Fork a distributed Postgres database with Citus	https://www.citusdata.com/blog/2017/08/04/fork-your-distributed-postgres-with-citus-cloud/	DataChomp
15016851	13.4723425	-5.383715	comment	3.0	14.5	1502791691	-9.175591	As a long time user of MySQL, I've switched to PostgreSQL for my most recent startup precisely because the PostgreSQL team continue to innovate in a sensible way.One of the core requirements is a stab...		rorygibson
12543892	13.618707	-5.2042785	comment	3.0	11.5	1474410191	9.86849	Sad to not see Jepsen tests ran on this at least by the developers when releasing a new clustering piece.The folks working on cockroachdb recently did this[1] and it was a good read.[1] https://www.cockroachlabs.com/blog/diy-jepsen-testing-cockro...		SEJeff
12584030	13.534585	-5.4318857	story	3.0	16.0	1474912593	9.791812	DBHub.io: SQLite database storage “in the cloud”	https://dbhub.io	justinclift
12642810	13.467017	-5.180339	comment	3.0	12.5	1475664072	9.605822	Don't want to be accused of being a shill (I'm not, I'm just a fan), but if you're looking for potential alternatives to RethinkDB, Couchbase (the company that was formed when the MemcacheD and CouchD...		PaulCapestany
12649464	13.708307	-5.2817383	comment	3.0	27.0	1475717603	9.9075	A shame that a company like mongo can exist while a company like rethink folds.		joneholland
12649483	13.684665	-5.30005	comment	3.0	19.0	1475717806	9.907369	MongoDB is like the Microsoft of operating systems.  Well promoted and easy to get going with.  Hopefully they use the money they have to rewrite MongoDB to be better.		bhouston
12649543	13.705916	-5.296216	comment	3.0	10.5	1475718285	9.891333	Because having the better product (often) doesn't matter:  see Windows vs Apple in the early days.Mongo has a strong community, which translates into a plethora of articles/blog-posts/tutorials/etc th...		omginternets
12649812	13.662418	-5.3199573	comment	3.0	11.0	1475721638	9.888833	"Not sales. Marketing.
In today's world having someone push a new database for a hefty price is not going to work. I would need to be able to test it against mongo and decide myself that it is better... but how would I know it's even an option?"		ronreiter
12649476	13.657641	-5.2837543	comment	3.0	21.5	1475717718	-12.825497	I hope this isn't true. Having worked at/on multiple competitors I have nothing but respect and admiration for the work the RethinkDB team has done to make a great database and development platform.Th...		tbrock
12656419	13.613057	-5.1974473	comment	3.0	11.5	1475790597	-12.724024	"I have to agree here a bit.  However, there was nothing stoping Rethink from building their own service and promoting it as the ""official"" RethinkDB service.  They have the unique opportunity of makin..."		nemo44x
12664015	13.595025	-5.3085756	comment	3.0	18.0	1475875437	-12.803992	"RethinkDB's niche is allowing a service to listen for changes to a dataset. As in, your Node application could listen for published events by Rethink, rather than your Node application long-polling the dataset for changes. ""Real Time"" data analytics can then be performed."		alexbanks
12664043	13.445453	-5.210752	comment	3.0	16.0	1475875730	9.692401	Its other niche is easy to deploy replication and sharding that actually works, actually scales, and does not lose data.		api
12688522	13.503929	-5.1365414	comment	3.0	12.0	1476219907	-13.698679	Can you point me to a source for 'routinely stream millions of events per second into druid'?While it is true that druid is great at querying billions of rows per second it's not very good at ingress....		dataloopio
12724430	13.66019	-5.250434	comment	3.0	18.5	1476707493	-12.806292	I was surprised to hear that RethinkDB was shutting down, since everyone that used it seemed to like it.I looked into their business model a bit more... and it was like, super difficult to figure out ...		mej10
12740834	13.562602	-5.4841447	comment	3.0	10.5	1476847687	9.770472	"Thanks for asking!Re: ""SQLite can be beat really easily by the client/server systems since each SQLite instance only supports one concurrent writer"" -- That's not actually true, sqlite supports concur..."		quinthar
12733425	13.529431	-5.344094	story	3.0	157.0	1476789329	9.85717	NoSQL Data Modeling Techniques	https://highlyscalable.wordpress.com/2012/03/01/nosql-data-modeling-techniques/	victorbojica
27512631	13.617719	-5.576913	comment	3.0	10.5	1623745345	9.8312	You can still mandate a spec, and if everybody ends up picking SQLite to implement it, so what?		int_19h
27550414	13.433589	-5.828146	comment	3.0	15.0	1624024937	9.909307	For me, ORMs are a sign one isn’t comfortable reading and writing SQL.I think this happens because in so many projects, commercial and hobbyist, you write queries a few times and then forget about it....		andrewmcwatters
27568537	13.568005	-5.560941	comment	3.0	11.0	1624182160	9.842656	We use SQLite in-memory databases for executing 100% of our business logic these days.  Letting the business write all the rules in SQL is the biggest win of my career so far.Also, if you think SQLite...		bob1029
27590826	13.560926	-5.550218	story	3.0	7.0	1624365061	9.839686	Show HN: Convert data exports from various services to a single SQLite database	http://github.com/bionic/bionic	sevazhidkov
27719332	13.61224	-5.5829363	comment	3.0	11.0	1625286197	-4.485831	I’d love it if Dr Hipp created a client/server db. He could call it SQLMajor instead of SQLite :)		alberth
27731966	13.620149	-5.6013856	story	3.0	210.0	1625426567	9.884825	Writing a SQLite clone from scratch in C (2017)	https://cstack.github.io/db_tutorial/	rubyn00bie
35253024	13.456189	-5.415541	comment	3.0	15.5	1679435117	9.835818	It's really nice to see more content for MySQL/MariaDB still being made, since it feels like they are still good solutions for a whole variety of situations! While I might look in the direction of Pos...		KronisLV
35253318	13.499319	-5.3960266	comment	3.0	13.5	1679436499	9.809075	> While I might look in the direction of PostgreSQL for more advanced in-database processing, for most CRUD apps the aforementioned two are going to be more than enoughI see this sentiment often here ...		hu3
35259259	13.475177	-5.3962345	comment	3.0	11.0	1679482471	9.791656	PG community had a similar patch, which got reverted from PG 15 on the last minute: https://www.depesz.com/2022/04/06/waiting-for-postgresql-15-...		onderkalaci
35284687	13.479227	-5.488742	comment	3.0	12.0	1679628129	9.743639	I wonder how hard it is to download the whole database from this source. Would be cool if they released a straight sqlite file or something to do analysis.		gleenn
35321166	13.429536	-5.8190465	comment	3.0	11.0	1679875660	9.922541	> Writing SQL is not that hard, and mapping the results to a type isn’t that hard either.But... Then you've written an ORM.		zzzeek
35344730	13.450404	-5.132298	comment	3.0	11.0	1680024582	9.75953	Serverless environments are a matter of fact. They exist, they are super convenient, and people want to use Postgres in them. This is a bridge for such people. Yes, it requires some sophisticated engineering, but it also enables to have less boilerplate code for a lot of people.		nikita
35357930	13.474444	-5.134157	story	3.0	24.0	1680100671	9.756303	Scaling serverless Postgres: How we implement autoscaling	https://neon.tech/blog/postgres-autoscaling	nikita
35415346	13.512073	-5.515188	comment	3.0	11.0	1680470350	9.668749	Decided to run this with NodeJS (on Linux) for mandatory Web Scale:100k inserts using `better-sqlite3` (difference: it does use prepared statements), all single-threaded with the same pragmas.- 8.6k i...		klabb3
35415383	13.594352	-5.5558295	comment	3.0	10.5	1680470642	9.786599	"The schema:    CREATE TABLE IF NOT EXISTS users (
        id BLOB PRIMARY KEY NOT NULL,
        created_at TEXT NOT NULL,
        username TEXT NOT NULL
    );


The data:    let user = User {
       ..."		VWWHFSfQ
35477059	13.452528	-5.265558	comment	3.0	16.0	1680832091	9.716551	One thing I notice is the over-usage of sharding, especially hash-based, might turn your Relational Database into just another key-value store, with consistency constraints moving into application code, and you lose many advantages of a traditional RDBMS		dikei
35454460	13.604968	-5.5818005	story	3.0	3.0	1680703574	-11.040956	An up-to-date list of SQLite related news from all over the World	https://sqlite.news	marcobambini
35507875	13.469765	-5.3805447	comment	3.0	14.5	1681086940	9.780122	Feature request that would make me consider moving off of pgbouncer: make prepared statements work in transaction pooling mode.We've found that we can double our throughput by using prepared statement...		phamilton
22331188	13.44939	-5.393327	story	3.0	75.0	1581720380	9.774277	Designing the most performant row-level security schema in Postgres (2018)	https://medium.com/@cazzer/designing-the-most-performant-row-level-security-strategy-in-postgres-a06084f31945	dfee
22367850	13.6226425	-5.608504	comment	3.0	14.0	1582133957	9.866488	Is it simple, though? I mean, reading about how they test it[1] leads me to believe it is not simple. Maybe it's simple compared to Oracle, and maybe using it is simple, but the actual implementation is definitely not simple.[1] https://www.sqlite.org/testing.html		umvi
22368542	13.540737	-5.4643555	comment	3.0	13.0	1582137472	9.8052025	We used SQLite at my company to allow users to write SQL queries against their db. When we hit the limit of it, we had to switch to Postgres. That migration is quite difficult and I wish we had used Postgres from the start. 20/20 hindsight but that was my first thought.		joshdance
22414543	13.555807	-5.4214497	comment	3.0	10.5	1582648484	9.856921	Interesting. I'm familiar with the meta as it relates to gaming (I follow SC2 pretty closely, though I basically never play anymore). I am curious to explore what the meta is as it relates to building...		mangoman
22426431	13.607673	-5.251484	comment	3.0	16.0	1582745764	9.762266	CouchDB is awesome, full stop.While it's missing some popularity from MongoDB and having wide adoption of things like mongoose in lots of open source CMS-type projects, it wins for the (i believe) uni...		splatcollision
22617654	13.4580965	-5.42838	story	3.0	27.0	1584545174	9.80192	Explanation of PostgreSQL PgAdmin Interface	https://www.yogeshchauhan.com/164/postgres/explanation-of-postgresql-pgadmin-interface	yogiUSA
15125735	13.584083	-5.422173	comment	3.0	11.0	1504026120	9.822823	I have a Node server that restarts once a day. On start it reads the state of the app (which is just one big JSON) from MongoDB into a JavaScript variable. When something changes it updates the variab...		Kiro
15127007	13.556286	-5.347558	comment	3.0	12.0	1504035538	9.862445	Here's my personal version of the story:With SQL DBs (Oracle, SQLServer and MySQL):1. SQL database migrations where killing us. Going back and forward in a dev environment was impossible. No hot deplo...		rgo
15127058	13.609131	-5.4104023	comment	3.0	15.5	1504035967	9.948546	I agree that Postgres trumps Mongo for most use cases, but if ORM is the answer, you might be asking the wrong question.I love that Fowler discusses[1] how to avoid ORMs and offers only two possibilit...		macintux
15127212	13.537763	-5.405974	comment	3.0	10.5	1504037285	9.793755	> 2. Understood what NoSQL meant and forgot about joins altogether.How would you represent a simple invoicing system in MongoDB (e.g. Customers + Products + Orders + OrderLineItems )? NoSQL-for-everyt...		DaiPlusPlus
15171018	13.658072	-5.66488	comment	3.0	10.5	1504561140	9.834037	Isn't SQLite an application calling for a clean implementation in Rust?		std_throwaway
15183191	13.513353	-5.168285	comment	3.0	10.5	1504702307	9.743578	"Riak builds on theoretical foundation, laid out in Amazon's Dynamo paper. The other NoSQLs did not have this theoretical underpinning, and so they just offer a ""best effort""."		cies
