id	x	y	type	relevance	size	year	umap1d	hovertext	url	author
33700898	13.989407	-5.2090945	comment	5.0	12.5	1669082863	-13.645051	> Something I don't understand: how are UUIDs not safe given that they are probably better than 99.9999% of passwords generated by users?UUIDs are 128 bits. Which is beat by a 5 character a-z random s...		nordsieck
33721847	13.4545	-5.194147	story	5.0	7.0	1669223685	-6.9459906	Ask HN: How to deal with multi-tenant SaaS database structure?		shahinghasemi
33742781	13.656661	-5.646013	comment	5.0	17.0	1669387357	9.831396	SQLite doesn't have hardware drivers (that IIRC are still majority of kernel bugs) that need actual hardware to test (as hardware mocks are at best mildly useful, coz real hardware can be... weird)And...		ilyt
33742685	13.6441345	-5.6188297	comment	5.0	22.0	1669386747	9.868903	Isn't SQLite a counterexample? They have more code that has tests than their actually running code. https://www.sqlite.org/testing.html		zitterbewegung
33803420	13.9407015	-5.2120523	comment	5.0	12.5	1669826891	-13.647856	How do you get more than 86,400 unique “identifiers” when they only change every second?		jagged-chisel
33897716	13.5425005	-5.482096	comment	5.0	14.0	1670436047	9.815164	I'd like to avoid writing boilerplate CRUD code. Is there an equivalent of PostgREST but for SQLite? Essentially, a standard binary would read the schema metadata, and generate standard CRUD APIs: htt...		nileshtrivedi
33909616	13.435198	-5.1547832	story	5.0	69.0	1670516337	9.740499	Edge-compatible Serverless Driver for Postgres	https://neon.tech/blog/serverless-driver-for-postgres/	carlsverre
33944271	13.621297	-5.585024	story	5.0	129.0	1670774400	9.822654	Richard Hipp Speaks Out on SQLite (2019) [pdf]	https://sigmodrecord.org/publications/sigmodRecord/1906/pdfs/06_Profiles_Hipp.pdf	pncnmnp
33945919	13.554893	-5.529249	comment	5.0	16.0	1670783617	9.779958	I've been trying to use SQLite3 in an embedded (ESP32 -- dual core 240MHz w/ qspi NOR flash) project and the performance has been surprisingly bad. Seems like the minimum amount of time to make a quer...		johnboiles
33984884	13.466681	-5.268774	comment	5.0	18.0	1671032039	9.766413	hey HN, supabase ceo hereIn case it's not clear - MFA is Multi Factor Authentication, and this one is for you, the developer, to use within your own appsThe neat thing about this one is that it flows ...		kiwicopple
34032990	13.586883	-5.5560117	story	5.0	244.0	1671316532	9.853471	SQLite internals: How the most-used database works	https://www.compileralchemy.com/books/sqlite-internals/	cube2222
35310141	13.430129	-5.195445	comment	5.0	16.5	1679798029	9.726693	I really don't want another database. I just want to have a solution built in for Postgres, and more specifically, RDS, which we use. I know there will be some extra difficulty that I will have to man...		dandiep
35320162	13.437045	-5.8403716	comment	5.0	22.5	1679868590	9.929565	This is why I always advocated against ORMs.  It’s so easy to fall into traps like this without even knowing it, and while you can work around it in some ORMs it is not obvious.Writing SQL is not that...		binarymax
35376688	13.461206	-5.4090676	comment	5.0	14.0	1680199270	9.809365	What's the best resource for the equivalent of this page but for Postgres?		SeanA208
35400711	13.500758	-5.1615586	comment	5.0	16.0	1680360481	9.649093	Your post made me read this: https://www.cockroachlabs.com/blog/living-without-atomic-clo... on how spanner and cockroadDB do this. And the answes are surprisingly simple, but with consequences attach...		ketzu
35478130	13.45946	-5.159688	comment	5.0	13.0	1680842805	-7.1482453	And the best sharding? Doing multi-tenant.Sharding at table level is very complex and expensive. Fully give a single DB per tenant is very practical, and the reasons to do sharding (like reporting) is...		mamcx
28057851	13.429552	-5.7984185	comment	5.0	16.0	1628058343	9.901173	I used to love ORM, I used it everywhere.  Writing another language in the language I am coding is wrong.  ORM simplifies my programs.No, ORM does not simplify coding!  It's a big complex adapter whic...		frogcoder
28076982	13.443632	-5.253092	comment	5.0	14.0	1628185147	9.900213	Noob question: Can you have time-series tables and regular Postgres tables in the same database? Is this distinction something that you decide on when you create a table?		oconnor663
28077164	13.499766	-5.435558	comment	5.0	21.5	1628185983	9.849524	> For a start, Postgres is simply an incredibly powerful, robust, and reliable piece of software, providing the best implementation of SQL.Why is it better than MySQL? This article wasted my time. Is ...		flowerlad
28157435	13.55789	-5.5159087	comment	5.0	15.0	1628781603	9.8464365	I'm going to build a business that offers SQLite as a web service. It will be backed by a P2P network of browser instances storing data in IndexedDB. Taking investment now.		leros
28157545	13.529041	-5.5335813	comment	5.0	26.0	1628782133	9.80536	The excuse was that a standard needs to have multiple implementations otherwise we are standardising implementation details and bugs.Hindsight shows that was entirely correct, as SQLite bugs were then...		daleharvey
28159037	13.507248	-5.4237757	comment	5.0	13.5	1628789237	9.819413	What gives you the confidence that it's going on circles? I cannot see our industry repeating the mantra that NoSQL solves all our persistence problems ever again. There are use cases for them, but no...		411111111111111
28182051	13.584226	-5.5540066	story	5.0	38.0	1628959522	9.796886	Show HN: SQLite-S3-query – Python function to query a SQLite database on S3	https://github.com/michalc/sqlite-s3-query	michalc
28341281	13.4985485	-5.3737736	comment	5.0	16.5	1630183040	1.5763059	For society as a whole I see negative utility in time wasted. Not all history is important to keep alive. You don't see people firing up coal fire steam engines in their back yard.For the individual t...		morpheos137
28346349	13.446162	-5.3236985	story	5.0	42.0	1630242127	9.7993145	PG_DBMS_JOB – PostgreSQL extension for Oracle DBMS_JOB compatibility	https://www.migops.com/blog/2021/08/27/announcing-pg_dbms_job-in-postgresql-for-oracle-dbms_job-compatibility/	avi_vallarapu
28430852	13.4537325	-5.2258987	comment	5.0	21.0	1630908137	9.730794	Lots of people are citing cutting-edge bells and whistles for advanced query plans and data types, but after working at $BIGCO and seeing what exists there (and has existed for years), I get frustrate...		GeneralMayhem
28463950	13.435866	-5.848011	comment	5.0	14.0	1631140863	9.941822	> Why would someone author an ORM, painstakingly creating Go functions that just map to existing SQL features?The answer to this question lies in the assumption you make in this statement:> the one wh...		bitwize
28489340	13.448083	-5.483061	comment	5.0	20.5	1631333006	9.798155	I’m a huge fan of Postgres. This one is “user error”, but we still got bit pretty hard.A query plan changed, on a frequently-run query (~1k/sec) on a large table (~2B rows) without warning. Went from ...		scott113341
12544399	13.604088	-5.2170672	comment	5.0	13.5	1474416155	9.664151	I remember CouchDB when it was initially released, it was one of the most promising and innovative DB's around. It's a shame it didn't live up to the hype.		desireco42
12579265	13.586947	-5.538902	comment	5.0	14.0	1474864535	9.884052	The one thing missing from SQLite is stronger type casting...however, SQLite does have a solid, cross-platform GUI in DB Browser [0]. It's not as nice as Sequel Pro and some of the commercial clients ...		danso
12589758	13.540032	-5.154432	comment	5.0	22.0	1474986110	9.641664	Hi, former Apache CouchDB guy, former Cloudant employee, and former Realm employee here… I (still) love CouchDB but at the end of the day I think its sync is a better fit for server-to-server or web c...		timanglade
12613797	13.519869	-5.440089	comment	5.0	14.0	1475256189	9.865769	I tried using and liking pgAdmin 4 beta for a few months. Even simple things like copy-paste from clipboard using Cmd-C/V, exporting/importing data to/from my local machine, etc were a hassle. Add to ...		sinatra
12623887	13.525893	-5.434631	comment	5.0	13.0	1475437573	9.819429	In my experience, most people who used MySQL simply hadn't heard of PostgreSQL (which isn't hard to install either and probably performed well enough for everybody's requirements - at least everybody ...		forinti
12650748	13.456702	-5.1867847	comment	5.0	14.5	1475738165	-6.891364	The articles mentions the approach to have one schema per tenant but sadly does not mention this again afterwards.Are there serious issues with this approach I am not aware of?		davidroetzel
12652798	13.621492	-5.313705	comment	5.0	18.0	1475764737	9.851568	"Please dont make excuses for their failure. ""Developer experience"" and ""performance"" are never reasons for failure. What does lead to failure is- lack of mass adoption - they didnt solve a problem eve..."		formula1
12922515	13.458251	-5.482284	comment	5.0	15.0	1478799972	9.8803	Complete list of new features in MySQL 5.7 [0] (in bullet form) would show scores of performance improvements.  The performance improvements from 5.5 to 5.6 were significant and 5.7 is much much better.[0] http://www.thecompletelistoffeatures.com/		0xmohit
12983852	13.668283	-5.291846	comment	5.0	18.5	1479436383	-12.815254	> RethinkDB is something we were looking at for a large projectFrom the comments in HN it feels like this was always the case for RethinkDB; folks looking at it, admire it, thinking about using it in ...		kinkdr
13033565	13.474745	-5.177859	comment	5.0	20.0	1480031829	9.667525	Cassandra is a piece of shit. Negative that comment how you wants, this never change the initial info. I used that BS on a startup on data science on the crawling info level and was on the worst experiences with db I had. CASSANDRA IS JUST PAIN.		lerax
13033555	13.472757	-5.1819186	comment	5.0	30.0	1480031684	9.674714	As a long time Cassandra user its easy to forget that some of Cassandra's semantics will be surprising to new users. That being said, if you are considering adopting an AP database it really is import...		helper
13072039	13.476461	-5.3947005	story	5.0	43.0	1480523337	-11.105278	Show HN: ToroDB Stampede: Automagical MongoDB to PostgreSQL, 100x Faster Queries	https://www.torodb.com/stampede/	ahachete
13102437	13.5617285	-5.2028565	comment	5.0	13.5	1480895488	9.664803	Is the project sponsored by Couchbase? If not, have you thought about publishing a storage API that the replication protocol calls so that it could be adapted to work with any backend db? What about P2P sync - (eg. serverless) has anyone thought of making PouchDB do that?		grizzles
13103026	13.575266	-5.20708	comment	5.0	14.5	1480905435	9.6722145	We've been running PouchDB in production for ~15 months now. We chose it because it was a greenfield project and it gave us 2 things: Easy offline support and real-time syncing that makes it easy to c...		ojanik
13102198	13.523001	-5.2308435	comment	5.0	21.5	1480891760	9.680797	I've been using PouchDB in a React Native app for about 6 months with SQLite as its backing store so that we can use more than 50MB of storage on the device. It has been working pretty well to persist...		PaulMest
13102546	13.635551	-5.1871705	comment	5.0	15.0	1480896986	1.2429113	Did you also consider Couchbase Lite? I'd be interested in your decision making.		m_mueller
13185076	13.666143	-5.328802	story	5.0	36.0	1481814790	9.911281	MongoDB will not prevent NoSQL injections in your Node.js app	https://blog.sqreen.io/mongodb-will-not-prevent-nosql-injections-in-your-node-js-app/?utm_content=buffer25729&utm_medium=social&utm_source=twitter.com&utm_campaign=buffer	ecares
13346481	13.713398	-5.2403364	comment	5.0	21.0	1483821568	9.888197	Absolutely ridiculous that MongoDB is this insecure by default.		tkyjonathan
13374932	13.742761	-5.2341857	comment	5.0	15.0	1484151177	9.915067	In production deployments, unsecured remote connections might be fine, because security would be handled at the network layer (e.g. by deploying MongoDB on a VLAN which only was accessible by your MongoDB clients which were on separate servers).		richardwhiuk
13433934	13.686796	-5.2844357	story	5.0	58.0	1484812334	-12.805446	RethinkDB: why we failed	http://www.defstartup.org/2017/01/18/why-rethinkdb-failed.html	kiyanwang
13440306	13.475551	-5.1961355	comment	5.0	14.5	1484867129	9.696399	It is fascinating that more and more people are using Cassandra. DataStax believes they have fixed problems with prior guarantees claims that were exposed by Jepsen. But there has been no official Jep...		flyingramen
13452574	13.447258	-5.3052006	comment	5.0	33.0	1485039734	9.793897	> I would spend a lot of labour on Postgres to avoid Oracle again.The best time to start was years ago. The second best time to start is today.		toomuchtodo
13569303	13.551519	-5.5614853	comment	5.0	14.0	1486245121	9.816714	Don't use sqlite for that. Or any other application specific format that only one application can read.There is no application that has a 30 years lifespan. Expect to already have massive issues in 10...		user5994461
13580195	13.691164	-5.314629	comment	5.0	18.0	1486394525	9.896712	You never heard of anybody using MongoDB?		SamReidHughes
13590837	13.687742	-5.3092346	comment	5.0	16.0	1486487840	9.9341545	MongoDB receives a fair amount of criticism here but the company is a fantastic place to work. I'm proud that I was able to learn and grow as a developer alongside all of those who have been trying (a...		tbrock
13609541	13.515798	-5.40535	story	5.0	119.0	1486665491	-13.117504	PostgreSQL 9.6.2, 9.5.6, 9.4.11, 9.3.16 and 9.2.20 released	https://www.postgresql.org/about/news/1733/	willlll
27542524	13.658166	-5.325269	comment	5.0	17.0	1623953130	9.866629	Do you have any opinions on ArangoDB or Dgraph? My new tech lead is talking about switching from MongoDB to one of those.		feu
27551570	13.693437	-5.4173884	comment	5.0	21.5	1624031171	-13.576561	It's rare in practice but occasionally rows have natural unique identifiers that are useable.The textbook case would be student IDs in a university database where each row corresponds to a single stud...		turbocon
27614263	13.700789	-5.228504	comment	5.0	25.0	1624512550	-9.589675	Glad someone else highlighted this old ticket.I bet this, in combination with the extremely irresponsible solution to ship mongodb without auth as default has caused countless of data leaks and destru...		gnyman
27665254	13.563577	-5.453354	comment	5.0	18.5	1624903294	9.761459	I'm building an open source Anki clone, and lemme tell you shit's surprisingly hard. Getting syncing working without resorting to uploading entire SQLite databases is nontrivial. You're basically doin...		dharmaturtle
27760073	13.474026	-5.424437	story	5.0	77.0	1625659180	9.819579	Dbcritic: Constructively criticizing your Postgres schema (using Idris)	https://www.channable.com/tech/dbcritic-constructively-criticizing-your-postgres-schema	rkrzr
27873246	13.507025	-5.4751544	comment	5.0	13.0	1626618741	9.756491	I am also interested in writing the SQLite or PostgreSQL file format straight to disk as a faster way to do ETL. I'd be curious to hear if anyone has actually tried this. I'd be as curious if you end up trying this too.		eatonphil
27876027	13.641106	-5.622998	comment	5.0	12.5	1626637734	-3.3401258	"> battletestedIs software that is always evolving battletested ? A new version could break something.I'm aware that sqlite has one of the best test suite in all of open source, I just wonder if something that was ""battletested"" is still battletested after a new release."		simlevesque
27897924	13.617862	-5.571668	comment	5.0	14.0	1626808381	9.832103	No idea what's with the sqlite articles making the front page every other day. This one is pretty old as well.  The measurements in this article were made during the week of 2017-06-05 using a version of SQLite in between 3.19.2 and 3.20.0.		xxs
27909580	13.545955	-5.419801	comment	5.0	15.0	1626889838	9.8722105	"SQL relies on joins. Joins are fine for reasonably sized databases, but on internet scale joins have miserable performance. ""Document"" based databases such as Mongo are designed to avoid joins.MongoDB..."		flowerlad
12113930	13.475778	-5.3259845	comment	5.0	17.0	1468832522	9.780453	One missing point Is the scalability. Postgres is awesome until you need to setup a db cluster.		eljulio
12135925	13.635256	-5.308663	comment	5.0	12.5	1469097333	9.918081	I was skeptical too, but the guy has 500,000 users on a $100/mo server. It's not even up for debate anymore, Node.js is fast and scalable. You might not like MongoDB, but it also works.		nathan_f77
12166836	13.437001	-5.3637567	comment	5.0	15.5	1469551033	9.8595295	Facebook maintains it's own fork [0] of MySQL.  A couple of interesting talks are also available: MySQL at Facebook, Current and Future [1] and Massively Distributed Backup at Facebook Scale [2].[0] h...		0xmohit
12201636	13.449422	-5.439794	comment	5.0	17.0	1470051927	9.866734	"but have you used MySQL? 
Maybe I am too nitpicky, but I always get suspicious when people make claims about technology whose name they cannot spell right."		rimantas
12201542	13.475149	-5.415486	comment	5.0	39.0	1470050551	9.821138	The PoststgreSQL project never fails to impress me. I know that there are some use cases which are not currently covered by it versus alternatives, but I have consistently got the feeling that everybo...		matthewmacleod
12204791	13.440848	-5.3290014	comment	5.0	15.0	1470076660	9.797957	So much work where there are many other solutions out there that don't have that limitation : PostgreSQL, several NoSQL databases...		pinaraf
12233263	13.597327	-5.5685077	comment	5.0	14.0	1470412460	9.841814	Don't you think that teaching how to use it with mysql or postegres would be more useful than sqlite?		bezzi
12235646	13.479417	-5.1520534	comment	5.0	14.0	1470430047	9.7843075	Ditto. If Google offered an equivalent of RDS PostgreSQL, I'd switch tomorrow.		matrix
12254581	13.468112	-5.41333	comment	5.0	15.5	1470751923	9.789538	"To all the upvoters, did you actually read the linked slides or are you just upvoting because it has ""PostgreSQL"" in the name[1]? Interesting to see this many votes with zero comments.It is a great se..."		koolba
12273361	13.49044	-5.385018	comment	5.0	13.0	1470975317	9.814757	Who do people feel the need to mention Postgres on every post talking about MySQL... It reminds me the same problem with Linux and *BSD.		Thaxll
12324815	13.483269	-5.3802214	comment	5.0	16.0	1471659922	9.787583	Dear Google, pretty please add some Postgres support		samhamilton
12352831	13.460268	-5.404092	story	5.0	124.0	1472053371	9.78391	Practical Guide to PostgreSQL Optimizations	https://tech.lendinghome.com/practical-guide-to-postgresql-optimizations-d7b9c2ad6a22#.d4s9e879m	omarish
12391547	13.483554	-5.279585	comment	5.0	16.5	1472574519	9.731541	> A dedicated, virtual server that runs your postgres version in replica mode. It continuously receives changes from your primary database server, becoming an off-site backup.This isn't an offsite bac...		koolba
12391586	13.473835	-5.344001	comment	5.0	14.5	1472574845	9.814257	We might add proxy-over-ssh/vlan options later on, but it would be incompatible with the 2-clicks-and-your-done interface right now.As far as I know, postgres authentication is rather simple and expos...		EmielMols
12482169	13.442376	-5.3867874	comment	5.0	16.0	1473703991	9.867486	Product Manager for the MySQL Server here.  Happy to answer questions!		morgo
12529508	13.472986	-5.425659	comment	5.0	16.0	1474268412	9.783583	The benefit: typically near infinite scalability with little loss of performance. It's super fast even when there's a lot of it.The cost: transactions, relations. These are actually incredibly valuabl...		mabbo
12534568	13.684249	-5.203071	story	5.0	43.0	1474318197	10.02381	How to Run CockroachDB on a Raspberry Pi	https://www.cockroachlabs.com/blog/run-cockroachdb-on-a-raspberry-pi/	orangechairs
22376647	13.681857	-5.1299	comment	5.0	18.0	1582219119	-13.006992	I did not follow every step, but assuming Oracle win this, will it also apply to Amazon proposing DocumentDB with the same API that MongoDB ?		seren
22426412	13.597896	-5.20888	comment	5.0	17.5	1582745629	9.678953	Reducing max document size from 4GB down to 8MB seems hyper-restrictive.For those interested, looks like the guts of CouchDB are going to be swapped out for FoundationDB.https://blog.couchdb.org/2020/02/26/the-road-to-couchdb-3-0-...		hajile
22469779	13.438631	-5.175984	story	5.0	3.0	1583188405	9.76479	Ask HN: Is there a NoSQL database with SQL-like queries?		riwasabi
22507500	13.634146	-5.3356066	comment	5.0	14.0	1583530281	9.914642	I know these kinds of tutorials are just for getting a flavor of a framework or paradigm. Nice so see it.As someone who's used Mongo for nearly a decade, I always feel compelled to note: Mongo will NO...		ruffrey
22768359	13.434646	-5.4644513	comment	5.0	13.5	1585915846	9.774445	While I do love PostgreSQL (and PostGIS which is excellent at transforming, indexing and querying geographic content) - I feel like MSSQL should get a bit of a shout-out in relation to your comment on...		jka
22838130	13.500586	-5.36755	story	5.0	169.0	1586558713	9.772113	Introduction to Hacking PostgreSQL (2007)	http://www.neilconway.org/talks/hacking/	mulander
22991269	13.477456	-5.412791	comment	5.0	14.5	1587943778	9.8079815	So I looked at these, I didn't notice any examples where the problem was with ANSI SQL? Please let me know if there were.It seems like the problems were with PostgreSQL flavored queries.Speaking of which - I know Microsoft has Transact-SQL and Oracle has PL/SQL, is PostgreSQL just PostgreSQL?		csours
23191439	13.69891	-5.3122425	story	5.0	159.0	1589546304	9.913735	Jepsen: MongoDB 4.2.6	http://jepsen.io/analyses/mongodb-4.2.6	aphyr
23270912	13.623758	-5.376052	comment	5.0	26.0	1590146884	9.88783	No. Every time I've used mongodb we've ended up regretting it for one reason or another. And migrating to a different database after launch is a huge hassle.I've done a couple projects where we kicked...		josephg
23272137	13.69946	-5.310415	comment	5.0	13.0	1590156134	9.909327	All of these replies are for Mongo's product 5+ years ago. MongoDB has changed A LOT since then. Has anyone used MongoDB IN THE PAST 2 YEARS?		randtrain34
23282561	13.54141	-5.4743137	comment	5.0	18.0	1590238830	9.78051	For our B2B application, we've been using SQLite as the exclusive means for reading and writing important bytes to/from disk for over 3 years now.We still have not encountered a scenario that has caus...		bob1029
23285994	13.471399	-5.498386	comment	5.0	12.5	1590264929	9.806178	> Why not use PostgreSQL instead? It supports a JSON document data type natively.Yes, that's the thing, it's just a field type. It's not really that different than dumping your JSON in a TEXT column. ...		hartator
23286635	13.479713	-5.3563204	comment	5.0	26.0	1590269251	9.818124	This might be a stupid question, but surely no one thinks of RabbigMQ as a database right?  I’ve used it from 2012 to 2018 extensively, including using things like shovels to build hub spoke topologies, however not once did I think of it as anything but a message broker.Did I miss something huge?		ceocoder
23287412	13.689025	-5.3174386	comment	5.0	26.0	1590275152	6.2810464	I was floored by this comment yesterday from one of their Developer Relations people:> Did any of you actually read the article? We are passing the Jepsen test suite and it was back in 2017 already. S...		kyllo
23321132	13.452607	-5.3170114	comment	5.0	15.5	1590572172	9.742881	"See my comments on Auth here: https://news.ycombinator.com/item?id=23320443> We want to nail the auth and we're looking at leveraging Postgres' native Row Level Security. This is a tricky task to ""gen..."		kiwicopple
23357406	13.607226	-5.3289285	story	5.0	3.0	1590799649	9.884427	Stack Overflow Research: MongoDB Is the Database Most Wanted by Developers	https://www.mongodb.com/blog/post/stack-overflow-research-most-wanted-database	krnaveen14
26709368	13.48379	-5.396122	comment	5.0	18.5	1617696908	9.820623	I will add one minor point to this list:The name.To this day I am convinced that the Hazapard UpperCASE usage is what has granted us:- A database called PostgreSQL- A library called libpostgres- An ap...		otikik
26710542	13.445912	-5.481907	comment	5.0	20.0	1617708215	9.824708	My single biggest beef about PG is the lack of query planner hints.Unplanned query plan changes as data distribution shifts can and does cause queries to perform orders of magnitude worse. Queries tha...		barrkel
26737833	13.518035	-5.3712025	story	5.0	127.0	1617884653	9.833068	NoSQL Data Modeling Techniques (2012)	https://highlyscalable.wordpress.com/2012/03/01/nosql-data-modeling-techniques/	agmm
26749737	13.624987	-5.653609	story	5.0	63.0	1617971746	9.810561	SQLRite – SQLite clone from scratch in Rust	https://github.com/joaoh82/rust_sqlite	ibraheemdev
26769383	13.699702	-5.3298516	comment	5.0	16.5	1618138787	9.896215	"""Tokutek claims to improve MongoDB performance 20x. It is unclear if this also means losing 20x as many documents.""ROFL."		toolslive
26782081	13.728018	-5.165553	comment	5.0	20.0	1618247630	9.977256	I have mixed feelings about this server side license stuff that mongo db started.  Imagine where the internet would be today if the creators of apache and mysql had tried to prevent shared hosting providers in the early days of the web from using their software		VWWHFSfQ
26793229	13.434331	-5.82598	comment	5.0	13.5	1618326540	9.9146595	> Or certain questions about complicated SQL queries (I use an ORM, rarely do I need to write a query by hand).This doesn't really seem unfair as ORMs stop working at a certain level. He seemed to have been targeting companies doing more complex things than he was previously doing.		MattGaiser
