id	x	y	type	relevance	size	year	umap1d	hovertext	url	author
12290761	13.476251	-5.3823104	comment	7.0	37.0	1471272370	9.8242445	On my personal projects, my default database choice is Postgres unless I have a glaring, obvious reason to choose something NoSQL (in which case I like CouchDB if the situation calls for a document st...		jcadam
18934040	13.650885	-5.3323174	comment	7.0	20.5	1547755212	9.89122	Anyone using this in production? Any thoughts or tips on how to adapt traditional MongoDB workflows to this?		gigatexal
19086626	13.4758005	-5.2962437	comment	7.0	21.0	1549383158	9.755703	Got this email just now.- - - -Hello,We’re contacting you about an ongoing outage with the Mandrill app. This email provides background on what happened and how users are affected, what we’re doing to...		GuyPostington
19126495	13.587641	-5.5512714	comment	7.0	51.5	1549776500	9.7918825	"Doesn't this affect all databases?  Or is it a different issue?https://www.sqlite.org/atomiccommit.htmlSQLite does a ""flush"" or ""fsync"" operation at key points. SQLite assumes that the flush or fsync ..."		chubot
19159116	13.646944	-5.318562	comment	7.0	22.0	1550110533	9.881097	This is a dead horse that's been beaten to death over and over again here on HN. MongoDB is garbage. MongoDB doesn't scale. MongoDB is $h!t says HN users.It just feels like an echo chamber. Are you ru...		nodesocket
19499601	13.63187	-5.371647	comment	7.0	20.0	1553683617	9.836305	"These ""caveats"" are mostly false, or outdated.> Loss of transactionsMongoDB 4.0 supports ACID transactions: https://www.mongodb.com/transactions> Loss of relational integrity (foreign keys)> Having a ..."		a13n
19578562	13.441751	-5.2879148	story	7.0	126.0	1554424882	9.746567	Pluggable Storage Committed in Postgres	https://www.postgresql.org/docs/devel/tableam.html	craigkerstiens
19869377	13.501495	-5.4134307	comment	7.0	38.5	1557417447	9.822259	"I maintain a couple of MySQL based applications. I don't really use any features outside of ""standard SQL"" is there a reason to switch over to Pg? I haven't used Pg before and usually default to MySQL."		eberkund
19871662	13.447533	-5.4590507	comment	7.0	63.0	1557431469	9.834088	I don't disagree that SQL can be improved. It's one of the biggest reasons I use Postgres in the first place because there are so many improvements available on top of SQL.All that said...SQL is prett...		brightball
15816596	13.429568	-5.2273226	story	7.0	21.0	1512056804	9.918506	Ask HN: Best time series database currently		mads
15855978	13.579974	-5.215343	story	7.0	78.0	1512507991	9.875928	“Follow-The-Workload” Beats the Latency-Survivability Tradeoff in CockroachDB	https://www.cockroachlabs.com/blog/follow-the-workload/	awoods187
15863940	13.503397	-5.3037868	comment	7.0	32.5	1512587398	9.76245	I’ve been involved in various Postgres roles (developer on it, consultant for it for BigCo, using it at my startup now) for around 18 years.I’ve never in that time seen a pacemaker/corosync/etc/etc co...		foobarbazetc
15949474	13.439331	-5.84029	comment	7.0	26.0	1513572002	9.943264	I think there are 3 main reasons ORMs came into common use:1. As a reaction to common SQL injection from poor libraries not implementing parameterized queries. (2004 or so)2. Novice engineers not want...		alexandercrohde
16298950	13.474098	-5.40928	story	7.0	96.0	1517684254	9.819187	Standard SQL features where PostgreSQL beats its competitors	https://www.slideshare.net/MarkusWinand/standard-sql-features-where-postgresql-beats-its-competitors	MarkusWinand
16358461	13.615292	-5.58148	comment	7.0	22.5	1518442812	9.879295	I find this page to be somewhat vague.  For example, any data that revolves around dates or time may require some addition hoops to jump through since, as https://www.sqlite.org/datatype3.html points ...		mwexler
16440755	13.6566925	-5.210144	story	7.0	133.0	1519328668	9.9476795	CockroachDB Interactive, D3-Powered Simulations	https://www.cockroachlabs.com/blog/database-evolution/	loiselleatwork
16585768	13.64818	-5.5883985	comment	7.0	27.5	1521043677	9.845811	C is great and SQLite seems doing amazing leveraging its power. Yet I bloody wish there were alternative (yet 100% compatible on the file format and SQL dialect levels) SQLite implementations native t...		qwerty456127
16586157	13.646064	-5.6228185	comment	7.0	22.5	1521046352	9.859389	I agree. SQLite gets away with using C because it literally uses military-grade levels of verification. As John Regehr pointed out, SQLite is quite possibly the only piece of software that goes to tha...		pcwalton
16618274	13.470487	-5.353011	comment	7.0	23.0	1521467116	9.774619	The short story of this is:- Gain access to the database itself- And the Postgres database should be vulnerable to various remote code execution- Once they're able to execute code remotely, they then ...		craigkerstiens
16755246	13.691457	-5.1850996	comment	7.0	17.5	1522853514	10.026906	I find it very interesting that although CockroachDB itself is stable and production ready, all of the client drivers are still 'beta'.https://www.cockroachlabs.com/docs/stable/install-client-dri...Th...		udia
16840220	13.454524	-5.4260883	story	7.0	447.0	1523749280	9.786097	My Favorite PostgreSQL Queries and Why They Matter	https://severalnines.com/blog/my-favorite-postgresql-queries-and-why-they-matter	grzm
16878825	13.50196	-5.4073305	comment	7.0	26.0	1524163570	9.856007	I feel the same way.  I've been using and tracking both since the mid to late 90s.I've always wondering why, in a world where PostgreSQL exists, would anyone use MySQL.  New releases seems to only sli...		ayan
17127220	13.431215	-5.307448	comment	7.0	21.5	1527006988	-11.357462	I still don’t understand what Oracle does better than Postgres. For free, it provides a cleaner data structure, DDL transactions, better performance, closer to SQL standards... Of course Oracle does sales better.		tajen
17130094	13.435547	-5.4086432	story	7.0	119.0	1527029446	9.779487	Are triggers really that slow in Postgres?	https://www.cybertec-postgresql.com/en/are-triggers-really-that-slow-in-postgres/	turrini
17187436	13.47387	-5.317847	story	7.0	203.0	1527686710	9.755819	Odyssey – Scalable PostgreSQL connection pooler	https://github.com/yandex/odyssey	pmwkaa
17414599	13.445953	-5.84006	comment	7.0	23.5	1530168353	9.961936	... Which begs the question: what good is an ORM if it does not prevent by design such issues? Here, we are essentially saying users of ORM must also have in their mind the SQL version. Or call an expert after the mess is done :/...		crocal
17497787	13.670378	-5.3220944	comment	7.0	35.0	1531228825	9.888125	My example is a bit dated, but may be illustrative:  I chose PostgreSQL over MongoDB for a MEAN webapp (making it PEAN?) project started in 2013 and regretted it.  I was constantly struggling with the...		kevinoid
17516583	13.634157	-5.6597414	comment	7.0	22.5	1531415281	9.864021	Richard Hipp (creator of SQLite) had this to say about Rust and SQLite in the comments:> Rewriting SQLite in Rust, or some other trendy “safe” language, would not help. In fact it might hurt.Prof. Reg...		collinf
17521277	13.497268	-5.454317	comment	7.0	32.0	1531469530	9.8301115	>I think NoSql, especially things like Mongo, got popular because it is super easy to program with javascript.I chose Mongo for a project recently. I have many years experience with SQL databases, and...		189723954
17855539	13.560504	-5.490322	comment	7.0	21.5	1535414526	-10.263237	I've seen this pattern a couple of times (e.g. for broadcasting changes using Postgres's LISTEN/NOTIFY.)Each time, I wonder why people are recreating the database's journal, within the database, where...		derefr
21032088	13.435359	-5.8282065	comment	7.0	29.5	1569019683	9.928679	Advocating for the use of SQL over an ORM in every case is like advocating for the use of Assembly over C in every case.In both cases, one is a higher level abstraction over the lower level capabiliti...		kbenson
21032554	13.430548	-5.836894	comment	7.0	34.0	1569024556	9.901609	Even more advanced programmer: writing the ‘boilerplate’ queries out manually takes barely more time than composing them in an ORM, means less indirection, saves me a major dependency, and encourages ...		sjwright
21040809	13.485443	-5.4201283	comment	7.0	20.5	1569151686	9.869138	The following isn’t the top reason I recommend Postgres, but is the reason I think least likely to be echoed in a dozen other comments:Postgres has some of the best documentation of any software produ...		nbouscal
21462674	13.70343	-5.196005	comment	7.0	20.0	1573049147	-9.077352	Most of the suggestions here is suggesting ways of restarting services when they go down, which is a good start, but that doesn't actually solve the issue I hit last night...My system integrates with ...		dkersten
21464272	13.469977	-5.3971324	story	7.0	169.0	1573058799	9.746007	Postgres Health Check and SQL Performance Analysis	https://gitlab.com/postgres-ai/postgres-checkup	torvald
21484970	13.464496	-5.553728	comment	7.0	17.5	1573236398	-7.7166724	>I haven't seen a Foreign Key smartly implemented in a LONG timeThis has also been my experience as a web developer mostly. I rarely see any applications that make use of foreign keys constraints supp...		lgl
21657725	13.464653	-5.4084296	story	7.0	243.0	1574952847	9.788854	Discovering less-known Postgres v12 features	https://www.cybertec-postgresql.com/en/discovering-less-known-postgresql-12-features/	samsk
21694831	13.484326	-5.2122335	comment	7.0	20.5	1575396315	9.703353	They could have offered a managed ScyllaDB service and saved themselves and their customers a lot of money while staying CQL / Cassandra compatible. Or what am I missing here?		heipei
39261459	13.972967	-5.220753	comment	7.0	42.0	1707142819	-13.668137	You probably should not use UUIDs to start with in your database at least not as an ID. UUIDv7 aims solve some of the issues of UUIDv4 that are even less suitable in for databases. 99% of times using BigInt for an ID is better.		sonium
39311231	13.485836	-5.539744	comment	7.0	36.5	1707451231	9.811073	There is a pg_hint_plan extension.  I think the danger with hints is that they might only be correct when written.  If the table sizes or data skew changes, they might make things worse.  I don't have...		davidrowley
18033239	13.499341	-5.402065	story	7.0	107.0	1537457913	-2.8088806	MariaDB acquires Clustrix	https://techcrunch.com/2018/09/20/mariadb-acquires-clusterix/	sahin-boydas
18297514	13.65404	-5.5949206	story	7.0	34.0	1540425418	-8.840696	SQLite Code of Ethics	https://sqlite.org/codeofethics.html	thrower123
18301602	13.743621	-5.1506844	comment	7.0	34.0	1540481081	9.945929	"I don't understand the line of reasoning. Can anyone give me a lay explanation?My understanding of the license change is basically ""if you use MongoDB to support any site, all software higher in the s..."		appleflaxen
18555464	13.716428	-5.1793933	comment	7.0	20.0	1543437751	-4.5741606	Someone should create a fork with work-safe name. CockroachDB brings connotation of cockroaches, who are known by eating almost everything and living almost everywhere.		anticensor
18804341	13.622924	-5.586005	story	7.0	157.0	1546406287	9.8895235	“The default name prefix is changed to be ‘sqlite’ spelled backwards” (2006)	https://github.com/endlesssoftware/sqlite3/blob/master/os.h#L133	sidcool
29740108	13.445144	-5.564446	comment	7.0	24.0	1640891102	-7.7138586	Please, no.  A common problem in data warehousing is that a design with lots of foreign keys becomes slow to load.  A standard solution is to move the checks for referential integrity elsewhere, then ...		btilly
29743102	13.450145	-5.575237	comment	7.0	23.5	1640908541	-7.723821	This is not actually compatible with SQL semantics.An important constraint on SQL is that a query must run, and produce correct results, relying only on the structure and content of tables. Indexes (c...		slotrans
29806345	13.94119	-5.2021804	comment	7.0	30.0	1641369542	-13.643692	I really liked this article but I feel it misses one somewhat important point about using incremental numbers: They are trivially guessable and one needs to be very cautious when exposing them to the ...		elevader
29850167	13.921495	-5.2375364	comment	7.0	28.5	1641635923	-13.647889	Bad for performance as primary keys.But, still provide strong value as a unique identifier which is what makes them popular.I’ve used integers as primary keys, with UUIDs as alternate keys for external-to-the-data-store queries.		drenei
30268989	13.488779	-5.3203	comment	7.0	20.5	1644382385	9.81086	Sharding and failover support is really cool indeed!But I've always struggled to understand the use cases of pgbouncer. In most cases, you want to front your database with a service and don't want man...		potamic
30631477	13.63485	-5.5927873	story	7.0	118.0	1646941410	9.857064	SQLite Online	https://sqliteonline.com/	belter
33236780	13.441118	-5.498373	story	7.0	145.0	1666027349	9.764316	Postgres 15 Merge Command with Examples	https://www.crunchydata.com/blog/a-look-at-postgres-15-merge-command-with-examples	winslett
33275945	13.607765	-5.391788	comment	7.0	21.0	1666278710	9.832614	Why are people still using Mongo when you can just set up a jsonb column in Postgres now?Is this just legacy applications that are stuck with Mongo? Certainly nobody is starting new projects on Mongo?Serious question.		cpursley
33330179	13.672862	-5.61639	comment	7.0	48.0	1666704446	9.858542	"Great work!!!""SQLite is extensively tested with 100% branch test coverage. We discovered this vulnerability despite the tests, which raises the question: how did the tests miss it?""Tests only validate..."		gregors
33339634	13.607762	-5.5973835	story	7.0	117.0	1666756585	9.871138	Making a change to SQLite source code	https://brunocalza.me/making-a-change-to-sqlite-source-code/	jerryjerryjerry
33696837	13.625433	-5.590118	story	7.0	76.0	1669059251	9.8638735	SQLite 3.40.0 with WASM Support	https://sqlite.org/releaselog/3_40_0.html	conductor
33699631	13.984329	-5.2122884	comment	7.0	21.5	1669073085	-13.664183	My only wish is that UUIDs were sortable and still contained their timestamp. When bug hunting, sometimes things become a little more obvious when there is an exact start and end to ids with issues.		hn_user2
33808473	13.446204	-5.2462425	comment	7.0	34.0	1669845759	9.771261	> You can spin up a Postgres database, or a whole cluster, with just a couple of commands. Sign up for Fly.io and launch a full-stack app in minutes!What is the HackerNews opinion on: who is their act...		MuffinFlavored
33934613	13.512682	-5.3635197	comment	7.0	20.0	1670693841	9.811272	Just use the right tool for the job at hand. If it’s Postgres for now, sure. There’s really nothing more to this. Period.But saying this would not make for a blog post. I can’t help but categorize thi...		posharma
33946715	13.57318	-5.522547	comment	7.0	19.5	1670787765	9.841202	“Heavier” and “lightweight” are such abstract terms in software.If “heavier” just means more LoC — sure, there’s more complexity in more LoC but also more problems solved. There’s a reason people tend...		eduction
33946597	13.650123	-5.605273	comment	7.0	31.0	1670787052	9.888646	Lots of people saying that SQLite is super high quality and finding a bug is so rare. It’s not. I found one on a simple query utilising WHERE EXISTS [1]. Reporting it to a weird forum was also a horri...		orf
26551825	13.634835	-5.5752544	comment	7.0	21.5	1616481987	-8.772557	Care to elaborate? I felt strongly the opposite. It makes me more eager to move away from SQLite. I'm very far from religious, and this seems to be very strongly suggesting atheism is synonymous with immorality.		pcthrowaway
26581197	13.601746	-5.5458097	comment	7.0	31.0	1616684949	9.796541	SQLite is very limited because of its threading model, imo it's not usable outside of the single app model where you have a single user.https://sqlite.org/threadsafe.htmlhttps://sqlite.org/lockingv3.html		Thaxll
26582756	13.588818	-5.5307136	comment	7.0	27.0	1616692167	-10.523162	"So if you're saying everything does support a web database... then what's the reason people aren't using it for websites?Why do you say it works for ""small"" websites but presumably not large ones? If ..."		crazygringo
26675664	13.488622	-5.354158	comment	7.0	25.0	1617395600	9.774705	>By default, PostgreSQL listens on a TCP port 5432.This post seems to outright state that by default postgres is listening to everyone via TCP for connection.This is not true.Unless you edit pg_ident....		throwaway13337
26857490	13.988771	-5.211	comment	7.0	20.0	1618788042	-13.666495	I just use a UUID for every variable name to make sure the codebase never has any ambiguity.No one is going to confuse e7693160-b5cf-4761-9202-de019cfd0fc9 with c3d8b9ac-d0da-4bbc-912b-025ce4e47f62		ineedasername
26918288	13.556436	-5.5675755	comment	7.0	22.5	1619206251	9.829825	> Existing formats like MBTiles are based on SQLite. This limits the ability to self-host maps to those confident running a server in production.Is that comical, or is there a deeper meaning I don't understand?		Tomte
27095459	13.435269	-5.6006565	comment	7.0	23.5	1620563680	-4.7126136	"SQL is commonly pronounced as ""sequel"" or ""S-Q-L"". Is one really more correct at this point?"		7thaccount
27237919	13.573748	-5.4844384	story	7.0	83.0	1621621482	9.808052	SQLite in production with WAL	https://victoria.dev/blog/sqlite-in-production-with-wal/	manjana
27248960	13.602144	-5.576746	story	7.0	73.0	1621707322	9.853407	Show HN: ClangQL – Query C++ codebases using SQLite	https://github.com/frabert/ClangQL	frabert
27324704	13.65878	-5.3859286	story	7.0	65.0	1622289811	9.823604	Show HN: Monty, Mongo tinified. MongoDB implemented in Python	https://github.com/davidlatwe/montydb	davidlatwe
27346837	13.932824	-5.213527	comment	7.0	26.5	1622485513	-13.648993	"I don't think I've ever seen this mentioned anywhere, but if
you need a unique ID for an entity with not a lot of records
planned (≤10,000,000), why not use a random int64 with
a simple for loop on th..."		ainar-g
27348761	13.850206	-5.2976203	comment	7.0	24.0	1622500117	-13.627558	> Now, sometimes a table has a natural primary key, for example the social security number of a country’s citizens.You know, you think that, but it's never that simple. The field was added incorrectly...		3pt14159
27347045	13.966894	-5.21244	comment	7.0	25.0	1622487083	-13.650917	"Mentioned this in a sibling comment:There's another benefit to UUID - You can generate them anywhere including application side.
Doing this on application side would have tremendous batching benefits ..."		tehlike
37733890	13.95289	-5.215569	comment	7.0	23.0	1696219744	-13.642277	> first component (prefix) of the identifier is a sortable timestamp> values generated are practically sequentialThese statements aren’t strict enough to be relied on. Maybe you have engineered the he...		erik_seaberg
38120240	13.617554	-5.215852	story	7.0	52.0	1698959612	9.8739395	DoorDash manages high-availability CockroachDB clusters at scale	https://www.cockroachlabs.com/blog/doordash-cockroachdb-massive-scale/	orangechairs
38171986	13.582508	-5.5392823	comment	7.0	19.0	1699320877	9.802879	"What do they mean by ""Since SQLite does not support concurrent transactions"" - it supports them, as long as you don't access the .db file through a file share (UNC, or NFS, etc) - https://www.sqlite.o..."		malkia
38285435	13.599753	-5.605652	comment	7.0	18.0	1700103721	9.860392	EDIT: It looks like something that mostly addresses my problem, “strict tables”, was added in 2021. Thank you everyone.It seems this rewrite would not have addressed my biggest gripe with SQLite: Surp...		anyfoo
38540616	13.453489	-5.6049366	comment	7.0	22.0	1701838735	9.706681	Hm I googled and found this draft of the encoding - https://sqlite.org/draft/jsonb.htmlIt feels like it would be better to use a known binary encoding.  I thought the MessagePack data model correspond...		chubot
15028063	13.513206	-5.3953643	comment	7.0	22.0	1502896302	9.852114	Is it an universally accepted truth now that it's generally better to use Postgres then to use MySql?Would anybody here use MySql for a new project? If so, why?		TekMol
15164733	13.500508	-5.4021587	comment	7.0	20.0	1504484068	9.836214	MySQL. Still more popular than Postgres.		evantahler
15186337	13.5336075	-5.0971518	comment	7.0	29.5	1504725408	9.875308	> Traditionally, databases have been used as the source of truth ... [but] can be difficult to manage in the long run. First, it’s often tricky to change the schema of a database. Adding and removing ...		toomim
15336007	13.464489	-5.430403	comment	7.0	28.0	1506398237	9.810898	I don't think the article could have said it much better.SQL is super powerful and makes much sense in so many ways. Nearly all apps have a relational structure to them and SQL is a reasonable way to ...		craigkerstiens
15367003	13.473775	-5.267207	story	7.0	97.0	1506704557	9.7596855	Distributed algorithms in NoSQL databases	https://highlyscalable.wordpress.com/2012/09/18/distributed-algorithms-in-nosql-databases	otoolep
15479040	13.5004425	-5.3349133	comment	7.0	24.5	1508098343	9.819138	I remember ages ago (a decade? or so?) I started working at a company using Postgres for a project, and one of the things my boss asked me to do was to set up replication for the database. We had it o...		danudey
15608586	13.581008	-5.577261	comment	7.0	35.0	1509609123	9.818847	> sqlite files couldn't be more openYes, actually they could. They could be readable without any software at all. Like XML.All of the improvements suggested in the article could be implemented by extending the XML format to allow including by other XML files by reference.		mseebach
15714829	13.458247	-5.1984096	story	7.0	110.0	1510855024	9.787492	Citus Cloud 2, Postgres, and Scaling Without Compromise	https://www.citusdata.com/blog/2017/11/16/citus-cloud-2-postgres-and-scale-without-compromise/	bgentry
12489936	13.44162	-5.330803	comment	7.0	25.0	1473784820	9.879833	So having read through the slides, these are not bad slides, but I'm missing the 'real' wow-factor of why Postgres was a better choice in the end than Oracle. There's no doubt that the rewrite (which,...		niftich
35247541	13.4571085	-5.372777	comment	7.0	22.5	1679412238	9.84657	Cool! Now we need this for Postgres.		whitepoplar
35249259	13.493966	-5.3735723	story	7.0	37.0	1679418863	9.776771	Ask HN: Postgres experts, how did you start your career?		labarilem
35318905	13.566388	-5.5721483	comment	7.0	20.5	1679860838	9.884756	I wrote a similar tool in Python a few weeks ago, which uses AppleScript to liberate the data and saves it to a SQLite database: https://datasette.io/tools/apple-notes-to-sqliteI didn't actually know ...		simonw
28017279	13.55756	-5.5472794	comment	7.0	19.0	1627732257	9.85835	I can’t fully put my finger on why exactly, but I feel that this is a transformative idea. What’s to stop me from emulating a private SQLite DB for every user of a web app, and use that instead of GraphQL?		manmal
28076572	13.577031	-5.5318813	comment	7.0	24.0	1628183490	9.846336	I'm always amazed at the amazing reviews SQLite gets, particularly in a thread about PostgreSQL. I get the angle of SQLite competing with fopen(). If what you need is a file format you can do a lot wo...		pedrocr
28078127	13.46832	-5.3893924	comment	7.0	20.5	1628190559	9.846602	> all of its competitors are essentially obsoleteFor most companies I've worked at I've used either SQL Server or Oracle and from what I've seen when looking at job posts recently the demand is only i...		__app_dev__
28092737	13.977923	-5.213349	comment	7.0	27.0	1628283929	-13.66983	>> but the downside is that there's no standard way to parse the time from one of theseIMHO that should not be a concern. The goal of UUID is to create a Unique Identifier, not to record the time some...		phkahler
28331769	13.573461	-5.523216	comment	7.0	28.0	1630091177	9.800501	"As a developer, I have to say that sqlite gives me the best experience.Everything else pales in comparison.Create a database?    sqlite3 mydata.db

Where is the database?    In the current directory

..."		TekMol
28425809	13.551902	-5.2462378	comment	7.0	42.0	1630861602	9.808522	CockroachDB is getting a lot of interest these days.It has broad PGSQL language (and also wire I think) compatibility yet has a clustered peer architecture well suited to running in a dynamic environm...		grobbie
28659076	13.48696	-5.398274	story	7.0	133.0	1632641238	9.730014	Pgloader: A High-Speed PostgreSQL Swiss Army Knife, Written in Lisp	https://pgloader.io/	kesor
22369011	13.639895	-5.586303	comment	7.0	20.5	1582140063	9.856924	For all the great things about SQLite there are some concerning things around the project.First off, even though the source code is public domain, you can't contribute since it is closed source: https...		hharnisch
22834879	13.657546	-5.3918996	comment	7.0	31.0	1586537782	9.889038	While I think it's easy to poke fun at this article - relational database better at handling relational data, more at 10 - it does make me want to understand why one would choose mongo over postgres?		stepbeek
22868286	13.561997	-5.2680264	story	7.0	150.0	1586883213	9.817928	Apache Druid vs. Time-Series Databases	https://imply.io/post/apache-druid-vs-time-series-databases	wochiquan
23058070	13.574157	-5.335293	story	7.0	104.0	1588500691	9.843601	Show HN: AvionDB: A Decentralised Database with MongoDB-like Developer Interface	https://github.com/dappkit/aviondb	Alex-Potsides
23071438	13.481635	-5.365017	comment	7.0	17.5	1588616378	9.829194	How often do developers recompile postgresql? How often do developers go through the hassle of upgrading databases versions? Whatever postgresql may have done recently, it won't be used and available ...		user5994461
