id	x	y	type	relevance	size	year	umap1d	hovertext	url	author
35489192	13.564576	-5.534978	comment	4.0	21.5	1680915138	9.776895	It's a really neat project. I did some simple benchmarks of it and it was between 10% slower to twice as slow. Which depending on your use case isn't that bad!https://datastation.multiprocess.io/blog/2022-05-12-sqlite-i...		eatonphil
35490559	13.626174	-5.55889	comment	4.0	11.0	1680928364	9.857503	Why would you want to do this? SQLLITE is so stable. Why would you switch to some port that will be dead in a year?		tetete
35499689	13.431874	-5.358077	comment	4.0	12.0	1681008783	9.817799	There is just so much, I've thought of writing some blog post about it but there is already a lot of content out there because pg is a big community with a lot of people doing interesting things and I...		KrugerDunnings
28017640	13.588252	-5.5436935	comment	4.0	11.0	1627735678	9.84554	Yeah but a key value system lacks all the really good things about SQL. And locally with sqlite you don't really have to worry about latency, so you should be able to just get atomicity and consistenc...		noduerme
28041918	13.437264	-5.4809494	comment	4.0	14.5	1627934757	9.763679	Just about when I was leaving [financial-service company] our team was considering that the Postgres query planner was a significant source of risk, and contemplating mitigations and alternatives.We'd...		fennecfoxen
28044562	13.692855	-5.311868	comment	4.0	10.5	1627951900	9.905854	I thought the fact that mongodb data files were essentially mmapped was used as a critique against its durability as a primary database. Is that not true?Or was that not a relevant critique?		atonse
28068897	13.62643	-5.6152687	comment	4.0	11.5	1628128869	9.846983	Basically, if it doesn't look like an INT, it won't be coerced into it.The edge case I hit was when it did look like an integer, but had leading zeroes that were important:    sqlite> create table exa...		banana_giraffe
28072134	13.592022	-5.615203	comment	4.0	11.0	1628161864	9.855116	> I mean, you can still use it, but you have to do your own type checking/coercion in codeCan you explain why you wouldn't have to check what you're putting into the database? If you're just stuffing ...		clnhlzmn
28076036	13.572372	-5.5353193	comment	4.0	12.5	1628181307	9.81714	SQLite is an exceptional piece of software as well…It’s lightweight, reliable, knows what it’s tasked for, does exactly wat it does, and easy to extend. I personally reach SQLite first in so many case...		pcr910303
28076595	13.502559	-5.425764	comment	4.0	13.0	1628183576	9.882959	How does it compare to MariaDB?		beermonster
28077434	13.507644	-5.4265738	comment	4.0	11.5	1628187214	9.81408	Could anyone recommend a good and current book on Postgres?		bogomipz
28080351	13.483738	-5.3689137	comment	4.0	12.5	1628199882	9.897973	I want to use PostgreSQL, because there seems to be a lot of technical discussion around why it's so great, but the tooling I have available to me seems to be immature compared to MySQL's.And so, I fi...		andrewmcwatters
28086022	13.532982	-5.5219774	comment	4.0	10.5	1628251827	-12.181237	I'm curious, why postgres.app and not SQLite? I'd usually reach for SQLite as my next step up from Excel, but maybe that's wrong (it's very possible that you're talking about an order of magnitude more data than I am).		easton
28090597	13.9747	-5.2285395	comment	4.0	10.5	1628272149	-13.684313	"> implementations MAY dedicate a portion
   of the node's most significant random bits to a pseudo-random
   machineID which helps identify UUIDs created by a given node.  This
   works to add an extr..."		fhrow4484
28091332	13.985444	-5.2116833	comment	4.0	10.5	1628275657	11.400676	Uuids are bulky if you store them in text form, but in binary form they are only 128 bits.The main feature of a uuid is it allows distributed generation.  32-bit or 64-bit integers are almost always s...		NyxWulf
28157208	13.4667845	-5.444686	comment	4.0	15.0	1628780645	9.785601	What's kind of bonkers here is that IndexedDB uses sqlite as its backend. So, this is sqlite (WASM) -> IndexedDB -> sqlite (native).The Internet is a wild place...		timdorr
28259975	13.604914	-5.6014547	comment	4.0	12.0	1629575348	9.864328	This is nice. Very nice. But to be honest, having used SQLite in many hobby/toy projects for ~15 years, I have never ever encountered a type error with it. Stricter handling of types is a good idea, I...		krylon
28260479	13.580898	-5.532791	comment	4.0	16.5	1629579185	9.844725	Honestly in that case you should just use Postgres locally. SQLite was never meant to be a stand-in for a true RDBMS. As they say, it's intended to be a replacement for fopen(). The fact that it works for local development is a fluke.		zarzavat
28279392	13.615623	-5.6674004	comment	4.0	19.5	1629740558	9.87806	How is Rust in regards to the SQLite's requirements now?		juice_bus
28279520	13.637575	-5.6191583	comment	4.0	25.5	1629741164	-6.6222277	I suppose that a version of SQLite written in a safe(r) language will eventually appear, and hopefully become popular.But it will take a long time to mature. SQLite the project cannot switch languages...		nine_k
28282638	13.976503	-5.216186	comment	4.0	11.5	1629756675	-13.667023	Personally, I dislike UUIDs that encode timestamps. They embed information in identifiers that look opaque, and can therefore accidentally communicate information about the history of an object that i...		jasonhansel
28294360	13.458606	-5.4240813	comment	4.0	12.5	1629836068	9.78912	I'd first reach for Postgres to do this.  Anyone have any idea how Postgres would stack up in a similar challenge?		andrewstuart
28294571	13.455204	-5.1762433	comment	4.0	17.5	1629836937	9.693538	We took a big bet on Cassandra, and then on an opinionated wrapper around Cassandra at $PASTJOB. The use case was a text search engine for syslog-type stuff.The product we built using Cassandra was wi...		legerdemain
28404561	13.671608	-5.314357	comment	4.0	14.5	1630678798	9.890276	This is the way.My previous company had a HUGE problem with Devs cowboying off and doing whatever and dumping it on the Ops team at the last minute.One of the biggest (but for damn sure not the last) ...		generalk
28425762	13.469067	-5.417455	comment	4.0	12.0	1630861286	9.845811	"Does your data model change often?
PostgreSQL and MySQL well be very difficult to make fundamental changes. If you need to make changes to your data model, the structure of relational databases will m..."		tdhz77
28427656	13.488985	-5.4042172	comment	4.0	15.0	1630875053	9.836218	This title kind of implies that PG or MySQL aren't modern or modern enough which i think is is very wrong. Look what they bring in every update. I think they are quite modern!		masa331
28488908	13.456215	-5.2949867	comment	4.0	13.0	1631326501	9.815552	"It's not a limitation that affects most of users, but lack of official multi master support makes it less suitable for ""always on"" databases. But to be honest multi master is something hard to get right in ANY database. PostgreSQL is great for many use cases and good enough for many more!"		jfbaro
28490433	13.436933	-5.4708295	comment	4.0	13.0	1631350123	9.806784	I'm currently having a similar issue where the query planner refuses to use the indexes on a search query (was fine for w hile, but one day it just started de-optimizing itself). Instead just does a s...		citrons
22315682	13.689356	-5.330944	comment	4.0	12.0	1581574523	9.895056	The mongoDB comment rings true at least from the pastNever heard of the OS mentioned		anon102010
22325039	13.552568	-5.5048795	comment	4.0	14.0	1581670718	9.830267	I still remember interbase, now called firebird. Of course, sqlite is much more prominent today for an embeded database, but for the times without sqlite...		altmind
22367763	13.440958	-5.547041	comment	4.0	18.5	1582133574	9.805981	MySQL is the same way.  A lot of people say My-sequel but I think its supposed to be my-ess-que-ell		larrydag
22367961	13.461433	-5.415722	comment	4.0	13.0	1582134483	-4.7991734	"PostgreSQL is the fun one out because they officially say it is Postgres-Q-L.The ""it's always S-Q-L and never `sequel`"" is IBM's fault and an early trademark infringement issue in computing. (IBM was told it couldn't call it ""SEQUEL"" by an aircraft company.)"		WorldMaker
22368741	13.440691	-5.827393	comment	4.0	12.5	1582138504	9.944723	Were you using an ORM?  I ask because most people use database switching as a selling point for using an ORM. I'm rather indifferent on the matter, but I'm curious.		throwaway55554
22369285	13.599137	-5.567117	comment	4.0	11.0	1582141614	9.846194	"SQL is a standard, but SQLite doesn't implement ""standard SQL"", it implements ""SQLite SQL"".For better or worse, the web has always been driven by specifications, rather than implementations. Properly ..."		Carpetsmoker
22369190	13.567229	-5.5582857	comment	4.0	13.5	1582141128	9.77355	One thing that I wish more people realized, especially ones developing native apps, is this: unless you really need an specific file format for your application, don't design your own. Just use SQLite. You get so much out of it (including features like undo), as well as a huge toolkit.		outworlder
22383264	13.431185	-5.637465	comment	4.0	13.5	1582294936	9.802868	One thing this leaves out is the danger of concurrency issues, which can sometimes be worsened by using an ORM. Writing correct, race-free SQL can be very hard (with READ COMMITTED transactions) or re...		jasonhansel
22426582	13.639838	-5.2494435	comment	4.0	13.0	1582746573	9.718201	MongoDB has _suspiciously_ amazing SEO and marketing. CouchDB's by contrast is awful.As silly as that sounds as a reason to choose CouchDB it demonstrates where the respective company's priorities lie.		Quarrelsome
22622637	13.4681	-5.357835	comment	4.0	10.5	1584574510	9.767421	Separate DB user per application user makes connection pooling difficult. And PostgreSQL has more costly connections		paulryanrogers
22734973	13.601035	-5.5707445	comment	4.0	12.0	1585629568	-11.823568	"> Dolt is the only database with branchesThere's also litetree, whose slogan is simply ""SQLite with branches"":https://github.com/aergoio/litetree"		samatman
22757507	13.695777	-5.3003826	comment	4.0	16.5	1585821239	9.906291	The moral of the story is once again that focusing on user acquisition at all costs is an effective strategy. MongoDB disregarded reliability, Youtube disregarded copyright, Reddit faked comments, Fac...		fvdessen
22766993	13.479096	-5.2498155	comment	4.0	13.0	1585898967	9.718754	Having worked with dozens of different databases over lots of years, I can certainly say that Postgres is my go-to _default_ database over all the other relational ones.In the same way that Golang cla...		endymi0n
22767336	13.490378	-5.374872	comment	4.0	13.5	1585903337	9.841982	The main reason I use MySQL over Postgres is storage engines.  MySQL has storage engines with transparent compression, which allow me to keep an order of magnitude more data than using Postgres.  Thes...		willvarfar
18927894	13.504402	-5.38675	comment	4.0	12.5	1547693386	9.82969	I lead our database team for a while, and picked ArangoDB. We started to regret it pretty soon thereafter. While I was there, we found that our cluster would just die. I think they got put fix in for ...		roflc0ptic
18951886	13.432467	-5.3199835	comment	4.0	11.0	1547972225	-11.338384	This is the thing I love about PostgreSQL, you can find out everything about the database. Oracle is ridiculous - they have something of the range of over a thousand hidden parameters, query tuning th...		chris_wot
18964104	13.472194	-5.425152	comment	4.0	11.0	1548108655	9.82172	I actually think the most important thing you can do is learn SQL and specifically how to make things fast/clever enough with just Postgres.Topics include different joins, relationship types, full text search, indexing, JSONB, amongst many others!		andy_ppp
18990718	13.482847	-5.399256	comment	4.0	18.5	1548350742	9.80006	Microsoft is hedging their bets. PostgreSQL has the potential to disrupt the traditional relational database market, so if they're going to be disrupted then better to do it themselves.I expect they'll also try to port Citus Data functionality to the SQL Server platform.		nradov
19048028	13.519162	-5.4246244	comment	4.0	10.5	1548963742	9.811207	I still haven't seen a great reason to go NoSQL over, say, Postgres.  I'll think about a good application but then realize that it'll be a PITA to do something slightly different than what I first imagined.What are good reasons to use NoSQL over SQL?		SnacksOnAPlane
19083228	13.483048	-5.3600593	comment	4.0	13.0	1549345417	-13.494179	The author talks a bit about the architecture of PostgreSQL transactions, touching on lazy transaction ID consumption and vacuuming. Notably, writes require IDs but reads do not. So this is focused on...		throwawaymath
18975640	13.712347	-5.175878	story	4.0	15.0	1548217046	9.86223	MongoDB vs. Amazon DocumentDB: MongoDB CTO Breaks It Down	https://www.mongodb.com/blog/post/documents-are-everywhere	saranshk
18992607	13.572577	-5.2157683	story	4.0	119.0	1548361864	9.886858	CockroachDB's Consistency Model	https://www.cockroachlabs.com/blog/consistency-model/	dilloc
19146733	13.467305	-5.308168	comment	4.0	11.5	1550000259	9.796016	"My experience may shed some light on this:
 I use pgdump to make backups of an important PostgreSQL server and I thought I was done. Then the server died. I then used the standard import... but it fai..."		benjohnson
19159060	13.706271	-5.3043203	comment	4.0	15.5	1550109804	9.901658	Wow was MongoDB really that bad?		Bucephalus355
19159080	13.594698	-5.376022	comment	4.0	42.0	1550110072	9.871051	MongoDB by default is (was? It’s been a while since I’ve used it) schemaless, which means all of your data validation must take place in your app instead of the database. Your data integrity is then only as good as your weakest validation.Edit: scheme/schema autocorrect typos corrected. Thanks!		toomuchtodo
19159291	13.510017	-5.425374	comment	4.0	18.0	1550113341	9.799656	My pet theory is that NoSQL took off purely because people were sick of having to manage schema changes.Unfortunately, people reacted to being (justifiably) frustrated with schemas by throwing strict schemas out entirely, instead of making better schema management/migration tools.		djrobstep
19159375	13.519519	-5.413585	comment	4.0	14.5	1550114758	9.842835	"First, most 'noSQL' DB's (including Mongo) have data validations anyhow, rendering the discussion almost moot."" RDBMS provides far more opportunity for validation""This can't be true. The application l..."		sonnyblarney
19248857	13.465433	-5.4077907	comment	4.0	11.5	1551124814	9.826106	I'd like to see this with PostgreSQL		paulryanrogers
19249948	13.472505	-5.350104	comment	4.0	12.0	1551132603	9.749067	"Frustratingly ""solutions"" like pgBouncer and similar do not properly maintain session state in transaction pooling mode and so commonly used features like prepared statements cannot be used, which is ..."		Diggsey
19310635	13.453922	-5.1066427	comment	4.0	14.0	1551795565	9.666968	"I recommend first reading bits of the Jepsen report, because the company blog paints quite a different picture.> We’re excited to report that FaunaDB has passed:
> Additionally, it offers the highest ..."		drej
19464662	13.459462	-5.4760346	comment	4.0	13.0	1553275180	9.787524	"You could have a look into RediSLQ (RediSLQ.com) which is a redis module that embed SQLite, giving crazy fast performance.It gives you a lot of interesting concepts like ""lightweight databases"" or pus..."		siscia
19499821	13.619468	-5.346555	comment	4.0	19.5	1553686382	9.867369	I’m a big fan of Mongo for the use case you described - searching by ID and all information in one document.But people don’t seem to understand that there are plenty of scenarios where you really eith...		scarface74
19498938	13.44021	-5.848922	comment	4.0	13.0	1553675099	9.971363	"The primary purpose of an ORM is to overcome the ""impedance mismatch"" between relational databases and programming language data structures. There's no need for an ORM if you can store your data structures directly in the database."		kijin
19411572	13.464938	-5.37722	story	4.0	34.0	1552785858	9.79421	Sharding Pinterest: How we scaled our MySQL fleet (2015)	https://medium.com/@Pinterest_Engineering/sharding-pinterest-how-we-scaled-our-mysql-fleet-3f341e96ca6f	pplonski86
19571913	13.485297	-5.392426	comment	4.0	13.5	1554383905	9.792866	I only read the title; but I'm expecting performance generally to be abysmal.I/O is quite poor on rPIs and that's what PostgreSQL needs more than anything. More than memory or CPU for sure.The best th...		dijit
19576541	13.457757	-5.2405906	comment	4.0	12.0	1554408425	9.765879	Yup, experiencing that at work quite a bit. People are currently arguing about big data solutions for a data set of 300Gb or so, growth in the area of 100ish Gb / year. I'm still arguing that this cou...		tetha
19578875	13.475201	-5.385605	comment	4.0	11.0	1554428274	9.802964	Is that a good thing?Instead of a single postgres this there will be a lot of subtle or very different variants, all needing completely different tuning, like it happened with MySQL. May well fragment the ecosystem significantly.		nn3
19589846	13.4313345	-5.8257318	comment	4.0	13.0	1554538912	9.904188	"Recently I tried using an ORM ""properly"" for a bigger application. I tried for days to fix the performance problems, which were mainly caused by serialization/deserialization overhead because of humon..."		thegeomaster
19590168	13.488035	-5.496078	comment	4.0	10.5	1554547562	9.819798	This talk didn't hook me, but then again, it looks like it's aimed at developers who jumped on the NoSQL bandwagon and now need to be told why SQL is clever.I feel that much of what we do with map, re...		ThJ
19738196	13.627464	-5.349209	comment	4.0	14.0	1556113338	9.873584	At some point I'll write up my notes about how I've been using MongoDB. I've basically given up on SQL databases. Every architecture, for every scale, from small to Enterprise, is really better handle...		lkrubner
19768178	13.457621	-5.4301543	comment	4.0	11.5	1556406221	9.81096	What I'd like is a postgres specific migration scheme that let me take advantage of a lot of cool (and unique) features postgres has without fighting with general purpose ORMs or having to manually edit migration files.		mythrwy
19826426	13.450671	-5.16146	comment	4.0	15.5	1556977916	9.884979	I have used TimescaleDB for several purposes. As it is built on top of Postgres, all the existing tools, libraries and processes work out of the box. This is a huge advantage if you are operating Post...		theomega
19746038	13.595238	-5.2648053	story	4.0	38.0	1556179771	9.842769	MongoDB to acquire open-source mobile database Realm for $39M	https://techcrunch.com/2019/04/24/mongodb-to-acquire-open-source-mobile-database-realm-startup-that-raised-40m/	febeling
19851480	13.441259	-5.831872	comment	4.0	11.5	1557249781	9.9791975	All the time allegedly saved is also more than compensated for when the ORM makes bad queries that are roughly impossible to fix.		toast0
19869311	13.470676	-5.2435164	comment	4.0	11.5	1557416932	9.792814	Question for PG happy users.How do you manage failover and replication? At my previous job this was done by a consultant. Is this doable on a self hosted setup?Thank you in advance.		rooam-dev
19869505	13.461581	-5.451036	comment	4.0	15.5	1557418199	9.826576	At my PHP-shop company, most projects are limited to MySQL 5.7 (legacy reason, dependency reason, boss-likes-MySQL reason...). They are all handicapped by MySQL featureset, and can't update to 8 yet. ...		kangoo1707
19871706	13.461888	-5.417689	comment	4.0	26.0	1557431648	9.835444	> I use Postgres in the first place because there are so many improvements available on top of SQL.Most of Postgres is standard SQL. It's just that most non-Postgres databases do not implement standard SQL very well.		tathougies
19879777	13.829795	-5.2514915	comment	4.0	15.0	1557507766	-13.661863	Pick a primary key (i.e., set of columns) for a table.  If you expose this outside the database in stable ways (e.g., in URIs), then do not permit changes to that table's rows' primary keys.There's NO...		cryptonector
15862300	13.551415	-5.551218	comment	4.0	12.5	1512577331	9.8489685	This seems as good of place as any to ask novice-level questions about PostgreSQL. I teach students SQLite and one of the most massive pain points in transitioning to PgSQL is how the latter, in the `...		danso
15862406	13.475009	-5.2619348	comment	4.0	12.0	1512577973	9.78553	I too am coming up on a need for no-downtime HA failover for Postgres. I too am not allowed to use a hosted PaaS-ish solution like RDS. I was considering Citus's multi master impl (I don't need to spr...		kodablah
15862637	13.609967	-5.596407	comment	4.0	10.5	1512579467	9.853	It's because the WHERE clause is evaluated before the SELECT. The reason that SQLite allows you to do that is because SQLite is much, much simpler than PgSQL, MySQL and SQL Server (all of which don't allow you to do this).http://tinman.cs.gsu.edu/~raj/sql/node22.html		hungerstrike
15863092	13.490771	-5.322261	comment	4.0	12.0	1512582251	9.81143	Having ran MySQL in prod for a decade and PostgreSQL in prod for half a decade I can say without doubt that your data team is telling fibs.Firstly we consider that there are multiple replication possi...		dijit
15864206	13.491498	-5.305294	comment	4.0	14.0	1512589129	9.803892	How does pgbouncer make this process easy? Just because there are less connections to go to the final DB? I've also got a random question you might be able to answer (having a hard time googling)... w...		morrbo
15898726	13.491341	-5.4423513	comment	4.0	14.0	1513014675	9.790748	Yeah, what a disappointment.In the early days of NoSql, a lot of dev were still shoehorning graphs, objects, or giant look up tables into SQL database, and yes, it turns out that there are some wonder...		geebee
15949373	13.431211	-5.83032	comment	4.0	15.0	1513570593	9.9307575	"Ah yes - the proverbial ""ORMs are bad, just learn SQL"" post. This is analogous to saying ""don't use frameworks"". Sound ridiculous? Yes, yes it is.The law of leaky abstractions applies to many, many th..."		misterbowfinger
16086558	13.439003	-5.1652594	comment	4.0	14.5	1515261946	9.796834	I'd argue that relevancy is more your application application's design then the underlying system retrieving the results. For example, putting the same dataset in Postgres or ES wouldn't make one deli...		agconti
16118689	13.633592	-5.612723	comment	4.0	11.5	1515615839	7.781851	Ok, I'm sceptical about the results. The reason is that there doesn't seem to be a massive difference between the tests. Since this fix is about speculative exec, why would it affect crypto code which...		viraptor
16194125	13.5014925	-5.134905	comment	4.0	13.5	1516468342	9.761173	Main developer of Keevo at Stream here and you ask a very good question. I've asked myself the same question quite a lot. And I think it actually warrants it own dedicated blog post at some point. To ...		JelteF
17872690	13.707525	-5.302484	comment	4.0	16.0	1535582286	9.932688	Another MongoDB misconfiguration, wow. How is it still so easy to configure mongo with no creds and an open port? Feels like these alone cause a large % of data leaks.If I was running a cloud platform...		uses
17891086	13.438506	-5.8672624	comment	4.0	11.5	1535794380	9.945691	It never made sense to me how popular ORMs were. The very first time I used one, I understood straight away that it was a bad idea and I never changed my mind about it (though I tried).Why is it that ...		cryptica
17951181	13.616249	-5.5789785	comment	4.0	14.5	1536581617	9.855949	Why not use SQLite directly instead of this extra layer?		bufferoverflow
17966070	13.631243	-5.6067634	comment	4.0	11.0	1536734493	9.854758	Surprisingly SQLite does actually embrace formal methods in various places.Such as, in their draft goals [0], under S30200, they outline a memory allocator goal by referring to a proof.Though, if the ...		shakna
18034456	13.437654	-5.3828216	comment	4.0	11.5	1537467545	-2.8117418	I was unfamiliar with Clustrix. It looks like they've been around a while (YC06) and have some sophisticated technology (http://docs.clustrix.com/display/CLXDOC/Distributed+Database...). A horizontally scalable drop in replacement for MySQL is nothing to sneeze at.https://www.clustrix.com/		sciurus
18044455	13.497242	-5.4003067	comment	4.0	28.0	1537590715	9.842415	What are some reasons I might consider Postgres over MySQL when choosing a DB platform?		deytempo
18045506	13.44497	-5.2112193	comment	4.0	12.0	1537614591	9.871245	Could you please elaborate how to use Postgres as a time series database (like InfluxDB)?		Avamander
18180367	13.629349	-5.3363466	comment	4.0	11.0	1539124110	9.849878	> why no run your own DB?Running your own DB introduces tons of risk that just isn't worth saving a couple bucks (until you're at the scale that it is).> That said, Mongo is a poor choice for any app ...		a13n
18229682	13.603066	-5.229099	comment	4.0	18.0	1539700493	9.889691	I had the feeling that AWS and Azure are pushing their own NoSQL solutions and don't care much about MongoDB.		k__
18229808	13.742695	-5.129125	comment	4.0	14.5	1539701389	-13.0012665	https://webassets.mongodb.com/_com_assets/legal/SSPL-compare...“Service Source Code” means the Corresponding Source for the Program or the modified version, and the Corresponding Source for all progra...		shadowmint
18229853	13.765477	-5.138949	comment	4.0	12.0	1539701648	9.973979	"The license is clearly based on (A)GPL which is copyrighted by FSF, and has the following notice: ""Everyone is permitted to copy and distribute verbatim copies of this license document, but changing i..."		zokier
