id	x	y	type	relevance	size	year	umap1d	hovertext	url	author
17744207	13.677744	-4.383395	comment	5.0	16.0	1534079556	-12.344676	What I don't like about Terraform is that the state of your resources is stored locally, which might lead to consistency problems depending on your setup. With CloudFormation state is handled by CloudFormation itself, so you can be confident that stack updates operate on the latest state.		Dunedan
18986090	13.44828	-4.980137	comment	5.0	14.5	1548305612	10.346849	> Kapacitor is the killer appUm. Yes. Wait, there are people that use influxdb _without_ kapacitor alerting??? Someone name any commercial or open source equivalent, b/c I'd like to know in case they kill it.		exabrial
19283028	13.47838	-4.809619	comment	5.0	70.5	1551460945	9.651407	"100M/year is ~8M/month. Some perspective on that, it could by you one of:~400PB of data in S3.~2600 bare metal ""x1 type"" ec2 instances running 24/7, 3 year upfront reservation.~60M Write IOPS in dynam..."		phamilton
19360195	13.494551	-4.4461894	comment	5.0	19.5	1552321533	-9.852135	This is a very surprising move from AWS. In the past they haven't seemed to be willing to contribute to the OSS that they pick up and host. Even though they claim they'll contribute changes upstream, ...		pauldix
19369758	13.459331	-4.3332925	comment	5.0	19.0	1552407421	-5.683558	It's interesting that the HN collective results seems to be complaining about the letter from either party.When Amazon wrote their letter, the [HN response](https://news.ycombinator.com/item?id=193639...		jrochkind1
19701191	13.451855	-4.894344	comment	5.0	14.5	1555693973	-10.015219	"> Where elasticsearch shines is in complex queries ...If the ""Multi-tenant indexing benchmark"" is accurate it seems like it might be a robustness concern for ES.  ""Elasticsearch crashed after 921 indi..."		wyldfire
19775718	13.458946	-4.8567495	comment	5.0	12.5	1556510185	-10.008821	I'm one of the people who'd definitely use an alternative to ElasticSearch! I hate the fact that elastic search is using Java. It just takes up too much memory.		blacksoil
37582752	13.523474	-4.2692084	comment	5.0	12.5	1695208194	9.403599	> 1 million a year buys a lot of development and operationalNot all that much.  At a global enterprise, for instance, that buys a couple senior systems engineers with SDLC experience after you include...		Terretta
37589657	13.430225	-4.216736	story	5.0	90.0	1695241340	8.720323	Angie – Drop-In Replacement for Nginx	https://github.com/webserver-llc/angie	IgorPartola
37647922	13.581517	-4.99899	comment	5.0	18.5	1695664540	-13.118061	The anti-pattern here isn't Kafka, it's using Kafka for 7,500 messages/day.  Making your whole system asynchronous for that level of load is the textbook definition of over-engineering.		davewritescode
37660457	13.479886	-5.0092506	story	5.0	10.0	1695740738	-13.075862	FastStream: Effortless Kafka/RabbitMQ Event Stream Integration for Microservices	https://faststream.airt.ai/0.1.5/	kumaranvpl
37669078	13.675936	-4.386213	story	5.0	74.0	1695781451	-12.165422	Why should I care about OpenTofu?	https://opentofu.org/blog/why-should-i-care-about-opentofu/	RyeCombinator
37678182	13.561076	-4.9922442	comment	5.0	14.0	1695836226	-13.082002	This is asking for a huge favor, but can anyone explain to me what Kafka does that RabbitMQ doesn't? Is it just scale?		throw1234651234
37943342	13.55033	-4.9316273	comment	5.0	16.5	1697725519	13.318485	> We do not recommend build Pulsar from source. Building from source is only necessary if you wish to make modifications. If you want to play with the source code check the Developers section of the d...		boilermen
37979488	13.553316	-5.0002346	comment	5.0	15.5	1698012084	-13.123593	Seems like overkill no? Otel collectors are fairly cheap, why add expensive Kafka into the mix. If you need to buffer why not just dump to s3 or similar data store as a temporary storage array.		bushbaba
37980118	13.566181	-4.9947143	comment	5.0	12.5	1698018583	-13.125841	I expect it would be far cheaper to scale up tempo/loki than it would be to even run an idle kafka cluster. This feels like spending thousands of dollars to save tens of dollars.		daurnimator
38071931	13.506047	-5.006008	comment	5.0	14.0	1698684254	-13.089516	I know of an engineer who built a work queue by having a chain from an app to kafka to a processor to Kafka to a database writer.Literally instead of a table.This stuff is everywhere. Microservices made it worse and half legitimized it.		foobiekr
38449524	13.465776	-4.515941	comment	5.0	14.0	1701197105	9.698873	I just noticed Q in the AWS docs and tried a few test questions, and was not impressed. It refused to answer or misunderstood some basic questions. Eventually I got it to answer how a few short SKs wo...		rurp
33117681	13.468215	-4.8467445	story	5.0	126.0	1665119643	-9.992214	Stateless – Evolving the architecture of Elasticsearch to simplify deployment	https://www.elastic.co/blog/stateless-your-new-state-of-find-with-elasticsearch	soheilpro
33316546	13.4555435	-4.830001	comment	5.0	19.0	1666619239	-9.935226	While I really like their lightweight, SQL-like protocol instead of Elasticsearch's fat JSON, I really think that this project could have much more impact if it could be a drop-in replacement for ES.E...		blacklight
33345735	13.452675	-5.021409	comment	5.0	12.5	1666800277	10.31106	Isn't InfluxDB rewriting their storage engine for the nth time? It makes me have a little less faith in their project to be honest.		_peter_
33664211	13.66277	-4.398834	story	5.0	10.0	1668813288	-13.478257	Ask HN: Does anyone use Terraform to deploy Kubernetes services in a large org?		sandspit
35499453	13.453053	-5.0223665	comment	5.0	13.5	1681005760	9.769365	"I'm surprised there isn't a ""serverless"" PostgreSQL. That seems like it would get more bank for buck then writing a cloud native DB from scratch.(Or maybe there is one but I don't know about it.)AWS made a serverless MySQL."		paulddraper
28111138	13.531293	-4.6376247	comment	5.0	18.0	1628465102	-9.929791	Can't Amazon just serve these bogus headers and keep opensearch compatible? It's not like headers are copyrighted...		catmanjan
28111249	13.527716	-4.54213	comment	5.0	13.0	1628466198	-9.886039	"Amazon could try that, but it wouldn't stop there. they'd end up in a constant arms race.also, that ""you know, for search"" tagline is featured on t-shirts sold by Elastic [0]. seems entirely plausible..."		evil-olive
28583774	13.669128	-4.3743734	comment	5.0	14.0	1632054322	-11.766298	Terraform can be frustratingly slow at times. You have to realize that at the end of the day, it's an abstraction layer on top of the public APIs of a cloud service. If all your services are hosted on...		picardo
28583914	13.62676	-4.351	comment	5.0	18.5	1632055674	-6.584419	An alternative opinion: When I worked at a large tech company, my team made a conscious decision to not use terraform. This gave us some key advantages- we are able to adopt new cloud features immedia...		dharmab
12601365	13.525451	-4.313259	comment	5.0	14.5	1475096687	-13.337301	>PS: How is your automated provisioning system reaching your cluster if not by SSH?Not sure about moondev, but Terraform + Cloud-init + Container Orchestrator means that I basically never need to SSH into my nodes, except in extreme/rare circumstances.		colemickens
12624074	13.453137	-4.873689	comment	5.0	12.5	1475440226	-9.968422	It's not that simple.If you're using a secondary data store like Elasticsearch presumably you're combining it with a traditional relational database like Postgres or MySQL. And in most use cases, you'...		r888888888
12955173	13.442832	-4.943311	comment	5.0	17.0	1479177348	9.760636	What's the performance of Amazon RDS like with Postgres? (Curious, never having used it).		thejosh
13002530	13.658597	-4.9645543	story	5.0	72.0	1479693983	10.552405	Kafka: An End or a Beginning?	https://lareviewofbooks.org/article/kafka-end-beginning/	lermontov
13093299	13.441662	-4.319209	story	5.0	14.0	1480722667	-5.835262	Did Amazon Just Kill Open Source?	http://iguaz.io/2016/12/02/did-amazon-just-kill-open-source/	ktamura
27541999	13.675456	-4.9583263	comment	5.0	16.5	1623950250	10.547523	Could be just me. I see Apache kafka more nightmarish than bureaucracy in 'The Castle' or Police/judiciary in 'The Trial' from author Franz Kafka. Mr Franz btw stole his last name from this very famous Apache Kafka project.		geodel
27653030	13.70799	-4.3835936	comment	5.0	20.5	1624812144	9.457681	Not sure why you’d ever do this instead of using terraform.		orf
27777719	13.70696	-4.385639	comment	5.0	15.5	1625779014	9.485994	You can (and always should) decouple the plan and apply steps. For a non terminal approach this can be done by outputting the binary plan to a plan file (with -out=path) and reviewing the plan termina...		aequitas
27818229	13.518068	-4.640677	comment	5.0	19.0	1626159129	-9.988394	OpenSearch is the AWS fork of ElasticSearch prior to the license change aimed at preventing AWS from copying Elastic IP without compensation.		politician
27820490	13.562797	-5.0033584	comment	5.0	24.0	1626181872	10.420393	Not just startups. I  interviewed with a large financial institution recently  and they had their heart set on Kafka. From what I learnt , they did not need Kafka -- the message order was not importan...		manishsharan
27974139	13.427974	-5.0509906	comment	5.0	20.5	1627402343	9.6768465	Hi, I started an Elasticsearch hosting company, since sold, and have built products on PG's search and SQLite FTS search.There are in my mind two reasons to not use PG's search.1. Elasticsearch allows...		fizx
12344858	13.463275	-5.000762	story	5.0	60.0	1471968709	10.444874	Announcing InfluxDB, Telegraf, Kapacitor and Enterprise 1.0 RC1	https://influxdata.com/blog/announcing-influxdb-telegraf-kapacitor-and-enterprise-1-0-rc1/	runesoerensen
22397654	13.523087	-4.7252836	comment	5.0	17.0	1582475044	-10.0042515	"Does it still have the issue of failing ""open to the world"" if the x-pack trial expires?  See: https://discuss.elastic.co/t/ransom-attack-on-elasticsearch-..."		tyingq
22824040	13.451306	-4.865674	story	5.0	4.0	1586449229	-9.990582	Ask HN: Perfect tooling for high-availability statistics?		vernondegoede1
22867591	13.692097	-4.394261	comment	5.0	13.0	1586880143	9.5105095	I've been looking at this for awhile and it's super cool! As a person who's used Terraform extensively and has ran into a lot of issues with it's declarative, non-scriptability (at least before 0.12),...		lycidas
22989841	13.457106	-4.362959	comment	5.0	24.0	1587932060	-5.800922	The third wave of open source software is no software at all. It is only a matter of time before Amazon doesn't care whether it's licensed Apache2 or not. They will just take software and sell it. You...		okram
23031859	13.486447	-5.0225215	comment	5.0	16.5	1588260227	9.641844	I understand the sentiment, but things are a bit different than they may look. About SSL, there is no way out of this. I opposed to this feature for a long time, but simply now because of changes in r...		antirez
23108782	13.706208	-4.3882337	story	5.0	59.0	1588888322	9.479264	Enhancing the Terraform Experience: Why We Use Terragrunt	https://transcend.io/blog/why-we-use-terragrunt	Sephr
23195617	13.5029745	-4.8735023	comment	5.0	15.0	1589567454	9.6874695	If you treat DynamoDB as a DBMS, you’re going to be disappointed (for the reasons you mention). But if you think of it as a highly-durable immediately-consistent btree in the cloud, it’s amazing. Dyna...		DVassallo
23209221	13.488705	-5.0832853	comment	5.0	13.0	1589684940	9.630033	"As a Kafka alternative, has anyone attempted to use PostgreSQL logical replication with table partitioning for
async service communication?Proof of concept (with diagrams in the comments):
https://gis..."		bonquesha99
23273179	13.449483	-5.057497	comment	5.0	15.0	1590161612	9.994441	Hi, I authored this post, but the credit really goes to the Timescale database team.Multi-node TimescaleDB is the result of a massive amount of engineering effort over two years, as can be seen in thi...		akulkarni
26648807	13.506153	-4.274204	story	5.0	20.0	1617205964	9.481938	AWS CloudFormation Best Practices	https://www.stackery.io/blog/aws-cloudformation-templates-best-practices	ryancoleman
26782169	13.49131	-4.6560206	comment	5.0	14.0	1618247926	-9.978862	What about the thing that is already named OpenSearch?		kizer
26782288	13.472142	-4.445965	comment	5.0	45.5	1618248377	-9.867362	One thing which surprised me: Elastic has a market capitalization of ~$11B.I think that changes some of the more floaty ethical concerns. This is not a David vs Goliath situation. This is Goliath vs S...		015a
26782748	13.43775	-4.2834344	comment	5.0	19.0	1618250374	-5.8151636	The absolute claim, aside from being at home in a rant on HN,  comes from a cursory glance at https://github.com/amzn, weighted by contributors and popularity, and compared to companies of similar siz...		TechBro8615
26813750	13.622553	-4.4328675	comment	5.0	21.5	1618438331	9.499936	If you like CDK, then i highly recommend pulumi		theopsguy
26814019	13.595149	-4.371227	comment	5.0	13.5	1618440152	-13.470335	Reading the sister comments, I kind of understand the appeal of terraform for huge/multi cloud infra systems.Now, managing changes in code doesn’t look too far from dealing with kubernetes’ json/yml c...		hrktb
26878727	13.452148	-4.910401	comment	5.0	23.0	1618942915	9.918465	(Timescale founder)We actually designed the Timescale License to be _less_ restrictive than AGPL. It contains no virality. It just prevents public clouds from offering TimescaleDB-aaS.		akulkarni
27027220	13.70158	-4.383901	story	5.0	106.0	1620059892	-13.069298	HashiCorp Nomad 1.1 Beta	https://www.hashicorp.com/blog/announcing-hashicorp-nomad-1-1-beta	edouardb
27051634	13.459657	-4.9148254	comment	5.0	25.0	1620230469	9.922264	TimescaleDB is a great product, but if you plan to go with them long term, there are few points to consider:* They are still trying to figure out their monetization strategy. Initially, they betted on...		Croftengea
27082086	13.674354	-4.3832917	comment	5.0	13.5	1620431031	-2.7628047	When is it actually desirable to imperatively program your cloud provider rather than using something like Terraform?Obviously there are services meant to be consumed from application code, but the infrastructure provisioning stuff?		closeparen
27433877	13.719965	-4.362452	story	5.0	54.0	1623153058	9.433062	Terraform v1.0 Is Out	https://www.terraform.io/docs/language/v1-compatibility-promises.html	weeha
27436182	13.6800165	-4.395834	comment	5.0	14.0	1623164890	9.495448	I recently had to do a piece of AWS work that required cross-account resources (create certificate in one account with ACM, set DNS entries on Route53 in another account).Not sure about pulumi, but AW...		borplk
27439356	13.68308	-4.394259	comment	5.0	12.5	1623178794	9.491886	The biggest issue with Pulumi is that Pulumi doesn't support adding custom API providers. Part of the power of Terraform is in provisioning infrastructure, orchestration, deployment, and application c...		solatic
15335911	13.436648	-4.9289765	comment	5.0	17.0	1506396495	9.695329	I had the task of replicating data from DynamoDB to Redshift on AWS on two large projects on the last few years. The primary factor in using DynamoDB is that is's cheap and scales like nothing else in...		ChicagoDave
15601879	13.566799	-5.0086813	comment	5.0	19.5	1509549086	-13.096806	At small scale just go with Kinesis. The base semantics are pretty much the same between the two, and Kafka is terribly complex to run. The hosted Kafka solutions are too expensive for small scale.Kinesis has a real auth story too, plus you can trigger Lambda functions off streams.		whopa
28681364	13.488476	-4.812651	comment	5.0	18.0	1632827002	-9.997372	What's worse (and I've seen this trend a lot) is to use Elasticsearch for metrics. My god.		denysvitali
28724519	13.501799	-5.0213385	comment	5.0	13.5	1633130626	-13.095239	https://kpow.io - we build kPow for Apache Kafka, a drop-in replacement for Confluent Control Center + much more.https://kpow.io/features- Multi-Cluster, Multi-Schema, Multi-Connect.- Multi-Tenancy, R...		d_t_w
28886814	13.691546	-4.3962083	story	5.0	41.0	1634379629	9.315353	TerraVision (1994)	http://www.joachimsauter.com/en/work/terravision.html	martyvis
28904105	13.574593	-4.997398	comment	5.0	15.0	1634554325	-13.073243	Very interested to hear how people here overcome the limits of kafka for ordered events delivery in real world, and what those were.		bsaul
29004130	13.440904	-4.599178	comment	5.0	15.0	1635272385	9.650961	Does CockroachDB Serverless expose an HTTP api? This sounds like a great fit for use with Cloudflare Workers, but that requires an http api.		rabaut
29094878	13.4356	-4.15134	comment	5.0	15.0	1635948890	8.770276	"Lots of choices in the this space...  - this tool (apache traffic server)
  - regular apache can proxy/cache/route
  - nginx
  - traefik
  - haproxy
  - envoy
  - kong
  - ...more

Then it also somewh..."		tyingq
29111588	13.687922	-4.374608	comment	5.0	24.0	1636054597	-12.775008	My thoughts not facts. I know that there are more products then I mention.I fail to see in what segment Hashicorp will remain relevant over time.Terraform is the tool I mostly see companies pay for. O...		AtNightWeCode
29235068	13.548871	-5.005388	comment	5.0	18.0	1637023376	-13.095725	Well to begin with, Java is not a serious programming language to do systems programming in, since it has poor control of networking, threads and memory.Then it's a message bus built on top of TCP. An...		mgaunard
29235486	13.541519	-4.9859056	comment	5.0	17.0	1637026204	-13.111221	It looks like Kafka is by far and away the way to handle persistent logs/events at scale. AFAIK a company here in Japan called LINE has all their messaging flowing through a large kafka cluster themse...		hardwaresofton
29359556	13.690473	-4.3872643	comment	5.0	13.5	1638014941	9.450241	I have never seen Terraform crash in the years I’ve been using it. Optimizing based on a lottery event seems counter-productiveEDIT: Alright guys, good points all around. Mainly what I meant is the ra...		klohto
29417496	13.694093	-4.3909183	comment	5.0	15.5	1638459741	-11.950066	I tried using Earthly, great product.Unfortunately, we rejected it at our organization due to how verbose the commands are. I want my users to be able to say `earthly plan-stage` for a terraform repo,...		honkycat
29421909	13.66586	-4.3997927	comment	5.0	14.5	1638476401	9.512022	I just started using CDK for a project, and after having fought with terraform and trying pulumi, I have to say CDK is a breath of fresh air. Really well thought out, makes doing things the right way ...		habitue
25454960	13.645987	-5.08723	comment	5.0	19.0	1608208055	9.90106	"(From the FAQs)
How does the change to the BSL affect me as a CockroachDB user?It likely does not. As a CockroachDB user, you can freely use CockroachDB or embed it in your applications (irrespective ..."		samblr
25589309	13.637951	-4.394345	comment	5.0	15.5	1609385600	9.559446	Personally I wouldn't deploy the lambda code with the terraform. They inherently have different life cycles. In an ideal scenario you deploy some dummy code with terraform (just a hello world). And as...		dastx
25591110	13.693929	-4.37783	comment	5.0	14.0	1609407179	9.544	The simplest HTTP API example is https://github.com/nsriram/lambda-the-terraform-way/tree/mas... is about 66 LOC of terraform. But wait, it uses lambda-role (12 LOC), lambda (27 LOC), api-gateway (47 ...		hendry
25778048	13.499214	-4.4287047	comment	5.0	31.0	1610640532	-9.826877	I can understand the motivation - AWS' approach, particularly to elastic, has been pretty awful, and migrating away from Apache/GPL/MIT is like a coming of age for the big databases (Mongo, Cockroach,...		LukeEF
25834341	13.510101	-4.463845	comment	5.0	12.5	1611070154	-9.8544445	This blog post strikes me as poorly written, overly emotional, and light on reasons to care. While not Amazon-sized, Elastic is itself a rather large company. Am I supposed to be upset that you're hav...		picodguyo
25835769	13.539842	-4.6261835	comment	5.0	19.0	1611076613	-9.937033	I thought their license update prohibits making a service that directly sells Elasticsearch? Did I miss that they are moving to closed source?		throw03172019
25865481	13.443284	-4.342823	comment	5.0	18.5	1611268571	-5.842761	Amazon has not been contributing back to the open source projects when they offer a service based on it.E.g. https://aws.amazon.com/blogs/big-data/performance-updates-to...Amazon EMR release 5.24.0 in...		sg47
25865623	13.532453	-4.5174932	comment	5.0	21.0	1611269239	8.184297	Forgive me for expressing my frustrating for a moment here:What is with this new generation of developers (I don't mean new as in young since I meet people in their 40s espousing these ideas), who mak...		__blockcipher__
25867404	13.466022	-4.331449	comment	5.0	13.5	1611281532	-5.6955624	I think, while correct, your argument is not addressing the point these commenters are making. The line of argument you are responding to seems to be based on the under-defined, and somewhat ephemeral...		throwaway17_17
25867468	13.4671755	-4.440602	comment	5.0	24.5	1611282048	-6.300666	> Plan having a gaping hole instead?A hole which didn't exist in this way 10 years ago. But well you could have seen it coming tbh.> all the while acting as if their license does not violate one of th...		dathinab
25867583	13.502432	-4.527823	comment	5.0	21.5	1611282806	-12.992653	The hole did exist ten years ago, though. The AGPL was released in 2007, three years before Elasticsearch was created, to fix this exact problem.…except Elastic doesn't want to use the AGPL because an...		jakelazaroff
13812051	13.660307	-4.960643	comment	5.0	13.5	1488905965	10.526248	I thought this was going to be about Kafka.		linkmotif
23815284	13.50181	-4.1455026	comment	5.0	17.0	1594592787	8.75781	Why do you choose HAProxy over Ngxinx?It's sounds like you love it, and I have had no experience with HAProxy. So I'm curious about the reasons you love it.(Just to be clear this is a sincere question to learn since tone is hard to express clearly with text.)		apple4ever
23917266	13.461843	-5.062393	comment	5.0	26.0	1595427637	10.288707	I'm in the process of moving from InfluxDB to TimescaleDB myself and can't wait to get rid of the hoops I have to jump through to get InfluxDB to answer some basic questions, mostly stemming from the ...		RedShift1
24215850	13.475768	-4.508466	story	5.0	110.0	1597868592	-9.886233	Elastic 7.9	https://www.elastic.co/blog/whats-new-in-elastic-7-9-0-free-workplace-search-engine-endpoint-security	praseodym
19986976	13.684169	-4.390244	comment	5.0	23.0	1558569894	9.510551	I’m a little unclear on terraform in practice.As you supposed to download this, use it’s language and syntax which is all it’s own thing, to define you services and then export that to a YAML setup th...		SlowRobotAhead
20071204	13.477625	-4.397055	comment	5.0	22.0	1559418642	-6.0073047	I don't think it's that hard to understand. To some degree, Amazon's behavior is exploiting an idealism that has given us software such as Linux that we're all benefitting from today, and it's easy to...		adamson
20121813	13.597334	-4.979093	story	5.0	6.0	1559884163	-13.158817	Apache Kafka on Kubernetes		jcamou
20353326	13.53079	-4.6891785	comment	5.0	15.5	1562236859	-9.9782	"> a misconfigured and Internet-facing Elasticsearch database without a password."" If this wasn't bad enough, a Kibana web-based app, there to make navigating through the data easier, had no password protection.That's not even really 'exposed in breach', that's just 'exposed'."		OJFord
20478950	13.47989	-4.805726	comment	5.0	17.0	1563546787	-9.988486	> Elasticsearch, definitely. I always recommend using it in hosted form and not running your own cluster. That allows you to focus on getting data in and out of your cluster instead of sinking time in...		busterarm
20586911	13.698009	-4.401457	comment	5.0	17.5	1564684846	9.462571	https://github.com/raxod502/TerrariaClone/blob/master/src/Te...You may not like it, but this is peak programming. A level of perfection attainable only by undergoing the rite of writing a single if statement with 100+ conditions.		rococode
20595966	13.568539	-4.980068	comment	5.0	17.5	1564774949	10.445289	In the days before hosted Kafka implementations were readily available, I tried to set up Kafka in our AWS infrastructure. Getting Zookeeper working in a world based on autoscaling groups was a nightm...		kevsim
20858553	13.495697	-4.8825026	story	5.0	5.0	1567425842	9.66809	How to learn to pick a database software and design a DB for your application?		eren_jaeger
20974860	13.710508	-4.383143	comment	5.0	13.5	1568508938	-8.1112	If you create resources outside of terraform/CF your doing it wrong. This is a feature, not a bug.		t34543
30791471	13.559468	-4.964791	comment	5.0	14.0	1648136590	-13.0038595	Elasticsearch is not a pain in the ass to scale, it is one of the easiest databases to scale. Kafka is medium, since they ditched Zookeeper.		jturpin
31176249	13.693315	-4.3973866	comment	5.0	17.0	1651033188	9.51754	> So returning to the original question: why doesn't Terraform use an existing language? So far, I've not yet encountered an existing language runtime which contains the building blocks Terraform uses...		mdaniel
31188599	13.705346	-4.3647633	comment	5.0	16.5	1651118651	9.370435	"OK so I'm a little puzzled by this demo (https://learn.hashicorp.com/tutorials/terraform/spotify-play...).The example directive ""spotify_search_track"" runs a server-side search on Spotify and returns ..."		mherdeg
