id	label	hovertext	author	x	y	type	relevance	size	year	umap1d
26650871	Man, I don't miss CloudFormation. If	Man, I don't miss CloudFormation. If you want to do anything interesting at all (like being able to spin up turn-key ad-hoc stacks for developers that are mostly the same as your main environments), then you have to parameterize everything, and passing data ar	throwaway894345	13.535409	-4.480656	comment	4.0	12.0	1617214396	9.468685
26781617	As a longtime ElasticSearch cluster 	As a longtime ElasticSearch cluster admin/developer and Elastic Cloud customer, I don't feel bad for Elastic in the slightest and I'm psyched about this fork.The way they operate their cloud service leaves a lot to be desired and encourages maximum spend if yo	busterarm	13.531346	-4.603507	comment	4.0	19.5	1618245775	-9.951748
26782016	> In fact, Amazon contributes very l	> In fact, Amazon contributes very little to open source in general, considering how much they take from itI don’t think this is a fact. Amazon seems to contribute pretty significantly according to the pages [0,1] they put out that describes their contribution	prepend	13.452277	-4.314304	comment	4.0	19.0	1618247328	-5.826957
26812857	Maybe an unpopular opinion but what 	"Maybe an unpopular opinion but what you just described as ""naive"" is arguably a better solution than Terraform's overengineering.I use Ansible to manage multiple clouds (Openstack, AWS...etc) using a mix of custom modules and public collections. I don't need a"	mr_C	13.669071	-4.3927364	comment	4.0	19.0	1618433292	9.457907
26813006	I haven't used Ansible so maybe I'm 	I haven't used Ansible so maybe I'm incorrect here but aren't tf and Ansible solving slightly different problems?Terraform feels like infrastructure management to me. We use it to provision underlying resources: Networking, Clusters, Nodes, Alerts, etc. All of	llbeansandrice	13.692835	-4.409739	comment	4.0	10.5	1618433986	9.52445
26815054	Roll back is one reason I choose AWS	Roll back is one reason I choose AWS Cloudformation over  Terraform. And also I do not see the reason for Terraform in my use case as we run only on AWS. No point in not using AWS native tools.	manishsharan	13.665309	-4.3654075	comment	4.0	16.0	1618448488	9.512202
26815003	I do not like terraform and I believ	"I do not like terraform and I believe it's a terrible tool.Here is the error you get when it fails:Terraform does not automatically rollback in the face of errors.
Instead, your Terraform state file has been partially updated with
any resources that successful"	rantwasp	13.708155	-4.3935833	comment	4.0	23.0	1618448146	9.54245
26882041	I used both in depth.  CDK as it is 	I used both in depth.  CDK as it is now is a wrapper around CloudFormation  and therefore suffers from same limitations: AWS only, 'static' templates.Pulimi on the other hand is closer to terraform, except you can write in a language which actually doesn't sta	rossmohax	13.653528	-4.4103074	comment	4.0	11.0	1618954397	9.513159
26882250	"According to [1], ""Native providers "	"According to [1], ""Native providers are built directly and automatically from the cloud provider’s API..."", and are not hand-coded, unlike Terraform's providers.I'm surprised this is possible. If it was, why didn't Terraform follow this approach a long time ag"	leg100	13.679049	-4.386459	comment	4.0	12.5	1618955343	9.499981
26882195	Any thoughts on Pulumi vs Terraform?	Any thoughts on Pulumi vs Terraform?	chrischen	13.68208	-4.391991	comment	4.0	13.0	1618955115	9.520851
27052042	Timescale Co-founder here. Happy to 	"Timescale Co-founder here. Happy to address your concerns!1. Monetization strategyThis funding round is actually a sign that our business model is working really well.To quote Redpoint Ventures, who led this funding round:  ""The [Timescale] team capitalized on"	akulkarni	13.437521	-4.876511	comment	4.0	18.0	1620232133	9.92041
27094898	I migrated a unmaintainable over eng	I migrated a unmaintainable over engineered java spring application consisting of around 20 micro services using Kafka all over the place to one single Rust application. A relief for anyone in the company.	holoduke	13.551272	-5.031581	comment	4.0	11.5	1620557067	-13.255433
27185415	I feel dumb saying it, but as someon	I feel dumb saying it, but as someone whose had a lot of experience with messages buses (Rabbit and AMQP1.0), I've always struggled to understand what domains/situations Kafka is actually the best fit for. It's probably because of the areas that I work in whic	Serow225	13.551919	-4.9807634	comment	4.0	11.5	1621269695	-13.091716
27190762	Infinitic (Apache Pulsar framework f	Infinitic (Apache Pulsar framework for building distributed applications)	zbentley	13.564447	-4.9599013	story	4.0	41.0	1621306095	-13.129262
27232637	Asynchronous API with DynamoDB Strea	Asynchronous API with DynamoDB Streams	kiyanwang	13.498219	-4.852365	story	4.0	29.0	1621595798	9.678025
27264626	The inability to easily go to $HOME 	The inability to easily go to $HOME in Finder is of great annoyance to mevwhen combined with app signing. Hashicorp seems to run into this most often - download a new version of Terraform/Packer/whatever, install to ~/.terraform.d/plugins/darwin_amd64, and Mac	sgarland	13.711797	-4.385446	comment	4.0	12.0	1621865827	-12.300321
27335508	Dynamo is indeed a very powerful too	Dynamo is indeed a very powerful tool for specific use cases.  A total heartbreak if the developer doesn't understand how/when to use it.	jugg1es	13.501869	-4.854896	comment	4.0	18.0	1622400556	9.662477
27367921	They offer commercial support servic	They offer commercial support services/contracts for Apache Kafka.They sell proprietary Apache Kafka add-ons for enterprise such as authentication/authorisation RBAC. The open source Kafka release supports auth/authz but not consistently between the suite of t	tiew9Vii	13.560136	-4.9898233	comment	4.0	15.5	1622637179	-13.112096
27368226	> I like Kafka but can’t see how Con	> I like Kafka but can’t see how Confluent can be profitable.I've seen what some corporate customers pay for an enterprise license. It's kind of insane.	scoopertrooper	13.569785	-4.9928546	comment	4.0	11.0	1622639214	10.483135
27322331	Elastic has broken filebeat in 7.13;	Elastic has broken filebeat in 7.13; no longer works with AWS managed ES	superchink	13.504785	-4.5506372	story	4.0	19.0	1622251147	-9.922554
27317128	Show HN: terraform-provider-factorio	Show HN: terraform-provider-factorio	efokschaner	13.686106	-4.382636	story	4.0	55.0	1622218076	9.470593
27323805	Franz Kafka: Manuscripts, drawings a	Franz Kafka: Manuscripts, drawings and personal letters go online	keiferski	13.696072	-4.961657	story	4.0	104.0	1622276144	10.543634
27429335	Lucene is Java, right? There should 	Lucene is Java, right? There should be space for a native implementation, like ScyllaDB is doing to Cassandra (and DynamoDB, though the gap is not of the same shape in the last case). Or am I missing something?I used ElasticSearch and run one cluster in produc	jng	13.43416	-4.905315	comment	4.0	11.5	1623113160	-10.095493
27434862	Can someone explain in a few words w	"Can someone explain in a few words what this is and who may be interested in this?The name does not give any hints, also the discription tells me nothing:""Terraform enables you to safely and predictably create, change, and improve infrastructure. It is an open"	jansan	13.702016	-4.388692	comment	4.0	10.5	1623158852	9.483066
27435927	You may be interested in Pulumi: htt	You may be interested in Pulumi: https://www.pulumi.com/Basically it's Terraform but instead of declaring your resources in HCL, you declare them in a real programming language. You're still producing a declarative config that the engine then diffs, applies et	ekimekim	13.705923	-4.4017935	comment	4.0	12.5	1623163849	9.52413
27477198	Its insane that it has to be this co	Its insane that it has to be this complex and require third party software to accomplish…Most modern rdbms/nosql database vendors allow a rolling upgrade where you roll in new servers and roll out the old ones seamlessly.Also the fact that AWS rds doesnt do th	tbrock	13.432438	-4.874658	comment	4.0	13.5	1623437954	9.768497
37581583	The new branding is recognizable, cu	The new branding is recognizable, cute and short. However, Tofu has a somewhat mixed reputation. I guess OpenTofu can stand on its own though.	yyyk	13.68032	-4.379925	comment	4.0	16.5	1695196455	11.48017
37581622	Is terraforming even a thing outside	Is terraforming even a thing outside of the realm of SF? I can't say I've ever seen it depicted as anything but positive, since it's taking unlivable planets and making them livable.	bigstrat2003	13.7250395	-4.351016	comment	4.0	11.0	1695196721	9.289795
37582376	What are OpenTofu's plans around CDK	What are OpenTofu's plans around CDKTF? Will that only work with HashiCorp TF going forward? Or will that be forked as well?Terraform is a better foundational layer than CloudFormation, but CDK is by far the better level of abstraction, I believe. AWS CDK is d	bilalq	13.687496	-4.386031	comment	4.0	12.0	1695204230	-12.211137
37581531	This is too woke for the UK governme	This is too woke for the UK government. Terraform is widely used in the Home Office, I don't think Suella Braverman will approve a switch...(Reference for non-UK viewers: https://www.theguardian.com/politics/video/2022/oct/18/suell...)	vr46	13.710829	-4.383223	comment	4.0	11.0	1695195989	9.440699
37616311	InfluxData is killing InfluxDB with 	InfluxData is killing InfluxDB with their changes. Their v1->v2->v3 changes are beyond insane. They revealed that flux is deprecated in v3, their main selling point for v2. In database domain you would like stability not breaking change in every 2-3 years. See	somedude82	13.45469	-5.0053906	comment	4.0	11.0	1695409641	10.387655
37647997	It seems a lot of the complaints wer	It seems a lot of the complaints weren't about kafka itself, but rather seemed to stem from internal communication problems.  Custom kafka message headers could very well be custom http headers, and the problem is the same.  Kafka is just coincidental.Looking 	chrsig	13.562229	-4.9991217	comment	4.0	15.0	1695664832	-13.087368
12819195	Elasticsearch 5.0.0 released	Elasticsearch 5.0.0 released	conductor	13.495438	-4.726163	story	4.0	42.0	1477679233	-9.977336
12935855	After spending a week evaluating if 	After spending a week evaluating if we are to pick Solr or Elastic, here are some of the more interesting conclusions:- Solr comes with optional security config; Elastic charges for Shield. At the time of the evaluation, Shield pricing wasn't online (and there	quickben	13.449766	-4.871989	comment	4.0	12.5	1478911734	-9.974337
12935569	I'd be curious to see the distributi	I'd be curious to see the distribution of Solr vs Elasticsearch in production. Anyone know how you would gather that statistic?	brian-armstrong	13.454007	-4.8793097	comment	4.0	16.0	1478908225	-10.003872
12994407	> I would like to hear what platform	> I would like to hear what platform bits of AWS that you find lacking in Google Cloud.RDS instances with Postgresql.	Fiahil	13.440204	-4.79845	comment	4.0	17.5	1479576296	9.7615185
13082316	One of the contributers here:GEM is 	One of the contributers here:GEM is at the first step towards true data modeling where it makes the mappings process very accessible. For someone coming from a SQL background, mappings in Elasticsearch are interesting because of it's nature of being both a sea	sidi	13.448212	-4.9752345	comment	4.0	11.5	1480618764	-10.027719
13276446	Ask HN: Why should one ever use AWS 	Ask HN: Why should one ever use AWS Kinesis when Kafka is out there?	amirathi	13.528893	-4.9667196	story	4.0	8.0	1483003619	10.564814
13494191	Unfortunately, this is not a very re	Unfortunately, this is not a very realistic analysis.Martin mentions HDFS in the first paragraph as an example.  But HDFS does not use partitions or consistent hashing for data assignment.  All replicas in HDFS are placed manually according to the placement po	colin_mccabe	13.528235	-5.02145	comment	4.0	10.5	1485457255	-13.105409
13526383	But here's the deal:  for someone li	"But here's the deal:  for someone like AWS who isn't giving back, the choice is not ""do they give back or don't they?"" -- it's ""do they run your software or someone else's?""  So: do you want to grow the ecosystem around your software or not?  Do you want AWS t"	bcantrill	13.443041	-4.3113313	comment	4.0	11.0	1485822436	-5.845084
13610754	What's the difference between this a	"What's the difference between this and AWS' DynamoDB, or Aurora if you prefer RDBMS? A HTTP endpoint as the DB API? Seems like a lot of extra overhead, unless you're hosting a ""client-only"" webapp (which would previously have used Firebase, IIRC).Also, this co"	falcolas	13.461891	-4.882668	comment	4.0	13.0	1486672952	9.672227
27602797	I feel like InfluxDB were the best t	I feel like InfluxDB were the best time series database in town for some time (2015-2018?), but they failed to monetise and exploit the space properly, and now they have lots of competition, many of it better in a lot of cases ( e.g. speed, space use, ease of 	sofixa	13.439951	-5.014401	comment	4.0	10.5	1624443393	10.390814
27516963	Aurora	Aurora	feross	13.479082	-4.781199	story	4.0	25.0	1623771266	9.110827
27653220	As someone who spends two hours a da	As someone who spends two hours a day dealing with buggered terraform state and upgrading terraform and dealing with terraform bugs I can see it.It’s one of those things that really works pretty well but there are enough edge cases to make it slightly soul suc	hughrr	13.703641	-4.388004	comment	4.0	15.5	1624813560	9.48461
27777550	Where I last worked, all terraform c	Where I last worked, all terraform changes went through PR, requiring approval, after having read the plan. It was using a system called atlantis. It was slow, but it prevented issues like this.	zug_zug	13.711998	-4.38298	comment	4.0	11.5	1625778046	9.489979
27780808	Y'know, normally I'd be relatively f	"Y'know, normally I'd be relatively forgiving as none of us are perfect, but jeesus this is a clusterf** of an article.The author, a ""Director of Consulting"" might want to do some training (Both Hashicorp and Microsoft have free training).Why in the hell would "	thedeusx	13.702342	-4.379881	comment	4.0	11.5	1625809860	-12.309592
27818445	Elastic are a $13 billion company. T	Elastic are a $13 billion company. They get little sympathy from me.They built that value off the back of many other open source products, and with help from the community - all under licenses like Apache 2.0 and MIT.And now, after building all that value by s	thefurrysquid	13.532	-4.603054	comment	4.0	14.0	1626161785	-9.94428
27820800	Not that I'm not impressed by Kafka 	Not that I'm not impressed by Kafka and its stability, performance and scalability, but I see the same behaviour from our customers.They specifically want Kafka, there's no real reason other than they need a queue, which Kafka actively states that it's not. At	mrweasel	13.563272	-4.9959917	comment	4.0	16.5	1626183625	-13.101407
27824175	It would if the source was pushing i	It would if the source was pushing into the Kafka stream directly. It doesn't solve the problem of going out of sync if my code to push to the Kafka stream is entirely down and I miss POSTs.(And, of course, I don't want Kafka. I want Google PubSub. No, wait, I	jerf	13.576085	-4.991039	comment	4.0	13.5	1626199746	-13.093098
27940023	Resource types in the name is a pet 	Resource types in the name is a pet peeve of mine. They should not be part of the name. An RDS instance can never be anything other than a database, no need for 'database' or 'db' or 'rds' in the name. Likewise a Kubernetes cluster can never be anything other 	ukoki	13.664423	-4.40488	comment	4.0	11.0	1627126668	-13.4669075
12057991	In solr vs elasticsearch, my underst	In solr vs elasticsearch, my understanding is that solr is more correct and has faster & better algorithms for certain edge cases. Though I'd be interested in hearing the details of any differences of opinion.Therefore Stratio's Cassandra Lucene Index is worth	grizzles	13.465012	-4.869033	comment	4.0	16.5	1468005669	-10.037909
12214358	Does anyone that has used Terraform 	Does anyone that has used Terraform have any major complaints about it, or conversely any specific praises for something it does well compared to other tools in that space?	_asummers	13.696823	-4.381554	comment	4.0	19.0	1470181861	9.463123
12235419	Don't get me wrong, I love AWS. I us	Don't get me wrong, I love AWS. I use ~15 products almost everyday. I actually like how powerful IAM is.But yeah, CloudFormation just sucks. It does. It's painful because it's a really good idea but the configuration format is inadequate for the task.CF should	nicobn	13.474386	-4.2917686	comment	4.0	12.5	1470427872	9.45742
12324833	I use and love Terraform. Even for s	I use and love Terraform. Even for small projects, I find it a lot better for provisioning AWS resources than any of the alternatives.	morgante	13.686348	-4.382675	comment	4.0	13.0	1471660090	9.520506
12464343	Aurora RDS vs. Google CloudSQL Bench	Aurora RDS vs. Google CloudSQL Benchmark	callmeradical	13.457759	-4.8090897	story	4.0	15.0	1473442323	9.674476
12533647	This needs a [2015]. Back then there	"This needs a [2015]. Back then there wasn't a single usable client for .net.Since then the non-Java clients have massively improved. In particular https://github.com/edenhill/librdkafka is fantastic.
There's also https://github.com/dpkp/kafka-python/, with sup"	ah-	13.570276	-4.9977317	comment	4.0	10.5	1474310413	10.124118
35176990	How is this possible? How is consul 	How is this possible? How is consul not self—healing? It just seems so brittle in a way even database clusters aren’t.	atonse	13.5991125	-4.5732613	comment	4.0	11.0	1678929795	-13.142244
12533895	AWS CloudFormation Update – YAML, Cr	AWS CloudFormation Update – YAML, Cross-Stack References, Substitution	Kaedon	13.571084	-4.3515463	story	4.0	19.0	1474312253	9.474746
35250146	Selefra: The Open-Source Policy-as-C	Selefra: The Open-Source Policy-as-Code Tool for Terraform and Muti-Cloud	leonynn-z	13.697319	-4.3915195	story	4.0	6.0	1679422399	9.4904995
28109098	Oh yes. Speed is an important point.	Oh yes. Speed is an important point. ElasticSearch & Solr use disk-first indexing (with RAM as just a cache), whereas Algolia and Typesense use a RAM-first approach where the entire index is stored in memory. This is what makes Algolia/Typesense return results	jabo	13.46822	-4.893675	comment	4.0	11.0	1628448535	-10.007388
28111176	I use to be a huge proponent of Elas	I use to be a huge proponent of Elastic.co for search. I paid for their Elastic Cloud Enterprise product to offer an internally hosted Elastic as a Service. We ran a proof of concept with the the open source Elastic Stack before requesting the funding to get c	thedougd	13.511162	-4.548054	comment	4.0	40.0	1628465492	-9.9342165
28257830	Quasi-related: what are some good ho	Quasi-related: what are some good hosted alternatives to AWS dynamodb / GCloud Firestore that are a) fast b) affordable at scale c) have a good local dev experience?A hosted disk based redis protocol compliant capable of sub TB size datasets would be a dream f	spookylettuce	13.457451	-4.862121	comment	4.0	10.5	1629560233	9.685412
28294990	The benchmarks against DynamoDB, Big	The benchmarks against DynamoDB, Bigtable, & CockroachDB [1] appear quite impressive - anyone have real world experience that can attest to these claims of improved performance and reduced cost?> Scylla vs DynamoDB – Database Benchmark> 20x better throughput i	criticaltinker	13.434716	-4.873283	comment	4.0	12.0	1629838996	9.632377
28427669	These things happen, props to Hashic	These things happen, props to Hashicorp for communicating about it.It would be easy to say that this is a failure of open-source in some way, but to do so would be unfair to the huge amount of work that companies put into tools like this, and the stewardship t	danpalmer	13.730251	-4.3607516	comment	4.0	34.0	1630875180	13.261976
28442230	The Basics of Apache Kafka	The Basics of Apache Kafka	the2ndfloorguy	13.600316	-4.985871	story	4.0	81.0	1631001947	-13.106806
28464881	> Amazon is the good guy in this sto	> Amazon is the good guy in this storyThat is so twisted.Elastic did all of the hard work. Amazon came in and took it.Open source is fair when there aren't giants plucking it out of the hands of workers and co-opting it into their massive platform options with	echelon	13.483759	-4.4308805	comment	4.0	17.5	1631148278	-9.853865
22341413	>  This means the Service must be cr	>  This means the Service must be created first, then when the corresponding NEG is created the name can be queried and added to the Terraform project.These kind of reverse dependencies, where app level changes have to be reflected in infrastructure are source	rossmohax	13.666416	-4.394057	comment	4.0	12.0	1581858922	-13.484538
22397710	Unsecured Elasticsearch servers have	"Unsecured Elasticsearch servers have been implicated in multiple breaches in recent months [1][2]. Since this post is an ""In depth guide to running Elasticsearch in production,” it should prominently include information related to security and configuration. W"	there_the_and	13.517932	-4.6813803	comment	4.0	17.0	1582475539	-9.909211
22688992	Elasticsearch is easier than mongo i	Elasticsearch is easier than mongo in some ways and harder in others.I run a few 10TiB ES clusters (which, is not much to be fair) but infrequently find that I have to reindex or reshard the cluster because I can’t just add another node. There’s something to b	dijit	13.472381	-4.8449173	comment	4.0	10.5	1585174574	-10.001907
22689206	I've been bitten by elasticsearch tw	I've been bitten by elasticsearch twice in my career, and I've seen others bitten by it as well. Once you put it in production, you can't just run it from docker on your workstation. You have to set up a cluster with enough capacity for whatever load you're go	jniedrauer	13.442499	-4.8819346	comment	4.0	11.0	1585176609	-9.971319
22767713	Having migrated a postgres database 	Having migrated a postgres database to dynamodb, I would say that I'm never going to use postgres again.The problem with all SQL databases is that they are too easy to query and use. You add all kinds of select queries, joins and foreign keys and when traffic 	me551ah	13.4980345	-4.896937	comment	4.0	12.5	1585908161	9.664995
22675124	Kafka-on-Pulsar: bring native Kafka 	Kafka-on-Pulsar: bring native Kafka protocol support to Apache Pulsar	lmsp	13.600048	-4.991755	story	4.0	19.0	1585061774	-13.125226
19110567	Your respect is misplaced. Amazon ha	Your respect is misplaced. Amazon has some of the worst business practices of any company its size. They region shop. They mix inventory. They engage in anti-competitive behaviour. They use their position as a platform to influence their competitive business o	3pt14159	13.456369	-4.2986665	comment	4.0	15.5	1549589637	-6.1089854
19150153	The more queries I write on Elastics	The more queries I write on Elasticsearch, the more I value SQL.	vietvu	13.468008	-4.91024	comment	4.0	10.5	1550028965	-9.98377
19359734	'Distro' makes it sound like a linux	'Distro' makes it sound like a linux-distribution with, in this case, Elasticsearch installed on it. From what I read on the page and on the aws blog this is not the case though?	mosselman	13.520657	-4.6637144	comment	4.0	15.5	1552318666	-9.935403
19359882	"This is an interesting new ""threat"" "	"This is an interesting new ""threat"" to the ""open core"" business model. ES makes proprietary extensions to support their FOSS core product - then a tech behemoth clones these features for their own hosted service, but makes them Free as well. Good for the consu"	Mizza	13.46577	-4.404039	comment	4.0	13.0	1552319692	-9.726064
19362604	Last year Elastic opened up the sour	Last year Elastic opened up the source code of their commercial X-Pack offering: https://www.elastic.co/blog/doubling-down-on-open. This means that these components (security, alerting, etc.) are now available in the GitHub repository, but they are covered by 	praseodym	13.526332	-4.5137753	comment	4.0	14.0	1552336867	-9.884653
19361234	As someone who is involved in the ec	As someone who is involved in the ecosystem and maintains some open-source projects based on ElasticSearch, I am similarly curious about the move to not build upon existing projects (there could be a good reason, but haven't heard it yet).Why wasn't ElastAlert	sidi	13.525121	-4.6182675	comment	4.0	15.0	1552327699	-9.9429035
19362788	In the event that F5 pulls an Oracle	"In the event that F5 pulls an Oracle and horribly mismanages nginx, runs it into the ground, or tries to close it off, I vote we name the community fork ""nginy""."	hannasanarion	13.455665	-4.1809707	comment	4.0	11.5	1552338106	-8.939676
19364473	> [Elastic] started developing new f	> [Elastic] started developing new features under a proprietary license> Elastic is the rare company that truly is committed to open sourceOn their face, those two statements seem mutually exclusive. What context am I missing that would make them not so?	abtinf	13.503739	-4.447482	comment	4.0	14.0	1552352876	-9.806247
19311301	Vulcanizer: A Library for Operating 	Vulcanizer: A Library for Operating Elasticsearch	yarapavan	13.460888	-4.8481817	story	4.0	104.0	1551801186	-10.009313
19512387	neither Kong nor its infrastructure 	neither Kong nor its infrastructure (i.e. nginx) have any future on the long term against envoy. Simply time is against them even if it is going to be very slow downfall. I guess that's the real reason nginx sold itself right in the peak of the economic cycle 	trpc	13.447473	-4.223206	comment	4.0	13.0	1553782585	8.794226
