id	x	y	type	relevance	size	year	umap1d	hovertext	url	author
33202633	13.674914	-4.3767495	comment	3.0	11.0	1665750646	9.521245	> API that works on localhost: 4 daysLol. This may be true but if kind of pointless as an api on localist isn’t very useful unless you’re automating your home. Of course it’s easier to hack something ...		prepend
26641035	13.5309	-4.988822	comment	3.0	11.0	1617141075	-13.13053	Correct; but I've seen many uses of Kafka that NATS could totally be used for. For example, load balancing across subscribers (use a NATS queue instead of a Kafka consumer group).NATS doesn't ever sto...		cmckn
26642170	13.508761	-4.983877	comment	3.0	11.0	1617150338	-13.069212	Is there any message ordering guarantee in NATS? With Kafka you can achieve this by using keyed message and messages in the same partition will always be orderedDisclosure: I work for Confluent		gantengx
26642297	13.571008	-4.873087	comment	3.0	11.5	1617151429	-13.195532	Reminded me of this project: https://github.com/travisjeffery/jockoKafka implemented in Go without needing Zookeeper.		didip
26641046	13.57472	-4.9947133	comment	3.0	10.5	1617141170	-13.115185	You can tune Kafka down fairly well if you know what you're doing, but it's not optimised for that OOTB. Or just use Confluent Cloud, which is fully managed and scales down as low as you want (costs cents per Gb). Disclosure: work for Confluent.		math
26783074	13.511001	-4.6186767	comment	3.0	12.5	1618251736	-9.943249	Will be interesting to see the resources that AWS will throw at this.  You can get a sense of the resource that elastic.co is throwing at elasticsearch athttps://public-001.gitsense.com/insights/githu...		sdesol
26785271	13.478455	-4.42425	comment	3.0	16.0	1618262015	-9.837599	The value in the market is the subject of the parent thread. Anyways, like I said, Elastic could've made money with a proprietary product but they chose OSS instead (and used Apache Lucene to build on...		manigandham
26812094	13.710251	-4.3885684	comment	3.0	11.0	1618429510	9.456723	Someone not in our team upgraded version by mistake from 0.12 to 0.13 (he was contributing something small and used the latest), the CTO got involved and made us update everything and it was a big und...		jokethrowaway
26812721	13.568101	-4.3434134	comment	3.0	13.5	1618432612	9.529856	Have you ever set something up manually via AWS console, then 6 months later totally forgot the steps you took and end up wasting a lot of time reverse engineering what you did in order to make a comp...		dasil003
26815201	13.693143	-4.397012	comment	3.0	12.0	1618450086	9.50397	The jump from what you mentioned in paragraph 2 to 3 is not necessarily Terraform. You can use other tools, like Ansible, that IMO have a much better framework than Terraform. I use Terraform for extr...		aprdm
37581811	13.709245	-4.3884964	comment	3.0	10.5	1695198491	9.507548	It's a nice pun and at the same time is close to the original, which would help Terraform users recognize the brand. Your suggestions are nice, but less recognizable in that way.Maybe we can take that...		notpushkin
37582095	13.6761875	-4.380347	comment	3.0	13.5	1695201076	-12.173852	The link and github does not tell much what OpenTofu is. So I opened the official website. Again very hard to find out what it actually is. Goals and why it was created, and a hundred times that it's ...		Mashimo
37582292	13.726156	-4.3525877	comment	3.0	12.0	1695203295	-12.529883	I generally like your takes but this one isn't very good since it wasn't Amazon that was the threat.HashiCorp couldn't compete. Their enterprise offerings were bad and their price quotes were insane a...		emptysongglass
37584319	13.758403	-4.3131733	comment	3.0	12.5	1695218847	-12.421692	I believe Dave McJannet, HashiCorp's CEO, should be concerned. OpenTofu has garnered massive support, with the project gaining admission to the Linux Foundation and even receiving public support from ...		cloudbrewer
37589123	13.512919	-4.9886265	comment	3.0	11.0	1695239225	-13.138659	> 3) Switch out log4j for Kafka, which will handle the persistence & multiplexing for you.I don't think this is a reasonable statement. There are already a few logging agents that support structured l...		rewmie
37614376	13.42867	-5.0355725	comment	3.0	10.5	1695401460	9.76304	> When you put your data right next to your application, you can see per-query latency drop to 10-20 microseconds. That’s micro, with a μ. A 50-100x improvement over an intra-region Postgres query.Why...		kijin
37639035	13.439858	-4.990656	comment	3.0	13.0	1695608693	-13.000689	> Anything but RabbitMQ.Would you mind elaborating on this? I'd be happy for others to chime in with their experiences/opinions, too.		reubenbond
37648051	13.548749	-4.985747	comment	3.0	10.5	1695665053	-13.096441	>small scale kafka, though. It's conceptually great to have everything work off of logs, but kafka does add a non trivial operational burden.does something like that exist ???		imachine1980_
37596439	13.7371	-4.3524184	story	3.0	14.0	1695298133	-12.498937	Community Growth At: HashiCorp	https://community.inc/deep-dives/community-growth-hashicorp	GarethX
37676585	13.560916	-4.869837	comment	3.0	17.5	1695830163	-13.18654	Coincidentally, as someone who worked on this blog, I was surprised (and pleased!) to see that we are not the only ones who felt the need to build a Zookeeper alternative.Looks like folks at StreamNat...		tbragin
37809947	13.713118	-4.384453	comment	3.0	11.0	1696769009	9.469877	If you wanted to store the state in Git, you would probably want to at least encrypt secrets. This is not something that Terraform supports now (theory is that this is to push their commercial offerin...		fishnchips
37810990	13.699443	-4.391777	comment	3.0	12.0	1696776721	9.525064	Much as I love the service homebrew provides, terraform is one of the edge cases that is better being managed outside of brew. I believe tf-switch is now the most popular option?The problem with Terra...		hnlmorg
37848078	13.505049	-4.8312893	comment	3.0	13.0	1697047704	9.599404	Not pictured: the cost of switching to DynamoDB when this service inevitably gets shut down in two years.		andrewedstrom
37849474	13.485086	-4.7499857	comment	3.0	14.0	1697054162	9.661424	From the AWS blog post they referenced-> DynamoDB powers multiple high-traffic Amazon properties and systems including Alexa, the Amazon.com sites, and all Amazon fulfillment centers. Over the course ...		tedivm
37849654	13.498134	-4.8414845	comment	3.0	11.0	1697055005	9.702036	I used DynamoDB as part of the job a few years ago and never got single-millisecond responses - it was 20ms minimum and 70+ on a cold-start, but I can accept that optimising Dynamo's various indexes i...		ljm
14723258	13.501276	-4.860134	comment	3.0	13.0	1499472290	9.671803	The gist of this seems to be that DynamoDB becomes a problem if you have millions of customers.Don't worry. You don't. And there will be many good reasons to refactor the architecture before you do.		nikanj
14723410	13.504544	-4.896968	comment	3.0	15.0	1499474733	9.6957	I don't know what the article author is storing, but it's noted that 10GB of data is stored per node. That's quite a bit of data for a single table, and the 10GB is per shard of a table, not per 'data...		windlep
14723834	13.4976225	-4.985137	comment	3.0	12.0	1499482946	9.778792	Many of the comments here are saying that the author's use-case wasn't a good one for DynamoDB. Can anyone share some simple approachable resources that talk about the kinds of use-cases where these t...		TheAceOfHearts
14741428	13.433952	-4.7147613	comment	3.0	11.5	1499744695	9.688722	Has anyone used RDS from lambda? Don't want to use Dynamo but perhaps for some key Val store.		buckbova
14801029	13.558246	-4.948058	story	3.0	28.0	1500421839	-13.116535	Apache Pulsar (Incubating)	https://pulsar.incubator.apache.org/	mmerli
12773784	13.623714	-4.5276494	comment	3.0	10.5	1477234208	-13.1446295	I'm no consul expert, but their only problem i've seen right now is the fact that ID is bound to an IP and that this IP is taken from the first network interface.I hope they can move to GUIDs or some ...		RRRA
12774297	13.513742	-4.711524	comment	3.0	10.5	1477241972	4.4479628	"(Aside from the issues with reason #1 for not using consul noted below...)The author says that Atlas is essentially ""required"" for bootstrapping. We simply use our cloud provider's ""list-instances"" co..."		zbjornson
27586160	13.488169	-4.271015	story	3.0	65.0	1624319972	9.471125	A Public Registry for AWS CloudFormation	https://aws.amazon.com/blogs/aws/introducing-a-public-registry-for-aws-cloudformation/	gmays
27777629	13.528358	-4.2776875	comment	3.0	10.5	1625778460	9.31339	We had the same issue with DynamoDB, that Terraform is all to happy to delete a table it deems acceptable to delete.  Which in 99 out of 100 cases is never the case.  It is a very aggressive IaC tool.		bwship
27777761	13.71204	-4.3776236	comment	3.0	10.5	1625779302	9.497658	Doesn’t terraform show you how many resources are affected and require you to approve that when running apply?		camjohnson26
27795054	13.439817	-4.7322283	comment	3.0	12.5	1625938601	9.662634	This is a good paper that talks about Aurora and provides some insight into how RDS operates: https://www.allthingsdistributed.com/files/p1041-verbitski.p...It’s nice that AWS builds their own higher ...		ec109685
35357946	13.48373	-4.9598393	comment	3.0	13.0	1680100764	9.665215	Hugely disappointed by Alloydb. Price and performance for a write heavy workload where off the charts horrible. It didn’t even support disabling an instance and it did only storage autoscaling much wo...		lysecret
35369524	13.447528	-4.8892713	story	3.0	11.0	1680163407	-9.977192	Meilisearch vs. Elasticsearch	https://blog.meilisearch.com/why-should-you-use-meilisearch-over-elasticsearch/	CaroFG
22351734	13.585813	-4.37669	comment	3.0	12.5	1581980222	-13.1996565	This is true to some extent. I'm building out the infrastructure for my company, and there is a lot of effort on my part required to automate stuff.Something like kafka requires figuring out the confi...		lykr0n
22601426	13.567117	-4.2062607	comment	3.0	13.0	1584416650	-12.513995	What is the purpose of Vault if you’re already on AWS?Even though I prefer CloudFormation, Terraform is quite popular. As far as Consul and Nomad, they are both nice for on prem infrastructure - I’ve ...		scarface74
15185450	13.528887	-5.009826	comment	3.0	24.0	1504718828	-13.075149	>We need the log to retain all events forever, otherwise it is not possible to recreate a data store from scratch.SIGH. Cue the facepalm, head in hands, etc.I'm not going to get into a big thing here....		cookiecaper
15185652	13.543624	-5.0290313	comment	3.0	13.5	1504720292	-13.080881	From what I can tell, Kafka isn't designed for long term data storage. RDBMS systems are designed for this.Kafka is more for streaming data and events, so I'd probably be uncomfortable assuming that i...		scaryclam
15185888	13.556318	-5.002503	comment	3.0	12.5	1504722048	-13.085108	This is a flawed architecture. It will work at release, but it will be difficult to manoeuvre with, and they will grow to hate it.As your business changes, your data changes. Imagine if on day one, th...		cturner
15346247	13.469859	-4.171724	comment	3.0	12.5	1506506192	8.797973	Yes, they have the same features mostly.The difference is that HAProxy has a monitoring page to see what is configured and where connections are going. Nginx is a black box unless you pay them ~ $2000 for the pro edition.Monitoring is feature #1 of a load balancer.		user5994461
15358895	13.498868	-4.1597676	comment	3.0	15.5	1506618619	8.760585	"Looks like both HAProxy and Nginx are going down the ""pay for more advanced features"" route:https://www.haproxy.com/products/haproxy-enterprise-edition/https://www.nginx.com/products/nginx/"		otterley
15385588	13.51026	-5.006554	comment	3.0	12.0	1506963611	-13.081263	Under what circumstances would one prefer Redis streams over Kafka and vice versa?		hyades
15389398	13.453595	-4.783918	comment	3.0	10.5	1506994357	9.640217	Anything that can go to dynamo, can go to s3, especially at that volume. And you get proper multi region replication, read/write capacity based on actual usage and instant scaling.I stay by my comment that dynamodb is a joke wrapped in thick layer of marketing crap.		sheeshkebab
15410674	13.448396	-4.9466457	comment	3.0	12.5	1507222625	-9.970095	I've been working mostly with Elasticsearch for the past couple of years, but I have to admit I'm deeply impressed with the results I got out of PostgreSQL after only a few hours of hacking. Elasticse...		simonw
15546469	13.489966	-4.9661655	comment	3.0	10.5	1508892415	9.850464	Aurora is very interesting especially in terms of removing storage management from the equation. I just wish they (and the regular postgres RDS offering) had support for TimescaleDB (http://www.timescale.com).		scrollaway
15546550	13.459983	-4.925499	comment	3.0	10.5	1508893673	9.769578	I ran the preview for ~2 months on a few instances.  No compatibility issues, but we had queries that were significantly slower than on a vanilla Postgres instance and a problem with temp table bloat ...		nmilford
15699237	13.4531975	-4.8285823	comment	3.0	11.0	1510694423	-9.954046	Cross data center replication is really a much needed feature.The way Elasticsearch is going though looks promising. With sorted indices, single mapping type and the other changes we might give it ano...		naiv
38013714	13.455169	-5.0094514	story	3.0	31.0	1698247030	-5.4623027	Using the FDAP Architecture to Build InfluxDB 3.0: Flight, DataFusion, Arrow	https://www.influxdata.com/blog/flight-datafusion-arrow-parquet-fdap-architecture-influxdb/	treesciencebot
38023896	13.447665	-4.913194	comment	3.0	17.0	1698317113	9.730672	how do y'all look at systems like AWS Aurora, GCP Spanner, etc which offer big speedups and cost savings, but lock you into the platform in practice?this isn't academic for me - I've got a service tha...		asah
38029609	13.738777	-4.383338	story	3.0	17.0	1698344250	-12.420484	Linux Foundation Adopting Terraform Fork Provokes Ire of HashiCorp CEO	https://thenewstack.io/linux-foundation-adopting-terraform-fork-provokes-ire-of-hashicorp-ceo/	thunderbong
38447720	13.473474	-5.0635695	comment	3.0	12.5	1701189774	9.678896	This sounds very exciting, but I would have greatly appreciated some actual technical details. From this statement> Sharded tables – These tables are distributed across multiple shards. Data is split ...		dkhenry
38447982	13.465729	-4.8629613	comment	3.0	11.0	1701191085	9.692799	Aurora Limitless Database is based on our own investments in database-optimized virtualization (Caspian), in scale-out log-first database storage (Grover)[2], and in a custom approach to cross-shard t...		mjb
27183853	13.431256	-4.974188	comment	3.0	10.5	1621261895	-13.050186	"When I proposed to use RabbitMQ for service integration my colleagues didn't agree to go with it because it ""won't scale"" and AWS doesn't provide a managed service. Because of an AWS fetish and awful development experience the product won't launch anytime soon."		nesarkvechnep
27434586	13.68232	-4.3981075	comment	3.0	14.0	1623157379	9.508557	People mention pulumi but hashicorp are creating something similar with https://github.com/hashicorp/terraform-cdk. But all the existing terraform providers work with it afaik.		granra
27434790	13.636093	-4.4120364	comment	3.0	12.5	1623158523	9.587691	I don't know if people have even tried Pulumi before recommending it.I've tried it, and it has buggy defaults, diff generation, etc.  Each time I applied the same code, it would generate a diff based ...		tonyhb
27434899	13.691745	-4.410352	comment	3.0	12.0	1623159034	9.510433	How does terraform compare to ansible?		syntaxstic
33491074	13.640953	-4.3726964	comment	3.0	10.5	1667730083	9.49809	Yes. CDK is just another way of expressing the same things as terraform and cloudfront but using a framework which is opaque. Plus it's slow as fuck, buggy and difficult to debug when it goes wrong.Ev...		gw98
33571832	13.701098	-4.3845973	comment	3.0	12.0	1668249024	9.4480505	What is the difference between this, terraluna earlier this year or MTGox?		rvba
33808427	13.629374	-4.530998	comment	3.0	11.0	1669845536	-13.143331	> we’re good at consulThank god someone is.  I’ve lost more of my life to consul partition failures that’s any other part of the nutech stack.		asguy
33849149	13.4512	-4.3192735	story	3.0	11.0	1670114153	-5.8840585	.NET open source is 'heavily under-funded' says AWS	https://www.theregister.com/2022/12/01/net_open_source_heavily_underfunded/	delta_p_delta_x
33897124	13.441875	-4.770769	comment	3.0	11.0	1670433634	9.68689	It's also a really nice combo for simple automation lambdas that need some state and you want an ergonomic DB without paying for full RDS.Go + Lambda + EFS + SQLite work great for that.		cube2222
34103465	13.432039	-4.8466067	comment	3.0	10.5	1671783610	3.6989815	I had heard no shortage of warnings against using Lucene/elasticsearch to host my own basic search. But it was incredibly easy to implement and about as painless as running an apache server. For a sel...		ehnto
22671152	13.453035	-4.8047113	comment	3.0	17.0	1585015906	-6.714978	> firebase at google is doing extremely wellSource?It's certainly popular but everyone I know (me included) is running away from it asap.		pier25
22748734	13.629283	-4.9789863	story	3.0	31.0	1585750837	10.55262	Apache Kafka: Life after the honeymoon period	https://lenses.io/blog/2020/03/apache-kafka-when-the-honeymoon-is-over/	lensesio
17898247	13.493764	-4.8586574	comment	3.0	13.0	1535917149	9.679914	He mentions DynamoDB for the data layer instead of regular RDBMS. I have tried to use DynamoDB several times but have been disappointed with it. I am not saying traditional RDBMSs solve the problem th...		actuator
17898393	13.447082	-4.992011	comment	3.0	15.5	1535918887	9.70161	So why is rdbms and serverless seemingly mutually exclusive? Are rdbms queries really that slow compared to something like dynamodb?		travbrack
17976709	13.5286	-5.0097094	comment	3.0	12.5	1536823553	-13.059758	Those are streaming/pubsub services though, this actually claims to be a store. I feel that's an important difference.Do people just point their system journal at Kafka and wait for something to break...		tinco
18992097	13.55425	-5.0232754	comment	3.0	14.0	1548358514	9.755286	Amazon Aurora doesn't have much to do with Postgres and is a custom storage subsystem used by many different database engines. Aurora Postgres is actually using Postgres code on top to handle queries,...		manigandham
18983040	13.503874	-4.852494	story	3.0	40.0	1548278102	9.640203	Running Fast SQL on DynamoDB Tables	https://rockset.com/blog/running-fast-sql-on-dynamodb-tables/	vahidfazelrezai
19082892	13.434924	-4.6700654	comment	3.0	17.5	1549338481	9.584658	OK. So you connect to Postgres on RDS - cloud agnostic.You connect to S3, and:a) You can build an abstraction service if you care about vendor lock-in so muchb) It has an API that plenty of open sourc...		staticassertion
19159333	13.554339	-5.0346203	comment	3.0	11.5	1550114068	9.837667	Tell that to AWS. They've banned relational databases for specific workloads because Dynamo (nosql) provides more consistent performance, and is easier to operate.Tons of conflation of Mongo's problems with those of nosql in this thread.		staticassertion
15808317	13.498274	-4.846294	story	3.0	102.0	1511974356	9.692192	Amazon DynamoDB Update – Global Tables and On-Demand Backup	https://aws.amazon.com/blogs/aws/new-for-amazon-dynamodb-global-tables-and-on-demand-backup/	polmolea
21044247	13.716434	-4.3884034	story	3.0	59.0	1569189644	9.4876795	Show HN: I Made a Terraform Crash Course		movedx
22867289	13.681506	-4.409129	comment	3.0	42.5	1586878735	9.499439	I have been wanting to try Pulumi out for a while. As an avid terraform user, I welcome the ability to use a proper language instead of the declarative HCL. For those who have migrated from terraform -> Pulumi, what are the biggest cons you've experienced?		dcardoza
22984262	13.615215	-4.3392897	comment	3.0	10.5	1587873321	9.548084	Most of the time when I see more complication on top of cloudformation, what you really want is terraform.		booi
22992083	13.455114	-4.3208075	comment	3.0	13.5	1587951389	-5.860765	I hate to defend Amazon, but it seems that they do contribute back to open source:https://aws.amazon.com/opensource/For example running `git shortlog -ne` in the Linux kernel git repository will show a number of Amazon folks with many commits to their name.		pabs3
23005521	13.708622	-4.4004345	comment	3.0	11.5	1588069420	9.558918	Ansible has full integration with cloud providers API. It's actually better for managing instances and highly dynamic resources because it has much better state management than Terraform.If you (re)cr...		user5994461
23010474	13.562211	-4.8979874	comment	3.0	11.5	1588100234	-13.407695	Author here. I started Liftbridge after working as a core committer on NATS and NATS Streaming (as well as my experience using Kafka in the past). In particular, implementing replication in NATS Streaming and drawing from that experience/lessons learned. Happy to answer any questions!		tylertreat
22982247	13.49444	-4.3932366	story	3.0	26.0	1587854373	-10.440053	Level up CloudFormation with VS Code	https://dannys.space/level-up-cloudformation-with-vs-code	dsteenman
23053590	13.491324	-4.771643	story	3.0	79.0	1588442292	-9.993373	Static Sites with Elasticsearch	https://www.gizra.com/content/drupal-static-elasticsearch/	amitaibu
23133432	13.627465	-4.348517	comment	3.0	10.5	1589124976	9.485425	yeah no.cloudformation is awesome and it works as advertised. I have literally not seen it fail catastrophically ever since it came out. it just works.terraform? or terrafail as it’s known. it’s a dis...		rantwasp
23155569	13.704921	-4.3849444	comment	3.0	10.5	1589299522	9.459736	The focus would make sense to me if, say, it exported to initial terraform templates or something like that.		cs02rm0
23194858	13.498448	-4.8730283	comment	3.0	11.5	1589563974	9.696563	DynamoDB is very compelling for performance, scalability, and low ops overhead, but I recommend thinking very carefully about the limited transaction support before going with it, as it’s likely to be...		danenania
23207267	13.590278	-4.9864397	comment	3.0	11.0	1589663596	-13.093852	For a lot a projects this is hardly a problem. On the other hand Kafka is more mature and has a huge ecosystem (Kafka Connect, Kafka Streams, KSQL, ...).		oweiler
23207742	13.530954	-5.0178967	comment	3.0	12.0	1589668373	-13.064718	So, I've been having a back and forth with a colleague on this and I'm genuinely interested in why you so strongly suggest this.For the record, I have good real world experience with all kinds of data...		sixdimensional
23207917	13.579765	-4.9878316	comment	3.0	13.0	1589669977	-13.100788	What every software engineer should know about Kafka, it's dead.If you're not already technically chained into it and Confluence hasn't already upsold your poor organization avoid it.If you want the e...		ckdarby
23209271	13.575844	-4.9927597	comment	3.0	11.0	1589685391	-13.128844	> Different things you argue; but alas, that's the point; the point you made was that kafka would 'be it' if it had come first, but...since it cannot serve the purpose of a db in most contexts; you're...		lmm
23209330	13.574979	-4.9919653	comment	3.0	18.5	1589686030	-13.095895	I worked with a short-lived startup which made this exact mistake. I suggested persisting important events to a postgres db, but I was shot down over and over. They were positive it would be fine to h...		steve_adams_86
23210136	13.570187	-4.9886093	comment	3.0	23.0	1589698347	-13.1199255	p99 latency.No startup times of course. This is for pushing a simple 2 petabyte workload.No AOT compilers, just download kafka bin distribution 2.4.1Just launching 6 or 7 of these.  bin/kafka-run-clas...		agallego
23207233	13.442356	-4.232947	story	3.0	64.0	1589663259	9.3644	Show HN: VPC Design Studio – Subnet CIDR planning with Terraform/Pulumi code gen	https://houqp.github.io/vpcstudio/	houqp
23213583	13.434982	-5.0462747	comment	3.0	11.0	1589736961	9.681582	>> Easier for who?For any decent SRE out there.>>  magnitudes more performance which is not possible by just tuning CassandraMagnitudes?? Are you talking about the order of magnitude? You should read ...		StreamBright
23245964	13.660021	-4.373287	comment	3.0	12.5	1589977095	9.508826	I don’t think I’ve ever met someone that actually uses cloudformation unless a template was provided them to setup something like a lambda.Why would you when terraform exists?		tbrock
23272048	13.538341	-4.9673166	comment	3.0	11.0	1590155554	9.742415	While there are many people here who are sharing their bad experience with MongoDB, just curious if you all find the experience with DynamoDB similar?Since they are both of the NoSQL family.		tmlee
23273239	13.672616	-4.9864492	comment	3.0	17.0	1590161904	9.895845	"That sounds like open source to me, I bet they're just being really conservative about saying ""open source"" because there's been so much backlash at MongoDB/Cockroach/etc for similar restrictions.It's restricted OSS because AWS takes things, runs them, and eats up all the potential revenue."		mrkurt
23273335	13.454413	-4.8407764	comment	3.0	10.5	1590162452	9.940478	> I think we're too hung up on OSI open source licenses.I disagree. The free software criteria were defined as they are for a reason. AWS and other cloud vendors are taking advantage, but that is not ...		CameronNemo
28067383	13.4917965	-4.7797694	story	3.0	6.0	1628116797	-9.950931	Elasticsearch-py removes support for AWS Elasticsearch		atsaloli
