id	label	hovertext	author	x	y	type	relevance	size	year	umap1d
13620313	RDS, or any hosted database solution	RDS, or any hosted database solution, is not some kind of silver bullet that solves all problems. While it's true it takes care of backups automatically, it does also restrict you in terms of what you can do.For example, you can't load custom extensions into R	YorickPeterse	13.454333	-4.8817005	comment	4.0	15.0	1486774965	9.76549
13620348	> Also, to the best of my knowledge 	> Also, to the best of my knowledge RDS does not support a hot standby replica you can use for read-only queriesRDS has very nice  Read Replicas.http://docs.aws.amazon.com/AmazonRDS/latest/UserGuide/USER_R...For HA you can use High Availability (Multi-AZ).http	phonon	13.442056	-4.7413664	comment	4.0	13.0	1486775602	9.74003
20956841	DynamoDB Compatibility Layer for Apa	DynamoDB Compatibility Layer for Apache Cassandra	hannahlee	13.505337	-4.8841667	story	4.0	90.0	1568324969	9.7079115
13662428	Just wondering here, but why would y	Just wondering here, but why would you use this vs terraform? Given that I can define most of the stuff I need from AWS in terraform and check the state of the infra via plan command, what would be the use case for CLI? I'm actively trying to break the habit o	vitalysh	13.68723	-4.3949356	comment	4.0	11.5	1487270809	9.531969
13723781	Great that they respond so clearly a	Great that they respond so clearly and quickly.One question - does anyone else feel that having NGINX as the only link in the summary kind of suggests that it's an nginx problem?  I could imagine my previous boss reading the article, and 3 months later saying,	deckiedan	13.44984	-4.238547	comment	4.0	13.5	1487945585	8.675705
13831484	Hopefully this pushes Microsoft to e	Hopefully this pushes Microsoft to expand their offering. I'd love managed Postgres in Azure.	JoshGlazebrook	13.477971	-5.078249	comment	4.0	10.5	1489083462	9.828066
13899305	How do folks feel about Terraform vs	How do folks feel about Terraform vs Cloudformation for AWS-only deployments these days? Do we have a clear winner? I remember even a year back there were certain features of AWS that were being made available through Terraform first before you could configure	akurilin	13.666238	-4.3715034	comment	4.0	12.0	1489799075	9.50921
13997129	I recently had cause to work with Ka	I recently had cause to work with Kafka Connect; we needed to get data from MySQL into Hadoop. It was not a positive experience, and IMO Kafka Connect is pretty immature, and Kafka as it is currently constituted isn't well featured enough for this purpose.Kafk	barrkel	13.548486	-5.0047417	comment	4.0	11.0	1490893912	12.785736
14237852	At Timehop we currently work with a 	At Timehop we currently work with a single instance AWS Aurora (MySQL-ish) database with over 40TB of data (plus a read-only replica on a smaller instance). Some stats: 1.5MB/sec receive throughput, 10MB/sec transmit throughput, commit latency around 3-4ms (wi	kevrone	13.463535	-4.9297776	comment	4.0	11.5	1493649974	9.735517
14310403	What looks compelling about the Post	What looks compelling about the PostgreSQL offering as compared to AWS RDS is that it looks like you get a PostgreSQL cluster rather than a single database in a shared cluster.  At least reading the documentation for creating a DB implies that (https://docs.mi	sbuttgereit	13.481392	-4.9933505	comment	4.0	15.0	1494440768	9.753531
14455966	I think the biggest question is, do 	I think the biggest question is, do you think its feasible to directly start with Kafka instead of NSQ or does Kafka just require a much stronger/larger team to operate than NSQ?	Roritharr	13.57836	-4.986888	comment	4.0	18.5	1496265211	10.521435
14456513	Engineer @ SegmentNSQ has served us 	Engineer @ SegmentNSQ has served us pretty well but long term persistence has been a massive concern to us. If any of our NSQ nodes go down it's a big problem.Kafka has been far more complicated to operate in production and developing against it requires more 	TheHydroImpulse	13.533232	-4.988944	comment	4.0	18.5	1496270687	-13.07535
14362398	Show HN: Goka – distributed stream p	Show HN: Goka – distributed stream processing library for Kafka written in Go	flosch	13.550899	-5.0093617	story	4.0	105.0	1495052213	-13.1148615
30894545	I know this comment will show up eve	I know this comment will show up eventually, so saying it first. Thought this was a critique piece on Apache Kafka.	pixel_tracing	13.642355	-4.9724755	comment	4.0	11.0	1648961226	10.522234
30873523	Kafka the hypochondriac	Kafka the hypochondriac	lermontov	13.68782	-4.953527	story	4.0	30.0	1648770054	10.582174
31056361	Basically before CDK, this type of o	Basically before CDK, this type of offering made sense but the truth is that AWS correctly identified this need to quickly scaffold infrastructures AND edit it without requiring YAML, Cloudformation or other declarative syntax like Terraform.CDK is literally w	tomatowurst	13.650755	-4.377067	comment	4.0	12.0	1650145435	9.493278
31175498	Unknown Values: The Secret to Terraf	Unknown Values: The Secret to Terraform Plan	sensiquest	13.708374	-4.3837137	story	4.0	35.0	1651025677	9.459534
31478590	I previously used Dokku and I loved 	"I previously used Dokku and I loved how the HTTP proxy was ""automatic"". I've moved past Dokku but don't want the complexity of k8s for a home network. I sort of envisioned a system that could read out running container names and create ""$name.$domain"" proxy en"	Steltek	13.465521	-4.1520796	comment	4.0	12.0	1653311657	-13.499005
31479261	Don't Traefik and Caddy already do e	Don't Traefik and Caddy already do exactly that with their official containers ? What makes NGINX Proxy Manager special in that instance ?	Bayart	13.490331	-4.1470594	comment	4.0	16.5	1653315063	8.809416
31537639	Terraform already has to manage thos	Terraform already has to manage those, and yet worse - Changes to the name of objects within the state were entirely manual until 1.0. Changes to objects underneath terraform often break the connection. Terraform doesn't have good tooling built in to find orph	GauntletWizard	13.714205	-4.391686	comment	4.0	12.0	1653712520	-12.361237
31537717	I'll consider this a variation on mo	I'll consider this a variation on moving state elsewhere.  Now you have to keep the deleted resource forever.  Or keep track of which environments the version with the removal directive is deployed to, or risk having orphaned resources in different environment	aayjaychan	13.453058	-4.26318	comment	4.0	10.5	1653713775	-12.3867655
31539024	I agree that state can be removed in	I agree that state can be removed in Terraform.But I do not believe leveraging tags and/or metadata is the right approach - configuration for these resources could potentially be large (e.g. GKE resources) and most providers will have a size constraint on thei	tomgouder	13.714556	-4.3946056	comment	4.0	12.0	1653731823	-12.384327
31736861	I hate Kafka with a passion. We’re d	I hate Kafka with a passion. We’re driving it with Kafka Streams, and our Streams threads have been blowing up left and right with undecipherable error messages whenever we look at it slightly wrong. We also don’t have the resources to babysit it hourly so her	Hackbraten	13.563193	-4.99227	comment	4.0	15.5	1655202104	-13.16656
28905238	This is exactly how I feel about it.	"This is exactly how I feel about it.A while back I was on team building a non-critical,
low volume application. 
It just involves people sending a message basically.
(there is more too it).The consultants said he had to use Kafka because the messages could com"	ThinkBeat	13.553003	-5.0120006	comment	4.0	12.5	1634563773	-13.076603
28910165	>My answer to anyone who asks for ka	">My answer to anyone who asks for kafka: Show me that you can't do what you need with a beefy Postgres.Sorry thats just a clickbait-y statement. I love Postgres, try handling 100-500k rps of data coming in from various sources reading and writing to it.
You ar"	superyesh	13.554792	-5.00691	comment	4.0	13.5	1634584480	-13.095706
28946035	I was surprised to see that ClickHou	I was surprised to see that ClickHouse and ElasticSearch have the same number of contributors. That's pretty astounding given how much older and more prominent ElasticSearch has been.https://github.com/ClickHouse/ClickHouse/graphs/contributorshttps://github.co	eatonphil	13.506556	-4.6628838	comment	4.0	11.5	1634830684	-9.951867
29005597	Oh boy, I'm an engineer, but I'll do	Oh boy, I'm an engineer, but I'll do my best to pretend I'm on the sales or marketing team for a minute...First of all, CockroachDB Serverless is available on AWS, and should integrate quite well with that ecosystem, including with Serverless functions offered	andydb	13.434992	-4.720312	comment	4.0	10.5	1635278793	9.672602
29063026	Not far off. Having chatted with fri	Not far off. Having chatted with friends from the company, consul failed due to a issue with streaming which was introduced in 1.9 (https://www.hashicorp.com/blog/announcing-hashicorp-consul-1...) which caused it to have massively reduced tps in certain circum	inside_edition	13.613421	-4.506159	comment	4.0	25.5	1635741339	-13.137839
29111937	I feel I need to reply with my thoug	"I feel I need to reply with my thoughts.- Vault is not niche - it’s THE way to manage pki and credentials if you’re half serious about security.
Which is why you’re now are starting to see managed vault.- Consul - EVERYONE should use service discovery, cloud o"	jordanbeiber	13.6095295	-4.309622	comment	4.0	18.5	1636056462	-12.92939
29112923	I have actively used Vagrant, Consul	I have actively used Vagrant, Consul, Terraform, and Vault and I really have never understood all the fanboyism for Hashicorp.  Their products are OK but easily replaceable and often redundant in modern cloud providers.  Wish them luck on their attempt to cash	shironandon	13.718818	-4.357422	comment	4.0	14.0	1636062567	-12.657128
29115486	> Consul - EVERYONE should use servi	> Consul - EVERYONE should use service discovery, cloud or not.Discovery means that you don’t know your service name? Or endpoints? How can one lose his service? Im def missing something :)	nuker	13.624809	-4.5316906	comment	4.0	11.0	1636086802	-13.12133
29299625	Anything more about Kafka you can te	"Anything more about Kafka you can tell us?Seriously, the one time I was in a situation where much of the team seemed hellbent on this ""just put all in Kafka"" idea (without really understanding why, exactly) the arguments they came up with were not too dissimil"	almeria	13.606601	-4.9839535	comment	4.0	17.0	1637528145	10.50937
29301154	I've worked at some places that used	I've worked at some places that used Kafka (including LinkedIn), although I have never been responsible for running the platform itself.  I'll chip in with what I see as the negatives.Kafka sits at roughly the same tier as HTTP, but lacks a lot of the conventi	curryst	13.58039	-4.9932284	comment	4.0	13.5	1637540008	-13.100566
29304117	Any comparisons and/or benchmarks wi	Any comparisons and/or benchmarks with Traefik or NGINX?	DeathArrow	13.436164	-4.213607	comment	4.0	14.0	1637569683	8.892973
29436247	Yeah. There's a lot that Elasticsear	Yeah. There's a lot that Elasticsearch can do. There are libraries and applications that can do bits of what ES can do, but no-one I'm aware of (and I watch this space) is even slightly close to building a genuine replacement (I'm not counting the AWS fork, fo	vosper	13.486511	-4.7511873	comment	4.0	13.5	1638569286	-9.962805
29501299	I've been looking at this for a whil	I've been looking at this for a while now.My company has a need to accurately identify, with high precision, records in elasticsearch, but with a bit more of a semantic match that existing elasticsearch plugins don't support.  Ideally the best of huggingface o	JPKab	13.446435	-4.874849	comment	4.0	11.0	1639075733	-10.019836
29644894	MongoDB Poaches Top Amazon Executive	MongoDB Poaches Top Amazon Executives to Compete with AWS	htrp	13.623508	-4.952038	story	4.0	3.0	1640140132	0.13959475
34319549	On a similar but slightly different 	"On a similar but slightly different topic, I've long wondered why someone hasn't created a ""Universal Terraform Provider"" that can work across the major cloud services. Resources such as ""instance"" and network are pretty general, an while there would definitel"	samcat116	13.650854	-4.3674026	comment	4.0	14.5	1673317328	9.501833
34319600	Handling 100k consumers with one pul	Handling 100k consumers with one pulsar topic	sherlockxu	13.544363	-4.9407043	story	4.0	53.0	1673317533	-13.110581
34342894	Ask HN: How to learn more about serv	Ask HN: How to learn more about servers?	jstx1	13.449829	-4.1646585	story	4.0	8.0	1673463789	8.795666
16827988	I'm not a Kafka user. However, I am 	I'm not a Kafka user. However, I am a long-time keen implementer of event sourcing and log-derived data stores. Many of these involve per-user or per-individual sqlite databases.I cannot understand why Kafka is causing people problems. I am surprised that this	dpwm	13.5298815	-5.009177	comment	5.0	14.5	1523607307	3.7754252
17039173	"""Aurora will try to retain enough lo"	"""Aurora will try to retain enough log information to support that window of time.""It's good to know that Aurora will try.  It's not like it needs to be reliable or anything."	ulkesh	13.468074	-4.7994037	comment	5.0	15.0	1525962915	9.449155
17399024	If you're using Consul for web servi	If you're using Consul for web services, I really recommend the Traefik web server: https://traefik.ioTraefik replaces Nginx: it's the reverse proxy that maps the incoming requests to your various services, which are advertising on some arbitrary localhost por	syllogism	13.48497	-4.2508397	comment	5.0	23.0	1530004772	-12.64791
17508548	Not very related to the article, but	Not very related to the article, but I'd like to get some opinions from HN community (if I may). I've read quite a few books and short stories of Kafka (I think all(?) his novels and some short stories like The Metamorphisis, A Report to an Academy) but most o	gnulinux	13.67561	-4.947818	comment	5.0	13.5	1531329308	10.525495
17639077	What are the downsides for implement	What are the downsides for implementing something like this rather than going for Elastic Search or SOLR?Is it possible to have production-quality search using just postgresql?	aldoushuxley001	13.443402	-5.0190697	comment	5.0	25.0	1532883733	-9.981073
17640742	I just yanked elasticsearch out of a	I just yanked elasticsearch out of an app and replaced it with PG's full text search.It's like shedding a 500# pack from my shoulders. Everything is so much simpler now -- dev is easier, testing is easier, deployment is easier. Infrastructure costs are down.El	deedubaya	13.442117	-4.9264445	comment	5.0	15.0	1532903938	-9.958566
17744207	What I don't like about Terraform is	What I don't like about Terraform is that the state of your resources is stored locally, which might lead to consistency problems depending on your setup. With CloudFormation state is handled by CloudFormation itself, so you can be confident that stack updates	Dunedan	13.677744	-4.383395	comment	5.0	16.0	1534079556	-12.344676
18986090	> Kapacitor is the killer appUm. Yes	> Kapacitor is the killer appUm. Yes. Wait, there are people that use influxdb _without_ kapacitor alerting??? Someone name any commercial or open source equivalent, b/c I'd like to know in case they kill it.	exabrial	13.44828	-4.980137	comment	5.0	14.5	1548305612	10.346849
19283028	100M/year is ~8M/month. Some perspec	"100M/year is ~8M/month. Some perspective on that, it could by you one of:~400PB of data in S3.~2600 bare metal ""x1 type"" ec2 instances running 24/7, 3 year upfront reservation.~60M Write IOPS in dynamodb~300M Read IOPS in dynamodb~3500 16xl RDS aurora instance"	phamilton	13.47838	-4.809619	comment	5.0	70.5	1551460945	9.651407
19360195	This is a very surprising move from 	This is a very surprising move from AWS. In the past they haven't seemed to be willing to contribute to the OSS that they pick up and host. Even though they claim they'll contribute changes upstream, I doubt that Elastic would accept changes that are competiti	pauldix	13.494551	-4.4461894	comment	5.0	19.5	1552321533	-9.852135
19369758	It's interesting that the HN collect	It's interesting that the HN collective results seems to be complaining about the letter from either party.When Amazon wrote their letter, the [HN response](https://news.ycombinator.com/item?id=19363961) seemed to tip towards not liking what Amazon had to say 	jrochkind1	13.459331	-4.3332925	comment	5.0	19.0	1552407421	-5.683558
19701191	> Where elasticsearch shines is in c	"> Where elasticsearch shines is in complex queries ...If the ""Multi-tenant indexing benchmark"" is accurate it seems like it might be a robustness concern for ES.  ""Elasticsearch crashed after 921 indices and just couldn’t cope with this load."" -- does that mea"	wyldfire	13.451855	-4.894344	comment	5.0	14.5	1555693973	-10.015219
19775718	I'm one of the people who'd definite	I'm one of the people who'd definitely use an alternative to ElasticSearch! I hate the fact that elastic search is using Java. It just takes up too much memory.	blacksoil	13.458946	-4.8567495	comment	5.0	12.5	1556510185	-10.008821
37582752	> 1 million a year buys a lot of dev	> 1 million a year buys a lot of development and operationalNot all that much.  At a global enterprise, for instance, that buys a couple senior systems engineers with SDLC experience after you include all the per-employee overhead that doubles their cost beyon	Terretta	13.523474	-4.2692084	comment	5.0	12.5	1695208194	9.403599
37589657	Angie – Drop-In Replacement for Ngin	Angie – Drop-In Replacement for Nginx	IgorPartola	13.430225	-4.216736	story	5.0	90.0	1695241340	8.720323
37647922	The anti-pattern here isn't Kafka, i	The anti-pattern here isn't Kafka, it's using Kafka for 7,500 messages/day.  Making your whole system asynchronous for that level of load is the textbook definition of over-engineering.	davewritescode	13.581517	-4.99899	comment	5.0	18.5	1695664540	-13.118061
37660457	FastStream: Effortless Kafka/RabbitM	FastStream: Effortless Kafka/RabbitMQ Event Stream Integration for Microservices	kumaranvpl	13.479886	-5.0092506	story	5.0	10.0	1695740738	-13.075862
37669078	Why should I care about OpenTofu?	Why should I care about OpenTofu?	RyeCombinator	13.675936	-4.386213	story	5.0	74.0	1695781451	-12.165422
37678182	This is asking for a huge favor, but	This is asking for a huge favor, but can anyone explain to me what Kafka does that RabbitMQ doesn't? Is it just scale?	throw1234651234	13.561076	-4.9922442	comment	5.0	14.0	1695836226	-13.082002
37943342	> We do not recommend build Pulsar f	> We do not recommend build Pulsar from source. Building from source is only necessary if you wish to make modifications. If you want to play with the source code check the Developers section of the documentation.Suspicious.> The recommended approach to gettin	boilermen	13.55033	-4.9316273	comment	5.0	16.5	1697725519	13.318485
37979488	Seems like overkill no? Otel collect	Seems like overkill no? Otel collectors are fairly cheap, why add expensive Kafka into the mix. If you need to buffer why not just dump to s3 or similar data store as a temporary storage array.	bushbaba	13.553316	-5.0002346	comment	5.0	15.5	1698012084	-13.123593
37980118	I expect it would be far cheaper to 	I expect it would be far cheaper to scale up tempo/loki than it would be to even run an idle kafka cluster. This feels like spending thousands of dollars to save tens of dollars.	daurnimator	13.566181	-4.9947143	comment	5.0	12.5	1698018583	-13.125841
38071931	I know of an engineer who built a wo	I know of an engineer who built a work queue by having a chain from an app to kafka to a processor to Kafka to a database writer.Literally instead of a table.This stuff is everywhere. Microservices made it worse and half legitimized it.	foobiekr	13.506047	-5.006008	comment	5.0	14.0	1698684254	-13.089516
38449524	I just noticed Q in the AWS docs and	I just noticed Q in the AWS docs and tried a few test questions, and was not impressed. It refused to answer or misunderstood some basic questions. Eventually I got it to answer how a few short SKs would be ordered in dynamo and the answer it gave was incorrec	rurp	13.465776	-4.515941	comment	5.0	14.0	1701197105	9.698873
33117681	Stateless – Evolving the architectur	Stateless – Evolving the architecture of Elasticsearch to simplify deployment	soheilpro	13.468215	-4.8467445	story	5.0	126.0	1665119643	-9.992214
33316546	While I really like their lightweigh	While I really like their lightweight, SQL-like protocol instead of Elasticsearch's fat JSON, I really think that this project could have much more impact if it could be a drop-in replacement for ES.Even if it offers only a fraction of the features offered by 	blacklight	13.4555435	-4.830001	comment	5.0	19.0	1666619239	-9.935226
33345735	Isn't InfluxDB rewriting their stora	Isn't InfluxDB rewriting their storage engine for the nth time? It makes me have a little less faith in their project to be honest.	_peter_	13.452675	-5.021409	comment	5.0	12.5	1666800277	10.31106
33664211	Ask HN: Does anyone use Terraform to	Ask HN: Does anyone use Terraform to deploy Kubernetes services in a large org?	sandspit	13.66277	-4.398834	story	5.0	10.0	1668813288	-13.478257
35499453	"I'm surprised there isn't a ""serverl"	"I'm surprised there isn't a ""serverless"" PostgreSQL. That seems like it would get more bank for buck then writing a cloud native DB from scratch.(Or maybe there is one but I don't know about it.)AWS made a serverless MySQL."	paulddraper	13.453053	-5.0223665	comment	5.0	13.5	1681005760	9.769365
28111138	Can't Amazon just serve these bogus 	Can't Amazon just serve these bogus headers and keep opensearch compatible? It's not like headers are copyrighted...	catmanjan	13.531293	-4.6376247	comment	5.0	18.0	1628465102	-9.929791
28111249	Amazon could try that, but it wouldn	"Amazon could try that, but it wouldn't stop there. they'd end up in a constant arms race.also, that ""you know, for search"" tagline is featured on t-shirts sold by Elastic [0]. seems entirely plausible to me that Amazon & Elastic lawyers could get into a pissin"	evil-olive	13.527716	-4.54213	comment	5.0	13.0	1628466198	-9.886039
28583774	Terraform can be frustratingly slow 	Terraform can be frustratingly slow at times. You have to realize that at the end of the day, it's an abstraction layer on top of the public APIs of a cloud service. If all your services are hosted on a single cloud, you don't need Terraform.We saw a huge impr	picardo	13.669128	-4.3743734	comment	5.0	14.0	1632054322	-11.766298
28583914	An alternative opinion: When I worke	An alternative opinion: When I worked at a large tech company, my team made a conscious decision to not use terraform. This gave us some key advantages- we are able to adopt new cloud features immediately, months before they were available in tf, and our direc	dharmab	13.62676	-4.351	comment	5.0	18.5	1632055674	-6.584419
12601365	>PS: How is your automated provision	>PS: How is your automated provisioning system reaching your cluster if not by SSH?Not sure about moondev, but Terraform + Cloud-init + Container Orchestrator means that I basically never need to SSH into my nodes, except in extreme/rare circumstances.	colemickens	13.525451	-4.313259	comment	5.0	14.5	1475096687	-13.337301
12624074	It's not that simple.If you're using	It's not that simple.If you're using a secondary data store like Elasticsearch presumably you're combining it with a traditional relational database like Postgres or MySQL. And in most use cases, you're going to require additional constraints on top of full te	r888888888	13.453137	-4.873689	comment	5.0	12.5	1475440226	-9.968422
12955173	What's the performance of Amazon RDS	What's the performance of Amazon RDS like with Postgres? (Curious, never having used it).	thejosh	13.442832	-4.943311	comment	5.0	17.0	1479177348	9.760636
13002530	Kafka: An End or a Beginning?	Kafka: An End or a Beginning?	lermontov	13.658597	-4.9645543	story	5.0	72.0	1479693983	10.552405
13093299	Did Amazon Just Kill Open Source?	Did Amazon Just Kill Open Source?	ktamura	13.441662	-4.319209	story	5.0	14.0	1480722667	-5.835262
27541999	Could be just me. I see Apache kafka	Could be just me. I see Apache kafka more nightmarish than bureaucracy in 'The Castle' or Police/judiciary in 'The Trial' from author Franz Kafka. Mr Franz btw stole his last name from this very famous Apache Kafka project.	geodel	13.675456	-4.9583263	comment	5.0	16.5	1623950250	10.547523
27653030	Not sure why you’d ever do this inst	Not sure why you’d ever do this instead of using terraform.	orf	13.70799	-4.3835936	comment	5.0	20.5	1624812144	9.457681
27777719	You can (and always should) decouple	You can (and always should) decouple the plan and apply steps. For a non terminal approach this can be done by outputting the binary plan to a plan file (with -out=path) and reviewing the plan terminal output which will show all actions Terraform will perform 	aequitas	13.70696	-4.385639	comment	5.0	15.5	1625779014	9.485994
27818229	OpenSearch is the AWS fork of Elasti	OpenSearch is the AWS fork of ElasticSearch prior to the license change aimed at preventing AWS from copying Elastic IP without compensation.	politician	13.518068	-4.640677	comment	5.0	19.0	1626159129	-9.988394
27820490	Not just startups. I  interviewed wi	Not just startups. I  interviewed with a large financial institution recently  and they had their heart set on Kafka. From what I learnt , they did not need Kafka -- the message order was not important, there was only one producer and one consumer and the volu	manishsharan	13.562797	-5.0033584	comment	5.0	24.0	1626181872	10.420393
