id	label	hovertext	author	x	y	type	relevance	size	year	umap1d
17453008	AGPLv3 is the cloud-condom open-sour	AGPLv3 is the cloud-condom open-source licensing model for the future. You are protected from the cloud-providers, who otherwise to monetize open-source projects that enterprise vendors develop. For example, MongoDB got offered money by AWS to include it in Re	jamesblonde	13.462199	-4.7828054	comment	7.0	21.5	1530646409	-12.98245
17744413	Terraform is terrible compared to Cl	Terraform is terrible compared to Cloudformation. Its selling point is multi-cloud support, but you'll never get it, clouds are too different.- Good CF template is 10x less code for the same solution.- No corrupted state problems.- Native tool, supporting all 	auslander	13.670898	-4.3800507	comment	7.0	24.0	1534082917	9.517697
17921362	Slightly off topic: this quote from 	"Slightly off topic: this quote from the SEC filing document:""Immediately prior to the completion of this offering, we intend to change our corporate form from a Dutch private company with limited liability (besloten vennootschap met beperkte aansprakelijkheid)"	tomputer	13.528503	-4.631625	comment	7.0	19.5	1536177370	-9.953745
17922552	I see several responses that mention	I see several responses that mention MongoDB for purposes of comparison and seem to conclude Elasticsearch fares favorably.It should be noted:[1] Unlike MongoDB (which is a ground-up build), Elasticsearch is basically an API layer on top of Apache Lucene. This	burnmaster	13.585963	-4.986056	comment	7.0	19.5	1536188041	9.907323
18344932	TimescaleDB 1.0 Is Production Ready	TimescaleDB 1.0 Is Production Ready	ScottWRobinson	13.450734	-4.989224	story	7.0	47.0	1540987334	9.948956
18562704	Amazon Managed Streaming for Kafka i	Amazon Managed Streaming for Kafka in Public Preview	abd12	13.550934	-4.990878	story	7.0	62.0	1543517427	-13.118335
30174820	Someone needs to make the obligatory	"Someone needs to make the obligatory ""Wordle clone in 50,000 lines of react/java/nosql/docker/terraform/documentation/7GB of unused dependencies"" :)"	jsiaajdsdaa	13.70178	-4.387148	comment	7.0	19.5	1643787326	9.470569
33218430	[Firebase founder]I no longer work a	[Firebase founder]I no longer work at Firebase / Google, but two points:1. There may be issues with the GCP integrations & UX/DX, but GCP integration is good for many customers and necessary for the future of the business.One of the common failure modes for th	jamest	13.432173	-4.825227	comment	7.0	30.5	1665866540	-6.745099
26781452	"From the announcement: ""You should c"	"From the announcement: ""You should consider the initial code to be at an alpha stage — it is not complete, not thoroughly tested, and not suitable for production use. We are planning to release a beta in the next few weeks, and expect it to stabilize and be re"	phd514	13.515949	-4.6408887	comment	7.0	19.0	1618245159	-9.958179
27434695	I strongly agree both with respect f	"I strongly agree both with respect for the half-baked-ness of the language and with the ""it's probably the best out there"". Ultimately, these tools should have a static/yaml-like ""assembly language"" that describes the state of your infrastructure without any o"	throwaway894345	13.67995	-4.4136167	comment	7.0	44.0	1623158017	9.562902
37809721	Homebrew to deprecate and add caveat	Homebrew to deprecate and add caveat for HashiCorp	mooreds	13.724039	-4.372394	story	7.0	262.0	1696766408	-12.515307
38002665	Show HN: Togomak – declarative pipel	Show HN: Togomak – declarative pipeline orchestrator based on HCL and Terraform	srevinsaju	13.691799	-4.3916554	story	7.0	55.0	1698169771	9.517852
15602823	Disclaimer: I'm one of the creators 	Disclaimer: I'm one of the creators of Kafka and founders of ConfluentThe best way to get the power, throughput, latency of Kafka without the operations is to use a hosted service. The one created and supported by the Kafka team is Confluent Cloud https://www.	nehanarkhede	13.568745	-4.999614	comment	7.0	19.0	1509553581	-13.106391
28583803	It's very difficult to communicate w	It's very difficult to communicate what Terraform's strengths and weaknesses are to someone who's never used it or IAC in general.Spend enough time playing with it and understanding it, you'll end up like me thinking about all the shit you configure left and r	scrollaway	13.670386	-4.3701153	comment	7.0	23.5	1632054712	9.526666
28584376	> On terraform it's different, becau	> On terraform it's different, because of the tfstate. All the deployed elements are stored in the tfstate, re-running terraform won't update resources that are supposed to be in a specific state but are not.This is incorrect, and makes me wonder how the autho	snom380	13.709194	-4.392808	comment	7.0	20.0	1632060086	-12.37603
22688199	I know the project doesn't claim it,	I know the project doesn't claim it, but the title somewhat implies this: I honestly don't understand people claiming ElasticSearch is hard to operate, especially not at small scales. If anything, ElasticSearch for me has been one of the easiest pieces of infr	heipei	13.461615	-4.845256	comment	7.0	25.0	1585167952	-9.9783325
22814200	Author here! If you want more, I jus	Author here! If you want more, I just released a book on DynamoDB yesterday --> https://www.dynamodbbook.com/ . There's a launch discount for the next few days.The book is highly recommended by folks at AWS, including Rick Houlihan, the leader of the NoSQL Bla	abd12	13.514623	-4.8004236	comment	7.0	23.0	1586362244	9.683577
23193809	Waves Author here. Happy to answer a	Waves Author here. Happy to answer any questions folks have about the book, about DynamoDB, or about self-publishing.NoSQL modeling is waaay different than relational modeling. I think a lot of NoSQL advice out there is pretty bad, which results in people dism	abd12	13.510855	-4.845287	comment	7.0	21.0	1589558983	9.709566
29347961	Must be something about Kafka to att	Must be something about Kafka to attract these kind of explanations. Another one few months back was a children's book on Kafka [1] . For me it just look like solution looking for actual problems.I wonder if Kafka represents an existential angst in these Kuber	geodel	13.578391	-4.9781613	comment	7.0	37.0	1637908462	-13.136022
29357849	Genuinely interested -- why would I 	Genuinely interested -- why would I choose this over running Terraform as part of CI/CD?	kaidon	13.69757	-4.382221	comment	7.0	23.0	1637992543	9.47892
34716797	Apache Kafka Beyond the Basics: Wind	Apache Kafka Beyond the Basics: Windowing	mooreds	13.581126	-4.9893165	story	7.0	135.0	1675896989	-13.097535
34842977	It would be nice if the Azure and AW	It would be nice if the Azure and AWS Postgres teams could get off their asses and release version 15 already. It has been out for several months now, and crickets.Homebrew too, but at least they have the excuse that it is open source and unfunded.	darksaints	13.50355	-4.9379973	comment	7.0	19.0	1676684423	9.842767
35157379	An important question not mentioned 	An important question not mentioned in this article - and may not have been known by the author - is how much (Dev)Ops burden do each of these add?In the places I've worked that use Kafka, it's 100% always a source of issues and operational headaches.That's in	justinclift	13.570814	-5.0011644	comment	7.0	21.0	1678823568	-13.09756
14099913	The only thing pretty bitter about N	"The only thing pretty bitter about Nginx is that the access to the server status in the open source community edition.You get only so much with ""ngx_http_stub_status_module"" that you have to compile in yourself, as distros don't compile it in:  https://nginx.o"	frik	13.4440155	-4.2134385	comment	7.0	30.5	1492018966	8.762751
14606254	I submitted this article because of 	I submitted this article because of a single paragraph:> When it came to the different types of NoSQL databases, it was pretty clear that a document store best suited our needs. We needed to be able to query based on the data so key/value was out, there was no	orf	13.490716	-4.968553	comment	7.0	28.0	1498067766	9.70994
14617731	Elastic enters Application Performan	Elastic enters Application Performance Management space with Opbeat acquisition	bevacqua	13.4847555	-4.5377226	story	7.0	70.0	1498206230	-9.86844
31231760	AWS RDS Postmortem: Is AWS Collapsin	AWS RDS Postmortem: Is AWS Collapsing Under its Own Weight ?	ruben81adelaide	13.430611	-4.9276085	story	7.0	27.0	1651469793	9.765502
31672063	Facebook's Zookeeper Implementation 	Facebook's Zookeeper Implementation on Delos	somerando7	13.539299	-4.87973	story	7.0	67.0	1654713478	-13.189167
36653399	Show HN: Digger – Open Source Terraf	Show HN: Digger – Open Source Terraform automation and collaboration tool	ujnproduct	13.703653	-4.3812346	story	7.0	91.0	1688899912	9.515647
37082263	HashiCorp adopts the Business Source	HashiCorp adopts the Business Source License for future releases of its products	rmoriz	13.726571	-4.35856	story	7.0	14.0	1691704475	13.27913
37083198	> That's pretty disappointing.From t	> That's pretty disappointing.From the article: “End users can continue to copy, modify, and redistribute the code for all non-commercial and commercial use, except where providing a competitive offering to HashiCorp.”Literally nothing has changed, this isn’t 	randmeerkat	13.719082	-4.3628387	comment	7.0	35.5	1691711147	-12.294059
37135029	I appreciate the letter and trying t	I appreciate the letter and trying to work with Hashicorp -- I used to have a ton of respect for Hashicorp.  But honestly... at this point......just fork it into a foundation.  Don't wait for Hashicorp's response.  I get wanting to have the appearance of worki	dbingham	13.733802	-4.347656	comment	7.0	66.5	1692112655	-12.501719
37138212	If any Hashicorp people are reading,	If any Hashicorp people are reading, can you please tell your middle and senior management that this decision has deeply soured my entire DevOps cohort on continuing to use Terraform in the future.We're already exploring alternatives. Future client projects ma	bloopernova	13.709861	-4.382568	comment	7.0	32.0	1692127633	9.452863
37154490	>Available on GitHub under the Elast	>Available on GitHub under the Elastic v2 license.So... not open source?	Cantinflas	13.496649	-4.524054	comment	7.0	26.5	1692223408	-9.907731
37335061	Not the OP, but I suspect HN has tri	Not the OP, but I suspect HN has trimmed the anchor link.> https://github.com/opentffoundation/roadmap/issues/24#issuec...That's the comment that made the issue clear -- specifically TOS were amended for https://registry.terraform.io to state:> You may downloa	martypitt	13.718084	-4.378756	comment	7.0	22.5	1693478276	-12.383852
37394964	As technical lead for the OpenTF pro	As technical lead for the OpenTF project, how does things like this get merged?https://github.com/opentffoundation/opentf/pull/36/commits	Foxboron	13.687291	-4.380841	comment	7.0	49.5	1693934578	-12.229035
24700370	Is it just me, or is $15/mo for the 	Is it just me, or is $15/mo for the cheapest Postgres-with-backups a bit steep? Heroku's free DBs (or $9/mo basic plan) support daily backups.I've currently got a web app I'm just self-hosting on a DO VPS for $5/month. I have a Postgres DB on the same VPS (via	avolcano	13.436796	-5.053512	comment	7.0	21.0	1602005858	-13.491675
24800294	Situations like this make me wonder 	Situations like this make me wonder why no one has created an open source license with a clause excluding multi billion dollar companies. If your company makes more than, say, $50 billion in revenue per year or something crazy like that, then you need to pay f	bogwog	13.436325	-4.3495617	comment	7.0	23.5	1602852677	-5.762103
25238183	I can't remember which db, but someb	"I can't remember which db, but somebody a while back claimed that one of Amazon's ""infinitely scalable"" dbs was tons of abstraction on top a massive heap of MySQL instances.I don't trust anything outside core services on AWS. Regardless of whether the rumor I "	throwaway189262	13.442406	-4.7667694	comment	7.0	19.0	1606578098	9.615122
32658933	Open source rules the world. A lot o	Open source rules the world. A lot of people use HashiCorp's OSS products; not a lot pay for them. I certainly haven't and I don't think I've ever met a paying Hashicorp customer even though I know lots of people that use their products.They are a consulting b	jillesvangurp	13.657282	-4.314764	comment	7.0	19.5	1661925946	13.311864
32807266	Ask HN: How do you host cheap relati	Ask HN: How do you host cheap relational databases?	wingshayz	13.480735	-4.862952	story	7.0	5.0	1662969066	9.664951
32047245	Amazon Aurora Supports PostgreSQL 14	Amazon Aurora Supports PostgreSQL 14	schranz	13.485088	-4.8990917	story	7.0	98.0	1657476636	9.730101
32399103	Software Engineer at Spacelift[0] he	Software Engineer at Spacelift[0] here - a CI/CD specialized for Infra as Code (including Terraform).A pattern we're seeing increasingly commonly are Platform Engineering teams doing the bulk of the work, including all the fundamentals, guidelines, safety rail	cube2222	13.673994	-4.383209	comment	7.0	27.5	1660057979	9.483599
22268944	Dynamic Route53 records for AWS auto	Dynamic Route53 records for AWS auto scaling groups with Terraform	traxmaxx	13.564013	-4.263924	story	7.0	87.0	1581099382	9.488987
23906556	Really, REALLY tried to love InfluxD	Really, REALLY tried to love InfluxDB. But its systems requirements, performance, and features are poor compared to things like TimescaleDB.	overcast	13.451932	-5.044284	comment	8.0	35.0	1595337370	10.207349
23958286	Works great. You can already find qu	Works great. You can already find questions on Stack Overflow from people getting their database deletedhttps://stackoverflow.com/questions/63067062/elastic-search-...Edit: The person raising that question is working for Atlassian (Jira), looks like Atlassian 	user5994461	13.505451	-4.7697206	comment	8.0	71.0	1595781825	-9.986047
24353412	AWS Tagging Best Practices: Using Te	AWS Tagging Best Practices: Using Terraform and CloudFormation to Enforce Tags	toeknee123	13.580307	-4.307872	story	8.0	63.0	1599055849	9.49509
19987106	I honestly love Terraform as a produ	I honestly love Terraform as a product. It was one of probably three tools I've used in my entire career that made me feel immediately more productive.  After using it for a very short period of time I was shocked developers continued to struggle through CF te	_t0du	13.694673	-4.3874836	comment	8.0	46.5	1558571120	9.481372
19988240	I mean, this is harsh, but there's a	I mean, this is harsh, but there's a running joke that the big feature terraform is missing is a -twice flag so that it'll re-run itself on failure, since that's what you end up having to do anyways.Also, the terraform language, HCL? It's, I guess there's no b	tptacek	13.705792	-4.3969917	comment	8.0	27.0	1558583240	9.509323
20216516	Announcing Timescale Cloud	Announcing Timescale Cloud	bsg75	13.45228	-4.95715	story	8.0	89.0	1560881928	-3.6201684
20276367	What’s New in Apache Kafka 2.3	What’s New in Apache Kafka 2.3	vsyu	13.621229	-4.9773703	story	8.0	53.0	1561482338	-13.10557
20478376	Very much so. For retail/catalog sea	Very much so. For retail/catalog search SOLR dominates. There's a lot more customization available for relevancy/ranking OOB than Elastic. Drawbacks are managing indexing - SOLR cloud is much harder to manage.For commodity search workloads (general retrieval/f	crawdog	13.456163	-4.865715	comment	8.0	25.0	1563542388	-9.974196
39688381	Freenginx: Core Nginx Developer Anno	Freenginx: Core Nginx Developer Announces Fork of Popular Web Server	kungfudoi	13.440884	-4.2160945	story	8.0	123.0	1710307936	8.769105
37036433	I'm Ryan Worl, co-founder and CTO of	I'm Ryan Worl, co-founder and CTO of WarpStream. We're super excited to announce our Developer Preview of our Kafka protocol compatible streaming system built directly on top of S3 with no stateful disks/nodes to run, no rebalancing data, no ZooKeeper, and 5-1	ryanworl	13.537497	-4.990462	comment	8.0	27.5	1691424868	-13.103365
37089192	I know most HN commentators are thin	I know most HN commentators are thinking about Terraform, but I think this change was done with Consul and Vault in mind.Plenty of companies (including my employer) have been building fully monetized software using Consul and Vault under the hood and not payin	alephnerd	13.68929	-4.347908	comment	8.0	43.5	1691764765	-12.388616
37138645	As an end-user, not competing with H	"As an end-user, not competing with HashiCorp, this change doesn't worry me. According to their FAQ [1]:  10. What are the usage limitations for HashiCorp’s products under BSL?
  All non-production uses are permitted. All production uses are allowed other than "	new23d	13.732967	-4.360633	comment	8.0	22.0	1692129805	13.267265
37173304	Terraform is dead; Long live Pulumi?	Terraform is dead; Long live Pulumi?	todsacerdoti	13.692181	-4.3929276	story	8.0	40.0	1692351729	9.535697
24779268	> * Boundary is free and open source	> * Boundary is free and open source. Similar to when we built Vault, we feel like the solution-space for identity-based security is too commercialized. We want to provide access to this type of security to a broader set of people because we feel it's the righ	candiddevmike	13.717284	-4.342917	comment	8.0	26.5	1602696848	-12.18195
25053812	InfluxDB 2.0 Is Out	InfluxDB 2.0 Is Out	samber	13.458551	-5.005721	story	8.0	78.0	1605052791	10.361839
25071502	Migrating Large Heroku Postgres Inst	Migrating Large Heroku Postgres Instances to AWS Aurora Without Downtime	sciguymcq	13.457993	-4.9681044	story	8.0	124.0	1605198449	-13.402379
25276386	AWS Goes After Microsoft’s SQL Serve	AWS Goes After Microsoft’s SQL Server with Babelfish for Aurora PostgreSQL	rsecora	13.486244	-5.048679	story	8.0	32.0	1606917825	9.74649
25288220	Not a surprising result at all. Time	Not a surprising result at all. Timestream is another case of AMS trying to make something for the sake of having it (see here Kinesis instead of just doing Kafka and many other products) instead of just adopting something industry standard. That isn't to say 	jpgvm	13.458464	-5.0430365	comment	8.0	36.5	1606998680	9.8639965
25348584	Alternatively from Jay Krebs [1] a m	"Alternatively from Jay Krebs [1] a much more thorough and nuanced discussion that is probably the best send-up on this topic.""So is it crazy to do this? The answer is no, there’s nothing crazy about storing data in Kafka: it works well for this because it was "	AndrewKemendo	13.552346	-5.005211	comment	8.0	27.0	1607449003	-13.087154
32693122	"i think the branding ""open source Am"	"i think the branding ""open source Amazon"" is just way too ambitious/big. invites a lot of confusion/criticism if Amazon is different things to different people."	swyx	13.442532	-4.30775	comment	8.0	34.5	1662138279	-5.6350226
32361558	Some notes on DynamoDB 2022 paper	Some notes on DynamoDB 2022 paper	c4pt0r	13.508867	-4.8593125	story	8.0	132.0	1659731088	9.673663
32363312	"Here's my notes on DynamoDB:
How to "	"Here's my notes on DynamoDB:
How to spend $100k on what would cost $10k with an sql server for a 100x worse service"	xthrowawayxx	13.490315	-4.8379397	comment	8.0	31.5	1659743511	9.686679
22151449	Aurora is finally ready to show the 	Aurora is finally ready to show the world what it’s been up to	Tomte	13.46446	-4.7724867	story	8.0	70.0	1580035327	8.994126
31271821	I was involved with archiving of dat	I was involved with archiving of data that was legally required to be retained for PSD2 compliance. So it was pretty important that the data was correctly archived, but it was just as important that it was properly removed from other places due to data protect	dkersten	13.69525	-4.3771353	comment	8.0	33.0	1651748616	9.5031185
31537625	Uh, how do you delete resources with	Uh, how do you delete resources with this model?If you don't have any state, and you have an empty module, did you just create it, or did you just remove all the resources from it? The former requires no action, the latter requires API calls to delete somethin	NovemberWhiskey	13.686223	-4.3773346	comment	8.0	38.0	1653712367	-12.40167
31559524	This again...The problems with borin	This again...The problems with boring technology are twofold. One, it's about rejecting newer tech on a bet you don't need their features. And two, it's about choosing older tech because you assume it's good enough for the one year, two year, five year plan. A	jbreckmckye	13.607726	-4.3545876	comment	8.0	31.5	1653921834	-5.368647
31582039	Terraform Labs Caught Moving $4.8M T	Terraform Labs Caught Moving $4.8M Through Shell Company	marban	13.687413	-4.361184	story	8.0	162.0	1654092649	9.365712
25781695	Elasticsearch and Kibana are now bus	Elasticsearch and Kibana are now business risks	vmbrasseur	13.483389	-4.6878185	story	8.0	94.0	1610654567	-9.957369
25834828	I think I have grown a rather hard s	I think I have grown a rather hard stance on this over the years: putting an open source license on a product isn't a business model. It's, by and large, a part of a larger business model.A license is a choice. It means you choose to not gain revenue by direct	CaptArmchair	13.512411	-4.5043635	comment	8.0	49.5	1611072539	-9.886996
25865495	Nothing about the new ES license wou	Nothing about the new ES license would've prevented me from using it for free in the previous places I've used it for free, as far as I can tell.Yet it would've prevented AWS from undercutting their paid offering in the place I'm at now that would rather pay f	majormajor	13.447081	-4.329009	comment	8.0	39.5	1611268640	-9.858519
25932114	> What is “not ok” is the fact that 	> What is “not ok” is the fact that switching to a GPL based license forces projects depending on the code like CrateDB to use a fork since it kills the business model.If your business model cannot survive when a critical upstream piece of your infrastructure 	berkes	13.49898	-4.545468	comment	8.0	38.0	1611773113	-9.92699
26083581	Personally I find this far more worr	"Personally I find this far more worrisome signal of the health of foss ecosystem than the quibbles between elastic and amazon.To me the idea of software ""by hackers for hackers"" and scratching your own itch has always been one of the key attractions in FOSS ec"	zokier	13.498787	-4.442184	comment	8.0	52.5	1612911111	-9.8185625
28780441	I stopped arguing about which is bet	I stopped arguing about which is better CF or TF. Some people go crazy every time this topic is discussed.Me, I just hate all this IAC thing. I spend weeks sometimes to deliver a script that deploys an rds database with blah blah blah. Yeah it is nice to have 	mikesabbagh	13.440448	-4.3954606	comment	8.0	22.0	1633568250	4.401214
29115263	Moving Apollo Federation 2 to the El	Moving Apollo Federation 2 to the Elastic License v2	cjcenizal	13.521188	-4.51304	story	8.0	57.0	1636084496	-9.881307
34339928	Show HN: Tagging Assistant – add AWS	Show HN: Tagging Assistant – add AWS cost allocation tags in your dev pipeline	isemenov	13.57436	-4.30377	story	8.0	38.0	1673453108	9.479204
34531943	Show HN: Precloud – Dynamic tests fo	Show HN: Precloud – Dynamic tests for infrastructure-as-code	safeerm	13.628594	-4.375676	story	8.0	48.0	1674743260	9.518478
35060124	Thanks for sharing this. One of the 	Thanks for sharing this. One of the authors here.We built a service that executes arbitrary user-submitted code. An RCE service. It's the thing you're not supposed to build, but we had to do it.Running arbitrary code means containers weren't a good fit ( conta	adamgordonbell	13.548267	-4.3451843	comment	8.0	32.0	1678218030	9.509759
35157513	I jumped onto https://mqtt.org/ to t	"I jumped onto https://mqtt.org/ to try to answer my usual use-case question about non-Kafka messaging, which is: ""Do the messages get saved anywhere so you can come back and read them later?""  Still not entirely sure about it.But I did see:    This is why MQTT"	mrkeen	13.445816	-4.8979697	comment	8.0	22.0	1678824083	-13.019033
18984764	InfluxDB 2.0 Alpha and the Road Ahea	InfluxDB 2.0 Alpha and the Road Ahead	pauldix	13.459884	-5.0173883	story	8.0	119.0	1548289490	10.386428
19054558	Finding Kafka’s throughput limit in 	Finding Kafka’s throughput limit in Dropbox infrastructure	redm	13.551417	-4.968297	story	8.0	148.0	1549033123	-13.080184
19362978	According to the public statements, 	According to the public statements, F5 is committing to maintain the current level of resources NGINX has allocated to their open source programs, to keep the same dev team involved, to keep licensing as it currently is, not change any of the repositories on M	darksoul	13.457563	-4.2374516	comment	8.0	27.0	1552339516	8.738102
19364273	> Unfortunately, we are seeing other	> Unfortunately, we are seeing other examples where open source maintainers are muddying the waters between the open source community and the proprietary code they create to monetize the open source.As I understand it, Amazon took ElasticSearch and monetized i	weberc2	13.515815	-4.4715676	comment	8.0	36.5	1552350541	-9.839119
19752164	Amazon, the third most valuable comp	Amazon, the third most valuable company on Earth and controlled by Earth's most wealthy human being, cloned an open-source project and then sold access to it. Of course that's allowed under the Apache license, but I'm sure Elastic never saw that one coming. So	zelon88	13.500573	-4.496335	comment	8.0	27.0	1556223769	-9.940633
19927877	Hermes – A message broker built on t	Hermes – A message broker built on top of Kafka	qluml	13.526974	-4.9833426	story	8.0	125.0	1558005159	12.067114
19965110	Security for Elasticsearch is now fr	Security for Elasticsearch is now free	jasondc	13.531185	-4.731766	story	8.0	108.0	1558385825	-9.984497
16405384	Rochefort – Poor Man's Kafka	Rochefort – Poor Man's Kafka	booknomads	13.662451	-4.963997	story	8.0	31.0	1518950138	10.5508585
