id	label	hovertext	author	x	y	type	relevance	size	year	umap1d
33202633	> API that works on localhost: 4 day	> API that works on localhost: 4 daysLol. This may be true but if kind of pointless as an api on localist isn’t very useful unless you’re automating your home. Of course it’s easier to hack something out on localhost than to design for actual users.I think it 	prepend	13.674914	-4.3767495	comment	3.0	11.0	1665750646	9.521245
26641035	Correct; but I've seen many uses of 	Correct; but I've seen many uses of Kafka that NATS could totally be used for. For example, load balancing across subscribers (use a NATS queue instead of a Kafka consumer group).NATS doesn't ever store messages persistently; but this might be fine for your ap	cmckn	13.5309	-4.988822	comment	3.0	11.0	1617141075	-13.13053
26642170	Is there any message ordering guaran	Is there any message ordering guarantee in NATS? With Kafka you can achieve this by using keyed message and messages in the same partition will always be orderedDisclosure: I work for Confluent	gantengx	13.508761	-4.983877	comment	3.0	11.0	1617150338	-13.069212
26642297	Reminded me of this project: https:/	Reminded me of this project: https://github.com/travisjeffery/jockoKafka implemented in Go without needing Zookeeper.	didip	13.571008	-4.873087	comment	3.0	11.5	1617151429	-13.195532
26641046	You can tune Kafka down fairly well 	You can tune Kafka down fairly well if you know what you're doing, but it's not optimised for that OOTB. Or just use Confluent Cloud, which is fully managed and scales down as low as you want (costs cents per Gb). Disclosure: work for Confluent.	math	13.57472	-4.9947133	comment	3.0	10.5	1617141170	-13.115185
26783074	Will be interesting to see the resou	Will be interesting to see the resources that AWS will throw at this.  You can get a sense of the resource that elastic.co is throwing at elasticsearch athttps://public-001.gitsense.com/insights/github/repos?r=gith...I'm currently indexing the fork, so in abou	sdesol	13.511001	-4.6186767	comment	3.0	12.5	1618251736	-9.943249
26785271	The value in the market is the subje	The value in the market is the subject of the parent thread. Anyways, like I said, Elastic could've made money with a proprietary product but they chose OSS instead (and used Apache Lucene to build on).AWS is just offering customers what they want and there ar	manigandham	13.478455	-4.42425	comment	3.0	16.0	1618262015	-9.837599
26812094	Someone not in our team upgraded ver	Someone not in our team upgraded version by mistake from 0.12 to 0.13 (he was contributing something small and used the latest), the CTO got involved and made us update everything and it was a big undertaking.Personally I have a nix shell file pinned to the ex	jokethrowaway	13.710251	-4.3885684	comment	3.0	11.0	1618429510	9.456723
26812721	Have you ever set something up manua	Have you ever set something up manually via AWS console, then 6 months later totally forgot the steps you took and end up wasting a lot of time reverse engineering what you did in order to make a comparatively small change?After that perhaps you vowed to take 	dasil003	13.568101	-4.3434134	comment	3.0	13.5	1618432612	9.529856
26815201	The jump from what you mentioned in 	The jump from what you mentioned in paragraph 2 to 3 is not necessarily Terraform. You can use other tools, like Ansible, that IMO have a much better framework than Terraform. I use Terraform for extremely simple stuff that is easy to destroy/recreate. Project	aprdm	13.693143	-4.397012	comment	3.0	12.0	1618450086	9.50397
37581811	It's a nice pun and at the same time	It's a nice pun and at the same time is close to the original, which would help Terraform users recognize the brand. Your suggestions are nice, but less recognizable in that way.Maybe we can take that pun to extreme though! If they ever have a designer that ca	notpushkin	13.709245	-4.3884964	comment	3.0	10.5	1695198491	9.507548
37582095	The link and github does not tell mu	The link and github does not tell much what OpenTofu is. So I opened the official website. Again very hard to find out what it actually is. Goals and why it was created, and a hundred times that it's a fork of another product.But still does not explain what it	Mashimo	13.6761875	-4.380347	comment	3.0	13.5	1695201076	-12.173852
37582292	I generally like your takes but this	I generally like your takes but this one isn't very good since it wasn't Amazon that was the threat.HashiCorp couldn't compete. Their enterprise offerings were bad and their price quotes were insane and unrealistic. I worked at two companies who rejected them 	emptysongglass	13.726156	-4.3525877	comment	3.0	12.0	1695203295	-12.529883
37584319	I believe Dave McJannet, HashiCorp's	I believe Dave McJannet, HashiCorp's CEO, should be concerned. OpenTofu has garnered massive support, with the project gaining admission to the Linux Foundation and even receiving public support from companies like Allianz. Within HashiCorp, the CEO has foster	cloudbrewer	13.758403	-4.3131733	comment	3.0	12.5	1695218847	-12.421692
37589123	> 3) Switch out log4j for Kafka, whi	> 3) Switch out log4j for Kafka, which will handle the persistence & multiplexing for you.I don't think this is a reasonable statement. There are already a few logging agents that support structured logging without dragging in heavyweight dependencies such as 	rewmie	13.512919	-4.9886265	comment	3.0	11.0	1695239225	-13.138659
37614376	> When you put your data right next 	> When you put your data right next to your application, you can see per-query latency drop to 10-20 microseconds. That’s micro, with a μ. A 50-100x improvement over an intra-region Postgres query.Why compare the latency of a remote Postgres database with a lo	kijin	13.42867	-5.0355725	comment	3.0	10.5	1695401460	9.76304
37639035	> Anything but RabbitMQ.Would you mi	> Anything but RabbitMQ.Would you mind elaborating on this? I'd be happy for others to chime in with their experiences/opinions, too.	reubenbond	13.439858	-4.990656	comment	3.0	13.0	1695608693	-13.000689
37648051	>small scale kafka, though. It's con	>small scale kafka, though. It's conceptually great to have everything work off of logs, but kafka does add a non trivial operational burden.does something like that exist ???	imachine1980_	13.548749	-4.985747	comment	3.0	10.5	1695665053	-13.096441
37596439	Community Growth At: HashiCorp	Community Growth At: HashiCorp	GarethX	13.7371	-4.3524184	story	3.0	14.0	1695298133	-12.498937
37676585	Coincidentally, as someone who worke	Coincidentally, as someone who worked on this blog, I was surprised (and pleased!) to see that we are not the only ones who felt the need to build a Zookeeper alternative.Looks like folks at StreamNative did as well, with their Oxia project: https://github.com	tbragin	13.560916	-4.869837	comment	3.0	17.5	1695830163	-13.18654
37809947	If you wanted to store the state in 	If you wanted to store the state in Git, you would probably want to at least encrypt secrets. This is not something that Terraform supports now (theory is that this is to push their commercial offering) but it’s one of the main feature requests for OpenTofu.Wi	fishnchips	13.713118	-4.384453	comment	3.0	11.0	1696769009	9.469877
37810990	Much as I love the service homebrew 	Much as I love the service homebrew provides, terraform is one of the edge cases that is better being managed outside of brew. I believe tf-switch is now the most popular option?The problem with Terraform is that you often need a pinned version because acciden	hnlmorg	13.699443	-4.391777	comment	3.0	12.0	1696776721	9.525064
37848078	Not pictured: the cost of switching 	Not pictured: the cost of switching to DynamoDB when this service inevitably gets shut down in two years.	andrewedstrom	13.505049	-4.8312893	comment	3.0	13.0	1697047704	9.599404
37849474	From the AWS blog post they referenc	From the AWS blog post they referenced-> DynamoDB powers multiple high-traffic Amazon properties and systems including Alexa, the Amazon.com sites, and all Amazon fulfillment centers. Over the course of Prime Day, these sources made trillions of calls to the D	tedivm	13.485086	-4.7499857	comment	3.0	14.0	1697054162	9.661424
37849654	I used DynamoDB as part of the job a	I used DynamoDB as part of the job a few years ago and never got single-millisecond responses - it was 20ms minimum and 70+ on a cold-start, but I can accept that optimising Dynamo's various indexes is a largely opaque process. We had to add on hacks like sett	ljm	13.498134	-4.8414845	comment	3.0	11.0	1697055005	9.702036
14723258	The gist of this seems to be that Dy	The gist of this seems to be that DynamoDB becomes a problem if you have millions of customers.Don't worry. You don't. And there will be many good reasons to refactor the architecture before you do.	nikanj	13.501276	-4.860134	comment	3.0	13.0	1499472290	9.671803
14723410	I don't know what the article author	I don't know what the article author is storing, but it's noted that 10GB of data is stored per node. That's quite a bit of data for a single table, and the 10GB is per shard of a table, not per 'database' (DynamoDB only has a notion of tables).Amazon has deep	windlep	13.504544	-4.896968	comment	3.0	15.0	1499474733	9.6957
14723834	Many of the comments here are saying	Many of the comments here are saying that the author's use-case wasn't a good one for DynamoDB. Can anyone share some simple approachable resources that talk about the kinds of use-cases where these tools make sense?Whenever I read about NoSQL systems, I'm alw	TheAceOfHearts	13.4976225	-4.985137	comment	3.0	12.0	1499482946	9.778792
14741428	Has anyone used RDS from lambda? Don	Has anyone used RDS from lambda? Don't want to use Dynamo but perhaps for some key Val store.	buckbova	13.433952	-4.7147613	comment	3.0	11.5	1499744695	9.688722
14801029	Apache Pulsar (Incubating)	Apache Pulsar (Incubating)	mmerli	13.558246	-4.948058	story	3.0	28.0	1500421839	-13.116535
12773784	I'm no consul expert, but their only	"I'm no consul expert, but their only problem i've seen right now is the fact that ID is bound to an IP and that this IP is taken from the first network interface.I hope they can move to GUIDs or some other solution soon and facilitate consul's use in ""dynamic"""	RRRA	13.623714	-4.5276494	comment	3.0	10.5	1477234208	-13.1446295
12774297	(Aside from the issues with reason #	"(Aside from the issues with reason #1 for not using consul noted below...)The author says that Atlas is essentially ""required"" for bootstrapping. We simply use our cloud provider's ""list-instances"" command (with a filter) so that we don't rely on any third-par"	zbjornson	13.513742	-4.711524	comment	3.0	10.5	1477241972	4.4479628
27586160	A Public Registry for AWS CloudForma	A Public Registry for AWS CloudFormation	gmays	13.488169	-4.271015	story	3.0	65.0	1624319972	9.471125
27777629	We had the same issue with DynamoDB,	We had the same issue with DynamoDB, that Terraform is all to happy to delete a table it deems acceptable to delete.  Which in 99 out of 100 cases is never the case.  It is a very aggressive IaC tool.	bwship	13.528358	-4.2776875	comment	3.0	10.5	1625778460	9.31339
27777761	Doesn’t terraform show you how many 	Doesn’t terraform show you how many resources are affected and require you to approve that when running apply?	camjohnson26	13.71204	-4.3776236	comment	3.0	10.5	1625779302	9.497658
27795054	This is a good paper that talks abou	This is a good paper that talks about Aurora and provides some insight into how RDS operates: https://www.allthingsdistributed.com/files/p1041-verbitski.p...It’s nice that AWS builds their own higher level abstractions on the same primitives outside developers	ec109685	13.439817	-4.7322283	comment	3.0	12.5	1625938601	9.662634
35357946	Hugely disappointed by Alloydb. Pric	Hugely disappointed by Alloydb. Price and performance for a write heavy workload where off the charts horrible. It didn’t even support disabling an instance and it did only storage autoscaling much worse overall experience than using Aurora we moved back to cl	lysecret	13.48373	-4.9598393	comment	3.0	13.0	1680100764	9.665215
35369524	Meilisearch vs. Elasticsearch	Meilisearch vs. Elasticsearch	CaroFG	13.447528	-4.8892713	story	3.0	11.0	1680163407	-9.977192
22351734	This is true to some extent. I'm bui	This is true to some extent. I'm building out the infrastructure for my company, and there is a lot of effort on my part required to automate stuff.Something like kafka requires figuring out the configuration you want, putting that into Salt, adding the correc	lykr0n	13.585813	-4.37669	comment	3.0	12.5	1581980222	-13.1996565
22601426	What is the purpose of Vault if you’	What is the purpose of Vault if you’re already on AWS?Even though I prefer CloudFormation, Terraform is quite popular. As far as Consul and Nomad, they are both nice for on prem infrastructure - I’ve used both - but once you’re on either AWS or Azure, the nati	scarface74	13.567117	-4.2062607	comment	3.0	13.0	1584416650	-12.513995
15185450	>We need the log to retain all event	">We need the log to retain all events forever, otherwise it is not possible to recreate a data store from scratch.SIGH. Cue the facepalm, head in hands, etc.I'm not going to get into a big thing here. But if you find yourself saying ""I need to keep this thing "	cookiecaper	13.528887	-5.009826	comment	3.0	24.0	1504718828	-13.075149
15185652	From what I can tell, Kafka isn't de	"From what I can tell, Kafka isn't designed for long term data storage. RDBMS systems are designed for this.Kafka is more for streaming data and events, so I'd probably be uncomfortable assuming that it won't do something and ""tidy up"" my very old data at some "	scaryclam	13.543624	-5.0290313	comment	3.0	13.5	1504720292	-13.080881
15185888	This is a flawed architecture. It wi	This is a flawed architecture. It will work at release, but it will be difficult to manoeuvre with, and they will grow to hate it.As your business changes, your data changes. Imagine if on day one, they had one author per article. On day 1000, they change this	cturner	13.556318	-5.002503	comment	3.0	12.5	1504722048	-13.085108
15346247	Yes, they have the same features mos	Yes, they have the same features mostly.The difference is that HAProxy has a monitoring page to see what is configured and where connections are going. Nginx is a black box unless you pay them ~ $2000 for the pro edition.Monitoring is feature #1 of a load bala	user5994461	13.469859	-4.171724	comment	3.0	12.5	1506506192	8.797973
15358895	Looks like both HAProxy and Nginx ar	"Looks like both HAProxy and Nginx are going down the ""pay for more advanced features"" route:https://www.haproxy.com/products/haproxy-enterprise-edition/https://www.nginx.com/products/nginx/"	otterley	13.498868	-4.1597676	comment	3.0	15.5	1506618619	8.760585
15385588	Under what circumstances would one p	Under what circumstances would one prefer Redis streams over Kafka and vice versa?	hyades	13.51026	-5.006554	comment	3.0	12.0	1506963611	-13.081263
15389398	Anything that can go to dynamo, can 	Anything that can go to dynamo, can go to s3, especially at that volume. And you get proper multi region replication, read/write capacity based on actual usage and instant scaling.I stay by my comment that dynamodb is a joke wrapped in thick layer of marketing	sheeshkebab	13.453595	-4.783918	comment	3.0	10.5	1506994357	9.640217
15410674	I've been working mostly with Elasti	I've been working mostly with Elasticsearch for the past couple of years, but I have to admit I'm deeply impressed with the results I got out of PostgreSQL after only a few hours of hacking. Elasticsearch is far more flexible and powerful but for smaller, simp	simonw	13.448396	-4.9466457	comment	3.0	12.5	1507222625	-9.970095
15546469	Aurora is very interesting especiall	Aurora is very interesting especially in terms of removing storage management from the equation. I just wish they (and the regular postgres RDS offering) had support for TimescaleDB (http://www.timescale.com).	scrollaway	13.489966	-4.9661655	comment	3.0	10.5	1508892415	9.850464
15546550	I ran the preview for ~2 months on a	I ran the preview for ~2 months on a few instances.  No compatibility issues, but we had queries that were significantly slower than on a vanilla Postgres instance and a problem with temp table bloat that never got reclaimed (480G as per \l+, being shown as 10	nmilford	13.459983	-4.925499	comment	3.0	10.5	1508893673	9.769578
15699237	Cross data center replication is rea	Cross data center replication is really a much needed feature.The way Elasticsearch is going though looks promising. With sorted indices, single mapping type and the other changes we might give it another try after switching to Algolia.Is there a safe way now 	naiv	13.4531975	-4.8285823	comment	3.0	11.0	1510694423	-9.954046
38013714	Using the FDAP Architecture to Build	Using the FDAP Architecture to Build InfluxDB 3.0: Flight, DataFusion, Arrow	treesciencebot	13.455169	-5.0094514	story	3.0	31.0	1698247030	-5.4623027
38023896	how do y'all look at systems like AW	how do y'all look at systems like AWS Aurora, GCP Spanner, etc which offer big speedups and cost savings, but lock you into the platform in practice?this isn't academic for me - I've got a service that's on vanilla RDS PostgreSQL but growing fast, and I'll soo	asah	13.447665	-4.913194	comment	3.0	17.0	1698317113	9.730672
38029609	Linux Foundation Adopting Terraform 	Linux Foundation Adopting Terraform Fork Provokes Ire of HashiCorp CEO	thunderbong	13.738777	-4.383338	story	3.0	17.0	1698344250	-12.420484
38447720	This sounds very exciting, but I wou	This sounds very exciting, but I would have greatly appreciated some actual technical details. From this statement> Sharded tables – These tables are distributed across multiple shards. Data is split among the shards based on the values of designated columns i	dkhenry	13.473474	-5.0635695	comment	3.0	12.5	1701189774	9.678896
38447982	Aurora Limitless Database is based o	Aurora Limitless Database is based on our own investments in database-optimized virtualization (Caspian), in scale-out log-first database storage (Grover)[2], and in a custom approach to cross-shard transactions that makes use of the high-quality hardware cloc	mjb	13.465729	-4.8629613	comment	3.0	11.0	1701191085	9.692799
27183853	When I proposed to use RabbitMQ for 	"When I proposed to use RabbitMQ for service integration my colleagues didn't agree to go with it because it ""won't scale"" and AWS doesn't provide a managed service. Because of an AWS fetish and awful development experience the product won't launch anytime soon"	nesarkvechnep	13.431256	-4.974188	comment	3.0	10.5	1621261895	-13.050186
27434586	People mention pulumi but hashicorp 	People mention pulumi but hashicorp are creating something similar with https://github.com/hashicorp/terraform-cdk. But all the existing terraform providers work with it afaik.	granra	13.68232	-4.3981075	comment	3.0	14.0	1623157379	9.508557
27434790	I don't know if people have even tri	I don't know if people have even tried Pulumi before recommending it.I've tried it, and it has buggy defaults, diff generation, etc.  Each time I applied the same code, it would generate a diff based off of some internal defaults and... recreate the exact same	tonyhb	13.636093	-4.4120364	comment	3.0	12.5	1623158523	9.587691
27434899	How does terraform compare to ansibl	How does terraform compare to ansible?	syntaxstic	13.691745	-4.410352	comment	3.0	12.0	1623159034	9.510433
33491074	Yes. CDK is just another way of expr	Yes. CDK is just another way of expressing the same things as terraform and cloudfront but using a framework which is opaque. Plus it's slow as fuck, buggy and difficult to debug when it goes wrong.Every attempt keeps trying to solve the same problems with a n	gw98	13.640953	-4.3726964	comment	3.0	10.5	1667730083	9.49809
33571832	What is the difference between this,	What is the difference between this, terraluna earlier this year or MTGox?	rvba	13.701098	-4.3845973	comment	3.0	12.0	1668249024	9.4480505
33808427	> we’re good at consulThank god some	> we’re good at consulThank god someone is.  I’ve lost more of my life to consul partition failures that’s any other part of the nutech stack.	asguy	13.629374	-4.530998	comment	3.0	11.0	1669845536	-13.143331
33849149	.NET open source is 'heavily under-f	.NET open source is 'heavily under-funded' says AWS	delta_p_delta_x	13.4512	-4.3192735	story	3.0	11.0	1670114153	-5.8840585
33897124	It's also a really nice combo for si	It's also a really nice combo for simple automation lambdas that need some state and you want an ergonomic DB without paying for full RDS.Go + Lambda + EFS + SQLite work great for that.	cube2222	13.441875	-4.770769	comment	3.0	11.0	1670433634	9.68689
34103465	I had heard no shortage of warnings 	I had heard no shortage of warnings against using Lucene/elasticsearch to host my own basic search. But it was incredibly easy to implement and about as painless as running an apache server. For a self hosted project I can recommend it. Is it Algolia? No. Did 	ehnto	13.432039	-4.8466067	comment	3.0	10.5	1671783610	3.6989815
22671152	> firebase at google is doing extrem	> firebase at google is doing extremely wellSource?It's certainly popular but everyone I know (me included) is running away from it asap.	pier25	13.453035	-4.8047113	comment	3.0	17.0	1585015906	-6.714978
22748734	Apache Kafka: Life after the honeymo	Apache Kafka: Life after the honeymoon period	lensesio	13.629283	-4.9789863	story	3.0	31.0	1585750837	10.55262
17898247	He mentions DynamoDB for the data la	He mentions DynamoDB for the data layer instead of regular RDBMS. I have tried to use DynamoDB several times but have been disappointed with it. I am not saying traditional RDBMSs solve the problem that DynamoDB has, but even DynamoDB is a poor fit for systems	actuator	13.493764	-4.8586574	comment	3.0	13.0	1535917149	9.679914
17898393	So why is rdbms and serverless seemi	So why is rdbms and serverless seemingly mutually exclusive? Are rdbms queries really that slow compared to something like dynamodb?	travbrack	13.447082	-4.992011	comment	3.0	15.5	1535918887	9.70161
17976709	Those are streaming/pubsub services 	Those are streaming/pubsub services though, this actually claims to be a store. I feel that's an important difference.Do people just point their system journal at Kafka and wait for something to break?At my previous job we built something similar to this out o	tinco	13.5286	-5.0097094	comment	3.0	12.5	1536823553	-13.059758
18992097	Amazon Aurora doesn't have much to d	Amazon Aurora doesn't have much to do with Postgres and is a custom storage subsystem used by many different database engines. Aurora Postgres is actually using Postgres code on top to handle queries, and eventually PG itself will get pluggable storage engines	manigandham	13.55425	-5.0232754	comment	3.0	14.0	1548358514	9.755286
18983040	Running Fast SQL on DynamoDB Tables	Running Fast SQL on DynamoDB Tables	vahidfazelrezai	13.503874	-4.852494	story	3.0	40.0	1548278102	9.640203
19082892	OK. So you connect to Postgres on RD	OK. So you connect to Postgres on RDS - cloud agnostic.You connect to S3, and:a) You can build an abstraction service if you care about vendor lock-in so muchb) It has an API that plenty of open source projects are compatible with (I believe Google's storage i	staticassertion	13.434924	-4.6700654	comment	3.0	17.5	1549338481	9.584658
19159333	Tell that to AWS. They've banned rel	Tell that to AWS. They've banned relational databases for specific workloads because Dynamo (nosql) provides more consistent performance, and is easier to operate.Tons of conflation of Mongo's problems with those of nosql in this thread.	staticassertion	13.554339	-5.0346203	comment	3.0	11.5	1550114068	9.837667
15808317	Amazon DynamoDB Update – Global Tabl	Amazon DynamoDB Update – Global Tables and On-Demand Backup	polmolea	13.498274	-4.846294	story	3.0	102.0	1511974356	9.692192
21044247	Show HN: I Made a Terraform Crash Co	Show HN: I Made a Terraform Crash Course	movedx	13.716434	-4.3884034	story	3.0	59.0	1569189644	9.4876795
22867289	I have been wanting to try Pulumi ou	I have been wanting to try Pulumi out for a while. As an avid terraform user, I welcome the ability to use a proper language instead of the declarative HCL. For those who have migrated from terraform -> Pulumi, what are the biggest cons you've experienced?	dcardoza	13.681506	-4.409129	comment	3.0	42.5	1586878735	9.499439
22984262	Most of the time when I see more com	Most of the time when I see more complication on top of cloudformation, what you really want is terraform.	booi	13.615215	-4.3392897	comment	3.0	10.5	1587873321	9.548084
22992083	I hate to defend Amazon, but it seem	I hate to defend Amazon, but it seems that they do contribute back to open source:https://aws.amazon.com/opensource/For example running `git shortlog -ne` in the Linux kernel git repository will show a number of Amazon folks with many commits to their name.	pabs3	13.455114	-4.3208075	comment	3.0	13.5	1587951389	-5.860765
23005521	Ansible has full integration with cl	Ansible has full integration with cloud providers API. It's actually better for managing instances and highly dynamic resources because it has much better state management than Terraform.If you (re)create some EC2 instances with Terraform. Terraform save the I	user5994461	13.708622	-4.4004345	comment	3.0	11.5	1588069420	9.558918
23010474	Author here. I started Liftbridge af	Author here. I started Liftbridge after working as a core committer on NATS and NATS Streaming (as well as my experience using Kafka in the past). In particular, implementing replication in NATS Streaming and drawing from that experience/lessons learned. Happy	tylertreat	13.562211	-4.8979874	comment	3.0	11.5	1588100234	-13.407695
