id	x	y	type	relevance	size	year	umap1d	hovertext	url	author
36304871	13.649262	-4.372616	comment	6.0	16.5	1686627351	9.4917965	"Honest question, if you're locked in to AWS why not just use the CDK?I've used Terraform and Pulumi in the past and the ""platform agnostic"" is only true for trivial builds. Once you get into medium si..."		irjustin
36476078	13.693365	-4.412594	comment	6.0	21.5	1687757872	9.550334	I would phrase almost the same idea from the opposite angle: focus on the fundamentals that never change, and view the trends in terms of how they relate to those fundamentals.But also, those are some...		andrewflnr
29063048	13.691838	-4.4024634	comment	6.0	23.0	1635741589	-13.013119	As someone not familiar with HashiCorp's products, could you give a super high level overview of what consul, vault and nomad are?		ZephyrBlu
29063314	13.629322	-4.5224247	comment	6.0	16.0	1635744826	-13.190681	> Consul is a service mesh. It’s your dynamic service discovery and routing layer.How does this differ from DNS?		colordrops
29063633	13.618131	-4.521245	comment	6.0	21.5	1635748375	-13.163349	My guess is Consul shit itself. It works until it doesn't.For now I prefer Zookeeper because at-least I have experienced most of it's failure modes. i.e they are probably all prone to blowing up but I...		jpgvm
29080562	13.434215	-4.305883	comment	6.0	18.0	1635858120	-5.781278	Amazon violating open source agreements to host their own version of the product and squeeze the life out of the original company? Not a peep.People whose political opinions differ from my own use the software? This must be stopped at once.		JohnWhigham
29399811	13.573408	-4.9853663	comment	6.0	18.0	1638324160	-13.131429	Based on our experience with Apache Kafka and alternative streaming systems, Apache Pulsar natively addresses the Honeycomb's needs.- Decoupling of Broker & Storage Layer- Tierered Storage (SSD, HDD, ...		krnaveen14
29448084	13.437869	-4.226357	comment	6.0	18.0	1638698392	8.696391	Here in Russia Rambler tried to do the same with nginx, and they failed to achieve their goals. I don't know, it creates nothing but bad publicity without giving anything in return considering they wo...		kgeist
29600118	13.574413	-4.975844	comment	6.0	29.5	1639787509	-13.107467	Such a server is 400$/mo, a backend developer that can confidently maintain kafka in production is significantly more expensive!		colinchartier
34515673	13.469467	-4.863023	comment	6.0	15.5	1674633923	-9.982573	What do people go for these days? I am working at a startup, and I need to pick either OpenSearch or Elasticsearch. So far I've concluded with that Solr is not that good in a cluster setup. The last o...		olavgg
34741431	13.433381	-4.8908105	comment	6.0	19.5	1676044898	-9.942409	Related: Meilisearch v1.0.0 release two days ago: https://news.ycombinator.com/item?id=34707727I have been following these two libraries (Manticore and Meilisearch) very closely. Their simplicity, por...		AlexAltea
37240673	13.675622	-4.3756757	comment	6.0	16.0	1692817338	9.527259	Didn’t Pulumi accelerate its adoption by the use of Hashicorp terraform providers? Didn’t AWS use elastic search for free then fork when the license changed? I think there are a lot of challenges arou...		SirensOfTitan
37262792	13.664549	-4.3746643	comment	6.0	34.0	1692977231	-12.213884	"> We completed all documents required for OpenTF to become part of the Linux Foundation with the end goal of having OpenTF as part of Cloud Native Computing FoundationImho the best possible choice, and one that was easy to see coming when they announced they were joining ""an existing foundation""."		mkl95
37262833	13.50724	-4.5165906	comment	6.0	31.0	1692977430	-9.874178	I am seeing parallels to the Amazon vs. ElasticSearch fiasco.Also interesting to mention that they haven't said a single word about CLAs. If this project would require a CLA (and copyright assignment)...		Pannoniae
37321846	13.56502	-4.9933243	comment	6.0	15.0	1693402142	-13.309192	The standard fix for this is to put the devs on call.Recurring operational issues get fixed mighty quickly when J. Dev has to wake up a few times at 02:00 on Saturday.Heck, design and architectural is...		oblio
37333232	13.6470585	-4.366099	comment	6.0	19.0	1693463322	-12.433452	Because it was libre, or because it was (is) gratis?I know that I downloaded and learned Terraform because it was free of charge only. I honestly didn't care and I didn't know about its specific licen...		NoZebra120vClip
37398618	13.682975	-4.379988	comment	6.0	34.0	1693952597	-12.388246	This is probably going to get a lot flake but what did we expect when big tech started eating up open source solutions and competing with the companies who started the work . MongoDB and AWS is a good...		gobins
37576077	13.503885	-4.998614	comment	6.0	30.5	1695155411	-13.080237	> one is a message broker, and the other is a distributed streaming platformI think this is an odd way of putting it. One is smart messaging; dumb clients. The other is dumb messaging; smart clients. ...		robertlagrant
24432068	13.674624	-4.9641423	comment	6.0	16.5	1599743975	10.553111	Video game advertisement disguised as hacker news post.>As much as I enjoyed my time with “Metamorphosis,” I should note that its stiff character animations make the human characters look like eerie-l...		xamuel
24746160	13.660974	-4.9672694	story	6.0	86.0	1602427795	10.547086	Kafka in Pieces	https://thebaffler.com/latest/kafka-in-pieces-goldman	apollinaire
25118349	13.480765	-4.9320107	comment	6.0	15.5	1605568671	9.725831	Meanwhile, AWS Aurora is still on Postgres 11. Postgres 12 is more than a year old.I've been using Aurora because it's managed, I don't have to worry about backups, it's faster and cheaper and easier ...		ccleve
32573098	13.44488	-4.228578	comment	6.0	18.5	1661298109	8.80807	As long as Dynamic Configuration is locked behind an nginx plus-only API, these are hollow words.This is a must have feature for todays workloads (kubernetes or just very busy webservers) in productio...		cypres
32654039	13.654168	-4.4209957	comment	6.0	21.0	1661887633	9.500954	Hi all, creator of D2 here. I posted this on Reddit to get some feedback but was hoping to improve the docs and offer a playground environment before posting on HackerNews. Ah well. I wanted to clarif...		alixanderwang
32866365	13.488848	-4.16043	comment	6.0	34.5	1663338023	8.73707	I feel like we never see HAProxy in these reverse proxy comparisons. Lots of nginx, Apache, Caddy, Traefik, Envoy, etc.The HAProxy configuration is just as simple as Caddy for a reverse proxy setup. I...		gordian_NOT
32089573	13.43306	-4.992147	comment	6.0	20.5	1657751654	-13.01683	"If I had to nominate a piece of software, as an SRE, that is as close to ""set and forget"" as possible, it'd absolutely be RabbitMQ standalone and a close runner up would be its clustered form.I've wor..."		kungfufrog
22277108	13.668812	-4.376396	comment	6.0	17.0	1581183804	9.51888	I seem to spend far more time on the deployment of code than I ever used to, more time writing CloudFormation and ansible than the Java backend, python lambdas and static UI that it deploys.That seems...		cs02rm0
23611791	13.681056	-4.9451947	comment	7.0	18.0	1592905787	10.530011	For anyone that doesn’t quite ‘get’ Kafka: I recommend his short stories and aphorisms over his novels. Metamorphosis and The Castle never quite did much for me, whereas The Great Wall of China or In the Penal Colony are some of my favorites.		ceilingcorner
23789119	13.572848	-4.969139	comment	7.0	22.0	1594366877	-13.10423	Can anyone share their thoughts on whether, in case of a new project is it worth to start with Pulsar instead of Kafka as a distributed log/pub sub solution with guaranteed delivery? I heard a lot of ...		polskibus
20056058	13.44954	-4.744506	story	7.0	83.0	1559251532	9.66777	Data API for Amazon Aurora Serverless	https://aws.amazon.com/blogs/aws/new-data-api-for-amazon-aurora-serverless/	vincentdm
20545896	13.645919	-4.3389626	comment	7.0	23.5	1564289333	9.495809	I am in agreement with everything generally except for CloudFormation and setting up Route53 zones manually.I use Terraform to setup my infrastructure as service on AWS, including Route53 zones.After ...		merlincorey
20651266	13.4732485	-4.8725815	story	7.0	48.0	1565323592	9.7109585	Build Highly Available MySQL Applications Using Amazon Aurora Multi-Master	https://aws.amazon.com/cn/blogs/database/building-highly-available-mysql-applications-using-amazon-aurora-mmsr/	jinqueeny
20864045	13.70183	-4.9922657	comment	7.0	43.0	1567490721	9.934208	I'm astonished at all the comments that vilify MongoDB Inc and then talk about moving to AWS's MongoDB clone. What sort of twisted world are we living in where a company makes a service, tries to sell...		elevenbits
25795350	13.506737	-4.535012	comment	7.0	27.5	1610739850	-9.8842745	Rephrased: Amazon played hardball with open source Elasticsearch, limiting elastic's ability to make money and forcing a license change. Now you should use Amazon's fork instead!This is not a good outcome for people who want an independent OSS ecosystem.		mrkurt
25865226	13.51438	-4.4752774	comment	7.0	21.0	1611267573	-9.82912	>Instead, new versions of the software will be offered under the Elastic License (which limits how it can be used) or the Server Side Public License (which has requirements that make it unacceptable t...		PradeetPatel
25865695	13.533373	-4.436891	comment	7.0	22.0	1611269543	-9.817018	Someone at Elastic didn't do the math on this. Amazon can easily fund developers, they just didn't because they didn't have to. Now that the gorilla has been enraged woe to the thing that pissed it of...		hyperion2010
25865443	13.493257	-4.457828	comment	7.0	63.0	1611268383	-9.821134	It feel like live by the sword, die by the sword to me.Elastic because a highly successful business off the product being open source and then leveraging that into funding and enterprise licensing and...		weego
35950766	13.555676	-4.9929104	comment	7.0	23.5	1684168013	10.322783	"TLDR: ""I work at Confluent, the owners of Kafka, and I have determined through my tests that Redpanda's performance is greatly exaggerated.""I don't think we can get a less reliable or trustworthy set ..."		purpleblue
36279198	13.484984	-4.7788954	story	7.0	28.0	1686469712	-9.982649	The Elasticsearch Rant	https://xeiaso.net/blog/elasticsearch	ingve
36337110	13.489356	-5.0502357	comment	7.0	27.0	1686810733	9.766095	"It may be a generational thing, a matter of familiarity with computing and computers. For someone who's lived through the 80s, ""handrolling postgres"" doesn't sound nearly as scary as you imagine.I exp..."		Radim
36344313	13.590203	-4.990844	story	7.0	88.0	1686852207	-13.096921	Gently Down the Stream – A gentle introduction to Apache Kafka (2021)	https://www.gentlydownthe.stream/	warrenm
36495931	13.447991	-5.0164013	story	7.0	78.0	1687886257	10.369207	InfluxDB 3.0 System Architecture	https://www.influxdata.com/blog/influxdb-3-0-system-architecture/	ren_engineer
28707577	13.460679	-5.04664	comment	7.0	25.5	1633016212	9.769939	An orthogonal migration issue which I'm hitting right now: we need to migrate from heroku postgres to aws rds postgres, and I'm stressed about the risk and potential downtime in doing so.  If there wa...		tomhallett
28761566	13.466217	-4.945601	story	7.0	62.0	1633451012	-2.7488427	The New Timescale Cloud	https://blog.timescale.com/blog/announcing-the-new-timescale-cloud-and-a-new-vision-for-the-future-of-database-services-in-the-cloud/	neom
28779202	13.450458	-4.240884	comment	7.0	20.0	1633558784	-1.0271137	Something funny (well, kind of sad) about CloudFormation I noticed this summer was that if you deploy a CloudFormation stack which updates a ECS service and deploys tasks which then fail health checks...		easton
29115362	13.520647	-4.4961114	comment	7.0	32.0	1636085562	-9.785513	This means this project is abandoning open source and free software, as the Elastic License is not an open source license.> The Apollo developer community is at the heart of everything we do. As stewa...		sneak
29298447	13.65773	-4.9638615	comment	7.0	32.5	1637519157	10.540662	Given that Kafka books are about impenetrable bureaucratic worlds, why is Kafka called Kafka? Sounds like it’s a tool to make sure your infrastructure is hard to comprehend.		wodenokoto
12844653	13.546273	-5.0218563	comment	7.0	20.0	1477998169	-13.080278	Not really sure why you would do it like this.Most systems do cache/index invalidation or HDFS archiving from the web app or a set of microservices that gets notified from the web app. So instead of p...		threeseed
13155707	13.561568	-5.010011	comment	7.0	19.5	1481519505	-13.083999	This is an excellent idea... but I'm a little put off by the reference implementation using DC/OS and Kafka... Its a little bit 'heavy' for a reference implementation, at least that's my personal pref...		techdragon
27589795	13.649553	-4.363652	comment	7.0	28.0	1624356248	9.499225	Can someone explain to me if people still do new projects using CloudFormation? If so why?I'm in an enterprise and they do everything with CloudFormation, but it doesn't really make sense to me. None ...		rjzzleep
27818408	13.513018	-4.5156636	comment	7.0	24.0	1626161362	-9.8853	So this is Amazon rip-off (legal one, obviously) of the last Elasticseartch version having Apache license...On the one hand, this is ok. Free software is taken and extended by someone who wants to do ...		piokoch
18985107	13.46105	-5.0193715	comment	7.0	27.5	1548292244	10.392022	InfluxDB creator here, happy to answer questions and add more commentary here!		pauldix
19260903	13.445925	-4.218982	story	7.0	115.0	1551242251	8.706635	Nginx 1.15.9	http://mailman.nginx.org/pipermail/nginx-announce/2019/000231.html	runesoerensen
19364708	13.453705	-4.3453326	comment	7.0	27.0	1552356048	-5.812457	My personal, probably disagreeable opinion, but... The narrative that Amazon is somehow screwing over open source is getting old. I don't really think anything is 'screwing over open source', but if i...		jchw
15808271	13.45451	-4.7429404	story	7.0	87.0	1511974095	9.57028	In The Works – Amazon Aurora Serverless	https://aws.amazon.com/blogs/aws/in-the-works-amazon-aurora-serverless/	polmolea
15824950	13.498745	-4.661575	comment	7.0	20.0	1512146199	-8.725545	Elastic | REMOTE | Full timeSenior JavaScript Engineer https://www.elastic.co/about/careers/engineering/jobs/593004Senior JavaScript Engineer (Security) https://www.elastic.co/about/careers/engineerin...		courtewing
15847579	13.460365	-4.767313	comment	7.0	19.0	1512422061	9.696759	"The idea is exciting, but the pricing looks too high for side projects. The docs state ""Aurora Serverless can scale from a minimum of 1 ACU to a maximum of 256 ACUs."" Unless I'm reading this incorrect..."		oh_hello
15913454	13.624029	-4.414545	story	7.0	60.0	1513162578	-12.198339	Announcing the OpenFaaS Function Store	https://blog.alexellis.io/announcing-function-store/	alexellisuk
16246171	13.6592655	-4.3844357	comment	7.0	26.5	1517060289	9.500398	The code comparison between CloudFormation’s abysmal JSON formatting and Terraform’s DSL is a bit disingenuous.CloudFormation has supported YAML for at least a year or two now, and it’s leagues more r...		geerlingguy
16281717	13.447122	-4.9109464	story	7.0	98.0	1517492163	9.519046	Building a Full-Text Search App Using Docker and Elasticsearch	https://blog.patricktriest.com/text-search-docker-elasticsearch/	quotable_cow
16869902	13.559225	-4.974028	story	7.0	81.0	1524077274	9.783369	CockroachDB is more scalable than Amazon Aurora for OLTP	https://www.cockroachlabs.com/blog/performance-part-two/	manigandham
17008909	13.689615	-4.399589	story	7.0	105.0	1525644849	9.506678	Open sourcing Terratest: tools for testing infrastructure code	https://blog.gruntwork.io/open-sourcing-terratest-a-swiss-army-knife-for-testing-infrastructure-code-5d883336fcd5	kiyanwang
17398704	13.629946	-4.514865	story	7.0	148.0	1530000345	-13.112924	HashiCorp Consul 1.2: Service Mesh	https://www.hashicorp.com/blog/consul-1-2-service-mesh	onnimonni
17453008	13.462199	-4.7828054	comment	7.0	21.5	1530646409	-12.98245	AGPLv3 is the cloud-condom open-source licensing model for the future. You are protected from the cloud-providers, who otherwise to monetize open-source projects that enterprise vendors develop. For e...		jamesblonde
17744413	13.670898	-4.3800507	comment	7.0	24.0	1534082917	9.517697	Terraform is terrible compared to Cloudformation. Its selling point is multi-cloud support, but you'll never get it, clouds are too different.- Good CF template is 10x less code for the same solution....		auslander
17921362	13.528503	-4.631625	comment	7.0	19.5	1536177370	-9.953745	"Slightly off topic: this quote from the SEC filing document:""Immediately prior to the completion of this offering, we intend to change our corporate form from a Dutch private company with limited liab..."		tomputer
17922552	13.585963	-4.986056	comment	7.0	19.5	1536188041	9.907323	I see several responses that mention MongoDB for purposes of comparison and seem to conclude Elasticsearch fares favorably.It should be noted:[1] Unlike MongoDB (which is a ground-up build), Elasticse...		burnmaster
18344932	13.450734	-4.989224	story	7.0	47.0	1540987334	9.948956	TimescaleDB 1.0 Is Production Ready	https://blog.timescale.com/1-0-enterprise-production-ready-time-series-database-open-source-d32395a10cbf	ScottWRobinson
18562704	13.550934	-4.990878	story	7.0	62.0	1543517427	-13.118335	Amazon Managed Streaming for Kafka in Public Preview	https://aws.amazon.com/about-aws/whats-new/2018/11/introducing-amazon-managed-streaming-for-kafka-in-public-preview/	abd12
30174820	13.70178	-4.387148	comment	7.0	19.5	1643787326	9.470569	"Someone needs to make the obligatory ""Wordle clone in 50,000 lines of react/java/nosql/docker/terraform/documentation/7GB of unused dependencies"" :)"		jsiaajdsdaa
33218430	13.432173	-4.825227	comment	7.0	30.5	1665866540	-6.745099	[Firebase founder]I no longer work at Firebase / Google, but two points:1. There may be issues with the GCP integrations & UX/DX, but GCP integration is good for many customers and necessary for the f...		jamest
26781452	13.515949	-4.6408887	comment	7.0	19.0	1618245159	-9.958179	"From the announcement: ""You should consider the initial code to be at an alpha stage — it is not complete, not thoroughly tested, and not suitable for production use. We are planning to release a beta..."		phd514
27434695	13.67995	-4.4136167	comment	7.0	44.0	1623158017	9.562902	"I strongly agree both with respect for the half-baked-ness of the language and with the ""it's probably the best out there"". Ultimately, these tools should have a static/yaml-like ""assembly language"" t..."		throwaway894345
37809721	13.724039	-4.372394	story	7.0	262.0	1696766408	-12.515307	Homebrew to deprecate and add caveat for HashiCorp	https://github.com/Homebrew/homebrew-core/pull/139538	mooreds
38002665	13.691799	-4.3916554	story	7.0	55.0	1698169771	9.517852	Show HN: Togomak – declarative pipeline orchestrator based on HCL and Terraform	https://github.com/srevinsaju/togomak	srevinsaju
15602823	13.568745	-4.999614	comment	7.0	19.0	1509553581	-13.106391	Disclaimer: I'm one of the creators of Kafka and founders of ConfluentThe best way to get the power, throughput, latency of Kafka without the operations is to use a hosted service. The one created and supported by the Kafka team is Confluent Cloud https://www.confluent.io/confluent-cloud/		nehanarkhede
28583803	13.670386	-4.3701153	comment	7.0	23.5	1632054712	9.526666	It's very difficult to communicate what Terraform's strengths and weaknesses are to someone who's never used it or IAC in general.Spend enough time playing with it and understanding it, you'll end up ...		scrollaway
28584376	13.709194	-4.392808	comment	7.0	20.0	1632060086	-12.37603	> On terraform it's different, because of the tfstate. All the deployed elements are stored in the tfstate, re-running terraform won't update resources that are supposed to be in a specific state but ...		snom380
22688199	13.461615	-4.845256	comment	7.0	25.0	1585167952	-9.9783325	I know the project doesn't claim it, but the title somewhat implies this: I honestly don't understand people claiming ElasticSearch is hard to operate, especially not at small scales. If anything, Ela...		heipei
22814200	13.514623	-4.8004236	comment	7.0	23.0	1586362244	9.683577	Author here! If you want more, I just released a book on DynamoDB yesterday --> https://www.dynamodbbook.com/ . There's a launch discount for the next few days.The book is highly recommended by folks ...		abd12
23193809	13.510855	-4.845287	comment	7.0	21.0	1589558983	9.709566	Waves Author here. Happy to answer any questions folks have about the book, about DynamoDB, or about self-publishing.NoSQL modeling is waaay different than relational modeling. I think a lot of NoSQL ...		abd12
29347961	13.578391	-4.9781613	comment	7.0	37.0	1637908462	-13.136022	Must be something about Kafka to attract these kind of explanations. Another one few months back was a children's book on Kafka [1] . For me it just look like solution looking for actual problems.I wo...		geodel
29357849	13.69757	-4.382221	comment	7.0	23.0	1637992543	9.47892	Genuinely interested -- why would I choose this over running Terraform as part of CI/CD?		kaidon
34716797	13.581126	-4.9893165	story	7.0	135.0	1675896989	-13.097535	Apache Kafka Beyond the Basics: Windowing	https://www.confluent.io/blog/windowing-in-kafka-streams/	mooreds
34842977	13.50355	-4.9379973	comment	7.0	19.0	1676684423	9.842767	It would be nice if the Azure and AWS Postgres teams could get off their asses and release version 15 already. It has been out for several months now, and crickets.Homebrew too, but at least they have the excuse that it is open source and unfunded.		darksaints
35157379	13.570814	-5.0011644	comment	7.0	21.0	1678823568	-13.09756	An important question not mentioned in this article - and may not have been known by the author - is how much (Dev)Ops burden do each of these add?In the places I've worked that use Kafka, it's 100% a...		justinclift
14099913	13.4440155	-4.2134385	comment	7.0	30.5	1492018966	8.762751	"The only thing pretty bitter about Nginx is that the access to the server status in the open source community edition.You get only so much with ""ngx_http_stub_status_module"" that you have to compile i..."		frik
14606254	13.490716	-4.968553	comment	7.0	28.0	1498067766	9.70994	I submitted this article because of a single paragraph:> When it came to the different types of NoSQL databases, it was pretty clear that a document store best suited our needs. We needed to be able t...		orf
14617731	13.4847555	-4.5377226	story	7.0	70.0	1498206230	-9.86844	Elastic enters Application Performance Management space with Opbeat acquisition	https://techcrunch.com/2017/06/22/elastic-enters-apm-space-with-opbeat-acquisition/	bevacqua
31231760	13.430611	-4.9276085	story	7.0	27.0	1651469793	9.765502	AWS RDS Postmortem: Is AWS Collapsing Under its Own Weight ?		ruben81adelaide
31672063	13.539299	-4.87973	story	7.0	67.0	1654713478	-13.189167	Facebook's Zookeeper Implementation on Delos	https://engineering.fb.com/2022/06/08/developer-tools/zelos/	somerando7
36653399	13.703653	-4.3812346	story	7.0	91.0	1688899912	9.515647	Show HN: Digger – Open Source Terraform automation and collaboration tool	https://github.com/diggerhq/digger	ujnproduct
37082263	13.726571	-4.35856	story	7.0	14.0	1691704475	13.27913	HashiCorp adopts the Business Source License for future releases of its products	https://www.globenewswire.com/en/news-release/2023/08/10/2723189/0/en/HashiCorp-adopts-the-Business-Source-License-for-future-releases-of-its-products.html	rmoriz
37083198	13.719082	-4.3628387	comment	7.0	35.5	1691711147	-12.294059	> That's pretty disappointing.From the article: “End users can continue to copy, modify, and redistribute the code for all non-commercial and commercial use, except where providing a competitive offer...		randmeerkat
37135029	13.733802	-4.347656	comment	7.0	66.5	1692112655	-12.501719	I appreciate the letter and trying to work with Hashicorp -- I used to have a ton of respect for Hashicorp.  But honestly... at this point......just fork it into a foundation.  Don't wait for Hashicor...		dbingham
37138212	13.709861	-4.382568	comment	7.0	32.0	1692127633	9.452863	If any Hashicorp people are reading, can you please tell your middle and senior management that this decision has deeply soured my entire DevOps cohort on continuing to use Terraform in the future.We'...		bloopernova
37154490	13.496649	-4.524054	comment	7.0	26.5	1692223408	-9.907731	>Available on GitHub under the Elastic v2 license.So... not open source?		Cantinflas
37335061	13.718084	-4.378756	comment	7.0	22.5	1693478276	-12.383852	Not the OP, but I suspect HN has trimmed the anchor link.> https://github.com/opentffoundation/roadmap/issues/24#issuec...That's the comment that made the issue clear -- specifically TOS were amended ...		martypitt
37394964	13.687291	-4.380841	comment	7.0	49.5	1693934578	-12.229035	As technical lead for the OpenTF project, how does things like this get merged?https://github.com/opentffoundation/opentf/pull/36/commits		Foxboron
24700370	13.436796	-5.053512	comment	7.0	21.0	1602005858	-13.491675	Is it just me, or is $15/mo for the cheapest Postgres-with-backups a bit steep? Heroku's free DBs (or $9/mo basic plan) support daily backups.I've currently got a web app I'm just self-hosting on a DO...		avolcano
24800294	13.436325	-4.3495617	comment	7.0	23.5	1602852677	-5.762103	Situations like this make me wonder why no one has created an open source license with a clause excluding multi billion dollar companies. If your company makes more than, say, $50 billion in revenue p...		bogwog
