id	x	y	type	relevance	size	year	umap1d	hovertext	url	author
19359734	13.520657	-4.6637144	comment	4.0	15.5	1552318666	-9.935403	'Distro' makes it sound like a linux-distribution with, in this case, Elasticsearch installed on it. From what I read on the page and on the aws blog this is not the case though?		mosselman
19359882	13.46577	-4.404039	comment	4.0	13.0	1552319692	-9.726064	"This is an interesting new ""threat"" to the ""open core"" business model. ES makes proprietary extensions to support their FOSS core product - then a tech behemoth clones these features for their own hos..."		Mizza
19362604	13.526332	-4.5137753	comment	4.0	14.0	1552336867	-9.884653	Last year Elastic opened up the source code of their commercial X-Pack offering: https://www.elastic.co/blog/doubling-down-on-open. This means that these components (security, alerting, etc.) are now ...		praseodym
19361234	13.525121	-4.6182675	comment	4.0	15.0	1552327699	-9.9429035	As someone who is involved in the ecosystem and maintains some open-source projects based on ElasticSearch, I am similarly curious about the move to not build upon existing projects (there could be a ...		sidi
19362788	13.455665	-4.1809707	comment	4.0	11.5	1552338106	-8.939676	"In the event that F5 pulls an Oracle and horribly mismanages nginx, runs it into the ground, or tries to close it off, I vote we name the community fork ""nginy""."		hannasanarion
19364473	13.503739	-4.447482	comment	4.0	14.0	1552352876	-9.806247	> [Elastic] started developing new features under a proprietary license> Elastic is the rare company that truly is committed to open sourceOn their face, those two statements seem mutually exclusive. What context am I missing that would make them not so?		abtinf
19311301	13.460888	-4.8481817	story	4.0	104.0	1551801186	-10.009313	Vulcanizer: A Library for Operating Elasticsearch	https://githubengineering.com/vulcanizer-a-library-for-elasticsearch/	yarapavan
19512387	13.447473	-4.223206	comment	4.0	13.0	1553782585	8.794226	neither Kong nor its infrastructure (i.e. nginx) have any future on the long term against envoy. Simply time is against them even if it is going to be very slow downfall. I guess that's the real reaso...		trpc
19600078	13.440316	-4.277026	comment	4.0	13.5	1554673208	-9.56948	Apologies, I'm not sure if you are disagreeing with me in any way or not. :)Envoy is indeed open source and freely-available for corporations to use. That is not what I was implying.Amazon, out of all...		rocgf
19733880	13.438365	-4.9476433	comment	4.0	12.0	1556060594	9.619476	Cadence vs SWFCadence was conceived and is still led by the original tech leads of the SWF.SWF had no new features added for the last 5 years. Cadence is open sourced and is under active development.C...		mfateev
19965411	13.529962	-4.6541805	comment	4.0	10.5	1558387682	-9.9841385	"Interesting. Three hours ago someone in our Ops team shared a link to ""Open Distro for Elasticsearch"" [1] and it's also featured on the AWS console login page.Is this a very rushed reaction to it? Or ..."		KenanSulayman
19869801	13.449684	-4.2343817	story	4.0	69.0	1557420142	8.723204	Nginx Is Now Part of F5	https://www.nginx.com/blog/nginx-is-now-officially-part-of-f5/	tachion
19965413	13.519167	-4.7273083	comment	4.0	21.0	1558387689	-10.010992	Too little too late? Trying to charge for TLS was a very poor move and it's made me not trust ElasticSearch...		vorpalhex
15809553	13.445659	-4.3355727	comment	4.0	12.0	1511981049	-5.882532	It seems a lot of Amazon services are managed instances of open source applications. For example, commenters are suggesting this may be based on Janus. Elastic load balancers, at least originally, wer...		chatmasta
15846850	13.528167	-5.032096	comment	4.0	15.0	1512417201	-13.066897	>The right to be forgotten, becomes one of the hardest challenges because of data immutability. Apache Kafka does not support deleting records, and although some eventual deletion is supported, it req...		Sir_Substance
15782132	13.482983	-4.778512	story	4.0	85.0	1511719500	9.0518465	A Deep Dive into NEC’s Aurora Vector Engine	https://www.nextplatform.com/2017/11/22/deep-dive-necs-aurora-vector-engine/	rbanffy
17975060	13.528798	-4.98944	comment	4.0	18.5	1536800815	-13.088648	How does LogDevice differ from Kafka?		ashu
18094168	13.448241	-4.89238	comment	4.0	12.5	1538148480	-9.998842	In 2015, they evaluated Apache Solr and Elasticsearch and decided to build their own (Firefly). They said, other solutions did not scale. So, instead of contributing to scaling (like Apple and Bloombe...		arafalov
18049512	13.65864	-4.9671144	story	4.0	40.0	1537679673	10.5477085	The Kafka Papers	https://www.weeklystandard.com/christoph-irmscher/review-of-kafkas-last-trial-the-kafka-papers	objections
18230297	13.650895	-5.0351543	comment	4.0	13.0	1539704882	-13.01176	Azure offers Cosmos DB advertised as a drop-in for MongoDB. I'm guessing Cosmos is Mongo in disguise, though  I don't know if it really is, and/or whether MS has made a deal with Mongo or just think t...		tannhaeuser
18179597	13.696736	-4.363866	story	4.0	18.0	1539117188	9.372278	Terrafugia transitions to market	https://www.aopa.org/news-and-media/all-news/2018/october/04/terafugia-transitions-to-market	prostoalex
18361101	13.661398	-4.410274	comment	4.0	11.0	1541141220	9.525537	Congratulations! I've been a fan of Vagrant for a long time and have done some Vault as well. I haven't yet had a chance to try Terraform, but everyone says it is better than Cloudformation. :-)I'm cu...		pjungwir
18428989	13.625183	-4.355775	comment	4.0	18.0	1541974551	9.529479	Infrastructure as code.Terraform using AMIs plus chef recipes that work in the cloud and bare metal. Dont use AWS specific services.This would allow you to spin over to another cloud provider , vsphere or bare metal with minimal work		geggam
18537818	13.678566	-4.375966	comment	4.0	13.0	1543275153	9.496517	... , then replace all that Terraform code with Cloudformation templates. You will get 5x less code, native vs third party tool v0.11 and my respect :)		auslander
18548650	13.492649	-4.8807235	comment	4.0	11.5	1543370407	9.681793	"I personally recommend using a SQL database until you're absolutely positively sure you don't need one, for many reasons.But, as far as the ""you end up overprovisioning"" because of hotspots thing, Dyn..."		coder543
18547976	13.503251	-4.857787	comment	4.0	11.0	1543362354	9.671277	My wishlist for DynamoDB is now down to:* Fast one-time data import without permanently creating a lot of shards (important if you are restoring from a backup)* Better visibility into what causes thro...		piinbinary
18553759	13.463824	-4.812957	comment	4.0	10.5	1543427531	9.237032	I'm actually impressed at how incredibly expensive they made this. $0.50 per million 1KB writes, which is 20x what aurora charges, since aurora allows 8KB writes. And Aurora is already expensive if you actually read/write to it.		willlll
18679338	13.469548	-4.693415	comment	4.0	19.0	1544775991	9.646828	About multiple AZ, I think we haven't used it in this case but it shouldn't change a bit, most of our AWS customers have AZ-aware deployments and it works great.Since I see you're with AWS, you're wel...		thekozmo
18690141	13.441372	-4.9006767	comment	4.0	19.5	1544905030	9.710765	You're not the only one.Some time ago I worked with a bunch of people who staked their careers on moving everything to AWS and converting it to serverless architecture. Here is just one example of how...		colllectorof
18827106	13.689524	-5.0225496	comment	4.0	14.0	1546631521	9.928814	I strongly disagree with the hypothesis raised in the article.First , most open source companies these days are Ventured Back ( Elastic , CockroachDB, MongoDB etc..) meaning the core of the issue isn'...		tinyvm
18870596	13.54554	-5.0807076	comment	4.0	13.0	1547081722	9.808421	It would be nice if Amazon provided an API to access the data via SQL alongside the MongoDB API; I've seen quite a number of organizations migrate from mongo to Postgres once they get out of the rapid development phase. This would make that transition butter smooth.		erikig
18898083	13.463575	-4.8776608	comment	4.0	11.0	1547406013	-9.970703	I don't get the hype about elasticsearch at all. Elasticsearch is more suited to searching logs. It doesn't have powerful sort functions, doesn't allow you to use multiple sort parameters etc.Apache S...		hashhar
18918141	13.454572	-4.7853847	comment	4.0	12.5	1547611373	9.68039	One of the biggest reasons why we left Aurora for an rds solution was that basic ddl operations like table alters would fail to work on db sizes greater than 2TB. Such operations required double the a...		stevev
18926115	13.805843	-5.0824966	comment	4.0	11.0	1547677586	-12.988454	From:https://www.mongodb.com/licensing/server-side-public-license...> What specifically is different between the GPL and the SSPL and what will it be called?> The new license will be called Server Sid...		giancarlostoro
29780390	13.698184	-4.3844433	comment	4.0	13.5	1641215361	9.498233	I hate seeing Terraform script or scripting. Am I the only one?		kaydub
29794270	13.658131	-5.0558653	comment	4.0	17.5	1641301621	-3.9709897	"Love the idea! I've been using Couchsurfing for many years and tried their ""hangout"" feature a few times. It's 95% males harassing traveling women that happen to log in but the 5% left can be great to..."		elbajo
29780098	13.698013	-4.388946	story	4.0	39.0	1641212994	9.50396	Terraform Scripting Concepts	https://serdigital64.github.io/post/terraform/terraform-scripting-concepts-part1of2/	serdigital64
29988964	13.451443	-4.270064	comment	4.0	14.0	1642557990	8.725733	“Igor has chosen to step back from NGINX and F5 in order to spend more time with his friends and family”I wonder what this is really about.Either way Nginx is the reason myself and many others were ab...		mmaunder
29990007	13.42926	-4.186596	comment	4.0	11.0	1642566866	-9.706747	I'm an experienced dev with a deep knowledge of full stack web as well as infrastructure but I've never put nginx in front of any app. I want to but I honestly avoided it because I thought it was diff...		graderjs
30010482	13.518408	-4.8078218	comment	4.0	11.5	1642694149	9.6969185	Customers care about the outcome, not the internal process. Besides, I’ve never worked at any sizable company in my 20+-year-long career where I didn’t conclude, “it’s a miracle this garbage works at ...		otterley
30010843	13.491397	-4.8663607	comment	4.0	11.0	1642695439	9.705635	To be honest, as a customer, it is hard for me to justify using DynamoDB. Some of this criticism can be out of date:1. DynamoDB is not as convenient. There are a bit too many dials to turn.2. DynamoDB...		didip
30041981	13.534427	-5.0694003	comment	4.0	12.5	1642894613	-13.090268	Sounds cool, almost like competition for Kafka if it solves global multi-DC replication and has a scaling story.  Is FB / “MarkZ The Generous”* planning to open-source this valuable sounding thing?  I...		metadat
30061145	13.668297	-4.9494424	comment	4.0	13.0	1643046500	-2.7134564	"""The trial"" by Kafka needs to be required reading for everyone involved in implementing systems like this."		friedman23
30199831	13.428282	-4.6126413	comment	4.0	12.0	1643926749	-0.951727	RIs like this are great, but the biggest savings we've found is moving everything we can to Spot Instances. We're hoping Aurora on spot becomes a thing as that's really our only remaining RI/on-demand cost.		phamilton
30092655	13.705237	-4.387527	story	4.0	24.0	1643234652	9.50154	My Pet Peeves with Terraform	https://blog.runx.dev/my-pet-peeves-with-terraform-f9bb37d94950?gi=de3e74d40ef0	nitinagg
30570447	13.524143	-4.65974	comment	4.0	18.0	1646505355	-9.951515	"This is Amazon's fork of Elasticsearch, to avoid the licensing restrictions introduced when they switched from Apache 2 license to ""Elastic License and Server Side Public License"" - https://www.elastic.co/pricing/faq/licensing"		simonw
30579007	13.440122	-4.851483	story	4.0	8.0	1646586564	5.630986	Elasticsearch vs. Google		donboscow
30711300	13.70254	-4.377128	comment	4.0	12.0	1647526047	-12.41145	Hi. I am Anton Babenko, maintainer (ukrainian by heart) here. I have updated the wording in README to state the facts about Russia (facts with links to wikipedia) - https://github.com/terraform-aws-mo...		antonbabenko
16231401	13.477924	-5.032943	comment	4.0	11.0	1516894129	10.231932	At my employer, we've recently (as of the middle of last year) been making a considerable effort to use InfluxDB to track our KPIs. It's working out wonderfully for us, and I'm expecting it'll get use...		amyjess
16246218	13.5161295	-4.4593406	comment	4.0	11.0	1517061392	9.428259	Personally I find YAML for cloudformation worse than JSON because of the whitespacing requirements. JSON isn't much better mind, especially once your template reaches to hundreds of lines with nested ...		djhworld
16380005	13.427992	-4.6717653	comment	4.0	11.0	1518646524	9.682557	> I, personally, have seen many projects burning thousands a month in database costs because they prefer replicating the environment for testing branches.If this is the premise for serverless database...		hodgesrm
16249372	13.703243	-4.380767	story	4.0	32.0	1517105982	9.460659	Ethereum miner with Terraform	https://github.com/17twenty/ethereum-miner-terraform/blob/master/readme.md	hactually
16298848	13.483444	-4.8968334	story	4.0	100.0	1517683134	9.716886	Amazon Aurora Postgres: First Thoughts	https://www.linkedin.com/pulse/amazon-aurora-postgres-first-thoughts-eric-green/	brandur
16488925	13.459896	-4.848639	comment	4.0	12.0	1519867432	-9.993478	Elasticsearch is a mess. It's so full of historical warts.One major problem is that none of their documentation is actually reference documentation -- if you look for the formal schema (for things lik...		lobster_johnson
16596312	13.676093	-4.9623127	comment	4.0	12.5	1521146162	10.548262	What do you mean by “Kafka-esque” in this context?		sahil-kang
16757894	13.615293	-4.1339173	comment	4.0	12.0	1522869008	-12.587775	It'd be cheaper than running Vault with a backing Consul cluster which also provides rotation and other features.There is a point where Vault is more cost effective, but I believe it'd require a ton o...		0xCMP
16827171	13.545239	-5.0279145	comment	4.0	19.5	1523594578	-13.08917	Okay, this approach is really cool, but... just hear me out: what if... you don't store personally identifiable data in the event store? What if you only store references/ids that point to services wh...		arpa
17031649	13.68035	-4.374137	comment	4.0	13.5	1525886059	9.498712	This is exciting, but I really hope that Terraform will add support for it in reasonable time. These days I'd prefer to not manually manage cloud resources if I don't have to.		jchw
17042086	13.472587	-4.7923026	comment	4.0	12.0	1525979749	9.62285	I don't know anything about Aurora and maybe I'm missing something. But why not just wrap everything in a TRANSACTION and then do a ROLLBACK if there's an issue?		cody8295
17001527	13.577771	-4.411238	story	4.0	66.0	1525523421	5.7680607	OpenFL 8.0.0 Released	https://github.com/openfl/openfl/blob/develop/CHANGELOG.md#800-03042018	doppp
17123153	13.469066	-4.805341	comment	4.0	14.0	1526952391	-9.935573	This acquisition has piqued my interest moreso than your average bear because I work for a major retailer that just so happens to be heavily invested in Adobe Experience Manager (AEM). We are using AE...		jsntrmn
22776147	13.499209	-4.9133143	comment	4.0	15.0	1585973490	9.717688	Moving to PostgreSQL on Amazon Aurora simplifies all the replication issues listed. We (Remind) use an autoscaled PostgresQL Aurora cluster and have been pretty happy with it.		phamilton
22814476	13.520267	-4.802644	comment	4.0	10.5	1586363688	9.687812	After seeing Rick's Re:invent talk, the one where at about minute 40 everyones' heads exploded, I emailed him (I'm in a very far away other department of Amazon) to ask him for more, because everythin...		mabbo
23131872	13.659834	-4.3756676	comment	4.0	14.0	1589110683	9.4737425	Cloudformation is spot on. There is simply no excuse in 2020 to use it when cloud agnostic Terraform exists.Elasticache is expensive and the analysis is generally correct on that, however if you do ac...		ciguy
23131912	13.673878	-4.375365	comment	4.0	11.0	1589111216	9.498913	Terraform is not “cloud agnostic”. Every provisioner is specific to the platform.		scarface74
23194235	13.445908	-4.341098	comment	4.0	21.5	1589561076	-5.8477345	The real problem with the licenses is that they are not open source, but many users of them still seem to think they are doing open source.The funny thing is that they are trying to protect themselves...		verdverm
23195967	13.525609	-4.8568525	comment	4.0	14.5	1589569105	9.647143	Fair enough! I think that's a reasonable position.IMO, there are two times you should absolutely default to DynamoDB:- Very high scale workloads, due to its scaling characteristics- Workloads w/ serve...		abd12
23207757	13.562543	-4.9836864	comment	4.0	16.5	1589668506	-13.102067	I'm surprised by the amount of criticism in this thread. I've used Kafka in the past and it definitely got the job done (as a message bus, not using stream processing or the other more whiz-bang features). What do people use instead?		Rebelgecko
23259642	13.439486	-5.0220447	comment	4.0	11.5	1590075288	-13.022263	Using the opportunity to pimp my book, RabbitMQ in Depth: https://www.manning.com/books/rabbitmq-in-depth:)		crad
23354854	13.666808	-4.410967	comment	4.0	15.0	1590782720	-13.036432	Have you tried or considered Nomad (from the makers of Terraform)?		herval
37811226	13.729392	-4.3794613	comment	4.0	13.5	1696778278	-12.44806	Honestly, all Hashi products are generally really good. I do think they do suffer from moving too fast syndrome. They pushed to go public and most or all of their recent shortcomings can be traced bac...		jacurtis
37862436	13.438224	-4.2074013	comment	4.0	15.5	1697140951	8.734174	Hehe, when I heard about the attack a couple of days ago I was interested to know if Nginx was affected and did a search on Google for the CVE of that attack followed by the name of Nginx.I didn’t fin...		codetrotter
37904358	13.491662	-4.3242064	comment	4.0	12.0	1697482299	-5.6797385	Where's this same vitriol directed at Amazon, Google, et al.?They've built huge cloud platforms on the backs of open source. These are highly profitable machines that siphon up so much free labor and ...		echelon
37831605	13.528411	-4.393878	story	4.0	37.0	1696943478	9.4587	Pulumi ESC: Easy and Secure Environments, Secrets and Configuration	https://www.pulumi.com/blog/environments-secrets-configurations-management/	todsacerdoti
38086944	13.452031	-5.086776	story	4.0	2.0	1698768170	10.05684	Ask HN: Does anyone use InfluxDB? Or should we switch?		ramikalai
25493880	13.539502	-4.7580924	comment	4.0	14.0	1608549394	-9.9124775	> That’s the strategy. That’s the magic. You don’t need to go Open Core or any other permutation of kind-of, sort-of open source. You can open source everything and just ensure you have a rock-solid m...		jabberwcky
25539073	13.69361	-4.382761	comment	4.0	10.5	1608930855	9.522529	I recently gave a tech talk internally about Terraform. I wanted to show how quickly a web service can get complicated by showing the SVG generated from `terraform graph` output.It failed miserably:$ ...		yegle
25554207	13.47068	-4.841869	comment	4.0	14.5	1609102787	-10.052573	It’s still Lucene underneath. Just like SOLR.The bread and butter of elasticsearch is in the aggressive sharding, shard allocation, replication and promotion. It essentially “clusterises” lucene.I can’t wait for something similar to what elastic did for lucene to happen to redis or Postgres.		dijit
25552098	13.4724655	-4.8144135	story	4.0	86.0	1609086685	-9.989866	A brief history of Elasticsearch (2014)	https://jaxenter.com/elasticsearch-founder-interview-112677.html	wallflower
25612640	13.690439	-4.3990107	comment	4.0	21.5	1609593434	9.511997	I have been saying this for a while now -- as much as I respect Hashicorp and admire their engineering, HCL is the biggest problem with the tools they have that it's used in -- biggest of which being ...		hardwaresofton
25778226	13.471372	-4.8162365	comment	4.0	12.0	1610641429	-9.956601	Elastic contributes massively to Lucene, so this is a false dichotomy		bevacqua
25782471	13.493673	-4.53175	comment	4.0	25.0	1610658170	-12.949553	TFA explains why Elasticsearch switching to SSPL is indeed a cause for concern. Money quotes:> Basically, it’s a hostile proprietary license masquerading in open source clothing. By using an SSPL proj...		ignoramous
25833909	13.505547	-4.4649763	comment	4.0	15.5	1611067902	-9.873177	Elastic's other blog post with a clarification about their recent license change is also interesting: https://www.elastic.co/blog/license-change-clarification. Apparently, they're considering further ...		dhd415
25834032	13.519919	-4.510998	comment	4.0	11.5	1611068646	-9.887149	"> ""When the service launched, imagine our surprise when the Amazon CTO tweeted that the service was released in collaboration with us. It was not. And over the years, we have heard repeatedly that thi..."		patrickaljord
25834305	13.452182	-4.34324	comment	4.0	18.5	1611069999	-9.561388	Could this potentially drive users to the Amazon fork? If I'm a business that may be impacted due to the licensing change, it would seem my safest (legal) option would be to freeze on the last version...		longhairedhippy
25834653	13.513287	-4.6122236	comment	4.0	14.0	1611071614	-9.938436	> Elastic could have released ES as closed source, but they didn't, and the OSS ecosystem is better for it.Except elasticsearch was created before the company Elastic even existed. They couldn’t have ...		cortesoft
25834257	13.517341	-4.5530953	comment	4.0	12.0	1611069802	-9.898472	> Our license change is aimed at preventing companies from taking our Elasticsearch and Kibana products and providing them directly as a service without collaborating with us.I feel like I just said t...		Pet_Ant
25834322	13.529206	-4.524865	comment	4.0	10.5	1611070084	-9.874725	> It doesn't matter what they say, read the license.I would love to but the terms within the ElasticSearch codebase on Github are quite confusing. Here's the text of the LICENCE.TXT file.  Source code...		hodgesrm
25834854	13.491223	-4.44977	comment	4.0	25.5	1611072723	-9.849755	> Apart from the general consternation about an OSS license becoming non-OSS, can we also talk about the problem that companies are formed, invest a whole lot of resources into creating a product, ope...		judofyr
25836521	13.489303	-4.411632	comment	4.0	12.0	1611079604	-9.703124	I'm surprised to see the reaction here on HN, but I'm starting to realize I'm from an older generation of open source contributors and don't share the values of some here.The point of open source wasn...		jaaron
25837701	13.529664	-4.5452027	comment	4.0	17.0	1611084611	-9.8510065	The new license doesn't restrict others from operating Elasticsearch as a service. It restricts others from operating Elasticsearch as a service unless they release any source code patches, improvemen...		floatingatoll
25865780	13.516195	-4.4734445	comment	4.0	15.0	1611269976	-9.891677	"> ""Elastic used its position as an open source maintainer to grow Elasticsearch to be one of the most important pieces of software in the world (nowhere as important as linux or arguably lucene but st..."		cphoover
25868883	13.521635	-4.482311	comment	4.0	14.0	1611295696	-9.911023	Interesting take, and I can see why Drew feels it's valid. He's ascribing to the maximalist interpretation of open source licensing. Licensing which never had any idea that Open Source would one day t...		kodah
25868385	13.488052	-4.6637344	comment	4.0	12.5	1611290620	-9.961286	Jason from Elastic here.I want to clarify this. Building a SaaS product with Elasticsearch or Kibana on the backend is okay and not prohibited, as long the service is not “managed” Elasticsearch nor K...		jasontedor
25932846	13.523129	-4.52028	comment	4.0	11.0	1611776252	-9.922	Jason from Elastic here.I want to clarify one aspect here. Elasticsearch and Kibana will be dual licensed under the Elastic License or the SSPL license, not only SSPL. The distributions that we provid...		jasontedor
25983860	13.54555	-5.0151925	comment	4.0	13.5	1612136829	-13.099842	When you have a monolith database that everybody wants to access Kafka with CDC is a very good pattern for teams to adopt.The alternative is modifying your app for arbitrary data access and dealing wi...		longcommonname
26253697	13.434967	-5.086087	comment	4.0	20.0	1614191663	9.721709	We’re currently migrating to Spanner for a variety of reasons - but the mandatory downtime on their Postgres CloudSQL offering will be the part I miss the least.It’s insane that even with all of their...		byteofbits
26260838	13.470476	-4.250853	comment	4.0	11.5	1614241364	8.735096	"A common pit I fell into is the ""inheritance"" of add_header. If you use a single add_header at a lower level all add_headers at the higher levels are ignored for that server or location.As some header..."		weinzierl
35514914	13.502968	-4.848184	comment	4.0	16.0	1681148102	9.683688	The biggest problem with Amplify is not any of it's underlying technologies. These are all great services. DynamoDB is one of the best things in the entire AWS service portfolio.The biggest problem wi...		cameroncf
35515715	13.490468	-4.8399067	comment	4.0	14.0	1681151800	9.674743	DynamoDB is a sad hack that heavy marketing had elevated in absence of better offerings on AWS at the time. It's not particularly good as KV store let alone something more serious.		qaq
