id	label	hovertext	author	x	y	type	relevance	size	year	umap1d
12017078	Dyalog APL v15.0 Free for Non-Commer	Dyalog APL v15.0 Free for Non-Commercial Use	jxy	15.568127	-2.6875498	story	8.0	73.0	1467387987	13.088845
12019063	So what's the trick to using APL if 	So what's the trick to using APL if you don't have the keyboard? Do most people use the custom keyboard? What about with laptops? Is there some sort of mnemonic for what symbols correspond to what letters? Do people put stickers over their keycaps?EDIT: Guys I	gaze	15.56476	-2.6898806	comment	8.0	24.0	1467401691	13.07387
20728715	J can look like APL or English	J can look like APL or English	paliilap	15.563273	-2.6998472	story	9.0	153.0	1566112100	13.052277
17506789	APL\3000 – HP Journal – July 1977 [p	APL\3000 – HP Journal – July 1977 [pdf]	i_don_t_know	15.568287	-2.686745	story	9.0	75.0	1531316774	13.112199
21587601	A History of APL in Fifty Functions 	A History of APL in Fifty Functions (2016)	lelf	15.562958	-2.7027183	story	9.0	109.0	1574278669	13.08797
21728991	I think I’m officially never going t	I think I’m officially never going to be smart enough to get APL.  Perhaps that day will come, but until then I find it hard to tell between these two viewpoints:(1) APL is another form of Perl golf, showing off basically.  The fact that so few people would be	gorgoiler	15.563195	-2.6993456	comment	9.0	32.0	1575703938	13.092346
38172760	Ask HN: Do You Program on Paper?	Ask HN: Do You Program on Paper?	mcmicah	15.562779	-2.6951964	story	9.0	5.0	1699326805	13.073745
32026647	APL and Array Programming	APL and Array Programming	tosh	15.56348	-2.6974742	story	9.0	93.0	1657312631	13.059837
24196025	APL386 Unicode – An APL Font	APL386 Unicode – An APL Font	chrispsn	15.566298	-2.6897988	story	10.0	136.0	1597734665	13.09167
21339750	Beating C with Dyalog APL	Beating C with Dyalog APL	lelf	15.557888	-2.7112837	story	10.0	102.0	1571869775	-7.1474
35392909	Isn't the original APL the only lang	Isn't the original APL the only lang that uses actual Unicode symbols for operators?	semi-extrinsic	15.56264	-2.6943932	comment	10.0	28.0	1680293609	13.073031
20255567	GNU APL 1.8	GNU APL 1.8	lelf	15.567468	-2.6912227	story	11.0	121.0	1561298622	13.103919
16799551	The BEAM needs an APL-y language	The BEAM needs an APL-y language	mpweiher	15.561037	-2.7038918	story	11.0	110.0	1523343349	13.075376
16952973	I wonder if array languages will fin	"I wonder if array languages will find wider popularity some day with a bit more verbose notation. Take “Array Indexing” (#29):    {(,⍺)[(⊂⍴⍺)⊥¨⊃∘.,/⍵]}

Or “Inverted Table Index-Of” (#31):    (⍉↑x⍳¨x) ⍳ (⍉↑x⍳¨y)

These could be written:    {(reshape lhs)[(encl"	evincarofautumn	15.564666	-2.6945662	comment	11.0	43.0	1525023320	13.07346
12254574	APL Tutorial	APL Tutorial	ktRolster	15.567118	-2.6899993	story	11.0	123.0	1470751847	13.086173
28093062	Here's what I don't get about APL. W	Here's what I don't get about APL. Why is it so important that everything be a single symbol? Why not give the symbols more descriptive names and let people use those names, instead of being forced to work with only the symbols? Heck, it wouldn't be much work 	civilized	15.565329	-2.690986	comment	11.0	40.0	1628285971	13.075204
23055793	Is APL Dead? Not anymore	Is APL Dead? Not anymore	lelf	15.563678	-2.6863964	story	11.0	127.0	1588463372	13.105327
28967485	APL is a write-only language. [1]Thi	APL is a write-only language. [1]This will be a controversial statement to devotees, but there's a simple argument that should clarify why this is true:1. APL's inventor claims that APL is a tool of thought. Specifically, it is designed to facilitate the devel	civilized	15.564669	-2.6928463	comment	12.0	45.5	1634989014	13.078831
38505138	A Personal History of APL (1982)	A Personal History of APL (1982)	lupin_sansei	15.569924	-2.6854975	story	12.0	122.0	1701582378	13.097573
28929709	APL in its modern state (2020)	APL in its modern state (2020)	akbarnama	15.566739	-2.6862917	story	13.0	95.0	1634731920	13.100692
35369084	APL: An Array Oriented Programming L	APL: An Array Oriented Programming Language (2018)	tailrecursion	15.560908	-2.7001843	story	13.0	105.0	1680159635	13.053777
28092097	Learning APL	Learning APL	todsacerdoti	15.563609	-2.696331	story	13.0	199.0	1628280117	13.085755
33180842	BQN: Finally, an APL for your flying	BQN: Finally, an APL for your flying saucer	tosh	15.563261	-2.6935346	story	13.0	88.0	1665598662	13.082743
13973812	A deep dive into APL	A deep dive into APL	sndean	15.564647	-2.6991272	story	14.0	168.0	1490671776	13.097444
16952045	A History of APL in 50 Functions	A History of APL in 50 Functions	jim-jim-jim	15.563284	-2.6961272	story	14.0	250.0	1525010888	13.097062
18073649	The Problem With APLs	The Problem With APLs	mr_golyadkin	15.565123	-2.6888313	story	14.0	82.0	1537947848	13.068553
39452211	APL at Volvo	APL at Volvo	tosh	15.568853	-2.6861646	story	17.0	152.0	1708511964	13.092203
37132510	What learning APL taught me about Py	What learning APL taught me about Python	RojerGS	15.552263	-2.7130992	story	17.0	90.0	1692098205	13.080729
34064480	The APL Source Code (2012)	The APL Source Code (2012)	pncnmnp	15.565531	-2.6894586	story	17.0	106.0	1671535887	13.0931
19325361	APL – A Glimpse of Heaven (2006)	APL – A Glimpse of Heaven (2006)	lelf	15.564714	-2.6855836	story	19.0	196.0	1551930021	13.108801
17173283	APL deserves its renaissance too	APL deserves its renaissance too	okaleniuk	15.567412	-2.688126	story	21.0	182.0	1527525047	13.111775
13797797	AMA: Explaining my 750 line compiler	AMA: Explaining my 750 line compiler+runtime designed to GPU self-host APL	arcfide	15.540496	-2.7189384	story	22.0	335.0	1488740463	13.0731945
