id	label	hovertext	author	x	y	type	relevance	size	year	umap1d
21730429	Looking at Advent of Code solutions,	Looking at Advent of Code solutions, I'm not sure if APL is really so much shorter or if it is rather a styling of programming.Some day2 solutions from reddit [0]:APL:    0{⍺⋄s←⍵⋄c←s[f+⍳4]⋄99=0⌷c:0⌷s⋄i a b l←s[c]⋄s[3⌷c]←(0⌷c-1)⌷a(+,×)b⋄(⍺+4)∇s}{j←⍵⋄j[1 2]←12 2	qznc	15.553363	-2.7057376	comment	4.0	10.5	1575729089	13.061328
21642670	Getting Started with APL (2017)	Getting Started with APL (2017)	lelf	15.564303	-2.6991436	story	4.0	97.0	1574802205	13.096274
39430710	Were APL, K, J, etc. ever used in pr	Were APL, K, J, etc. ever used in production? Array programming seems like a cool idea (albeit being counterintuitive sometimes), and it's maybe one of the tersest syntaxes I've ever seen.	behnamoh	15.551777	-2.711479	comment	4.0	11.0	1708356097	13.039116
39471374	TIL APL...neat!  Found this for othe	"TIL APL...neat!  Found this for others who want to play along.https://tryapl.org/(Note: took a while but the special characters for producing lists, etc... are from ""virtual keys"" you can see at the very top of the web page)"	whitej125	15.559418	-2.6896634	comment	4.0	19.0	1708627992	13.076248
39474255	425,000 lines of APL code boggles th	425,000 lines of APL code boggles the mind. It's like 10,000 pages filled with APL symbols. I guess that for normal non-APL programmers it's as close to an inscrutable alien artifact as you can find on Earth.	kryptiskt	15.564747	-2.6910489	comment	4.0	11.5	1708641208	13.107131
39610371	Is there a reason why APL languages 	Is there a reason why APL languages all fold right? I mean other than genealogical, as in they fold right because APL does. Does it offer compelling advantages?As an outsider it looks like wasted novelty budget. There's already a lot of new things to learn and	samatman	15.565559	-2.6942637	comment	4.0	10.5	1709680907	13.086205
32082274	"  input = 1

  out1: input + 1
  #ou"	"  input = 1

  out1: input + 1
  #out1 is now 2

  input = 4
  #out1 is now 5

  out2: out1.replace(+, -)
  #out2 is now 3

  # let's pull an APL
  input = 4 2
  #out1 is 5 3
  #out2 is 3 1

The reactive programming idea a la Excel but text-based looks really "	eatonphil	15.561919	-2.69818	comment	4.0	14.5	1657718410	-12.047074
22043186	“[..] to present to the eye some pic	“[..] to present to the eye some picture by which the course of their reasonings might be traced: it was however necessary to fill up this outline by a tedious description, which in some instances even of no peculiar difficulty became nearly unintelligible, si	jodrellblank	15.563747	-2.6933017	comment	4.0	10.5	1578994059	13.079255
35867240	I walked in, realized just how advan	I walked in, realized just how advanced this was and then proceeded to read through the same way I pan through the Abstract Art section of the museum.I freaking love APL and would love to learn it, but it is so incredibly jarring not knowing anything about the	mikercampbell	15.561599	-2.6909251	comment	4.0	11.0	1683580995	13.086731
24048776	The BEAM needs an APL-y language (20	The BEAM needs an APL-y language (2018)	lelf	15.564145	-2.7001638	story	4.0	27.0	1596539672	13.08615
13974653	The main problem with (GNU) APL for 	The main problem with (GNU) APL for me is the line editor: I can't feel comfortable using a REPL to write a program without keybindings like ctrl-a, ctrl-w. Everytime I try to learn APL I eventually give up.	rnhmjoj	15.566995	-2.69301	comment	4.0	10.5	1490684411	13.088877
14670909	Dyalog APL 16.0	Dyalog APL 16.0	sndean	15.568579	-2.6877434	story	4.0	65.0	1498832555	13.092667
28930045	I will note that the article doesn't	"I will note that the article doesn't contain the word ""readability"". APL is the classic example of a ""write-only"" language."	_rgek	15.562054	-2.6902936	comment	4.0	15.5	1634734397	13.088016
28930296	"""Language X is a write-only language"	"""Language X is a write-only language"" seems to be code for ""it doesn't look like C.""I've also heard Forth and Lisp described this way. And yet I find both readable since I have experience using them. I wonder if APL is similar: It's only unreadable to people w"	dreamcompiler	15.559389	-2.6991243	comment	4.0	12.5	1634735958	13.088819
28930842	I don't know which would be more pai	I don't know which would be more painful, trying to program on a touchscreen, or trying to program in APL.	thrower123	15.550906	-2.688429	comment	4.0	10.5	1634739046	13.08061
29261538	It's too bad APL never enjoyed ubiqu	It's too bad APL never enjoyed ubiquity on Unix-like platforms. The world would have been a better place. Maybe if Stallman or some early GNU participant had championed APL we'd all be either using APL or constantly excusing ourselves. Like Emacs did for Lisp.	wahern	15.564854	-2.695783	comment	4.0	11.0	1637204319	-10.180167
29520481	I was watching the youtube series on	I was watching the youtube series on solving advent of code in APL and was blown away. I immediately checked this site to see if X == APL just to get a sense of what the hell is going on, but unfortunately it's not yet there yet.Anyone got a favorite obscure l	bko	15.563032	-2.695826	comment	4.0	10.5	1639226430	13.089991
16848348	I have used Fortran 90+, Python with	I have used Fortran 90+, Python with Numpy, R, and (rarely) Matlab/Octave, all of which allow operations on whole arrays and array sections. Would they be considered array languages? What is qualitatively different about APL, J, and K?	poster123	15.550355	-2.7130914	comment	5.0	24.0	1523880389	13.015737
16952385	I have no idea of what APL is, and t	I have no idea of what APL is, and the thing doesn't even bother explaining it.	wfwefwef32	15.564815	-2.6892397	comment	5.0	17.5	1525015615	13.089148
16953540	You can assign a name to each of tho	You can assign a name to each of those symbols if you want and have something equivalent to what you just wrote.tranpose=:⍉take:=↑index=:⍳each=:¨done, now I can write (⍉↑x⍳¨x) as (transpose take x index each x)But the entire idea of APL is notation as a tool o	segmondy	15.565354	-2.6929617	comment	5.0	15.5	1525030740	13.084821
17534245	APL at Its Core	APL at Its Core	panic	15.566677	-2.6893106	story	5.0	77.0	1531640894	13.086674
19842238	Alan Kay on “What Made APL Programmi	Alan Kay on “What Made APL Programming So Revolutionary?”	fniephaus	15.564793	-2.6901052	story	5.0	53.0	1557166908	13.072312
37682270	APL people often point to the defini	"APL people often point to the definition of ""average"" as evidence for its economy of expression: +/÷≢They make the argument ""the word 'average' has more symbols than its definition, so why not just use the definition inline as a tacit function?""There's some el"	saulpw	15.563492	-2.6920047	comment	5.0	13.5	1695853628	13.080549
37689537	Well APL is great but it is write-on	"Well APL is great but it is write-only. Also naming is hard, but in APL it is very easy: you just don't do it. What does the following do?    program ← {⊃1 ⍵ ∨.∧ 3 4 = +/ +⌿ ¯1 0 1 ∘.⊖ ¯1 0 1 ⌽¨ ⊂⍵}

Libraries in other languages deal with arrays just fine, and"	BenoitP	15.564241	-2.6976075	comment	5.0	17.5	1695908761	13.072881
38505690	There's also April APL: https://gith	There's also April APL: https://github.com/phantomics/aprilAlso the array language family seems to be stronger than ever with foss: ngn/k, BQN, uiua, and of course J but as you mentioned they're all different languages.	liveranga	15.545749	-2.7212403	comment	5.0	12.5	1701591703	13.046771
33639085	APL died for the same reason Perl is	APL died for the same reason Perl is fading: it is a write-only language.Those symbols look cool. But they're not very far away from Brainfuck.	diego_moita	15.562097	-2.6929276	comment	5.0	20.0	1668694265	13.100014
33639665	APL is from an era where impressivel	"APL is from an era where impressively functional code that looks like line noise (another obsolete concept) was considered heroic.  Other examples of such code are text editing and text formatting macro languages.  Recall that EMACS stands for ""Editor Macros"" "	MarkusWandel	15.561435	-2.6998284	comment	5.0	17.5	1668696902	13.079931
33640132	> Its powerful array manipulation pr	> Its powerful array manipulation primitives can easily be brought forward into a language with modern syntax, and haven't they?Kind of. The languages that one might expect to do this (Julia, R, NumPy) have picked out a few things from APL in an inconsistent w	mlochbaum	15.559754	-2.7021284	comment	5.0	13.5	1668698625	13.067128
35396696	APLcart – Find your way in APL	APLcart – Find your way in APL	whereistimbo	15.568608	-2.6851342	story	5.0	109.0	1680318656	13.102516
28092453	Don't flame me, but I think APL is t	Don't flame me, but I think APL is the perfect language to introduce coding to kids. I've had great success with it personally. The symbols are suprisingly intuitive to them, and APL's strengths match the domain of what kids typically do with computers at firs	queuebert	15.566446	-2.6906755	comment	5.0	17.0	1628282202	13.080732
27516817	This it the end of an era. Although 	This it the end of an era. Although most people will have never seen it, APL was a pretty influential programming language. It is the main reason that Kenneth Iverson received the Turing award.It uses its own character set, which makes it possible to write ver	aliasEli	15.564531	-2.6958547	comment	5.0	16.0	1623770645	13.09716
27639731	> This, however, I disagree with. I 	> This, however, I disagree with. I mean in a general sense, not specific to how your brain is wired. It all depends on the first couple of language that one learns and how they are learnt and taught. 10-15 years ago people would find it hard to grok Python's 	wsc981	15.552964	-2.7048762	comment	5.0	22.5	1624690052	13.065972
22833478	Since this flurry of APL/J/K/A+/Q ar	Since this flurry of APL/J/K/A+/Q articles started, I've been wondering about the relationship between APLs and literate programming.They say that APL was developed to mimic mathematical notation, and I see the resemblance. But real works of mathematics consis	scythe	15.564538	-2.6941535	comment	5.0	18.5	1586529719	13.070273
23058909	I don't really understand these arra	I don't really understand these array based J/K/APL languages but from a distance it would seem like they would primarily be useful for numerical based work such as finance or calculating patterns on 2d arrays (game of life). The languages seem more mathematic	zests	15.55836	-2.70341	comment	5.0	23.0	1588513216	13.060094
23059592	Having used APL professionally for t	"Having used APL professionally for ten years from the early 80's to early 90's I am a big fan.  I used it for a wide range of applications, from business systems to DNA sequencing.  I even published a paper at a conference eons ago.So, yeah, I am an ""APL guy""."	robomartin	15.563155	-2.687754	comment	5.0	13.5	1588519983	13.099445
34067071	I like APL (and k/j). Problem is, ou	I like APL (and k/j). Problem is, outside trading (and even there it's a niche), it is just not popular enough. This also because most people dismiss it as line noise / write only programming language; that's usually only people who never used it or used it br	tluyben2	15.56284	-2.6940432	comment	5.0	20.5	1671549640	13.098777
13905066	APL is a language that confuses the 	APL is a language that confuses the hell out of me, and I hate that.  I wish there was more guidance online to using it, since I find the paradigm to be very interesting.	tombert	15.564605	-2.6946657	comment	5.0	17.5	1489895429	13.081757
13974505	Is APL still used for anything now? 	Is APL still used for anything now?  It seems like it could be a useful language for _something_.	ColanR	15.563248	-2.6984396	comment	5.0	19.0	1490681689	13.085978
24168392	That's me! It's a pretty exciting ti	That's me! It's a pretty exciting time for BQN because I've just put the self-hosted version online where you can try it out. In addition to exploring a lot of new APL ideas[0], BQN is also a test of the Co-dfns[1] approach to compilation, meaning that with an	mlochbaum	15.551724	-2.7100203	comment	5.0	16.0	1597494424	13.069387
30777176	Dyalog APL 18.2	Dyalog APL 18.2	tosh	15.568734	-2.687556	story	5.0	82.0	1648033547	13.069373
30794124	What does the integration ecosystem 	What does the integration ecosystem look like for array-based languages? e.g. writing and consuming network services, database interoperability, C FFI, text encodings, etc.Given this release of APL introduces support for shebang scripts I'm thinking the ecosys	joncfoo	15.558939	-2.7054002	comment	5.0	12.5	1648148999	13.039671
39500260	Tinkering with APL (Dyalog) gave me 	"Tinkering with APL (Dyalog) gave me one of my most mind-bending programming moments.  dismal ← 10⊥(⌈/10⊥⍣¯1⊢)

This is the complete solution to addition in the framework of Dismal Arithmetic [1].The pivotal idea there was the inverse of a function, and ""trains"	adityaathalye	15.563071	-2.6976142	comment	5.0	14.0	1708864275	13.068134
38913119	I've been knee deep in APL for the p	I've been knee deep in APL for the past year, working on a YAML parser: https://github.com/xelxebar/dayaml. It's still very prototypy, but for ~30 lines of code it's surprisingly complete.The process of getting that project to where it is now really revolution	xelxebar	15.561254	-2.700234	comment	5.0	43.5	1704727008	13.081646
16247139	I’m constantly amazed there isn’t a 	I’m constantly amazed there isn’t a more standardized “transliteration” of APL into a slightly more verbose form that can be written easily on a conventional QWERTY keyboard (yes, I get it, APL devotees love the information density, but as this letter points o	yodon	15.564158	-2.6949854	comment	5.0	17.5	1517075698	13.078901
16398527	I've read a bit about APLs and I've 	I've read a bit about APLs and I've seen them popping up in HN a few times. They do seem incredibly awesome and the products around it (K/KDB+ etc) amazing.However, in case I ever felt like learning one of these, I'd always wanted to know: the syntax crazyness	jjmaestro	15.563472	-2.6970797	comment	5.0	14.5	1518834304	13.076315
16583871	The APL / J / K family of languages 	The APL / J / K family of languages seems to be very strong with this effect. If it fits your problem domain, it's (apparently) so powerful that using anything else feels like a frustrating waste of time.	pavlov	15.563045	-2.6978211	comment	5.0	13.5	1521026346	13.096352
18689771	Now that I feel the bite from my sed	Now that I feel the bite from my sedentary lifestyle on my bum, I'm more and more attracted by the idea of a language taking 1/10th the typing compared to what's typical today. However, afaict languages following APL's suit specialize in math, so I wonder if t	aasasd	15.56563	-2.6930034	comment	5.0	19.5	1544900459	13.085694
24530672	I really like this quote:> some stil	"I really like this quote:> some still seem to equate ""the ease of programming"" with the ease of making undetected mistakesConversely you could say that ease of programming is equal (or at least correlated) with ease of getting confidence of your programs corre"	zokier	15.557318	-2.7039945	comment	5.0	23.5	1600553840	13.0804615
32030324	APL seems like a great language for 	APL seems like a great language for computer graphics! Has anyone tried their hands at the same?	z3phyr	15.56245	-2.6907597	comment	5.0	13.0	1657329807	13.107989
22082657	Ruins of forgotten empires: APL lang	Ruins of forgotten empires: APL languages (2013)	lelf	15.561683	-2.6941617	story	5.0	31.0	1579327417	13.088233
23415169	APL-likes have been a fascination of	APL-likes have been a fascination of mine for some years, but sadly at a distance.  For those of you working in these languages, what do you use them /for/?  What industries and/or kinds of applications do you write?  Why are these languages used for them vs o	michaelcampbell	15.565006	-2.695321	comment	6.0	15.0	1591269786	13.041718
24167804	BQN: An APL Variant from Marshall Lo	BQN: An APL Variant from Marshall Lochbaum	chrispsn	15.565736	-2.6928132	story	6.0	60.0	1597487441	13.091434
29964871	Does anyone have any stories to shar	Does anyone have any stories to share involving apktool?Random note: It's curious how the homepage and the linked repo are on GitHub but the binary downloads are served from bitbucket.	3np	15.539385	-2.684335	comment	6.0	15.5	1642412281	13.107806
30453919	Mastering Dyalog APL (2009) [pdf]	Mastering Dyalog APL (2009) [pdf]	Tomte	15.567779	-2.6910512	story	6.0	69.0	1645705955	13.108251
17174365	Neat little tribute article.APL will	Neat little tribute article.APL will not be reborn. If that was going to happen, this century's embrace of analytics and linear-algebra-rich machine learning would have propelled the upswell. It didn't and it won't.Why? It's not the symbols. Not the keyboard. 	untangle	15.565154	-2.694382	comment	6.0	24.5	1527536284	13.082384
21717666	Sixteen APL Amuse-Bouches (2016)	Sixteen APL Amuse-Bouches (2016)	kick	15.569089	-2.6882741	story	6.0	62.0	1575587344	13.103976
35392132	It’s awe-inspiring to see a K progra	"It’s awe-inspiring to see a K program where the comments are in another APL variant (I can’t pretend to know which):  {d:~1=':s:^x             / s‿e←1⊸»⊸(>⋈<)' '=𝕩
   c:^""aeiou""?_x@&d&~s     / c←¬(s/𝕩)∊""aeiou""
   x,:,/$`pig`dog c        / ins←⥊c⊏[""pig"",""dog""]
"	pavlov	15.555773	-2.694979	comment	6.0	32.0	1680290693	13.060273
28498287	I think every sentence in this post 	I think every sentence in this post is more or less wrong. Also, we do not want to introduce non-ascii glyphs into programming languages - APL is about the only time this has been tried and (merits of the language aside) it was hardly a success.	zabzonk	15.560114	-2.694342	comment	6.0	16.0	1631415959	13.065119
22539783	APL a Day	APL a Day	lelf	15.568378	-2.6865969	story	6.0	83.0	1583874926	13.102022
23058489	I investigated APL pretty seriously 	I investigated APL pretty seriously at the end of 2019, after a very inspiring conversation with Aaron.  I discovered that everything in this post is true, and (dyalog) APL is a pretty great language.However, I also decided that it is still a bit too dead, at 	codesections	15.564668	-2.6929026	comment	6.0	22.0	1588507132	13.0986595
26637619	> There is no other language that pl	> There is no other language that places such an emphasis on programming directly with plain and naked data literals.Counterexamples: Erlang and Elixir. Arguably also Prolog. Also Lua. Many Schemes, and Racket. Of course, REBOL and Red. TCL probably, too.I can	klibertp	15.542244	-2.7320933	comment	6.0	34.5	1617125646	13.046039
27391259	I would be genuinely interested of t	I would be genuinely interested of the advantages of APL over languages like Julia or Python with numpy who have also quite flexible array types. For instance in Julia, I could write:data = [1,2,3]# . means element-wise operationsum(exp.(filter(isodd,data)))# 	kwertzzz	15.559541	-2.7025928	comment	6.0	18.0	1622789366	13.052454
27461338	Would APL work as well with the unus	Would APL work as well with the unusual symbols replaced by keywords? Any with APL experience know?	pradn	15.561644	-2.6975093	comment	6.0	25.5	1623336205	13.072624
13904688	GNU APL 1.7 Released	GNU APL 1.7 Released	Avshalom	15.566658	-2.6882198	story	6.0	127.0	1489888125	13.093556
13975059	I am blown away to see how frequentl	I am blown away to see how frequently APL seems to come up on HN these days, a language I used professionally for over ten years.As much as I love it I have to say one of the issues with APL is that it was way ahead of it's time.  Because of that it struggled 	rebootthesystem	15.562528	-2.6994267	comment	6.0	24.0	1490690649	13.088521
14125651	A Source Book in APL (1981)	A Source Book in APL (1981)	alexcweiner	15.564923	-2.687258	story	6.0	51.0	1492348252	13.105668
30870868	Why APL is worth knowing	Why APL is worth knowing	tosh	15.565936	-2.688335	story	6.0	121.0	1648752443	13.110248
30871639	I would like to see something about 	"I would like to see something about ""Why Python is worth knowing"" from someone who knows APL.  For whatever reason I can spend time playing around APL but I cannot force myself to spend time playing around with Python."	1vuio0pswjnm7	15.56127	-2.7045856	comment	6.0	22.5	1648756961	13.096383
28965788	APL Compiler Based on Tail (Typed Ar	APL Compiler Based on Tail (Typed Array Intermediate Language)	xvilka	15.563731	-2.6967301	story	6.0	62.0	1634964158	13.063589
29576470	We are getting closer and closer to 	We are getting closer and closer to differentiable APL running on GPU. I like this direction :)	mlajtos	15.567191	-2.6897569	comment	6.0	18.5	1639646083	13.077792
39032874	I have a longstanding fascination wi	"I have a longstanding fascination with K and other ""modern"" APL derivatives.There are a few intersecting truisms about coding that I believe: one is that people's working memory varies: some have an immense amount, some less. Humans definitely process spatiall"	vessenes	15.555206	-2.7048333	comment	6.0	23.0	1705522745	13.009753
23510433	APL Since 1978 [pdf]	APL Since 1978 [pdf]	7thaccount	15.567151	-2.6873462	story	7.0	69.0	1592064711	13.101225
29047853	These sorts of minimalist bare metal	These sorts of minimalist bare metal abstract PL articles are so thrilling to me. APL comes to mind.I wonder how high you can go with only 1MB say.	agumonkey	15.555597	-2.6884542	comment	7.0	30.5	1635592120	6.578141
19325972	I once got talking with an anesthesi	I once got talking with an anesthesiologist who was taking care of a family member. Upon hearing I was a developer, he told me he was an APL programmer who spent most of his computer time developing Bible software. He regaled me with a few APL war stories, abo	TimTheTinker	15.559871	-2.6947365	comment	7.0	22.5	1551940099	13.060604
16403099	Node-APL: APL interpreter written in	Node-APL: APL interpreter written in JavaScript	bryanrasmussen	15.546372	-2.7187185	story	7.0	35.0	1518906221	13.076232
21104698	APL Demonstration (1975) [video]	APL Demonstration (1975) [video]	emersonrsantos	15.568155	-2.6860697	story	7.0	78.0	1569725176	13.101354
21652218	A big hurdle for me is that there's 	A big hurdle for me is that there's no APL interpreter available in my Linux distribution's (Gentoo's) package manager.  So I can't easily install it as I can most other languages, using my distro's package manager.  That means I'm going to have to search out 	pmoriarty	15.564925	-2.6936905	comment	7.0	22.5	1574889455	13.07839
17944800	APL matrix product operator	APL matrix product operator	panic	15.567108	-2.6912289	story	7.0	61.0	1536478272	13.064344
33639114	I disagree. The terseness of APL is 	I disagree. The terseness of APL is the worst part about it. Its arcane symbols are a close second.I don't want my programming language to be as terse as possible. I want it to be easy to read and maintain. I don't see how APL is a step in the right direction 	ninkendo	15.562886	-2.696084	comment	7.0	32.5	1668694434	13.083367
27380431	From Competitive Programming to APL	From Competitive Programming to APL	todsacerdoti	15.568679	-2.6881938	story	7.0	89.0	1622724420	13.088638
38036534	Ask HN: Do I need a special keyboard	Ask HN: Do I need a special keyboard layout to learn array programming?	distcs	15.562904	-2.696815	story	7.0	4.0	1698400464	13.02865
35370992	I always wondered how one can start 	I always wondered how one can start learning APL or similar array oriented language. Any suggestions? I'd like to give it a try!	finalfire	15.563494	-2.6985786	comment	7.0	17.5	1680175456	13.075689
28093198	Author here. I wrote this because I 	Author here. I wrote this because I thought APL deserved an up to date introductory text. It's basically the notes I kept when learning it myself. Stoked to see it on HN.	skruger	15.563237	-2.6819048	comment	7.0	21.5	1628286813	13.094256
13779218	50 Years of APL Datatypes (2016) [pd	50 Years of APL Datatypes (2016) [pdf]	breck	15.566339	-2.6887324	story	7.0	59.0	1488496219	13.114826
30792421	Who is using APL in production out o	Who is using APL in production out of curiosity?	alfalfasprout	15.562885	-2.6876466	comment	7.0	21.0	1648140641	13.058013
24799739	> Not necessary as per the APLv2 lic	> Not necessary as per the APLv2 licenseThe conversation ends there, doesn't it?	curiousgal	15.566927	-2.6859443	comment	7.0	25.5	1602848143	13.100949
23413183	Can someone who knows all those one 	Can someone who knows all those one letter languages well succinctly describe the differences between J, K, Q and APL?What I think I've got so far (this is all hearsay, and none should be taken as fact):APL: The original. Non-ASCII. APLers hate the successors,	Tomte	15.5583315	-2.7007446	comment	8.0	31.0	1591251495	13.042677
24198323	I think the J examples at the bottom	I think the J examples at the bottom illustrate perfectly _why_ it’s preferable to force this type of array syntax into a language like Python, rather than jumping ship for APL:The J is inscrutable! But the Python is intuitive. Analytics code I’m writing for w	michaericalribo	15.556423	-2.705217	comment	8.0	24.0	1597757696	13.041152
32374317	Ivy – An interpreter for an APL-like	Ivy – An interpreter for an APL-like language	georgia_peach	15.559573	-2.7038457	story	8.0	135.0	1659853159	13.0686245
26025156	The APL Orchard	The APL Orchard	lelf	15.566387	-2.685295	story	8.0	78.0	1612445648	-0.45881623
28929843	Anyone using APL or J for work on HN	Anyone using APL or J for work on HN? I've used it as a hobby and think it's really cool, but haven't ever used it professionally.Edit: this has been posted on HN before.	7thaccount	15.5537195	-2.6882527	comment	8.0	24.0	1634732995	13.081185
