id	label	hovertext	author	x	y	type	relevance	size	year	umap1d
37680872	I'm a big fan of stack-based languag	I'm a big fan of stack-based languages conceptually, but they always seem to fall flat when it comes to basic reading comprehension. APL has the same issue, as does J. Factor did improve on this a little bit by eschewing the symbol fetish but it was still very	diogenes4	15.539066	-2.7143087	comment	3.0	15.0	1695846791	13.073031
27517530	This might not mean what you'd expec	This might not mean what you'd expect at a glance. The agreement here seems to be that IBM has sold all relevant IP for APL2[0] to Log-On Software[1], which will now be offering essentially the same product and some level of support.For some time now APL2 has 	mlochbaum	15.565308	-2.686681	comment	3.0	12.5	1623773569	13.088685
35370450	"> What I mean by ""readable"" is, that"	"> What I mean by ""readable"" is, that it uses ASCII strings and actual names, not merely 1 characterI urge you to reconsider: That they are 1-character is an extremely important feature of Iverson's work.> instead of symbols, of which I do not know their namesW"	geocar	15.558172	-2.6979165	comment	3.0	16.5	1680171460	13.081226
22449159	k, J & APL, in roughly that order.	k, J & APL, in roughly that order.	kick	15.562141	-2.696074	comment	3.0	11.5	1582955488	13.035715
22630934	So this:> {.+(k;({x@&~_n~/:x}x@')'k:	So this:> {.+(k;({x@&~_n~/:x}x@')'k:?,/!:'x)}Turns a list of dictionaries to a dictionary of lists. It is clearly amazingly expressive as you can do so much in just half a line of code.However, for someone not used to APL, this is utterly and totally unreadabl	short_sells_poo	15.559606	-2.708192	comment	3.0	10.5	1584647327	13.091203
27239500	It's not the last time major portion	It's not the last time major portions of the world fundamentally changed how they did things to align with the major powers at the time.Even WITH all the Unicode support that currently exists in the computing world I don't know of a single computer language th	bombcar	15.529764	-2.7137198	comment	3.0	14.0	1621628849	10.707346
27461040	Are there companies still producing 	Are there companies still producing modern keyboards with APL in mind? I like the idea but can't see how it would be practical with a normal keyboard.	NextHendrix	15.554512	-2.6871204	comment	3.0	11.5	1623334550	13.06533
34064948	> But APL programs are often cryptic	> But APL programs are often cryptic and hard to decode. Some have joked that it is a “write-only language” because even the author of a program might have trouble understanding it later.So the original Perl?	xedrac	15.566149	-2.6931796	comment	3.0	11.5	1671539388	13.097807
34067867	Lots of programming isn't math or lo	Lots of programming isn't math or logic, its shovelling data and manipulating strings. Is APL good at that?	MrBuddyCasino	15.564962	-2.6937354	comment	3.0	11.5	1671552558	13.082082
22907163	> by getting the whole parser onto a	> by getting the whole parser onto a single screen, I find that I can get the whole problem into my brain’s working memory and avoid burning cycles scrolling up and down to pin down butterflies bugs.This is an excellent point, and one that not enough programme	codesections	15.543038	-2.7168903	comment	3.0	24.0	1587211836	13.115573
12255109	You may want to learn J instead. It 	You may want to learn J instead. It uses ascii, and it's from Iverson, so it's the true continuation of APL.	qwertyuiop924	15.563688	-2.6946008	comment	3.0	11.0	1470755718	13.083612
30462835	I think APL has a lot to teach us ab	I think APL has a lot to teach us about parallel (specifically GPU) programming. I've rewatched a few talks with Aaron Hsu and listened to his arraycast podcast[1].In researching an upcoming blog post on monoids, I tried implementing the problem in Guy Steele'	raphlinus	15.554707	-2.7026606	comment	3.0	15.5	1645754069	13.059277
30577611	I'm wanting to learn APL (I'm leanin	I'm wanting to learn APL (I'm leaning towards J or BQN) and Lisp as two languages/paradigms. APL for is expressivity and Lisp for its ML background.More mainstream I'm wanting to learn TCL and lua.I don't program professionally so don't need to learn anything 	account-5	15.565192	-2.6956112	comment	3.0	11.0	1646574943	13.092071
18367038	Don't get rid of Apu. He's a hero to	Don't get rid of Apu. He's a hero to many of us	paulpauper	15.56717	-2.6852183	story	3.0	22.0	1541195274	13.120445
18689396	I can imagine that a fork of GNU APL	I can imagine that a fork of GNU APL, re-written in FORTRAN with multi-threaded and maybe distributed computing support, would be an amazing mathematical tool.  Something that's super fast and scales really well, and makes mathematical operations really easy.	ColanR	15.556335	-2.7001266	comment	3.0	16.5	1544896139	13.030938
16408549	Imagine something like Go and APL co	"Imagine something like Go and APL compile down to the same AST, and imagine two programmers working on the same project with different syntaxes as you describe. The Go user one day finds a function called ""life"" that contains several hundred lines of code, whi"	Buttons840	15.559333	-2.6994622	comment	3.0	11.5	1518987348	13.0684
31906119	> does it have to be a general trans	> does it have to be a general transpose?  And if so, why?There are two answers to this, one less interesting, and one more interesting.The less interesting answer is that it's a primitive in APL, and I have a vested interest in making APL fast.  Then, it need	moonchild	15.560644	-2.6963885	comment	3.0	11.5	1656412872	9.385034
32137123	Add spaces around APL operators and 	"Add spaces around APL operators and name them.You examples become:  2 partial mod
  1 minus 2 partial mod
  > partial 4

I guess your examples still need some framing to make them somehow passable around, for example, a definition or some kind of closure. Let'"	thesz	15.563879	-2.6980145	comment	3.0	11.5	1658144846	13.079114
32178565	Among all languages, APL has the hig	"Among all languages, APL has the highest ratio of times its founding document is posted to Hacker News to lines of code written.I don't mean this to be terribly dismissive: I've always been ""tangentially fascinated"", like I think a lot of people are, by APL an"	zetalyrae	15.565142	-2.6963124	comment	3.0	12.5	1658406981	13.0881195
22009601	It’s just a different style. After u	It’s just a different style. After using kdb+/q for aoc2019, I quite like the no space one-line style. I find the code easier to read and remember. I think most people who have tried an APL derived language also agree.It’s important that many/most cultural nor	smabie	15.564695	-2.6961846	comment	3.0	12.0	1578647954	13.081089
22225136	April: An APL That Compiles to Commo	April: An APL That Compiles to Common Lisp	kick	15.515073	-2.857635	story	3.0	148.0	1580744816	13.104679
38982944	Nothing has ever convinced me about 	Nothing has ever convinced me about the potential for array languages in practice quite like watching Aaron Hsu describe how he develops his parallel APL compiler [0] using two Notepad.exe windows side-by-side: https://www.youtube.com/watch?v=gcUWTa16Jc0&t=860	refset	15.557233	-2.7034936	comment	3.0	20.5	1705170625	13.043795
39471430	I wanted to do some statistics, so I	I wanted to do some statistics, so I accidentally learned J (thinking it was R). J is like APL, but with digraphs (multiple characters) instead of special characters as symbols.	stirfish	15.563448	-2.692834	comment	3.0	10.5	1708628258	13.064789
39611031	> There is no benefit to having thes	"> There is no benefit to having these symbolsHard disagree. Which do you find more readable?    -b/(2a) + 1/(2a) √(b²-4ac)

or    (plus (minus (div b (times 2 a)) (times (div 1 (times 2 a)) (sqrt (minus (pow b 2) (times 4 a c))))))

or    plus(minus(div(b, tim"	xelxebar	15.565649	-2.6946714	comment	3.0	14.0	1709686784	13.073483
16804632	There’s also <-, most commonly seen 	There’s also <-, most commonly seen in R but draws it’s heritage from the APL keyboard	jghn	15.548999	-2.6958191	comment	3.0	15.0	1523389866	13.045138
19325720	For anyone interested in apl, take a	"For anyone interested in apl, take a look at k which is essentially apl restricted to the ascii character set.
There's also q (aka kdb) which adds some additional database-like functionality (among other things) however it's proprietary and ""free""."	breenhead	15.563854	-2.6940618	comment	3.0	12.0	1551936227	13.074146
19326888	I would say that pandas and R can pr	I would say that pandas and R can pretty much express everything that APL/J/Q can. They are a lot slower though (than Q atleast, I haven’t used J or APL)	mruts	15.548104	-2.7057672	comment	3.0	11.0	1551953497	13.044806
25250224	Yes. There are some deep insights in	Yes. There are some deep insights in this exposition. The irony is (in my opinion) APL is the worst Array/Matrix based programming language. In fairness it was also the first, but compared to Matlab or Julia it is not as expressive and feels much harder to use	blululu	15.55902	-2.700715	comment	3.0	15.0	1606703819	13.026179
35857072	Suggestivity and Idioms in APL	Suggestivity and Idioms in APL	mr_tyzic	15.565503	-2.6865015	story	3.0	74.0	1683508246	13.088609
28930242	APL is alive and well and widely use	APL is alive and well and widely used. It’s just evolved into more verbose forms known as NumPy, R, and other Iverson Ghosts [0].Turns out people love array programming but hate terse syntax.[0] https://dev.to/bakerjd99/numpy-another-iverson-ghost-9mc	MontyCarloHall	15.562066	-2.695971	comment	3.0	13.0	1634735597	13.07955
23414690	> APLers hate the successors, becaus	"> APLers hate the successors, because ""notation is tool for thought"" and ASCII is a poor representation.I'm perplexed by this one. I'll concede that the APL symbols are prettier but why does it magically stop being a notation just because you use combinations "	Rampoina	15.565741	-2.6928155	comment	3.0	13.5	1591265247	13.081624
20255929	I'd like to play with this as it is 	I'd like to play with this as it is a free APL that I could use for work without paying a license (like Dyalog APL requires). J is another free array language, but it doesn't use the APL characters that I enjoy.I've had a little trouble in the past getting it 	6thaccount2	15.565792	-2.6942017	comment	3.0	14.5	1561301692	13.048046
20256468	When I was a young lad, the ink on m	When I was a young lad, the ink on my EE degree still wet, I worked with an older gentleman with a PhD, who used APL on an exotic computer with what looked to me like Sanskrit symbols (or space alien, for all I knew) on the keys. He gave me a couple tutorials 	sizzzzlerz	15.560939	-2.6916368	comment	3.0	14.5	1561305864	13.079445
13695415	agree with you, apl is great for ML,	"agree with you, apl is great for ML, see this 6 lines Neural Network Example by apl with no deps:  https://github.com/ghosthamlet/ann.aplall code here:      l0 ← 4 3 ⍴ 0 0 1  0 1 1  1 0 1  1 1 1

      y ← 4 1 ⍴ 0 0 1 1

      syn0 ← 3 1 ⍴ 0.5069797399 0.57038"	ghosthamlet	15.561614	-2.6938913	comment	3.0	11.0	1487685483	13.075354
13695098	APL in R	APL in R	ghosthamlet	15.566747	-2.6884658	story	3.0	84.0	1487682056	13.088782
13798508	I had some exposure to APL program f	I had some exposure to APL program for statistics few years back, but never really dived in. Largest problem being that the tools I encountered then didn't yield themselves well to intermittent exploration (indeed, Dyalog APL had Linux version that required Wi	jarpineh	15.562372	-2.7090957	comment	3.0	14.0	1488746843	13.089536
13977419	"""APL, and its successor J [...] prov"	"""APL, and its successor J [...] provide a notational interface to an interesting model of computation: loop-free, recursion-free array processing.""  How is APL loop-free, exactly?Later they say: ""Under this implicit lifting, the iteration
space is the argument"	jtraffic	15.563372	-2.698158	comment	3.0	11.5	1490714989	13.032916
30907806	Thank you for this.What do you make 	"Thank you for this.What do you make of BQN? 
https://aplwiki.com/wiki/BQNI get enamored with apl/k/j every time I see it and was looking for excuses to use it despite everything.I understand that due to the much smaller community the tooling and ecosystem is m"	recuter	15.556293	-2.7121527	comment	3.0	14.0	1649086253	13.055547
35028261	Notation is important and incredibly	Notation is important and incredibly valuable.  If you are abandoning notation, as J did, that’s a mistake.If you search for APL and my username in HN you should be able to find opinions on this going back several years.	robomartin	15.563826	-2.6968246	comment	3.0	11.0	1678010664	13.081267
37153890	I know nothing about APL. But I thin	I know nothing about APL. But I think I would write it the same way as the OP. I also think use len is better to convey counting operation:len(age for age in ages if age > 17)	aynyc	15.5655575	-2.6903322	comment	3.0	11.0	1692220252	13.087847
29106109	APL Since 1978 [video]	APL Since 1978 [video]	tosh	15.567861	-2.68783	story	3.0	58.0	1636027875	13.101025
35917181	Unfortunately (missed opportunity): 	"Unfortunately (missed opportunity):        ""APL""+1
    ""BQM"""	ithkuil	15.564646	-2.6898103	comment	3.0	11.5	1683903260	13.092483
36439453	IMHO the mathematical language is an	IMHO the mathematical language is an impediment for learning math for exactly this reason.  It's chock full of cryptic symbols with no obvious meaning that make it incomprehensible to anyone who has not taken years to learn it and also surprisingly difficult t	jandrese	15.565004	-2.694083	comment	3.0	10.5	1687470102	13.066976
26029902	If you're interested in recent devel	If you're interested in recent developments in array languages, I recommend checking out:BQN https://mlochbaum.github.io/BQN/ngn/k https://git.sr.ht/~ngn/k/tree/master/item/readme.txt (Previous discussion: https://news.ycombinator.com/item?id=22009241)aplette,	kick	15.559318	-2.7042842	comment	3.0	10.5	1612473400	13.043242
31380292	I was just playing with Nils M Holm'	I was just playing with Nils M Holm's Klong this morning: https://t3x.org/klong/index.html  (Klong rather than the others mostly because the C implementation looks like C so I have a ghost of a chance of actually grokking it.)These folks are really onto someth	carapace	15.560836	-2.6964192	comment	3.0	11.5	1652549533	13.081693
20604592	"To contrast with most of the ""write "	"To contrast with most of the ""write your own small text editor"" articles out there, I feel compelled to post this:http://kparc.com/$/edit.kThis is a text editor written in K, an APL-family language. Determining how it works is left as an exercise to the reader"	userbinator	15.537743	-2.7043116	comment	3.0	13.5	1564896614	13.046801
33317797	Seriously: APL!Yeah, it takes a bit 	Seriously: APL!Yeah, it takes a bit of time to become really comfortable, but our accountant was (after the initial take-it-away! phase) really glad i have her introduced to it	RalfWausE	15.553363	-2.6621258	comment	4.0	15.5	1666624471	0.7209293
33640275	There are a lot of comments of the t	"There are a lot of comments of the type ""it's unreadable/write-only/unmaintainable"" here. It's a natural reaction; I know, I was there. It looks different. But readability is in the eyes of the beholder, not the language. I made this point in my APL book (http"	skruger	15.561692	-2.6971066	comment	4.0	20.5	1668699077	13.102937
26638812	> [1] Why aren't we all writing in A	"> [1] Why aren't we all writing in APL/K/J if it matters that much?Because most programmers aren't nearly as productive as we could be.And because ""concise"" should be measure in the number of tokens needed to achieve certain functionality, not by excessive use"	jimbokun	15.563531	-2.6952934	comment	4.0	12.0	1617130723	13.077651
27394223	Is there a modern reincarnation of A	Is there a modern reincarnation of APL with similarly terse but clever syntax?	yewenjie	15.563548	-2.6988673	comment	4.0	11.0	1622818654	13.046657
27461558	I suppose if arrays language get pop	I suppose if arrays language get popular enough, we will get a module to use them as a DSL for libs like numpy, just like we have regex for strings, instead of a whole language dedicated for them.It would be a win / win, you gain the strength of J, K and APL f	BiteCode_dev	15.541666	-2.7215154	comment	4.0	14.0	1623337409	13.004543
27462419	It what ways is J an abomination? AP	It what ways is J an abomination? APL (and to a degree J) are on my bucket list of languages to learn. I’d always read that J was a sort of spiritual successor to APL.	sswezey	15.553281	-2.7029142	comment	4.0	16.5	1623341951	13.0643635
27484591	APL – A Glimpse of Heaven (2006)	APL – A Glimpse of Heaven (2006)	tosh	15.565318	-2.6861475	story	4.0	19.0	1623506686	13.108192
12787549	About 2 years ago I discovered a pro	"About 2 years ago I discovered a programming language called K. It's a very unusual-looking, extremely terse language in the APL family. It just ""clicked"" for me. I enjoy the ability to experiment with different algorithms and approaches in a few keystrokes, a"	RodgerTheGreat	15.524683	-2.722681	comment	4.0	13.0	1477400503	12.977598
13259582	How many people use APL currently? I	How many people use APL currently? Is it easy to find APL programmers?	gravypod	15.56719	-2.6874478	comment	4.0	10.5	1482783547	13.091157
12254992	I learned C and IBM APL2 around the 	I learned C and IBM APL2 around the same time for financial apps.  For APL, i read the Polivka and Pakin book about 30 times, not this edition, but the red paperback I used is apparently impossible to buy.  Excellent book, it got me to where i could be competi	gtani	15.565451	-2.6913848	comment	4.0	11.5	1470755076	13.099134
35370573	I think APL is very beautiful as som	I think APL is very beautiful as someone who has longed to learn it from afar and not yet had the time, would be very curious to get more insight into how it changes the way you approach problems in both APL and programming in general, and how it gets you to t	youssefabdelm	15.56518	-2.6940742	comment	4.0	12.0	1680172329	13.102903
35375241	> APL shows 74 symbols. I count at l	> APL shows 74 symbols. I count at least 50 math symbols that seem very likely to show up in an undergraduate degree; notably, 26 symbols +-×÷|⌊⌈!~∧∨⍲⍱<≤=≥>≠∊∩∪≡≢∘ in APL are taken from math with similar meanings.I have counted at least 30 symbols that I haven	gjulianm	15.565325	-2.6953745	comment	4.0	10.5	1680193588	13.078321
35393966	Amazingly, APL is more readable. Act	Amazingly, APL is more readable. Actually, it's even pretty intuitive. Which proves again, that restricting code to ASCII when every competent programmer (and PC-user in general) can enter almost any unicode symbols just fine is simply stupid.	krick	15.560395	-2.6967065	comment	4.0	13.0	1680298441	13.083038
28092965	Can I ask, why has APL suddenly beco	Can I ask, why has APL suddenly become the flavour of the month? This isn't a downer on the language, I'm just genuinely curious.	DaedPsyker	15.570106	-2.682151	comment	4.0	11.5	1628285347	13.107159
28093325	I had given myself a project of writ	I had given myself a project of writing my interview phone screen coding question in as many languages as I could, more as a lark, but also in 'prep' for a candidate being 'funny' when I say 'use whatever language you are comfortable in'.I did APL, which was f	jboy55	15.562926	-2.692009	comment	4.0	11.0	1628287699	13.085071
22552376	What's the most popular modern APL?	What's the most popular modern APL?	threatofrain	15.563367	-2.694455	comment	4.0	13.5	1583974012	13.041273
18998613	DisclaimerThe author has never used 	DisclaimerThe author has never used APLI’d like to know more about the underlying motivation! APL is a fascinating language but I’m not sure how you’d implement it efficiently in a language like Go - you would need intrinsics to get at the vector instructions 	gaius	15.565525	-2.6938944	comment	4.0	10.5	1548429270	13.073774
18997977	APL\iv: an APL interpreter and strea	APL\iv: an APL interpreter and stream processor written in Go	chrispsn	15.5599985	-2.7024252	story	4.0	143.0	1548425674	13.052554
19159408	Learn UX Design A$AP	Learn UX Design A$AP	svarlamov	15.555435	-2.6853867	story	4.0	10.0	1550115229	13.093958
15909001	I used to use KX/kdb/Q/K daily for s	I used to use KX/kdb/Q/K daily for several years. I wrote a full implementation of reinforcement learning (15 lines), a lightweight MVC framework (to show reports and tables in an internal webapp) and even a Q syntax checker (abusing table as a data structure 	ktamura	15.556307	-2.7014785	comment	4.0	13.0	1513109421	13.05464
15910517	Several things:1. K (and the entire 	Several things:1. K (and the entire APL family) eschew many of the layers upon layers of abstraction that modern software engineering uses, whether they are justified or not. It turns out, that they are mostly not justified. K gently pushes you toward thinking	beagle3	15.561883	-2.6980984	comment	4.0	12.0	1513121243	13.074227
18074148	In my experience the APL family of l	In my experience the APL family of languages are extremely hostile to the kind of exploratory coding that people would do in e.g. Python, JS or even C.You do APL like you do mathematics: sit down with pen & paper and think. And yes, many times it’s hit-n-miss,	aaaaaaaaaab	15.565546	-2.6936095	comment	4.0	14.0	1537953102	13.076092
18074603	One of the ideas that really informs	"One of the ideas that really informs my thinking about comparative programming languages is ""semantic compression"": https://caseymuratori.com/blog_0015A programmer has an idea of what they want the program to do, expressed in human language and concepts. Progr"	pjc50	15.558565	-2.7004368	comment	4.0	10.5	1537959119	13.016914
18640451	APL is more French than English (197	APL is more French than English (1978)	tosh	15.567051	-2.6910112	story	4.0	35.0	1544356511	13.052882
16514435	Noob questions:- Did anybody try to 	Noob questions:- Did anybody try to use APL (or a derivate) in web development?- Is the APL job market under-saturated? Or putting it in a different form: is there job opportunities for the 'average Joe'?I hate verbose, or better, I hate to be distracted by it	galfarragem	15.565577	-2.6846814	comment	4.0	10.5	1520165671	13.1005
16516006	Fear and Loathing in APL (2015)	Fear and Loathing in APL (2015)	jxub	15.567502	-2.6841617	story	4.0	90.0	1520190521	13.095948
16803109	"I think APL is for ""a programming la"	"I think APL is for ""a programming language"", not ""another programming language""."	FractalLP	15.565892	-2.6919408	comment	4.0	10.5	1523380732	13.094696
17150421	Someone smart needs to explain what 	"Someone smart needs to explain what an infinite algebraic lattice is, because it sounds awesome. Potentially.Edit: (I just googled ""algebraic type lattice"" and while ymmv, I don't recommend it unless you're well versed in scary black mathic)I didn't get too in"	qop	15.566699	-2.6904902	comment	4.0	11.0	1527219218	13.0747595
17174101	No, it does not.  I used APL profess	No, it does not.  I used APL professioally for about ten years back in the 80's.  I love the language.  It is incredibly powerful.  Once you internalize it's like playing the piano, you don't think about the mechanics you play music.However, the language did n	rebootthesystem	15.56531	-2.6921923	comment	4.0	14.0	1527533812	13.0863905
23060070	gnu apl is an often overlooked but e	"gnu apl is an often overlooked but extremely solid APL implementation that plays nice w/ unix.slightly verbose example but heres gnu apl as a pipe-like interface. Often this would be abstracted to a library that gets included when you call it:  printf ""1,2,3,4"	gandercrews	15.565115	-2.6953208	comment	4.0	13.0	1588523786	13.076912
38055544	I know people still use COBOL, but d	I know people still use COBOL, but does any important software use APL nowadays?From Wikipedia:> APL is used for many purposes including financial and insurance applications,[82] artificial intelligence,[83][84] neural networks[85] and robotics.[86] It has bee	armchairhacker	15.566293	-2.688864	comment	4.0	11.5	1698548888	13.103341
38873776	Since we are on the topic, I've thou	Since we are on the topic, I've thought about APLs a decent amount so here are some other resources/notes. I'm not an expert on this topic - I don't work with or research the language or anything. These probably are not good getting-started resources.There is 	bbwbsb	15.561346	-2.6993415	comment	4.0	11.5	1704411582	13.031401
38915656	From experience, my take is that mos	From experience, my take is that most laymen devs are unwilling and/or uninterested in taking the dive into apl/k/array langs due to the, in their own words, deliberately abstruse and obscurantist syntax/glyphs/typing; it's just too theoretical and/or cognitiv	jd3	15.562399	-2.6967263	comment	4.0	21.5	1704736821	13.076057
38916159	> abstruse and obscurantist syntax/g	> abstruse and obscurantist syntax/glyphs/typingI've often wondered what are the real blocks to having it both ways? Have the source saved as some lowest common denominator - IL, tagged AST, or somesuch - and then read and written in whatever pleases the indiv	uticus	15.560224	-2.6994638	comment	4.0	18.0	1704739157	13.076994
38505645	I find it sad that APL nowadays mean	I find it sad that APL nowadays means Dyalog. They appear to do amazing work. Unfortunately, the license isn't open. Why would I invest time learning it only to be locked in? I wonder how much licensing plays in APL not being more popular and used in the prese	spit2wind	15.56695	-2.692724	comment	4.0	15.0	1701590816	13.094672
17799598	APL Quotations and Anecdotes	APL Quotations and Anecdotes	srpeck	15.553099	-2.670547	story	4.0	53.0	1534770681	13.09382
21509396	APLcart – Find Your Way in APL	APLcart – Find Your Way in APL	lelf	15.568414	-2.6860895	story	4.0	54.0	1573509856	13.097201
